date,rating,note,review_text
2023-09-01,4.0,Stayed one night,"Clean, peaceful and beautiful little home. There is no privacy though if that is what you are looking for. If it were my place I would put up 3 or 4 privacy panels between houses. That would make this place awesome instead of good. I rented primarily for the hot tub. I was disappointed in it because it barely has any jet pressure and again no privacy. It was more like a bath tub instead of a hot tub. It was clean and nice also though. If you want a little camp fire bring a bucket so you can fill it up with water. We were a little worried about the tall grass next to the pit catching on fire. The wood was all wet also and did not want to burn. Thank goodness we brought our own dry hard wood and a fire starter. Bring a roll of paper towels, ice and pest spray. There are a ton of flies but that comes with the country. The bed was super comfortable. We also saw a jaw dropping new moon that was right up there at the top of my favorite moons ever. The bathtub drained slow also"
2023-09-01,5.0,Stayed one night,amazing would come again!
2023-09-01,3.0,Stayed one night,"The place was cute, well decorated, and looked like the photos. The hot tub was a nice amenity. It was quiet although the owners do have a house on the property, it isn’t super close and we didn’t even see them. However, the inside of the home REEKED. The kitchen sink and shower drain were both obviously clogged and hardly drained the water. The shower water was freezing cold pretty much immediately after turning it on. The outlets on each side of the bed did not work. One of the outlets in the kitchen was hanging out of the wall. One of the lights next to the bed was missing a lightbulb. The entire place had moths, flies, and ants inside."
2023-09-01,5.0,Stayed one night,"We had a great night staying at Amber's tiny house, and are already thinking about how to plan our next trip to stay here! Although it is on a busy road, inside the house is quiet and peaceful, and the setting is just great, with fields all around, and chickens and sheep to greet you in the morning. The house itself is cute, small, and comfortable. Amber was very responsive, and left a light on for us so that we could easily see and find the house when arriving after dark. Just no complaints whatsoever, and looking forward to staying again."
2023-09-01,5.0,Stayed with kids,"very sweet , peaceful, and full of the Goodness of God loved the white and purple lavender ! takes you away from the busy world"
2023-09-01,5.0,Stayed a few nights,Amber was very quick to respond and had clear instructions. The home was amazing and exactly as described but even better in person. We would definitely stay here again and most likely will!
2023-09-01,5.0,Stayed one night,"Wonderfully comfortable, lovely space, would stay again in a minute!"
2023-09-01,5.0,Stayed one night,"A beautiful country retreat! The hot tub was impeccably clean, and having the fire pit so close meant we could have the best of fireside & soak! The kitchen was spotless, and well stocked with everything we needed to cook during our stay. Literally the perfect spot for a girls’ night away. The Broom Corn Festival happening the same weekend was good timing on our part. Would highly recommend, and hope to return!"
2023-09-01,5.0,Stayed a few nights,Great stay very clean and good energy. We got to see the farm animals in the morning and got to enjoy the hot tub as well. Everything we needed was right there we packed only very little which was nice. So well organized that even though it’s a tiny home it’s spacious. Given it’s in the farmlands there isn’t much to do but it gives you a nice break from reality tech free to spend time with your significant other. We had board games and got to enjoy cooking together and talking!
2023-09-01,5.0,Stayed a few nights,"What a wonderful country setting, coming from downtown Chicago we enjoyed the animals and corn fields. We came in after dark and it was very hard to find the turn in, it would be helpful to have at least a reflector or even a solar light at entrance off highway 133."
2023-08-01,5.0,Stayed a few nights,"Very nice place out in the country. Well furnished. Great town and neighboring towns as well. Super friendly restaurants and bars. Hot tub was a nice add.
Outside light in front of home had no switch to turn it off. Was difficult to sleep as it was right outside front window. Just a call out that there is no TV or WiFi. My bad as I probably would have passed on it if I had realized that. Otherwise great accommodations."
2023-08-01,5.0,Stayed a few nights,"we were looking forward to a quiet, relaxing getaway... This was fantastic. Check out the library, which is gorgeous, and the Walldogs murals, they're amazing. and the painted brooms too. The Visitors Center, next to the groovy Hippie Memorial, are both worth the stop. Aikman's Zoo in Chesterfield is very nearby and the drive through was cool. If you're hungry head to Yoder's Kitchen in Arthur, the Saturday buffet was plentiful and replenished often. Thank you for allowing us to stay in a great place to explore and chill."
2023-08-01,5.0,Stayed one night,"I came with two teacher friends, it is our 11th end of summer girl’s trip. We came on an unusually hot day and didn’t get to enjoy the beautiful setting, hot tub or fire pit. But they are great amenities. The tiny house is as tastefully decorated as the pictures show!"
2023-08-01,5.0,Stayed one night,Awesome as usual! We’ll be back to unplug again soon!
2023-07-01,5.0,Stayed a few nights,"It was a beautiful, simple place to hang out and relax. We would definitely do it again!"
2023-07-01,5.0,Stayed one night,This is such a cute place to stay! You can tell they put so much thought and love into all the details. The hot tub was wonderful - lots of fire flies! 😍 We loved that it was on a little farm and we got to see sheep and chickens.
2023-07-01,5.0,Stayed one night,"We enjoyed our stay so much. It was rainy and storming but that was fine. Oddly, the best part was no tv! We talked and played trivia allowing us the reset we needed. Gorgeous place with great surroundings. Loved exploring Arcola and Arthur."
2023-06-01,5.0,Stayed a few nights,My son and his bride stayed here for two nights following their wedding. They loved it!!! Thank you so much!!
2023-06-01,5.0,Stayed one night,"it was absolutely beautiful, and the hot tub was amazing!!"
2023-06-01,4.0,Stayed a few nights,"What a lovely place! Cornfield out the window! Sheep bleeding, chickens were so peaceful! Gorgeous place! Everything you need!"
2023-06-01,5.0,Stayed one night,We had a great time!
2023-06-01,5.0,Stayed one night,we loved our quiet evening at the tiny house
2023-05-01,5.0,Stayed with kids,We loved our stay!
2023-05-01,5.0,Stayed a few nights,"Beautiful private spot. A perfect tiny getaway that is beautifully designed! The trees make you feel separated from the owners house and in your own space. The hot tub was wonderful! We will definitely be returning, several times!"
2023-05-01,5.0,Stayed a few nights,Beautiful house. So peaceful and enjoyed seeing the farms in this area. Really enjoyed the hot tub. Everything was perfect. Great getaway.
2023-05-01,5.0,Stayed a few nights,Great getaway! Can't wait to stay again!
2023-05-01,5.0,Stayed with kids,We loved our stay with Amber!
2023-05-01,5.0,Stayed with kids,Best staycation ever!
2023-05-01,4.0,Stayed one night,"A cute little cottage for those who wish to get away from it all, sit outside and enjoy a bucolic setting near chickens, corn fields and sheep. No wifi so you can really relax!"
2023-05-01,5.0,Stayed with kids,"This was a very cute and comforting space. The decor and setup was lovely. The host was extremely kind and flexible with check in. We had been traveling with a toddler and this place was wonderful to stop at a relax for a night. It was very clean which we appreciated and the layout was perfect.
We did come during a thunderstorm which didn’t allow us to utilize the outside space. I’m sure on a nicer day that outside patio would have been awesome.
We appreciated our host and our stay and love their little plot of land."
2023-05-01,5.0,Stayed a few nights,"we had a great stay,
such a cute little place to get away and relax!"
2023-04-01,5.0,Stayed a few nights,Beautiful town and clean space. The host was very respectful and responsive to all of our questions and needs!
2023-04-01,5.0,Stayed one night,"It was refreshing to be away from the fast-paced city. We enjoyed disconnecting at this tiny home — the hot tub was just perfect! Thanks, Amber!"
2023-04-01,5.0,Stayed one night,lovely place. very private.Great place to get some rest.
2023-04-01,5.0,Stayed one night,"Went out there to tour EIU & UIUC from Chicago. Right in the middle and not a bad drive! It doesn’t have a TV or WI-FI but like if you’re looking to disconnect, it makes the perfect choice. Hot tub was amazing, and shocking to see actual stars in the sky. You can hear the cows mooing and have a straight view of the farm animals the host has.
Overall i would definitely love to come back and pretend to live the farm life."
2023-04-01,5.0,Stayed a few nights,Ambers place was super peaceful. We definitely enjoyed it!
2023-04-01,5.0,Stayed a few nights,It was a perfect place to stay! Quiet and relaxing!
2023-04-01,5.0,Stayed with kids,We stayed here for my daughter’s birthday and went to Aikman’s Wildlife and some other fun stops. It was an amazing trip and Amber made it special by even including a birthday detail for my daughter! We would definitely stay again.
2023-04-01,5.0,Stayed one night,We loved our stay here! It was the perfect spot as we were traveling through Illinois. Easy to find and cozy inside!
2023-03-01,5.0,Stayed a few nights,"Awesome stay in the middle of nowhere! This really is a ""Tiny Home"", perfect for 2 people! The only thing I would bring is maybe a bluetooth speaker. There is no radio or tv."
2023-03-01,5.0,Stayed one night,Such a beautiful and peaceful place to stay. It was everything the host advertised. Great place to go to get out of the city and relax.
2023-03-01,5.0,Stayed one night,Amber's was so comfortable and relaxing. Everything in this tiny house is beautiful and clean! The hot tub is a great feature! We also enjoyed the fire pit. The view of the cornfield and chickens and sheep just add such great character to the place!
2023-03-01,5.0,Stayed one night,This was our second time staying at Amber’s place and everything was just as perfect the second time around! Looking forward to visiting again!
2023-03-01,5.0,Stayed one night,"We loved our stay at Tiny House! The smallness of the place creates closeness. The lack of technology was actually a plus! We loved having no TV, it creates conversation! Even though it was quite windy outside, we still enjoyed the hot tub and our friends to the south: the sheep and chickens. My wife loved the Farmhouse decor.
Great visit!"
2023-03-01,5.0,Stayed a few nights,"The house was adorable. It is simply and fashionably decorated. When the new landscaping grows up a bit, the privacy in the hot tub will be excellent! We only went in at night, as it felt the most private. We enjoyed seeing the farm animals out the windows - made it feel that much more quaint. We enjoyed our time very much!"
2023-03-01,5.0,Stayed a few nights,"Cute, comfortable place. Easy check in and amber is great with communicating!! Would definitely recommend if anyone is looking for a nice little get away!"
2023-03-01,5.0,Stayed one night,"Great little Airbnb, adorable decor, cozy, easy check in, cute sheep outside, quick communication, close to restaurants. Other than us not being able to use the hot tub, it was a great stay. :)"
2023-03-01,5.0,Stayed one night,"Great host! First time AirBnb user and wasn't disappointed at all! Pretty cheap in comparison to a hotel. My only cons are that I would prefer an AirBnb that isn't on the owner's personal property, even though that wasn't an issue during my stay at all."
2023-03-01,5.0,Stayed a few nights,"A very clean and cozy place to stay. This is a place where you can come to relax if you come from the city. This is what my fiancé and I were looking. A peaceful place to relax. Amber was excellent and gave clear instructions, which was a plus for me."
2023-03-01,5.0,Stayed a few nights,"Cozy, comfy couple getaway! Would highly recommend"
2023-02-01,5.0,Stayed a few nights,"My husband and I enjoyed a wonderful getaway at this comfortable and private home. Very clean and well decorated, and the hot tub was fabulous! I would highly recommend for a weekend away to recharge! We can’t wait to come back!"
2023-02-01,5.0,Stayed a few nights,"A very nice little cottage, we enjoyed it very much. Everything was clean and welcoming. The hot tub was great! Nice to be in the country, but not far from multiple towns. I think the only drawback to this location is that there is a bit of traffic noise through the night. We would stay again!"
2023-02-01,5.0,Stayed a few nights,Such a wonderful experience filled with quality time and great memories. We booked for the hot tub and it did not disappoint! The cleanliness of the entire home was pristine and we would absolutely return to stay in this home.
2023-02-01,5.0,Stayed one night,Such a peaceful stay! Cute place that looked just like the photos. The hot tub did not disappoint. Very relaxing. Highly recommend. Amber was a fantastic host.
2023-02-01,5.0,Stayed one night,We had a great time! Such a peaceful place to escape for a bit. Cute sheep view from the jacuzzi.
2023-02-01,5.0,Stayed one night,Had a great experience! The house is so cute and nice while the surrounding area is super interesting and awesome!!! The hottub was a great time and looking at the sheep and chickens was amazing. Great experience!!!!
2023-02-01,5.0,Stayed one night,Perfect space for best friends that are moms to relax!
2023-02-01,5.0,Stayed a few nights,Loved this tiny house! Had all the essentials & felt right at home. Only thing I would recommend is some sort of table with chairs for eating. Other then that everything was wonderful!
2023-01-01,5.0,Stayed a few nights,Very thoughtful and responsive host! Loved the hot tub feature! I asked if she had any board or card games and Amber was quick to respond and even brought some over which was a great save! Definitely recommend this place a quick in country getaway!
2023-01-01,5.0,Stayed one night,"Thank you Amber, your place is darling! Most likely will come back sometimes. Love the vibe.
xx
Angel"
2023-01-01,5.0,Stayed one night,Amber’s home was just perfect! Everything is decorated beautifully and we felt right at home!
2023-01-01,5.0,Stayed a few nights,"Absolutely loved our stay at the tiny home. Beautiful, peaceful and relaxing."
2023-01-01,5.0,Stayed a few nights,Perfect relaxing getaway!
2023-01-01,5.0,Stayed one night,"She was absolutely amazing! I booked this place for my sister for her birthday! I told Amber about it being a surprise for my sister, she took her time out and went to her local bakery and got my sister this fancy cake in a cup! never asked her to do it. she just did. super kind. super friendly. amazing place! thank you so much!"
2023-01-01,5.0,Stayed one night,Perfect little place!
2023-01-01,5.0,Stayed one night,"Had a lovely time at Amber’s listing! She was very responsive, and always messaged back in a reasonable time! She even extended our checkout time! Very accommodating and a nice full kitchen!"
2023-01-01,5.0,Stayed a few nights,"The place was great for what we were looking for. Quiet, charming and relaxing!"
2022-12-01,5.0,Stayed one night,"Fun, quiet, quaint little place! Perfect for a couples night away! The hot tub was nice and so relaxing! We did have to use the ironing board for a makeshift table for our carry out Chinese lol a small table or tv trays would be a great addition. We loved this place and will be back again!!!"
2022-12-01,5.0,Stayed a few nights,It was a nice place to stay while my husband and I went to visit his family. It was super cold and she left an extra heater for us which helped so much even though we lost power for a couple of hours one night. I’m a little sad that we didn’t get to use the hot tub but we will definitely be coming!
2022-12-01,5.0,Stayed a few nights,Enjoyed our stay! Great cozy place to have a night away. Everything was great except a slight sewage odor especially when flushing or using water. Overall it was a nice Airbnb.
2022-12-01,5.0,Stayed a few nights,"Very lovely home, perfect place if you’re looking for a peaceful getaway. Definitely a place I would book again."
2022-12-01,5.0,Stayed a few nights,My friends and I enjoyed our time at the tiny home!
2022-12-01,5.0,Stayed with kids,"The house was beautiful just as pictured, Amber was great we really enjoyed our stay."
2022-12-01,5.0,Stayed one night,Amber was a great host!! Super responsive and very nice! Thanks for being a awesome host!
2022-11-01,5.0,Stayed one night,Beautiful little place. Great for a night away.
2022-11-01,5.0,Stayed one night,Great place to stop and rest! Very clean and inviting! The hot tub is a great bonus!
2022-11-01,5.0,Stayed with kids,"It was a great place to rest for the night while traveling through many states. It was big enough for toddler, husband, and I. I loved that it had all the amenities of an actually home—just in a smaller square space. We don’t make this trip often, but when it comes time, we would come back again! Also, the comfy bed and robes were a great added bonus 😃"
2022-11-01,5.0,Stayed a few nights,This was a great place to unplug and get away for a few days! My husband and I especially enjoyed the hot tub. It is very quiet and clean.
2022-11-01,5.0,Stayed a few nights,"I was looking for a place to have a quiet retreat, and Amber’s tiny house was perfect. There was attention to detail in everything from the decor, to a tea kettle on the stove, to the provision of robes for the hot tub. The space was spotlessly clean. What a find! Highly recommend!"
2022-11-01,5.0,Stayed one night,Was so clean and charming! Would def stay again!!
2022-11-01,5.0,Stayed with kids,Beautiful spot! Very quiet but just a couple minutes from restaurants in town. Will stay here again!
2022-11-01,5.0,Stayed one night,This is such a special place to stay. Great place to sit outside and enjoy a fire. Take a dip in the hot tub. Then a comfortable night's sleep in a comfy bed. Thank you for creating such a perfect place to get away. ❤️
2022-11-01,5.0,Stayed a few nights,"The was such a wonderful place to stay! Between the hot tub, the sunsets, and the beautifully furnished home, it was so peaceful and relaxing. Amber was a wonderful host and a lot of thought was clearly put into making the place cozy and comfortable for guests. Would absolutely recommend!"
2022-11-01,5.0,Stayed one night,Enjoyed our brief stay at the tiny cottage. Very tastefully decorated.
2022-10-01,5.0,Stayed one night,A luxurious space! Thoughtful host!
2022-10-01,5.0,Stayed a few nights,Amber is amazing and this place is just as adorable and comfortable as the pictures let on.
2022-10-01,5.0,Stayed one night,"This little house was fabulous! Fresh, homey, clean, simple. We hiked at Charleston Lake and Fox Ridge. We ate at Yoder’s and shopped at Shady Crest Market. We visited the pumpkin patch in Arthur.
Amber was a PERFECT HOST and went out of her way to provide dry wood and new lighter fluid so we could have a fire after the rain!"
2022-10-01,5.0,Stayed a few nights,Amber was always very responsive when I had any questions. House is perfect for a couple or close friends/family as it is a studio. The space is of much higher quality than other Airbnbs that I have stayed-quality craftsmanship and very clean. I look forward to staying again in the future!
2022-10-01,5.0,Stayed a few nights,Great stay! Gave our family some nice quiet time to reconnect. Super clean and cozy. The bed was incredibly comfortable. The hosts were very responsive and helpful. Would love to visit again!
2022-10-01,5.0,Stayed one night,Beautiful place and great host!
2022-10-01,5.0,Stayed a few nights,Such a beautiful property out in the country. Very clean and peaceful environment. Perfect to getaway from the noise. It is located next to the primary home so privacy when using the hot tub or fire pit may not be possible. Still was worth the stay. We loved it.
2024-06-01,5.0,Stayed a few nights,Cute camper on a beautiful property. Lots of trails to hike in the woods on their property and a lot of other hiking nearby. I definitely recommend it to anyone who likes the outdoors. Rebecca and her husband are both very nice and very welcoming. I hope to be back in the future.
2023-07-01,4.0,Stayed over a week,"The place was pretty good. Jennifer was a very responsive host and was willing to answer calls or messages within a few hours. I had a longer stay.
My only critiques were regarding cleanliness and noise. I will say that when I checked in there was a lot of white pet hair on the ground scattered throughout the place and a slight odor too. The owner has a dog that is sensitive to outside noises and will bark anytime you go in/out of the door, which can get annoying at times.
Newer privacy curtains were installed in the bedroom, but they still let in a lot of light in the mornings. The kitchen ones are the same and none for the ones in front of the sink. If you’re staying for a longer period, you’ll want to bring your own pots and pans. There are the minimal basics but you’ll want more if you like cooking. The shower and bathroom are nice. Overall, for short-time stays I think it’s a good place but it’s unfortunate it doesn’t have washer, dryer, microwave, and tv."
2023-04-01,5.0,Stayed over a week,Jennifer’s place was so cozy! It is a great location and the perfect size for my needs. I’d definitely stay there again!
2022-12-01,2.0,Stayed a few nights,"I was glad to find an Airbnb in Charleston, but would have appreciated a little more privacy. No curtains in the kitchen which looks straight into the bedroom and very sheer curtains in the bedroom. The host was very nice and lowed the heat after we requested."
2022-12-01,4.0,Stayed a few nights,"It was a very nice stay. the room was quaint, comfortable, clean, and very peaceful. I enjoyed the amenities and especially liked the shower. The room is also in a great location in relation to the town, the freeways, and surrounding cities. I recommend a stay at this location."
2022-11-01,5.0,Stayed a few nights,"Jennifer's place was clean and neat. It suited our needs for a short visit. Definitely read the narrative - there really ISN'T a TV, microwave, coffee pot, or toaster in this cottage apartment. Could use some window treatments for privacy at night - just sheer curtains in bedroom but none elsewhere.
Enjoyed the coffee shop just a few blocks away."
2022-11-01,4.0,Stayed a few nights,7
2022-10-01,3.0,Stayed a few nights,"Nice place, but no curtains in the main area hang out area, the kItchen. And the curtains in the bedroom are sheer like. It’s just nice to have the choice of privacy, especially in the evenings.
I had read a previous review regarding lack of window treatments but thought it would have been taken care of as mentioned in the response.
Also, the bedroom door was broken at the top hinge. So you have to lift the door a bit, then push it to get it to shut.
But otherwise, very nice, clean, quiet and close to the main street square. The Bluetooth was a nice surprise for my daughter.
Thank you."
2022-10-01,5.0,Stayed a few nights,Wonderful stay! There is a cute garden in back and the location is perfect. Everything you’d need is in the Airbnb and it’s very considerately put together!
2022-09-01,5.0,Stayed over a week,"Pleasant stay, quiet neighborhood, attentive hostess!!"
2022-07-01,5.0,Stayed one night,"Jennifer was a fantastic host! The place was peaceful, cozy and impeccably clean. The host is very responsive to any needs or questions. The unit was set up to be a wonderful retreat and is just minutes from everything in the area. Highly recommend it."
2022-07-01,5.0,Stayed one night,Very clean and comfortable. Great value
2022-06-01,5.0,Stayed one night,Jennifer was very accommodating and the house was super clean!
2022-06-01,5.0,Stayed a few nights,"Just as described, clean and close to downtown"
2022-06-01,4.0,Stayed a few nights,Comfortable and convenient space. Easy check in access and great communication with the host. I enjoyed the back porch in the mornings and waking up to the beautiful gardens outside the windows.
2022-05-01,4.0,Stayed with kids,Nice unit for short stay
2022-05-01,5.0,Stayed over a week,"Jennifer was a great host and the place itself was nice and cozy. Only drawback for me was that there were almost no curtains, except for thin ones in the bedroom. Otherwise the area is nice and quiet and this is a great place to stay if looking for a place while in Charleston or Mattoon."
2022-04-01,5.0,Stayed a few nights,"What a lovely place to stay! Check-in instructions were easy to follow and everything was just as we expected. The high ceilings and big windows made the space welcoming even on dreary days. The porch and all the wildlife (squirrels, bunny, cardinals and other birds) in the backyard were a nice bonus. It was great to be in a residential area and a short walking distance to the square."
2022-03-01,5.0,Stayed a few nights,"Jennifer's place was perfect for a weekend getaway. It was within walking distance of downtown and campus. It was also within driving distance of Fox Ridge State Park which made for a great day of hiking. The place was cozy, clean, and exactly what we had in mind when we booked it. Jennifer made check-in very easy and was very informative and responsive. Definitely recommend!"
