date,rating,note,review_text
2024-06-01,5.0,Stayed a few nights,What a beautiful and relaxing accommodation. Tim and Joanie thought of everything down to the little details. Communication was excellent. The restaurant suggestions were spot on. We hope to stay again. Thank you for creating and sharing this peaceful space!
2024-06-01,5.0,Stayed a few nights,"We needed a place to stay for an investigation and the place was so nice, so private, so peaceful that we hope to go back not for another regular trip but just to stay there for a few days and unwind. Top spot. Couldn’t ask for better."
2024-06-01,5.0,Stayed a few nights,Tim and Joanie's place is very charming. We loved every moment of our stay. They were flexible with the check in and wanted to know that we had got checked in. The setting is very peaceful and private. I recommend going on walk around the property. If you follow the gravel road past the house you will find a nice sitting area. My husband left his watch and they mailed it to us. Would definitely stay again.
2024-05-01,5.0,Stayed a few nights,Everything was perfect. Very comfortable and clean house. We loved everything about this place. Tim and Joanie were amazing hosts and they took care of everything we could have needed!
2024-04-01,5.0,Stayed a few nights,"Nice clean and peaceful place, 10 min drive to EIU, even closer to hiking. Tim and Joanie are good communicators and have thought of just about everything. I would stay here again. Just a note that the stairs are very sturdy but narrow and steep. We had no issues but I would recommend slippers with non slip soles for the stairs and for the cool tile on the first floor. Thanks for an enjoyable stay!"
2024-04-01,5.0,Group trip,"We loved this place! No corners were cut. The space is pleasantly creative and unique. The beds are super comfy and we prepared several meals in the kitchen and found everything we needed for them. Hubby was please with desk set up in loft. 16-year old loved the ping pong table, swing chairs on the porch and the cubby bunk (the right bunk in the photos, behind the partial wall).
The setting is beautiful too. The trees in the photo aren't just forest but dramatic ravines that lead to the Embarras River. We didn't spend as much time in Charleston as we wanted but we second Tim and Joanie's recommendation of Siam Thai. We definitely want to return!"
2024-04-01,5.0,Stayed with kids,"Very peaceful, quiet and relaxing. Very beautiful shouse!!! Felt right at home."
2024-03-01,5.0,Stayed with kids,"This Airbnb was amazing!!! Very peaceful location and gave us that ""at home feel"" . Very clearly outlined directions to get to the Airbnb and instructions once inside , along with recommendations for the area and things to do were all greatly appreciated . We stayed with our 4 children and never felt cramped . The special touches to help make families create memories like game area , ping pong table , and fire pit were amazing. Our children loved the swings and sitting around at night playing games together .
We would definitely stay again!"
2023-12-01,5.0,Stayed a few nights,"Beautiful location. We would love to stay there in warmer weather, to enjoy the outside."
2023-12-01,5.0,Group trip,This was our second stay here. We love it. it's quiet and peaceful. Very relaxing spot to enjoy family. Very clean and hosts are very easy to communicate with.
2023-12-01,5.0,Stayed a few nights,Amazing stay as always. We utilized the fire pit out side and thoroughly enjoyed our nights between work.
2023-12-01,5.0,Stayed a few nights,This place is absolutely a must stay! We enjoyed the entire week of the cozy loft.
2023-11-01,5.0,Stayed a few nights,This is a great place. Absolutely spotless and exactly what I needed! Excellent hosts!
2023-11-01,5.0,Stayed a few nights,The loft was a wonderful place. Very peaceful very clean no problems at all . relaxed and had a wonderful time.
2023-11-01,5.0,Stayed a few nights,The perfect cozy cabin for a weekend in the woods
2023-10-01,5.0,Stayed a few nights,"This place felt like home! It was so comfortable and super clean. There was a personal note, hand written on custom fine art stationary, with great information about the area included. My husband is a professional artist so the small gesture and gift was much appreciated. We stayed in multiple places during our time in Illinois, but Tim & Joanie were the kindest and most communicative hosts. Everything you could need and more was available for use here. The cozy and spacious Barndominium is great for both shorter and longer stays. It was close to amenities yet quiet and private. Beautiful kept property. Highly recommend."
2023-10-01,5.0,Stayed a few nights,"Very clean, quiet, private , nice to sit on the swings and watch the deer. We had a very lovely time. we would certainly book at this location again :)"
2023-10-01,5.0,Stayed with kids,Tim and Joanie are great hosts with amazing attention to detail.
2023-10-01,5.0,Group trip,Great place to stay with friends for homecoming
2023-10-01,5.0,Stayed a few nights,Tim and Joanie have thought of everything for this space. it's cozy and comfortable with amazing outdoor area. They have it supplied with everything you'll need to enjoy yourself at any age.
2023-09-01,5.0,Stayed a few nights,Such a peaceful setting! A great place to go to reset and recharge your mind.
2023-09-01,5.0,Group trip,We stayed for EIU’s family weekend. Perfect location and very charming. We had the most relaxing & peaceful time here. Communication was great & very prompt. We will for sure stay again!
2023-09-01,5.0,Stayed one night,This was a really fun place to stay. It had a unique setup with the bedrooms upstairs in the loft. The home was clean and well equipped. It was wonderful to have a location away from noise an chaos. There were even deer that visited in the morning.
2023-09-01,5.0,Stayed a few nights,"Great place to stay as long as you like country living. definitely not a downtown setting, but you can see than in the pictures. Can't wait to stay there again next time we come to the area."
2023-09-01,5.0,Group trip,Thanks for the hospitality! Our stay was comfortable and peaceful.
2023-08-01,5.0,Stayed with kids,This place is even better than the pictures and descriptions. So peaceful and quiet. We saw deer several times while our drinking coffee in the mornings. Close to lots of local attractions and restaurants
2023-08-01,5.0,Stayed a few nights,"This place is too cool. The pictures don’t do this place justice. It’s very secluded, quite and very peaceful."
2023-08-01,5.0,Stayed a few nights,"Terrific stay! The space worked great for us — we enjoyed watching the deer and birds in the morning. And so close to EIU to drop off. Really appreciated the information Tim and Joanie provided, we explored Arthur after reading about it. Love to stay again."
2023-08-01,5.0,Stayed a few nights,"Lovely, peaceful place. Very clean and well taken care of."
2023-08-01,5.0,Stayed with kids,"This place was amazing! It was very clean and we especially loved how private and relaxing it was. It was beautiful inside and out and the price was great! The ping pong table was a big hit, too! Very highly recommend!"
2023-08-01,5.0,Stayed a few nights,Great hosts. Found something in drive that was ours and brought to where we were. Great host will stay again
2023-07-01,5.0,Stayed a few nights,"Tim and Joanie's rural ""Barndominium"" was a real diamond in the rough -- peaceful and cozy, yet modern -- with lots of charm and amenities. My wife and I were returning to central Illinois to celebrate her grandmother's 100th birthday, and once we decided to have an extended stay to visit with family for longer than the party, we were please to stumble on Tim & Joanie's rural hideaway as a place to come back to each evening after a day of visiting, shopping and celebrating. Tim & Joanie greeted and welcomed us before we arrived, sharing very user friendly check-in instructions -- and they were always responsive if we needed to communicate with them. Instead of staying in a hotel room for roughly the same price, we got to enjoy an expanded home space and the peace and quiet that comes with Illinois country living. Coming from a Virginia community where we see lots of deer in our local wooded habitat, it was very cool to see lots of deer nestling in the grassy and wooded areas here."
2023-06-01,5.0,Stayed a few nights,My girlfriends and I stayed here for a weekend getaway. It was perfect for us and loved being away from everything. It’s very secluded with amazing porch swings. Drive to town is about 15 min which was no problem for us. The beds were so comfortable too.
2023-06-01,5.0,Stayed with kids,Awesome Decor and super peaceful!
2023-06-01,5.0,Stayed with kids,"Though short it was a great break in our travels. Leaving the interstate and driving to their place was good for our being. A space to breathe
The place too is beautiful and accommodated the 6 of us well"
2023-06-01,5.0,Stayed a few nights,"Was very nice, and the property was beautiful. Coming back in January, may give you a call."
2023-06-01,5.0,Stayed a few nights,"I think for up to 6 people, peaceful, spacious acreage and as nice as most peoples homes, $100 a night beats any hotel accommodations and most bnbs. Everything and more is right there for you to enjoy. Best bnb for me so far.....and I'm pretty picky."
2023-06-01,5.0,Stayed with kids,"Tim and Joanie have thought of everything! Our stay at their place was flawless, and we would for sure stay again. Everything was clean, the property was beautiful, and the house had anything and everything you could need. The game area, and art supplies was a huge plus!! We were in town for our children’s dirt bike race, and after 3 long days at the track each evening we looked forward to going back to their oasis! It’s truly is a gem, and they were great hosts!"
2023-05-01,5.0,Group trip,"Tim and Joanie's place was a perfect retreat for our family weekend getaway. The home is spotless and is well stocked with useful amenities. The clever layout of the living spaces worked well for our family. We had beautiful weather so we were able to spend a lot of time in the yard and enjoyed relaxing in the porch swings, eating at the picnic table, and playing bags and ping pong. We highly recommend this Airbnb - great hosts and a great home :)"
2023-05-01,5.0,Stayed with kids,"Tim and Joanie's place is phenomenal.
Place is sparkling clean, beds are super confortable, and communication was top.
Our 2 little boys enjoyed the special designed bunkbeds, and me and my other son had a great time on the ping pong table.
Super recommend these place , and we will look forward in staying here again on the future if possible.
Thanks!"
2023-05-01,5.0,Stayed with kids,"Outstanding location, beautiful property, perfectly located for our needs. Wonderful area plenty of things to keep you as busy as you want or just relax and enjoy the serenity. The stars are amazing!!Tim and Joanie's place is awesome and their top notch hosts. Thank you so much we had a great stay!!"
2023-05-01,5.0,Stayed a few nights,"This place was so serene and just beautiful scenery. We felt right at home, safe and had all the amenities one could want! We highly recommend this place if you are looking for a home away from home to stay in. Thanks Tim and Joanie for sharing your place !"
2023-05-01,5.0,Group trip,Amazing place to stay loved everything about it.
2023-04-01,5.0,Stayed with kids,"Oh my gosh, professionally decorated, awesome first clsss linens & towels. A clean unit with an extra play room."
2023-04-01,5.0,Stayed a few nights,Amazing property and the accommodations were amazing! Highly recommend!
2023-04-01,5.0,Group trip,Such a wonderful place to stay.
2023-04-01,5.0,Stayed a few nights,Beautiful home and very peaceful!
2022-11-01,5.0,Stayed a few nights,Everything was great. Hope to return again.
2022-11-01,5.0,Stayed a few nights,Very clean and nice place to stay.
2022-11-01,5.0,Stayed a few nights,We really loved our stay! Tim and Joanie provided the perfect space for us while we attended a conference! We will definitely stay again if we’re in the area!
2022-10-01,5.0,Stayed a few nights,Tim and Joanie are excellent hosts. Property was very clean and well furnished. They are very responsive to all questions and happy to assist however they are able. We were on a hunting trip and found their property perfectly located for us. Thanks again
2022-10-01,5.0,Stayed a few nights,We had a great time staying at Tim and Joanie's place.
2022-09-01,5.0,Stayed with kids,"Awesome!!Every thing was perfect. There are crib,safety fence and kids plates and spoons etc, it's the perfect place for child's and adult nature experience!!There are also many activities for when it rains, such as board games and table tennis etc.We need to stay for more than a week to make the most of it!!!i highly recommend for family stay!!!"
2022-09-01,5.0,Stayed with kids,Very cozy and quiet surroundings! Has a nice cabin feel but easy to get to! Very clean and well stocked! Definitely recommend!
2022-09-01,5.0,Stayed a few nights,Great location beautiful house lots to do
2022-08-01,5.0,Stayed a few nights,"10/10!! This cozy home is absolutely perfect for anyone! Everything from the check-in to check-out was seamless. The apartment is equipped with everything you need, in prestige condition, and the extra amenities couldn’t have been better. Rural location not too far from town. The property allows for outdoor activities and hiking. We loved our stay and will definitely visit again! Thank you so much!"
2024-06-01,5.0,Stayed with kids,The house is very cozy and was very clean. It was a great place to stay and I’m sure we will book again in the future.
2024-06-01,5.0,Stayed with kids,"Our son was competing in the IHSA Track and Field competition at Eastern and this place was exactly what we needed. It was a great location and a super easy drive to and from Charleston. Comfy beds, great water pressure, very clean, very quiet. Thank you Michael and Linda!"
2024-06-01,5.0,Stayed one night,Super clean and comfortable space conveniently located close to the highway. Hosts were extremely helpful!
2024-06-01,5.0,Stayed one night,Always enjoy staying at the Cozy Corner. Perfect location. Lots of room for three couples. I walk every morning and the neighborhood and town is beautiful.
2024-06-01,5.0,Stayed with kids,I felt right at home.
2024-06-01,5.0,Stayed one night,We didn't actually make it due to an unforseen travel disruption on our end. But Michael and Linda were kind and understanding. The communication was good. We would book again in the future and appreciate their responsiveness.
2024-06-01,5.0,Group trip,It was an amazing stay I wouldn’t definitely stay again!!!!
2024-05-01,5.0,Stayed one night,"We almost always stay at one or the other of Michael's and Linda's properties on our way to and returning from visiting our daughter in Kansas City, Missouri. Both of their homes are always spotlessly clean and comfortable. It's our home away from home. Mike and Linda are gracious and responsive hosts who are always ready to help. You can book either of their homes with confidence that you will have a great experience."
2024-04-01,5.0,Stayed a few nights,Everything was immaculate with everything one would need.
2024-04-01,5.0,Group trip,Beautiful house and quiet place. We love it
2024-04-01,5.0,Stayed one night,This place was great!! Our family will definitely be back to stay here!!
2024-04-01,5.0,Group trip,Very clean and nice
2024-04-01,5.0,Stayed one night,"Really cute,clean house in a nice neighborhood. Hosts were always there to respond to questions and very helpful about places to visit."
2024-04-01,5.0,Stayed one night,"Great place in a nice neighborhood, clean and well-stocked. Owners were very responsive to our questions."
2024-04-01,5.0,Stayed a few nights,Comfortable and relaxing as always ... Mike and Linda are great hosts.
2024-03-01,5.0,Stayed with kids,Great place to stay while visiting family
2024-03-01,5.0,Stayed with kids,What a beautiful home. We really enjoyed our stay. Looking forward to next year's trip.
2024-03-01,5.0,Stayed about a week,"We enjoyed staying at Cozy Corner. It is so nice to see affordable places to stay in Greenup. In the past we have had to go to Effingham and stay at a hotel so having a home with all the privacy, quiet and space was perfect. We visit Greenup frequently and mostly stay with family, but this time we had a family reunion and needed a place to stay. This worked perfectly.
I definitely recommend this home for a family to stay in. It is clean, has great amenities such as a full kitchen, laundry, and is a nice quite place to stay. We only needed one bedroom, so we used a 2nd one for suitcases / dressing and still had an extra 3rd bedroom. It would work great for a family."
2024-01-01,5.0,Stayed one night,"A very nice, clean and homey place to stay. Unfortunately we arrived very late .... pretty much just to stop and sleep for the night and we were back on the road by 8ish the next morning.
This place is as described and right off the highway. Great hosts, they were both very pleasant and proactive in communication. I would definitely stay here again :)"
2024-01-01,5.0,Stayed with kids,Super clean and great for our family of 4 for an overnight stay! Everything we needed was there! We will be back!
2023-12-01,5.0,Stayed with kids,"This little home was the perfect stop for us. It was clean, comfortable and convenient. We will be staying here on future road trips!"
2023-12-01,5.0,Stayed with kids,Cozy Corner is a perfect place for us to stay because we have family nearby. The house is always clean and feels easy to relax. Several bedrooms gives us space for everyone to have some privacy.
2023-12-01,5.0,Stayed one night,It was wonderful plan on using it again
2023-12-01,5.0,Group trip,Thank you was good
2023-12-01,5.0,Stayed one night,Everything was perfect! Thank you!
2023-12-01,5.0,Stayed one night,"Great place, great to work with. I was able to host a dinner for a few family members. I will definitely rent again. Some of the family members were interested in sharing with their family members from out of town."
2023-11-01,5.0,Stayed one night,"Everything you would want, need and expect!"
2023-11-01,5.0,Stayed a few nights,Cozy Corner was just as described. The home was very comfortable and clean. It was very much like staying in a friend's home.
2023-11-01,5.0,Stayed with kids,Great stay. We were traveling from Tulsa Oklahoma to South Bend Indiana for Thanksgiving and needed a place to stay. This was a perfect in between spot. Super clean.
2023-11-01,5.0,Stayed with kids,"This was a great place, easy highway access. We have stayed here twice now as we travel across country on family vacations. A nice little home away from home, and we will stay there if our travels take us that way again!"
2023-11-01,5.0,Stayed a few nights,Ill admit that theres not much in the way of restaurants and shopping in greenup but our stay was because we were surprising my mother in Effingham for her birthday so we are pretty familiar with the greater area. This house perfectly accommodated my siblings and I. The place was super clean and had cute decor. Beds were soft and comfortable and plenty of towels and linens available. We really were only at the house to sleep and spent most of our time in Effingham but I would definitely rent again. The time spent there we dod get the opportunity to play some family board games and they had some games available to us as well as the ones we brought.
2023-11-01,5.0,Stayed a few nights,"Cozy, as advertised! Our stay was very pleasant. Can't complain about a single thing!"
2023-11-01,5.0,Stayed about a week,"Suited our needs perfectly.
Be back for sure"
2023-10-01,5.0,Stayed one night,"We have stayed at both of Michael’s places in Greenup several times. Every time, the accommodations are clean and comfortable and have everything we need and Mike and Linda are friendly and responsive hosts.
I Imagine, as long as our daughter lives in Kansas City, Missouri, and we live in West Virginia, we will continue to stay in one of Michael’s and Linda’s homes on our trips to Kansas, as they both are very conveniently located just off of Route 70 and about halfway between our home and our daughter’s.
Thanks, Mike and Linda, once again, for a wonderful experience."
2023-10-01,5.0,Stayed one night,We were only there a few hours but the house was definitely “cozy” as mentioned in the title.
2023-10-01,5.0,Stayed one night,COZY CORNER IS THE MOST BEAUTIFUL AIRBNB IN THE COUNTRY. THE SWEETEST AND MOST RESPECTFUL HOST’S. HOUSE WAS SOOOO CLEAN AND EFFICIENT FROM FRONT TO BACK. SO IMPRESSIVE.. Thank U Guys. GREAT FOLK
2023-10-01,5.0,Stayed a few nights,"We had a great visit to the Casey IL area and Greenup was an awesome location for us.
We saw all the big things and enjoyed a hike at the Fay Pickering park!"
2023-10-01,5.0,Stayed with kids,"we needed an overnight stay.
this was perfect.
it had super comfy beds
all I can say if we travel through again and it was available I would book in a heartbeat.
thanks again."
2023-09-01,5.0,Stayed one night,"Cozy Corner is an exceptionally nice airbnb! Very clean. Very ""cozy."" We were very happy we made the choice to book a reservation here on our way to Columbus, OH. Highly recommend! Enough room for 6 people. We wish we could book this property every time!"
2023-09-01,5.0,Stayed a few nights,We had a wonderful stay. Everything was as expected or better. We highly recommend staying at this home.
2023-09-01,5.0,Stayed a few nights,My work crew loved the house and the location.
2023-09-01,5.0,Stayed one night,"Everything was great! Beautiful home, very clean, we had all that we needed. Would definitely recommend!"
2023-09-01,5.0,Stayed one night,The stay was good. They had everything you might need there for you. Thank you very much.
2023-09-01,5.0,Stayed with kids,This is a great spot . Very clean. Host was a great communicator.
2023-09-01,5.0,Stayed one night,"Our stay at Cozy Corner was perfect. The location was ideal and check-in was seamless and our accommodations were great, clean and comfortable!"
2023-09-01,5.0,Group trip,We are going back some day thank you!
2023-09-01,5.0,Stayed a few nights,"we loved this place. It was very clean & had a lot of extra towels, soap, shampoo, & conditioner."
2023-08-01,5.0,Stayed a few nights,Very accommodating and flexible would stay there again !!
2023-08-01,5.0,Group trip,It was perfect for our girls outing! We stayed overnight then spent the next day shopping in Casey!! Thanks for the clean and comfortable place to stay! I would definitely recommend this place!
2023-08-01,5.0,Stayed one night,Very nice & clean! Highly recommend ⭐️⭐️⭐️⭐️⭐️
2023-08-01,5.0,Stayed one night,Perfect place an location for our needs. We will be back.
2023-08-01,5.0,Stayed with kids,"Michael and Linda are amazing!!! Very accommodating and loving people to work with. We stayed at Cozy Corner and Cumberland Road guest house. Both places were wonder. We will be staying again. Thanks Michael and Linda for spectacular accommodations!
Diane Allen & Family"
2023-08-01,5.0,Stayed one night,"We were very pleased with the house & our stay! Michael & Linda were very responsive to any questions or concerns we had. It felt very warm & welcoming from the moment my Wife & I first saw it! It felt very homey & comfortable from the outside & inside! We appreciated the recommendation to explore the town of Casey which was only 9 miles away. It was home to the worlds largest mailbox, pencil, barber shop pole, ruler, knitting needle, bird cage, etc! My Wife & I walked around with eyes as big as half dollars looking at everything !
We were dismayed though that the house did not have a dishwasher though. I didn’t pay attention when booking the house that it didn’t list having one. The bed in the first bedroom sagged in the middle so my Wife & I slept very close to each other…more so than usual.🙂 Also the two recliners in the living room were uncomfortable…not as plush as they look. If we ever get that way again we would love to stay at the Cozy Corner again! Highly recommended!"
2023-08-01,5.0,Stayed with kids,Nice house. Accommodating host.
2023-08-01,5.0,Stayed one night,We enjoyed our stay very much and will book this house again on our next trip! Thank you!
2023-08-01,5.0,Stayed one night,"My husband ,daughter and I had such a wonderful/ restful stay at Micael’s place. Michael was so very nice and quick to communicate with us from reservation to check out.,The home was just beautiful and immaculate too. The location is only 1 mile away from main highway and in such a lovely neighborhood. We highly recommend Michael’s home to everyone."
2023-07-01,5.0,Stayed with kids,Great place to stay! Quiet and clean. We have enjoyed this place multiple times!
2023-07-01,5.0,Stayed one night,"Great overnight stay, comfortable and just as described!"
2023-07-01,5.0,Stayed one night,This home was very nice and cozy. The host was friendly and accommodating. Would definitely stay again.
2023-07-01,5.0,Stayed with kids,"We truly enjoyed our stay. Very nice and clean house, had everything we needed."
2023-07-01,5.0,Stayed one night,This place is right off the interstate and yet we found it very quiet and peaceful. We had no problem cooking a wonderful dinner on the grill and breakfast in the kitchen. The space is very comfortable and we really enjoyed our stay here. Our bed was quite soft and at the same time I still had a good night sleep.
2023-07-01,5.0,Stayed one night,"Clean, comfortable, and relaxing. Mike and Linda are great hosts."
