date,rating,note,review_text
2024-04-01,5.0,Stayed a few nights,"Once again, we enjoyed our stay at the charming McGrady Inn! It was great to see you both! Thank you for your kind and helpful hospitality. 🤗"
2024-04-01,4.0,Stayed a few nights,Very kind and personable host! Beautiful restoration of church into an Airbnb/bed& breakfast. Centrally located between Charleston and Mattoon. Easy walk to the Charleston Square or Eastern IL University.
2024-02-01,5.0,Stayed a few nights,Thank you again for a beautiful experience. I went to school here and this is by far of the best place I have ever stayed in the Charleston area. I will definitely be coming back and I look forward to doing business with you guys again. A+.
2024-02-01,5.0,Stayed one night,Had a great stay. Will recommend to out of town family when they visit.
2024-02-01,5.0,Stayed one night,Adam and Karen’s place is beautiful. Super clean and really close to Eastern Illinois university. Definitely we are coming back.
2023-12-01,5.0,Stayed a few nights,"Just the finest place in Charleston. This place worked just like a bed and breakfast. It was clean, private and comfortable."
2023-10-01,5.0,Stayed a few nights,"I had lived in Coles County for 30 years but had been gone from there for the 25 years since; I am no longer young. This was a visit to reconnect. I found this bed and breakfast online and was intrigued -- I remember the building as a church! The pictures were attractive, the amenities tempting -- I had a four-night stay and thoroughly enjoyed the experience. I far preferred it over a motel. Karen and Adam were ""there but not there"" -- available, not hovering -- privacy was something I appreciated due to the nature of my visit, meeting up with the friends still in this world, and visiting graves of some no longer with us. It was a wonderful, if wistful trip, and much of the success of it I credit to Adam and Karen's lovely facility. I heartily recommend a stay there, or to utilize as a place to stash relatives for the next family reunion! But beware: there are many stairs. Part of the charm, I thought (I'm pretty spry!) -- after all, the place had been a church. FIVE STARS!"
2023-08-01,5.0,Stayed one night,"Great place, Karen was awesome. We’ll be back!"
2023-08-01,5.0,Stayed a few nights,Great hosts and a wonderful historic building.
2023-08-01,5.0,Stayed one night,So friendly I felt like I was home. 💕
2023-07-01,5.0,Stayed one night,"This was my second time staying here. It’s conveniently located, quiet, perfect!"
2023-07-01,5.0,Stayed one night,"Such a beautiful, unique place to stay!! We were just traveling thru but wanted to stay somewhere different. This place fit the bill. Photos do not do it justice! Karen was great with instructions and greeted us upon our arrival. Our room, including private bathroom, was very clean and inviting. Common areas in the refurbished church were so inviting and very well supplied. If you like history and like to stay at unique places, stay with Karen and Adam!!"
2023-06-01,5.0,Stayed one night,Best place in town for our out of town family and friends.
2023-04-01,4.0,Stayed one night,"We thoroughly enjoyed the ambiance, history, decor, stained glass, tile, hard wood floors with old church features that remained intact through a significant renovation process to turn this building into a unique bed and breakfast. We appreciated the kindness of the host and her flexibility as our arrival time was adjusted from our original ETA. We have stayed at numerous AirBnBs over the years and we seek out unique places. This fit our expectations and the aesthetic of this historic building did not disappoint."
2023-03-01,5.0,Stayed one night,My husband and I had a wonderful night at this unique Air B&B!!! Thanks for your hospitality!!
2022-10-01,5.0,Stayed a few nights,"Lovely property, we enjoyed a two-night stay for a wedding. Very clean and well maintained, very quiet at night."
2022-07-01,5.0,Stayed one night,"The McGrady Inn has to be one of the top AirBNBs in the country! Stained glass, polished wood, and comfy chairs combine to make a visitor to EIU feel right at home. This jem is just a short walk from downtown and you won't regret staying here!"
2022-05-01,5.0,Stayed one night,Great place. Very charming.
2022-04-01,5.0,Stayed one night,"Perfect place to stay in Charleston!
Hosts are super friendly. Great communication. Super clean. Hard to imagine a more interesting place to stay."
2022-04-01,5.0,Stayed one night,Wonderful place to stay. Great Communication. Comfortable bed. Close to town.
2022-03-01,5.0,Stayed one night,Could not be a better stay in Charleston. Great in every way
2022-02-01,5.0,Stayed one night,"Beautiful building and rooms, pristinely maintained. Great communication and check-in. Highly recommend!"
2022-01-01,5.0,Stayed a few nights,Beautiful place! Cozy stay. Amazing hosts. Will be back!!!
2022-01-01,5.0,Stayed a few nights,Great place
2022-01-01,5.0,Stayed a few nights,"If ever in Charleston, IL and you want a unique lodging experience, look no further. This is a great property with attention to details for everything you could possibly want or need while away from home. Highly recommend."
2021-12-01,5.0,Stayed a few nights,The McGrady Inn is a beautiful place to stay. The combination of historic features and modern conveniences was perfect! Communication with Karen was informative with quick responses. I would definitely stay here again and would highly recommend it.
2021-11-01,5.0,Stayed one night,"My daughter and I stayed while visiting the college and enjoyed staying at Adam and Karen’s so much. Not only is the building very unique, the amenities were great and the setup perfect (my daughter was able to sleep in while I had coffee and did a little work at the dining table). If my daughter ends up going to college there, I know where we will stay when we visit!"
2021-10-01,5.0,Stayed one night,"Just stayed one night on business
Adam and Karen are great host
there place is super cool, clean and
peaceful. would stay again."
2021-10-01,5.0,Stayed one night,"Great place to stay for a quick trip for work! Comfortable bed, large bathroom, and the basics you need. Would highly recommend!"
2021-10-01,5.0,Stayed a few nights,"Adam and Karen’s place was just perfect! Very spacious and quiet common areas. Walking distance to downtown and EIU. Not a lot of tourist attractions around, but there are definitely a lot of older homes and buildings to look at on your walks. I love the murals downtown too!"
2021-09-01,5.0,Stayed a few nights,"This was a great quiet alternative to hotels in the area. The place was spotless!
We enjoyed the wide open spaces to read, play games and enjoy our coffee in the morning. Wonderful kind hosts as well!"
2021-09-01,5.0,Stayed one night,"Fantastic place to stay. Beautifully decorated, spotless and clean. Will definitely stay again and recommend to fellow travelers."
2021-08-01,5.0,Stayed one night,"Karen was very polite and helpful. She, is very meticulous about the cleanliness of her establishment."
2021-08-01,5.0,Stayed a few nights,"What a lovely space! We enjoyed just hanging out in the main area. Beds were comfortable and the entire place was impeccably clean. When we return, we’ll stay here again."
2021-08-01,5.0,Stayed one night,This is an architectural beauty and just an overall great place to stay! When in Charleston this is a great go-to as it’s within walking distance of EIU and the Charleston downtown square.
2021-07-01,5.0,Stayed one night,"What a beautiful place to stay! Quiet, comfortable, with beautiful light through all the stained glass windows in the morning."
2021-07-01,5.0,Stayed one night,Great place to stay!
2021-06-01,5.0,Stayed one night,Beautifully restored 100 year old church with all the modern amenities you want. You don't have to be a fan of older architecture to thoroughly enjoy staying here.
2021-06-01,5.0,Stayed one night,I was travelling for business. The check-in process was quick and easy to follow. The room was clean and spacious. The interior of the building is beautiful and unique. I wanted to stay at a unique place that was convenient and this was exactly what I was looking for. I would recommend the stay to anyone travelling for business or personal reasons. Downtown businesses are just a short walk away.
2021-04-01,5.0,Stayed one night,What a great spot. Beautiful and as clean as possible. Hosts are great. The ONLY place to stay in Charleston! Will be back.
2021-04-01,5.0,Stayed one night,"Perfect place to stay overnight during your travels. Very clean, beautiful old church."
2021-03-01,5.0,Stayed one night,"We had a great stay here. The hosts were kind and accommodating, and even showed us a binder of the history of the inn when we inquired about it! We will certainly stay again."
2021-03-01,5.0,Stayed one night,Beautiful. Rustic and modern. Rich with age/history. Clean. Comfortable. Lots of little nooks to sit in. Beautiful.
2021-02-01,4.0,Stayed one night,"Immaculate , warm and cozy.
We arrived last night around 6 pm.
Beautiful ambiance awaited us with gorgeous wood floors and stained glass windows as described in listing .
We like to sleep in the winter with windows cracked open with maybe a fan, but the upstairs room had no window.
With the ceiling fan turned up on high and the bathroom door left open, it kept the room cool enough to enjoy a good sleep . We did find a plug in fan the next morning in the closet. I would of loved to have used it last night, if I knew it was there.
Morning was quiet and peaceful enjoying coffee overlooking the local homes .
We bought 2 of the sturdy coffee mugs available for sale ."
2021-01-01,5.0,Stayed a few nights,"Amazing place to spend some peaceful time. Good to know about the history of this place, adding more to it uniqueness. Thanks for being so wonderful. :) ~ Monica / Lekhana"
2021-01-01,5.0,Stayed a few nights,"My stay at the McGrady Inn was amazing! The space was sparkling clean which is especially important during Covid. The place itself is homey and comfortable. Karen and Adam are amazing people! Not only were they responsive to the constant changes in my trips and quick to accommodate, they even drove me to the train station at 4 AM! I couldn’t have asked for better hosts, will definitely be staying here again!"
2020-12-01,5.0,Stayed one night,This is a special place! It has been beautifully restored! Large and spacious with easy access. Had the extra delight of a beautiful place with Christmas decorations throughout. The hosts are very friendly and responsive. Would highly suggest staying here! You will not be disappointed. Will definitely return in my travels!
2020-10-01,5.0,Stayed one night,"This is a beautiful space! Open and spacious, beauty stained glass, wonderful woodwork. The room was very comfortable and clean, and the space has everything you could need. Would love to stay here again!"
2020-10-01,5.0,Stayed one night,"Extremely clean. Hosts were excellent.
Very cool property. A Charleston destination in itself.
Bed was fine. Rooms very cozy.
Beats a hotel by ten fold.
Would stay again. Highly recommend."
2020-09-01,5.0,Stayed one night,We would definitely recommend McGrady Inn. It is beautiful and the rooms are comfortable.
2020-09-01,5.0,Stayed one night,"This inn is truly a great stay! Super cute, great location. Karen was very nice. Will for sure stay again next time I'm in town."
2020-08-01,5.0,Stayed one night,100% would recommend!
2020-08-01,5.0,Stayed one night,"Amazing place, so beautiful."
2020-08-01,5.0,Stayed one night,"A unique place and sparkling clean. I enjoyed my night here, and the breakfast items offered were a nice touch."
2020-07-01,5.0,Stayed a few nights,"Karen was so quick to reply to my messages and was flexible when we asked to change our check in time. COVID precautions were taken, and the whole place was sparkling clean. This was my favorite Airbnb I've ever stayed in, and far better than any hotel. We are recommending this to friends and family in the area!"
2020-03-01,5.0,Stayed one night,"This is a one-of-a-kind accommodation! Beautiful common spaces with large old church windows, lovely private rooms with attached bathrooms...a historic gem. The continental breakfast was as it should be, simple and delicious. Karen was a gracious and kind host. We would stay here again in a minute."
2020-02-01,5.0,Stayed a few nights,"Unique, quiet, clean stay. We would love to stay here again,"
2019-12-01,5.0,Stayed one night,Very unique and interesting space. Couldn’t have been more comfortable and clean. Really a special experience.
2019-11-01,5.0,Stayed a few nights,Beautiful spaces. Very clean and super friendly hostess.
2019-11-01,5.0,Stayed a few nights,"Had an enjoyable stay, as always at the McGrady Inn! Super comfortable and clean"
2019-10-01,5.0,Stayed a few nights,"McGrady Inn is an incredible building, and Adam and Karen are attentive hosts. We’ll definitely stay again."
2019-10-01,4.0,Stayed one night,"this building retains wonderful things like the ceiling stained glass transom that floods the first floor with light. The original wood trim of the hundred year old building has been faithfully recycled into the new design. Windows are nearly up to the ceiling so by daylight the place gleams. There are MANY stairs to deal with so not a good choice for somebody with bad knees. The breakfast is noted to be ""continental"" and it is a serve yourself setting. I found it to be under powered and I have suggested that the options be expanded."
2019-10-01,5.0,Stayed one night,Absolutely loved this place! It was super clean and I would come back anytime and recommend to anyone!
2019-10-01,5.0,Stayed one night,Plenty of common space and quiet serene setting
2019-09-01,5.0,Stayed one night,"This is likely the best run and most beautiful Airbnb rental we have ever experienced! It is conveniently located near the town center of Charleston - what a rich and interesting history. Adam & Karen have thought of everything! Really - Everything! We have stayed here twice, and will surely come back! Beautiful floors, backlit stained glass, high story central common space. The first time we stayed in the choir loft, and this trip in one of the suites. I have never recommended a place higher - 6 stars!"
2019-09-01,5.0,Stayed one night,"Adam and Karen were great. They were quick to respond when I could not get the TV to work.
Most importantly, everything was so clean! The kitchenette downstairs was also a great amenity with yogurt, coffee, natural tea, granola bars, muffins and more. I would highly recommend this stay to anyone."
2019-09-01,5.0,Stayed one night,A really great place to stay and much nicer than a hotel for the same price. Karen checked us in and she was very friendly. If we need to stay in Charleston in the future I’m looking here first.
2019-09-01,5.0,Stayed one night,Adam and Karen were amazing hosts!Their place was so unique and I enjoyed my stay immensely! I hope to stay again during the holidays!
2019-09-01,5.0,Stayed one night,"When when we are traveling we tend to avoid hotels and try to find unique accommodations. McGrady Inn certainly fit that bill. We enjoyed looking at the binder of pictures of the history and renovation of the church which was turned into a very lovely place to spend the night. The beautiful wooden trims, antique furnishings, and the salvaged stained-glass church windows throughout both the common areas and in the individual rooms were gorgeous. Great decor! Our room with spacious and the bed was very comfortable. We appreciated the relaxing shared areas where we could sit and enjoy the company of other couples we met who were there from different parts of the country... quite an enjoyable stay in an impressive accommodation!"
2019-09-01,5.0,Stayed one night,"You can expect only the best. Beautiful, comfortable, well lighted inside & out.
You will need to be willing to do some stairs but even those have great handrails."
2019-08-01,5.0,Stayed a few nights,"A wonderful clean, quiet and historic site to relax in. Walking distance to campus and the town square."
2019-06-01,5.0,Stayed one night,Amazing place and great location!
2019-04-01,5.0,Stayed one night,"This is a beautiful old building with high ceilings. Close to the University where we visited our granddaughter. The breakfast area had what you would need although Gini and I always travel with our own coffee, oatmeal, sugar, etc. We did take a couple muffins with us! Roger"
2019-04-01,4.0,Stayed a few nights,Super!
2019-03-01,5.0,Stayed one night,"We couldn’t have asked for anything better than McGrady Inn. Between the sparkling clean location, their passion for preservation and a wonderful overall stay, we had such a relaxing and peaceful evening. This location is one of those “hidden gems” you always keep in your back pocket for a weekend away."
2018-11-01,4.0,Stayed a few nights,Beautiful gem of an inn!
2018-10-01,5.0,Stayed one night,Absolutely fantastic experience. Beautiful accommodations and amazing hosts. We will stay here every time we make a trip out in this direction.
2018-10-01,5.0,Stayed one night,"McGrady Inn was a welcome surprise of top-notch amenities and restoration touches on our road-trip. Wish we could have stayed longer than 1 night and explored the walkable charms of downtown a bit more! Karen was very responsive and helpful with our check-in and also with suggestions on local eateries before we were to meet friend later in the evening. We would stay here again 100%, such inspiration to see the love and care put into their historic converted Church Inn."
2018-10-01,5.0,Stayed a few nights,Adam and Karen are the best! I enjoyed my stay at their inn and would highly recommend it to anyone touring the Charleston area!
2018-09-01,5.0,Stayed one night,"Very clean, lovely architecture, cozy rooms, and large roomy bathroom! It was an excellent choice for us!"
2018-09-01,5.0,Stayed one night,Great spot close to campus. Friendly and clean. Karen and Adam were very hospitable. Would def stay again.
2018-08-01,5.0,Stayed one night,"This place is a wonderful gem!! We loved staying at the church. It was clean, beautiful and so relaxing."
2018-07-01,5.0,Stayed one night,"Unique, interesting, clean, friendly, helpful.... yep that says it."
2018-07-01,5.0,Stayed a few nights,"I recently was in Mattoon, IL on business and the usual chain hotels were fully booked. The McGrady was available and for less than I usually pay. Rolling the dice on an unknown isn't always easy for someone who spends over 100 nights a year in Hilton's and Marriotts. This was a dice roll that paid off.
The innkeepers Adam and Karen were super helpful and friendly. Adam even showed me some of their pictures of the building from back in the early 1900's.
This place is spotlessly clean and the AC is adjustable in each room. Everything is comfortable and welcoming.
This building was a United Brethren church and then a United Methodist Church. There is stained glass and beautiful wood floors. It is an architectural gem.
The only detracting is the narrow staircase to get in the building, otherwise a perfect experience. I loved the peaceful and unhurried experience.
I will be back!"
2018-06-01,5.0,Stayed one night,McGrady's is a beautifully done former church that retained many of the stain glass and other features. It is spotless and unique. Highly recommend it.
2018-06-01,5.0,Stayed one night,A very cool space w/tons of character. Several nice amenities & host Karen met us to check-in & then we met Adam as we were leaving. Very nice hosts & a must see location. We’ll be back.
2018-04-01,4.0,Stayed a few nights,"Karen and Adam were wonderful hosts, and the amenities lovely. The space is gorgeous and the bathrooms large and clean. Charming historical building. You need to be able to climb steps to enter."
2018-01-01,4.0,Stayed one night,"The renovated church has a very attractive and useful open common space for all guests with a kitchen, couches, sitting areas on two different floors. The room I had was clean and neat. If you came for TV, the large one in the common space is for you. I will come again."
2017-11-01,5.0,Stayed one night,"If you are staying in Charleston, IL this is the place to stay!! Such a cool building in a prime location. Adam & Karen are awesome and easy to communicate with - you will thoroughly enjoy your stay!"
2017-09-01,5.0,Stayed one night,"This is such a unique B & B being in an old church building. We enjoyed looking in all the spaces and noticing all the 'old' things, the curved woodwork, and the simple furnishings. Even though the rooms were booked, the place was quite and we enjoyed our coffee and breakfast in an upstairs sitting area. The bathrooms are very spacious and clean. We highly recommend a stay here and we are looking forward to another visit."
2017-08-01,5.0,Stayed one night,"We stayed at the McGrady Inn for a quick overnight stay while travelling back home from northern Ohio - so glad we did! This is a wonderful alternative to a conventional hotel. The renovation from church to Inn/BnB has been really well done. Details from the original building are preserved throughout; the renovated space is full of craftsman style detailing.
Karen was a wonderful host. She met us at the property, talked with us about the building's history, suggested restaurants in town, provided directions, and made sure we had everything we needed. The room was well-maintained and clean. Our overnight stay was peaceful and quiet - providing for some of the best sleep we had throughout our trip. If we are in the Charleston, Il. area again, we will definitely stay at the McGrady Inn. Recommended!"
2017-08-01,4.0,Stayed one night,"McGrady Inn is a remarkable renovated space. Highly recommend. We had a very short stay (arrived late, left early) and we would have liked to have been able to enjoy the Inn more. Karen was flexible and accommodating even though we arrived later than expected and met us at the Inn to show us to our room. The room and private bathroom were lovely, clean, and had plenty of space. The whole place had great character and is truly unique. The only downside is you can quite literally hear everything that is going on and spoken in the guest room next door. If you are looking for complete privacy in that way, this would not be the place unless you happen to be the only guests there. Overall very good stay!"
2017-08-01,4.0,Stayed one night,"This was a beautifully renovated old church. However, we were disappointed that this was a small commercial Inn just like the name said, and not like a private Airbnb such as we had experienced in the past. That said, it was unique, and worth a visit. The accommodations were comfortable, spacious, and very clean. We loved the old church, however, we did not have a restful sleep because the couple next door to us came in late after we were asleep, woke us up and kept us awake with loud talking until the wee hours of the morning, then woke us up again early in the morning with more of the same. We may as well have stayed in a Days Inn."
2017-07-01,5.0,Stayed a few nights,A warm and interesting place to stay. A welcome alternative to hotels.
2017-06-01,5.0,Stayed a few nights,Incredible house. Architecture and furniture perfectly match. Hosts live in different house.
2017-04-01,5.0,Stayed a few nights,"This location is amazing! It is peaceful and beautiful! A friend and I met there for a weekend get-a-way. The weather was not good but we enjoyed two dinners out within walking distance and a trip to the outlet mall about 25 min away. I would enjoy coming back to explore the area when the weather is better. This location was a good mid-way stop for us as we are from Indianapolis and St. Louis. The owners are kind and attentive and gave great recommendations for food and outings. I would highly recommend this Inn! It would also be a great location if there was a need to rent the entire place, as there is so much room to congregate in the open living area on the main level. I could picture it as a wonderful event venue!
Thanks again to Adam and Karen for being such wonderful hosts!!!"
2017-04-01,5.0,Stayed a few nights,"This was our first experience with air bnb and this place made it wonderful. The inn is adorable and they made sure we would have everything you could ever need. Adam and Karen were great hosts and so helpful. They went above and beyond to make us feel welcome, and even helped us find an apartment in Charleston for when we move."
2017-04-01,5.0,Stayed one night,This is amazing. In fact it's perfect!
2017-04-01,5.0,Stayed a few nights,The place is amazing. The owners are great. I hope to stay there again!!
2017-03-01,5.0,Stayed a few nights,One of the cooliest places I have ever stayed at!
2017-03-01,5.0,Stayed a few nights,"Wow, what a great place to stay! My son and I stayed in one of the five bedrooms with private bath available. The entire inn is well-kept, clean, and nicely appointed. Adam and Karen were gracious hosts and communication was excellent. I arrived late Friday night and they met me at the Inn to let me in and show me around. I can't recommend this place highly enough if you will be in the Charleston, IL area. Thanks!"
2017-03-01,5.0,Stayed a few nights,"Lots of character, very clean, convenient to EIU. Very friendly and helpful."
2017-02-01,5.0,Stayed one night,"Best Airbnb we have ever stayed in. We were leery about driving so far off the highway but so glad we did.
This beautifully renovated church is a masterpiece. We stayed in room two and enjoyed a wonderful night's sleep. Every touch is perfect... The wonderful sheets, the heavy towels, the thoughtful snacks and breakfast items.
We are from New York, this would've been a $400 a night stay in New York. We paid $100, what a steal. Run don't walk to this inn!"
