date,rating,note,review_text
2024-06-01,5.0,Stayed with kids,Had a great stay. Elizabeth was very responsive with any questions we had. It was the quiet weekend getaway that we needed.
2024-06-01,5.0,Stayed with kids,Great place to stay! Beautiful home located right next to the river that makes you feel at peace with the nature.
2024-06-01,5.0,Group trip,We had a great weekend on the Rock River. Enjoyed the sights of the local state parks while celebrating our NIU graduate.
2024-04-01,4.0,Group trip,loved the location. Chock full of everything you might need for cooking. Bathrooms clean and nicely done. Rear deck and fire pit nice.
2024-04-01,4.0,Group trip,"The river house was nice, and had a lot of great items in the kitchen for cooking and living room for entertaining. The grill didn’t work, but we enjoyed the large fire pit and they had a lot of wood to burn and cookware to put meat in to roast over the fire so we were able to make meals over the fire which was nice. Bring a lighter though because starting the fire was an interesting achievement for us day one, but day two we were able to keep it going from the night before. The water pressure wasn’t that great, but the bathrooms were fully stocked, and clean. The kids had a great time listening to records, and playing their guitar. We all enjoyed river view, their canoe is gorgeous, and while we didn’t catch any fish, it was a charming, cozy stay in a nice river home. Our children had a blast!"
2024-04-01,5.0,Stayed a few nights,Beautiful riverside house. Comfortable and convenient. En plein coeur de la nature.
2024-03-01,5.0,Group trip,This was a great place to stay with a lovely river running in the backyard. Elizabeth was always responsive and so friendly!
2024-03-01,5.0,Stayed with kids,Elizabeth’s place was great. We were in town to visit my grandmother for the weekend. We had a 5 year old and an 8 year old with us who loved all the toys.
2024-03-01,5.0,Stayed with kids,Elizabeth was very responsive and flexible with check in and checking out. I got all the information that I needed before and during our stay at her home. This Airbnb is perfect for kids as they have many toys in the house and in the garage.
2024-02-01,5.0,Group trip,"This was my first experience renting an Airbnb, and I couldn't be more impressed! Elizabeth was an exceptional host. She contacted me before the trip and gave me detailed information to make our check in easy and helpful information to help us make the most out of our stay.
The house was in pristine condition and had ALL the amenities you would need. Truly all you need to bring is food, the rest is already there to enjoy! You can tell that Elizabeth has spent a lot of care and time into making sure her guests enjoy their stay. She was very friendly and easy to communicate with.
The location is right on the Rock River and close to surrounding towns. You don't need to leave, but if you do, there are many things close in the area to enjoy.
I would absolutely book with her again!"
2024-02-01,5.0,Group trip,"This place nice and cozy, very beautiful inside and out!!!"
2024-02-01,5.0,Stayed a few nights,Great place!
2024-02-01,5.0,Stayed a few nights,Great location- quite nice house…very comfortable! Lots of great hiking around and the local bars are comfy!
2024-01-01,5.0,Group trip,Place was wonderful! Felt cozy like at home and the scenery was beautiful. Elizabeth was very quick to respond to questions - a perfect host. Thanks again.
2024-01-01,5.0,Stayed a few nights,Perfect location surrounded by nature.
2023-12-01,5.0,Stayed with kids,"Elizabeth’s place was very nice, well kept and located not too far from downtown Oregon. It had everything we needed and beds were very comfortable for all six of us. The kids loved that there were toys & books. We will stay there again; especially in warm weather when we can enjoy the outdoors. Elizabeth was very quick to respond and a great host!"
2023-12-01,5.0,Group trip,"We had an amazing stay at this Riverfront Retreat in Oregon, Illinois! The spacious and cozy interior, updated kitchen, and delightful river views made our time truly special. The deck with a BBQ and the backyard fire pit added to the charm. The location is perfect, just minutes away from hiking spots and the river access is a bonus. The recent renovations and thoughtful amenities, like the pack-and-play, made it family-friendly. Whether you’re looking to fish, hike, or simply unwind, this retreat has it all. Highly recommend!"
2023-12-01,5.0,Stayed a few nights,"I really enjoyed the stay, felt a lot more at home than most places I stay for work."
2023-12-01,5.0,Group trip,"We loved this home. It was very comfortable and perfectly met our needs. The home is pristine, well kept, with a very organized kitchen. It is as nice as the photos. The host was very responsive and helpful. 5 star experience all around."
2023-12-01,5.0,Group trip,"6 of us went here for a girls weekend, it was perfect! The house was very clean & had everything you would need, if you chose to do any cooking, we did not we checked out the restaurants instead. There is a Great Mexican restaurant I highly recommend. Cute little shops to check out as well.
Elizabeth was very responsive to any ? we had. Definitely will be staying here again"
2023-12-01,5.0,Group trip,"We loved everything about this property. The home was very clean, tidy and had everything we needed. Elizabeth was very responsive and great to work with. We would definitely stay again!"
2023-11-01,5.0,Group trip,"We love the house on the river. We had a great time, the house was just it was described and the surrounding is just beautiful. We will be back."
2023-11-01,5.0,Group trip,Excellent stay close to castle rock with great view of river!
2023-11-01,5.0,Stayed a few nights,We really enjoyed our stay. Lovely spot on rock river with easy access to local state parks.
2023-11-01,5.0,Stayed a few nights,We enjoyed the beautiful sunrise and sunset over the tops of the trees each day. A bald eagle showed up around 4pm almost every evening to rest for while in full view across the river. A bird lovers spot with all forest on the other side of the river. My husband and I enjoyed cooking in the open kitchen. So nice to cook in a kitchen that is set up by someone that cooks. We especially liked the beautiful wood cutting boards. We both slept great each night. So private and peaceful. We reluctantly left to go hiking each day. We look forward to staying here again in the future.
2023-10-01,5.0,Stayed with kids,"This place was just what we needed. A countryside getaway in the fall at a beautiful property, furnished with all the comforts, with lovely indoors and outdoors. The place had everything for our family with senior parents to a 1 year old infant.
Elizabeth was proactive, kind and easy to communicate with, even in the middle of a major life event. She shared local recommendations and pointed us to various resources at home for our kid. We cooked, had a campfire, hiked at nearby trails, took walks around the property, and cozied up next to the fireplace with a book and hot chocolate.
Will definitely be going back for the summer!"
2023-10-01,5.0,Stayed over a week,It was a very peaceful place to stay. They were very quick to respond to any questions we had. I would highly recommend this place to anyone looking for a nice peaceful getaway.
2023-10-01,5.0,Stayed with kids,"Loved the house! It was absolutely gorgeous, wish we didn't try and pack so much into the weekend so we could have enjoyed the actual house a little more, but it definitely worked for our needs!"
2023-10-01,5.0,Stayed a few nights,"One of my favorite airbnbs so far! I was looking for a waterfront place, and this country home by the river was perfect. My friend and I would take our chairs and sit and read or talk down by the river...so peaceful watching the river and the fish jump. The house itself is decorated with a quiet palette, and the way the kitchen is stocked with spices and pots and pans (even vanilla!) and the bathroom has extra toothpaste in a drawer, feels very thoughtful and welcoming. My bed was very comfortable as well. The only possible drawback, which doesn't deter me from coming back, is that there is some periodic road noise from Illinois 2, but you don't hear it in the house."
2023-09-01,5.0,Group trip,"Elizabeth was a very gracious host for a post-engagement weekend getaway. It can sleep 8, but was a very comfortable place for 4. The kitchen was a joy to cook and socialize in, and the outdoor space was well kept."
2023-09-01,5.0,Stayed a few nights,"We had a wonderful time at Elizabeth's home. The home was clean, comfortable beds, everything you need as far as cooking items and toiletries. Beautiful view of the river and great fishing on the bank right outside the house. Area is very private and peaceful, we would definitely like to come back someday. We had a little issue with the garage door and the DVD player and Elizabeth was quick to respond. Oregon itself was very nice also. Plenty of hiking, antique shopping and we did kayaking on the river....Thanks again Elizabeth for a memorable time!"
2023-09-01,5.0,Stayed a few nights,"We went with another couple for a quiet and relaxing weekend. Elizabeth’s place was just what we needed. The rippling of the river behind her home created a very relaxing atmosphere. Elizabeth was so accommodating and kept in contact with us before arriving to be sure our weekend met our needs and expectations. The home was clean,well maintained, and stocked with the essentials! Great experience."
2023-09-01,5.0,Group trip,"The place is truly Paradise! Thanks to the owners for a wonderful vacation! The house is wonderful. Everything is thought out to the smallest detail. Very comfortable! The views from the house to the river, especially at dawn, were simply mesmerizing! The yard is well maintained and spacious. We really enjoyed spending time around the fire pit. Quiet and cozy place. We'll come again!!!"
2023-09-01,5.0,Stayed with kids,We had a great stay.
2023-09-01,5.0,Stayed with kids,"If I could give this place 6 or 7 stars, I would. With Airbnb filled to the rafters with perfectly acceptable but soulless accommodation, this is throw back to the platform's early days.
Elizabeth's house backs on to the Rock River, and it's off the main road so it's wonderfully secluded. Outside the main things we heard were cicadas and the river. It's so relaxing.
Inside, the house has been tastefully renovated and feels lived in. The kitchen is stocked with almost every item imaginable, the cookware is top grade, and there are plenty of condiments and spices to make tasty meals. (Side hint: get some local corn, it's crazy sweet and delicious.)
The couch, and beds are all very comfortable. And although we only spent a few nights here, we felt fully refreshed.
There's plenty to do at house too with canoes, a zip line, fishing gear, plenty of kids' toys, and board games.
Internet is available, but it's slow, which was great for our needs, but not if you want to work remotely."
2023-08-01,4.0,Group trip,"There were a lot of things in the garage to use while staying here. We did go out and buy some bag-o bags because it looked like some mice got into them. We also brought some fishing gear because there were poles, but nothing to use to fish with. All-in-all it was a fabulous experience."
2023-08-01,5.0,Group trip,"The house is very cozy and intimate and private, with a nice view, we enjoyed the backyard and spent most of our time outside. The beds were super comfy and clean, along with plenty of washed towels available in both restrooms, the living room area was also very cozy and comfortable. Elizabeth was also a great host, she was very responsive and made sure check in went well as well as check out. The River house also had everything you might need for your stay. We enjoyed our stay and would book again:)"
2023-08-01,5.0,Stayed with kids,Weenjoyed the peace and serenity. The house was perfect for us and our children.
2023-08-01,5.0,Stayed a few nights,"We booked Elizabeth's home for a getaway and it was wonderful. It is quite charming. Her thoughtful touches made the space very homey.
Elizabeth was always responsive and made sure we had a nice stay. We would not hesitate to book again."
2023-08-01,5.0,Stayed with kids,"We wanted a country getaway for our family (kids aged 2, 4, and 7), and we could not have asked for a better time. The house is stocked with joys for kids: games, toys, a mini kitchen and chalk board, and even a vintage school desk filled with art supplies. The kids' room had everything you would need if you had smaller children: baby monitors, a pack & play, portable high chair, etc. Outside there is a mowed pathway along the river (no swimming due to the current) and the garage had lots of treasures for kids and adults alike: a canoe, fishing poles, a ""bags"" set, and other outdoor games. There is even a mini zip line my kids spent hours on, dragging one another back / forth. With four bedrooms, everyone slept comfortably and peacefully. There is a motion detector light in the hallway for middle-of-the-night needs. We visited during the Ogle County Fair, so between carnival rides, cotton candy, running/zipping around the River House, my 7 year old said it was the best day of her life!"
2023-08-01,5.0,Stayed a few nights,"My wife needed some time to reconnect with nature in a beautiful setting and a slower pace of life for a few days. This place absolutely delivered.
THE SETTING: the drive to the home through small towns, state parks and rolling hills is a retreat in and of itself.
THE PROPERTY: After you drive down a narrow paved drive, you come to a gravel road path which immediately reminds you that life is now slower and simpler and to pump the brakes and look around. The old home looks like a miniature farm house mansion-of-old. The pictures on the Airbnb site are nice, but pale in comparison to the actual charm we felt pulling up. Out back it's just you, trees & the Rock River.
THE HOUSE: Nice modern finishes coupled with vintage touches. The kitchen has everything you may need, most brand new, including a Brita in the fridge with filtered H2O, a stocked Keurig, appliances, etc. FYI there is no recycling on site. Upstairs there are four perfectly quant bedrooms with new bathrooms. We'll be back"
2024-06-01,5.0,Group trip,"Outstanding stay. Very clean and comfortable. Relaxation in a multitude of ways. Sit on multiple decks with a breeze, fishing, hot tub, sauna, fire pit, boating. Loved it and plan to be back."
2024-06-01,5.0,Group trip,"The location was perfect for a weekend getaway, and Mike was super responsive."
2024-04-01,5.0,Group trip,"This island home was perfectly secluded with 360-degree water views, private gate access. Mike, the host, was very responsive! Ideal for families, with plenty of games and child-friendly furnishings. Every detail caters to comfort and convenience—offering a large communal area with multiple hangout areas both in and outside. Luxurious mattresses with extra linens and towels. Fully equipped kitchen with a complimentary espresso machine. Only a 9-minute drive to restaurants and a 10-minute drive to a golf course.
This island home is not just a place to stay—it’s a destination in itself, promising an unforgettable experience that combines the serenity of an island retreat with the comforts of a luxury home. It’s a must-book for anyone looking to unwind and indulge in the beauty of nature with all the comforts of modern living!"
2024-04-01,5.0,Group trip,Was an amazing stay for friends or family. Private and away from ppl if you want a little get away. Beautiful and so many activities.
2024-04-01,5.0,Stayed with kids,Perfect.
2024-03-01,5.0,Group trip,"Great place for relaxing away from the city, 100% privacy, everything in this house exceeds our expectations, Mike was a great host, responsive time less than one minute.
Will come back soon!"
2024-03-01,5.0,Group trip,Mike was a great host! His place is beautiful and really is a great place to gather. Good amenities and private.
2024-02-01,5.0,Stayed with kids,"Highly recommend; although a family emergency stopped us short of fully experiencing this unique home it is truly spectacular.
Highly recommend"
2023-12-01,5.0,Stayed with kids,Nice spot to hangout for a few days. We had a large group with several kids and everyone had a good time.
2023-11-01,3.0,Group trip,"First, I'll give you the good- The place is a lovely house, and the location is beautiful. The site is truly an island and is very private.
However, I will tell you that my issue with this place was the mice problem. Every room had evidence of mice droppings—even Some of the drawers in the kitchen. Twice in broad daylight, we saw a mouse running from one end of the room to the other. I understand that the house is by a river and the the first night, I told my kids, ""It's because we are by a river."" But then, I noticed how it was a bigger problem: bad. There are plenty of ways to combat this problem; there is no reason for this. It is very unhealthy for anyone staying there."
2023-10-01,5.0,Group trip,We had a large group and had plenty of space to be together. Home was clean and organized. Would recommend for others to use for a get away.
2023-10-01,5.0,Group trip,Awesome location and views! So relaxing and a great place for a good time with friends.
2023-08-01,5.0,Group trip,"An absolutely beautiful property. Unfortunately 100 degree weather hindered using the sauna or hot tub. The listing said that the house was stocked and ready to go. Toilet paper, coffee pods, pots/pans, games, high chair. Everything we would need was there. It could be a little buggy out when grilling, but completely understandable given its proximity to the Rock River. Great experience! We’ll definitely do it again. Maybe winter?"
2023-08-01,4.0,Group trip,It truly is your own island! House has great amenities. Responsive host! But wish it was a little more organized and carefully kept for the price.
2023-07-01,5.0,Group trip,"A nice house with many places to entertain inside and out. Plenty of beds, linens, pillows, an air mattress.
One bedroom with 3 beds has a small window A/C and there's larger window unit in the living room. It was over 100F outside when we arrived so it took a little time to cool. The bar and pool table rooms in the basement stayed cool though without A/C. I would bring fans for the other bedrooms if it's going to be over 90F but we were outside 90% of our time thanks to the kayaks, hot tub, fire pit, sauna, paddle boat, grill, smoker, fishing, etc.
Bring your own tupperware, Ziploc bags, and paper towels but otherwise the kitchen is well-stocked.
For kayaking, plan to walk back from the nearby boat launch if you leave the cove because if it's rained recently, you won't be able to paddle against the current to come back.
An overall great weekend with 8 of us, each in our own bed, which is hard to find!"
2023-07-01,4.0,Group trip,"We had a great time at the private island, which truly is private. Lots to do at the house, and Dixon is a short drive away. Mike was an excellent host. The house was very clean, and he was responsive when I had questions. I do wish the house had Wi-Fi, and the faucet water is a little gross. Regardless, I highly recommend staying here."
2023-07-01,5.0,Group trip,Easy check in process. Enjoyed the stay with friends on a peaceful island!
2023-07-01,5.0,Stayed with kids,Unique beautiful spot on the rock river in northern IL. Plenty of space to spread out for the whole family. Linens and pillows were very comfortable. Hot tub and sauna with views of the river were amazing. River is really low from the lack of rain but kids still had plenty of fish to keep them busy. Large umbrellas on front and back decks were nice addition for warm sunny days. Assume being on the river with a shallow well and low water level may have caused the sulfur smell in the water faucets. Other then that wonderful memorable experience!
2023-07-01,5.0,Group trip,Great cozy place! Lots of space indoor and outdoors! I highly recommend for a family vacation.
2023-07-01,5.0,Group trip,"This cabin style home is in a beautiful surrounding! The home is large and can easily accommodate a large group. The kitchen was lacking on utensils for a large group- but, we made do. Mike was extremely responsive to questions and did his best to make everything comfortable for us. It truly was a peaceful property and great house!"
2023-06-01,4.0,Group trip,Beautiful property
2023-06-01,5.0,Group trip,Very nice place! Perfect for a girls weekend. Tons of space and the location was wonderful.
2023-06-01,5.0,Group trip,"This cabin was the perfect place to relax and enjoy. Mike was a great host! Everything went smoothly, from booking to checking out."
2023-06-01,5.0,Group trip,This is a really cool property for a group of friends or family. The house is very spacious and being on an island offers great views and privacy. Would highly recommend to anyone looking to get away from the city!
2023-05-01,5.0,Stayed with kids,"This is such a gorgeous place to stay! We had plenty of comfortable space for our big family, and there was lots to do indoors and outdoors"
2023-05-01,5.0,Group trip,Perfect experience for a private get away trip
2023-05-01,5.0,Group trip,"Perfect place for a guys weekend! Beautiful yard and space with tons of seating options outside and inside. We loved all the amenities Mike had available (sauna, hot tub, kayaks, grills, towles, extra blankets, etc.). I would definitely come back"
2023-05-01,5.0,Group trip,"Had a great time, super nice home with much to do!"
2023-04-01,5.0,Group trip,Mike was an excellent host! And his retreat is amazing! We may have to plan another girls retreat again next year! It was perfect for a gathering. We especially enjoyed the steam room.
2023-04-01,5.0,Group trip,"Great place to stay, ill suggest it for more people."
2023-04-01,5.0,Group trip,Mike's private island was the perfect weekend getaway. It's located approximately 1.5 hrs from Chicago and offered awesome amenities for a guy's weekend. I'd highly recommend it for anyone looking for a fun and/or peaceful escape with a group of loved ones.
2023-03-01,5.0,Group trip,Great place to spend time with friends and family.
2023-02-01,5.0,Group trip,Great place for a weekend getaway. Sauna and hot tub were the best perks for our crew.
2023-02-01,5.0,Stayed a few nights,Very beautiful home !!!
2023-01-01,5.0,Stayed with kids,"we wanted to escape from our daily routine and to relax somewhere, this was the perfect place kind of unique private Issland surrounded by the beautiful nature ,inside nice and clean, hot tub and sauna was 5star , very nice place"
2023-01-01,5.0,Group trip,"Good host, beautiful environment."
2022-12-01,5.0,Group trip,Awesome place and great getaway!
2022-12-01,5.0,Group trip,"Great place to stay, Mike was a quality host!"
2022-11-01,4.0,Stayed with kids,"The Private Island House is a great opportunity to unwind on beautiful grounds with many amenities. It was very clean and the new furniture was pristine, as well as cozy. There isn't, however, a second living room with three more sleeping places. I recommend confirming with the owner about any changes to the property before you arrive, in case that has been updated. Our group was hoping to use the extra sleeping spaces so we wouldn't have to double-up, but those sleeping spaces didn't exist. Additionally, the hot tub was not in safe condition (brown water) upon arrival so I suggest you confirm with the owner that the issue has been resolved before booking your stay. Lastly, I recommend you bring your own towels as we did not have enough to accommodate our group."
2024-06-01,5.0,Group trip,We throughly enjoyed our stay. Everyone left happy and we’re hoping to book again next summer.
2024-04-01,5.0,Stayed with kids,"This was our second time staying at this property.
We will definitely be back!!"
2024-04-01,5.0,Group trip,This house was perfect for our girls weekend! Plenty of room for our large group and everyone had their own space to sleep. Would definitely stay here again!
2024-04-01,5.0,Group trip,This was my second time at this location and this time it was with a group of girls and it was just as wonderful! We enjoyed being away from the hustle and bustle and just relaxing and talking with friends. Lots of wildlife and peaceful surroundings. Great space for playing games and sharing meals and just being together. Beds are comfortable and had all we needed in the kitchen. Loved the deck and didn't get to use the firepit but it looked awesome! We will definitely be back! Thanks Heather for a beautiful place!
2024-04-01,5.0,Group trip,Heather was very nice and responsive the entire time of my stay. Never had any issues from check in to check out. The house was clean and spacious to host a gathering.
2024-03-01,5.0,Group trip,"This stay was incredible. There was so much space and the house was exactly what we needed. It is amazing for a larger group. The driving instructions Heather gave were very helpful and needed. The only difficulty was lack of towels, but everything else was sheer perfection."
2024-03-01,5.0,Stayed with kids,"Beautiful and peaceful place to stay. It was a little tricky to find, but with the directions given by the host it got you right there. Host was responsive and helpful."
