date,rating,note,review_text
2024-06-01,5.0,Stayed a few nights,Teresa’s place was lovely. Looked exactly like the photos. She was very responsive and helpful. I would definitely recommend & I would also stay here again.
2024-05-01,5.0,Stayed over a week,beautiful place to stay!
2024-03-01,5.0,Stayed a few nights,"Great small place huge master bedroom comfortable bed. Close to ft bliss, El Paso airport, and a good spot in El Paso."
2024-03-01,5.0,Stayed about a week,Great host and location!
2024-02-01,5.0,Stayed over a week,"Teresa was excellent at communicating and was flexible. This was the perfect home away from home for an extended stay for work. I felt safe, the kitchen was fully stocked with appliances and dishes. I’d stay here every time I visit El Paso! Thanks Teresa!"
2024-01-01,5.0,Stayed a few nights,"Teresa our Host went above and beyond to accomodate ""las tres hermanas"" on their annual trek to our magnificent hometown.
She exemplifies what El Paso is ALL ABOUT- the people...the Food is a close second.
Gracias Ms Teresa"
2023-12-01,5.0,Stayed a few nights,Very nice home.
2023-11-01,5.0,Stayed over a week,"This Accomodation was exactly as advertised! Great townhouse in a nice are on the west side of El Paso , it’s walking distance to some local shops and you can access , shopping malls , theatre and much more actives within 10-15min drive. Highly recommend!"
2023-08-01,5.0,Group trip,Great place! Host was amazing!
2024-06-01,5.0,Stayed one night,Very nice and clean I would rent it again in the future
2024-06-01,5.0,Stayed one night,This place was one of the firsts to make me feel right at home. It was a long flight and getting to a place with all the lights on and fresh AC blowing was great. The shower is amazing! a lot of amenities. I will definitely stay here again.
2024-06-01,5.0,Stayed one night,Cute place! Very homey feel :)
2024-06-01,5.0,Stayed one night,"Beautiful place and great location. Love the Mountain View’s.
Thank you"
2024-06-01,5.0,Stayed one night,"Wow!! What a beautiful home!! Definitely one of my most favorite places I've stayed!! Thank you so much, Laura, for sharing your lovely home!!"
2024-05-01,5.0,Stayed one night,"I felt so safe the whole time, beautiful home and Laura was always ready to help out. The whole check in/out process was easy to do!
Great stay"
2024-04-01,5.0,Stayed one night,Great Place...Great vibe...very homey and thoughtful decor/furniture!
2024-04-01,5.0,Stayed a few nights,"Lovely home, close to some great food too!"
2024-04-01,5.0,Stayed one night,Great stay
2024-04-01,5.0,Stayed one night,"What a great gem of a house: late 20s/30s bungalow felt just like grandma's house. Great design & updated everything, but with antique/vintage touches too (old turntable & records to play was a nice touch). Fantastic bedding/linens, tons of amenities, stocked kitchen. Everything was impeccably clean, too. The recommendations for local eateries & such were well done. The only drawbacks were neighborhood, noise & cooling. The house is in a pretty empty neighborhood---sketchy? I don't know the area, so hard to say, but not a place we felt comfortable walking around at night. The location is just a block off the major east/west highway which parallels major train tracks, so you will need ear plugs for the noise (constant throughout the night---but they were provided). Also, there is an AC in the living room, but not in the bedrooms: if you need it cool to sleep you will not be happy. Overall, though, we loved this house & would certainly stay again on our next drive through El Paso."
2024-04-01,5.0,Stayed a few nights,Laura is an amazing host and was extremely accommodating and great to communicate with. Her casita was spotless and she had some great local recommendations for food and coffee.
2024-04-01,5.0,Stayed a few nights,"Very nice apartment, well equipped. I would recommned this property."
2024-04-01,5.0,Stayed a few nights,Unique and homey. It was easy to get around and do things we wanted to do in El Paso. Clean bathroom and cute kitchen.
2024-04-01,4.0,Stayed a few nights,It was an amazing stay and Laura was responsive and friendly. a very unique place and welcoming with personal touches all over. Will definitely stay again.
2024-03-01,5.0,Stayed one night,"Nice and Beautiful place.
Very private, safe and secure.
I wanted a place to crash for the night while driving from CA to TX. Leaving the car overnight with full of stuff was safe."
2024-03-01,5.0,Stayed with kids,"Adorable house! Above and beyond as Laura has thought of everything you might need during your stay. While the neighborhood is older, her place is great and full of charm. The Mexican place, L&J cafe, we walked to based on another review was excellent! Thank you for a fabulous stay."
2024-03-01,5.0,Stayed one night,"Wonderful spot in the middle of El Paso, close to everything we needed. Quiet, safe, clean and spacious. Plus it has the best shower any of us have ever used. Thank you Laura!"
2024-03-01,4.0,Stayed one night,Check in could have been earlier but place was nice.
2024-03-01,5.0,Stayed one night,It was thee most wonderful place! Had a friendship anniversary staycation here and it was so perfect:) the home was homey and chic. Beds were so comfortable. Laura was the kindest host ! Can’t wait to rent again in the future.
2024-03-01,5.0,Stayed one night,"Great place to stay, quiet neighborhood, all was as advertised, easy access! Charming home!"
2024-03-01,5.0,Stayed with kids,"A very nice house, the decor is very nice, very cozy, the bathroom is very nice and clean, it feels peace throughout the house, I definitely recommend it"
2024-03-01,5.0,Stayed one night,"Laura’s place is great. It’s really well decorated, surprisingly spacious, lovely and clean and has fantastic beds and bedding. It’s really good value for money too. I’ll definitely stay here again if it’s available when I’m back in town."
2024-03-01,5.0,Stayed one night,What a beautiful place! The spot is beautifully decorated and so comfortable.
2024-03-01,5.0,Stayed one night,Such a beautiful home! Laura was very kind and the check in was super easy. The home had everything that we needed and was very comfortable. I would highly recommend staying here!
2024-03-01,5.0,Stayed one night,Very clean property. Bed was comfy. The aesthetic was great and Laura provided many travel necessities! Thank you!
2024-03-01,5.0,Stayed one night,"Laura’s place was lovely, comfortable, and very well decorated. It was the perfect place to stay while we were in town. The parking on premise was a big plus and felt very secure. I’d definitely stay there again."
2024-03-01,5.0,Stayed with a pet,"This was my favorite place I've ever stayed in. so beautiful and clean. she clearly cares for this home and the items inside. I felt immediately at home and relaxed. i loved the shower and carport, my wife loved every detail and front yard, and my son loved his room and the back yard. everything you need is so close so you don't have to drive far out for anything unless it's to go site seeing. I really can't praise it enough. loved it."
2024-03-01,5.0,Stayed one night,Superbly well equipped and charming place. Laura was always responsive and helpful. Very convenient. Would certainly stay again if I am back in El Paso.
2024-03-01,5.0,Stayed one night,Really cool place. Enjoyed my stay very much.
2024-03-01,5.0,Stayed one night,Such a beautifully decorated and cozy home.
2024-03-01,5.0,Stayed one night,"Our second time staying at Laura’s place, definitely our favorite place to book while we stay in El Paso. The parking situation is great, the home is well decorated and has so much character. We appreciate all the thoughtful amenities and quick responses."
2024-03-01,5.0,Stayed one night,"Laura was a wonderful host. Convenient location. She suggested a few eateries and we picked one in walking distance.
The home had great character. We really enjoyed our stay."
2024-03-01,5.0,Stayed one night,Laura’s place was so adorable! We loved staying there for the night! Perfect location right off the highway and we didn’t feel unsafe. The place had the cutest touches! We would definitely stay there again!
2024-03-01,5.0,Stayed about a week,"Wonderful host,
Replys immeditaly
Thank you"
2024-02-01,5.0,Stayed one night,Laura’s place is beautiful decorated and super convenient in terms of getting to/from the airport. Would recommend and would stay again.
2024-02-01,5.0,Stayed with kids,The casita was very clean and a nice place to stay for our night in El Paso. It was pretty close to everything we needed too. Overall I would recommend it. Thanks!
2024-02-01,5.0,Stayed one night,Perfect in every aspect
2024-02-01,5.0,Stayed one night,"Laura’ place is beautifully decorated and very comfortable. The perfect stay close to downtown El Paso.
I really enjoyed the details of this place, and we even tried out the record player. I definitely recommend her spot when visiting El Paso!"
2024-02-01,5.0,Stayed one night,"Laura is a great host, and this is a LOVELY Airbnb. Beautiful art and local touches. Everything is clean and designed for travelers - there were even extra little amenities like an extra toothbrush and some basic oils and spices. There was a little noise in the neighborhood at night from a nearby train. I noticed there were earplugs if needed but we slept fine."
2024-02-01,5.0,Stayed one night,Just as pictured. Great little house.
2024-02-01,5.0,Stayed one night,"The cutest Airbnb. Beautifully decorated and furnished. Very clean, comfy bed. 10/10 would recommend and stay again"
2024-02-01,5.0,Stayed a few nights,Our stay was fantastic! Comfortable and clean home. Will definitely return to this cozy casita.
2024-01-01,5.0,Stayed one night,"Everything was perfect for our quick stay, especially on short notice. Thanks Laura!"
2024-01-01,5.0,Stayed with kids,Laura’s place was absolutely beautiful and filled with thoughtful touches that made it feel like home. It was easy to find and a great spot for us to sleep on a long road trip. We will definitely stay again next time we are in El Paso!
2024-01-01,5.0,Stayed one night,"Cozy, affordable and has a great host. Do yourself a favor and stay HERE."
2024-01-01,5.0,Stayed one night,"We were only at this home for one night en route on a driving trip. It is very convenient to I-10 and easy to find, and get into. The house is very comfortable and fully equipped for traveling visitors. Laura is an excellent, communicative and flexible host. We'd be happy to stay here again."
2024-01-01,5.0,Stayed one night,Thank you so much we loved the casita it was cozy and conveniently located! Great decorations and lovely living room/bathroom design.
2024-01-01,5.0,Stayed one night,Such a lovely house! Felt right at home!
2024-01-01,5.0,Stayed a few nights,"The Casita is conveniently located in El Paso with some of the most thoughtful host touches! The space was clean, well appointed, cozy and just as described.
For other sensitive sleepers, these are not at the fault of the host, but are worth a mention. The train traffic was consistent and very audible, trash comes very early and the neighbor animals can be rowdy late and early. There are earplugs and fans if those work for you to block out noise. You would be hard pressed to find a location nearby without these downsides.
If you want a great deal with a very kind host centrally located in El Paso, this is the rental for you! We would stay again!"
2024-01-01,5.0,Stayed one night,Laura was eager to help my daughter and I have a comfortable stay for one quick night. Her place was perfect. There was a sweet coffee and tea bar set up. The beds and linens were comfy. She has everything thought out. I love the plants she had around the Casita. Thank you!
2023-12-01,5.0,Stayed a few nights,My wife and I really enjoyed our stay! Very clean and cozy!
2023-12-01,4.0,Stayed a few nights,The space was beautiful and cozy. The finishes in the kitchen and bathroom were nice as well. And the design held true to El Paso.
2023-11-01,5.0,Stayed with kids,"Excellently located, very cozy, the host takes great care of the details."
2023-11-01,5.0,Stayed about a week,"Laura was a wonderful host. My daughter and I had a delightful stay in this cozy and inviting Casita. The home exudes charm and is well-equipped with all the essential amenities for a weeklong stay. Thank you, Laura, for a lovely experience."
2023-11-01,5.0,Stayed one night,Fantastic host!
2023-11-01,5.0,Stayed one night,"Loved this adorable house. Every time I’m in El Paso, I visit El & J for their Green Chili Chicken Enchiladas! Laura’s house was right across the street.
The decorations were so lovely. Thank you Laura for being a responsive host!!"
2023-11-01,4.0,Stayed a few nights,"Laura's place was super cute. She really put a lot of effort into the details and made the small space very workable. We were 2 couples so it was cozy (sharing a bathroom) but still very comfortable for our short stay. Laura went above and beyond accommodating our requests and letting us have a late check out.
The neighborhood is commercial and busy, (home was super sound proof tho) a bit far from "" downtown"", if that's important to you, but close to the airport which worked great for us. We also enjoyed the ""local flavor"".........."
2023-11-01,5.0,Stayed a few nights,"Best place I've stayed yet!
Describe the space and experience in one word: Comfort.
Truly felt like home. If I am ever in the area I will look this casita up for certain. Casita has a well stocked kitchen and all your basics in the bathroom to wash up, even black towels for make up removal and disposable towelettes. I forgot my toothbrush and the complimentary one was perfect. The beautiful natural lighting in the day was perfect. Decor was fitting for the city and the culture. I truly wouldn't know how to improve this place.
Quiet & safe neighborhood. Having a private parking was very helpful. Really enjoyed ourselves and got some good inspo for home. Host was very attentive and responsive.
Gracias!"
2023-10-01,5.0,Stayed one night,A lovely home - very clean and organized! Would definitely stay here again if I come back to El Paso.
2023-10-01,5.0,Stayed one night,This is a beautifully renovated home with a great central location. I would definitely stay again
2023-10-01,5.0,Stayed one night,Exceeded all my expectations I will definitely stay there again
2023-10-01,5.0,Stayed one night,"We spent one night at Laura's before flying out of El Paso. Her communication was great. The house was easy to find, clean, and comfortable. Note that it is walking distance from a well-regard restaurant, the L&J Cafe. This is a very nice place to stay."
2023-10-01,5.0,Stayed one night,"Had a great stay at the Casita, and while we only stayed one night, we really enjoyed it!"
2023-10-01,5.0,Stayed one night,"Had a wonderful stay at Laura’s en route from El Paso so Big Bend. The home is spacious, beautifully designed with vintage furniture and art, and was a quiet and peaceful place to stay convenient to the airport before a road trip. Would highly recommend!"
2023-10-01,5.0,Stayed one night,Laura’s place was perfect for our 1 night stay. The house was just as pictures showed and we felt right at home. The house is a quick 5 minute drive to downtown El Paso.
2023-10-01,5.0,Stayed one night,"The house is cute and well decorated, and the host provides nice extra touches of hospitality and responds quickly. Recommend!"
2023-10-01,5.0,Stayed a few nights,La Casita was very peaceful and nearby so many local restaurants and downtown. It was very comfortable and makes you feel at home. Highly recommend to anyone visiting El Paso!
2023-10-01,5.0,Stayed one night,"Easy stay, comfortable and nice atmosphere."
2023-10-01,5.0,Stayed one night,"Laura’s place is our perfect El Paso home. The house is cute, cozy, exceptionally clean and well appointed.
We loved the eclectic decor. It is similar to our home in NYC. The beds were very comfy with nice crisp sheets. It was incredibly easy to navigate the location and we liked being able to park our car in the back. The entire place was very clean- VERY.
Nice location for our needs. While we only stayed 1 night, this home is perfect for extended stays.
Laura herself is a fast and friendly communicator.
This is a great place and I highly recommend this lovely home for short or long term stays."
2023-10-01,5.0,Stayed one night,"This was one of my favorite Airbnbs by far. The house is very cozy, well-decorated, and very close to downtown. I highly recommend this place."
2023-09-01,5.0,Stayed with kids,Beautiful place and great communication. Will definitely stay again if we are in El Paso.
2023-09-01,5.0,Stayed one night,"Had a lovely, if brief stay and really liked all the little touches. And all the great towels!
Thanks Laura and we’ll be back again soon."
2023-09-01,5.0,Stayed a few nights,"This casita is excellent. Located in the Five Points, and easily accessible to local restaurants, downtown and more.
This is my go-to stay in El Paso!"
2023-09-01,5.0,Stayed one night,Good as laa time
2023-08-01,5.0,Stayed one night,"We loved this adorable casita! It was so cozy and lovely, we felt right at home. Definitely recommend! Will be coming back!"
2023-08-01,5.0,Stayed one night,"My college-age daughter and I stayed there and loved it. Laura’s place is very cute, we’ll decorated, comfortable, and thoughtful. We stayed only one night but I’d be happy to stay a week. We really enjoyed our (short) time in El Paso!"
2023-08-01,5.0,Stayed one night,Laura is very good with communicating 10/10 House is beautiful.
2023-08-01,5.0,Stayed one night,Great stay! Very homey and cozy and I'm excited to come back for a longer amount of time. Laura does everything she says she will and then some!
2023-08-01,5.0,Stayed a few nights,"We really liked the cottage, it was clean, tidy and attention to detail and decor. Freshly appreciated water in the fridge, given the temperatures, but also coffee and more. The neighborhood is quiet and safe. Absolutely recommended."
2023-08-01,5.0,Stayed one night,"this house is super cool and cozy, perfect for a peaceful and easy stay. very comfortable and convenient. very clean."
2023-08-01,5.0,Stayed a few nights,"I had an outstanding stay at Laura’s casita. The house is beautiful and cozy, and I felt right at home. The front porch is great for sitting outside in the shade all day long. The neighborhood is friendly with cafes and restaurants within walking distance. L&J cafe is a must go for drinks and dinner!"
2023-08-01,5.0,Stayed one night,Very cute and clean place. was great for a short stay. if I come to El paso again I'll stay here again for sure :)
2023-08-01,5.0,Stayed one night,"Wonderful quick visit during cross country trip. Home is cute, cozy, well appointed and beautifully decorated with lots of nice thoughtful touches."
2023-08-01,5.0,Stayed one night,"Lauras casita was extremely clean, the decor was beautiful, Comfy beds. Will definitely be back!"
2023-08-01,5.0,Stayed one night,"A gorgeous little place, spotless and refined."
2023-08-01,5.0,Stayed one night,"Perfect stay! The house was clean and very pretty, everything we could need was there and the area was very calm and quiet. We truly felt at home. Laura was very kind and communicative."
2023-08-01,5.0,Stayed one night,Beyond expectation. everything is perfect. will definitely come back
2023-07-01,5.0,Stayed one night,I absolutely loved my stay at Laura‘s place. She was very communicative and the house was beautiful and clean. I will definitely stay there again.
2023-07-01,5.0,Stayed one night,second time there and enjoyed it like the first time there. very nice place 👌
2023-07-01,5.0,Stayed one night,"Laura’s casita was a dream to stay in. The beds were soft and yet firm enough to give us a night of sleep that was heavenly. The casita and the decor are darling and it felt homey and safe. The bathroom was perfect and such attention to detail was remarkable, even small black towels for makeup removal. The shower was aaaamazing!! The kitchen was equipped with all the essentials and more! The delicious Coffee and tea was the perfect way to start the day. Even my kitties felt at home. Thank you Laura for understanding the complications of a cross country road trip with pets and going above and beyond to be flexible and gracious! I would recommend your place to everyone and would love to come back again :)"
2023-07-01,5.0,Stayed one night,"nice place, i highly recommend it."
2023-07-01,5.0,Stayed a few nights,"Beautiful, was very calm and relaxing !"
2023-07-01,5.0,Stayed one night,"Best place we’ve stayed in a while! Laura’s place was not only comfortable, but so well decorated and thoughtfully furnished. The beds were super comfy, sheets were so soft, and the bathroom was well stocked and super clean. We only stayed for one night, but will certainly be returning for our next trip to El Paso. Loved having access to a private and covered driveway. Definitely recommend this place to anyone looking for a quiet, cozy place to stay."
2023-07-01,5.0,Stayed one night,"Laura’s place is so cute, comfortable, and just overall lovely to stay at! Laura was so quick to respond, provided wonderful options for dining, and put so many unique touches on this little house to make it feel homely. Highly recommend if you’re in the area!"
2023-07-01,5.0,Stayed one night,"Had all the amenities needed, nice, quiet location, and overall a comfortable cozy home. Made my last day spent with my parents before deployment comfortable :)"
2023-07-01,5.0,Stayed one night,We moved Laura’s casita! Perfect place. We will be back!
2023-07-01,5.0,Stayed with kids,Laura’s space was very cozy and comfortable! She went above and beyond with communicating and flexibility. We highly recommend her place!
2023-07-01,5.0,Stayed one night,Excellent accommodation and Laura is always attentive. We would definitely stay again.
2023-07-01,5.0,Stayed one night,I loved this stay! It was so cute and quiet. I definitely recommend.
2023-07-01,5.0,Stayed one night,Great stay! Very fun and beautiful place. Would highly recommend for those looking for a peaceful and lovely stay.
2023-06-01,5.0,Stayed with kids,So thankful for Lauras !!
2023-06-01,5.0,Stayed with kids,"We came to El Paso for a short stay to have a procedure done for our young son. Laura’s Casita was everything we could have asked for and more. Not only was the decor beautiful and intentional, but there were so many personal touches including toiletries that are often forgotten, coffee, tea and bottled water in the fridge. Despite the extreme heat outside, the casita stayed very cool (we are from the mountains and we’re comfortable!).
The home itself felt incredibly peaceful and really felt like home, making the stress of the nature of our visit much less so.
Laura was also so kind and responsive. We will definitely book here again in the future! Thank you for everything!"
2023-06-01,5.0,Stayed one night,Great little spot !!!! Slept like a baby !!
2023-06-01,5.0,Stayed one night,"Super cute, well decorated, and comfortable house! Had everything we needed. Highly recommended.
Only downside is that the neighbors had their barking dogs out all night, which could be heard in the back bedroom through the walls. Bring your own earplugs or grab a pair that the host provided in the bathroom."
2023-06-01,5.0,Stayed one night,Wow! What a cute and comfortable place. We loved this little casita and wished we could have stayed longer! So many great details—amazing sheets and fabulous shower. Coffee was perfect!
2023-06-01,5.0,Stayed with kids,Beautiful clean place! Love El Paso and wish we could’ve stayed longer to enjoy.
2023-06-01,3.0,Stayed one night,"Gorgeous, clean home with personality beaming through vintage pieces and original framework.
Had a few concerns though—the temp throughout the day and evening was fixed around 80 although I had set it at 72. Laura was quick to respond and offered to send someone out to inspect the AC, which I appreciated.
Was gonna use the chili crisp in the kitchen, but I noticed it expired in 2022 so I did lose confidence in that area of the house."
2023-06-01,5.0,Stayed one night,"Laura’s Casita is a must if staying in El Paso! Great location (near downtown), comfy beds and we loved the decor- made us feel right at home! Only wish we could’ve stayed longer. And do not miss the L&J Cafe nearby."
2023-06-01,5.0,Stayed one night,"Great cozy home had unplanned trip to El Paso. Home is conveniently located, not far from the airport and close to a mall and endless restaurants."
2023-06-01,5.0,Stayed one night,Adorable little house! We only stayed one night but would have loved to stay longer.
2023-06-01,5.0,Stayed one night,"This property is one of the most comfortable I have stayed in. It was clean and tidy, easy to find and it’s in a convenient location. Also, the host was responsive and organised. Next time I come to El Paso, I will look for this property first. Highly recommended."
2023-06-01,5.0,Stayed one night,This was honestly the best air BnB experience me and my sister have had. We enjoyed all the amenities and ambiance. If we are ever traveling back through El Paso this will be the place we book!
2023-06-01,5.0,Stayed a few nights,Cute little house conveniently located
2023-06-01,5.0,Stayed one night,"So jealous of this place! Wish we could stay forever. Decor is truly beautiful, from the vintage furniture to the little details like stamped coffee sleeves, this place is truly special. Well equipped, great location, quiet area, really no negatives here."
