date,rating,note,review_text
2024-06-01,4.0,Stayed with a pet,"This older house was cute, clean, and nicely furnished. It has been ""lightly"" renovated. A few issues: keyed entry isn't ideal for an Airbnb (prefer smart lock); closet smelled like cigarettes; saggy mattress; AC adjustable only between 74 and 78 ( and El Paso is already hot in May). There's a large fenced backyard, large driveway, and single-car garage (garage door is difficult to open and close, which the house description does mention). The neighborhood was fairly quiet, but close enough to the highway for constant hum. Navigating to and from the house to other parts of El Paso is tricky because of its location. Our host was very communicative during booking, but slower to respond after we checked in. However, he was accommodating of our dogs, which was a win! Finally, one tiny picky thing: some of the art was awesome (limited edition prints that looked local), but other art felt bland and random and kinda killed the vibe. Would have loved more local art!"
2024-06-01,5.0,Stayed a few nights,The house is very nice and the surrounding area is beautiful. Check in was quick and easy. Would recommend 100%!
2024-06-01,5.0,Stayed one night,We enjoyed our stay!!! Recommend highly!!
2024-06-01,5.0,Stayed a few nights,"Victor's was great for us! 2 of us were working so we used the bedroom desk and the dining room table. We had no problems with the internet while working.
The neighborhood is safe and quiet (except a few talkative dogs), easy to access I-10 and US-54, and the house is really cute and nicely laid out.
Victor was proactive and communicative ahead of time about entry instructions, which I really appreciated after driving all the way in from Tucson"
2024-05-01,5.0,Stayed a few nights,Would definitely stay again. Beds were very comfortable and had a good nights sleep. Overall very clean. Victors instructions were very clear and easy to follow. Really enjoyed his recommendations on different restaurants. We tried several of them and they were all good and close by.
2024-04-01,5.0,Stayed one night,"Clean place, easy check in, overall great place to stop on our road trip!"
2024-04-01,5.0,Stayed one night,Very nice and comfortable place to stay in El Paso
2024-04-01,4.0,Stayed a few nights,A wonderful quiet and relaxing stay!
2024-04-01,5.0,Stayed a few nights,This was my second time staying at Victor's place. Charming beautiful spot. We had a Uhaul & trailer & appreciated the ample parking. Loved walking out to the back yard to have my morning sunshine & tea. Sound machine & work space are a nice touch. Thanks Victor!
2024-04-01,5.0,Stayed a few nights,"Perfect last minute stay for the weekend. Another booking cancelled at the last minute and it could not have been cuter, more accommodating, and convenient. Victor’s info about the Casa and surrounding area including restaurants and fun things to do was great. The area was safe and we felt comfortable walking around the neighborhood and saw a lot of friendly faces.
We loved it and look forward to staying with hi again in the future."
2024-04-01,5.0,Stayed one night,Another great stay at Victor's place!! A+++
2024-04-01,5.0,Stayed with a pet,"Victor was a great host, the house is exactly as described. Nice and clean, easy to find, had plenty of space for a family. Backyard is completely fenced, was perfect for our dog to go out. Water got hot and stayed hot, clean linens and an added bonus the sound machine in bedroom! We all slept great. Victor has a great handbook and lots of recommendations for food and things to do in the area!"
2024-04-01,5.0,Stayed one night,"Very comfortable and well appointed. Both bedrooms were quite nice. Slept like a baby. Nice kitchen, we had no problem making dinner, although we do travel with our own knives. but all the plates, bowls, glassware etc you could want. Fairly easy to find although big markets aren't right nearby. Easy check in and out. Enjoyed an evening of just vegging out with Netflix on the comfy couch after a long day of driving and really appreciated the great water pressure and abundant towels in the bathroom. The hosts left a sheet of recommendations that would have been great if we'd had more time but still, appreciated the effort."
2024-04-01,5.0,Stayed one night,"I had to go to El Paso for a quick turnaround trip, and only stayed at Victor's place for one night. The home was just as is described, and just what I needed. I felt safe in this area, and although I could have used the garage I just parked in the driveway. The home had all of the amenities, clear instructions, and plenty of recommendations where to eat and even places to visit. There are two bedrooms and a quaint living room, dining area, and separate kitchen. I really liked the décor as it felt homey.
Although the home is near the freeway it's in a neighborhood so you don't hear all the busy street traffic. It also made things easy to get to. There is an Albertsons about 5 minutes away by car, so everything was very convenient. I appreciate that Victor offers this home for visitors like us, and his response time is very quick."
2024-04-01,5.0,Stayed with kids,"Thank you Victor for your attention In our short stay in El Paso.
we really enjoyed your place."
2024-04-01,4.0,Stayed with kids,Good location! El Paso is a smaller city and the house allows for accessibility. The home is spacious and has good offerings. I like the early check in
2024-04-01,5.0,Stayed one night,Great spot! We enjoyed our stay and would definitely stay again!
2024-04-01,5.0,Stayed with a pet,Great place to come with dogs. Very comfy and great water pressure
2024-03-01,5.0,Stayed with a pet,Best Airbnb host in El Paso.
2024-03-01,5.0,Stayed one night,Victor’s place was such a delight! It was very comfortable and conveniently located. My long-time friend and I were returning from a trip to Big Bend National Park and we were very happy to stay at his place. We loved the eclectic decor. The price was amazing— has to be the best deal in El Paso!
2024-03-01,5.0,Stayed one night,"Great place, very clean, very spacious; you can tell that Victor really cares. The location was great, near everything I wanted to do on El Paso."
2024-03-01,5.0,Stayed one night,"Very beautiful house, with beautiful hard wood flooring. Everything mentioned in the description was true. Definitely going to stay here again!"
2024-02-01,5.0,Stayed a few nights,"Victor is an amazing host! He was super responsive and kind. His place was very comforting and well acommodated.
Thank you for everything !"
2024-02-01,5.0,Stayed one night,Another great stay at Victor's place. He is so friendly and responsive. A+++
2024-02-01,5.0,Stayed one night,"a very comfortable place, nice, you can see the effort of being clean...Victor a very good host, very friendly"
2024-02-01,5.0,Stayed a few nights,"Victor’s place is excellent. It was clean, good location, and had all amenities in the listing. Victor is an excellent communicator and very hospitable. I booked his place last minute because a different Airbnb listing i was going to use fell through. I’m very grateful for Victor’s communication and hospitality. Would definitely stay again!"
2024-01-01,5.0,Stayed a few nights,"Once again, we love to stay at Victor's place when visiting El Paso! Love it!!"
2024-01-01,5.0,Stayed with a pet,Great stay! Was the perfect stay for our long cross country trip. Víctor communicated well and we really enjoyed the stay. Highly recommend!
2024-01-01,5.0,Stayed with a pet,Very warm and welcoming space in a great central location. Host was attentive and friendly. Highly recommended.
2024-01-01,5.0,Stayed with a pet,Great host! Had every possible amenity you could need and was extremely understanding and friendly. You won’t regret staying here :)
2023-12-01,5.0,Stayed one night,A good place to stay
2023-12-01,5.0,Stayed a few nights,"The house and host are both amazing!! The stay was very comfortable and the house is nice and cozy. The neighborhood is good as well, 100% would stay here again."
2023-12-01,5.0,Stayed one night,Great place to stay
2023-12-01,5.0,Stayed with a pet,Victor was very helpful and the place was exactly as described.
2023-11-01,5.0,Stayed one night,Loved the house and colorful furnishings. Beds were super comfy and we felt right at home.
2023-11-01,5.0,Stayed with a pet,This is the best Airbnb I’ve stayed in. Provides enough towels for the duration of the stay and provides enough household necessities for your stay. Felt right at home.
2023-11-01,5.0,Stayed with a pet,Great spot for passing through with pets
2023-11-01,5.0,Stayed one night,Thanks for the great stay!
2023-11-01,5.0,Stayed one night,Victor’s place was great! My friend and I felt right at home and the beds were very comfy. I’m particular about cleanliness and the place was definitely clean. Perfect stay for our quick trip.
2023-11-01,5.0,Stayed a few nights,Enjoyed our stay....again! Close to the Scenic Drive which closes to traffic and is open to walkers/runners/cyclists on Sundays - very nice!!
2023-11-01,5.0,Stayed one night,"This was a neat little house. The unique decorating and all of the upgrading that has been done really showed off nicely. I wish we had been staying for more than just one night. The neighborhood was very convenient with a few stores and restaurants within walking distance. It was also just a short drive over to UTEP where my weee daughters attending a concert. As I said, this would be a great place to stay for several nights or a week, especially with the kitchen having practically everything, you would need to cook meals every day. I would definitely re has a nice place to stay."
2023-10-01,5.0,Stayed a few nights,"This home is perfect! Incredibly clean and so peaceful. Victor is amazing. I’m sure he is the best host Airbnb has to offer. Any time I’m in the area, I will be looking to book this home. Can’t say enough good things about staying here!"
2023-10-01,5.0,Stayed one night,Victors rustic refurbished air bnb is a great stay. Highly recommend if your visiting or trying to get away for a bit.
2023-10-01,5.0,Stayed one night,"Wonderful place, comfortable beds, amazing host!"
2023-10-01,5.0,Stayed one night,I wish we had scheduled more days - the house was perfect. I would definitely stay there again!
2023-10-01,5.0,Stayed one night,"In terms of security and peace of mind, I fully recommend coming here. Out of all the bnb's I've stayed in, this is by far the best value for my money that I've ever had."
2023-10-01,5.0,Stayed with kids,"Very cute home. Close to so many restaurants, stores, etc. Included everything you could need for kitchen and bath. The neighborhood was very peaceful. We had a wonderful stay and would definitely choose it again for our next visit to El Paso. Thanks!!!!"
2023-10-01,5.0,Stayed one night,Great place to stop by & relax
2023-10-01,5.0,Stayed a few nights,Clean and lovely home. Everything is as described. Will definitely stay here again.
2023-10-01,5.0,Stayed one night,"Enjoyed my stay at this charming, quiet place in a nice location."
2023-10-01,5.0,Stayed one night,"This is a very cozy spot for resting after a long day on the road. The neighborhood was quiet and it's evident Victor considers every detail for his guests. The furnishings were fun and having extra space for our family of three to spread out, all at a reasonable rate, were very much appreciated. Thanks again Victor!"
2023-09-01,5.0,Stayed with a pet,Perfect little home for a trip to El Paso and Juárez. Great yard for the dogs!
2023-09-01,5.0,Stayed one night,"If I could give Victor’s listing 6 starts, I absolutely would. From the minute my friends and I walked in, we felt right at home. The house was clean, spacious and had such fun and unique decor. The beds were also so comfortable which is a great bonus, it was definitely the best night sleep I had in awhile. Victor was so great about leaving organized instructions and plenty of recommendations for us, plus he was so quick to respond to my questions. Definitely definitely recommend, thanks again Victor!"
2023-09-01,5.0,Stayed one night,Very beautiful home!
2023-09-01,5.0,Stayed a few nights,"This was our 3rd stay and we have not been disappointed ever! It is a very comfortable place that more than meets our needs, I would highly recommend."
2023-09-01,5.0,Stayed one night,"Amazing experience, place was very nice, the theme was adorable and the house was styled beautifully. Victor was Ana amazing host, very communicative and flexible, highly recommend this stay."
2023-09-01,5.0,Stayed over a week,"Victor was so friendly! I felt like I was talking to an old friend. His place was clean, tidy, and felt just like home. As a Nova Scotian I felt like this place was perfect for traveling the first time.
Whenever I had any issues or questions Victor was always eager to help. I loved his positive attitude.
Book with Victor today he’s awesome!!!!!!"
2023-08-01,5.0,Stayed about a week,My partner and I stayed here for a week. We absolutely loved it! We could relax here after a long days hike or bring dinner back from all the great restaurants that were in the area. The place was very clean and felt very homey. We would stay here again!
2023-07-01,5.0,Stayed one night,"Great place to stay, the host was very friendly and responsive, no issues at all."
2023-07-01,5.0,Stayed with kids,"Victor's place was an older house but has been kept in good condition. It felt very private and the neighborhood felt safe. Had a one car garage but we just parked in the driveway. It was very clean and the air conditioning and ceiling fans kept the place at a comfortable temp even in the heat wave while we were there. Victor was a courteous and proactive host. Even on the 4th of July with a few fireworks going off in the neighborhood, the noise was not an issue and we slept soundly. Perfect for our one night stay. Would definitely stay again when passing through El Paso."
2023-06-01,5.0,Stayed with a pet,"This is a very comfortable house. He has water for us and the kitchen was set up nice.
The mattress in the main room was super comfortable.
At the end of the street is a wonderful park to walk your dogs."
2023-05-01,5.0,Stayed over a week,great host and the pictures dont do the house justice. The back yard is amazing for entertaining and pets.
2023-04-01,5.0,Stayed one night,"Great place, perfect for what we needed. Host was very responsive and check in/out was easy as pie! Highly recommend I will definitely stay there again!!"
2023-04-01,5.0,Stayed with a pet,Had a great stay here with our dog. The neighborhood is safe and quiet and the property has a big backyard and many cute cat themed decorations!
2023-04-01,5.0,Stayed one night,What a charming vintage home. Victor was very responsive.
2023-04-01,5.0,Stayed one night,"Amazing place to stay, it’s very comfortable and clean worth every penny"
2023-04-01,5.0,Stayed one night,The Airbnb was clean and spacious. We appreciated Victor's recommendations for restaurants and site-seeing.
2023-04-01,5.0,Stayed about a week,nice place
2023-04-01,5.0,Stayed a few nights,"Super cute little house, quiet area had no issues! Loved it victor was super nice!"
2023-03-01,5.0,Stayed one night,"Just slept there for a few hours.
Bang for your buck🤙🏼🤙🏼🤙🏼🤙🏼"
2023-03-01,5.0,Stayed one night,"It was such a lovely place, it was clean, felt safe. Super enjoyable and the host was quick to respond as well as on top of my needs as a guest. Would love to go back."
2023-03-01,5.0,Stayed about a week,Such a relief to stay somewhere that's 100% comfortable in every way. I'll be staying here anytime work brings me to El Paso!
2023-02-01,5.0,Stayed one night,Victor was friendly and place and location was peaceful!
2023-01-01,5.0,Stayed one night,Very nice and cozy place. We would stay there again.
2023-01-01,5.0,Stayed a few nights,This is my second time staying at Victors place. I love visiting the cat artwork in the dining room and through out the space. Look forward to staying there again the next time I visit.
2023-01-01,5.0,Stayed one night,Good
2023-01-01,5.0,Stayed one night,"Sweet lil’ bnb. Clean, comfortable, well equipped. Victor was helpful, attentive, but not annoying. Would definitely book another stay."
2023-01-01,5.0,Stayed one night,"Great stay! Easy location! Good communication, and great price! Victor was wonderful."
2023-01-01,5.0,Stayed a few nights,Victor’s place was perfect for our needs. We were attending two funerals over the span of four days and the house was a perfect home base. I loved the quiet of the neighborhood; I slept well every night. I would stay there again.
2022-12-01,5.0,Stayed over a week,Victor has a great place that is very close to Ft. Bliss. Extremely convenient and a very accommodating host.
2022-09-01,5.0,Stayed a few nights,Great location- quiet neighborhood- clean and comfy beds
2022-09-01,5.0,Stayed one night,amazing stay! probably my favorite stay that i’ve ever experienced!
2022-08-01,5.0,Stayed one night,"This location is very welcoming. We easily parked two cars in the drive, and felt safe in this neighborhood. Great restaurants were nearby. The rooms are spacious allowing easy movement. There is a fully furnished kitchen. One of our favorite features was the back yard/lawn. It was so pleasant to sit outside in a peaceful surrounding and relax. A garage is also attached to the property. We were very pleased and rested when we left the next morning."
2022-08-01,5.0,Stayed one night,"Bed was comfy, stay went well. Super quiet. No issues. Would stay again."
2022-08-01,5.0,Stayed one night,"Victor’s place was everything needed for a quick stay. The house was very clean. I loved the retro books and overall aesthetic. The beds were very comfortable , especially after being at a concert all evening. (:"
2022-08-01,5.0,Stayed one night,This house was in a calm neighborhood very clean and well decorated. It was a very comfortable stay
2022-08-01,5.0,Stayed with kids,Beautiful home so clean and it has everything you need you really feel like being home it’s a really safe area !
2022-08-01,5.0,Stayed a few nights,We had a great stay at Victor’s! He was extremely helpful when we accidentally locked ourselves out of the house (totally our fault!) and was at the Airbnb in 5 minutes to help us back in. Comfy bed and cozy stay! Thanks!
2022-08-01,5.0,Stayed one night,Great property one of the best places I’ve stayed.
2022-08-01,5.0,Stayed one night,Great decor and very comfortable. Had everything that would be needed and more. Host very good with communicating.
2022-08-01,5.0,Stayed one night,Very clean place.
2022-08-01,5.0,Stayed one night,"We had a great stay, everything was as-advertised and we had no issues with anything at all. Overall, great."
2022-08-01,5.0,Stayed one night,"Lovely stay with good amenities. The garage is a big plus as we were traveling on a road trip. One thing to note is the garage is pretty narrow so while my sedan can comfortably fit, I imagine it could be an issue for larger vehicles. Overall an amazing stay and I would love to stay there again!"
2022-08-01,5.0,Stayed one night,"Cute, quiet home in a lovely neighborhood. We were able to walk somewhere for dinner. Victor left great info on the area that helped us find a place to eat. The house had everything we needed and was cute and comfortable. We’d happily stay again."
2022-08-01,5.0,Stayed one night,great place to stay
2022-08-01,5.0,Stayed one night,Best place we have stayed at thus far. Very welcoming and accommodating and went above and beyond my expectations.
2022-08-01,5.0,Stayed with kids,Victor’s place was great. We would recommend it to anyone!
2022-07-01,4.0,Stayed a few nights,"We found this cozy home to be everything it promised to deliver. Centrally located, safe neighborhood and nicely decorated with comfy beds.
Thank you Victor!"
2022-07-01,5.0,Stayed with kids,"This was our first AirBnb experience and we were so so happy that we landed at Victor’s place. It’s exactly like the pictures, very clean and very homey. He was very responsive and accommodating. My mom, who is very picky, was very happy with her stay and had literally no complaints. She said she was very surprised at how smooth everything went and describes her experience as perfect! One more plus— our 7month old baby slept so so well! Anytime we’re in El Paso, we’ll look for Victor’s place first!"
2022-07-01,5.0,Stayed one night,"Awesome place for a quick stay for our band on tour to California. Only thing to mention are the dogs next door, they bark at all hours of the night but we eventually fell asleep :) Thanks Victor!"
2022-07-01,5.0,Stayed one night,Great host and very responsive
2022-06-01,5.0,Stayed one night,Great stay!
2022-06-01,5.0,Stayed one night,"This is hands down the best place I’ve stayed in El Paso! The price is basically a steal! The home has a very modern touch, and is very artsy! It’s a great place to work on projects and and get the creative energies flowing! Don’t even get me started on the back yard! So much space it’s, and so peaceful! Victor is an incredible host, accommodating, and fully present! Don’t miss out on this one, y’all!"
2022-06-01,5.0,Stayed one night,Good
2022-06-01,5.0,Stayed with kids,"awesome place, just as described and pictured. Victor is a great host was attentive and friendly, would definitely stay here again"
2022-06-01,5.0,Stayed with kids,"Cute, cozy house right in El Paso. Easy access to I10. Right down the street from the famous L&J Cafe. Beds were comfy. Easy check in."
2022-06-01,5.0,Stayed one night,"Victor's house was perfect, only a short drive from the airport."
2022-06-01,5.0,Stayed one night,"Great space, full of quirky and thoughtful touches."
2022-06-01,5.0,Stayed with kids,"A perfect stay! This Airbnb is our home in El Paso each time we pass through - so well kept, well appointed, great energy, has all we need! Our little family loves Victor’s place!"
2022-06-01,5.0,Stayed with kids,"This is our second stay here, the house is comfy and feels like home."
2022-06-01,5.0,Stayed a few nights,Beautiful house located in a quiet nice neighborhood!
2022-06-01,5.0,Stayed a few nights,Victor is an amazing host! We absolutely loved the home and it was located in a great area! The home was very clean and the backyard was a great place to hang out!
2022-06-01,2.0,Stayed with kids,"Mediocre accommodation.
In a quiet area but the neighbor's dogs are very noisy even during the night.
Some downsides regarding cleanliness, accuracy, credibility, and communication."
2022-05-01,4.0,Stayed one night,"This is a cozy old bungalow with a retro vibe. Nicely equipped but again it's historic. Inside climate is controlled by host... quite warm in the summer. Neighbors have dogs.. be prepared for noise. While the house is beautiful and has great amenities, the outside environment may not be child friendly or quiet."
2022-05-01,2.0,Stayed with kids,*review already written from my other stay*
2022-05-01,5.0,Stayed one night,Terrific place. The host put a lot of effort into the guidebook for the local city.
2022-05-01,3.0,Stayed with kids,"We stayed here on two separate occasions a week apart and both times the house and yard did not seem overly clean, such as bbq remnants left in the yard, dog poo and a cork left on the bottle opener. The neighborhood had many dogs that bark a lot, I thought it was thoughtful of the host to provide sound machines but now I understand it’s because of the dogs barking all night. You cannot step in the yard without triggering all the dogs to start barking.
Soon after we arrived at the house the host and workman were doing work on the roof which felt very invasive.
The first time we stayed there was no coffee machine which was very inconvenient as that was listed as included.
The thermostat was locked at 78 and could not be made any lower, but we were all hot, including my baby so that was very frustrating not being able to make it cooler in the house.
Overall not a very pleasant stay, luckily these were just stop overs but if you’re looking for a break from a long drive I’d find somewhere else."
2022-05-01,4.0,Stayed one night,Make sure to carefully read the description and the lowest the AC can be set is 75 degrees and some of the rooms feel even hotter. If you have trouble sleeping at night when it’s hot then don’t stay here! The host is not accommodating with regards to changing the temperature either. Otherwise the place was nice and clean
2022-05-01,5.0,Stayed a few nights,"The place is very clean, spacious and comfortable"
2022-05-01,5.0,Stayed one night,Great place! Loved our stay!
2022-04-01,5.0,Stayed one night,"The house is very nice, well cared for, clean Victor let us know places to eat and enjoy everything to have a pleasant stay. The neighborhood is super quiet. Very comfortable beds. Rest in that home to the fullest after a busy day."
2022-04-01,5.0,Stayed one night,"Victor’s place was great to stay at. He communicated clearly from the beginning, offered prompt instructions and immediate responses and was very cordial. His place was clean, well set up for our stay and well stocked with coffee, tea and kitchen equipment. Highly recommend!"
2022-04-01,5.0,Stayed a few nights,"Great place, great price."
2022-04-01,5.0,Stayed one night,"Great stay, beautiful home."
2022-04-01,5.0,Stayed one night,"Excellent house with all the amenities you need. Really clean throughout, and perfect location for what we needed. Great to have Netflix in the evening and Victor was responsive to all requests. Would definitely stay again !"
