date,rating,note,review_text
2023-12-01,5,Group trip,"Was perfect for my whole family for my daughter’s Basic Training graduation! Comfortable, convenient, clean & a great place to spend the day just relaxing with my soldier! Thank you Karen!!! 😊"
2023-11-01,5,Group trip,Lives our stay! Plenty of room for everyone and close to local shopping. Grocery store very near by to get the necessities for the week. Easy to navigate to Ft Leonard Wood from the house.
2023-11-01,5,Group trip,Lovely home
2023-10-01,5,Group trip,"Enjoyed our stay. Beds were comfy, felt right at home."
2023-10-01,5,Group trip,"this was just as described, fit everyone that was in town for graduation. easy to check in and out. we enjoyed our stay."
2023-10-01,5,Stayed a few nights,We had a great time visiting family. The house was five minutes from them. The deck was great place to just relax.
2023-10-01,5,Group trip,"The Revelation Airbnb was an excellent option for our family stay to attend a FLW military graduation. The home is in a very nice & quiet neighborhood. The balcony to the backyard has a beautiful view and the trees offer privacy from other backyards. Kitchen has all the essentials needed to prepare a home cooked meal for guests, there is also an outdoor grill; the wine cooler and crockpot were great! Rooms are spacious and clean! I loved the master bed&bath! The board games were a great way to enjoy time together without leaving the house and spending money for entertainment. The host was very responsive to inquiries and welcomed our stay. I could go on and on about how great our stay was, but simply put…we felt right at home. We will definitely will use this Airbnb again! Thank you Karen for hosting your home!"
2023-10-01,5,Stayed with kids,Amazing spot really quite beautiful houses area. Reminded me of home
2023-10-01,4,Group trip,"Beautiful home and great Hosts!
Home is a little tricky at first to get to, especially in the dark, but after a couple of trips to town and back, there was nothing to it. Friendly neighborhood! Master bed/bath was great, and all guests said theirs beds were very comfortable. Top bunk, though, is really not usable due to the closeness of the ceiling fan. Lacks a couple of TVs in the extra bedrooms and a can opener, lol. The back deck is nice. We would definitely rent here again!! Lots of room for everyone!!"
2023-09-01,5,Group trip,"I had a wonderful time on my trip and staying on this airbnb made it a 100 times better, beautiful place and an amazing area. I will love to go back."
2023-09-01,5,Stayed with kids,"we stayed the weekend for a wedding. it felt like home there, we enjoyed our stay."
2023-09-01,5,Stayed with kids,"We were in the area for our son's graduation from Fort Leonard Wood. Close drive. He seemed to feel right at home on our Family Day with him.
Very Nice Layout. TONS OF SPACE. Loved the added touches of variety of coffees, creamers, and snacks. Games on-site to play. Very quick to respond when need for communication. Very friendly host."
2023-08-01,5,Group trip,"This Airbnb was very nice. Very spacious and layed out nicely. Bedrooms and bathrooms were all spacious and clean. Kitchen was great, nice sized and modern. We cooked a large meal with what amenities they provided. Large refrigerator/freezer with ice maker came in handy. Very large flat screen TV in LR for winding down at night. We did not use the outdoor deck or fire pit as it was 95-100 degrees during our stay. The area is a quiet newer housing development a few miles NW of Waynesville but still a short, easy drive to Fort Leonard Wood. Communication with our host Karen was excellent and she was very accommodating with some changes we had. We look forward to staying here again!"
2023-08-01,4,Stayed a few nights,Karen's place was a great place to stay to visit our son. Plenty of room for him to stay with us so we could spend more time with him. Very clean and comfortable.
2023-08-01,5,Group trip,The house was beautiful and checked all of the boxes for my team! We’ll stay again!
2023-08-01,5,Stayed with kids,I love the house. The back deck was my favorite place to be most of the time. The trees were beautiful and it was so peaceful.
2023-08-01,5,Stayed with kids,"Came into town for graduation at Fort Leonard Wood. The home was perfect for our family. Convenient location to the base, stores, and restaurants."
2023-07-01,5,Stayed with kids,Very clean and pretty place. Host was kind and always quick to respond!
2023-07-01,5,Stayed with kids,Was in town for a family members graduation from Fort Lenwood. It was a little bit away but loved the fact we did this vs a hotel. Our soldier felt comfortable and our family loved it. Would highly recommend
2023-07-01,5,Stayed with kids,My family loved your place! It was comfortable and inviting! There was plenty of space for everyone :) we enjoyed playing a couple of the games. Thank you again!!!
2023-07-01,5,Group trip,Perfect location for my daughters graduation from Fort Leonard Wood. Five bedrooms and three bathrooms was more than enough for my family.
2023-07-01,5,Group trip,overall a great experience
2023-06-01,5,Stayed with kids,"My son was graduating from Basic Training and several of my family members came. The home was perfect for us, spacious, very cozy with scenic views. It felt right at home."
2024-06-01,5,Stayed a few nights,The place was great for my family stay during high school graduation for my daughter
2024-06-01,5,Stayed a few nights,Lisa was very accommodating
2024-01-01,5,Stayed with a pet,Great place! And great location. Lisa was awesome in responding to any of my questions and was truly accommodating! Highly recommend!
2023-12-01,5,Stayed with a pet,The home was a great spot to stop on our road trip for the holidays. It was very clean and smelled amazing!
2023-12-01,5,Stayed with kids,"I would give 10 stars if I could. By far the nicest BNB we've stayed it. Super clean, felt right at home. We were there to watch my son graduate basic training at Fort Leonard Wood. It was so close to the base and am easy travel. Thank you for opening your home to us! Happy holidays!"
2023-11-01,4,Stayed with kids,Get place and super quite
2023-10-01,5,Stayed with a pet,Lisa is an amazing host! She was very responsive to any question! The house was a wonderful and we had access to the garage! I have marked the house and Lisa for future stays in this area!
2023-10-01,5,Stayed with a pet,Our stay was wonderful we enjoyed it. Yards were great for kids and pets. House is very cute and was exactly as pictured and expected. We want to thank Lisa for her hospitality and would highly recommend.
2023-09-01,5,Stayed with a pet,"This house was conveniently located to FLW and we were here for our son’s graduation from Sapper school. We particularly enjoyed the fact that it had a fenced yard for our dogs. The house was very nice/clean and highly recommend it. Thanks again for allowing us the use of your beautiful home, Lisa."
2023-07-01,5,Stayed with a pet,"The house was clean and cute. The hosts were so thoughtful to include dairy-free creamer for the coffee! The fenced yards were perfect for our dogs. Lots of room for parking so we were able to fit our F250, a 26' moving truck, and our bronco in the driveway. We are very impressed!"
2023-07-01,5,Stayed with a pet,"Lisa was such a great hostess and was extremely helpful. The yard was fantastic for our dog, and the home was beautiful!"
2023-06-01,5,Stayed one night,Great place for our crew’
2023-04-01,5,Stayed with kids,Perfect place to stay for an on post event especially if you have dogs. The huge fenced in surround yard was awesome
2023-04-01,5,Stayed with a pet,"Great stay only slept the night and left in the morning but it was convenient, perfect for a dog and had me wishing I had more time to spend there."
2023-04-01,5,Stayed one night,This is my second stay.. i very much enjoyed it.
2023-04-01,5,Stayed a few nights,Lisa is as an absolutely amazing host! Very friendly and accommodating. The house was so cute and very clean. Don’t miss out on this great Air B&B
2023-04-01,5,Stayed a few nights,Lisa was a wonderful host very kind and generous with the check out times!
2024-06-01,5,Stayed with kids,"We recently stayed at this Airbnb for our son's military graduation at Fort Leonard Wood, Missouri, and our experience was absolutely wonderful. The host was incredibly accommodating and responsive, making the booking process smooth and stress-free.
Location: The location was perfect—just a short drive to Fort Leonard Wood, which made attending the graduation events very convenient. Additionally, the property is situated in a quiet and safe neighborhood, ensuring we had a peaceful stay.
Accommodation: The house was spotless and well-maintained, with all the amenities we could have asked for. The beds were extremely comfortable, and we appreciated the thoughtful touches like extra blankets and pillows. The kitchen was fully equipped, allowing us to prepare meals easily.
Amenities: We particularly enjoyed the spacious living area where our family could gather and relax. The Wi-Fi was fast and reliable, which was important for staying connected with extended family who couldn't make it"
2024-06-01,5,Group trip,"The property was amazing! Aaron was accommodating and responsive! The house is pretty much ad pictured, although pics don't do it justice, it is so much more beautiful in person. The neighbors are friendly too! Would absolutely stay again."
2024-06-01,4,Stayed with kids,"The stay was great, the cabin as just as described. Our stay was awesome! The are was peaceful and we got to see so much wild life the kids loved it. The game room was the kids favorite part."
2024-05-01,5,Stayed with kids,We had great stay! It was a peaceful and beautiful cabin! Host was flexible for early check in and we appreciated it! We had fun with board games! Highly recommend!!
2024-04-01,5,Group trip,"A great location for people traveling for Army base graduations, located only a couple miles away from Fort Leonard Wood. The house accommodated a lot of people comfortably. Perfect for hanging out with your graduate in a private but open area with plenty of room inside as well as outside property if you don’t want to sit inside all day. We loved it!"
2024-04-01,5,Stayed with kids,"We were in town for my son's basic training graduation. Aaron's house gave us all plenty of room to relax with our new soldier. The area this house is located is beautiful and quiet. The rec room in the basement was an excellent area for everyone to relax and have fun. Kitchen has everything a person needs for making a home cook meal. The house is an easy drive roughly 15 minutes from Fort Leonard Wood. Aaron is always responsive for any questions or concerns you may have.
Our daughter graduated basic training 7 months ago and we were in a hotel for family day and graduation. We didn't like the fact that the ten of us couldn't all fit in one room comfortably and enjoy our new soldier's company. This time around we decided to find a nice house to relax in with plenty of room, beds, and bathrooms for us all and this house was the perfect fit.
Thank you again Aaron for the hospitality and the beautiful house."
2024-04-01,5,Stayed with kids,"I visited with my extended family. The place was beautiful, big, and well-equipped. We needed some more towels and warmer blankets. The game room is a big plus for long rainy evenings."
2024-03-01,5,Stayed a few nights,We have stayed in several home away from homes. This space exceeds expectations.
2024-03-01,5,Stayed with kids,"Our family of ten stayed for our second oldest daughter's graduation from basic training. there was plenty of room, towels, dishes, etc. It was a little ways into the trees, but it is very peaceful,private, and only 15 minutes from the main gate! The hosts had a few lights on so that it was easy for us to come in and find our way around. we will definitely stay again if we are ever back in town."
2024-03-01,5,Stayed with kids,"Mr.Aarons Cabin was very beautiful and peaceful . Visited Missouri for the first time and immediately fell in love ! Was looking for a place to stay and bring my son home from Fort Leonard Wood. This cabin felt just like home we had everything we needed. If we didn’t have it Mr.Aaron was a message away! Felt just like home.
my soldier was able to relax and get some much needed rest. This Cabin is so nice and clean and organized. The downstairs game room was our favorite place out of the whole cabin! If you are in Missouri please Give Aaron’s Cabin a stay . You won’t regret it!"
2024-03-01,5,Group trip,This cabin was such an amazing place to stay! Highly recommend!
2024-03-01,5,Stayed with kids,"The place was just as on the picture. We were a family of 13 adults with 2 toddlers and 1 infants that stay at the cabin. But we were 19 in total. My son was graduating from Fort Leonard Wood. Which was just 15 mins away from where we stayed. We had enough space for everyone to be completely comfortable. We bought our own big pot to cook in for the amount of people we had. But they do have a few pots and pans that you can use. We enjoy our time making memories with him there, before he leaves to go to Germany for 3 yrs."
2024-02-01,5,Group trip,"Aaron's place was just what we needed. my family stayed here for my son's graduation from Basic Training. we wanted a place where everyone could stay and he would feel comfortable relaxing during family day and graduation day, and it was exactly that. We utilized the fire pit, the porch and deck and the game room, all were a wonderful way to all be together in the same central location and still have a little change of scenery. It was under 20min to drive to the base, super easy and the kitchen had everything we needed to cook meals during our stay. If you're here for graduation and you're nervous about not staying on base, don't be! Aaron's home is the perfect location."
2024-02-01,5,Stayed over a week,Great place
2024-01-01,5,Stayed with kids,Well executed mountain/cabin getaway perfectly secluded and beautifully put together. From the game room to the kitchen everything was supplied and clean would definitely recommend!!
2024-01-01,5,Stayed with kids,Great cabin that fit our large family perfectly! Aaron is a fantastic hosts and we come to the area a lot and plan to always stay here!
2023-12-01,5,Stayed a few nights,Perfect spot for a quiet getaway! Cabin has the complete cabin feel with all the modern amenities. Highly recommend! Host Arron and Michelle are awesome very friendly and responsive hosts. You will not be disappointed.
2024-06-01,5,Stayed with a pet,Great stay. Clean and close to the town without being in it. Would stay again.
2024-06-01,5,Stayed with kids,"Brooke’s home is beautiful and a great stay for kiddos. My one year year-old was able to play with toys and there wasn’t a lot for her to get into which was great! The house is right off of 44 and provides a 30 minute drive to Rolla. While we did have minor cleaning issues we needed assistance with, Brooke was incredibly gracious and helpful with getting them solved and I would stay here again!"
2024-05-01,5,Group trip,"Beautiful clean and spacious. The host was super communicative when I had questions or concerns. Stocked coffee bar which was a big hit every morning.
We were here for a graduation on base and this place is perfect as it was super close and affordable. 15 min drive and also really close to an Aldi’s and some restaurants"
2024-04-01,5,Stayed a few nights,"Beautiful home! So much space, and had everything we needed for our short stay while visiting family at Fort Leonard Wood. It rained the whole time we were there, so the game closet came in handy. The only down side was that there must have been a family staying downstairs and we could hear the kids, especially since the door is right next to the bedroom, but it didn't affect our comfort level. Thank you!"
2024-04-01,5,Stayed a few nights,Stellar host! Very impressive place to stay.
2024-04-01,5,Stayed with kids,"We stayed at Brooke’s place for a basic training graduation at FLW, and we had a wonderful time! The house is beautiful, squeaky-clean, well stocked with amenities and extra towels and linens, and very family friendly."
2024-04-01,5,Stayed with kids,This is a stunning Airbnb pretty close to the base which was the reason we were in town for! We really enjoyed our time.
2024-04-01,5,Stayed one night,"Wonderfull stay. Comfortable beds, very clean and tidy, and beautiful homey decor. Thank you!"
2024-04-01,5,Stayed a few nights,We loved this space to visit our son who was on base! It was comfy ans very relaxing. Thank you so much. The Murphys
2024-04-01,5,Group trip,"Great location, close to Fort Leonard Wood. Highly recommend for families attending basic training graduation."
2024-03-01,5,Stayed with kids,This place exceed my expectations! It really felt like home. We were in town for a bootcamp graduation from FLW. It was only about 10-15min away. We had enough space that the whole family could relax and spend time with our army graduate. Our soldier really missed having a home cooked meal & the kitchen had everything we needed to complete his request. Besides that the place is beautifully decorated and very CLEAN! Brooke is a very responsive host and truly cares about the quality of your stay! I would most definitely book here again!
2024-03-01,5,Stayed with a pet,"Fantastic host, clean and cozy house. The blankets were super soft."
2024-03-01,5,Stayed with kids,"Fantastic experience, a clean, comfortable, and beautiful house. Brooke was a great host. She was very responsive at any time. I definitely recommend Brooke."
2024-03-01,5,Stayed with a pet,Brooke was a great host. Felt like I never left home. Her house was very clean and very spacious. She was very helpful and responsive. I also liked how her house was kid friendly! Would definitely stay here again in the future. Can’t recommend her enough!
2024-04-01,5,Group trip,"Lauren was very sweet and accommodating. When we had an issue with check in, she made sure we were taken care of. The home was just as described, looked like the pictures, and was in a quiet neighborhood. The beds were comfortable and everything was clean and tidy.
She provided a helpful binder of house rules, local recommendations, and useful information regarding the airbnb including the option of purchasing forgotten essentials like tooth brushes. Between that and the complimentary snacks, coffee, and laundry pods we felt like we were staying at a hotel but with all the convenience of staying in a single family home!
It’s a convenient area, only 5 to 10 minutes from Walmart, 15 minutes from Fort Leonard Wood, and 15 minutes from Uranus Fudge Factory(lol)"
2024-04-01,5,Stayed with kids,We felt relaxed and at home while we stayed here. Our Marine had special liberty and was able to enjoy the down time. The games in the garage were fun to play as a family. It was nice to sit around the kitchen table and visit. Everyone had their own room. We would stay here again if we were in town.
2024-04-01,5,Stayed a few nights,Very happy with the stay it was quiet and relaxing. Everything was super clean and organized.
2024-03-01,5,Stayed with kids,"Great place, wonderful host who communicated everything as needed. We felt right at home for an Army graduation on Fort Leonard Wood. Home was close to base. Private, cozy home. Plenty of sleeping space. Clean and accommodating. Bed was extra comfy also!"
2024-03-01,5,Stayed with kids,"Great place to relax and unwind! Plenty of room for our family of 7. Kids loved all the toys and games! Lots of yard space to play outside.
Super close to the base and everything you'd need!"
2024-03-01,5,Stayed a few nights,"We had a great stay at Lauren's place. Her communication was excellent and it was easy to access the home. It was very clean and tastefully furnished, with just the right amount of furniture. Dining table sat six comfortably which was important for game playing. The coffee bar was very nice and well stocked and there were a few treats and water in the fridge (much appreciated). They beds were comfy and linens were spotless. It was a great place to catch up with family during out quick trip to MO. I also appreciated that there was no big list of chores to do before checking out since we were leaving at 7 to start our 9 hour drive home. All we did was start the dishwasher, turn down the heat, and lock the door on our way out. Very easy!"
2024-03-01,5,Stayed with kids,"Beautiful minimalistic home with plenty of kitchen gadgets, pans etc to make dinning there easy and affordable, comfy beds, great shower pressure, some nice amenities.
Highly recommend this home and host!!!"
2024-03-01,5,Stayed with kids,"It was such an amazing stay! I needed a last minute change to the Air B&B and Lauren was so accommodating.
The price is honestly very affordable, and it had more than enough space for my family.
The place is very very clean, and the beds were super comfortable.
100/10 recommend if you are visiting your loved one at Fort Leonard Wood because the drive is super short to get on base. And especially if you are visiting a soldier who is graduating, its the perfect space for them to feel like they are at a home away from home.
We will definitely be booking again"
2024-02-01,5,Stayed with kids,"Loved the location! It was so quiet and peaceful. The home exactly matched the photos, it was clean, comfortable and definitely a great value. There’s a nice little back yard, great for letting the kids run around and expend some energy. Lauren definitely earned the “super host” title. Everything was great!"
2024-02-01,5,Stayed with kids,"We booked this home as reviews mentioned it was close to the base, and it was. Easy access to highway to Fort Leonard wood, and in a quiet neighborhood. The home was clean and space accomodated our family. Equipped with all the amenities we needed during our stay. Lauren was very responsive and provided clear instructions on the check in/out process for her home. Thank you!"
2024-02-01,5,Group trip,"Super comfortable, and very familiar it was a very nice experience where we also went to see my brother graduating from the Fort Leonard Wood army. The place is impeccable and comfortable, my family and I were very satisfied."
2024-01-01,5,Stayed a few nights,Very nice to stay!
2023-12-01,5,Stayed with kids,The home was very cozy and inviting.
2023-12-01,4,Stayed a few nights,The house was great for us to use as home base as we were visiting a serviceman at the base. Lauren was very responsive and experience was very enjoyable. Would use again.
2023-12-01,5,Stayed with kids,"Really enjoyed our stay. It was a nice comfortable place, had everything we needed."
2023-12-01,5,Group trip,"We had great time and the place was clean. Communication was good, I would recommend."
2023-12-01,5,Stayed with kids,"A wonderful place to stay, cozy, clean and quiet. Everything was perfect."
2023-12-01,5,Group trip,"if you have a family member at Fort Leonard Wood, this is an ideal spot. Even with traffic, it was minutes from the base. The price for having an entire home was worth it. I had a fewquestions, Lauren responded back almost immediately. I'd definitely recommend."
2023-11-01,5,Stayed with a pet,The place was nice and clean. Lauren was a very good host!
2023-11-01,5,Stayed with a pet,"The home was very nice and super clean. My wife loved how well stocked the kitchen was with everything she needed to cook. Our host was very friendly and responsive. it was very easy to check in and out. The bathrooms were super clean, and the shower had very good water pressure. This home was definitely worth what we paid, and we will gladly stay there again if we visit St Robert."
2023-11-01,5,Stayed with a pet,"We loved staying with our 4 dogs! The yard was fantastic, as well as the garage. The only hiccups were that the garage door was broken, and we couldn't find one of the TV remotes! Host was responsive, even though they couldn't correct the issues during the stay. Couldn't ask for anything more! Spacious listing, great value."
2023-10-01,5,Stayed a few nights,"This is a newer home that is all updated. the check in was a breeze, the location was nice and quiet, the direction were spot on, the house has all you image to help make your stay comfrontable, and it was a peaceful place to stay at. I would recommend this place."
2023-10-01,5,Group trip,Appreciated all the kitchen gadgets to make the crew meals! Nice master bedroom/bathroom.
2023-10-01,5,Stayed a few nights,"Beautiful home and in a perfect location to the gate we needed to be by at Fort Leonardwood! If we’re ever in Missouri again, we’re definitely staying at Lauren’s!"
2023-10-01,5,Stayed with kids,"Lauren was a great host, the home was clean and well appointed; especially the kitchen. The location was easy to find and Lauren’s instructions were perfect! Highly recommended!!"
2024-06-01,5,Stayed with kids,This home is exactly what air bnb should be. We had everything we needed and it wasn’t too full of frills/unnecessary decor/clutter. Super clean and exactly as described. Had a great stay!
