date,rating,note,review_text
2024-04-01,5,Stayed a few nights,Very happy with the accommodations! Julie was very easy to speak with and friendly. Would definitely recommend!
2024-03-01,5,Stayed a few nights,"We loooove the home. Everything was clean, just like the pictures. They make us feel like home. Very well located. The next time I come back I will definitely stay here. The host was so attentive to everything we needed and willing to help with whatever we needed. 100% recommended"
2024-03-01,5,Stayed a few nights,"Julie was a phenomenal host. She was incredibly friendly, responsive, and accommodating. The home was immaculate in many ways. It had all the necessary amenities and it was extremely comfortable. I highly recommend staying at this home!! I will definitely be returning in the future."
2024-06-01,5,Stayed with kids,We got into town early and messaged the owner who allowed us to go in earlier. Place was clean and in a quiet neighborhood.
2024-06-01,5,Stayed a few nights,it was a great place to stay for my son's basice training graduation
2024-06-01,5,Group trip,Jayson’s place was perfect for our occasion. Clean neat and organized. Just right for our family to gather after our youngest son’s graduation.
2024-05-01,5,Stayed with kids,This place has everything you need for a home away from home trip. Very clean and spacious. Lots of amenities and an excellent price range! We enjoyed our stay!
2024-04-01,5,Group trip,Overall a great place to stay. The host was very easy to work with and allowed us to check in a little earlier than 3.
2024-04-01,5,Group trip,The place was very nice and spacious. an easy 10 minute to Fort Leonard wood. Appreciated the extra thangs like the large variety of games to use. would stay again
2024-04-01,5,Stayed one night,"Flew in all the way with my family from Hawaii, being a big family & unfamiliar with Missouri it was actually nice to have hosts assist & make us feel so welcomed! Highly recommend! Would def book again! Aloha & thank you"
2024-04-01,5,Stayed a few nights,"The house was homey, clean, comfortable and close to the base. We would definitely stay again."
2024-03-01,5,Stayed with kids,This is our second time staying in this house. We love how easy it is to check in and out and how nice the host is! Super friendly and will respond with any questions or suggestions no matter what.
2024-03-01,5,Group trip,Was a great location to Fort Leonard Wood. It is close to activities and lots of restaurants. The house was very clean and comfortable.
2024-02-01,5,Stayed with kids,"We all enjoyed our stay at the airbnb, great commute to Fort Leonard Wood base, only 10 minutes driving."
2024-02-01,5,Stayed a few nights,Nice place would stay again.
2024-02-01,5,Stayed with kids,"Peaceful, peaceful The host was so Helpful"
2024-02-01,5,Stayed a few nights,Perfect for my son's graduation from Fort Leonard Wood.
2024-02-01,5,Stayed one night,A must stay place. Comfortable beds and a warmth you feel at home
2024-02-01,5,Stayed with kids,"Jayson Places was clean, quiet, and comfortable.￼ It had everything we needed for our quick trip. Jayson was very helpful and responsive on any questions or concerns we had. Great value and stay!"
2024-01-01,5,Stayed a few nights,Jayson was a great host and his home was close to Ft. Leonard base!
2023-12-01,5,Group trip,Jayson’s place was perfect for our overnight stay. Very cozy and quiet!
2023-12-01,5,Stayed a few nights,"Our stay here was perfect. The home and space were exactly as described. We were in town for our soldier’s basic/AIT graduation and this worked perfect for family to gather and spend time with him on family day and after graduation.
Jayson communicated well and we had no issues."
2023-12-01,5,Stayed a few nights,Awesome place! Great location! Was on base within 15 minutes! It made family day amazing for my soldier! It had everything we needed and plenty of room!
2023-12-01,5,Stayed with kids,"We were in town to attend our oldest son's Army Basic Training Graduation. I found Jayson's home perfect for what we needed. The house was clean, it had all the supplies we needed to cook and do laundry. I definitely recommend staying here."
2023-11-01,5,Stayed with kids,It was very welcoming. It was in a great location especially if you’re staying in town for graduation at Fort Leonard wood. My kids and I loved it! It had games which kept my kids entertained. Very nice!
2023-11-01,5,Group trip,"very nice place. Easy to find. plenty of parking. Fans available in room for use. Plenty of dishes for use. Extra blankets available. Only negative, that doesn't effect anything, is multiple carpet stains."
2023-11-01,4,Stayed with kids,We enjoyed the house for our party of 7 while in town for basic training graduation. Plenty of space and great location!
2023-10-01,4,Group trip,"We needed 5 beds and that was perfect! Light colored carpet was really stained everywhere. All upstairs along the walls had a dark line and behind the doors was same way. It was dust buildup that’s been there for a very long time based on the dark color.
This was a very nice place and all the information was great. I can see why he is a super host with the exception of the carpet upstairs. Could be rectified easily with a stiff broom and a vacuum. (And possibly a different cleaning service)
Cheap ceiling fans would be nice in each bedroom for those of us who use them.
I would highly recommend if cleaned better!"
2023-10-01,5,Stayed with kids,Great experience & excellent proximity to Fort Leonard Wood.
2023-10-01,5,Stayed with kids,"We had a great time and it’s not far from the bass at all down the street, everything clean and ready. I’ll recommend this place to anyone. Thank you"
2023-09-01,5,Stayed with kids,The home was very beautiful and spacious. Only minutes away from Ft Leonard Wood main gate. Jayson was very responsive to our needs and accommodated us very well.
2023-09-01,5,Group trip,Loved our stayed! Place was nice and spacious and had very good amenities. Jayson always responded quickly which is super appreciative!
2023-09-01,4,Stayed with kids,Great deal for a nice place for the entire family to stay. Neighborhood was quiet and seemed safe. We met the neighbor of the duplex and he was very nice. We were unaware it was a duplex at the start however even with a dog and child we could not hear the neighbors. Everything we needed was provided in the house. My only wish was that the beds were a little more comfortable and the carpets were a little cleaner. But that’s just a personal thing. Overall very pleased with the stay.
2023-09-01,5,Stayed one night,This is a great location. They host Jayson were attentive to our questions and accommodations were well met.
2023-09-01,5,Stayed with kids,"Jayson was an amazing host! His place was perfect for our intended purposes. Our daughter graduated from BCT at FLW. Only 10 minutes away from the main gates to the base. The home was literally minutes from the exit off of I44. It was easy to find and just ducked off into a nice subdivision. The home was exactly as pictured. It was beautifully furnished, clean, and very welcoming! Wifi was great for my teens. The kitchen had everything needed to cook an entire meal. There were 2.5 bathrooms and 3 spacious bedrooms. The views from the two bedrooms were absolutely breathtaking!
Check in and check out was very easy. I will definitely be requesting his space again when we return to FLW for AIT Graduation.
Thank you, Jayson! Your home and hospitality is appreciated!"
2023-08-01,5,Group trip,"I wanted a place that was comfortable and had a home feel. I was able enjoy time with my son that was graduating from basic training and he requested home made meals, the house was great. We got all of our groceries at a super Walmart less than 10 min down the road. Everything was just right. Thank you for the memories made at your place"
2023-08-01,5,Group trip,Great place for people looking for some extra space while attending family day/graduation at the base. It was exactly what we needed.
2023-08-01,5,Stayed with kids,"Host responded quickly to my question. The place was very clean and had all the amenities you could need, plus a little extra! I would recommend to anyone looking for a spot to stay in the area. Thank you!"
2023-08-01,5,Group trip,We only stayed one night as we were traveling through the area. This was a very comfortable home with plenty of room!
2023-08-01,5,Group trip,We stayed here for a graduation at Fort Leonard Wood. Great location about 10 minutes from base.
2023-08-01,5,Stayed a few nights,It was warm and welcoming from the moment we pulled in the driveway. There was 4 of us and we all enjoyed the house. It’s was very beautiful and had more then expected. We never reached out to Jayson because everything was very clear and well laid out.
2023-08-01,5,Stayed a few nights,My family and I felt as if we were at home. They even had my brand of coffee 🤗. Overall it was the perfect place for what we were there for. Thanks Jayson for your hospitality.
2023-07-01,5,Stayed with kids,What a great place to stay! The house was comfortable with plenty of space and we loved the thoroughness of the host. They left great directions and recommendations and clear directions. It worked perfectly for travel back and forth to post.
2023-07-01,5,Stayed with kids,"Jayson’s house was very clean and spacious. The check instructions were extremely clear. Even had videos to help. Had everything we could need to include ample kitchen necessities, “I forgot” items such as deodorant, toothbrush etc and laundry essentials!"
2023-07-01,5,Stayed with kids,"Very clean, comfortable, and roomy. Close to Fort Leonard Wood and provided a great place to stay and bring our soldier for a good meal and visit on Family Day before his graduation."
2023-07-01,5,Group trip,"This was a perfect place for us. We visited for our son's graduation at Fort Leonard Wood. The location was very convenient and it was very quiet. The place was really spacious for us with 6 people. Everything we needed was provided, and we especially enjoyed the boardgames and little sundry basket, that was a thoughtful touch."
2023-07-01,5,Stayed with kids,Great and clean place to stay!
2023-07-01,5,Group trip,"It was the perfect size for the 6 of us to stay. We were there for our daughters Army graduation, so it was prefect distance and easy drive to the main entrance.
The instructions for our stay were clear and precise.
Overall it was a very pleasant, comfortable stay."
2023-07-01,5,Group trip,The place was very nice and cozy… If you ever just want to get away to clear your mind.. This will be a nice place to rent.. Jayson has ALWAYS communicated with me when I needed him to as well for any questions…I hope they pleased for the way we left it as well…
2023-06-01,5,Stayed one night,B&B was exactly what we needed/expected
2023-06-01,5,Group trip,"We originally came to attend a military basic training graduation. Where do I start? Everything was close by including Walmart and other convenience stores. Our soldier felt comfortable and we all had a nice dinner. We spent the majority of time in the house so we can say by fact that the house felt very homey.
Jayson is very responsive and was even flexible in terms of the check in time. It was without a doubt a 5 star experience."
2023-06-01,5,Stayed one night,this was last minute and happy with the price and availability. reasonable cleaning rates help make the decision.
2023-06-01,5,Group trip,"Very nice place to stay. Plenty of room, plenty of dishes and pans, etc. Beds were comfy, couch was plenty big. I enjoyed the stay. It was a quick drive to the gate of Ft. Leonardwood. I recommend this place to any family coming for a graduation or any reason."
2023-06-01,5,Stayed with kids,Very nice place to stay while visiting my nephew at FLW. Great place for a big family or group. Close to base entrance. Was great to park in the garage! We stayed in and cooked pizza from scratch in the kitchen. Had just about everything we needed minus the ingredients. Jayson was very responsive and helpful. The pack n play worked great for our 1 year old and was awesome it was there so we didn’t have to take ours.
2023-06-01,5,Stayed with kids,Jayson is a great host and I highly recommend his place and we felt right at home. Thanks Jayson!
2023-05-01,5,Group trip,Easy to get to and very accommodating.
2023-05-01,5,Stayed with kids,"This house was a great pick, especially if your in town for the graduation at fort Leonard. It was comfortable, felt like home away from home. It was big enough to fit our family and we enjoyed the stay!
I would suggest bringing a kettle if you aren’t a coffee person like myself. Also the stove smokes a lot so beware. Other than that EVERYTHING WAS GREAT !! I would stay here again if I’m ever In the neighborhood.
Thanks again Jayson!!"
2023-05-01,5,Stayed with kids,"My family and I really enjoyed Jayson’s home. Moving can be stressful as it is, but we felt right at home and comfortable. The home was very spacious and accommodating for my big family. Jayson was very quick to respond any questions I had. Would definitely recommend 10/10!!"
2023-04-01,5,Stayed with kids,We came to Saint Robert's to watch my husband graduation basic training/AIT in Fort Leonardwood. The location was perfect distance to the base. The house was extremely clean and was kid friendly. We felt right at home and very safe. I highly recommend this Jason and his Airbnb.
2023-04-01,5,Stayed with kids,"-First of all, Mr Jayson is very proactive and welcoming. Always available for communications exchanges.
-Secondly the Native beauty of the house, the peaceful and awesome environment that surrounds it. We will not hesitate if we have to go back there again."
2023-04-01,5,Stayed with kids,"Very nice, would stay here again."
2023-04-01,5,Stayed a few nights,"This location was convenient for what we needed. We went to my son's graduation at Ft. Leonard Wood, we had a rental car so it was easy for us to get around. Not much walking distance though. We loved that they had a garage. We loved that the house did not have a lot of ""decor"" on the walls / shelves. It felt clean and not as cluttered. It is a townhome duplex located in what appeared to be an apartment complex or or condos maybe. It was quiet and easy navigate. The overall grounds could use some clean up , but that is not the hosts job. Overall a 5.
Jayson responded quickly to a couple of emails we exchanged prior."
2023-04-01,5,Stayed a few nights,"Very clean, closet full of games was perfect. loved our stay here. would stay again if I am back in the area."
2023-04-01,5,Stayed with kids,This listing is just as described. Worked out great for our family since we were there to visit for sons graduations at fort Leonardwood. Great location close to base. Jayson was more than helpful to answer questions we had and was responsive to our needs.
2023-04-01,5,Group trip,"We stayed one night in the condo. It was nice, clean, and spacious. It had all the amenities we needed. Host sent very clear instructions to ensure easy check in and out process. Will rent again in the future."
2023-03-01,5,Group trip,"My husband and I's family stayed because my husband was graduating from there. We put the place , very comfortable, clean and spacious .
If we go back to Missouri, we'll stay again."
2023-03-01,5,Group trip,"We were visiting from Illinois and we were staying at Jaysons home for 3 days. My youngest son was graduating from Fort Leonard Wood. The house was very beautiful and clean. Jayson communicated very well with me over the app and thankfully we had no issues that would have required us to reach out. All of my family members enjoyed the stay. The location is close to a lot of restaurants , groceries like Walmart and other stores. If we ever have to come back to Missouri, we know where to stay moving forward. Thank you for hosting us."
2023-02-01,5,Stayed with kids,Had a great time at this airbnb. I have three small children and it felt like a home away from home. Lots of space for the kids to roam and not be contained in one small area.
2023-02-01,5,Stayed with kids,"The place was clean and very nice. It looks just like the photos, so very accurate. Their was a ""in case you forgot"" basket with items which we thought was nice. It was fully stocked with all kitchen essentials. Their was also spices, butter, and a waffle maker which my children enjoyed. However the only thing I would recommend is Jason adding a shade or curtain on the window near the front door for privacy. The window is very clear and anyone can look inside."
2023-02-01,5,Group trip,Listing was as advertised. Clean and well kept house. Close to Fort Leonard Wood for our son's graduation. Host suggested the Maramec Spring Park. It was a beautiful place and one of the best things we did on our trip. We would highly recommend the host and the airbnb.
2023-02-01,5,Stayed a few nights,Very cozy and clean! The description of the location was spot on in a very quiet neighborhood. Will definitely stay there again in the future!
2023-02-01,5,Stayed with kids,We drove up for our daughters graduation from Tampa Florida and we were pleasantly surprised with the town house. It was clean and cozy. Everything from the beds and linens were amazing and smelled freshly cleaned. The kitchen had everything we needed to cook a decent meal for our soldier. There was also plenty of menu options to order take out. I would definitely recommend to anyone who needs to visit especially that the Army base is literally a 15 min drive. The area had enough variety as far as things to do but since we were in town for only 3 days could not take full advantage. I love that we could put our vehicle right into the garage and go in from in there. It was freezing and having that remote control for the garage door made a big difference. The unit also has a washer and dryer which for me is heaven. Traveling with two children under 10 and eating in the vehicle let’s just say there were more than one food disaster. Welcoming /instructions binder was a nice tough.😁
2023-01-01,5,Stayed with kids,Awesome host and the home was lovely!
2023-01-01,4,Stayed a few nights,"Jayson's place is a clean, tidy, duplex in a safe neighborhood. It was perfect for our son's family day/graduation from the Army. All the most important items were there for us including a few trial sizes items just in case we forgot something. Comfortable beds, cozy duvets, good pots/pans."
2023-01-01,5,Group trip,"So many added touches...games, books, crayons! Don't look any further, book now!"
2023-01-01,5,Group trip,Loved the stay in this house. Was as describe and Jason answered all my questions and he was very helpful.
2023-01-01,5,Stayed with kids,"The larger bed in the second bedroom was awful but when i mentioned it, he brought a mattress pad over. We ran low on toilet paper, 4 girls in one place for a week uses a lot of paper but as soon as i mentioned it, he came and got us some more. He was very nice about it. Quite place, wonderful puzzles and great base access."
2022-12-01,4,Stayed with kids,Thank you! Was a great stay!
2022-12-01,5,Stayed with kids,"This was one of the absolute best Air bnbs I’ve stayed at! Easy to get to, perfect distance from Base, and clean! Jayson is a great host!"
2022-12-01,5,Group trip,Super clean. conveniently located near the reason for our stay. Quiet neighborhood. Stylish and comfortable!
2022-12-01,5,Stayed with kids,"Great house , I recommend the house is close from army . The house is very clean and close to the store."
2022-11-01,5,Group trip,Jayson was very responsive with all my questions. The house was neat and close to Fort Leonard Wood.
2022-11-01,5,Stayed a few nights,Had a wonderful stay at Jayson’s place. Clean and comfortable. Super friendly and responsive host.
2022-11-01,5,Stayed a few nights,If your looking for a great place to stay close to Fort Leonard Wood this is the place. Close and easy to get to base. The perfect place to enjoy a relaxing family day with your soldiers.
2022-11-01,5,Stayed a few nights,"The stay was great . Good location if you’re visiting Fort Leonard Wood . The home was stocked with everything you might need during your stay, and even a basket of things you might have forgot, like toothbrush and deodorant . Really felt like it went above and beyond . Jayson was pleasant and communicative . My family and I truly enjoyed our stay, I would definitely recommend ."
2022-10-01,5,Stayed a few nights,"Stunning view, great location really close to Fort Leonard Wood base. Great responsiveness of the host, Jayson, to questions and issues that popped up. We would stay here again if we were in the area."
2022-10-01,5,Stayed a few nights,"Everything was very clean and comfortable, we spent 3 days very comfortable to be able to attend our son's graduation in Ford Leonard Wood."
2022-10-01,5,Stayed a few nights,All was great and and location was perfect
2022-10-01,5,Stayed with kids,Everything about the house is excellent. Easily accessible from the expressway. The host was also responsive and on time for extra help.
2022-09-01,5,Stayed one night,Great home. Nice neighborhood. Easy access the highway. Clean. Easy communication with host.
2022-09-01,4,Group trip,"Great location for visiting especially when visiting those at Fort Leonard Wood. We loved that there were 3 bedrooms with separate beds. They had pamphlets of things to do locally and within driving distance, restaurant menus and a binder with all the details regarding the rental as well as qr codes for easy access to wifi and their lists. They also had a did you forget basket which was a nice touch!"
2024-06-01,5,Stayed with kids,Very comfortable staying here. One exit away from Fort Leonard Wood. Host was responsive to my requests to extend (due to my wife being under the weather) which was greatly appreciated. Would definitely stay here if we visit MO again.
2024-04-01,5,Stayed with kids,"Great place to stay. My family lived it, close to Ft. Leonard Wood. Overall great experience."
2024-03-01,5,Group trip,was a really nice stay
2024-03-01,5,Group trip,Great place to stay!!!
2024-02-01,4,Stayed with kids,"It’s a great place located close to fort Leonard wood. Grocery shopping close. Uranus fudge factory close. Dominos close. Does not have a washer and dryer. Be sure to pack enough clothing for duration of stay. We ran out of fresh towels the first day. They provided extra towels the following day per request. Does not accommodate a baby. We had to sleep baby on the bed or on the floor. There is a big garage but it’s locked and not accessible. Outdoor trash cans went missing halfway during our stay and we ended up placing our closed bags of garbage outside by garage door and we were paranoid doing so because we weren’t sure what to do with the collecting garbage. We appreciated the convenience of a vacuum. We asked for an indoor broom which was provided the following day, so we could clean up after ourselves. Parking is at a decline and very close to the street. We wished we could have parked in garage."
2023-12-01,5,Stayed a few nights,the house was nice. very easy to Access. very roomy. close to FLW.and lots of places to eat . fun things are the house to do.. we definitely will stay there again when we visit Missouri. And would definitely recommend the property for others to stay.
2023-11-01,5,Stayed with a pet,"Nice place. Pets welcomed. It was the perfect halfwayway point to break up our 14 hour drive back going home. Ordered food, relaxed and slept well. Responsive host."
2023-09-01,5,Stayed with kids,Perfect for families visiting soldiers at Fort Leonard wood.
2023-08-01,5,Stayed with kids,Thank you very good house
2024-04-01,5,Stayed with kids,"This place was very nice and had extras things such as board games, tooth bushes and etc."
2024-04-01,5,Stayed a few nights,"Revelation house was the perfect place to stay when my SIT graduated from boot camp at Fort Leonard Wood. Wonderful, clean, and spacious home, very welcoming, with everything needed to arrive, unpack and enjoy your stay. Wonderful kitchen with enough staples to prepare meals. Overall an excellent value and I highly recommend."
2024-04-01,5,Stayed about a week,"Our stay, here was very comfortable, spacious, safe and very clean. Karen was quickly responsive for any questions we had. This was the perfect place for our family to meet the newest addition to our family coming from four different states. If we are ever looking for another rental in this area, I would not consider anything but Karen’s."
2024-03-01,5,Group trip,"The place was nice and spacious bed was very comfortable, quiet neighborhood. Everyone enjoyed the time there. Thank you"
2024-02-01,5,Group trip,"I definitely would recommend this spot.
It was clean, stocked with the amenities Karen listed. There are streaming options for TV viewing, board games and a gorgeous view from the back porch. The downstairs queen mattress was more of a “futon” type mattress and a bit one the uncomfortable side. But it worked for the amount of time we were there. This was perfect for the few days we stayed."
2024-01-01,5,Group trip,A quiet beautiful place that’s close enough to fort Leonard woods to celebrate our little soldier graduating basic training. The landscape is beautiful and sets a different peaceful vibe compared to life in Miami.
2023-12-01,5,Group trip,"Thank you so much for the wonderful accommodations as our family celebrated a graduation at Fort Leonard Wood! Your place was perfect, everyone slept well in your comfy beds, the little details were all covered! thank you! Access to the base through the Waynesville check point was super quick - for guests who are looking to access Fort Leonard Wood - great place to stay!"
