date,rating,note,review_text
2024-06-01,5,Stayed with kids,it was what we needed ...only complaint was the tub in master wasn't working and we drove for 12 hrs and a hot bath in a tub I could relax in would have been great
2024-06-01,5,Stayed a few nights,"Thanks, we had wonderful stay"
2024-05-01,4,Group trip,Good place to go with a big group if you have a solider graduating.
2024-04-01,5,Stayed with kids,Nice house that is clean and comfortable. Would stay again. Host is very responsive and a pleasure to work with.
2024-03-01,5,Stayed with kids,"House was clean, neat and convenient. We couldn't get the microwave to work but that didn't take away from enjoying the home."
2024-03-01,5,Stayed with kids,"Attended a graduation at Fort Leonard Wood. This home is PERFECT! We had a large group, 9 adults and 1 infant staying at the home. Never did we feel crowded. The home was very clean and spacious. Very close to Fort Leonard Wood, shops and restaurants. Beautiful neighborhood and friendly neighbors (while we sat on the front porch some waved as they passed). Shawn was extremely quick with responding to any questions or concerns I had. Perfect ""home base"" for anyone attending a graduation at Fort Leonard Wood. Our soldier was able to spend a few days with us and he really loved the home as well. We had multiple vehicles and we were able to utilize the garage, this was extremely helpful and appreciated. Mahalo Shawn for being such an amazing host. If weʻre ever in the area again, I will definitely see if this home is available."
2024-02-01,5,Group trip,"For this trip to my son's BCT Graduation, Shawn was very accommodating. My son had the date wrong and Shawn changed my stay date with no hesitation. As soon as we walked this home smelled so clean and inviting. It's very spacious and beautiful, the pictures does it know justice. Very close to FLW and restaurants. I would definitely recommend anyone to stay here!!!"
2024-02-01,5,Group trip,"PERFECT LOCATION for Fort Leonard Wood. Spacious house with ample room to spread out with multiple living rooms and many beds. Home is exactly as appears in the photos. Close drive to base, food and shopping. Will def make this our home base on any trips to FLW ! Home was perfect !! Highly recommend."
2024-02-01,5,Group trip,I would absolutely stay here again! The number of rooms/beds/full baths exceeded my expectations. Everything was clean and neat. The neighborhood is quiet and well maintained with no security concerns. It really was ‘home way from home’. Thanks for the warm hospitality!
2024-01-01,5,Stayed one night,The place was convenient and large enough to accommodate everyone. Exactly as described.
2024-01-01,5,Group trip,"We stayed at this location because it was near LFW and we were attending a graduation. Great home, nice neighborhood. Perfect for our group of 6. Host was very responsive and helpful."
2023-12-01,5,Group trip,"We were pleasantly surprised at how clean and spacious the house was. The photos do not do it justice. The hosts were incredibly fast at responding to my questions, even during the holidays. My family and I would definitely recommend this beautiful space next time we are in town.
Thank you for a peaceful and welcoming stay!"
2023-12-01,5,Stayed with kids,Thank you Shawn. The place was awesome and I felt right at home. Place was clean and very comfortable. Will definitely visit again if the host would have us.
2023-11-01,5,Group trip,Shawn is a wonderful host who communicates and is more than willing to make sure your comfort is most important. His place was perfect for our crew working in the area and we will be back if ever need to.
2023-11-01,5,Group trip,The house was everything a family could hope for while visiting a soldier at Fort Leonard Wood. We were a family of 7 and there was more than ample room for all of us. I would highly recommend this Airbnb to anyone looking for a family home atmosphere while in St Robert
2023-10-01,5,Stayed with kids,"Really great host very nice home , close to FLW"
2024-06-01,5,Stayed one night,Very clean and friendly host. Higher end memory foam beds made for a great nights sleep. Open concept living room with kitchen was a nice place to relax after a long day of travel and the bathrooms were spotless clean.
2024-06-01,5,Group trip,This was the perfect peaceful place to say while visiting our soldiers for graduation. The place was clean and felt like home to us. We enjoyed coming back with our soldiers to watch movies make a home cooked meal/ grill steaks and enjoy family time . Our soldiers felt at ease here. Getting on and off base was quick and easy since the nearest entrance was free of all the visitor traffic. Katie was accommodating and had the place open for us as we arrived later than expected.
2024-06-01,5,Stayed a few nights,"We loved the surroundings and the country setting .. The place was very clean and the beds were comfortable and we loved the pillows , it was just like sleeping in my own bed at home. It’s also perfect to get out for a morning jog or walk especially if you bring your fur baby ..My daughter was graduating from basic training and it was only about 15- 20 min from base ..I highly recommend this place!"
2024-06-01,5,Stayed a few nights,"Our stay was great, very quiet. maybe a better directions, we went past it. but overall it was great. if we ever come back we would stay again. Thank you"
2024-06-01,5,Stayed with a pet,"Nice place, very clean and comfortable. Great spot for our family and our dog to relax after a long day outside."
2024-06-01,5,Stayed a few nights,"Great place to stay, not very far from Fort Leonard wood."
2024-05-01,5,Stayed with kids,Was easy to find even with being located in an area without the best service. Host was friendly and accommodating also greeted us upon arrival. Place was very well maintained and exceeded our expectations
2024-04-01,5,Stayed with a pet,"We loved this Airbnb and it will now be our go-to for this area. Kind and very helpful hosts, spotless home, and a beautiful setting. You won’t be disappointed!"
2024-04-01,5,Group trip,A beautiful place to stay!
2024-04-01,5,Stayed a few nights,As advertised
2024-04-01,5,Group trip,We were so pleasantly surprised and very impressed with our home away from home! Everything was perfect! Thank you so much for a wonderful place to stay!
2024-04-01,5,Stayed with kids,"I almost forgot I was in a Mobile Home, it is so spacious! Beautiful, calming surroundings; with front and back decks, making it feel as if I were ""stepping into"" the beautiful scenery! The nice Laundry Room is definitely a plus!"
2024-04-01,5,Stayed a few nights,"The drive from Kansas took longer than expected but the drive was beautiful! We were within 20-25 minutes from Ft. Leonard Wood. The area was quiet, peaceful and relaxing. Katie provided a large storage ottoman filled with family games and puzzles for families who enjoy having family game nights. She communicated quickly and friendly. It was exactly what were looking for and within our budget. We had a wonderful weekend with our son before he headed to his permanent duty station. Thank you so much for sharing your lovely home!"
2024-03-01,5,Group trip,"Katie was great at communicating with us the whole time we were there. The location was great and we appreciated the fun games provided. Ft Leonard Wood was close enough, yet we felt like this was a secluded get away."
2024-03-01,5,Stayed with a pet,"We loved staying here! Nice and spacious, and clean! 🤍 Definitely will stay here again when we come back!"
2024-03-01,5,Group trip,The place was very clean. Lots of things we found to be helpful. Would recommend
2024-03-01,5,Stayed with a pet,"This was my first time booking in AirBnB. We are from New York State and have never even crossed a time zone. We came down for my husband's basic training graduation and booked her Airbnb. Walking in, the place was amazing! so neat and clean. the view was breathtaking, and the house was really nice. On our way down, our car started threatening potential troubles, and we were ready to search for a mechanic. Her brother-in-law, I believe, Don greeted us with a kind smile and a big heart and made us feel so welcome, even helping my father check on our car and make sure we got home safe. Through storms, kitchen needs, and directions, they were ready and willing to help any way they could. I couldn't have asked for a better host and her family! Sweet, amazing people ready to help, a cute house, and a gorgeous, relaxing view. Give stars isn't enough to show how much I recommend them! We hit the jackpot for sure!"
2024-03-01,5,Stayed with a pet,"Great place! We booked very last minute, as we needed a place to sleep and shower after a long day on the road. Katie responded right away and generously hosted us. Highly recommended!"
2024-03-01,5,Stayed a few nights,Nice place. Clean and comfortable. Host was very friendly.
2024-02-01,5,Stayed a few nights,"This had to be one of the homiest places we have stayed at. The little details made it comfortable. The beds had nice heavy and not so heavy bedding. There were both soft and harder pillows. Plenty of towels and linens. Plenty of utensils, plates, and cookware. And comfy recliners to relax in at the end of a busy day. The surroundings are beautiful and peaceful. My family got to enjoy downtime with my son before he shipped out for AIT. Very easy commute to the main gate."
2024-02-01,5,Stayed one night,Super clean and cozy! Felt like home. Would definitely book again (:
2024-02-01,5,Stayed with kids,Love the place will choice this again the best air bnb ever
2024-02-01,5,Stayed with kids,"home was very clean and well maintained. there was towels and basic toiletries available. house was exactly as list. my only complaint is that Maps does not show the house where it actually is, however that is not a problem with the home or Katie, just something to note"
2024-02-01,5,Stayed with kids,Very clean and was exactly as described.
2024-01-01,5,Group trip,"Host was very kind, welcoming and responsive. Home was cozy and VERY clean. Just as described in the narrative as well as in the photos. Had all of the amenities of home! We were there for Army graduation and had plenty of space to gather as a family with our soldier. Perfect space to enjoy time with family!"
2024-01-01,5,Stayed with a pet,"This was our second stay at Katie’s. We loved our stay both times. This is such a cozy, clean, and peaceful place to stay. Katie is a wonderful host. She is always responsive and goes above and beyond to make your stay comfortable."
2024-01-01,5,Stayed with kids,"Katie is an amazing host! The place was super clean, very comfortable, and well equipped. Katie left drinks and candy that my children loved! Watching the sunrise with the birds chirping was peaceful. We will absolutely be booking again with Katie when we come back to visit family."
2023-12-01,5,Stayed with a pet,"We had a short overnight stay here in between traveling. The home was clean, and the king bed in the primary bedroom was comfortable. We were traveling with our dogs so I was looking for a place for them to be able to stretch their legs. This worked out well! The main living area/kitchen is spacious and open so there was plenty of room for us and the dogs. Overall, we had a comfortable stay!"
2023-12-01,5,Stayed with a pet,Nice quiet space. Very clean. Katie was super friendly. Great stay!
2023-12-01,5,Stayed with kids,"Amazing hosts! Katie is amazing and took time out of her day to take us to print something important out.
The property is very clean and the house has everything you can think off. She says she loves to add things based on recommendations which is amazing because that shows that she truly cares about her guests feeling at home with what the house provides."
2023-12-01,5,Stayed with kids,"My nephew was graduating from the army in Fort Lenord Wood, and we were looking for Air B&B. I read one review from Katie's space, and I chose the spot, and I didn't regret it.
What stood out to us was that when we checked in, the ambiance was amazing. There was juice and water in the fridge, fruits were out in a basket and and a welcome note from Kate, I was blown away.
The space was very clean, cozy, and spacious to accommodate my family.
I would recommend anyone who is visiting the Missouri/Richland area. Katie's place is the space, great rural area, peaceful, quiet when the morning sun comes up it gives you tranquility, then you relax in the jacuzzi tub.
I got a chance to meet her and her husband and what great people they are , thank you Katie, I will definitely be back."
2023-11-01,5,Stayed a few nights,"Perfect place to stay if you’re visiting a soldier at Fort Leonard Wood. The place was very clean and Katie was very considerate in stocking us up on coffee and even had drinks in the fridge for us. There wasn’t anything we needed. She thought of everything. It was a pleasure meeting her and her husband. They are very gracious and sweet people. Praying our soldier doesn’t get stationed up there, but if he does we will definitely be contacting Katie!"
2023-11-01,5,Stayed with a pet,"This was our second stay with Katie, we loved our first stay and decided to stop for the night on our way back to IL. We all felt like it was home, it just came naturally to stay here a second time.
Everything about our stay was great, the house was exceptionally clean and comfortable. We got to see a few deer on our way in. This place is so peaceful, it makes you not want to leave. We already know we will stay here in future travels. Our host was great, she left chocolates and a fridge stocked with drinks, everyone in our group talked about how great coffee was.
Katie, thank you for hosting our group! We will be back!"
2023-11-01,5,Stayed with a pet,She was very responsive and the home was cozy and clean. Their property is beautiful especially with the fall colors!
2023-11-01,5,Stayed with a pet,"Katie’s place was just as described. We took an exit that later turned out to be a gravel road and it took us to our peaceful and safe destination. Upon arrival at 1:30am we noticed the house and surrounding area had great lighting. Check in was a breeze with code. The house was very clean. Katie left a sweet note and even had sodas, water bottles and coffee for us. Beds were comfortable and everyone kept commenting on how spacious and cute it was. Living room & master bedroom had fans. The pups enjoyed the large open yard. There is an area for a fire pit, and also an area with a big grill. There is plenty of parking for multiple larger vehicles. Heads-up, if you’re allergic/sensitive to plug-in scent diffusers let Katie know, there is a few throughout the house
Overall we would recommend anyone to stay here, it sleeps 6 comfortably but if you wanted to bring an extra person, you could. Couch is big enough. If we ever need to rest on our way to Texas. We will surely stay here again!"
2023-11-01,5,Stayed with a pet,We had a short but very peaceful stay! We enjoyed the quiet county area! A very pretty area and lovely HOME! We couldn’t have ask for more!! A nice HOT bath and great night sleep!
2023-10-01,5,Stayed with a pet,"What a beautiful cozy place to stay. It was everything we had hoped for. Katie was so help and responsive. She went above and beyond to make us feel welcomed. The home was extremely clean and we felt so comfortable during our stay. We stayed during our son’s graduation. What Katie didn’t know is that we had actually booked with another AirBnB before booking with her. That host called with less than a week’s notice to say that her listing was all wrong. She requested more money and that we cancel our reservations with her. This left me feeling frantic to say the least. After following up with AirBnB customer service, we went back to available listings and found Katie’s location. She made booking with her so easy. She turned what had been a horrible situation into a positive and joyous experience. I’m so grateful for her hospitality and kindness. We were able to celebrate our son’s important moment, without stress or concern about staying somewhere safe."
2023-10-01,5,Stayed one night,"Katie was such a sweetheart. No matter how many times I bothered her 😂 when I walked through the door, the smell of a nice and clean house hit me in the face. Everything was spotless. She even left us sodas, waters and coffee! The bed was nice and comfortable with the most comfortable pillows! The back porch space was so peaceful and relaxing! We stopped and got our own toiletries but when we got there she already had some there! I literally only had to bring myself and food! We loved our stay! I would definitely recommend!!"
2024-06-01,5,Stayed with kids,Perfect for my son’s graduation. It was a close easy drive to the base.
2024-04-01,5,Stayed with kids,"Tashas place was exactly as she described. The house was beautiful, clean, in a nice quiet area, and truly felt like a home away from home.
Tasha is very kind and responds quickly, even took a moment during our stay to send a message and make sure we had all we needed. House rules/instructions were clear and easy making check-out a breeze.
If we are in the area again we will definitely be checking for this place first."
2024-04-01,5,Stayed a few nights,We enjoyed our time here to stay in St. Robert for our visit with family. The location was conveniently located near restaurants and shopping. Very clean unit with 2 spacious bedrooms and 2 bathrooms. Owner was very friendly and had responsive communication. Easy check in and we look forward to staying again!
2024-04-01,3,Stayed a few nights,Spacious and updated.
2024-04-01,5,Stayed a few nights,Perfect location. I was attending my brother’s graduation from basic training. Minutes from the base. Tasha was very responsive and had the best set up I have seen in an Airbnb. I highly recommend.
2024-04-01,4,Stayed a few nights,The place was nice.
2024-03-01,5,Stayed a few nights,"The place was amazing! Super quiet and private, it was very clean and exactly as the photos showed. Tasha was very flexible with my check in and was super responsive! If I ever find myself back in St Robert I would definitely book again with her!"
2024-03-01,5,Stayed a few nights,"The stay was extremely nice, the beds were comfortable. 10 minutes drive to the gates of Fort Leonard wood, great for graduations."
2024-03-01,5,Stayed a few nights,"Easy check in and instructions
Looked just like the photos
Comfortable beds!"
2024-03-01,5,Stayed one night,"Check-in and check-out were easy. Open and spacious floor plan. Host was super friendly and communicated promptly. It’s close to Fort Leonard Wood, perfect for family attending graduation."
2024-06-01,5,Stayed with kids,Great place! Far enough from everything to be peaceful but close enough to the local amenities to not be irritating!
2024-06-01,5,Group trip,"Beautiful big home . Beds were great.
game room was wonderful. Lots of space for our group traveling for a wedding. Enjoyed the big covered deck and seeing all the deer in the neighborhood and back yard.
THANK YOU FOR YOUR SERVICE !!!
HAPPY MEMORIAL DAY !!!"
2024-06-01,5,Stayed with kids,Perfect for large families. This is was a home away from home. Close enough to Ft Leonard Wood base which allowed for our soldier to spend time with family in a great home setting.
2024-06-01,5,Stayed a few nights,"Beautiful house with an amazing host. The house was meticulously cleaned, has a ton of space both upstairs and downstairs, a lot of nice little details and decorations throughout the house and in a nice and quiet neighborhood. Thomas was a great host, proactive and communicative with clear instructions for us. Perfect stay for our family for my nephew's graduation."
2024-05-01,5,Stayed with kids,Beautiful place to relax and hang out with our new American solider on family day!
2024-04-01,5,Group trip,"5 STAR accommodations!
Came for graduation & the pool table was a hit!"
2024-04-01,5,Group trip,It was a great place to stay while we were in town for my son’s military graduation. Highly recommend!
2024-04-01,5,Stayed a few nights,Thomas has a beautiful home and it is very well kept.
2024-04-01,5,Stayed with kids,"Lovely home in a quiet neighborhood. Very clean! Lots to do, including board games, DVDs, fooseball & shoot pool! Our family felt right at home and our soldier enjoyed having a place to relax!
5 stars and would definitely stay here again if we ever find ourselves back at Ft. Leonard Wood!"
2024-04-01,5,Stayed one night,Excellent place to stay. I would highly recommend.
2024-03-01,5,Group trip,It was a beautiful home
2024-03-01,5,Stayed with kids,Beautiful home with everything we needed to enjoy our stay. The host was very friendly and always responsive and we will definitely stay again
2024-03-01,5,Group trip,Our visit to this home was much too short. A perfect fit for our group of friends traveling through!
2024-03-01,5,Group trip,"It was such a a great home to stay to enjoy family day & graduation from Ft. Leonard Wood. Comfortable, spacious & relaxing. And as stated in other reviews, the dining table is wonderful for family conversation & game-time fun."
2024-02-01,5,Stayed a few nights,Very warm and welcoming home. The house had all of the amenities and was stocked with supplies. The house was quiet and peaceful. Would recommend booking this property.
2024-02-01,5,Stayed with kids,This was a great place for me and my family. If there was any problem it was immediately solved. The house was even bigger in person. I would definitely recommend to anyone. Especially people going for the basic training graduation!
2024-02-01,5,Group trip,nice home. place was as described.
2024-01-01,5,Group trip,"We found out two hours before our booking that the rental I had booked months in advance was unavailable. I frantically searched the area and found this home for our stay! Thomas was very responsive and we were able to get into the rental almost immediately from the inquiry!!
This home is immaculate and spacious!! The view is breath taking and you will feel at home infront of a cozy fire!!
It is conveniently close to Fort Leonard Wood nestled into a beautiful neighborhood.
Thank you Thomas for allowing us to stay in your home like it was ours!!"
2024-01-01,5,Group trip,"Wow, this place was awesome! It was beautifully decorated and had everything we needed, plus some. The instructions for the fireplace were perfect, and we enjoyed the warmth on a cold evening. Extremely clean in all areas, plenty of comfortable beds/bathrooms for our group, wonderful book of recommendations in the area, and a nice welcome note from the host. We would love to return sometime and use the grill and sit on the deck to enjoy the nice view. Thanks for providing the best place to meet up with other family members!"
2023-12-01,5,Stayed a few nights,This is an awesome house. Very roomy and comfortable. The pool table and foos ball are great additions for good family fun. It was cold so we couldn’t enjoy the patio and deck but they were very inviting. Would definitely stay here again if we get back to the area.
2023-12-01,4,Stayed with kids,Our family loved this house. It had entertainment and a great gathering place for us to all be together.
2023-12-01,5,Group trip,Walking into this home was more than what I expected. It was very comfortable and big…we felt right at home! Was very clean upon arrival. Love the layout of the home and would definitely stay there again!
2023-12-01,5,Stayed with kids,Wonderful home to spend time with family. Had everything we needed to enjoy our stay inside.
2023-12-01,5,Group trip,The house was fantastic for our family while we visited for my son’s graduation from FLW. Thomas was great to communicate with and we had everything we needed. We used the grill one night for dinner. Very comfortable and would definitely recommend.
2023-11-01,5,Stayed a few nights,Great homey place to stay with family and friends for a holiday visit.
2023-11-01,5,Group trip,Exactly as advertised. Very comfortable. Felt like home away from home.
2023-11-01,5,Stayed with kids,"This was a wonderful house to host our family for our son's Boot Camp graduation. 10 of us stayed in the house and everyone had a bed! It was clean and in a nice neighborhood. There was a playground down the street that was nice to take the younger children to. It was nice enough that we ate meals at the house and just hung out together, playing pool or hanging out around the fire pit. The hosts were very responsive if we had a need or question. Wish I had another reason to go a stay there!"
2023-09-01,5,Stayed with kids,Was great stay! Thank you!
2023-09-01,5,Stayed with kids,If I could give my stay 10 stars I would!! This is the best Airbnb I’ve ever stayed in! My family and I felt like we were home. Everything was first class. They go above and beyond to make sure you have everything you could possibly need while you’re there. I hope we can stay here on out next trip to FLW! Thank y’all so much!
2023-09-01,5,Stayed with kids,It was a great place to stay would definitely rent again.
2023-09-01,5,Group trip,"We enjoyed staying here so much!! It was perfect for our group to spend quality family time with our soldier. The deck was amazing! We grilled, played games, and enjoyed the view!
We would recommend this house to anyone!"
2023-09-01,5,Group trip,"I can't say enough good things about this house.
I rented this home to spend labor day weekend with my son who is currently in MP training at Ft. Leonardwood.
From the time we walked in the door, it felt so warm and inviting. The bed linens smelled amazing.
The neighborhood was quiet.
It was a great place for him to sit back enjoy some steaks on the grill and family game night."
