date,rating,note,review_text
2024-06-01,5,Stayed a few nights,Lovely and highly convenient location. I would return!
2024-06-01,5,Stayed with kids,Jennifers place was excellent. We would stay here again!
2024-06-01,5,Group trip,The house was great - made us feel at home and had easy access to Main Street
2024-06-01,5,Group trip,"Such a great place to stay while in Fredericksburg! Great location, can easily walk to all the restaurants, bars, and shops. Great recommendations on places to eat and connected us with an awesome local driver (Brad). We would book again next time we come back!"
2024-05-01,5,Group trip,We had a great time… the rainy weather didn’t stop us…. Our house was perfect and in a great location right by Main Street…
2024-05-01,5,Stayed one night,Great stay!
2024-04-01,5,Stayed a few nights,"Laurel Haus is a perfect spot for two couples to stay and visit Fredericksburg. Everything about the house is charming, just right, and it is only two blocks from the center of Main Street. I highly recommend it!"
2024-04-01,5,Group trip,Had a girls weekend here and it was perfect for our stay! Walkable to main st! Very clean!
2024-04-01,5,Group trip,The house was cute and clean and walkable to main street. Unfortunately it rained so we were unable to use the firepit but we were excited the house had a firepit for evening wine tasting!!. Would recommend to friends and would definitely stay again!!
2024-04-01,5,Stayed a few nights,The house was super cute and clean! Great walking distance to shops and restaurants. Was a great experience will come back!
2024-04-01,5,Stayed with kids,We came here for the solar eclipse. The house was wonderful!!! Would come back to it again to visit the area.
2024-04-01,5,Group trip,"We had an excellent stay at Laurel Haus—it was absolutely spotless, convenient walking distance to downtown, with a beautifully decorated interior. Backyard was beautiful as well! Was the perfect home base for my group of girls to enjoy the weekend. Is larger than the pictures convey!"
2024-04-01,5,Stayed a few nights,Jennifer’s house was beautiful and perfectly situated. The walk to downtown was quick and in the middle of everything. The home was very comfortable and clean. We highly recommend this property when visiting Fredericksburg or the Texas hill country.
2024-04-01,4,Stayed with kids,We enjoyed our stay at Jennifer’s beautiful home. The management team was quick to respond when we were in need of amenities and location could not have been better!
2024-03-01,5,Group trip,"Perfect Airbnb for Fredericksburg! We loved this house! From the decorations, design, and location, it was absolutely perfect. I’d highly recommend!"
2024-03-01,5,Stayed a few nights,Laurel Haus was a perfect location in Fredericksburg. A short walk to all the restaurants and shops in a very quiet neighborhood. The house was spotless with comfortable sitting areas inside and out. Jennifer definitely exceeded our expectations. You would be very pleased with this location.
2024-03-01,5,Group trip,Awesome place. Sooo convenient to shops and restaurants in town. Plenty big for our family of 4 adults and 2 teens. Highly recommended!
2024-03-01,5,Stayed a few nights,"The house was perfect for our girls trip! So cute, very clean and we loved learning the history of the house.
Jennifer put a lot of work and love into this home. Highly recommend it!"
2024-03-01,5,Group trip,"This house was so quaint and clean! A mixture of farmhouse and minimalist modern. Spacious and comfortable.
Loved that we were able to easily walk into town, to the museum, and several restaurants and shops."
2024-03-01,5,Stayed one night,This was a beautiful property. Jennifer (the host) was extremely proactive and provided great recommendations on restaurants and places to visit in the area. Will definitely go back!
2024-03-01,5,Stayed one night,"Our girls' trip to Fredericksburg was made so much better at Jennifer's place. The ease, the location, and the sweet home was perfect."
2024-03-01,5,Stayed a few nights,A great stay for a few days in Fredericksburg! Easy walk to Main Street and centrally located.
2024-03-01,5,Group trip,"What an adorable home, so clean and had all the essentials for our weekend stay. We highly recommend this home for your next Fredsrickburg stay!"
2024-03-01,5,Group trip,Had a great stay at Laurel Haus. It was an excellent place to stay and the beds were extremely comfortable! We would for sure stay here again!
2024-02-01,5,Stayed one night,This is the best deal in town.
2024-02-01,5,Stayed a few nights,This was a great stay for us. Very comfortable. It’s a short walk to Main St. the downtown area. Enjoyed the backyard including a fire in the fire pit. I highly recommend this location.
2024-02-01,5,Stayed a few nights,The house was exactly as described. Loved being able to walk to all the shops and restaurants.
2024-02-01,5,Group trip,We had a great stay at this adorable house! Walkable to Main St and got many great recommendations. Definitely recommend staying here.
2024-02-01,5,Stayed one night,"Incredible updated home. We loved the private backyard and the decor on the inside. The open kitchen had great natural light. ￼￼
The bedding and pillows were top-notch. The beds were super comfortable.
This host was so accommodating and friendly. We will absolutely come back!"
2024-02-01,5,Stayed a few nights,Had a wonderful time in Fredericksburg and staying at laurel haus. Very cute and quaint house that has been remodeled very well. Overall the house was perfect for our girls trip. Beautiful home!
2024-01-01,5,Group trip,"Went for a girls trip and had a fantastic time. The home was cozy, clean and welcoming. The host was responsive and friendly! Location was a huge plus with being walking distance to Main Street. Overall a wonderful place & we’d absolutely come back."
2024-01-01,5,Group trip,Simply wonderful… the house is beautiful really clean and great attention
2023-12-01,5,Stayed a few nights,Darling house with quick and easy access to Main Street! Would stay again!
2023-12-01,5,Group trip,Lovely village home. functional and beautifully designed - Nicer than the pictures if you can believe it!
2023-12-01,5,Stayed a few nights,"Loved the house , very comfortable for our family of 4 and so close to everything in downtown Fredericksburg. Had everything we needed and more- the outside patio was great, had lots of fun times around the kitchen table playing games and in the main room with our family and friends- all worked out perfectly. The house is very nice!!"
2023-12-01,5,Stayed one night,"Great, accessible location. Very nice home. Beautiful decor. Very clean."
2023-12-01,5,Group trip,"Perfect place to celebrate my birthday. We were able to walk everywhere, and the house was super cute and cozy for all of us!"
2023-11-01,5,Group trip,"The house is absolutely adorable with the bonus of a lovely outdoor space and very private setting. The beds were extremely comfortable and the living space hosted enough space for us all to sit comfortably. I would recommend the laurel haus to anyone. Perfect for a family, group of girlfriends or a few couples that would like to stay and enjoy Fredericksburg!"
2023-11-01,5,Stayed one night,"This house is SOOO cute! and was perfect for our girl get away! walking distance to Main St., and all Jennifer said would be available at the house was indeed true! Highly recommend this house & Jennifer too! Thank you!"
2023-11-01,4,Stayed with kids,"The home was beautiful, clean, and a short walk to main street. Its really a 2 bedroom as the ""3rd Bedroom"" is an open loft right over the living room which made it a bit difficult for us as we used both rooms for adults and put our daughter in the loft. Still, aside from this, I highly recommend the home as its a perfect location for seeing downtown Fredericksburg. Jennifer was also supper friendly and responsive with the booking process."
2023-11-01,5,Stayed with kids,"Absolutely gorgeous, remodeled home in walking distance to downtown Fredericksburg. Perfect setup for 2-3 families or couples!"
2023-11-01,5,Stayed a few nights,We were in Fredericksburg for my daughter's wedding and spent 5 nights here. It was the perfect size for 2 couples. Extremely spacious and decorated beautifully. The location is perfect for walking to Main Street. I hope to stay here again on future visits!
2023-11-01,5,Stayed a few nights,"It was a really cute old house that was redone with modern amenities. The two bedrooms with king size beds made it perfect for our 2 couples. The loft with the 2 beds would have been great if we brought our kids.
We also loved how it was so close to downtown Fredericksburg, making it convenient to get to dinner and shopping."
2023-10-01,5,Stayed one night,Such a sweet place!! It is a great location because you can easily walk to everything on Main St. We did tastings on Main St then walked to dinner at Sage then stopped at a wine bar on the way home... all great recommendations from Jennifer. Perfect place for couples. We will be back!
2023-10-01,5,Stayed a few nights,Nice place and walking distance to Main St.!
2023-10-01,5,Stayed with kids,Great little house! Perfect for families. Close to downtown and was able to walk there easily. Highly recommend!
2023-10-01,5,Stayed a few nights,"Jennifer’s place was a great place to stay. It was very comfortable and clean. She was very responsive to questions, and she provided great recommendations for places to eat and enjoy in Fredericksburg. We would definitely stay again!"
2023-10-01,5,Stayed a few nights,Crisp-Clean-Cozy and Can’t wait to come back!!!
2023-10-01,5,Stayed one night,"This home is super special and was perfect for our girls trip. It is located just a couple of blocks off the main strip.... very walkable and especially close to our evening entertainment at the RockBox Theatre which is an amazing listening venue for music. We really appreciated the restaurant recommendations too. We especially loved the ""story"" behind the house and that there was a family that loved it enough to bring it back to life and let others enjoy it's charm for a fleeting moment in time. We can't wait to come back and stay longer!!"
2023-10-01,5,Stayed a few nights,Great location! Two blocks from Main Street and a close drive to the wineries. This place had everything available and the back yard was a nice place to wind in the evenings.
2023-10-01,5,Stayed one night,"Excellent Location, house was gorgeous."
2023-10-01,5,Group trip,"The house is very nicely set up, well furnished and looks great. In a perfect location for the Main Street, restaurants and wine tasting - would highly recommend staying here!"
2023-09-01,5,Group trip,"It was wonderful! Exactly as describe in the listing, everything was clean, we felt very a safe walking into town and home at the end of the nights. Highly recommend staying here - it was the perfect girls weekend"
2023-09-01,4,Group trip,"We loved staying at Jennifer’s place! It was a fantastic location. My husband and I ended up in the loft twin room which was a little tight for adults however it was a great location, great amenities and we loved the backyard so it was all good over here! thank you so much for the wonderful experience"
2023-09-01,5,Stayed a few nights,House is clean and comfortable. It was close to Main Street for shopping and restaurants.
2023-08-01,5,Stayed a few nights,"The house is off the main road , very easy to get to, with a private driveway so you can park off the street if you desire. Very spacious and comfortable. I've stayed here more than once and it has always been excellent."
2023-08-01,5,Group trip,My friends and I came to town to celebrate my 21st birthday! This location was great to get around town. We LOVED the house and amenities. Such a fun weekend!!!
2023-08-01,5,Stayed with kids,"I will definitely stay here again. The home is charming & beautiful, in a great location, and very clean with a great backyard. I give it 5+ stars!"
2023-08-01,5,Group trip,We really enjoyed our stay!
2023-07-01,5,Group trip,Beautiful house! It was super cute and comfortable. An easy 5 minute walk to Main Street but still very quiet and cozy when we would come back to relax in the middle of the day. Jennifer was a great host quick to answer any questions we had. Would definitely stay here again!!
2023-07-01,5,Stayed one night,"The communication with Jennifer was absolutely “5 “Stars!
The property was remodeled and all of the finishes in the house (kitchen, bathroom and bedrooms) were done perfectly.
The house is in an amazing location to walk to shops, restaurants etc.
The internet connection was super fast, the appliances are all new and in immaculate condition.
If you are visiting Fredericksburg, consider Jennifer and this property!"
2023-07-01,5,Group trip,"This house is very pretty and clean- walking distance to Main Street- nice appliances and all you need in the kitchen-
Will stay there again and would recommend it to friends 🙏😊"
2023-07-01,5,Stayed a few nights,Fantastic stay in an absolutely amazing place.
2023-07-01,5,Stayed a few nights,House provided everything we were looking for. Great location to downtown.
2023-06-01,5,Group trip,"Jennifer's house was in the perfect location for our experience - we walked to most shops and restaurants in town. The house was beautiful to stay in and well equipped for our girls weekend (6 women). The furniture and beds were comfortable, the house was well lit, and super clean and had odds and ends for cooking. They only had enough dinner plates and glasses for 6 - so serious about 6 guests maximum. One full bath is en suite and one is off the dining area. Great air conditioning - super important in the summer heat, especially for those who slept in the loft. We would stay here again - we thought it was very reasonably priced considering the location, convenience, and accomodations.
One call-out: The house address has ""East"" in front of the street name; be sure you plug that into your GPS or you may end up at the same house number on the West side knocking on the wrong home's door. That is not on the homeowner, but it happened to us so it could happen to others."
2023-06-01,5,Stayed one night,"This is a great place to stay in Fredericksburg! It is so close to everything but also very quiet. The accommodations are excellent. Nice amount of space and the mattresses in the bedrooms downstairs were very comfortable. (We did not use the beds upstairs because we only had 3 people). The bedrooms are very roomy and the bathrooms are large and were spotless.
Thank you Jennifer for providing such a nice house.
Ramona"
2023-06-01,5,Group trip,Great location.
2023-06-01,5,Stayed one night,"The home is beautifully decorated, and the beds are so comfortable. I would have loved to have stayed a few extra nights."
2023-06-01,5,Stayed with kids,"Great house in, great location could walk 2 blocks to main to enjoy all that Fredricksburg main street has to offer.
Clean, quiet and comfortable.
Thanks Jennifer!!"
2023-05-01,5,Stayed one night,"A beautiful modern house with all of the amenities you’d need. The house is located just a short two-block walk to Main Street. Everything was very clean, and the house had a light airy feel. The front porch and rear patio were perfectly furnished for sitting outdoors. I would definitely rent again in the future."
2023-05-01,5,Group trip,We came to Fredericksburg for a girls weekend and really enjoyed our stay at Jennifer’s house! The house and the location were perfect.
2023-05-01,5,Stayed with kids,Wonderful location and modern up to date house. Would stay again and would recommend to others. Thanks for the lovely stay!
2023-05-01,5,Stayed a few nights,Beautiful inside and out. Walking distance to many restaurants in Fredericksburg.
2023-05-01,5,Stayed a few nights,Great house in a great location. I would highly recommend
2023-05-01,5,Stayed one night,Jennifer's place was fantastic. Very clean and well decorated. The short walk to Main St was nice. High recommend.
2023-05-01,5,Group trip,"Great place, very close to Main Street.
Loved it! ❤️"
2023-05-01,5,Stayed a few nights,Perfect for 2 couples. Indoor and outdoor spaces conducive to social chatter. Neighborhood felt safe. Close to shops on Main Street. Highly recommend.
2023-04-01,5,Group trip,The house is beautiful and very accessible to Fredericksburg Main Street. We walked to dinner every night but ended up coming back home to enjoy the accommodations. The home is spotless and has everything you could need! We were extremely happy with this booking and will absolutely return next year!
2023-04-01,5,Stayed one night,The location of the house is very convenient to the center of town. The kitchen is well appointment and the entire home is beautifully updated.
2023-04-01,5,Group trip,Beautifully renovated old house within walking distance to all the shops and restaurants in downtown Fredericksburg!! Comfy beds and pillows!!! Nice area to sit outback and enjoy the fire pit. Perfect for our group of 6 adults.
2023-04-01,5,Group trip,"We loved our stay! This was the most perfect Airbnb. This house is updated and so perfect for a wine trip gathering. We loved the outdoor space, proximity to town, and the house itself is so cute! Jennifer was an amazing host and was super responsive. I definitely would recommend this place to stay for anyone who is planning to visit Fredricksburg."
2023-04-01,4,Stayed a few nights,We all had a great time. Little stuffy in the loft. Had to be careful on the difference levels with stepping down and up. But all in all we had a great time. Peggy
2023-04-01,5,Stayed a few nights,"Wonderful location and house! Couldn’t have been happier! Quick walk to Main Street, clean and well maintained and accurately described. It does get warmer in the living room than the other rooms during the day but the weather was mild enough for it not to be a bother. Thanks for a great stay!"
2023-04-01,5,Stayed a few nights,"A great house in a great location! Perfect spot to walk and explore Fredericksburg Main Street.
The house is beautiful with very comfortable beds and furniture. The kitchen is well equipped.
Lovely mix of the older features of the original house with the modern touches.
Would definitely recommend staying here if you are planning a trip to Fredericksburg."
2023-03-01,5,Group trip,House is beautiful and is very close to all the shops and restaurants. It was bright and had everything we needed. Beds were very ncomfortable too. Loved staying there. Listening to the birds and drinking coffee in the morning was heaven. Jennifer was great!!! Hope to stay there again in the future.
2023-03-01,5,Stayed a few nights,Had a marvelous girls weekend (party of 4) at Laurel House. Perfect location. Easy walk to Main Street.
2023-03-01,5,Stayed a few nights,"Absolutely perfect! Had so much fun. Great location, very clean."
2023-03-01,5,Group trip,Our couple’s getaway weekend to Fredericksburg was made complete by this gorgeous home. Had everything we needed and more. Wish we had stayed longer. Thank you!
2023-03-01,5,Group trip,Absolutely beautiful home. We really enjoyed our stay.
2023-02-01,3,Stayed a few nights,The location was great! The house was nicely decorated. It was clean and well stocked. One negative was the second floor being unsafe because of the low ceilings. There should have been a warning of low ceiling. Another negative was the coffee pot would barely drip. After we called they worked on it and it was better the next day. We would have preferred a Keurig. The owners were responsive and easy to contact. It was an overall good experience.
2023-02-01,4,Stayed a few nights,"This is a super cute house and very convenient for walking to Main Street. There is an issue with the temperature control in the house. The living room and loft do not have adequate airflow and temperature control. There are no hangers in the house and in the 2nd bedroom, there is not a dresser or place to unpack. The coffee maker took a couple of hours to make coffee. We called and let a message, but we didn’t get a reply, even by the 3rd day when we left. Hopefully, they will get some of these issues resolved and then it would be a fantastic place to stay."
2023-02-01,5,Stayed one night,Great place to stay. Very convenient to everything you need and Jennifer was extremely responsive and helpful.
2023-02-01,5,Stayed with kids,"The place was clean and felt spacious! It’s even better in person versus the pics online. It is a quick walk to all the shops and restaurants. The backyard was so quaint and we had a fire and roasted marshmallows one night. It was such a perfect stay! Oh and the beds were super comfy and the bedrooms are all spread out from each other, so you never have to worry about keeping other guests up.
You won’t be disappointed!"
2023-02-01,5,Stayed a few nights,We had a great stay. Close to everything and the home was clean and cozy. We plan to comeback.
2023-01-01,5,Group trip,Great location! Beautiful and cozy!
2023-01-01,5,Group trip,This place has such a great location so close to town. We loved that didn’t have to drive much (besides to the wineries on 290) since downtown was so close. The home had everything we needed and had the most comfortable bed I’ve ever slept in at an Airbnb! Fredericksburg is a great place to spend a weekend. We really enjoyed our stay and would stay here again.
2023-01-01,5,Stayed a few nights,Great and beautiful house. Will definitely be staying here again.
2023-01-01,5,Stayed with kids,Great location in downtown. Easy access to everything. Comfortable home.
2023-01-01,5,Group trip,"Seamless check-in, clean and well organized home, and a great location."
2022-12-01,5,Group trip,"We loved our stay! It was the perfect location (2 easy blocks from Main) and the house was beautiful! Beds were super comfy, showers were great and furnishings were updated and lovely. We will definitely be back and will let our friends know about this find!"
2022-12-01,5,Group trip,"Excellent location - walking distance to everything you could need in Fredericksburg. Newly renovated and beautifully decorated. Great amenities and very clean. Check-in was easy and smooth.
Our only complaint is the difficulty to control temperature in separate areas of the house. However, we did get a fair warning about this in the welcome book, along with tips to make it more comfortable. Overall this did not negatively affect our stay.
Had a great time!"
2022-12-01,5,Stayed a few nights,"Beautiful, cozy house right in the heart of the town"
2022-12-01,5,Stayed a few nights,"Awesome , perfect just as described only better!!! Loved the location and everything was well thought of ."
2022-12-01,5,Stayed a few nights,Great decor and location!
2022-12-01,5,Stayed a few nights,"A great house, this our third time staying at Jennifer’s house. House is up to date, clean and a great location for walking the town."
2022-12-01,5,Stayed with kids,We had a wonderful time in Fredricksburg and loved staying here! It is a charming home with new finishes throughout in an amazing location! It is a very short walk to Main Street shops and restaurants. We'll stay here again!
2022-12-01,5,Stayed a few nights,Exceptionally clean home! Beds were extremely comfortable and everything was spotless. EXCELLENT location only 2 blocks from Main St. We all had a wonderful time. Will definitely book again.
2022-11-01,5,Stayed a few nights,Great location just off Main Street and close to great restaurants. Enjoyed the fire pit in the back yard. Perfect place for 2 couples.
2022-11-01,5,Stayed a few nights,Great location. This house is within short walking distance to the center of Main Street. Very clean and well-appointed with everything you need for a comfortable stay. Beds were super comfortable. It was perfect! We loved it!
2022-11-01,5,Group trip,"The house was fantastic!! Super cute as advertised and very clean. The location couldn’t have been better - just a short 10 minute walk to Main Street. I was very pleased and so were my friends who shared the house with us for the weekend. Also, I messaged Jennifer with a question before our stay and I think she answered me within 3 minutes. We would for sure stay here again!"
2022-10-01,5,Stayed with kids,Amazing home🤩 perfect location so close to everything. The beds were so comfy and all the recommendations were spot on. We’re looking forward to coming back next time we’re in Fredricksburg.
2022-10-01,5,Stayed with kids,"Jennifer’s place was incredible. It was beautiful, clean, and comfortable. She thought of everything! We will definitely stay here the next time we are in Fredericksburg. We walked almost everywhere without any issues."
2022-10-01,5,Stayed a few nights,This is a beautiful home in a great location. It is exactly as advertised with an extremely responsive host. Thank you for the great time. Would stay here again for sure.
2022-10-01,5,Stayed a few nights,Wonderful location!
2022-10-01,5,Stayed a few nights,Jen’s place has everything you could need or want in a home away from home!
2022-10-01,5,Group trip,Place was fantastic!
2022-10-01,5,Group trip,This place was great for what we were looking for! It was just as the pictures showed. It was very well put together! I would definitely stay here again!
2022-09-01,5,Stayed a few nights,Great place. Great location. We enjoyed our stay.
2022-09-01,5,Group trip,"Beautiful home in a great location! The house is very thoughtfully furnished with everything we needed for our stay, and Jennifer was responsive with any questions we had. Would definitely stay here again"
2022-09-01,5,Stayed a few nights,"great amenities, beautifully decorated, very private"
2022-09-01,5,Stayed a few nights,What a wonderful place. Private driveway with space for two cars (easily). We loved our stay and will definitely be back!
