date,rating,note,review_text
2024-06-01,5.0,Stayed about a week,Great place!! Very comfortable and relaxing!
2024-06-01,5.0,Stayed with kids,"We were so blessed by our stay at Mary Kay’s and Joseph’s wonderful home! The warmth and kindness they showed us made us feel like family. Because of them, it was such a special time, and we will always treasure the precious memories we had in the dear town of Oldenburg."
2024-04-01,5.0,Stayed a few nights,Great stay and wonderful host!
2024-04-01,5.0,Stayed one night,Very nice location and easy check in. Would recommend to anyone!
2024-04-01,5.0,Stayed a few nights,"This place is darling! The view overlooking the park and town is lovely, and both Oldenburg and the Air BnB itself are very charming and historic. Mary Kay is a fantastic, welcoming host."
2024-03-01,5.0,Stayed one night,This place was so cute and exactly what I needed! It was a very comfortable and quiet stay with a pretty view over the town. Mary Kay was amazing with communication which made everything go very smooth. I would definitely recommend this place!
2024-03-01,5.0,Stayed one night,"the place was just as described! clean, easy to locate and comfortable! fit exactly what I needed! host was very responsive and on top of it all!"
2024-03-01,5.0,Stayed one night,This was a perfect little place. It was spotless and makes you feel right at home. It was a cozy little spot and a great place to relax and unwind. I would absolutely stay here again!
2024-02-01,5.0,Stayed one night,"As always, we really enjoyed our stay here. It is very cozy and in an area we love to visit. Mary Kay is a wonderful host and is very friendly and accommodating!"
2024-02-01,5.0,Stayed one night,Great place to stay. Perfect size for the price and had all the necessary amenities.
2024-01-01,4.0,Stayed one night,"My sister and I met here for my Godmothers funeral. We don’t often get to see each other as we live 8 hours apart.
It was gray and rainy and this sweet little bungalow was the perfect place to catch up."
2024-01-01,5.0,Stayed one night,We had a great one night stay! The place was exactly as described and was a great value. The host was very communicative. We will definitely be back.
2024-01-01,5.0,Stayed a few nights,This is a perfect place to stay if you are visiting Oldenburg or Batesville. It is a short walk to a couple of restaurants and microbrew. I could not have asked for more or a more attentive host.
2024-01-01,5.0,Stayed one night,Great place for an overnight stay - looked just like the photos and Mary Kay was very communicative and made it easy to check-in and out. Would recommend!
2023-12-01,5.0,Stayed a few nights,Great stay as always!
2023-12-01,5.0,Stayed about a week,"Had a wonderful stay, Mary Kay was a great host, and had a very nice and clean place with a great view of Oldenburg. Would definitely recommend staying here ."
2023-12-01,5.0,Stayed one night,"very nice location at the end of Main street. very walkable. Great view of Oldenburg and the spires. We stayed at Christmas time, and the whole town was beautifully lit, with town maypole Christmas tree just outside our window."
2023-12-01,5.0,Stayed a few nights,Another wonderful weekend! Definitely recommend!
2023-11-01,5.0,Stayed a few nights,Thank you for the perfect place to stay to be close to our family over the holidays! We will definitely come again.
2023-11-01,5.0,Stayed one night,Mary Kay’s place is a perfect place for a weekend getaway. Clean and peaceful and a friendly cat. Loved our stay.
2023-11-01,5.0,Stayed a few nights,"Great spot, nice view, comfy space, friendly cat, awesome host. Every detail accounted for. We'll probably be back!"
2023-11-01,5.0,Stayed one night,Mary was very kind and extremely accommodating. I would definitely stay here again if ever in the area.
2023-10-01,5.0,Stayed a few nights,Great stay. So cozy. So cute. Restful and felt taken care of.
2023-09-01,5.0,Stayed a few nights,"The AirBnb was very cute, quiet and peaceful. It felt very homey, and everything was easy to find. There was a printed list of restaurants nearby and places to explore nearby as well. 10/10, would recommend this AirBnb to anyone planning on going to Oldenburg."
2023-09-01,5.0,Stayed one night,Mary Kay was super friendly and accommodating for us!
2023-09-01,5.0,Stayed one night,"A+ communication. Great deal! Wonderful quaint little place in a quiet neighborhood… very clean and organized! After a long hot day in the sun, Mary Kay’s place was cool and refreshing to walk into. The local recommendations book was very helpful in choosing our breakfast location. As Mary Kay clearly states you must be able to climb steps to access the Airbnb and the sleeping area but is just fine if you’re agile. We would definitely stay again!"
2023-08-01,5.0,Stayed a few nights,"Mary Kay’s place was great! We stayed for a short weekend but enjoyed great food from local restaurants, live music, and a fun day trip to white rock park (only 30 min from Mary Kay’s). This place is a great stay and close to a lot of fun activities!"
2023-08-01,5.0,Stayed a few nights,It was a lovely home with a great view
2023-08-01,5.0,Stayed with a pet,Excellent hosts that responded to questions in a very timely manner. Very friendly and quiet town. Quite relaxing. Would stay again in the future.
2023-08-01,5.0,Stayed one night,Great bnb and scenic town
2023-07-01,5.0,Stayed with a pet,The airbnb was just as described and a great place for our dogs and us to stop on our long drive! We appreciated the little box of goodies of things for our dogs to use during our stay too!
2023-07-01,5.0,Stayed a few nights,Mary Kay's place was just a described. a perfect little house for a visit to Oldenburg. We went for Freudenfest and it was perfectly located. Mary Kay was a great host with friendly neighbors. Would book again.
2023-07-01,5.0,Stayed one night,I enjoyed staying in Mary Kay’s - the cottage was so clean and comfy! The bed was comfortable and the shower warm. It was nice to have a fridge to store my food and she had bottled water and soda too. Mary Kay was always so quick to respond too! I’d love to come again!
2023-07-01,5.0,Stayed with kids,I loved the view over the city. The house was clean and slept the three of us very well. The owners were very nice.
2023-07-01,5.0,Stayed one night,"Mary Kay’s place was so cute and comfortable, it was perfect for our weekend getaway and we loved how close we were to the historic town!"
2023-06-01,5.0,Stayed one night,An awesome place in an amazingly cool little town with a German theme…what could be cooler? Mary Kay and her husband were very kind and even had a shared interest in cars with me…so we ended up chatting about that for quite a while lol. We had a great time walking the downtown…even though everything had just closed for the day. Still very neat aesthetics! The little house was comfy and cute for the size. Just what we needed! Thanks again!
2023-06-01,5.0,Stayed one night,It was a very sweet stay. Too short! And I missed seeing your cat 🐈
2023-06-01,5.0,Stayed a few nights,"I was very happy with the adorable little house I stayed in over the weekend. It was nice to stay in a safe and comfy place that has everything I needed. I slept on the bed downstairs and it was pretty comfy!
Mary was incredibly friendly and helpful and I really enjoyed the ice she gave me."
2023-06-01,5.0,Stayed one night,"MaryKay was the most available host I've had using Airbnb. She also went out of her way to make sure the space was ready for us early, just in case we needed it to be, and she had the A/C going so that it was wonderfully cool when we arrived...a very thoughtful thing to do, since we'd been out in the hot sun all day! She came and introduced herself to use and visited a while, and she just did so many things to make us feel welcome. Staying at her place was lovely...if we find ourselves in Oldenburg again, she's who we'll be hoping to stay with. Thank you so much, MaryKay!"
2023-05-01,5.0,Stayed a few nights,We really enjoyed our stay in Oldenburg. It was a great home base for hiking in the region. We did day hikes in Brookville and Versailles State parks. We also explored Metamora and walked on the canal trail. The space was peaceful and comfortable.
2023-05-01,5.0,Stayed one night,"I loved my stay! And I couldn’t think of a thing to improve.. everything was excellent, cozy, clean and Mary was SO helpful- would love to stay again!"
2023-05-01,5.0,Stayed a few nights,Very attentive host in a beautiful town
2023-05-01,5.0,Stayed one night,Thank you very much for everything
2023-05-01,5.0,Stayed one night,Host was incredibly accommodating and helpful.
2023-05-01,5.0,Stayed one night,"Can very easily tell that Mary Kay cares about how her guests feel. The small house is clean, zero oder and very cozy. Also, Mary Kay is kind and welcoming!"
2023-05-01,5.0,Stayed a few nights,"The selfish side of me wants to tell you that Mary Kay, Joe and even Benny the cat are sub par hosts at best and their listing is not worth a glance, but I’d be flat out lying if I said that solely to keep this hidden gem all to myself. Truth is Mary Kay and Joe are absolutely exceptional, knowledgeable, and cordial hosts. Their place is not only immaculate and well appointed, but ideally located to anything you might want to do in the tristate area. We were welcomed like family by our new found friends and felt right at home from the moment we arrived. The self check in was a breeze and the detailed binder of “things to know” was easy to find and follow. Mary Kay and Joe even went as far as lending us their cat so we wouldn’t miss our cats back home. Hands down ideal lodging and super friendly, amazing hosts and cat that I can’t wait to get back to see again. I highly recommend you see for yourself how incredible this stay and the hots truly are. Safe travels my fellow airbnb’ers"
2023-04-01,5.0,Stayed with kids,"We loved Mary Kay’s place! Super clean, comfortable and cozy. It had everything we needed and was the perfect location for our trip to Oldenburg. It also had a beautiful view. Mary Kay was a great host to work with. I highly recommend!"
2023-03-01,5.0,Stayed one night,"Mary Kay’s home was perfect. Very clear check in and out instructions, and she provided a really welcoming environment!"
2023-03-01,5.0,Stayed a few nights,"I would 10/10 recommend this place! was very clean, a nice quiet space! Not that big, but so perfect! We loved climbing up the loft to a cozy bed there!"
2023-02-01,5.0,Stayed one night,"The inn was clean, well-maintained, with lots of creature comforts. Abundant tv choices, premium services, close to everything, and walkable"
2023-01-01,5.0,Stayed one night,Great stay. Very clean and cool little town
2023-01-01,5.0,Stayed one night,"Mary Kay’s listing was a wonderful little house! My mom, sister, and I give it 5 stars! We were celebrating my mothers 65 th birthday and took her to the Creation Museum! Mary Kay’s home was the perfect location to visit the museum. Oldenburg is a beautiful old town with a great little restaurant called the Brau Haus that served family style chicken dinner and handmade desserts! If you have time, have breakfast at the Big Four in Batesville before you go to the Creation Museum, it was awesome! Mary Kay’s house was clean, well equipped, priced right, and Mary Kay’s communication and suggestions were awesome!"
2022-12-01,5.0,Stayed one night,"My husband and I enjoyed our time here at this gem of a location! We were very pleased with the accommodations, view & quaint town!"
2022-12-01,5.0,Stayed a few nights,Awesome place to stay!
2022-12-01,5.0,Stayed one night,Was a great location looking over the town.
2022-12-01,5.0,Stayed one night,Loved the house! Perfect for 2 people. Comfortable beds and great relaxing space. Mary was easy to communicate with and very accommodating! Description matched the house and looking forward to being back!
2022-12-01,5.0,Stayed a few nights,Very nice place for a quick stay or a long one. The hosts are very accommodating and go above and beyond
2022-11-01,5.0,Stayed about a week,Mary was awesome! Will certainly come back!
2022-11-01,5.0,Stayed about a week,"Very cute place, host was very helpful with any questions I had. Clean and in a safe area"
2022-10-01,5.0,Stayed a few nights,This is a wonderful little house to stay in. It is so comfortable the beds are wonderful and so clean.
2022-10-01,5.0,Stayed a few nights,This beautiful little town is perfect if you need some peace & quiet from the noisiness of a city
2022-09-01,5.0,Stayed a few nights,Wonderful stay! Mary Kay was the best host! The place is in the cutest town too! We loved our stay!
2022-09-01,5.0,Stayed one night,Awesome place in a great town
2022-09-01,5.0,Stayed a few nights,"Convenient check-in, friendly host"
2022-09-01,5.0,Stayed one night,Super cute house with loft sleeping. Great value. Host very communicative and responsive. Highly recommended for anyone in the area.
2022-09-01,4.0,Stayed one night,We had an overnight stay at this quaint cottage. It had everything we need to make our stay comfortable. If you’re in the area we had to recommend a stay at Mary Kay’s properties.
2022-09-01,5.0,Stayed a few nights,Very pleasant and a wonderful view of Oldenburg. Hostess was very accommodating. Will definitely be back next time we are in that area.
2022-08-01,5.0,Stayed a few nights,"Such a cute place, great communication with Host, and really enjoyed the location."
2022-08-01,5.0,Stayed a few nights,Awesome place.
2022-08-01,5.0,Stayed one night,My husband and I stayed at Klein Haus overnight on our way to Pigeon Forge. It was a great comfortable place and we enjoyed eating at Izzy’s in Batesville for an awesome supper. Highly recommend the quaint place and the easy going nice restaurant.
2022-08-01,5.0,Stayed one night,Comfortable little house to stay in and enjoy the views of the town! Mary Kay's place is charming and has thoughtful touches. Don't hesitate to stay here!
2022-07-01,5.0,Stayed a few nights,"Awesome place to getaway!!
Will be back for sure!!"
2022-07-01,5.0,Stayed one night,Mary Kay was extremely kind and communicative from the beginning. She really thought of everything!!! The space was clean and exactly as described and listed. There were plenty of small accommodations as well - like a crock pot. I recommend this space to any other guests - no issues at all!
2022-07-01,5.0,Stayed one night,It’s a small quiet place to stay I would highly recommend if you’re looking at it it’s absolutely adorable
2022-07-01,5.0,Stayed one night,"Such a delightful find on Airbnb! The KleinesHaus was absolutely perfect for my overnight stay in Oldenburg! I was traveling solo and I had the choice of beds; since I loved the idea of sleeping in a loft, I chose to climb the ladder/stairs to a very spacious sleeping area and enjoyed a great night's sleep.
Mary Kay is an awesome host and provided me with great communication for my stay. Although I was only there for one night, every detail had been attended to! I look forward to coming back again!"
2022-07-01,5.0,Stayed one night,Excellent little house with everything you need. Mary Kay was super communicative and helpful!
2022-07-01,5.0,Stayed with kids,This was our first time staying at an Airbnb. Mary Kay was a great host and definitely set the bar high.
2022-07-01,5.0,Stayed about a week,Everything went smooth....good folks.
2022-06-01,5.0,Stayed with kids,Amazing place. Lovely small German town. Absolutely beautiful and awesome view. The owners are absolutely amazing as well.
2022-05-01,5.0,Stayed with kids,Highly recommend staying here. The house was very clean and in a beautiful area. Mary Kay is a great communicator and host!
2022-05-01,5.0,Stayed one night,The stay was amazing. Beautiful little cottage!
2022-04-01,5.0,Stayed a few nights,Great place. Great hosts
2022-04-01,5.0,Stayed one night,Great little stop for a place to stay the night
2022-04-01,5.0,Stayed one night,"This is a very nice space, quiet and convenient in a perfect location. Mary Kay was great with communication and quickly responsive to any needs. This is a real bargain in today’s Airbnb’s world. I’ll definitely stay here again."
2022-04-01,5.0,Stayed one night,Wonderful stay! Would highly recommend to anyone traveling in the area!
2022-04-01,5.0,Stayed a few nights,Great little house with a really thoughtful hosts. Could not ask for anything better.
2022-04-01,5.0,Stayed a few nights,"This place is everything you want in an Airbnb!! The space was so cozy and clean and the location was the perfect small town, with lots of fun things, great restaurants, and beautiful sights!! This was our favorite Airbnb we’ve ever stayed at, and we would love to stay here again. Mary Kay was a warm and welcoming host- it was overall a fabulous experience. If you stay here, you will not regret it!! :)"
2022-04-01,5.0,Stayed with kids,You won't be disappointed
2022-03-01,5.0,Stayed with kids,This was an adorable little house. Mary Kay was very kind and accommodating and went out of her way to meet all of our needs. Everything was clean and the house was exactly as described. We would stay again if we were in the area!
2022-03-01,5.0,Stayed one night,Great place!!! Very clean!
2022-03-01,5.0,Stayed one night,A clean and comfortable place to stay with a beautiful view . The short walk to the very interesting town of Oldenburg starts from your front door.
2022-03-01,5.0,Stayed about a week,"The communication with the host was excellent, very responsive. My stay at KleinesHaus was very enjoyable, house was very clean. I was in the area for work and if I return again, I am definitely seeking out the KleinesHaus for my stay. I highly recommend others to stay there as well."
2022-03-01,5.0,Stayed a few nights,Cozy little place perfect for 1 or 2 people and the host really goes above and beyond. Couldn't ask for better
2022-02-01,5.0,Stayed about a week,"A great tinny Haus overlooking, and with a short walk into, the town of Oldenburg! The host provides a great packet to inform you of things to do and places to eat in town and in Batesville. The host is incredibly responsive, helpful, and flexible!"
2022-02-01,5.0,Stayed one night,piece and quiet
2022-02-01,5.0,Stayed one night,Super cute place! Perfect for a quiet night in.
2022-02-01,5.0,Stayed one night,"Mary Kay was very proactive communicating all the information I needed for a stress-free stay. The rental exceeded all my expectations in terms of convenience, cleanliness, functionality and comfort. Wonderful host and fantastic accommodations!"
2022-02-01,5.0,Stayed a few nights,Great location. Nice place. Will stay again if I’m in the area.
2024-06-01,5.0,Stayed with a pet,We enjoyed staying at Kelly’s place. It was clean and beautifully decorated. Furbabies enjoyed the backyard very much.
2024-06-01,5.0,Stayed with a pet,We had a lovely stay at Poppy House celebrating our anniversary and exploring Greensburg! Kelly is a wonderful host who has thought of everything you could possibly need! The neighborhood is very walkable which was great for taking your dog as well!
2024-06-01,5.0,Stayed a few nights,We had a great stay and loved this cute home! Very close to downtown and walkable to many places. Would recommend to anyone!
2024-06-01,5.0,Stayed a few nights,"I can’t thank Kelly enough! Poppy House is the perfect cozy little home for a getaway. From the Chase lounge on the couch, the comfortable bed, the amazing bathtub to the private backyard with twinkle lights… the place has it all! So much to offer in this little home with lots of love! Thanks again, see you again real soon!"
2024-05-01,5.0,Stayed one night,"Super cute little place, and awesome host, definitely recommend and would stay again!"
2024-05-01,4.0,Stayed with a pet,"Kelly was a very responsive and friendly host. The house was as pictured. However, my pug was very sensitive to the dust and dog hairs and was sneezing the whole stay. Overall, I would recommend the stay."
2024-04-01,5.0,Stayed with a pet,"This place was perfect for our stay. Absolutely loved the decor, so cute! Would recommend and stay again."
2024-04-01,5.0,Stayed with a pet,Kelly's place was so cute! The kitchen was equipped with some seriously nice equipment. The bed was super comfortable. The backyard was large and fenced. Kelly answered a few messages I sent almost immediately. She was a great host and her place is beautiful!
2024-04-01,5.0,Stayed with a pet,Kelly's place was great for us and extremely dog friendly. The house has been really well renovated and the neighborhood is real close to downtown. Kelly was super responsive! Great stay.
2024-04-01,5.0,Stayed a few nights,I wanted a place to get away and Kelly’s place was perfect. A huge tub for soaking and a fenced in back yard for my puppy to play. She really enjoyed the basket of toys. I will be back again!
2024-04-01,5.0,Stayed a few nights,We enjoyed our stay! The bed was comfortable and the sofa bed was nice as well. It was easy to find and easy to get into.
2024-04-01,5.0,Stayed with a pet,"My husband, our two dogs and I were there for the exciting eclipse weekend. Kelly went above and beyond to make sure we were all set for the eclipse and even left us the appropriate eclipse viewing glasses. All the amenities as described in the listing plus more. Kelly was incredibly responsive in all of our communication. There were a number of plug-in room freshener scents that were quite overwhelming for us. If this is something you are sensitive to I'm sure. Kelly would accommodate having them unplugged ahead of time. We had a great long weekend!
It's very obvious that kelly enjoys sharing her own home."
2024-04-01,5.0,Stayed one night,"My boyfriend and two weenies loved our stay, definitely would recommend and stay again!"
2024-04-01,5.0,Stayed with kids,Kelly gave great info about weather conditions before we even checked in. Very responsive and kind.
2024-03-01,5.0,Stayed with a pet,"This was a great stay! Kelley's house is very cute and offers great amenities such as games, a large backyard, and clean spaces. The price was incredible and was only 30 minutes away from a kayaking trip we did. Our dog also enjoyed the space! Kelley was extremely responsive and provided local recommendations + updates on the weather. Definitely would stay again!"
2024-03-01,5.0,Stayed with a pet,Felt right at home!! The perfect place for my family and I to stay at.
2024-03-01,5.0,Stayed with a pet,"We enjoyed a weekend here for an event in Indianapolis. It was about a 40 min drive to Lucas Oil Stadium which was perfect for us. We traveled with our dog and have never stayed in a more perfect place for our pup. The fenced in back yard was a plus. The home was clean, decorated beautifully, and exactly as described. Kelly definitely made us feel right at home."
2024-03-01,5.0,Stayed with a pet,"Cute house, great for the dogs. Will definitely be back. Kelly is a great host."
2024-02-01,5.0,Stayed with a pet,"Great, relaxing stay. Kelly was a great host and made us feel at home!"
2024-02-01,5.0,Stayed with a pet,Kelly's place was cozy and comfortable. Loved the pullout sofa!
2024-01-01,5.0,Stayed a few nights,"Kelly was an amazing host! She made the whole process start to finish a breeze. Very helpful, informative on the area and the poppy house has so much charm! We felt right at home, and will seek out the poppy house when in the area. 10 out of 10 will recommend anyone going through the area."
2024-01-01,5.0,Stayed a few nights,Great host! Comfortable and clean! Will stay here again!
2024-01-01,5.0,Stayed a few nights,Awesome place that was well described and everything you would need for a stay away from home. Will definitely be staying here again when in town!
2023-12-01,5.0,Stayed with a pet,"It was perfect. House was so cute and clean and accessible.
The back yard was fully fenced and perfect for our dog."
2023-12-01,4.0,Stayed with a pet,Good for pets. Kelly was a responsive host.
2023-12-01,5.0,Stayed one night,Wonderful!! Backyard great and dog treats were superb!
2023-11-01,5.0,Stayed a few nights,We loved staying at Kelly’s! It was super clean and comfy.
2023-11-01,5.0,Stayed with a pet,Very cute house was perfect for us and our two pups on our trip! Nice fenced in yard was great for the dogs! Love the new girl and Harry Potter decorations!!
2023-11-01,5.0,Stayed with a pet,This worked out great for a quick weekend!
2023-11-01,5.0,Stayed a few nights,We were in town for our daughters baby shower and Kelly was super flexible. We enjoyed the space and felt very much at home. Great place to stay and I am sure we will be back after the baby is born since it is so close to our daughters house. Thank you Kelly for your warm hospitality🌸
2023-11-01,5.0,Stayed one night,"Kelly's home was very cute and cozy. We felt like we were staying at a friend's house. It was kinda neat to open the fridge and actually see food in there. It felt like home.
Kelly was very nice and easy to get along with. Check-in was very easy, and the home was exactly as she described.
We were a little thrown off by the fact that she actually lives there at first, but I'm really glad we decided to stay. Her home is decorated nicely, and it was so comfortable. Don't pass this one up!"
2023-10-01,5.0,Stayed a few nights,Kelly was helpful and quick to answer any questions. Her home is beautiful and clean! She provides everything needed for a few days away from home.
2023-10-01,5.0,Stayed with a pet,"Kelly was a gracious and proactive host who offered information every step of the way. Her house is lovely and we were super-comfortable there, and our little dog loved the basket of toys she had out! Great private backyard. We felt so comfortable, we even ate her snacks, which she was super nice about! Just a charming little house, and a great stay."
