date,rating,note,review_text
2019-01-01,5.0,Stayed a few nights,"Brent was a great host. He welcomed us upon arrival, had recommendations of places to eat and things to do in the area, and the studio apartment was more than we expected! We loved our stay and the train that did go by was super quick and not a nuisance at all! Thanks for the clean apartment with all amenities we needed."
2019-01-01,5.0,Stayed one night,"Very nice, spacious and comfortable apartment in a quiet country setting."
2018-12-01,5.0,Stayed one night,"This place was truly a gem, for my husband and i. After a long day at a Basketball Tournament,this place was perfect ,to unwind and rest. It was spotless clean, comfortable and very peaceful. I hated we had to leave. Very sweet and honest couple. I most definitely would love to retreat there again."
2018-12-01,5.0,Stayed one night,Awesome stay at Gerald Brent’s studio! The community is peace and friendly. Even wanna living there after the short stay. Highly recommend!
2018-12-01,5.0,Stayed one night,"This was a pretty, quiet neighborhood. While we only stayed for one night, I could see it being functional for several days given the set up. This was an affordable, comfortable option and would be good for travelers."
2018-11-01,5.0,Stayed a few nights,Nice space in a pretty location.
2018-11-01,5.0,Stayed a few nights,Very nice place. Clean and comfortable. Easy communication.
2018-11-01,4.0,Stayed a few nights,Clean accommodations
2018-11-01,5.0,Stayed a few nights,"Would highly recommned staying at Brent & Susans place!!! Their hospitality was impeccable!! Their place was SO comfortable, clean, & great location!!"
2018-10-01,5.0,Stayed a few nights,"This was the perfect location for a relaxing long weekend. The neighborhood is beautiful and quiet, and Brent was a very hospitable host. Private access to come and go was just what we were looking for. We cooked a few meals in the kitchen and had everything we needed. There is a large variety of restaurants and parks in the vicinity. We would love to come back soon!"
2018-10-01,5.0,Stayed a few nights,Brent and Susan are the best of the best when it comes to hosting! Their place is perfectly appointed with everything you need. It’s a beautiful quiet neighborhood and they couldn’t be more welcoming. I’ll see you again soon!
2018-10-01,5.0,Stayed a few nights,I can’t say enough how wonderful Brent and Susan’s place is! If there were an option for 10 stars I would choose it! The place is quiet and comfortable. Brent and Susan are friendly and welcoming but respected my privacy after long days at work. I will be booking with them again and again!
2018-09-01,5.0,Stayed a few nights,"Very nice, would stay there again tomorrow. 5 Star"
2018-09-01,5.0,Stayed a few nights,"If you want to see what an amazing studio needs to be just stay here! Gr8 host, gr8 place, gr8 neighborhood."
2018-08-01,5.0,Stayed a few nights,"Gerald is a great host. He met us on arrival and gave us an orientation to the apartment. The apartment was just as it had been pictured -- clean, comfortable and well-furnished. Gerald was available for questions and gave us several restaurant tips as well as telling us about the local covered bridge and other sights."
2018-08-01,5.0,Stayed a few nights,"Warm, comfortable, clean, hospitable: a very large studio that would be wonderful for overnight or a month's stay. It's in a friendly, green and wooded neighborhood. There's every amenity for a fully furnished apartment."
2018-08-01,5.0,Stayed a few nights,"A practically new, super-clean apartment, separate from the owner's home, on a quiet cul-de-sac in a beautiful lakeside community. Great hosts, all the amenities, come and go as you please. A great AirBnB experience."
2018-08-01,5.0,Stayed a few nights,"Absolutely wonderful. Brent and Susan took care of my girlfriend and were extremely friendly. Offered local places to check out, had no problems with privacy and the area is even more beautiful in person."
2018-08-01,5.0,Stayed a few nights,"Our hosts took great care of us, sharing local tips of sights to see in the area, the best food, and state park."
2018-08-01,5.0,Stayed with kids,This place is a cozy little home with good amenities and privacy for two people. Great hospitality by Mr Brent who helped us checkin late in the night and made sure we are all settled. The studio is very clean with all necessities tucked in to the well designed room. Me and my son loved our short stay.
2018-07-01,5.0,Stayed one night,A very peaceful place and a kind and welcoming host.
2018-07-01,5.0,Stayed one night,Beautiful apartment. Just as pictured. Brent was a most gracious host. Very peaceful surroundings.
2018-07-01,5.0,Stayed a few nights,Very nice place in lovely neighborhood. Comfortable and loved all the light and tall trees visible from the windows.
2018-06-01,5.0,Stayed a few nights,"Modern studio apartment. Very clean. Excellent host. Upscale, secluded neighborhood. We would definitely come back if we are in the area again. Loved it!"
2018-06-01,5.0,Stayed one night,Very nice neighborhood and wonderful stay
2018-06-01,5.0,Stayed a few nights,The studio apartment was a lovely space for my husband and I. Pictures really don't do it justice! It's very beautiful and clean. Brent was very helpful and accommodating. We definitely plan to stay another time in the near future!
2018-05-01,5.0,Stayed one night,"This is a beautiful and homey space, very peaceful, very clean, and just beautiful. Brent is a very hospitable guy, but not intrusive at all. There was coffee for the morning, and excellent recommendations for food both that evening and in the morning. We would highly recommend this for anyone looking for a nice place to stay."
2018-05-01,4.0,Stayed one night,"Gerald was a great host who has a cozy, clean space."
2018-05-01,5.0,Stayed a few nights,"Extra nice—thoughtful extras like coffee, soaps, snacks, etc. super clean and comfortable, great privacy..really nice place. Hosts were extra helpful with directions and communication. Setting was really nice with a great wooded view. Really lovely place"
2018-04-01,5.0,Stayed one night,Beautiful property. Extra clean accommodations. Kind host. Relaxing and enjoyable experience.
2018-04-01,5.0,Stayed one night,"The apartment was great - very new, and very clean. It was in a very nice neighborhood in a scenic part of Indiana. We were travelling from Chicago on our way to Kentucky after work on a Friday night, and the owners were very accommodating with our late check in. We would definitely stay there again if travelling that way!"
2018-04-01,5.0,Stayed one night,"Sparkling clean and very comfortable! A relaxing, private get away. We hope to return some day. You were a great host - and thanks for the tip on the place for breakfast!"
2018-04-01,5.0,Stayed a few nights,"Gerald Brent is a perfect host. He met us and showed us everything we needed to know for our stay. He offered recommended places to see, eat in the area (to include a charming diner nearby), and responded immediately upon our arrival and prior to our stay. Gerald's place is open, clean, and nicely decorated. We liked the lamps that charged our phones and the bed was super comfy. We would recommend staying here to our friends and family."
2018-04-01,5.0,Stayed a few nights,"My second stay here, highly recommend it if you, like me, need a quiet touchdown somewhere in between Cincy and Indianapolis. Clean, private, and well-appointed."
2018-04-01,5.0,Stayed a few nights,"Great private in-law/studio place. Very clean, well decorated, and well appointed. Kitchen was sufficient for cooking my bachelor meals. Hosts are very friendly and hospitable."
2018-03-01,5.0,Stayed a few nights,"Lovely place, quiet, private. Gerald Brent and Susan gave us some helpful suggestions of things to see and do in the area."
2018-03-01,5.0,Stayed a few nights,Very clean and well decorated studio apartment. Kitchen is stocked with everything you’d want and the space feels very homey. I also liked the quiet neighborhood and lack of light pollution.
2018-01-01,5.0,Stayed about a week,Great place to stay
2018-01-01,5.0,Stayed over a week,"The studio apt. is perfect for long term or short stays. The space is set up to make you feel like it is your home away from home. The apt. looks exactly like it is pictured. Perfect location for quiet time and relaxation. I would highly recommend this space to future travelers, you won't be disappointed."
2017-12-01,5.0,Stayed one night,"We would highly recommend Gerald Brent's studio. It is very nicely appointed, immaculate and exceeded our expectations. The only downside would be if stairs are a problem for someone since it is a 2nd story studio."
2017-11-01,5.0,Stayed a few nights,"What great hosts! Their interactions were above and beyond nice. My wife was feeling under the weather and they left a little care package for us, and the morning we were leaving our car battery was dead, and they came out got our car running! We couldn't have asked for better. Above and beyond our expectations!!!!"
2017-11-01,5.0,Stayed one night,You will not be disappointed! This apartment is the perfect blend of comfort and style. The personal touches make it feel like home. Brent went out of his way to make us feel welcomed. We would recommend this place to anyone and hope to return in the future.
2017-11-01,5.0,Stayed a few nights,"Spacious studio apartment with lots of light backing up onto a lovely wooded area. Thoughtful placement of comfortable furniture made every need a delight. Brent came out to meet me when my exit was closed and had me follow him in to the destination, then helped me get around town -- a huge help! Stayed two nights and was extremely comfortable. There was a train one night (the apartment is about 40 feet from the track) but it was early enough that it didn't bother me, but I wore earplugs just in case. One tiny thing is there is bright light on the left and in the front of the bathroom mirror, which made it hard to see my makeup on my right side. Could use a light to the right. Other than that, perfect stay. Highly recommended!"
2017-10-01,5.0,Stayed one night,Our stay was perfect...wish we’d have planned for a longer visit. The apartment is set up conveniently and feels big. It had everything we needed and more! The bed was so comfortable and the view from our room was lovely. We’ll definitely be back!
2017-10-01,5.0,Stayed a few nights,Beautiful and immaculate studio apartment that was in a very lovely and quiet neighborhood. Brent and Susan were amazing hosts and I am honored to have met and been welcomed to their home. Far exceeded my expectations and would stay again in a heartbeat if I find myself in the area.
2017-10-01,5.0,Stayed one night,"Amazing place to stay, everything was all we could ask for. They do a great job with being available for late check in, and checking out is extremely easy. The space is above his work studio in the garage and is 20 steps away from his house if anyone was wondering. I will stay again if work brings me this way."
2017-10-01,5.0,Stayed one night,"If you are looking for a quiet, very clean, well appointed place, this Airbnb fits the bill! Gerald greated us promptly upon arrival, showed us our space and answered our questions. Very comfortable bed, well lit room and a fully stocked kitchen and bathroom. This is a 5-star private place and perfect for weary travelers. Highly recommended."
2017-10-01,5.0,Stayed one night,An awesome studio apartment in a great neighborhood. Mr. Brent was very accommodating with our late arrival. The studio was immaculate and we were very impressed with the attention to detail within the studio. My wife forgot her hair dryer but no worries she spotted a hair dryer in the bathroom. Loved the fact there was wifi available. Mr. Brent's place is a gem and a must stay if you are looking in the area.
2017-09-01,5.0,Stayed one night,The place was terrific we would stay there again.
2017-09-01,5.0,Stayed a few nights,"Brent's place is so beautiful, new, and clean. Lots of light. And he was there to greet us and show us around. He also checked in with us a day later to be sure we had everything we needed. We had a sense of being well cared for and welcomed. I highly recommend his place. (Yes, train tracks are real close, but after the first one, didn't really notice it anymore. And I'm really sensitive to noise ordinarily.) We'd stay here again, definitely!"
2017-09-01,5.0,Stayed one night,"A great private stay! This apartment is seperate from the main house and in a very nice and safe neighborhood. The apartment was immaculately clean and all appliances and utilities looked to be brand new! Susan and Brent were very communicative when needed and were helpful with last minute changes we had. Comfortable bed and chairs, with a good shower and wifi made for a great stay. Thank you!"
2017-09-01,5.0,Stayed one night,Very nice will stay again
2017-09-01,5.0,Stayed one night,"Anyone booking at this location will be extremely satisfied with everything! Brent and Susan have done a great job at offering a private studio and all the amenities that are included. The furnishings, decorating, and cleanliness was impeccable. We checked in late and it was a breeze communicating with Brent to get access to the apartment. Susan makes delicious cookies!! We would recommend this to anyone in the area."
2017-08-01,5.0,Stayed one night,"Gerald's listing was the perfect stopping point for me and my fiancé ""babymoon"". Gerald and his wife were welcoming and lovely people to speak with. The suggestions they gave made our stay and trip a Homerun, such as the restaurant suggestions in New Point. The listing felt very safe and secluded, and the neighborhood was absolutely gorgeous and quiet. For anyone traveling the Batesville area, I would highly recommend Gerald's place as a must stop!"
2017-08-01,5.0,Stayed one night,"Immaculate little 2nd floor walk up apartment, in a separate building. Woodsy setting is like a rural get away. Lovely modern furnishings, great AC. Best Airbnb we've experienced so far."
2017-08-01,5.0,Stayed a few nights,"Great place, the host were very friendly and accommodating. Supplied with everything you would need, in a residential area but still very secluded and private. This will be a place that we will return to in the future."
2017-08-01,5.0,Stayed one night,This is the best place to stay in the Batesville area. The apartment was modern and beautifully decorated. The hosts were very hospitable and thoughtful. The check-in and check-out process was very easy. We really enjoyed our stay and recommend it to others.
2024-06-01,5.0,Stayed one night,"so nice to find a place with quality furnishings. The bed was soooo comfortable! gorgeous tile flooring and kitchen design. A little food in the fridge (bread, butter, jam, eggs), plenty of coffee. Fridge with ice and water dispensing was nice. Would stay again."
2024-06-01,5.0,Stayed one night,"We were on a road trip and ported in to Richard's lovely apartment for the night. The host thinks of every detail for a comfortable stay! We loved the deck with its shady maple tree and bucolic view, a perfect place for a relaxing evening after a long journey. It's close to highways yet peaceful. If you are ok with one flight of stairs (which Rick, of course, discloses), don't even think twice. l"
2024-06-01,5.0,Stayed one night,"Host was great, very good recommendations and information. Would definitely stay there again , the unit is super nice."
2024-06-01,5.0,Stayed a few nights,"This is truly a first class Airbnb with great energy. Everything was perfect from the well equipped kitchen, to the pristine bathroom, the great deck etc. We could not have been happier. Stayed 3 nights. Could have stayed more. Richard was an extremely nice and gracious host. Highly recommend"
2024-06-01,5.0,Stayed with kids,Rick was a great host and his space had everything you could want or need and more. We really loved the view and the bed was extremely comfortable.
2024-04-01,5.0,Stayed one night,"Richard’s apartment Airbnb was very clean and had all the amenities and extras that I would not expect. Refrigerator was stocked with water, cokes, etc. bread"
2024-04-01,5.0,Stayed one night,"Our first impression is: your home is beautiful! It's impeccably clean, fresh and new! We love it! Some people in our age group, 64/80, may have difficulty with the stairs, but we live in an older home and climb stairs everyday of our lives! Great exercise!
We did eat at Lil' Charlie's. We were under impressed at first. however, we ordered and the food was outstanding!!!
This is a fabulous start to our Charlotte Trip! The village is charming and filled with history. Thank you for offering this lovely property on Airbnb! We'll definitely recommend it to family and friends!
Marie and Severing
Janesville, WI"
2024-04-01,5.0,Stayed one night,"Richard’s place exceeded my expectations. The decor and furnishings are first class. It is spacious, comfortable, and equipped with everything you could want or need… surrounded by the charm of this quaint little town. This is an exceptional value! I will be back."
2024-04-01,5.0,Stayed one night,"We only stayed one night on our way to Kansas but would definitely stay again if given the chance ! The place was easy to find, plenty of parking, very quiet and safe area. The inside was clean, Richard kept it well stocked with everything we would have needed."
2024-04-01,5.0,Stayed one night,This is a wonderful place to stay in the quaint town of Oldenburg. The host included many special touches. You will enjoy your time here.
2024-04-01,5.0,Stayed one night,"Very nice place!! Clean and comfy! Enjoyed sitting out on the deck after we went to recommend eatery, Pearl Street Pub! Fun place!! Before checking out the next morning, enjoyed bagels and coffee that was provided! Very sweet and much appreciated!! Would highly recommend this place!! Nice town, friendly people!! Beautiful location!"
2024-03-01,5.0,Stayed a few nights,"Richard was a gracious host. Interior was brand new, clean, and the deck was the perfect setting to relax on our trip."
2024-03-01,5.0,Stayed a few nights,"Great getaway, much needed time away. Great couples getaway."
2024-03-01,5.0,Stayed one night,"Very clean and organized. Peaceful vibes, lovely place!"
2024-03-01,4.0,Stayed one night,"Very picturesque scenery, and very quiet. The host outdid himself by stocking the fridge with cold drinks, and supplied everything needed to make a nice breakfast! Everything was squeaky clean and the bed was very comfortable. Despite the cordless blind in the master bedroom refusing to pull down, we slept well. Washer & dryer was also handy to have, and it washed everything up nicely.
We took the host's dinner recommendation and went to Lil Charlie's, and we LOVED IT! I recommend the Tuscan pasta.
The Keurig unfortunately didn't work for us, and we have been Keurig users for years, so I don't think it user error. Not having my morning coffee set things off to a slow start, but thankfully, there was a Scooters Coffee in town. Also, there's no privacy in the living room with the patio door not having any curtains or blinds. I felt like I was in a fish bowl.
Overall, Ricks place definitely has its perks and the host pulled out all the stops to make sure our stay was comfortable."
2024-02-01,5.0,Stayed a few nights,Excellent host! Would stay again for sure.
2024-06-01,5.0,Stayed with a pet,"Located in a small town. It was easy to find , and the host was polite and accommodating. It had everything we needed."
2024-04-01,5.0,Group trip,"This was an amazing spot! The game room is awesome, there are TVs everywhere, and the pond was fun to fish in! This spot if perfect if having a guys weekend!"
2024-04-01,5.0,Group trip,"Perfect for nature lovers! Even able to watch nature from the living room couch! Or the porch couch. Or the swing. Or the screened-in picnic place by the firepit. Pictures can't catch the beauty of the redbuds blooming around the pond or the birds that flit about, serenading us. Nor are pictures accurate inside...the comfy feel in the chairs, the handy room arrangement for a family, the shower in addition to the bathtub in the master bath!
Not far from main roads, but along a quiet, good-paved, country road in a wooded area. A home away from home in every sense! A place to spend top-quality family time!"
2024-04-01,5.0,Stayed a few nights,"The pictures do not do this property justice- it has an absolutely tranquil setting. What you can't see in the pictures- is the sounds of nature that surround you. We really enjoyed paddle boating and many actives that are available.
The home was very clean and the host responsive, welcoming and gracious. We rented this property due to its location being in the totality of the 2024 solar eclipse- but hope to return again in the future just to enjoy this hidden gem ."
2024-06-01,5.0,Stayed with kids,"Nice place. Quiet and secluded. You have to travel for big stores, but there are plenty of restaurants nearby. Really close to nice parks and walking trails. Would recommend"
2024-06-01,5.0,Stayed a few nights,I will stay there again. I loved everything about it. A five star place to live while visiting my family. I can say it was an excellent place to stay. Love it. Thank you. Suellen Stamps
2024-04-01,5.0,Stayed a few nights,Very clean. As described.
2024-06-01,5.0,Group trip,"It is a beautiful place. Unfortunately, we only stayed one night. The weather didn't cooperate with our stay to take advantage of the beautiful property.
Had an awesome visit from the big white dog!
I look forward to going back and enjoying a longer stay!"
2024-06-01,5.0,Group trip,"Wonderful place! Very peaceful, clean and absolutely beautiful. Very responsive and helpful hosts as well."
2024-06-01,5.0,Stayed with kids,Seven springs hideaway was the perfect weekend getaway! It was the first time our entire family has been away together in 9 years! There was plenty of room for all 15 of us! The property was beautiful and peaceful! The house was stunning! So glad we chose Susan's home to celebrate our Mom's 70th birthday together! We would love to come back for another visit! We will be telling all our family/friends about it!
2024-06-01,5.0,Group trip,"WE LOVE THIS PLACE!! 9 of us friends stayed here. Peaceful, yet packed with fun is the only way to describe this place. We enjoyed the hot tub surrounded by nature, caught bass, bluegill, and catfish in the pond, and played pool. Plenty of room for everyone. The property was extremely clean and well taken care of. The kitchen in the basement was so convenient! We loved our stay so much that our group will be returning from now on for a yearly fishing retreat! (If we can wait another year!) highly recommend! Thanks, Susan!"
2024-06-01,5.0,Group trip,"This place was amazing, would definitely come back again to stay! It’s beautiful, peaceful & you feel right at home. Susan was also very helpful & responsive if we had a question! Thank you so much for having us! :)"
2024-04-01,5.0,Group trip,"I cannot say enough great things about the stay at this gorgeous home and Susan as a host. We went for the eclipse, and to avoid traffic on the way, I asked to arrive a bit early. Susan was more than accommodating although we were an eager bunch.
The house, grounds and view are stunning. There were only 8 of us, but the house would be absolutely perfect for a larger gathering. All the beds were comfortable, the entire house we spotless and we loved the reclining couches and pool table.
Can’t rave enough- if you’re considering booking this spot do it NOW!"
2024-04-01,5.0,Group trip,"Wonderful stay, amazing place, great host!"
2024-04-01,5.0,Stayed with kids,Beautiful property and friendly host
2024-04-01,5.0,Stayed a few nights,"Me and my family rented this beautiful place for Easter weekend and trust me, it did not disappoint. My family is already planning on going back.
The house inside is well decorated and very spacious. The kitchen has almost everything you could ever need( well stocked). Bedrooms were comfortable. Master suite has a jetted tub (very relaxing) and a very nice stand up shower. There is plenty of space in this house.
Outside the house has a hot tub and a pond. The hot tub area is nice. It has a little area to sit and start a small fire.( small fire pit). Wife loved it. Has lights and a blue tooth stereo. Also has a unique swing that everyone liked getting on.
The pond was my favorite place. It is off the basement level of the house. Has a medium fire pit. Burnt a lot of wood there. You can cook steaks over the flame using this fire pit. The pond itself is stocked with Catfish and Bass.
I definitely recommend this place to anyone !!!"
2024-03-01,5.0,Stayed with kids,"Was a great place,roomy,quiet and relaxing.Our children weren't ready to leave💯.Even got to see deer around pond.Was a chilly weekend so we didn't get a chance to go outside,as it got great area to wonder around....."
2024-03-01,5.0,Group trip,Very nice place inside and out. Very spacious and clean. We enjoyed our stay. Would stay again!
2024-06-01,4.0,Stayed with kids,"Nice cabin, though could use more lighting near the coffee machine. Enjoyed the deck over looking the river. Very peaceful."
2024-06-01,5.0,Stayed a few nights,Amazing house so beautiful house in on a amazing river
2024-06-01,5.0,Group trip,"This place was incredible. It was quiet and private. We enjoyed listening to the little waterfall, all the bullfrogs, and even the occasional bobcat. The house was very clean and kept up. We love sitting out on the back deck just visiting with family and enjoying the peacefulness of the property. I would highly recommend this place to anyone. The host was very responsive the few times that I texted him."
