date,rating,note,review_text
2022-02-01,5.0,Stayed one night,A cute & comfortable littleplace away from it all. The kitchen is extremely well stocked and wonderful for cooking a nice meal. All the little extras like candy dishes & make up wipes make this space like home. We liked the bedroom & bath upstairs feeling secluded from the rest of the house.
2022-02-01,5.0,Stayed one night,Such a cute place to stay.
2022-02-01,5.0,Stayed about a week,Thank you very much for allowing us to stay at your .beautiful house it was everything we expected
2022-01-01,5.0,Stayed a few nights,"A really nice place to stay! Mary Kay takes such good care of the house and when we were there, even though it was 8 degrees one night, the house was very comfortable. Oldenburg is a neat old town and this house sits in such a perfect location. It was built in 1926 and it's solid!
Mary Kay's communication was great and checking in was simple and straightforward. We will be back in the area again and hope this home will be available when we return."
2022-01-01,5.0,Stayed a few nights,Very cozy place too stay. I look forward to coming back.
2022-01-01,5.0,Stayed a few nights,"Awesome, charming house. Great hosts! Clear info on working the TV. TV's now a days are confusing but clear instructions were available. Plenty of space and clean. Loved the Christmas decorations."
2022-01-01,5.0,Stayed one night,Great little place in a cute town. Mary Kay was very communicative and helpful.
2022-01-01,5.0,Stayed a few nights,Great place to stay with a great host!
2021-12-01,5.0,Stayed one night,"I have stayed at Mary’s home twice and would come again! Mary is such a great host - easy to communicate with and generously accommodating. Her home is clean, cozy, and picturesque as it sits on the top of a hill overlooking the quaint town of Oldenburg.
Can’t wait to come back!"
2021-11-01,5.0,Stayed with kids,"Mary Kay’s place was perfect for our weekend. Beautifully decorated for Christmas and spotlessly clean overlooking the town, truly a gem of a find."
2021-11-01,5.0,Stayed a few nights,"Oldenburg is a charming town, especially when you gaze on it from the front porch of this house with character. I have stayed here twice - once with college girlfriends and once with my husband of 47 years. It’s a great place to relax and make good memories. The host has thought of everything you could possibly need."
2021-11-01,5.0,Stayed one night,"Mary was wonderful. Very informative, responded quickly and was just an overall sweet person. Although I was not able to stay the entire period what I did notice instantly was place was perfectly decorated and you could tell Mary takes pride in ensuring the home is in great condition!"
2021-11-01,5.0,Stayed one night,"Wonderful, cozy little home right by the main strip!"
2021-11-01,5.0,Stayed a few nights,"Great AirBnB house to stay in and the hosts were great. Everything was super clean, the house was exactly as advertised, there was a helpful binder about the area etc., and the hosts even dropped us off some chips and salsa in the beginning. Was there with some college friends for a sporting event and we loved the house/area! Recommend hitting the small brewery/bar right in town."
2021-11-01,5.0,Stayed with kids,This Airbnb was a beautiful home with a fantastic view of the town. I stayed here with my family. Mary Kay was a wonderful hostess and easy to contact if I had any questions. I will definitely come again and I will recommend it to my family and friends too!
2021-10-01,5.0,Stayed a few nights,"Mary Kay did a fantastic job! She stayed in touch with me to make my check-in/out and my entire stay smooth and enjoyable.
She went above and beyond to accommodate my group and I appreciated her hospitality.
I already have another weekend reserved!"
2021-10-01,5.0,Stayed one night,fantastic home with fantastic hosts
2021-10-01,5.0,Stayed with kids,"Everything was perfect! The house is darling and the pictures on the posting do not do it justice. I think the hosts literally thought of everything when it came to fine touches of hospitality! We enjoyed our stay so very much and sure weren’t ready to leave. We will be back to enjoy more of the beautiful view, my husband wanted to draw it but we just had to many plans and not enough days.
Can’t wait to visit again!"
2021-10-01,5.0,Stayed one night,Beautiful house to stay in. Even better then the description. Wonderful view of the town and in walking distance to everything. Even has a basketball court down the road which my daughter loved to walk to. Even though we had a slight issue with ac unit during our stay we had great communication between Mary and Robert. Everyone was super helpful. Can’t wait to stay again soon. Thank you.
2021-09-01,5.0,Stayed a few nights,This is a wonderful place to stay! Everything was so clean and comfortable. I came to visit for a few days and spent most of the time on the comfy front porch. It is the best view in Oldenburg! Mary Kay is a welcoming hostess and adds little touches to welcome you and makes you feel right at home. Definitely would recommend this little house on the hill for a getaway--I will stay again!
2021-09-01,5.0,Stayed a few nights,"Mary Kay and Joe are superb hosts. Their house is beautifully decorated with a nautical theme, well stocked with bottled water and many condiments in the refrigerator; toiletries including toothpaste, toothbrushes, soap; hand sanitizer, antibacterial wipes, masks, as well as a kitchen loaded with many spices, and herbs to cook with.
It's a great home for toddlers with the pack n play, high chair and toddler bed included. 
Chips and fresh salsa were waiting for us on the kitchen table. 
In town is Wagner's Village Inn's famous fried chicken, just 2 blocks away. THe Brau Haus with tasty German favorites, such as bratwurst and schnitzel is a close 3 block walk. The house overlooks Oldenberg, and sitting on the front porch we had a beautiful view of the town. 
They live right behind the rental and Joe was readily available with an extra key when our napping grandson was accidentally locked in the house! 
All in all, we had a fantastic stay at Mary Kay and Joe's home. This is THE place to stay if you're in the Oldenberg/ Batesville area!"
2021-08-01,5.0,Stayed with kids,"Cute, comfy place with a well-stocked kitchen and walking distance to a couple local German restaurants and pubs. Mary Kay and her husband were very friendly and helpful. Lots of thoughtful touches that made our stay comfortable."
2021-08-01,5.0,Stayed one night,This is a super cute house and a amazing location!!! Mary Kay spoiled us rotten with extra little touches!! She is an amazing host!!
2021-07-01,5.0,Stayed about a week,"A sweet house with an absolutely lovely view of the town. I spent a week in Oldenburg and spent half of my time sitting outside, working from my laptop and watching the town- it’s such a picturesque location.
Mary Kay and Joe are very available and kind, we chatted and I even came back from exploring to find a slice of pie and a note on the doorstep. They live behind the rental so if I had any issues (I didn’t) they could be over in a heartbeat.
I will say there were lots of spiders and bugs outdoors- not unexpected as I visited in the middle of summer- but not a single one indoors. The home itself is spotless and very comfortable. They have thought of everything! From nightlights to fans to the kitchen being fully stocked.
Definitely worth the stop. Thank you both!"
2021-07-01,5.0,Stayed one night,"What a lovely property! This home was perfectly maintained and full of every essential and amenity you could need, including tons of kids activities.
The charming view over the town was perfect for relaxing. We enjoyed playing a board game and watching a summer storm over the Spires. The jacuzzi tub was a nice bonus!
We had lunch at the Pearl Street Pub and their handmade burger and sausage patty sandwich were delicious!"
2021-07-01,5.0,Stayed about a week,"Don't miss this opportunity, great value, great owners, great place. This was a perfect house to bring my kids back for a visit with family and friends."
2024-06-01,5.0,Stayed with kids,A wonderful place to stay! My family of 10 plus a baby had so much space and everything we need. We had fires outside every night with enough sets for each of us. We really enjoyed our stay and will be back!
2024-06-01,5.0,Group trip,Thank you for a wonderful weekend for out of town guests for our daughter’s wedding.
2024-06-01,5.0,Stayed a few nights,"Pictures do no justice! It was absolutely adorable! Everything was so thoughtfully put in place for us. We arrived at night. The music, lighting, space..it was perfect for our last minute weekend getaway! Highly recommend!"
2023-12-01,5.0,Group trip,Another wonderful stay with a wonderful host! Cannot recommend the location enough - the attention to detail and effort behind the space is clear. Really the best Air BnB experiences I’ve ever had!
2023-12-01,5.0,Stayed over a week,Perfect
2023-10-01,5.0,Stayed a few nights,Beautiful views outside and the inside was like stepping back in time to an old cabin
2023-10-01,5.0,Stayed a few nights,We had an amazing time. The place was a gorgeous log cabin and so peaceful. We enjoyed a fire and s’mores every evening! We came to visit family in Indiana and made the trek from Florida. The check in was easy and communication made it a breeze after a long drive . Highly recommend !!
2023-10-01,5.0,Stayed with kids,"We’ve stayed here twice now when visiting family. It’s a fun unique place that our kids love. The house is stocked with everything you need, and Joe is super responsive."
2023-09-01,5.0,Stayed a few nights,"Place was an amazing getaway. Me and the misses were thrilled with how beautiful the scenery was. Joe was an amazing host with very detailed instructions for the place and even some local recommendations!
Very happy with our stay and hope to come back."
2023-09-01,5.0,Group trip,This place was absolutely perfect! The best Airbnb we have ever rented! Beautiful place! Would love to book every year! Joe was tremendous to us and always very responsive. Thank you Joe!
2023-08-01,5.0,Group trip,Worked perfect!
2023-08-01,5.0,Group trip,I had my wedding here and it was amazing. I'm glad I found red Rose ranch and I can't wait to come back in the future
2023-07-01,5.0,Group trip,Beautiful cabin
2023-07-01,5.0,Stayed a few nights,"We were able to visit friends and family nearby and have a place to rest and relax on our own. The cabin is beautifully decorated and has everything you need for a stay - up to and including enough pantry items to ensure you could feed late night hunger pains! Joe was very responsive, even late at night when we thought we had locked ourselves out. The attention to detail really sets this place apart."
2023-07-01,5.0,Stayed a few nights,"Our stay was amazing. The cabin is so impressive, pristine and beyond clean. We are from chicago and would return in a heartbeat. We hosted a party for 30 in the event space and our smaller family stayed in the cabin. Absolute bliss which is much needed from a very busy lifestyle. Don’t miss out on this gem."
2023-06-01,5.0,Stayed with kids,"This was the perfect cabin to fit our family of 5 and help us enjoy the peace and quiet of the country! Seeing and knowing the history of this hand-hewn log cabin from the 1800's and being able to enjoy it with some of today's amenities made for the best of both worlds. The kiddos loved the bunk beds, and my wife and I enjoyed the space upstairs. Wonderful firepit out back with prepared chairs made smores night super easy and enjoyable. Joe was always super responsive and helpful with any questions we had. Would gladly book with him again if we're able to get back to the Greensburg area."
2023-06-01,5.0,Stayed with kids,Rented only less than one week before. Very responsive host and very amenable to my family’s needs.
2023-05-01,5.0,Stayed with kids,"We traveled to Indiana to visit family & needed a larger space to accommodate us. The Red Rose Ranch was very clean, comfortable & a unique stay. The kitchen was stocked with all we could have needed, the beds & bedding were so comfortable. Joe was a great host & had great communication throughout our reservation, check-in & stay. Excellent host!"
2023-04-01,5.0,Stayed with kids,Wonderful stay! Joe was a great host! Our favorite place to stay in Indiana now. We will be back :)
2023-03-01,5.0,Group trip,"This place was better then the pictures! it was such a beautiful place to stay, it was peaceful and quiet, the house was well stocked with pans, firewood, towels blankets pillows. even spices and some basic stuff you would need to cook, loved the coffee And hot chocolate that was stocked. they have instructions and a book to tell you things you would need to know about the house, very through and a great idea very very helpful, it's alot bigger then it looks in the pictures. definitely a great place to stay and would 10/10 recommend staying here, I will hopefully be back in the future! Joe is very responsive and answers any question in a quick time. the beds were comfy, the tons of fireplaces were great you didn't even need central heat using them. just sitting outside enjoying a cup of coffee In the morning even when it was cold,was nice and seeing the horses next door was awesome. if Your looking for a great quiet place to stay for a vacation with friends and family this would be it!"
2023-02-01,5.0,Stayed with kids,Beautiful cabin
2023-01-01,5.0,Stayed with kids,"Everything was cozy, amazing, and surprisingly fancy for a cabin. A unique experience that we will return to."
2022-12-01,5.0,Stayed with kids,"Peaceful, unique and memorable for a family getaway. House is so cool and rustic, we took lots of cool photos of the care they put into the house and the comfortable amenities. Thanks for a great time!"
2022-12-01,5.0,Group trip,"Speechless with gratitude. The hosts decorated for our holiday stay, so we were able to have gifts under the tree! We felt so welcome, and the hosts were very helpful - even making sure we had coffee in the morning! Overall absolutely wonderful experience. Highly recommend, and planning on arranging another stay soon!"
2022-11-01,5.0,Stayed with kids,Joe was a fantastic host and the cabin was beautiful! The guest book was extremely thorough and Joe was extremely responsive if we needed anything.
2022-11-01,5.0,Group trip,"We can’t thank Joe enough for letting us have our small wedding on the premises during our stay.
The cabin was cozy yet spacious and was able to comfortably house our friends and family that helped with the wedding.
Alongside the cabin, we rented the barn and was allowed to decorate however we pleased. It was a gorgeous reception space for us and our nearest and dearest, and we held our ceremony alongside the orchard. It was wonderful and everything we wanted"
2022-10-01,5.0,Stayed with kids,This place will not disappoint! Every detail of the cabin and property allowed for a weekend to disconnect from the day to day rush and enjoy a time to refresh with friends and family. We loved our stay and hope to visit again someday! Thank you Joe!
2022-10-01,5.0,Stayed with kids,"Thank you for a wonderful stay! Our family had a wonderful time gathering at the cabin. The grounds are beautiful and the cabin was inviting, spacious and comfortable. The cabin was appointed with everything we could have wanted. The beds were very comfortable. The bathrooms were clean with plenty of towels. We appreciated how helpful and communicative Joe was. A really special Air BNB! Thank you!!!"
2022-08-01,5.0,Stayed with kids,"This space will NOT disappoint. From breathtaking views to a gorgeous interior, this home was a true pleasure to stay in."
2022-07-01,5.0,Stayed with kids,"We really loved this airbnb and it was perfect for kids and our family gathering. The check-in was easy and Joe was great in all aspects of the rental. We made a campfire and used the ""smores"" fixings that were provided (a really nice touch!). The kitchen was well-equipped. It was very secluded and very quiet. Tony"
2022-07-01,5.0,Stayed with kids,Wonderful serene location. Big dining room table for lingering over meals or games. Huge kitchen with all the amenities. Comfortable beds. Wonderful fire pit in the yard.
2022-06-01,5.0,Group trip,"We highly recommend this cabin. Quiet and spacious with plenty of room to spread out indoors and outdoors! Secluded but just a few minutes from town, the location was great. We had a very restful time at the cabin and look forward to going back sometime, especially when it’s cold and we can take advantage of all the fireplaces!"
2022-06-01,5.0,Stayed with kids,"Super place. I can only guesd at time, money and love invested. Well done"
2022-06-01,5.0,Stayed with kids,Our family gathered to enjoy a wedding over the weekend… we came from 3 different states and this cabin was the perfect place. We got to imagine all of the history that the last 150 years may have included…. The hosts were very welcoming and hospitable. Thank you.
2022-05-01,5.0,Stayed with kids,We had the best time at our stay in Greensburg! The house was an amazing getaway and the property is stunning. Joe and Sandra were so responsive and helpful our whole stay.
2022-05-01,5.0,Group trip,Couldn’t have been better! A great weekend spent with family at a wonderful home. Book now - you won’t regret it
2022-04-01,5.0,Group trip,"This cabin was spectacular! Made for a great week with my family. Everything needed for the stay was in the cabin. Love the main wood burning stove and all the other stoves through out the cabin. I wish we could have been able to also enjoy the outdoor pit and make the smores that Joe had left as a welcome to the cabin. Unfortunately the weather did not allow.
The cabin is so nice and roomy and has many different seating areas to visit, play games, or even watch TV. We enjoyed the beautiful sunsets when possible from the front porch and star gazing from the back porch. They have thought of any and every amenity you could possibly need.
Can't wait to come back! Thank you for the wonderful hospitality. Joe is a wonderful host!"
2022-04-01,5.0,Group trip,"The Red Rose Ranch is a stunning property, with all of the amenities to make your stay pleasant. The bathrooms and kitchen are well-stocked. We especially loved all of the cozy blankets throughout the cabin. This place is HUGE, yet so comfortable and homey. So much charm and very clean!! And the owners went above and beyond with providing things to make s’mores over the fire! We look forward to staying again some day!"
2022-03-01,5.0,Stayed with kids,"Joe was extremely accommodating to our requests, communicated immediately, and made sure we had everything for our stay. The cabin is cozy and filled with history. The property is beautiful with amazing sunrises and sunsets, and horses as neighbors. We would be fortunate to stay at the Red Rose Ranch again!"
2024-06-01,5.0,Stayed with kids,This was our second time staying here and we lived it just as much as the first time. very accommodating! He set up a play pack and play and bassinet for our baby. he also has wet wipes and diapers! it's basically a fully stocked house! you won't be disappointed!
2024-06-01,5.0,Stayed about a week,"great stay, would stay again for future trips!"
2024-06-01,5.0,Stayed with a pet,"Jonathan’s place was great, he is super accommodating. Definitely would recommend his place if you need something in the area."
2024-05-01,5.0,Stayed a few nights,"the Airbnb that Johnathan owns was very very comfortable and the snack bar and the beverages that were provided were very much appreciated. I would highly recommend this Airbnb to anyone in the Osgood Indiana area. Thanks again Jonathan, for a great great stay."
2024-04-01,5.0,Stayed with a pet,We had an amazing experience. we'll definitely be back!
2024-04-01,5.0,Stayed a few nights,Rare 6 out of 5 stars. Impeccable hospitality.
2024-04-01,5.0,Stayed with kids,We only stayed one night at Jonathan’s but we thoroughly enjoyed our time there. Everything was as described and pictured. Jonathan was very communicative and super accommodating for our group needs. Would definitely stay here again if in the area.
2024-04-01,5.0,Stayed a few nights,"This was a return visit so it was familiar but it was also an upgrade—New washer and dryer!
The breakfast options were abundant! It is set up to be like “home.” Jon goes out of his way to make this little house comfortable. Thanks so much!"
2024-04-01,5.0,Stayed with kids,"This was a great place for us to stay and make day trips around the area. The extra goodies in stock were a nice bonus as well. Also, Jonathan is just the friendliest guy!"
2024-04-01,5.0,Stayed with kids,"Jonathan stocked the fridge and pantry with lots of staples, drinks and snacks! Super clean, lots of sleeping arrangements available, excellent communication! In a quiet neighborhood. And THANK YOU for not asking us to complete a list of cleaning duties before check out, esp when charging a cleaning fee (which we are happy to pay!). I highly recommend this property and owner!"
2024-03-01,5.0,Stayed with a pet,Cute home that was accurately described. Comfortable beds and pillows. Lots of drink and breakfast options for the morning. Would stay again.
2024-03-01,5.0,Stayed with a pet,"Jonathan is an awesome host, going above and beyond for guests in every way possible. My family and I enjoyed our stay in this comfy/cozy home and definitely recommend booking with him!"
2024-03-01,5.0,Stayed with kids,"Fantastic hosts, great place to stay. Had everything we could possibly need and then some, even with our large group of 9. They are the MVP of airbnb hosting!"
2024-03-01,5.0,Stayed a few nights,"Second time staying here, always a great host and very communicative. The house was everything we needed. Will stay again !"
2024-02-01,5.0,Stayed one night,"Johnathan and Renae went ABOVE and BEYOND to make our stay a great one! I have never left a review as good as the one you are about to see here!
They brought in some TV trays for us since I was concerned that the kitchen table wouldn't be large enough for an elaborate game (it was). I had asked if we needed to pick up creamer before arrival since many places provide the powdered stuff. They got us two types of CoffeMate creamer, a fresh bottle of 2% milk, orange juice and even FRESH apple fritters for the morning!
We were thrilled 😄!
The refrigerator was full of yogurts, fresh fruits, assorted canned drinks, and a little alcohol. The array of breakfast and snacks provided was impressive.
The bathroom had extra toothbrushes and toothpaste, soaps, shampoos, wet wipes...pretty much anything you might need.
Being a shutterbug, I decided to take a bunch of photos for them to add to their listing if they want.
We will definitely stay again!"
2024-02-01,5.0,Stayed a few nights,The house had everything we needed for our trip to Indiana for the MDT Frostbite match. We will definitely look for this place again next year!
2024-02-01,5.0,Stayed with kids,I can't say enough about Jonathan and his flexibility and hospitality! Due to unfortunate circumstances I had to reschedule what felt like 10 times and Jonathan was totally understand of each time I pushes my stay back and never charged me extra. We will definitely book again with him in the future!
2024-02-01,5.0,Stayed one night,"Had a wonderful stay, Jonathan was very accommodating going above and beyond. Excellent communication"
2024-01-01,5.0,Stayed a few nights,Probably the most well equipped air bnb with some of the more comfortable mattresses we have stayed on.
2024-01-01,5.0,Stayed with a pet,"Jonathan went out of his way to help us out, we highly recommend this host and his house."
2024-01-01,4.0,Stayed a few nights,My stay was good Johnathan was good if I had questions he was right there to help
2023-12-01,5.0,Stayed with a pet,"Absolutely loved our stay! Johnathan had the place super clean and had so many extras. There was breakfast cereal, milk, yogurt, oatmeal, chips and more! First stay we've had that provided toothbrush and toothpaste which is amazing because somehow someone always forgets it at home. Osgood is a small quiet town and it was a treat to stay in the town my mother in law was born and raised. We played the games that were provided and if we needed something the dollar store was in walking distance. We will be back, Johnathan had the best response when we asked about bringing our pets. He understood they were family too and now we have a home away from home 😍."
2023-12-01,5.0,Stayed a few nights,This home has been my second home for a few weeks now . Everything is always perfect . The host is awesome .You want be disappointed.
2023-12-01,5.0,Stayed a few nights,Never disappointed here . One of my favorite Airbnb's.
2023-12-01,5.0,Stayed a few nights,Always perfect awesome host . I stay here everytime I'm in the area. We are are never disappointed
2023-11-01,5.0,Stayed with a pet,"Jonathen was the best host we ever had, very responsive, caring, and kind. The house was very pretty, clean inside and out !! Jonathan definitely goes beyond the expectations of a host. I would definitely recommend 100%"
2023-11-01,5.0,Stayed with a pet,Great spot to stay! We really enjoyed our time!
