date,rating,note,review_text
2024-06-01,5,Stayed one night,"An amazing stay, one of the most equipped places I've stayed. Check in/check out was simple and the views were absolutely gorgeous. Bryce was prompt with answering questions, highly recommend staying here."
2024-06-01,5,Stayed a few nights,This was a beautiful and peaceful stay and I loved the place!
2024-06-01,5,Stayed one night,"Wow! The views were stunning! We only stayed one night passing thru but this spot definitely will be a future destination stay for us. The space was large, cozy, had a feel of home and equipped with every amenity possible. Loved our short stay."
2024-06-01,5,Stayed one night,Our stay was just great! beautiful place. Very clean. we had everything we needed. thank you Bryce!
2024-06-01,5,Stayed with kids,This was a super cute and a perfect stay for my little family. We were just passing through but I wish we had gotten a weekend stay at this place. The views were breathtaking and we felt right at home inside. We even had some farm fresh eggs in the fridge!
2024-06-01,5,Stayed one night,Second stay there. If it’s available it’s going to be my go to when in town. One of the better airbnbs I’ve stayed at. Thanks much.
2024-06-01,5,Stayed a few nights,Had a great stay and the location was beautiful!
2024-06-01,5,Stayed a few nights,"Beautiful location, highly recommend"
2024-06-01,5,Stayed one night,"One of the best Airbnb I have been to. Well-equipped, scenic views, beautiful place, exactly the ideal American home I would love to experience."
2024-06-01,5,Stayed with kids,"As most guests have commented, the view of the valley and distant mountains is stunning. Friendly family and not too far out of town. Relaxed, cooked steaks purchased from the farm, and enjoyed omelettes with farm fresh eggs! Great stay."
2024-06-01,5,Stayed one night,"Absolutely gorgeous property and home, can’t recommend enough!"
2024-06-01,5,Stayed a few nights,"Great place to stay on their farm. Quiet, comfortable, plenty of space and feels like home. I enjoyed the country setting being right on the edge of Harrisonburg. Easy location and nicely furnished. Full kitchen area if you want to cook, which we did plenty of room for us and my kids came over to eat dinner with us.
They have a little toy box for kids. Some games and a puzzle if you just want to relax inside. This was my second stay and would stay again!!"
2024-05-01,5,Stayed a few nights,Perfect location for activities in Harrisonburg: close to the action but secluded and beautiful. Would definitely stay there again. Happy cows!
2024-04-01,5,Stayed a few nights,We had a wonderful stay in this gem of a place! The view simply cannot be beat. The apartment was spacious and had everything we needed. The hosts were so friendly and made us feel right at home. We absolutely loved seeing the cows up close! We will be back for sure!
2024-04-01,5,Stayed a few nights,"The view from the apartment was breathtaking- looking out towards the Shenandoah Mountains!
The apartment was inviting, comfortable, and well equipped with all we needed for our two night stay. We also enjoyed some delicious ribeyes we purchased and took home with us.
We would definitely plan to stay at Glendora Farms when traveling through Harrisonburg again!"
2024-04-01,5,Stayed one night,"Everything was very clean and well kept! Very private with great views. We bought a steak right from Bryce’s farm and cooked it that night in the apartment - delicious and fresh!
Would stay again!"
2024-04-01,5,Stayed one night,Gorgeous view! Great for our one-night stay passing through town.
2024-04-01,5,Stayed one night,Beautiful stay while my daughter and I visited local colleges.
2024-04-01,5,Stayed a few nights,"The listing was exactly as advertised. Plenty of space and beautiful views. Bryce responded to all of my messages clearly and quickly. We were always greeted by smiles and friendly waves, and we never felt like we didn’t have our own space."
2024-04-01,5,Stayed a few nights,Basement apartment was as described. His parents live above and they weren't loud and were very nice. Excellent location just outside of Harrisonburg. Great views.
2024-04-01,5,Stayed a few nights,"This was located on the edge of town in a working farm. Great view, quiet. Spacious with full sized appliances in the kitchen. Loved the country interior. The furniture is comfortable with extra blankets if needed. Room to unpack and hang clothes in the closet and a dresser to use. The place is larger than the pictures make it look. Already booked to stay again."
2024-03-01,5,Stayed a few nights,Excellent AirBNB. Easy access into town. Beautiful surroundings. Everything was clean and ready to use. I come into the valley on a regular basis. Will definitely stay here again if available. Thanks.
2024-03-01,5,Stayed a few nights,"Pictures don't due this place justice. Every direction you turned was beautiful. In the country, rolling hills, yet only a mile from restaurants and conveniences. The place was super cozy and quiet, adorably decorated and clean. Shenendoah National Park within a half hour's drive, so great hiking, great breweries, great coffee shops, etc.
We loved it!"
2024-03-01,5,Stayed one night,a grt place for the price. sure will come back
2024-03-01,5,Stayed a few nights,"This was a great stay for my partner and I, Bryce and Myron were super helpful and friendly. We stayed here while visiting Shenandoah National Park (which was a bit of a drive from the stay) and got to enjoy downtown Harrisonburg, and some delicious fresh steak! Definitely recommend this stay, as well as purchasing something from the barn."
2024-03-01,5,Stayed a few nights,"We loved our stay at the GlenDor Farm! The apartment is spacious and very clean, it's in a wonderful location near many restaurants, and the views are absolutely to die for! Wonderful stay-highly recommend!"
2024-03-01,5,Stayed a few nights,"The apartment was amazing. It was very quiet and while it is technically outside the city, it is very close to everything we did during our stay. If we return to the area for another visit we will definitely be staying here again."
2024-03-01,5,Stayed a few nights,"Loved, loved, loved Our stay on the farm! We stayed for a few days to celebrate Matts 30th birthday! Close to downtown and the local breweries but far enough away from noise! We bought some steaks from the barn and they were amazing!!! Plus seeing all the cows and the beautiful countryside was a plus! Everything was so clean and nice. We where worried that there would be a lot of noise because it’s a downstairs apartment but you would of never known anyone was home!
Thanks again, definitely will be coming back:)"
2024-03-01,5,Stayed one night,A little slice of heaven far away from home! Stunning views and cute cows roaming around outside. The apartment was spacious and very clean had all the ammenities of home
2024-02-01,5,Stayed a few nights,it is great! its super quiet!! its private enough to not have any noise at night but close enough to downtonw.
2024-02-01,5,Stayed a few nights,"The only problem was that we didn't receive a code from Airbnb. When I texted Bryce, he soon responded with the code. The apartment was nicely done and clean. I was not disappointed. I would stay there again."
2024-02-01,5,Stayed one night,"Hilltop was super clean and comfortable. We only stayed one night, but it would be a great place for an extended stay. And the absolute best part--the mountain views. Loved drinking my coffee at the kitchen table, looking out at the stunning landscape."
2024-02-01,5,Stayed with kids,We enjoyed an overnight stay at this lovely apartment overlooking the farm hillside with mountains in the distance. Everything was just as pictured and our host was most accommodating. Highly recommend. Hope to come back for longer visit sometime.
2024-02-01,5,Stayed one night,"Loved the location, great place to stay and enjoyed some cows!"
2024-02-01,5,Stayed one night,Great place. Close to town but small farm community
2024-02-01,5,Stayed one night,"The hilltop at GlenDor Farm was beautiful. From the sunset to the cows, it was a great stay that’s not too far from downtown Harrisonburg, but just far enough to get a peaceful stay."
2024-02-01,5,Stayed a few nights,A wonderful stay - was blown away pulling up the driveway. Bryce and his family were very hospitable and responsive. Highly recommend!
2024-01-01,5,Stayed a few nights,The views here are stunning!
2024-01-01,5,Stayed one night,"We enjoyed this place for our second stay. It has a spectacular view from its hilltop to the surrounding valley, superb in snow. More importantly for us it is sparkling clean, easy to get to, private and safe. Harrisonburg is a nice town with lots of good restaurants and a homey feel. We will most likely stay here again on our treks to see family in Philadelphia."
2024-01-01,5,Stayed one night,"We had a great night on the farm, the view is incredible and the steaks we arranged to have left in the fridge were delicious!"
2024-01-01,5,Stayed a few nights,"Gorgeous, close to Harrisonburg and a wonderful view of the farm and mountains! Can't beat it!"
2024-01-01,5,Stayed a few nights,The stay was very nice. The place is very peaceful and quiet with everything needed included.
2024-01-01,5,Stayed one night,Beautiful place!!
2024-01-01,5,Stayed one night,"Great place, very spacious!"
2024-01-01,5,Stayed with kids,Great and friendly hosts. The area is beautiful.
2024-01-01,5,Stayed a few nights,"As already indicated briefly: the view alone is well worth the price. The one sunrise was almost beyond belief--awesome! The ""apartment"" is spacious and could probably be advertised as such. The ""laundry"" was so nice and full-sized (though we didn't need it). The kitchen and eating equipment was wonderful and it even had a double-door frig. The sayings on the walls, etc. indicate that these owners are Bible believing folks but not overdone.
Also as already indicated briefly: the macadem driveway was a bit muddy--after the rain...due to cows, etc. And the well done steps down to the lovely apartment might be improved with a railing."
2023-12-01,5,Stayed a few nights,"Amazing views! I loved being in the country but still being just outside the city limits and only minutes from everything. The space was clean, had everything I needed and felt home-like. I always love having a washer and dryer in the unit, makes traveling so much easier."
2023-12-01,5,Stayed a few nights,"Such a beautiful place to stay! The place itself feels very private, it also has amazing views and the hosts cows love to say hello. I also love that it’s within 5-10 minutes of downtown Harrisonburg. It gives you the feeling of a private getaway but with options to go out without driving a further distance. Bryce was super nice and responsive, we also bought some breakfast sausage and steaks to make during our stay from their business and I highly recommend trying it! Would definitely consider staying again if I’m in the area."
2023-12-01,5,Stayed over a week,Very beautiful stay. Would stay again.
2023-11-01,5,Stayed one night,"Such a good place, nice view"
2023-11-01,5,Stayed a few nights,"Stunning, friendly hosts, and we will absolutely stay again"
2023-11-01,5,Stayed one night,"Great experience - beautiful view - nice space - would definitely stay here again.
I could go on in more detail, but wouldn't be saying anything different than the other reviews - this is a great space, with easy access to Harrisonburg. I highly recommend."
2023-11-01,5,Stayed one night,Lovely place with LOTS of space and a great view. Bryce was a very accomodating host and was great to chat with when we crossed paths.
2023-11-01,5,Stayed one night,We were way later getting in than anticipated but Bryce’s directions and instructions were perfect. Everything outside was well lit and easy to access. We had a short but peaceful stay and the views once daylight hit were amazing. Gorgeous! Highly recommend!
2023-11-01,5,Stayed over a week,"Bryce and the family are AMAZING hosts. This place is the best. We are already planning our trip back to the farm! The place itself is cozy and modern. The views of the hillsides are incredible. The host family is hospitable and warm. We got great food from the farm and recommendations for local restaurants and activities. The WiFi works well for remote workers. We stayed here for over 1 month, and we're so happy we did. The check-in and check-out process is seamless with our own door code: so no keys are required. There is plenty of space for parking. The location is close to all services, groceries, and a short trip to downtown. This Airbnb is a 10 out of 5. It is absolutely worth every penny of the price!"
2023-10-01,5,Stayed a few nights,"Best experience - the place is a diamond in the ruff. Beautiful scenery, exceptionally clean, and great communication."
2023-09-01,5,Stayed one night,"We enjoyed our stay, beautiful location, very clean and cozy."
2023-09-01,5,Stayed one night,"I have stayed in many airbnbs, and this is by far the best one to date. The view was breathtaking, the atmosphere was calming and peaceful, the apartment itself was spacious, clean, and welcoming. My partner and I enjoyed our stay thoroughly, and plan to come back again! Thank you so much to our hosts for having us!"
2023-09-01,5,Stayed one night,"Great communication and great location. This place is underpriced, in my opinion (I’m not complaining!). Thanks to Bryce for a great stay."
2023-09-01,5,Stayed one night,"We only were able to stay 1 night but hope to stay here again sometime.
The bed was comfortable, bathroom and kitchen had everything we needed.
Bryce was a great host and we even had a chance to meet him at the Harrisonburg Farmer's Market (and meet his dad on the way in and out - ""had"" to buy some of their grass fed beef at the small shop on their farm.) Also highly recommend the bread from their neighbor (Mill Song Bakery!)
As everyone also notes, the view is so so pretty - and it's fun to be on a property with such a nice family including grandkids."
2023-09-01,5,Stayed a few nights,Beautiful apartment near the center of Harrisonburg (car ride) with everything you need! With a fantastic view!! Host is quick to respond.
2023-09-01,5,Stayed one night,"I had a great time staying there. We ordered steak and patties from the farm and we were able to get it from the freezer directly in the apartment at our convenience after check in. The marbling on the ribeye was amazing.
Nothing beats waking up to that hill top view. I'd stay there again 100%. Amazing place to relax. Very quiet, clean, and peaceful. Incredibly spacious rooms, you won't find a better deal in the area."
2023-09-01,5,Stayed one night,Great space for a couple’s getaway. The view is beautiful!
2023-09-01,5,Stayed with a pet,"Look no further than this beautiful farm house for the perfect stay. From the beautiful view to the perfect simplicity and attention to detail, this is one of the best Airbnbs I've ever stayed in. I even had the pleasure to meet Bryce and his family and they were a delight. Stop looking, you've struck gold!"
2023-09-01,5,Stayed one night,"Bryce's place was lovely. We were joust overnight while traveling, but it was relaxing and perfect!"
2023-09-01,5,Stayed one night,"We would highly recommend staying here! Close to the amenities of the city, but quiet and peaceful with gorgeous views! We hope to come back!"
2023-09-01,5,Stayed one night,Gorgeous location with fantastic views. Every amenity was considered and provided. Definitely want to come back for a longer stay.
2023-09-01,5,Stayed a few nights,"It was absolutely lovely staying here. Beautiful views, quiet, kind and flexible owners, as described, and exactly what we needed. Highly recommend :) thanks again for sharing your space, Bryce!"
2023-09-01,5,Stayed one night,"Glendore Farm is worth the price if for nothing more than the incredible view. Throw in the spacious, clean, and comfortable apartment, and you have a winner. We stay in the area 2 or 3 times a year and no doubt we will book Bryce's place again."
2023-09-01,5,Stayed one night,We enjoyed our quick stay. It was very easy in and out. The space and view was wonderful.
2021-12-01,5,Stayed over a week,"My partner and I wanted to explore the Shenandoah Valley and stayed at the Airbnb for a month while working remotely. The internet was very reliable and the place had everything we needed and was very clean. We put the kitchen to good use and had all the necessary items to make our meals. The hosts were very respectful and attentive, they even apologized for making noise while their family visited for the holidays (which we totally understood, but still very much appreciated them checking in)! In terms of the views, they speak for themselves. We loved waking up to the beautiful mountains and cows roaming the farm. If we are ever in the area again, this will be the only place I will be looking to stay again in!"
2021-11-01,5,Stayed with kids,Place was beautiful. My family and I really enjoyed it. Everything we needes was there.!
2021-11-01,5,Stayed one night,"Just stay here. The apartment is huge and gorgeous, the views are incredible, the farm is awesome and the hosts are kind and attentive. Harrisonburg is charming, the whole thing- I'm running out of ways to describe how lovely the apartment is so just stay there and see for yourself. Can't wait to come back for a longer stay next time!"
2021-11-01,5,Stayed a few nights,The space is wonderful with a great view! Great amenities in a beautiful hilltop location.
2021-11-01,4,Stayed with kids,Beautiful view. Great space.
2021-11-01,5,Stayed a few nights,"This was a perfect spot. 5 minutes from downtown, clean, and private. Even though it was a basement apartment, you would never it was apart of the house. Definitely recommend"
2021-11-01,5,Stayed one night,"Pros
- Unmatched view! It was gorgeous! Try to be there during the day so you can watch the world go by. They even had binoculars near the main window!
- Quiet and comfortable.
- Everything looked new and clean.
- The apartment was extremely well-equipped. We gave the kitchen a good workout, and everything went well! Every small and large appliance we could have needed was there, with the exception of a dishwasher.
- Tastefully decorated, with beautiful and clever touches all over the place.
- Nice shower.
- Great communication with the hosts. We never saw them, but they were very accommodating to our wishes.
Information
The mattress was soft, like a cloud. If that's good for you, you'll love it! The bed also had a down comforter/duvet. :-)
The tall kitchen table seats three; they have plates and bowls for four; and the living room seats four.
Cons
None! This place is fantastic!"
2021-10-01,4,Stayed a few nights,Appreciated our stay here! The scenery was beautiful & the cows watching us pass on the driveway was quite cute & amusing! The unit had essentials for the stay and the check in process was very easy.
2021-10-01,5,Stayed a few nights,"Amazing views! Relaxing Location just outside of town, but close enough for food and errands."
2021-10-01,5,Stayed one night,The view of the mountains was wonderful.
2021-10-01,5,Stayed a few nights,Perfect!
2021-10-01,5,Stayed a few nights,All worth it for the view alone! Enjoyed the farm fresh eggs as well and stocked up on some beef. Very close to historical downtown area of Harrisonburg.
2021-10-01,5,Stayed a few nights,"Place is just as if not better than advertised! Kitchen is very well stocked, apartment was quiet and peaceful and huge! I could live there full time.
Having the washer and dryer was convenient as I’ve been on a month long road trip, the location is outside of town but close enough for errands or a night out. Enjoyed my stay and wish I had known about this place sooner."
2021-10-01,5,Stayed a few nights,We had the beat weekend ever! The hilltop apartment was perfect for our stay. It let me cook a home cooked meal for my college freshman that was missing mom’s lasagna and allowed us to spend some time together outside feeding the chickens and watching cows. Bryce helped us with buying some delicious steaks before we left. We look forward to our next stay at the hilltop apartment!
2021-10-01,5,Stayed with kids,"It was such a wonderful stay we wish we could have stayed longer! We're hoping to make it back again. Please know that the cows are ""out"" but they are supposed to be. We were concerned when we saw one next to the driveway but they are kept in by the metal grates you drive over! It's very cool and you get to see them pretty up close first thing in the morning."
2021-10-01,5,Stayed a few nights,This was my second stay at Glendor Farms because I needed a little getaway as I work remotely! I absolutely love the apartment and the view. It’s so peaceful and quiet and relaxing but a five minute drive from downtown. I always appreciate how clean and comfortable the space is. And of course the farm fresh eggs and lots of coffee. Thanks Bruce!!! I’m sure I’ll be back a bunch.
2021-10-01,5,Stayed a few nights,This was an excellant choice for us. The location was convenient; privacy was great; the view is wonderful! The furnishings and appliances are very clean and up-to-date. We would definitely recommend Hilltop Apartment.
2021-09-01,5,Stayed a few nights,"Bryce's hilltop apartment is amazing! I cannot imagine having a better view of the surrounding mountains. The space was very clean, comfortable and well-kept. He had everything that we could have needed for our stay, including farm fresh eggs in the fridge, which we thoroughly enjoyed for breakfast. Communication responses were quick and Bryce answered all of our questions. We also purchased some meat from the farm and are looking forward to enjoying that very soon. I would highly recommend staying here and we look forward to booking with him the next time we are in town."
2021-09-01,5,Stayed a few nights,"What a lovely spot! Convenient to town but with a country feel and gorgeous views. It was a treat to have country fresh eggs for breakfast (waiting in the fridge) then sip coffee while watching the sun rise over the mountains and the cattle graze in the field. The apartment is comfortable, with a full kitchen and nice living area. The self check-in is nice when traveling a distance and not sure of arrival time. Appreciated the quiet and privacy of this location. Thanks for sharing your beautiful and comfortable space with us, Bryce! (thanks to the chickens too!)"
2021-09-01,5,Stayed a few nights,Perfect.
2021-09-01,5,Stayed one night,"We loved Bryce's place! It was the perfect place to stay during our visit to JMU. It was clean, comfortable and spacious. We really enjoyed walking around the farm, and the beautiful view. We can't wait to return!"
2021-09-01,5,Stayed with kids,Had a very relaxing stay. Very clean.. farm fresh eggs & sausage were a hit with my little one. Have already recommended to family & friends. The sunset view is absolutely stunning.
2021-09-01,5,Stayed one night,We loved our stay at the apartment. It had everything that we needed. And the view was awesome! Thanks Bryce!
2021-09-01,4,Stayed a few nights,Very pretty setting.
2021-08-01,5,Stayed one night,Beautiful sunset and an excellent space!! I would definitely book again!
2021-08-01,5,Stayed one night,"Breathtaking views, great location, extremely clean, quick and efficient communication! Highly recommend!"
2021-08-01,5,Stayed one night,Beautiful location and clean apartment. Would definitely stay here again.
2021-08-01,5,Stayed with kids,The apartment is on the top of a hill overlooking the pastures for a beautiful view. It is ideally located freight outside of town. The apartment has all the necessities and is well kept.
2021-08-01,5,Stayed a few nights,Nice apartment with a beautiful view. It has all you need for a comfortable staying. The hosts were really nice to us and the nature is gorgeous.
2021-08-01,5,Stayed with kids,"This place is a gem! It’s perfect for a “layover” in the middle of a road trip, private, and has a spectacular view! The sausage and eggs breakfast fixings are an incredible extra touch. Highly recommend giving this stay a try!"
2021-08-01,5,Stayed one night,"Bryce is a great host with a beautiful home. Provided detailed instructions, and lists of local food / attractions. Was very flexible with our check out time which was helpful as we were in the middle of a big move. Would be happy to stay with again !"
2021-08-01,5,Stayed a few nights,A great place to stay!
2021-08-01,5,Stayed with kids,"They have a nice, well kept, and very clean apartment overlooking farm country in the Shenandoah Valley. The view is amazing. Overall, this is a great spot and we would highly recommend."
2021-08-01,5,Stayed one night,The farm fresh eggs in the fridge were a tasty bonus!
2021-08-01,5,Stayed a few nights,Wonderful view of the valley with cows to watch meander around.
2021-08-01,5,Stayed one night,Beautiful views!!! Great place for the price and will be back!
2021-08-01,5,Stayed a few nights,.
2021-07-01,5,Stayed one night,This place is so nice love the farmland sunsets are absolutely gorgeous the sausage and eggs in the morning were delicious will be staying here again hopefully soon
2021-07-01,5,Stayed a few nights,This place was very clean and felt very comfortable to stay in! Nice views and very calm.
