date,rating,note,review_text
2019-11-01,5,Stayed a few nights,"Howard was a terrific host! The Urban Oasis Studio was wonderful!! It was warm, cozy very clean and filled with everything from fresh baked goodies, to common staples that you may need if you like to cook. He was available if I needed anything and made my very first stay in an Airbnb a real delight."
2019-10-01,5,Stayed a few nights,Very clean and neat. Great amenities.
2019-10-01,5,Stayed a few nights,"The Urban Oasis is fantastic. There are several thoughtful touches that Howard includes in his place; such as a small basket of baked cookies and scones that are yours to enjoy. His place is sparkling clean throughout, and you can tell he takes pride in his property. The shower and bathroom are immaculate with great water pressure, and draining. Howard was respectful of our privacy we felt free to come and go as we pleased through the private entrance into the bottom of the unit. There is a door between the bottom floor and the upper floor that has a chain installed on both sides to give you an added sense of space which I appreciated. Should I ever be in the area again the Urban Oasis is going to be the at the top of my desired places to stay!"
2019-10-01,5,Stayed a few nights,"Urban Oasis was a wonderful place to stay. Every review before mine is accurate. Howard has made this a very comfortable, clean and homey place with many added touches (cookies and scones to name a few)! I would recommend it to anyone."
2024-06-01,5,Group trip,We had a great stay and highly recommend it! The location was great for us to see local family and it was close to food and shopping! Easy on and off the highway also! It was the perfect size for our family and had everything we needed.
2024-06-01,5,Stayed with kids,"We felt right at home with all the special touches. Every detail was carefully thought out and planned for a perfect stay. The cottage was very clean and had a peaceful setting with beautiful views of the mountains. Eliot was a fantastic host! We will definitely come back for a stay, and highly recommend “Martin Cottage” to any family visiting the Shenandoah Valley."
2024-04-01,5,Stayed a few nights,"Our family had an absolutely wonderful time staying at The Martin Cottage. It's such a cozy, beautiful, well appointed, home away from home!!! Eliot has certainly thought of everything a guest could possibly need or want. I highly recommend it to all who may be looking for a get-a-way in the Harrisonburg, VA area!!! Thanks Eliot for opening up your beautiful home to us!!!"
2024-04-01,5,Group trip,"This is a beautiful and spacious home! Our family of 5 had plenty of room to spread out and relax as well as spend time together. The bedrooms are large and there are 2 living areas to relax and have fun. We were able to prepare full meals and eat together at the large dining table. We were visiting our daughter at JMU. This home is just a short drive to Harrisonburg and minutes away from grocery, gas and restaurants. Eliot was a great host making sure that we had what we needed for our stay. We will definitely stay here again. Thank you, Eliot!"
2024-04-01,5,Stayed a few nights,"Beautiful and had everything one would need.
Extremely clean and welcoming.
Would highly recommend to others!"
2024-04-01,5,Group trip,We had a great weekend. Eliot went above and beyond! Highly recommend!
2024-03-01,5,Stayed a few nights,Fantastic place to stay!
2024-02-01,5,Stayed a few nights,"This house was perfect for our family. We played so much ping pong and had a great time relaxing playing games. The space was perfect for us to all hang out together.
Eliot thought of everything. Hooks, plenty of towels, bathroom toiletries, etc.
And the coffee bar was awesome!"
2024-01-01,5,Stayed a few nights,The perfect stay close to JMU with breathtaking views of the valley! The space was amazing and offered everything you could need for an enjoyable stay. We will be back often!
2024-01-01,5,Stayed with kids,"We enjoyed our stay this weekend, great location for visiting JMU and taking the kids snow tubing at Massanutten. Quiet, clean and lots of welcoming touches. Recommend!!"
2024-01-01,5,Stayed a few nights,"6 STARS!!! Extremely clean, well maintained, and thoughtfully appointed and accomodating for our family gathering. Eliot took extra care to provide for the things that might be needed for a longer family stay. Eliot also reached out several times to be sure we knew how to check in and that all was ok. Great place, and we will be sure to stay there again!"
2023-12-01,4,Group trip,We had a great stay. The house was a great place where we could meet up as a family. The instructions and information about local restaurants and venues in the area also was helpful. The amenities provided were also great! Highly recommend.
2023-12-01,5,Stayed with kids,"Stayed here for JMU graduation weekend and we couldn’t be happier with our stay! We have a family of five with kids ranging from 3-18 and there was something for every age in the house. It had the right bit of everything one might need when borrowing a house. So many thoughtful details and everything felt brand new and fresh. Eliot welcomed us even before we arrived and made the process so easy throughout our stay. The location is on a road without a sidewalk so no walking to anything-however, it was such a short, easy drive to campus and downtown with great places to eat! We loved staying here and would definitely book it again next time we are in town!"
2023-12-01,5,Stayed a few nights,Awesome place! The cottage was beautifully renovated with so many high-end amenities. We loved the coffee bar. Hope to stay here the next time we visit Virginia. Thanks for everything Eliot.
2023-12-01,5,Group trip,"Had an amazing time staying at the Martin Cottage! Beautifully decorated, spotless and comfortable. Eliot has thought of everything including makeup wipes, toothpaste, contact solution, etc in case you forgot anything. Love the chocolate surprise!"
2023-11-01,5,Stayed a few nights,This place was great .It exceeded my expectations in quality and amenities.Eliot made sure this was a five star experience.Would rent again when in the area.
2023-11-01,5,Group trip,It’s a great place to stay. We had a good time.
2023-11-01,5,Stayed a few nights,Great communication! Property was perfect for our needs! Recommend to any guests.
2023-11-01,5,Group trip,"The Martin Cottage was the perfect place for our weekend getaway! The house was clean, spacious, and beautiful and Eliot was great at communicating information and replying in a timely manner. You can definitely tell that he went above and beyond to make sure we felt at home during our stay. This is the perfect place for groups visiting Harrisonburg!"
2023-10-01,5,Group trip,"The Martin Cottage was filled with beautiful simple touches that made our weekend wonderful! The location is about 8 miles from the JMU Campus- a short/easy drive!
We had 2 couples for the weekend but could easily have had 3 couples. There is a beautiful view from the deck and everything was set up so thoughtfully! The place would also be great for a family with children who
would have a very safe backyard to enjoy!
Lots of games and some toys too! There is a corn hole game available for use and a ping pong table!
The Martin Cottage is a Great place to stay!
It is necessary to have a car."
2023-10-01,5,Stayed a few nights,"My husband and I loved staying in this lovely home. It was near Harrisonburg and not far from the many orchards in Winchester. The house was clean and up to my expectations even though I am very picky about cleanliness. The house is decorated like a home not like staying in a spartan hotel room. Eliot responded quickly and friendly if we did have a question. We were also pleased that the house had everyday needs such as trash bags, detergent, cleaners, coffee, and etc.
We hope to stay again when we are in the area."
2023-10-01,5,Stayed with kids,We stayed here for my wife's birthday and saw family that were in town. The place was perfect! Exactly the experience you want with an Airbnb. 10 of 10 would recommend!
2023-10-01,5,Stayed a few nights,"Eliot was very responsive and timely. The place was well stocked and clean. Arrival instructions were easy and clear. Our family had a great weekend! Thank you so much, Eliot"
2023-10-01,5,Stayed with kids,"This is by far the best Airbnb I’ve ever stayed. I have been staying at airbnbs for along time, and this place is by far the greatest. The place is well laid out. The basement was an amazing place to hangout if you are coming with a large group. The place was spotless and with loads of extra comfort items. Playing ping pong and corn hole with the family made our evening’s more engaging. The host is always easy to get ahold of. I could go on and on. Thank you for going above and beyond."
2023-10-01,5,Stayed with kids,"Eliot thought of everything! We did not need anything that was not provided. Comfortable beds, sparkling clean, and so cozy! Eliot was easy to contact and responded quickly. We would love to return some day."
2023-10-01,5,Stayed a few nights,"Eliot’s place was great, with comfy beds, lots of space, comfortable furniture and a fully-stocked kitchen. The coffee bar was great too! Eliot was a great communicator from booking to check-out. Eliot has a book with local recommendations and it came in handy throughout our time there. The chocolates left for us was an unexpected treat! I asked for a place to walk and the park Eliot recommended was great! We would highly recommend Eliot’s place in Harrisonburg."
2023-10-01,5,Stayed a few nights,The place was great! Exceeded my expectations.
2023-09-01,5,Stayed with kids,"I 100% recommend it
It will be the best decision they make regarding the place. Everything was lovely, my kids really enjoyed it.
We appreciate your stay. It was a success."
2023-09-01,5,Stayed with kids,"The Martin Cottage exceeded my expectations. The house was clean and spacious, and having three full bathrooms was priceless. Eliot’s communication was spot-on. This home will be my number one choice for accommodations when visiting the Harrisonburg area in the future. I’m hoping it will always be available. *fingers crossed*"
2023-08-01,5,Stayed a few nights,This is great place. Maybe the nicest Airbnb I’ve ever stayed in. Thoughtfully renovated and furnished. Very clean. And Elliot was fantastic. Super clear and responsive communicator.
2023-08-01,5,Stayed a few nights,"We needed a last minute rental and Eliot was fabulous. His communication before, during, and after was so professional and prompt. The cottage is beautifully decorated, clean, and comfortable. There are so many extras to make your stay relaxing and enjoyable. We've rented quite a few times with Airbnb and other platforms and at various locations; this was the best ever!"
2023-08-01,5,Stayed a few nights,"A very clean and comfortable cottage. We enjoyed sitting on the deck in the mornings, sipping our coffee and loving the view."
2023-08-01,5,Stayed a few nights,"We enjoyed our stay at the cottage while moving our son into college. House was beautiful, comfortable and lots of room to spread out. The host was responsive and flexible."
2023-08-01,5,Stayed a few nights,"Our stay at the Martin Cottage was super! Eliot is a thoughtful host, in every sense. The house is tastefully decorated and extremely well-equipped, including lots of dishes, mixing bowls, pots and pans , cleaning supplies, travel items a guest might have forgotten, extra linens, etc. The “coffee bar” was ideal, complete with Peet’s coffee!
We also very much appreciated access to Netflix et al on TV. Loved the small deck looking over the back yard field below, especially when the traffic was light.
One more very important aspect of Eliot’s place is the lower level full of games, ping pong and even cornhole.
We heartily recommend the Martin Cottage!
Bonnie & Ernie Smith
Zionsville, IN"
2023-07-01,5,Stayed a few nights,"This was our first time staying at an Airbnb and Martin’s Cottage has set the bar really high! Our family went on out first vacation since the pandemic to the Shenandoah Valley and this home really made our vacation complete. We loved how homely the house felt because of it’s location and how everything was set. Our family loved getting coffee in the mornings and sitting in the front porch and just talking and relaxing with each other. Moreover, Eliot was an incredible host and was always in touch with us throughout our stay! Our family thoroughly enjoyed our stay at this house and will definitely be coming back again soon!"
2023-07-01,5,Stayed with kids,Very well appointed home with lots of unexpected extras and nice touches. We especially loved the guide to local spots and visited several!
2023-07-01,5,Stayed with kids,it is a nice place to stay and enjoy
2023-06-01,5,Stayed a few nights,Fantastic host. They have thought of everything to help make your stay feel just like home. Very comfortable and the extra attention to detail and little amenities were wonderful. True blessing to spend time with family in this beautiful yet cozy home.
2023-06-01,5,Stayed a few nights,"Eliot was an extremely helpful host, the home was beautiful and clean. I felt right at home, he even left us a local treat! 10/10 recommend"
2023-06-01,5,Stayed with kids,Elliot's place is beautifully decorated! He has thought of so many details that are very accommodating. It was very easy to communicate with Elliot. We would definitively stay there again and have already recommended it to friends.
2023-06-01,5,Stayed with kids,"I just stayed at Eliot's place this past weekend and I have stayed at tons on Airbnb but this was by far one of the best places I have ever stayed at. The pictures do not do it justice - the place is absolutely beautiful and the amenities - he had EVERYTHING you could think of.
I will definitely stay there everytime I go back home to Harrisonburg."
2023-06-01,5,Stayed a few nights,"Our short stay was made phenomenal, cozy and fun thanks to your beautiful home. Thank you for thinking of everything your guests could possibly need from: q-tips and lotion, to a pen to fill out Cards, tape to wrap our gifts and toys for kids (my 2.5 yr old loved the toy box of goodies lol). The guidebook you created was also super cute and informative.
Looking forward to booking with you again the next time we’re in the Harrisonburg area."
2023-05-01,5,Group trip,"We loved our stay at The Martin Cottage! It was a peaceful area, just a few minute drive away from downtown Harrisonburg. The house is decorated beautifully and Eliot has thought of every amenity and nice touch to make his guests’ stay enjoyable. The coffee bar was a highlight! Eliot was easily to reach and very accommodating.
The only downside was that there wasn’t a door between the main level and the basement. So, in the morning, the people upstairs had to be super quiet to try to not wake up the people who were sleeping in the basement. (But if you all woke up at the same time, or didn’t have people sleep downstairs, it wouldn’t even be a problem.)
Bottom line: I highly recommend it. We had a great stay!"
2023-05-01,5,Stayed with kids,Very nice and clean house. We had a wonderful stay.
2023-04-01,5,Stayed with kids,"Eliot was very communicative and proactive. The place was lovely with lots of games, books, puzzles. Lots of extra amenities in case you forgot something small. Beautiful view as well- would definitely stay again!"
2023-04-01,5,Stayed a few nights,"The house was beautiful.. Also had every amenity imaginable. Eliot is a great host, and responded within minutes to any questions we had. We'll definitely be back."
2023-04-01,5,Stayed a few nights,"Great place to stay!! Adorable, clean and very welcoming house! Loved the coffee bar! The basement was great - the many games, ping pong and cornhole were a bonus! Lots of space to spread out! Will def stay there again!"
2023-04-01,5,Stayed a few nights,"We loved staying at the Martin Cottage.
The location was great. In addition, the house was beautifully furnished, comfortable, and well stocked with anything we may have needed. The hosts have paid great attention to the guest experience, and it shows.
We hated to leave and look forward to returning."
2023-04-01,5,Group trip,"Really enjoyed staying here while in town for a wedding and showing some friends around Harrisonburg. Was an ideal space for our group with 6 adults, loved playing ping pong in the basement!"
2023-03-01,5,Stayed about a week,"Eliot’s place was the perfect get away for us. It was clean, comfortable, & exactly as described. We had all we needed in the kitchen for cooking and had fun with the games provided. We would definitely stay again!"
2023-03-01,5,Stayed a few nights,Eliot was very communicative to ensure that we had the best weekend. The house was exactly as pictured- extremely clean and well-stocked and located close to town. One of the best Airbnbs we’ve stayed in!!
2023-03-01,5,Stayed a few nights,"We stayed March 4-5 and the house was just perfect for our needs. It was clean, spacious, nicely decorated, convenient to shopping and JMU. Eliot was a wonderful host and very responsive with any questions we had. Would definitely stay here again in the future!"
2023-03-01,5,Stayed a few nights,"It was an awesome treat to stay at the Martin Cottage --thank you to Eliot and his wife for such a welcoming and ""home away from home"" stay!
The surroundings are beautiful --a delightful country setting, just a few miles from James Madison University. I ran on the main road that leads to The Cottage, and even though it's a busy road, I felt safe. Views on my run included rolling hills, lots of cows, bubbling brooks, historic churches, and gorgeous sunrises.
Eliot and his wife go out of their way to provide amenities -from coffee to goodies at check in, and everything was very clean. There is lots of room to enjoy at The Cottage, so it would make a great place for a family get away. ~ I was there for a work related trip and needed excellent wifi --The Cottage did not disappoint :--)
I highly recommend not only The Cottage, but Eliot and his wife as hosts. <3"
2023-02-01,5,Stayed with kids,My family truly enjoyed our time at The Martin Cottage. Elliot was a great host and thought of everything necessary to make our stay comfortable. The proximity to skiing and JMU was great. Our kids loved the ping pong table!
2023-02-01,5,Stayed a few nights,This place was amazing!! Highly recommend! Super clean and modern very homey and beautiful views
2023-02-01,5,Stayed a few nights,"Our stay at the Martin Cottage was wonderful! From the moment you step into the front door, you feel at home. Even though we never met, Elliot was so friendly and communicative. The amenities were beyond expectations. The house was immaculate with beautiful decor. My husband and son especially loved the ping pong table! I could go on forever about how much we loved this house! We will definitely be back when we can and will definitely recommend the Martin Cottage to all of my friends!"
2023-02-01,5,Group trip,This house was just wonderful. So peaceful and beautiful window views. A great private get away to spend some time alone with family and friends. The home looked exactly like the pictures. The host was great. Everything was amazing. 10/10 stay!
2024-06-01,5,Stayed a few nights,Best airbnb ever! So clean and comfortable! Everything was perfect and felt like staying my own house.
2024-02-01,5,Stayed with kids,"Such a wonderful place to stay. My son and I (he is 4) loved playing with the dominos! She has other multiple board games too which is nice. Her pantry was stocked with lots of food, we didn't use any but it was there for us. Ice cold filtered water in the fridge. Comfy bed, and the shower was fun too."
2024-02-01,5,Stayed a few nights,Carrie's place was great! It matched the description exactly and was spotless. Very nice area with plenty to do.
2024-02-01,5,Stayed a few nights,"What a great place to stay! Clean, comfortable, quiet, and relaxing. Literally had on hand anything we couod have needed. Water pressure and temperatures were great and drains effective, washer and dryer were convenient for 1 load of laundry. We were just regretting not staying an extra nighr! Also good communication from host."
2024-02-01,5,Stayed a few nights,Carrie is a top notch host! She is very responsive to questions and very accommodating. I will definitely rent from her when I'm in the Harrisonburg area!
2023-12-01,5,Stayed with kids,"The apartment is amazing! Expertly clean, and so cozy!!
Truly a place for healing and comfort!!"
2023-12-01,5,Stayed a few nights,"c arrie's place was just what i needed. everything was just right: location, enviromennt, easy access to everything wether by car or on foot. would stay again. Carrie is a people person. One of the best units i've stayed in."
2023-12-01,5,Stayed a few nights,delightful stay - even had some snow to show off the mountains on the day we left. We would definitely stay here again - just what we needed to relax while visiting family in the area.
2023-12-01,5,Stayed a few nights,Apartment was exactly as portrayed. Very clean and it had everything we needed. We had a great stay and would definitely stay here again!
2023-11-01,5,Stayed a few nights,"Carrie’s apartment was exactly as advertised. Check-In and Communication was great. If you are in the area, this is a perfect place to stay."
2023-11-01,5,Stayed a few nights,"Very nice and cozy apartment. Fully equipped kitchen. Very nice and large outside area. Parking in driveway.
Very nice and fast communication, we were able to check in at short notice one day earlier."
2023-11-01,5,Stayed a few nights,It was a peaceful little getaway. It was perfect. Everything was so clean and well maintained. Will recommend to friends.
2023-11-01,5,Stayed a few nights,Carrie's place was beautiful and very quiet! Very clean! Carrie was always available for us! Really enjoyed our time there and look forward to coming back again. Would recommend this place to anyone!
2023-10-01,5,Stayed a few nights,We stayed for two nights and couldn’t be more pleased with everything about this apartment. It was easy to access and had everything explained and in order. We certainly recommend this apartment.
2023-10-01,5,Stayed a few nights,"Carrie’s place is one of the best Airbnb spots we’ve ever stayed at, clean, cozy, and convenient! We needed a place to stay while visiting our son, daughter-in-love and two little granddaughters, a place to rest and relax after spending each day with them and Carrie’s space provided that and more.
Her home is in such a beautiful and quiet area, yet minutes away from anything you might want to do or see in Harrisonburg and the surrounding area. The kitchen was well-stocked with essentials, the bed and linens were beyond comfortable and the shower – wow! We also appreciated the perk of having a washer and dryer in the unit, first time ever in an Airbnb for us and it came in very handy.
We highly recommend Carrie’s “Spacious & Bright 1 Bedroom Apartment”!"
2023-10-01,5,Stayed a few nights,"Nice, clean space. Comfortable bed. Good water pressure with high shower head. Convenient to JMU."
2023-09-01,5,Stayed over a week,"I rented the apartment for a month after finding out the regular apartment we just leased for my daughter who is starting grad school wouldn't be ready for the first month of the fall semester. Carrie was so gracious and helpful, and her apartment was great. It's in a peaceful and quiet neighborhood, and it was close to the James Madison University campus. Carrie provided everything our daughter needed, and she above and beyond. She is definitely and Super Host, and I'll definitely rent from her again."
2023-08-01,5,Stayed a few nights,"Great location near all the things you would want to do in and around Harrisonburg. Space was well appointed, super clean, and quiet. The host was timely with communication and follow-up. Would highly recommend to anyone looking to stay in this area. The 5-star status is legitimate!"
2023-08-01,5,Stayed over a week,Carrie is an amazing host. She is accommodating and kind. Our stay was most comfortable and we would recommend Carrie’s listing to guests who are visiting Harrisonburg. Thank you Carrie!
2023-07-01,5,Stayed about a week,Carrie was a fantastic host! Will certainly be coming back when I visit JMU again.
2023-06-01,5,Stayed a few nights,"This downstairs apartment in a quiet neighborhood had its own driveway and entrance. It was clean, very spacious, and well appointed. We used it as our base of operations for the 3 day Harrisonburg portion of the 2023 Bike Virginia cycling tour. It worked out perfect for us. It was just minutes away from the tour HQ at Hillandale Park and the surrounding Shenandoah Valley countryside was perfect for cycling. Carrie was a great host. Highly recommend."
2023-06-01,5,Stayed a few nights,"when you need an accomodation in Harrisonburg VA, dont think twice: Carrie's house is a must! :)"
2023-06-01,5,Stayed a few nights,The place was so clean and comfortable. The neighborhood was quiet and beautiful. It was also close to many amenities and we would highly recommend the space:)
2023-06-01,5,Stayed a few nights,"This was a wonderful stay in a spotless, comfortable apartment with a well equipped kitchen. Enjoyed walking in the area including watching a full moon come up over the eastern mountains. Highly recommend this site!"
2023-05-01,5,Stayed a few nights,"Located in a nice neighborhood, the place is very clean, comfortable, and well-equipped with most anything that you'll need."
2023-05-01,5,Stayed a few nights,"exc
Clean, bright, spacious, an excellent stay. will stay here again."
2023-05-01,5,Stayed a few nights,Beautiful place and family!
