date,rating,note,review_text
2023-10-01,5,Stayed a few nights,"Beautiful home and location. Beds were so comfortable, husband made note of the brand for our next mattress purchase! The layout of this home is wonderful with every bedroom away from the main living spaces. Kitchen and bathrooms have everything you need! This was my first air b&b rental - will definitely book again. I recommend this home to anyone, especially family wanting to be all together or for large groups - plenty of space for
Privacy and also for gathering."
2023-09-01,5,Stayed one night,"Great place, lots of room, loved it! A+++"
2023-09-01,5,Stayed a few nights,"This home was perfect for our stay. Clean, wonderful location, and AJ was great with communication. This property featured everything we needed for our Grand-daughter and coffee for us ( a must). We look forward to staying again when we are in Hays again.
Denise and Steve"
2023-09-01,5,Stayed with kids,Very nice house. Lots of room for our big family to relax and visit. The hosts were very flexible with our schedule. Enjoyed our stay!
2023-09-01,5,Stayed with kids,"Great, large house in a great location! Very clean and newly done! Very cute and a great place to stop on the way to CO."
2023-09-01,5,Group trip,This place is awesome! Love the space and location and would stay here again.
2023-09-01,5,Stayed with a pet,Nice place to stay. High quality and was feasibly priced for a larger group of people to split. The hosts were very responsive and helpful.
2023-09-01,5,Stayed with a pet,amazing house
2023-09-01,5,Group trip,This place is amazing. We absolutely loved it
2023-09-01,5,Group trip,"BEST home that we’ve stayed at! Loved the quiet neighborhood, fenced in back yard and the house was just beautiful. SO cozy and clean. AC keeps the house so cool. The home is stocked better than I’ve ever seen. Ample towels and paper goods. Fully stocked kitchen, TV’s in some of the bedrooms was a great touch, SUPER comfortable beds. AJ and others were amazing at communicating and flexible with our stay. We only had our family of 6, but would house the maximum amount perfectly with a huge table for board games and fun. Wi-Fi is lightning fast. 10/10 recommend!!"
2023-08-01,5,Stayed a few nights,Our stay at this home was great. The house was very clean and had nice decor. We came for a girls' weekend and had plenty of room to spread out and loved the layout of the house. The hosts were great at communication. The neighborhood was nice and quiet. We all agreed that we'd stay here again.
2023-08-01,4,Group trip,Awesome place for a family or friends!
2023-08-01,5,Stayed with kids,Very nice place to stay
2023-08-01,5,Stayed with kids,"Beautiful, recently updated or renovated house in a fantastic location."
2023-08-01,5,Stayed with kids,"This home was beyond beautiful!
Loved everything about it. Everything was very clean and host was amazing.
I highly recommended this place."
2023-08-01,5,Stayed with a pet,"Wonderful house! Very clean and quiet. And we loved the kids toys, dishes, and the crib! Thank you for the great stay!!"
2023-07-01,5,Stayed with a pet,"Circumstances would dictate that my wife, dogs, and one year old had to make an unexpected stop in Hays. We were so thankful to have found AJ's place! This home IS AS advertised! We would love to stay here again!"
2023-07-01,5,Stayed with kids,This home was lovely and was extremely spacious. We booked this last minute and we are so happy that we found this place since we make this trip about once a year. I would highly recommend!
2023-07-01,4,Stayed with a pet,"Nice quite neighborhood, great space and nice finishes and amenities."
2023-07-01,5,Stayed with a pet,"This home has it all! The neighborhood is very peaceful. The home is beautiful, spacious, and spotless! On a 2 week road trip across the USA, this was the most restful night we had. Thank you!!"
2023-07-01,5,Group trip,This was a perfect rental for our family during our weekend stay in Hays. It was close to everything. Neighbors were kind and helpful and the house was clean and had ample room for our families to stay in one place. It doesn’t have a ton of kitchen supplies that you find in older Airbnbs but the primary equipment to cook meals is present. We will book again next time we are in town! Great rental!
2023-07-01,5,Stayed with a pet,"This place is so lovely! I was on a road trip with the family and pets and this house was just perfect. It was relaxing, homey and just what we needed to recharge. We felt like ourselves again after our stay which says a lot when you taking a road trip with babies and furry family in tow. The hosts were responsive and the house was neat and beautiful. Next time we are running through the area we will definitely stay here again! Thank you hosts and thank you house!"
2023-07-01,5,Stayed with kids,"We were in town for a softball tournament so we wanted something that felt at home. This was perfect. It was kid friendly, plenty of room, beds were so comfortable. we had late nights at the field but slept like babies. We appreciated having bathroom items as backups as well. If we return, we will definitely be looking to stay again."
2023-07-01,5,Stayed with a pet,"Incredible stay! The house was clean, functional, and spacious. Looks just like the photos. The house was fully stocked with snacks, water, toilet paper, towels, soap. The host was very responsive. They were so kind and even had a pizza for us as we got in late after a long day of driving."
2024-06-01,5,Stayed with kids,"We really enjoyed staying here! Everything was clean and cozy and felt like we were staying at a friend’s home. We loved all the thoughtful extras, how everything was organized and labeled and just the overall decor of the home. Great hospitality 💛"
2024-06-01,5,Stayed one night,This was our 2nd stay at the Casita traveling from Alabama to Colorado. We planned our route just so that we could spend the night there. We’ll be back and next time will get into Hays earlier so that we can enjoy the lovely town. The Casita is super comfortable and offers all the amenities of home.
2024-06-01,5,Stayed one night,"great spot! host was very communicative & the place was nice, clean, & cozy. loved that i could walk to restaurants. would stay again"
2024-06-01,5,Stayed a few nights,Very nice place to stay!!
2024-06-01,5,Stayed one night,Lovely overnight stay.
2024-06-01,5,Stayed one night,Love the place!!
2024-06-01,5,Stayed one night,"Erin’s place was great! It was just like the pictures, clean, and quiet. Erin responded quickly to any questions we had. We would definitely book again."
2024-06-01,5,Stayed one night,We stayed at Erin's for a night on our journey to the west. The apartment was well-equipped and beautifully decorated.
2024-06-01,5,Stayed a few nights,"This was our second stay at The Casita. It feels so homey. We enjoyed both visits.

The bed is comfortable, cupboards are well stocked. For a long stay like ours, the washer and dryer were a big plus.
Erin is a great host."
2024-06-01,5,Stayed one night,Very relaxing and nice. Would definitely come back if we are in the area.
2024-06-01,5,Stayed one night,"La Casita feels like a warm hug from your grandmother or an old friend! The fixtures are retro and the vibe is warm and inviting. I have stayed at several AirBnB places and this one is a favorite. It is a fully furnished apartment in which one (or two) could be quite comfortable for an extended stay. The bed and linens were very comfy! The neighborhood is quiet and the homes all are well cared for. It is within walking distance to Main Street Hays where one can enjoy a meal, or an art gallery, or visit one of the local shops or the library. I did not meet Erin, but she was flexible and communicated well. I recommend La Casita wholeheartedly!"
2024-06-01,5,Stayed one night,Great place! Lots of cozy touches and just a really comfortable and safe place. Highly recommend.
2024-05-01,5,Stayed with kids,Great place for my daughter and I to stay for a softball tournament!
2024-05-01,5,Stayed a few nights,"This listing was cute, clean, comfortable, and well-stocked."
2024-04-01,5,Stayed a few nights,"Great one bedroom rental unit above garage. Private, clean and very nice. Accommodations were nicely decorated and amenities like fresh water and coffee were appreciated."
2024-04-01,5,Stayed one night,"Beautiful, clean and homey! It was a quick stay for me but I'd stay there again in a heartbeat!"
2024-04-01,5,Stayed one night,Erin is a very attentive host. Her place is very cozy and has everything you need! I was very comfortable and wish I could have stayed longer!
2024-04-01,5,Stayed one night,"Really enjoyed this stay, very clear expectations and instructions!"
2024-04-01,5,Stayed one night,Great place to stay! Very thoughtfully put together and we had everything we needed.
2024-04-01,5,Stayed one night,Convenient location. Affordable and great fast response from host.
2024-04-01,5,Stayed one night,"Such a cozy and charming little airbnb above the garage of an equally charming older home. We felt right at home and both commented we felt like we were having a sleepover at grandma's- it was just that delightful. Erin has added many thoughtful touches to make for a wonderful stay. The location must be close to train tracks, as I heard it pass by a couple of times in the night. My husband slept right through it, but next time I'll be sure to bring some earplugs. This darling airbnb is an excellent value for the money. Thank you Erin for a lovely stay!"
2024-04-01,5,Stayed a few nights,Thank you Erin! Your place is beautiful and homely! This is our second time staying here and will stay there again!
2024-04-01,5,Stayed one night,"Nice place. Not far from downtown! We walked to Gella’s diner-it’s a bit of a walk but not bad. Would definitely stay here again, everything was just as expected!"
2024-03-01,5,Stayed one night,the Casita was a beautiful place to stay it was cozy and peaceful.
2024-03-01,5,Stayed one night,Extremely comfortable and very clean will definitely stay here again when I'm passing thru
2024-03-01,5,Stayed with kids,Erins place was great! She saved us when a blizzard shut down I70 and we couldn’t make it home at the last minute. Loved our stay!
2024-03-01,5,Stayed one night,"Adorable and roomy! I loved the decorations and all the high quality furniture, had everything and more! Definitely the my favorite air bnb for good reason!"
2024-03-01,5,Stayed a few nights,Erin was a great hostess. She was friendly and interested in why I was staying. Communications were timely and helpful.
2024-03-01,5,Stayed one night,"Great stay! Clean, comfortable bed, safe parking, quiet area, friendly host and flexible check-in. Would recommend!"
2024-03-01,5,Stayed with kids,Wonderful AirBnB! Definitely our planned stop on our trip back to see family!
2024-03-01,5,Stayed one night,"Great place to stay, quiet neighborhood that’s close to many things. Would stay there again."
2024-03-01,5,Stayed with kids,"Beautiful place, had everything we needed, definitely a great place to stay."
2024-02-01,5,Stayed one night,Beautiful!! Very quiet and peaceful!!
2024-02-01,5,Stayed one night,"Wonderful gem of a place! Excellent kitchen, and was well stocked. Great water pressure and stayed hot. Bed was very comfortable. Great value, highly recommend"
2024-02-01,5,Stayed one night,Great place! Close to everything you need. The apt has everything you need and is very comfortable.
2024-02-01,5,Stayed with kids,Absolutely loved this place!!! So quaint and cozy! Will definitely book again ❤️
2024-02-01,5,Stayed a few nights,Wonderful place to stay in Hays. Super clean and comfortable. I would recommend to anyone.
2024-02-01,5,Stayed a few nights,"The place is every nice, clean and spacious. just a few blocks from campus. A wonderful place to stay."
2024-01-01,5,Stayed a few nights,Very comfortable bed and lots of space in the apartment. Nice to be above the garage and not in a basement! Lots of little extras and easy to walk downtown.
2024-01-01,4,Stayed one night,"Erin’s place was a peaceful, private, cozy stay! Loved the decor, bed was super comfy and she put a lot of cute personal touches throughout. It was a bit outdated but that didn’t bother me. I had trouble getting the code to work when I got there and Erin came right out with a new one. Would stay here again."
2024-01-01,5,Stayed a few nights,Erin was super awesome to work with!! Very accommodating and helpful!! Bite space!
2023-12-01,4,Stayed one night,The only reason I am giving for 4 stars is the train noise. Otherwise I would give it 5 stars.
2023-12-01,5,Stayed over a week,If you are looking for somewhere cozy/homey to stay this is definitely the place! I felt right at home and the place was very nice and private! The designated parking spot was always left open for me! Host always communicated in a timely manner! Overall I would’ve loved to stay longer! Very close to the local college if that interests you!
2023-12-01,4,Stayed one night,Ok for the price. We're getting a little old for stairs
2023-11-01,5,Stayed a few nights,Visiting daughter who lives in Hayes. Very close to where she lived and to downtown area. Good restaurants and easy to get around. Mostly stayed inside with puzzles and games and eating at the apartment. Had the essentials for cooking. Very warm and cozy when it was very cold outside. Comfortable bed and a very large bathroom that was fully supplied for extra towels and extra essentials . Good hot shower and even bath salts for a soak. Will stay here again when in the area.
2023-11-01,4,Stayed with kids,"I was surprised upon walking into the apartment to find messy carpets and floors considering the rules stated that all guests should take their shoes off at the door. There was leftover popcorn and other food on the kitchen floor and inside the drawers.
We turned on the heat when we walked in - it had been set to 67, and after a few hours there wasn't much of a change in the temperature. After some back and forth Erin checked the pilot light and it was out. She told us to use the mini splits as a backup heat in case it went out again, which it did. The heat from the mini splits doesn't make it to the bathroom so that was freezing in the morning.
I was hoping for a better alternative to hotels in the area but I wasn't very impressed with the apartment, it was cold and a little rundown."
2023-11-01,5,Stayed one night,Fantastic short stay on our way from Arkansas to Colorado.
2023-11-01,5,Stayed with kids,"Nice place, good location."
2023-11-01,5,Stayed a few nights,"Perfectly suitable, quiet, comfortable, clean accommodations for not much more than you'd pay for a dingy room in a Super 8. Had some trouble operating the coffee maker and Erin kindly and quickly helped sort it out. Would -- and probably will -- stay there again."
2023-11-01,5,Stayed one night,Great cozy place in a peaceful neighborhood! Very clean and well-stocked kitchen. I would stay here again!
2023-10-01,5,Stayed one night,Had a great one night stay. The Casita is truly one of the best airbnbs I’ve ever stayed in. The decor is really cozy and unique and filled with thoughtful touches. Erin is a great host and would absolutely stay again next time I’m in town
2023-10-01,5,Stayed a few nights,"Always great to stay here. Clean, close to events, priced just right. Thank you again!"
2023-10-01,5,Stayed one night,"We had stayed at Erin's place once before and enjoyed it. This second time was just a good, or better! The Casita is roomy, comfy, and clean. Filtered water in the fridge, packs of oatmeal for breakfast, coffee available. We weren't missing anything and felt right at home."
2023-10-01,5,Stayed a few nights,We thoroughly enjoyed our stay at the Casita! We were close to family and the neighborhood was quiet. We had the added bonus of watching the squirrels play in the treetops each morning. Erin did a fantastic job ensuring our comfort!
2023-10-01,5,Stayed one night,"Our second stay at Erin’s, would stay again!!"
2023-10-01,5,Stayed one night,"It was easy to get to Erin’s place off of interstate 70. The place had everything that my wife and I needed, and we could’ve stayed there for a week."
2023-10-01,5,Stayed a few nights,"My wife and I were in Hays for a weekend event and stayed 2 nights at “The Casita”. The location was great for downtown/FHSU campus activities yet was far enough from both to be quiet. The neighborhood was well maintained and safe. The Casita was well furnished and stocked with all the things a traveler needs. The bed was very comfortable as was the living room furniture. All the appliances worked flawlessly and the laundry was a very handy extra. The second floor arrangement was not a problem for us, but could be a challenge for travelers with mobility issues."
2023-09-01,5,Stayed one night,An excellent place to stay off I-70 while traveling through the middle of the country. I felt very much at home. Excellent and spacious accommodations. I would definitely stay here again.
2023-09-01,5,Stayed one night,Everything was exactly as described in the listing. Very clean and cozy! Erin is a great hostess.
2023-09-01,5,Stayed one night,"Erin is lovely and as stated in other reviews very responsive and compassionate for the fact I was staying over as I was moving across country. She helped ensure my belongings would be safe so I didn’t have to worry.
The place is decorated with such unique flair and there are so many great touches. I also really appreciated the outfitted kitchen! The bed is super comfortable as is the tub!
The only suggestion I have is to add blackout curtains to the bedroom and a fan in the bedroom. The security light and light from neighbors cars shown through and woke me a couple times but otherwise was a great stay!"
2023-09-01,5,Stayed a few nights,Such a nice place to stay
2023-09-01,5,Stayed one night,"Erin is truly a super host and her Airbnb is beautifully appointed, spacious, and spotless. Her many touches, both artistic and functional, are evident througout the space. She takes great care in anticipating all the needs of her guests and is an excellent communicator. The property is located in a nice residential neighborhood and is a convenient walk to the downtown of Hays. This is the second time we have stayed at this Airbnb and we enthusiastically recommend it to other travelers."
2023-09-01,4,Stayed one night,Such a charming place! Many thoughtful touches and amenities made us feel at home. Very comfortable bed too!
2023-09-01,5,Stayed with kids,We had a good stay. We enjoyed looking at the maps and quotes on the walls. Seemed like a nice quiet neighborhood.
2023-08-01,5,Stayed one night,Awesome place! One thing we loved was luggage racks! We are often surprised how few homes we've stayed at had these. The space is incredibly clean and nice. Wish we could have stayed longer!
2023-08-01,5,Stayed one night,We were very pleased with our stay. The property was exactly as described. The bed was comfortable as was the living room furniture. We were in town for a quick visit to the university and especially enjoyed the location's close proximity to FHSU. Will definitely consider staying again.
2023-08-01,5,Stayed one night,"Erin's place was perfect for our overnight stay in Hays - great location on a quiet neighborhood street, yet close to the highway: spacious, cozy, tastefully decorated to make you feel at home, and thoughtfully stocked with toiletries and little things that a traveler might need. Would stay at The Casita again!"
2023-08-01,5,Stayed one night,"La Casita was as pictured and very well worth the price. Erin is a responsive hostess in communication and thoughtful in the amenities, ie. a first aid kit, a small sewing kit and some extra toiletries in the bathroom. The bed was comfortable. Hubby and I slept well. The well stocked kitchen offers coffee, tea, powdered creamers, sugar and non sugar packets, hot cocoa, instant oatmeal and popcorn. There were 2 ice trays so I could have ice in my cooler the next day. The space in La Casita is generous and the furnishings and wall decor are unique and thoughtful. I liked the stacked suitcase bedside table and the stacked trunks in the living room. Erin has put together a nice and easy to read notebook of house rules, how things work and check out procedures. Also, she left suggestions for dining out, including 2 discount cards from LA Casita for our use at the place of our choosing. I pickeout many items of interest about KS, off the brochure rack. We hope to come back. Thank you."
2023-08-01,5,Stayed one night,"Had a wonderful stay during a road trip. The host was really responsive, and the place was clean. Cute neighborhood and easy to find/follow directions. Everything matched the description and pictures. I’d definitely stay again on another road trip."
2023-08-01,5,Stayed with kids,Very helpful and responsive host!
2023-08-01,5,Stayed one night,Loved all the cute and thoughtful touches with the decor. We will definitely be back again (:
2023-08-01,5,Stayed one night,Very relaxing place after a long drive! She has everything you need and more. I’d forgotten a toothbrush- good thing she has a cute little bowl of toiletries!
2023-08-01,5,Stayed one night,Really nice place and well decorated. All kinds of extra touches to make the stay convenient. Will stay again on our travels.
2023-08-01,5,Stayed one night,Great space with private entry.
2023-08-01,5,Stayed one night,"Erin’s place is at home feeling environment. Show much goes in to the Decorate . Everything you would need to away from home she has provided.
Clean home cozy. I loved it wanted to stay longer. Thank you for treating your quest so nice. I would love to stay longer."
2023-07-01,5,Stayed about a week,"The Casita was the perfect choice for my week-long stay in Hays. The apartment was cozy, quiet and well appointed. The keyless entry made entering and leaving so easy, which was very much appreciated.
The bed was super clean and comfortable, as was the living room furniture. Hooray! (There's nothing worse than booking a cute place only to discover it has a super stiff sofa or a saggy mattress!)
Erin also includes several thoughtful extras, like coffee, tea, spices, basic condiments, feminine products (yay!) and more so you have a few basics covered upon arrival.
The neighborhood is perfect for morning or evening strolls and is also conveniently close to downtown's shopping and dining options, as well as the town's smaller grocery store.
Highly recommend this place for your next trip!"
2023-07-01,5,Stayed one night,Beautifully appointed casita for an overnight while on a road trip!
2023-07-01,5,Stayed a few nights,Accurate description of everything. It was nicely decorated and welcoming. Erin has a talent for it. The bed was the best. I had a long drive of 8 plus hours from Texas and didn't get in until 4am because of delays. I slept like a baby in the comfy bed that had amazing sheets. It was quiet and peaceful the whole time which I really really needed. Great variety of coffees and I loved the milk provided as I use milk in my coffee. I didn't have time to cook but there is everything you need and is labeled and easy to find. I would definitely book here again if I'm ever in town for a Larks baseball game. Thank you Erin !
2023-07-01,5,Stayed one night,This is exactly what I needed for a night. Perfect place to crash! Had everything I might need and more. :) cozy and well decorated! Clean and organized. Host was kind and communicative. I recommend to all considering.
2023-07-01,4,Stayed with kids,Great location and great home. Very comfortable and quiet. Just what we needed.
2023-07-01,5,Stayed one night,"Very spacious, clean and organized. Clearly labeled parking made arrival super smooth. Really appreciate how everything was labeled. Felt very at home."
2023-07-01,5,Stayed one night,Great place to stay! Every detail was considered. My husband remarked that the sheets felt like butter. We had a great night’s rest before getting back on the road!
2023-06-01,5,Stayed a few nights,Great place to stay!
2023-06-01,5,Stayed one night,"This was the perfect place! I needed a spot to stay in as I traveled back home from Colorado. After a long day of driving, the Casita was a welcoming home away from home to really rest and unwind in a safe, peaceful, and clean place. I have saved this spot in my favorites and we will make this our usual stop on the way to and from CO in the future! Erin has thought of all the little extras and has decorated it so very well. I love the travel theme of the apartment, and I particularly loved the scriptures and quotes as you climb the one story staircase! LOVE IT!!"
2023-06-01,5,Stayed one night,Clean
2023-06-01,5,Stayed one night,"Erin’s place is a great value. The apartment is spacious, comfortable, and Erin provides instructions for everything along with friendly quotes, and funny comments. She responded quickly to questions, and was very helpful. We wish we could have stayed longer at her apartment. Note, there are about twelve steps to get to the apartment but there is a designated guest parking space in front of the house"
2023-06-01,5,Stayed one night,"Very spacious and clean. In a good area close to the downtown (try Gella's Diner and Brewery, it is great). Would love to stay for more than one night if I am ever in Hays again."
2023-06-01,5,Stayed one night,"Absolutely LOVED staying here! Erin is a phenomenal host and made the space feel like home. It was exactly what my partner and I needed after a long day of driving on our road trip. Genuinely the best AirBnb I’ve stayed at in a long while, I will definitely stay here again the next time I pass through Hays! Do yourself a favor and book here, you will not regret it."
