date,rating,note,review_text
2024-04-01,5.0,Stayed one night,"We loved staying at Emilie’s bed and breakfast. When we got there, Emilie showed us around the priority and recommended a nice walk through the surrounding forest. Emilie gave us whatever we needed to make sure we enjoyed our stay. Turbo the Cat was a joy to be around as well. Thank you for the amazing omelettes you made us in the morning as well :)"
2024-04-01,5.0,Stayed one night,Emilie’s place was very welcoming and comfortable in a peaceful setting. We had a delicious breakfast!
2024-03-01,5.0,Stayed with kids,"We have stayed here numerous times. We love it for our growing little family! Wonderful breakfasts made fresh and delivered each morning, beautiful surroundings, and the kids enjoy the cats and dogs that live on the farm. As always, Emilie is a great host. We will book again when we are in the area to visit family. :)"
2024-03-01,5.0,Stayed a few nights,"Emilie was very kind, very helpful and breakfast was always so good and on time.
Emilie allowed me to move the sheep with her! We got to know each other a bit and it was nice. I know Emilie takes great care over this prooerty.
The property is absolutely beautiful and there's so much peace. The animals were all friendly and greeted us too!
It's the perfect get away, we WILL be back.
Emilie is the hostess with the mostess!
I would gladly pay more to stay bc peace of mind is absolutely priceless.
Thank you Emilie! I've already shared about Bluebird B & B with many friends!!"
2024-02-01,5.0,Stayed a few nights,Emilie was a wonderful and accommodating host. The place was ready early & immaculate. Her communication was thoughtful and quick. She brought us fresh eggs and homemade muffins and demonstrated how her dogs herd the sheep. The property is beautiful and peaceful. We will definitely return.
2024-01-01,5.0,Stayed a few nights,"Emillies place was extremely clean, peaceful and relaxing. She had everything that we possibly needed and she provided extra treats as well."
2023-11-01,5.0,Stayed one night,Great stay! We loved the place and the breakfast was delicious.
2023-11-01,5.0,Stayed one night,Emilie was very kind and made the process very easy. Her place was very nice and she even offered us breakfast in the morning. Thanks for a peaceful night!
2023-10-01,5.0,Stayed a few nights,"We stayed with Emilie at Bluebird Trail for the second time. She is a wonderful host and it is a great location! The apartment is private and comfortable, and her breakfast and goodies are great (the sourdough was awesome 😎).
We will definitely stay with her again!"
2023-10-01,5.0,Stayed with kids,Absolutely lovely. Great place to turn off your phone and just decompress. Emilie is a wonderful host. Breakfast was amazing. Love the animals!
2023-10-01,5.0,Stayed a few nights,"We loved our stay at Emilie's lovely little apartment. She was very thoughtful and helpful and is a great cook! If you're looking for a peaceful place to stay, this is your kind of place. The beds were comfortable and Emilie made sure to include the little, thoughtful things that made our stay wonderful."
2023-09-01,5.0,Stayed with kids,"We enjoyed our stay in the cute upstairs apartment at Emilie's farm! It was clean and cozy, along with toys and good books for the kids! She served a delicious breakfast and her communication was always prompt and helpful! We felt well taken care of! A wonderful gem of a place in a woodsy off the beaten path location."
2023-08-01,5.0,Stayed a few nights,"Beautiful farm, very comfortable. Emilie is a friendly and responsive host. Her omelets were great! We’ll definitely be back!"
2023-08-01,5.0,Stayed a few nights,"We loved Emilie's Bed and Breakfast. Comfortable and clean inside especially the bed, slept like a log. Out on the deck enjoying coffee in the morning with a diversity of trees watching the birds. Everything from Sandhill Cranes and Turkey Vultures to Gold finches and Bluejays. Even spied the B&Bs namesake Bluebird. Friendly kitties and dogs come to say hello. Gray and white cat hung out with us in the morning snoozing in the chair next to us.
Breakfast brought to us in the morning was absolutely delicious. Really just a perfect way to start our day. We were discussing coming back as we were driving away. A top notch farm stay run by a top notch host."
2023-08-01,5.0,Stayed a few nights,"The apartment was great and well equipped. There was a Keurig with coffee pods, sugar/sweetener, creamer and tea. These items are sometimes missing at other Bed & Breakfasts. We really appreciated not having to go to the store to buy these.
Emilie is a perfect hostess. We enjoyed hearing about the sheep and the farm. Breakfast was always delicious - omelettes, quiche, sourdough bread, blueberry muffins. Everything homemade with fresh ingredients.
Hillsdale is a small college town about 15 minutes away and the farm is quiet, which was perfect. Hillsdale isn't a ""tourist"" area but still had plenty of things to do. We enjoyed walking around the Children's Garden and the Aboretum at Hillsdale College. We also drove down to Baw Beese Lake. There is fishing, boating, swimming, and great views. If you are there on a weekend during the summer, you can check out the Farmer's Market in town.
We highly recommend a stay at Bluebird Trails."
2023-08-01,5.0,Stayed a few nights,"The place is absolutely wonderful!! If you need a peaceful, quiet place to stay, this is it. Emilie was very nice and welcoming. The homemade breakfast, each morning, was delicious! My wife thoroughly enjoyed the opportunities to work with the sheep."
2023-08-01,5.0,Stayed a few nights,"We come to this area to visit family a couple times a year. We have stayed with Emilie the last few times. We will continue to do so. It’s comfortable, the kids love the farm atmosphere, it’s quiet, and the beds are extremely comfortable. Not only that, but she brings the most wonderful breakfast each morning! It’s the perfect home away from home."
2023-07-01,5.0,Stayed with kids,Emilie’s place is a favourite. We always feel at home. A perfect stop on the way through Michigan.
2023-07-01,5.0,Stayed with kids,This area is beautiful! We wanted a farm stay and it’s what we got. We rode out with our host to see the goats. The dogs are so friendly. We felt welcome and at home. The place is quiet with a wonderful view of the area out all the windows. We will stay here again. Breakfast is fantastic as well.
2023-07-01,5.0,Stayed with kids,Always a pleasure to stay at Emilie’s. Such a peaceful spot. A favourite for our summer vacation trip.
2023-07-01,5.0,Stayed with kids,perfect. I got some fish and free them.
2023-06-01,5.0,Stayed a few nights,"Emilie responded to our family with sincere respect. We had limited time together and a wedding to enjoy as priorities. She certainly delivered as advertised.
The peaceful setting and comphy beds made for 2 good nights of sleep. We especially enjoyed watching birds from the balcony deck by day, and listening to bullfrogs while watching fireflies late into the evening.
We missed walking with the sheep, but could hear them. Having dogs on the farm made us feel safe from any intruders. Loved the remote setting!"
2023-06-01,5.0,Stayed with kids,"We had a lovely time at Emilie’s place! Our family love the animals, the food and the experience. The pond was peaceful. The fire flies and stars made for a perfect peaceful evening. We appreciate everything about the trip and our kids have called it their favorite stop on our 10 day cross country road trip!"
2023-06-01,5.0,Stayed a few nights,The farm stay is everything you would want in a rural setting. Breakfasts were standing! She was the perfect host!
2023-06-01,5.0,Stayed a few nights,"Our second time staying with Emilie, would come back again. She was always available to answer our questions and very accommodating and flexible. A great hostess and we loved the location!"
2023-06-01,5.0,Stayed one night,"Highly recommend staying at Bluebird Trails! The farm was so quiet and peaceful, and was easy to find. Emilie is a welcoming host, quick to respond to any messages we sent. The apartment was clean and cozy- awesome design plan for a small space, including a very nice kitchen. Her farm baked goods are amazing too!"
2023-06-01,5.0,Stayed with kids,"This was our third time staying at Emilie’s B&B. When we (family of 3) travel to Michigan to see my grandmother in a nearby town, we plan our visits around availability here; we simply don’t want to stay anywhere else!
The space is comfortable, very clean, and feels like a home to us. Emily is super responsive and kind. She always makes a delicious breakfast for us to start each day, taking care to accommodate our various dietary needs. It is so nice to start each day with a home cooked meal!
Emilie has been a B&B host for many years, and it shows. Highly recommend!"
2023-05-01,5.0,Stayed one night,"We thought the communication between the owner and us was excellent and check-in was a breeze. Everything was extremely clean and tidy and well stocked with coffee and amenities even in the shower. We were only there one night, but if we need to go back to Hillsdale again we will definitely call again! By the way, breakfast was amazing!"
2023-05-01,5.0,Stayed a few nights,We enjoyed our stay and it was what we expected. My boys enjoyed the farm and the property. Emilie was happy to show them around to meet the animals. The fresh breakfasts were delish. Thank you Emilie!
2023-05-01,5.0,Stayed one night,"Emilie is a wonderful host, very responsive and hospitable from beginning to end. We had a very comfortable stay, and we highly recommend her space—especially if you’re an animal lover!"
2023-04-01,5.0,Stayed one night,Our farm stay was lovely! The property was gorgeous and all the animals so sweet. We loved watching the collies work and seeing newborn baby lambs.
2023-04-01,5.0,Stayed one night,"The apartment was great, breakfast was delicious, and Emilie and the animals were very kind."
2023-04-01,5.0,Stayed one night,"Emilie is a 5 star host!!! Apartment was clean and cozy, she made omelets and blueberry muffins for breakfast, YUM!!
Apartment was like in a treehouse…. Wonderful farm views. Highly recommend Emilie!"
2023-04-01,5.0,Stayed one night,We had a nice stay at Emilie's farm - it was peaceful and beautiful. It was just the getaway we needed!
2023-04-01,4.0,Stayed one night,Very clean with everything needed for a comfortable stay. So peaceful
2023-03-01,5.0,Stayed a few nights,"Incredibly peaceful — and able to buy incredible fresh lamb to cook up when you walk in. (The free eggs and bread pair great!)
An incredible refreshing spot. One of best farm stays in area."
2023-03-01,5.0,Stayed one night,"Thank you for your hospitality. My sons felt welcomed and they really enjoyed their first Airbnb experience. They loved the special breakfast.
In their own words, our stay was “Fantastic”🙏"
2023-02-01,5.0,Stayed one night,"My 4 children and I had a magical, peaceful, fun, refreshing, exciting and overall marvelous time at Bluebird Trail Sheep Farm. We felt like we bonded with the sheep and Emilie. We will miss our new friends and started looking forward to returning again the moment we pulled out of the driveway. My kids didn’t want to leave and I felt the same! Knowing that such a beautiful place and amazing person like Emilie is only 15 minutes away is such a happy thought!"
2023-01-01,5.0,Stayed one night,"Emilie's quiet, clean, and cozy apartment with its view of the rolling countryside was the perfect getaway from our busy life - if only for one night. I enjoyed her friendly pets and the positive vibe of her working farm. She was kind enough to walk me out to locations on her property where I could take photos of the night sky and she makes amazing blueberry muffins. I'm already looking forward to coming back."
2022-10-01,5.0,Stayed a few nights,Beautiful getaway with many animals to love and hit fresh delicious breakfast delivered every morning. Host was a great communicator and very accommodating
2022-10-01,5.0,Stayed over a week,Emilie’s place is ideal! A beautiful setting with great homemade breakfast every morning. Would 100% recommend staying with Emilie when in Michigan
2022-10-01,5.0,Stayed a few nights,"This is our second stay with Emilie and it was just as delightful as the first. The property is beautiful and so relaxing, the accommodations are clean and comfortable and her breakfasts are the best in Hillsdale! We can't wait to visit Emilie again when we come see our daughter at Hillsdale College."
2022-09-01,5.0,Stayed with kids,"We stayed with our two young kids. We loved the farm experience. My daughter was enamored with the cats that hung out on our deck begging for snuggles. There were even cute sheep books on the shelf that my kids loved reading. Emilie had a bowl of some farm fresh honeycrisp apples on the table. They were SO GOOD! So many nice, homey touches that made it such a fun night away. Emilie is a great host and it was so interesting to learn about the sheep farm."
2022-09-01,5.0,Stayed one night,"Emilie's farm b&b is beyond words! Emilie herself was kind, attentive, and caring. Her second floor 2-bed, 1-bath was as described, with comfortable and thoughtful finishes. The kitchen in particular is well equipped and spacious. There's a semi-private deck for use by guests as well, which looks over her backyard, gardens, and pond. The breakfast was delicious, and watching Emilie and her dogs shepherd the sheep was amazing! The woods and pasture on her farm are amazing to just walk through and enjoy. Cannot wait to visit again."
2022-09-01,5.0,Stayed a few nights,Emilie is an exceptional host! Her home is clean and the beds comfortable! Quick to communicate. We enjoyed going with her to move the sheep and watching the dogs at work helping her!! We stayed before and we will continue to stay when we come to town. Recommend going to the farmers market in Hillsdale. Thank you for a great weekend!
2022-09-01,5.0,Stayed a few nights,"Beautiful, restful, rural location! a peaceful spot!"
2022-09-01,5.0,Stayed a few nights,"An incredible place and host. The apartment was very private, clean, spacious, and relaxing. The farm is stunning. I felt like I could spend forever here. Emilie (the host) is the best host I've had experience with on Airbnb. She brought us breakfast every morning, let us explore her beautiful farm, and let us play with her beautiful animals. And speaking of the animals... Oh. My. God. They are incredibly friendly and beautiful. We would be greeted in the morning by them coming up the porch! If you love animals, you're at the right place!"
2022-08-01,5.0,Stayed a few nights,"This is our second time staying with Emilie! it's always wonderful! Her breakfasts are amazing, her property is beautiful, and the kids enjoyed the friendly animals that wander up to our door. very comfortable accommodations, with everything you might need for your stay. We have already booked our 3rd stay with her to visit our family from the area."
2022-08-01,5.0,Stayed a few nights,"Emilie's property is beautiful and peaceful, the perfect respite from a busy college move in. We loved visiting with her and meeting the animals. Emilie's breakfasts are delicious and don't miss out on her bread and produce. The beds were very comfortable, kitchen was well equipped and we had a delightful stay. Can't wait to come back!"
2022-08-01,5.0,Stayed one night,"This is the most charming place I have ever stayed! The apartment has everything you could possibly need, everything is super clean and comfortable. There is no way to improve on perfection. Emilie is very easy going and generous. The breakfast was amazing! Highly recommended."
2022-08-01,5.0,Stayed with kids,"Friendly, quiet, well-appointed. Storybook. Hope to return."
2022-08-01,5.0,Stayed over a week,Nice
2022-07-01,5.0,Stayed about a week,"This was our second time here and was as wonderful and relaxing as before. Emily is a kind and gracious host. The breakfast are amazing, what a fabulous baker/cook. The accommodations were clean and comfortable, well stocked kitchen. Location is quiet and private. We will be back!!!"
2022-07-01,5.0,Stayed about a week,Amazing place to stay. A breath of fresh air on a nice big property. Host is very accommodating also. Would stay again
2022-07-01,5.0,Stayed with kids,Our second time staying at Bluebird Trails. Just as great as the first time. The space is comfy and has all that we needed. Kitchen is well equipped and there is a collection of movies and games. Emilie shares good suggestions for restaurants and things to do. This time we decided to explore Sandy beach and park- lots of fun playgrounds. Looking forward to our next farm stay.
2022-07-01,5.0,Stayed a few nights,Very peaceful and tranquil location! The sheep experience is once in a lifetime and Emilie will guide you through this with a smile on her face and in her heart.This is a great location for little and adults alike! The breakfast is out of this world and made with love! Highly recommend! Host is also open to all families and accepting of all!
2022-06-01,5.0,Stayed a few nights,The apartment is in an old farm house and is very clean. Moving the sheep is an experience you will never forget and would be fun for your kids. The host is friendly and very accommodating.
2022-06-01,5.0,Stayed one night,"Emilie’s Bed and Breakfast was very charming! It was peaceful and the animals were adorable. Our pancakes were also very delicious! Thank you, Emilie!"
2022-06-01,5.0,Stayed one night,Beautiful spot and great birding. Lovely breakfast.
2022-06-01,5.0,Stayed with kids,"Emilie’s place is a beautiful, comfortable place to stay. It’s a peaceful retreat with great views. The front room with surround windows was a favourite spot. The breakfast was such a treat. She is very gracious and welcoming host. We loved learning about her farm. We would absolutely stay again."
2022-06-01,5.0,Stayed with kids,"This is such a wonderful place to stay! Emilie is so wonderful and we loved going out to see the sheep (and bottle feeding a lamb!) with her. If you are looking for a peaceful getaway surrounded by nature, this is the perfect place. The breakfasts were to die for, not to mention the fantastic homemade bread. The Airbnb was clean, cute, and cozy and the photos don’t do it justice. We had fun looking through the collection of DVD’s and kicking back and enjoying some good movies and popcorn in the evening. Emilie is truly the best host, and we would definitely stay here again."
2022-05-01,5.0,Stayed a few nights,Great stay at this lovely farmhouse with abundant nature on a quiet lane. Emilie was a gracious and friendly host who brought beautifully prepared homemade breakfasts. The flowers were in full bloom and enjoying coffe on the deck overlooking the scenic lake with birds chirping everywhere was splendid! Highly recommend this relaxing getaway.
2022-05-01,5.0,Stayed with kids,"Love, love, love this place!! The apartment was even more lovely than the photos show. Emilie is lovely, responds very promptly and is so kind.
Beds were very comfortable, the apartment was spotlessly clean and she provides nice snack items and a well stocked kitchen with basics. The fresh breakfasts she supplies are amazing!!
She also has a nice selection of movies, games and even a few toys for kids.
The farm is gorgeous, very peaceful, quiet and there's lots of space for walking.
The location was very convenient for going into town for Hillsdale College events (~15 min drive).
Emilie's space provided our family with a lovely retreat while attending college commencement.
I also recommend checking out the fresh farm goods that Emilie sells as well! Delicious raw honey, eggs, bread and other items."
2022-05-01,5.0,Stayed one night,"Great place!
Wake up in the morning sit on the deck and just reset!!"
2022-04-01,5.0,Stayed one night,"Fantastic place and fantastic host.
Easy to find authentic farm atmosphere. Very good breakfast mad with local ingredients as well."
2022-04-01,5.0,Stayed with kids,This was our second time to visit there. We spent amazing moment with Emilie and her animals. We'll absolutely be back again!!
2022-04-01,5.0,Stayed a few nights,"If you're looking for a quite place to relax and love nature, this is the place!"
2022-03-01,5.0,Stayed a few nights,"What a lovely find. This B&B is very near a trailhead for the North Country Trail, which is why I chose it. Peaceful and quiet, thoughtfully designed apartment complete with kitchen and rainy-day activities like media and board games, good roads that would be passable by sedan, and delicious cooked breakfasts. I will definitely return if I am coming this way again. Do take Emilie up on the offer to see the farm, it's well worth the time!"
2022-03-01,5.0,Stayed a few nights,"It was our second time staying here. We had a great time and got to watch the baby sheep feeding with their mothers :) The weather was freezing cold during the weekend so we couldn’t stay outside much, but we still enjoyed our time watching movies 🍿"
2022-03-01,5.0,Stayed one night,"Delicious breakfast, comfortable beds. Emilie's communication was clear, prompt, and accurate."
2022-02-01,5.0,Stayed a few nights,"We had such a nice, peaceful, relaxing weekend on Emilie’s farm. It felt like we were in our own cozy little treehouse with a view of the snow, icicles, trees, and chickens.
Emilie was the best host we’ve ever had at an Air B&B, and we hope to return in the summer."
2022-02-01,5.0,Stayed one night,"Emilie is so sweet. Also the place is super nice and extremely comforting. She is very kind and welcoming, and you’re sure to have a very relaxing stay :)"
2022-02-01,5.0,Stayed a few nights,"Beautiful spot! The type of place we would have loved to tour in more depth.
Functional and lovely interior space."
2022-01-01,5.0,Stayed a few nights,"Wonderful little apartment for a quiet getaway. The accommodations are clean and comfy, and the breakfast provided is fresh and delicious. We had everything we needed for a comfortable stay; the few things we needed were supplied right away by the host. She allowed us to come with her as she fed her sheep and it was great fun to watch. It is a working farm and the dogs do ""talk"" to one another quite a bit. It didn't bother us at all but if you're a very light sleeper you might take note of that."
2022-01-01,5.0,Stayed about a week,We stayed over a week for the birth of our grand baby and really enjoyed our stay. It is cute and very very clean. The wonderful breakfasts were so delicious and we looked forward to them. There was plenty of room for both us and we were able to work at the table as well. Totally recommend it!
2022-01-01,5.0,Stayed one night,Amazing! One of my favorite places I’ve stayed. So peaceful and relaxing.
2022-01-01,5.0,Stayed a few nights,Emilie was very respectful and the BEST HOST we have had on this platform. Her animals were well trained and watching them work was a great experience. You should buy a loaf of bread from her. It was soooo good! We are definitely coming back to this place!
2021-12-01,5.0,Stayed a few nights,"This was my best Air BnB stay to date! These days AirB has turned into such a business in the US that it’s often the same experience as staying in a hotel. Not so with Emilie! This is the way it used to be before we capitulated to the idea that humans are just here to extract money from - kind, generous human interaction and sharing :).
The unit itself is quite nice, large for two people, clean and well organized. The kitchen is large and stocked not just with cooking ware, but with granola, milk, orange juice, spices and other food.
The out doors are lovely and nature. Many deer, beavers, a Bald Eagle, owl, sheep, dogs, squirrels and much more.
But the real peak is Emilie’s generosity. Homecooked full breakfasts every morning! Awesome sourdough bread and muffins. Any other spices or pots we asked for. Flexibility and kindness :).
Thank you very much my friend."
2021-11-01,5.0,Stayed with kids,"Accommodations are exactly as described! she had everything we could have wanted, including some snacks and beverages in the fridge. The beds are very comfortable, so you most definitely get a good night's rest! The breakfasts are amazing, and she brings you more then you can even eat (which is great since it's so yummy, you get leftovers!). Sheep herding is a wonderful experience too! We will check if this available again when we come to visit our family in the future!"
2021-11-01,5.0,Stayed a few nights,If you need peace and quiet- this is your place!
2021-10-01,5.0,Stayed with kids,"Delightful in every way. Clean, cozy and everything you need, nothing you don’t. Although, the breakfast was FAR above and beyond- homemade gourmet food, hot and delicious. Do be aware of lots of outside animals… dogs and cats and more, which was especially exciting for the kids. Cannot find a kinder or more generous host than Ms. Emilie- we will return!"
2021-10-01,5.0,Stayed a few nights,"Emilie's room are so comfortable, and the view from the deck is wonderful! The food is delicious and the location is just a short distance from Hillsdale. We will definitely be staying again when we come to visit!"
2021-10-01,5.0,Stayed a few nights,This was our second stay with Emilie. This is a beautiful spot to stay while visiting our boys at Hillsdale College. This morning I listened to the wildlife while drinking my coffee on the back deck. The homemade sourdough bread was amazing! Emilie is quick to respond and makes us feel welcomed and cared for every time we visit.
2021-10-01,5.0,Stayed a few nights,Great place! Loved the food/drinks provided! Clean and quiet stay. Definitely recommend.
