date,rating,note,review_text
2024-06-01,5.0,Stayed a few nights,"Indy's First Container home is AMAZING!!! The house is clean, cheerful, and has great decor! We will definitely be back!
James was flexible on check in which was very kind as we had multiple arrival times into Indianapolis.
Thank you so much for being the perfect host with such a fun house!"
2024-06-01,5.0,Group trip,Incredible home! Great location. The hosts were awesome.
2024-06-01,5.0,Stayed with kids,"The place was pristine! The beds were extremely comfortable with TVS in all the bedrooms as well as private patios! The listing had all the amenities to accommodate my large family, from excess toiletries, to the kitchen supplies, washer and dryer, and even home security, those features really made my family feel safe and comfortable! The host was very accommodating and flexible with quick responses and helpful local recommendations. The stay was beyond our expectations! My family will absolutely be staying again! We really had such a wonderful time in a beautiful place, it really made our experience worth it! The only thing I could really say was the limited patio furniture. There were so many patios with an awesome view, just no where to relax on. It seemed like the host was in the process of adding those additions. Seriously, regardless of patio furniture, I'd absolutely stay again!"
2024-06-01,5.0,Stayed with kids,Our family has a great time! James is a phenomenal host and the place is really unique.
2024-05-01,5.0,Stayed a few nights,"This is one of the best Airbnbs in Indy! The pictures are great but it’s so much nicer in person. The house is very unique , welcoming , clean and has lots of space ! There wasn’t a thing out of place, the furniture was clean and well kept even the WiFi info was ready and available! Our host went above and beyond to make sure all of our needs were met and was very accommodating and easy to work with. Communication was on point and he even gave us recommendations for restaurants and things to do near by. I give this stay a 5/5 star review and I’m already looking to book again !"
2024-04-01,5.0,Group trip,"Great experience in a unique home. The host communicated well and provided extremely useful information for our stay. The entire house was clean and in excellent condition with lots of personal products to help make our stay more comfortable. We found having a garage very helpful for our stay. The location was great for activities in the city. While we had no issues, we thought guests who are not fully mobile might have difficulty accessing the third floor bedroom."
2024-04-01,5.0,Group trip,James was an absolute delight of a host. He was not only incredibly kind and communicative he truly went above and beyond to ensure a positive experience for our time at his home. Everything was so neat and organized and you can tell the space was so intentionally put together. I am beyond grateful for such an incredible host and can’t wait to stay at another of James’ properties!
2024-04-01,5.0,Stayed a few nights,"Absolutely stunning spot, I’ve been obsessed with shipping container houses online and getting to stay in one this gorgeous was a dream. We will definitely be back."
2024-04-01,5.0,Group trip,Would definitely rent it again
2024-04-01,5.0,Stayed with kids,"The ""box house"" (as our 2 yr old grandson called it!) was even cooler than we could imagine! It felt very spacious - especially considering it was made of shipping containers! Our family of 8 had plenty of room to spread out and get comfortable. The upper deck was the perfect spot for viewing the solar eclipse!
James went above and beyond with acquiring items for the grandkids - our grandson was so excited to see the box with train tracks and cars! We so appreciated the baby gates for the stairs!
We also appreciated the 3 car garage, well stocked coffee supplies and basket of snacks to welcome us.
We had a great time exploring Indy but it was nice to come back and relax at the box house!"
2024-03-01,5.0,Stayed with kids,"first time in Indy and staying here was part of a great experience. comfortable, clean, easy communication."
2024-03-01,5.0,Stayed a few nights,"What an amazing property!!! Thanks so much for an incredible stay. Great host.
Great communicator! Pleasure staying."
2024-03-01,5.0,Stayed a few nights,"We loved our stay here! We were travelling as a family of 4 with two kids under 5 years. From booking to check out the communication with the host was great with loads of tips what to do and where to eat and with plenty of kids activities.
The house is very spacious, very clean and very comfortable. Thanks James for all your help, we had a wonderful stay."
2024-03-01,5.0,Group trip,"The shipping house was all we hoped it would be. We really enjoyed your home and appreciate all the amenities you had in the home to make our stay more comfortable. The house is adorable and cozy. Everything from the coffee readily available, to the bathroom essentials, and cozy blankets, games, and records! We really enjoyed our stay. Excellent communication with the owners, very responsive and always a step ahead! We will definitely save this location for our yearly trips to Indy! Thanks again!"
2024-03-01,5.0,Group trip,Very beautiful home with private balconies with almost every room. Not the kind of neighborhood you’d want to take a walk in however. The provided garage did make us feel more comfortable there though. Thanks James!
2024-03-01,5.0,Stayed a few nights,Very unique home with everything we needed and more. Host provided all needed information and made the stay very simple.
2024-03-01,5.0,Stayed a few nights,What a unique and exquisite place! Lots of room to gather together and also plenty of places to curl up with a book. Only a few minutes walk to Mass Ave and the NE Quadrant. I highly recommend!
2024-03-01,5.0,Group trip,"James was a great host. There were very clear directions on getting into the house and some of the amenities of the house. Also there was a tremendous amount of recommendations on food and activities. The house was gorgeous. The three floors worth of decks were great. Four floors worth of TVs in all the major rooms. Tons of space, multiple living areas. The master bedroom “birds nest” at the top of the winding staircase makes you feel like a rockstar. Definitely will come back. Thank you, James, for making our short stay in Indy a memorable one."
2024-02-01,5.0,Stayed one night,"The photos do a great job of selling the property, but once you get in, there are so many other really neat amenities as well. This is one of the coolest and nicest airbnbs we’ve stayed in, and we travel a lot for work. They were responsive, communicated quickly, and have such a gem of a house. I can’t wait to stay again. You won’t be disappointed. In fact, you’ll probably be even more excited once you get inside."
2024-02-01,5.0,Stayed a few nights,The container home was a great vibe! It’s pretty cool and interesting what people can do with different materials to build homes. This was our 1st time in a container home and it’s a must! Anyone going to Indy should definitely check out this container home.
2024-02-01,5.0,Stayed a few nights,"Cool spot in an up and coming neighborhood. Close to a lot of thoughtful food and booze spots. It was a central location near highways, but far enough away to feel tucked away in a secluded neighborhood. The house was fantastic."
2024-02-01,5.0,Stayed a few nights,"Impeccable! This home was beautiful, functional, and interesting. My first stay in a shipping container home and it’s one I’ve already told dozens of people about. We will be back!"
2024-01-01,5.0,Group trip,Unique house. Great place to stay and we would return again. Appreciated how well the place was stocked. Great host with fast response to questions.
2024-01-01,5.0,Stayed a few nights,We thoroughly enjoyed staying in James beautiful home! It was very nice to be able to use the garage to stay out of the cold. The house was immaculate and we would love to stay there again. Host was very responsive and very helpful!
2024-01-01,5.0,Stayed a few nights,"Everyone in our group thought the house was spectacular. Modern, unique, spacious, clean and just as described. We did some cooking and the kitchen was reasonably well equipped. The multi-car garage with door remotes was a nice bonus. The neighborhood is in transition, but well on its way and was not a negative for us - and the central location is nice. James was a fine host - proactive and responsive. Would certainly stay again!"
2024-01-01,5.0,Group trip,This is a fun and fantastic house to stay at! Our group of 8 adults all enjoyed staying here. Highly recommend this rental to anyone considering it.
2024-01-01,5.0,Stayed with kids,Our favorite Airbnb in Indy!!! such a fun and unique home!! We will be back!!
2024-01-01,5.0,Stayed a few nights,"My family came to stay at this awesome container home in Indy for New Years and a football game. What a good time we had. Lovely home, and so comfortable, blankets everywhere, very comfy beds, and not to mention a great attentive host. I hope we get to come back!"
2023-12-01,5.0,Stayed a few nights,"This is a real stunner of a place. Very stylish and comfortable. There is lots of room and great for a larger group. My family was there a few days for a visit and loved it.
Many comment on the neighborhood - while it is a bit transitional, never felt unsafe and there are lots of great amenities (hello Provider Coffee 3 blocks away and on the Monon Trail) and downtown is super close.
The kitchen was very cool and we appreciated the treats left for snacking and the half and half for coffee. TVs are plentiful and cozy couches and chairs in the common areas.
Downsides - sound travels a lot. If you are in the basement we can probably hear you upstairs. In the master bedroom at the top of the spiral stairs, it has no door or anything, so you can hear everything downstairs and vice versa.
There were some small issues for maintenance (like the garage lock being loose, etc.) but I mentioned them to James and they will resolve.
Definitely worth the stay!"
2023-12-01,5.0,Stayed with kids,James was a great host. He was very proactive in check in instructions and very helpful with things to do in the area. He also made sure we knew check out procedures prior to our departure. The house was great! Our 4 boys all found their spaces at all felt quite at home for the few days we were in Indy. This was a great first time Airbnb experience for us!
2023-12-01,5.0,Group trip,Had a great time at the house! Clean and fun space
2023-12-01,5.0,Stayed a few nights,house is unbelievable. i would love to had enjoyed this in the summer. the neighborhood around the house is being developed which distracted me a little but overall the house is gorgeous.
2023-11-01,5.0,Stayed with kids,"We enjoyed our stay, it was close to everything. Highly recommend."
2023-11-01,5.0,Group trip,"Spent 3 nights at Indy's first Container house with my son and 4 of his senior classmates for the National Catholic Youth Conference at Lucas Oil Stadium. The boys thought they were pretty high rollers staying in this super cool AirBnB. Loads of space to spread out, comfortable beds, TVs galore, and the ability to make a quick breakfast before we headed out for the day...made for a great stay. The only thing I would add to the kitchen is a toaster. Other than that, everything was well stocked! Great suggestions for restaurants and a easy drive downtown. Would totally stay again."
2023-11-01,5.0,Group trip,"Unique home
A must see & stay"
2023-11-01,5.0,Stayed a few nights,This house was great. It was just like it was described. The area it’s in is a little sus. But the house was great and we felt safe. Would definitely book this place again.
2023-11-01,5.0,Stayed with kids,Literally the best Airbnb experience I had yet! Looks exactly as describe but much more space than we expected very creative my family and I will definitely recommend and book again great host!!
2023-10-01,5.0,Group trip,"We had an AMAZING time. The house is very cool and exceeded expectations. It has everything you need. Plenty of room for our group of seven. The decor is beautiful, and we loved the kitchen and porches. There are a few little places in walking distance but we also took an easy Lyft to other neighborhoods and Lucas Oil. We felt safe in the neighborhood and appreciated the use of the garage. Also appreciated not having a long list of chores at checkout :) Very friendly, communicative, and accommodating host! We would love to stay again."
2023-10-01,5.0,Stayed a few nights,The container house is great! We had a group of 4 in for work and were all extremely comfortable. We each had our own room and had 3 full baths which was incredible for an AirBnB. The 3 car garage accommodated all of our vehicles and was perfect as we only drove one around in the evening. There’s a great pizza place not even a block from the house we really enjoyed! Bring some wine and snacks to enjoy the deck outside!
2023-10-01,5.0,Group trip,"The house was super cute and as pictured as well as extremely clean. The host was very responsive and accommodating. He provided very clear directions about checkin, nuances about the house and recommendations for things nearby. We didn’t have an opportunity to explore the neighborhood but it looked like there were many cute places within walking distance. Would definitely stay here again."
2023-10-01,5.0,Stayed a few nights,I booked this for my husband’s surprise 40th birthday party and this place didn’t disappoint. James was a fantastic host and very helpful. The place is awesome and close to everything. Walking distance to West Fork Whiskey company and a brewery and pizza place. Overall we absolutely loved our stay and would definitely recommend and rebook here.
2023-10-01,5.0,Group trip,We had a fantastic stay — we were blown away by the house and also the amenities! James was super responsive and flexible which was awesome.
2023-10-01,5.0,Stayed a few nights,Really fun space. It was great for entertaining.
2023-10-01,5.0,Group trip,"The house was exactly as pictured, very modern and beautiful! Hosts were extremely helpful and would definitely stay again!"
2023-10-01,5.0,Group trip,Awesome unique air bnb experience with great attention to detail. James was a great host and the container home wowed in many ways. Super comfortable and well stocked! Great beds!
2023-09-01,5.0,Stayed a few nights,James home was amazing I would love to visit again.
2023-09-01,5.0,Stayed with kids,Amazing!!!
2023-09-01,5.0,Group trip,"My wedding party and I stayed here for the days leading up to and the night of our wedding and we were blown away every day. Everyone that came by or worked with us was so impressed and it was such a cool experience. The beds and pillows were raved about by everyone and I’ve never stayed anywhere so full of helpful things, besides the fact that James provided our favorite snacks and he didn’t even know, and what I think was a wedding surprise!
James was so helpful with my questions and worked with us to make sure we would have all the time we needed. So flexible in such a stressful time!
We will certainly be referring everyone here and can’t wait to stay again.
Thanks James!"
2023-09-01,5.0,Stayed a few nights,"Incredibly cool space! Modern, in a great neighborhood, spacious and super unique. The host was very accommodating and helpful throughout the process. Everything went wonderfully well and we hope to visit again soon."
2023-09-01,5.0,Stayed with kids,Very nice. Beautiful home. I would stay here again. My children loved it. The board games in the house added to the fun. Perfect place to stay for any length of time.
2023-08-01,5.0,Stayed with kids,"Exactly as advertised! Clean space, thoughtfully decorated and a very conveniently located neighborhood to many restaurants, coffee, monon trail and playgrounds.
James was an efficiently responsive and very helpful host. We thoroughly enjoyed our stay!"
2023-08-01,5.0,Group trip,James was a great host I have to start with him because we had a great experience with him before we even saw the place. I had my brother in town celebrating his birthday and a few outside family as well. I needed a place to host them since I live in a small studio and let me just say James’ place Wow! Definitely a great experience staying in Indy’s first container home. Everything from the set up to the amenities and location was 10/10. Definitely would stay here again in the future!
2023-08-01,5.0,Group trip,We absolutely loved our stay! The house itself was incredible. We loved the decorations and attention to detail! Location was close to town and walkable to a local brewery and whiskey distillery! We would definitely stay here again!
2023-08-01,5.0,Group trip,Perfect stay.
2023-08-01,5.0,Stayed with kids,"We really enjoyed our stay at this container home! It was thoughtfully designed and had higher ceilings than we thought. The amount of space was perfect for our group, and our family in particular really enjoyed the basement area. It felt like it's own space entirely. James was extremely quick to respond to anything we had a question about and very generous with flexible check-in and check-out times. We would not hesitate to book again! Thank you for a great stay!!"
2023-08-01,5.0,Stayed with kids,"Such a cool place. The design is so interesting yet cozy and comfortable. Tons of space, beautiful light, easy parking and check-in. Great communication from the host. We'll be back!"
2023-07-01,5.0,Stayed a few nights,"This house has an enormous ""wow factor!"" The pictures can only go so far in how cool the place is when you actually get there. And I have to specifically mention how responsive the host was - well above average! We really enjoyed our stay. The highest recommendation that I can ever give is that I would stay there again (because I am picky). 😊"
2023-07-01,5.0,Stayed a few nights,"The home was absolutely beautiful, it looks just like the pictures. James was an excellent host. Anything we needed he always responded in a timely manner. I strongly recommend this rental."
2023-07-01,5.0,Stayed with kids,"This shipping container home did not disappoint. It was a super, cool experience for our family!! With 4 levels of aesthetically pleasing decor and plenty of spaces to curl up and read a book, or for the family to gather and play a game, none of us wanted to leave. Very spacious. Comfortable. Peaceful. Host was AMAZING! 5 stars all day!!"
2023-07-01,5.0,Group trip,"We really enjoyed our stay at Indy's first container home which is so beautifully furnished and decorated! It's unique, spacious, and clean. The furniture is very comfortable, especially the mattresses. The house is well stocked with everything a guest could need, and having a garage to park in is a huge plus! The neighborhood is safe, quiet, and close to downtown Indianapolis. James is very friendly and helpful. We appreciate how he provided detailed information about getting into the the home, parking, amenities, safety, and food options in the area before check-in. The container home was the perfect place for us to stay, and we would love to stay there again."
2023-07-01,5.0,Stayed a few nights,If you ever get a chance to stay here please DO NOT hesitate. James over communicates and goes out of his way to make you feel at home. I will only stay here when I’m in town.
2023-07-01,5.0,Group trip,"Nice apartment for family and friends get together, peaceful environment will definitely return when am in Indys"
2023-06-01,5.0,Stayed a few nights,This space was great for our team to gather and build our vision. There were multiple work spaces and many other perks! Thank you for a lovely home!
2023-06-01,5.0,Stayed a few nights,"The container home was the most perfect spot for my team’s inaugural planning meeting. The entire space is so open, traffic flows in a perfect way, and starting our days off with morning yoga on the rooftop patio was incredible. We were close to some amazing local food options, but also far away enough from everything so that we could focus on what we came together for. The kitchen and dining area served as our main meeting space, and the Bluetooth speaker was perfect for our dance breaks."
2023-06-01,5.0,Group trip,One of the best airbnbs I’ve ever stayed at.
2023-06-01,5.0,Stayed a few nights,Exceptionally cool place to stay! No doubt
2023-05-01,5.0,Stayed with kids,This was by far the best stay experience we have had with a host through house rental platforms. We would definitely be to stay if we visit Indy again !
2023-05-01,5.0,Stayed a few nights,Fantastic stay while in Indy!
2023-05-01,5.0,Stayed a few nights,"6 stars out of 5, place is over the top clean and nice. Full of surprise goodies that were so appreciated. Hope to stay here again!"
2023-05-01,5.0,Stayed a few nights,"Spectacular stay. James was an incredible host, very responsive and went above and beyond, providing recommendations for restaurants and things to do, and graciously accommodating flexible checkout. The home is beautifully designed, squeaky clean and very comfortable. Our family thoroughly enjoyed our stay and would come back."
2023-05-01,5.0,Stayed a few nights,Fantastic !
2023-05-01,5.0,Group trip,"James was very flexible with check-in/check-out, replied to questions quickly and sent a great set of options for restaurants and bars in the area."
2023-05-01,5.0,Stayed a few nights,Fantastic stay ! When traveling through Indy !
2023-04-01,5.0,Stayed a few nights,"Great place, close to where we planned to spend time and easy to get in and out of. Clean, easy stay. Thanks!"
2023-04-01,5.0,Group trip,Awesome Location! Great Place with plenty room and very close to tons of restaurants and things to do. I would definitely stay there again. Thanks James!
2023-04-01,5.0,Stayed a few nights,James place was a great location and space for us to hold a company owners retreat. James information for check-in was clear and made the process easy
2023-04-01,5.0,Stayed a few nights,Another stay well worth- if traveling through Indianapolis!
2023-04-01,5.0,Stayed with kids,Everything was great we had a little internet outage in the area and they walked me through fixing it. Don’t really like the landscape around the house bunch of “different” people next door staring but other than that the house is BEAUTIFUL ! Would def get again if need be. Thanks guys
2023-04-01,5.0,Stayed a few nights,A wonderful place to stay no doubt-
2023-04-01,5.0,Stayed a few nights,"This house is truly beautiful. Updated modern living at its finest. James provided plenty of walkable Resturant recommendations, which made finding great food a breeze. Would highly recommend staying in Indianapolis’s first container home. 5 star host / 5 star house."
2023-03-01,5.0,Stayed a few nights,Another great stay at the property !
2023-03-01,5.0,Stayed a few nights,Another excellent stay !
2023-03-01,5.0,Stayed with kids,One of the coolest places we have ever stayed! Beautiful inside and out! Walking distance to a local distillery and brewery!
2023-03-01,5.0,Stayed a few nights,Another excellent stay ! If traveling through Indy - I highly recommend !
2023-03-01,5.0,Stayed a few nights,Another fantastic stay here !
2023-03-01,5.0,Stayed one night,"The place is just as described in the pics. There’s 4 levels to the home, plenty of space and amenities. The sun rises in the front of the home and sets in the back of the home. It’s a great space for plenty of people! Every bedroom has a tv and the basement is a fun space for all! Book it!"
2023-03-01,5.0,Stayed a few nights,Another Quality stay !
2023-02-01,5.0,Stayed a few nights,Its a great place to stay while cruising through Indianapolis!
2023-02-01,5.0,Stayed a few nights,"I don’t think I can come close to writing a good enough review to convey how wonderful my experience was. This house is absolutely incredible! The decor was STUNNING! Everything was perfect and clean! Every detail was thought of and was provided to make us feel right at home. It was SO clean and comfortable. It was spacious, well equipped in every way. We really loved walking around and looking at how cute everything was decorated! I’ve never seen a container home before let alone stayed in one. This was hands down MY FAVORITE Airbnb that I’ve ever rented. James was so incredibly kind and helpful and we felt really comfortable there. Thank you sooo much for this cool place. We will DEFINITELY be coming back and will recommend it to anyone who’s looking for a place!"
2023-02-01,5.0,Stayed a few nights,Fantastic property ! We highly recommend !!
2023-02-01,5.0,Stayed a few nights,I highly recommend staying at this cool property if staying in Indianapolis !
2023-10-01,5.0,Stayed one night,As always...great stay!
2023-10-01,5.0,Stayed one night,Outstanding
2023-10-01,5.0,Stayed one night,"Nice, clean and quiet place 👍"
2023-10-01,5.0,Stayed one night,It was really affordable place in Indianapolis!
2023-10-01,5.0,Stayed one night,"I booked last minute and it took just a moment to receive the code for check in, but I called Angel and she picked up after the first ring. Instructions were sent shortly after. The home, while older, is clean and overall in good condition. There was only one other guest during my stay and no issues there. The bare bones room furniture (nothing but a night stand), older style home, and hostel style approach might not be for everyone. However, with the exorbitant cost of hotels, Angels place represents a good value for those that literally just need a clean place to sleep for a night. Therefore, it gets five stars from me. Thankful for places like this that can provide the basics and still be affordable."
2023-09-01,5.0,Stayed one night,Amazing place.
