date,rating,note,review_text
2024-06-01,5,Stayed one night,"Very good stay, quick check in"
2024-06-01,5,Stayed one night,"A great place to stay on my way to Minneapolis St. Paul. The house was really clean and adorable. Maura even had some fun little K cups available for her guests to use in her Keurig, which I really appreciated because I forgot to get some at the store on my way up. The house was decorated with a find Bohemian style. You could tell that Maura put a lot of effort into the details of her living room and kitchen; the communal areas of this home There were some great restaurants near nearby on the main street in downtown Janesville. I had a wonderful salmon salad at the Whiskey Bar and Grill. Also, the neighborhood had an old-fashioned little Americana feel and I felt extremely safe. In fact, I’m staying there again on my way back home tomorrow evening. Thank you so much for your hospitality Maura!"
2024-06-01,5,Stayed one night,Very comfortable and clean apartment! Highly recommend.
2024-06-01,5,Stayed about a week,"The house was very comfortable and a homey place to stay for a week. It is well-set up for people traveling alone or with one other person. The kitchen was well-equipped and I appreciated being able to cook breakfast. The only missing item was a cutting board, which is not essential. The living room was cosy, a bit small if we had been a group of four, however great for one person working on a laptop. I really appreciated being able to park in the driveway for peace of mind about the rental car! It was great to know that Maura and her husband were available and responsive throughout my stay. Overall, they have provided a comfortable and very functional place to stay durya visit to Janesville."
2024-06-01,4,Stayed with a pet,"Inexpensive space with a large backyard for the dogs. There is only one bathroom for four rooms, so that could mean up to 8 adults sharing one bathroom. The shared kitchen was sufficient for minimal meals and food storage in the refrigerator/freezer. Maura was very communicative."
2024-05-01,5,Stayed a few nights,Very Nice. Would come back if I needed to.
2024-04-01,5,Stayed with a pet,Cute little place and nice fenced in yard for the dogs
2024-04-01,5,Stayed one night,Maura was amazing! Check in was very easy and the instructions were clear. I left my glasses and Maura was kind enough to send them to me! Would stay here again :)
2024-04-01,5,Stayed a few nights,Nice place.
2024-03-01,5,Stayed one night,"Maura’s place was fantastic, easy and flexible check in all for a great price."
2024-03-01,5,Stayed a few nights,"The house as elegantly decorated. The host provided soap and shampoo for the bathroom, and allowed me to use the garage where I staged my luggage for my next stage of travel. The people staying there, on the other had were very stand offish and it was like having the house to myself. I am used to a more socially friendly place (not Maura's fault)"
2024-02-01,5,Stayed one night,Easy to find and cozy.
2024-01-01,5,Stayed one night,"Very clean accommodations, comfy bed, quiet neighborhood."
2024-01-01,4,Stayed with a pet,"This place was nice; comfy after a snow storm around Janesville. The place was warm, the paths shoveled and a place for leaving shoes. My 2 pugs enjoyed the area even though the snow was too high for them 😃. But they were able to find spots to go. 💩 And having a poop bags available was very nice as I had forgot mine. Having a kitchen available was very nice. I will stay again when in the area."
2024-01-01,5,Stayed over a week,I stayed for 8 weeks. Very nice clean place to stay. Host was always responsive. If I ever go back to Janesville I would definitely stay with them again.
2023-12-01,5,Stayed one night,"Super warm, cozy, and a perfect place to sleep after a night out. Nice quiet area super close to the main streets where there is more to do and see."
2023-10-01,5,Stayed a few nights,"Nice place to stay for a couple days to a week. Nice bathroom, good workspace in bedroom, and really comfy bed!"
2023-10-01,5,Stayed with a pet,"This was the first time I have had other guests staying at the same location, but all other guests were friendly and helped when needed. The location of Maura's house was in a great location, I had access to all my events within 10 mins from location. I would stay again if ever in the area."
2023-10-01,5,Stayed with a pet,"I stayed here 1 night as a stop over on our 2 day road trip. It was so nice to have an area to let my dog out and there was another guest with a dog so they got to play a little which helped. The house is super clean, which is impressive considering how many people must stay there on a weekly basis and most of the house is shared."
2023-09-01,5,Stayed a few nights,Maura was very helpful and the house was great!
2023-09-01,5,Stayed over a week,"Stayed for a month and was very happy with the quiet neighborhood, the fenced in yard for the dog, and the friendly and timely response from Maura. Definitely would stay again!"
2024-06-01,5,Stayed with kids,Such a quiet neighborhood and close to everything we needed. House was very clean and well stocked. Would definitely stay again!
2024-06-01,5,Stayed with kids,The house was perfect for my family. It was immaculate and very comfortable. They were very accommodating and stocked the home with an array of supplies and essentials. We are so grateful!
2024-03-01,5,Stayed a few nights,Great place to stay for the weekend! Plenty of space and nice touches. Will be staying again!
2024-03-01,5,Stayed one night,"This place was super amazing. The host was an absolutely outstanding. Was flexible with my checkout , responded very fast for last minute plans and also gave me a discount for my military service. I the house was clean and unique. Would definitely book here again next time I come to visit."
2024-03-01,5,Group trip,Newly renovated and Spotless.
2024-03-01,5,Group trip,Nice place!
2024-03-01,5,Stayed a few nights,"This home is in a great location, very convenient for the town. It was in pristine condition and very well decorated. The cleanest airbnb I’ve stayed in to date. It’s perfect for a weekend landing spot or a professional staying in the area for business. The hosts were very helpful prior to my stay and had everything ready for my arrival. Thank you!"
2024-04-01,5,Group trip,Great place with lots of land and bedrooms!
2024-04-01,5,Stayed with kids,Absolutely gorgeous home and perfect for a large family. Very gracious hosts. Hoping to stay again the next time we visit.
2024-03-01,5,Group trip,"Thank you very much for everything, definitely recommend this home and will definitely be back!"
2024-03-01,5,Group trip,Great place to stay with a large group! 15 min drive to Janesville with groceries and food options.
2024-02-01,5,Group trip,"We had a great stay at the farmhouse. It fit our needs for a business/social retreat with a great kitchen, dining table and places for conversation. The sleeping accommodations were also very nice. Host was very responsive and pleasant. Beautiful location in rural Wisconsin."
2024-02-01,5,Group trip,Very private and the house was really clean
2024-01-01,5,Group trip,the large dining room was the perfect size for our large family. we are very happy that we found this place.
2023-12-01,5,Stayed with kids,Beautiful home! Booked for the holidays with family. Was very spacious and peaceful! They decorated the home and everything!
2023-12-01,5,Stayed with kids,Thank you
2023-10-01,5,Group trip,We loved it! It was very clean and quite. Beautiful location!
2023-10-01,5,Group trip,"Lovely 1880's farm house has been updated cosmetically and provides comfort and space for a large group. Good communication, check in was easy and flexible due to no booking immediately before or after, ample parking, well stocked kitchen including a nice welcome basket, awesome large dining table with coffee bar area, comfortable beds in bedrooms with ceiling fans.
Biggest negatives: No bathroom on the second floor where 4 of the 5 bedrooms are. Downsides: The towels in the bathrooms are somewhat small (although an abundance of wash cloths were provided) No side tables for some of the beds, no table lamps, and limited outlets for plugging in. The road the house sits on is actually fairly busy and surprisingly noisy even late at night.
One complaint: removing my own bedding and taking out trash when I'm being charged a hefty cleaning fee. (Other places do not require this)
But, it's a beautiful home, in a lovely setting, great for large groups convenient to several towns in the area"
2023-10-01,5,Group trip,"We absolutely loved our stay!!!
It was worth what we paid and absolutely BEAUTIFUL!
We stayed for a wedding in Janesville and met our needs in so many ways- the amount of rooms (to fit 8 people), and space it was perfect."
2023-08-01,5,Group trip,"Very nice, clean and very accommodating."
2023-08-01,5,Group trip,"Very rare that I stay somewhere that is better then I thought it would be. This is such a place.
1. Extremely clean and updated
2. Lot of amenities: Firepit, cornhole, etc
3. Communicative and kind hosts. Internet wasnt working. and within a few minutes of telling them, they came and fixed it. Also great suggestions on things to do prior to our arrival
The only con would be only 2 bathrooms, but this is something that is stated very clearly from the beginning and so can plan for the two bathrooms."
2023-08-01,5,Stayed with kids,"This was the perfect stay for a quick family vacation not too far from home! We enjoyed the large dining table, the out door space, used the grill, and the rooms fit everyone just great. The two restrooms there came
in handy with so many of us. It was a pleasant time and can’t wait to be back! Thanks for hosting us!"
2023-08-01,5,Stayed with kids,"This house was amazing for our crew! We were a large group coming from all over to relax and vacation together. The kids had plenty of space for playing and many games of sardines were had. The fire pit was well stocked & the walking field was well maintained so we could stretch our legs. It was the first time we didn’t have to eat in shifts when all together, as we all fit around the dining room table. We were comfortable in our rooms & the insulation was so great that the littles could go to bed early and the big kids could stay up later and play without worry of waking them up. The house itself is beautifully renovated, with amazing old details sprinkled around (ie: the doorknobs!). It was so clean and comfortable! We want to make this a yearly get away!"
2023-07-01,5,Group trip,Wonderful place for a family reunion. Beautiful setting with outdoor seating and historical architecture! We loved it.
2023-07-01,5,Group trip,The house and land is better than the pictures! Everything was perfect for a larger gathering!
2023-07-01,5,Group trip,"This is one of the most beautiful, peaceful places we have rented anywhere in the states! The home is lovely well cared for and spacious. The hosts had a very thoughtful book of things to do and places to eat nearby; we grew up in the area yet discovered new adventures. We made s’mores by the campfire, took walks and watch the fire flies over the field. In the evenings… it was truly magical."
2023-06-01,4,Stayed with kids,The home was just right for my large family. We felt right at home and would definitely use this property again.
2023-06-01,5,Group trip,"Our group really enjoyed staying at the farm house. It was cute and was exactly as pictured. The towels and sheets were very clean, and so were the bathrooms and kitchen. We enjoyed the spacious land and privacy. The welcome book had some good restaurant recommendations that we tried and enjoyed. We hope to be back one day!"
2023-05-01,5,Stayed a few nights,Nice and quiet place for a weekend getaway. Convenient location with all shops available within 10 miles radius. Had basic kitchen utensils for cooking. Lawn was tidy for the kids to play in barefoot. Had basic board games to keep ourselves busy. Would strongly recommend to my friends.
2023-05-01,5,Stayed about a week,"Beautiful, peaceful and nostalgic. Quiet and restful! Very responsive hosts and clearly proud owners of a historic site with remodeled kitchen and plenary of room for big family or group."
2023-04-01,5,Stayed a few nights,Great place. My grabdkids had a great time playing in the yard and exploring the land
2023-03-01,5,Stayed with kids,"I love being in the country so that made it wonderful! The place was super clean, calm, quiet, and very lovely. My son just died and my other children are scattered all around the country, so this was the perfect meeting place. It was nice having my family all be able to stay in this beautiful home without being crowded. The house has so much room, and the huge table in the dining room was just the best. Lots of talking happening around the big table was comforting for everyone. The kitchen was also well stocked and we could cook rather than go to restaurants. From check in till checkout everything went perfectly. This is not a house, it is a home filled with love. We were able to create some new memories to cherish. I’m hoping to be able to come back in a couple of years and have a nice family reunion. I think any family would love this place, and should try it! Highly recommend for peace and quiet when you don’t want the hassles of running from room to room at some random hotel!"
2023-02-01,5,Group trip,"We LOVED this house, it had so much character and charm. We had 16 people and it was a huge space where we never felt crowded or cramped. Absolutely beautiful, hosts were responsive and let us check out late. Also didn’t have to worry about noise with the huge property. Would stay here again in a heartbeat."
2023-01-01,5,Group trip,"This property exceeded all our expectations. The home was spacious and clean, allowing all of us to comfortably reunite and catch up on life. The bedrooms and bathrooms were well equipped with plenty of linens and towels, which added to the overall comfortable and relaxing experience. The location was tranquil, and it was a perfect getaway. The house was very accommodating for our large group allowing us to make memories together. The communication with the host was great as well, they were always available to answer any questions we had. I highly recommend this Airbnb to anyone looking for a comfortable, tranquil, and enjoyable stay, especially for large groups looking to catch up and reunite."
2022-12-01,5,Group trip,"The site is as pictured and described; it was very comfortable for our family reunion. We were 7 adults sharing the house, and it worked very well for us. The bedrooms were large and comfortable, the kitchen was more than adequate for preparing full meals, and the house was tastefully decorated for the holidays. Great dining room with farmhouse table and benches, and nice coffee bar.
The farm is about 15-20 minutes from Janesville, on good roads. Easy to locate, but load up w/ supplies needed before you come."
2022-12-01,5,Stayed with kids,Wonderful AIRBNB. Beautiful house and property. It was perfect for our large family gathering.
2022-11-01,5,Stayed with kids,"Beautiful stay, would definitely recommend and return."
2022-11-01,5,Group trip,The house was perfect. Very clean and welcoming. We had all of the comforts for our stay. We will go back when we visit our family again. So much room too!
2022-10-01,5,Group trip,"Great home, clean updated and well kept"
2024-06-01,5,Stayed a few nights,"We found Jim's place to be a perfect accommodation for our visit. Clean, cozy, quiet and relaxing. Will definitely look to stay again when we are un the area."
2024-06-01,5,Stayed a few nights,"I can't say enough to describe how amazing this little place was! It honestly had everything you would ever need, especially for long stays, and it was very cozy. My mom and I only stayed a weekend, but would love to come back for a longer visit. This definitely will become our goto stay when visiting family in Janesville! Thank you so much for sharing this lovely home 😊"
2024-06-01,5,Stayed with kids,"We had such a comfortable stay at Jim’s place! It was much better than we expected, actually. They had everything you would need in the kitchen for cooking and even had plenty of snacks and water which was a wonderful touch. The area was very clean and the linens smelled great. The host was quick to respond with any questions we had. We would definitely stay here again next time we visit the area!"
2024-04-01,5,Stayed with kids,My family and I had a wonderful stay here. We are return visitors and will be back next time we are in Janesville. This is the ideal Airbnb for anyone looking for a quiet and comfortable place to stay during your trip. Couldn’t recommend it more!
2024-04-01,5,Stayed a few nights,"Staying at Jim's place was great. Everything was as described, and matched the pictures (or was better in person!) We walked to several restaurants and enjoyed the area, as well as our being able to come back to our quiet, clean, and homey stay."
2024-04-01,5,Stayed a few nights,Jim was a great host!
2024-03-01,5,Stayed with kids,This was a lovely one bedroom two bed apartment. Very close to downtown and had off street parking. Was exactly how it was advertised and allowed us to have a great visit in Janesville.
2024-03-01,5,Stayed a few nights,"This was our fifth time staying at Jim’s. It’s always comfortable, cozy, and clean. The kitchen is well stocked if you plan to cook. The new TV in the bedroom and new air fryer were great additions since the last time we were there. It’s also walking distance to a small Mexican Restaurant and Grocery store."
2024-03-01,5,Stayed about a week,"Among my favorite Airbnb places! Perfect size for one or a few guests. Nicely furnished, including a decent set of cutlery! Jim & Marilyn left some snacks and bottled water which were appreciated after a cross country drive. Quiet, respectful neighbors in a nice middle class working neighborhood - more like ""small town"" feel rather than suburbia. Great internet connectivity. I'd stay at Jim & Marilyn's place again!"
2024-03-01,5,Stayed a few nights,"Beautiful place. Pictures are very accurate! Clean and convenient, great communication."
2024-03-01,5,Stayed a few nights,Highly recommend this rental. Great location-could walk to downtown restaurants. Place is charming and well kept.
2024-02-01,5,Stayed about a week,Very nice place! Loved how he had coffee and a sweet treat in the fridge. Will probably be booking again soon!
2024-02-01,5,Stayed a few nights,Great stay for the price
2023-11-01,5,Stayed a few nights,"Clean, cozy, and comfortable, Exactly what we were looking for. We felt right at home and had a great weekend in Janesville!"
2023-11-01,5,Stayed a few nights,"Excellent location and so well appointed! Very spacious and very cozy. Jim & his wife were so friendly and helpful, ensured I got in alright. The kitchen has the basics (like actually has them so you don’t have to buy oil/butter/spices if you opt to cook) and then some. Very walkable to downtown Janesville but set a couple min away from the middle of everything so it feels cozy & quiet at night."
2023-11-01,5,Stayed a few nights,"LOVED!! An absolutely perfect stay and the photos don’t do the apartment justice. Super nice and responsive hosts, Jim greeted me in person with a delicious pumpkin roll in hand that paired wonderfully with hazelnut coffee - what a warm welcome! There are two beds with excellent separation for two individuals traveling together, the bed was super comfortable, as was the furniture in the living room. There’s a cozy fireplace that I didn’t use, but everything is so inviting that I didn’t want to leave. I really appreciated the ceiling fans as well as portable tower fans that will oscillate. The lights on dimmers were much appreciated, too! So many thoughtful touches. This has been my hand-down favorite stay. I was in town to meet with an attorney and found this location to be super convenient to the downtown and courthouse area, easily walkable and friendly neighborhood that felt exceptionally safe. It was nice to be able to use the driveway, especially for unloading and loading luggage."
2023-11-01,5,Stayed a few nights,"This place is perfect. Loved all the little touches including instructions for light switches and TV, snacks, and the cinnamon rolls. It’s clear the host takes a lot of pride in this place and enjoys hosting. Bed was comfortable and place was clean and quiet. Loved the decor in kitchen and living room and the elector fireplace made it really cozy. Can’t wait to stay here again!"
2023-10-01,5,Stayed a few nights,Jim's is a great place to stay while visiting Janesville. It had everything we needed and the location was perfect to walk downtown. We would love to stay again next time we visit.
2023-09-01,5,Stayed a few nights,"Great spot. Walked to downtown, lots of restaurants, bars, etc. quiet and peaceful backyard. Two clean and comfortable beds. Full well stocked kitchen. Great value."
2023-08-01,5,Stayed a few nights,"We love staying at this apartment. This was our third visit. We actually booked our next stay before I even got around to writing this review for our previous stay, so we'll be back soon! The apartment is very comfortable, well stocked, and a home away from home. I ended up having a terrible migraine the night we arrived. I appreciated so much the comfortable couch where I could just rest and watch t.v. The apartment is walking distance to the Lions Food Mart, as well as a Mexican grocery store/restaurant. The grocery store/restaurant has basics and we were able to get eggs, cheese for quesadillas, and a lemon for some homemade guacomole. I always cook when we are there and the apartment is well stocked with a blender, crockpot, cooking utensils, etc."
2023-08-01,5,Stayed with kids,"This was my first Airbnb experience, and the bar has been set very high.
They thought of pretty much everything. I arrived later than intended and not only did Jim take my phone call to help me find the location, he stayed on the phone to be sure my code worked on the door and I could enter.
The water bottles in the fridge and snacks available were a wonderful addition (especially after a long day of flights). They had an entire folder of local restaurants and things to do in addition to puzzles and some games in the house. Instructions were clear for everything and we had a wonderful stay.
When we come back to visit family again we will definitely plan on staying here. We had a great time and it was everything we could need and more."
2023-08-01,5,Stayed a few nights,"I’m a Superhost myself and I have to say, Jims place is amazing. The bed was comfortable and had everything we needed. We surprised my daughter who just moved here for a job and turned 21 years old. Was not to bad of a drive into Madison and we enjoyed ourselves exploring. Came back to the Airbnb cooked dinner enjoying the outdoor patio space play a trivia game they had. We definitely will stay here anytime we visit."
2023-07-01,5,Stayed with kids,"This is the fourth time we have booked here, so, obviously, we love it. It is our go-to place when we visit family in Wisconsin. Thanks for everything!"
2023-07-01,5,Stayed a few nights,I would definitely stay here again! Jim was very responsive to any questions we had and very accommodating! Place was exceptionally clean and comfortable...almost wished we could have stayed longer. Definitely see why he is a superhost. Overall an excellent experience.
2023-07-01,4,Stayed with kids,"Overall, we had a good experience at Jim’s place! It was nice being able to get just about anywhere in town in ~10 minutes. We had trouble with the code to get in initially, but the issue was resolved within 30 minutes or so. Unfortunately, the wifi was in and out our whole stay, but Jim was responsive about it. While we didn’t pursue getting the issue resolved (we weren’t at the house much, so it just didn’t feel worth it to worry about), Jim offered to come over to take a look, and we feel confident he would’ve gotten it resolved. He actually refunded us part of our fee for the trouble… so kind! The hosts left muffins on the island for us, which was so thoughtful (and awesome particularly for our 5 year old… she was excited)! And we really appreciated the cold waters in the fridge after a 20+ hour trip. I think it’s important to note the home is older (i.e. no central A/C, uneven floors, smaller spaces, etc) - so as long as that’s your vibe, you should have a great stay!"
2023-06-01,5,Stayed a few nights,We had such an enjoyable stay! The house was so cozy and private. We loved using the kitchen and how easy to use everything was. There were so many thoughtful touches that made us feel right at home. We wish we would have booked a longer stay! The location was so convenient and close to all we needed to get to. Thanks for such a wonderful time!
2023-06-01,5,Stayed a few nights,"The house was just as described. It was very clean and well stocked with towels, bed sheets etc. The location was quiet and peaceful."
2023-06-01,5,Stayed a few nights,This is the 3rd time we have stayed here while visiting family in town. Always love to see the continued updates but we felt the change to bi-fold doors on the bathroom lead to much less privacy. We will definitely be back when in town.
