date,rating,note,review_text
2024-06-01,5.0,Stayed a few nights,Peaceful and clean cabin. It was a great experience!
2024-06-01,5.0,Stayed with kids,"The house was perfect for our small family gathering. Everything needed was there. Great outdoor spaces, 3 minute walk to the river. Host very responsive. Easy check in. Beautiful surroundings. Loved it."
2024-06-01,5.0,Stayed one night,"Beautiful home located in a private, rural setting. The view was gorgeous and it was a peaceful place to relax. John was very responsive and helpful to make our stay perfect. I look forward to spending time here again when visiting family in the area."
2024-06-01,5.0,Stayed a few nights,Ew construction. Clean Perfert
2024-06-01,5.0,Stayed a few nights,"In short, John’s cabin is an absolute gem. We most enjoyed the quiet accompanied by the sounds of nature. We saw badgers, deer, eagles, owls and a whole plethora of other wildlife. Bring your binoculars and a good camera! Memories will be made!"
2024-04-01,5.0,Stayed a few nights,"Highly recommend if you're looking for a quiet, remote getaway. Thanks, John!"
2024-04-01,5.0,Stayed a few nights,"This place is great for those that want to “camp” comfortably, and it’s much better than just that. I could spend days here without getting in my Truck, as could my young children."
2024-04-01,5.0,Stayed a few nights,This place is great. Very beautiful place and great surroundings. If u love the outdoors then this place is for you. Right on the river. Lots of wildlife viewing and can see every star in the evenings.
2024-04-01,5.0,Stayed with kids,Great place to stay! Would love to go back again! It was so peaceful and the house was beautiful!
2024-04-01,4.0,Group trip,Great place to stay in the Nebraska countryside. Peaceful and quiet.
2024-03-01,5.0,Group trip,Great getaway and awesome location. Thank you!
2024-03-01,5.0,Stayed one night,One of the most beautiful properties in Nebraska. The home feels like home and is very spacious. Huge kitchen. We met our friends there and had a wonderful visit. John also provided us with farm fresh eggs!
2024-03-01,5.0,Group trip,"This place was a gem! Surrounded by nature, peaceful, could see the stars at night and breath the fresh air. This was the perfect get-away."
2024-03-01,5.0,Stayed a few nights,"This was a great private getaway from all the crowds while on a crane watching trip. The river was just down from the cabin as described and the property was great for a little hiking and exploring. We brought all of our food for cooking at the cabin and the kitchen was well stocked with everything we needed for food prep.
Towels and linens were clean and sufficient. There was a nice supply of board games for a rainy day, 3 SmartTV's, and a pair of binoculars for checking out any wildlife you may see at a distance. We definitely heard the wild animals in the middle of the night, but it justed added to the ambiance.
Check-in/out instructions were easy to follow.
Dishwasher, washer and dryer, coffee pot [cone filters], toaster were available and functioning
TIP: Arrive with your food, as the property is as described, off the beaten path. I imagine you will have a bit of a drive to the nearest grocery store if you didn't plan ahead. We were prepared for, and loved the seclusion."
2024-03-01,5.0,Group trip,The cabin was beautiful and perfect for a girls weekend getaway. The kitchen was great with all of the necessary cooking items to prepare our meals. The main room was so spacious and the furniture was comfortable. We're already discussing when to book our next weekend getaway.
2024-03-01,5.0,Stayed with kids,Beautiful home on a beautiful piece of property.
2024-02-01,5.0,Stayed one night,"This place is a gem. My girlfriend and I attended a nearby bull sale and it really couldn’t get any closer. This place is quiet, private, and very spacious. The floor plan is super open and there is a ton of room to spread out. It more than accommodated just the 2 of us and could very easily host a multi-family stay. John was easy to work with and the self check-in with the keypad is a breeze. Do plan to bring your own food as there is not much other than condiments and town is a good distance away. You can definitely cook anything you’d want. There are pots, pans, cookie sheets, a crockpot, etc. The included washer dryer is also nice, we were able to run a load with little issue.
Do be wary of wildlife however. We arrived after dark and there were definitely critters hanging out on the front step when we tried to get in. Not a problem, just an observation. You should expect such things when staying in the Sandhills! 10/10, really can’t go wrong here."
2024-02-01,5.0,Stayed a few nights,"Very friendly hosts, clean and enjoyable"
2024-02-01,5.0,Group trip,Great place to stay. The house was great and the property was beautiful. John was a great host.
2024-01-01,5.0,Group trip,Great place to stay. John is a great host. Really enjoyed our time!!
2024-01-01,5.0,Stayed a few nights,Great host!
2023-12-01,5.0,Stayed a few nights,"The property is gorgeous, watching the sunset through the windows and from the porch made the trip worth it. It was cold and I had issues with getting inside because the lock was frozen but John talked me through it and was immediate in responses to any requests I had. It’s an amazing place and well worth the booking."
2023-12-01,5.0,Stayed with kids,"John has a great place to stay! My family and I will definitely be back, everyone loved the home. The scenery is beautiful, it was a home away from home. John is an outstanding host and we’re happy we got to meet him!"
2023-12-01,5.0,Stayed with kids,We were on a big road trip from Salt Lake City to New Jersey and John’s place was our first stop. It was perfect for our quick stop and our big family. My kids loved the bunk beds!
2023-11-01,5.0,Stayed with kids,"We only wish we could stay longer at John’s house. It was absolutely beautiful, outside and inside. Very clean, new. The host was very responsive and helpful. We will definitely be back for longer stay."
2023-09-01,5.0,Stayed one night,great place and good host!Thank you
2023-09-01,5.0,Stayed one night,Great space. Beautiful house with a great view. Everything we needed for a quiet relaxing evening.
2023-09-01,5.0,Stayed with kids,Very peaceful! Our family had a wonderful stay!
2023-09-01,5.0,Stayed a few nights,It was a very quit and peaceful place to stay
2023-09-01,5.0,Stayed a few nights,"The place is really well done, very clean and cozy. Perfect for a large group or just the two of us. Well stocked kitchen for cooking or good restaurants not to far away. We enjoyed a nice evening fire in the fire pit with tons of stars including plenty of shooting stars. The sunsets both nights were spectacular. This is a special place and John was the best."
2023-08-01,5.0,Stayed a few nights,Another great stay at John's place. Love the secluded and peaceful cabin. Looking forward to planning our next trip!
2023-08-01,5.0,Stayed with kids,"This riverside home was everything we hoped for...and more! It is pretty secluded (which suited us great!), in a beautiful part of Nebraska, surrounded by hills, trees, fields, and wildflowers. We brought our two little guys (3yrs and 1.5yrs) and they had great fun romping in the yard and playing on the front porch. The river is accessible but not so close to the house as to make it worrisome for little people who can't swim. A nice little clearing by the river, surrounded by towering cottonwoods, holds a zipline, swing, and slack line that make for great fun. The house itself is clean and beautiful (""magical"" and ""refreshing"" were two words that kept popping up in our vocabulary while we were there), with a well-thought-out layout and a crisp decorating style that is chic while being very kid-friendly at the same time. We are already talking about coming back! We highly recommend this place and its hosts. Thanks for a great stay, John and Mandy!"
2023-08-01,5.0,Stayed a few nights,Our stay at the cabin was lovely in every way. It was so quiet and relaxing. I couldn’t recommend it more and we will definitely be back!
2023-08-01,5.0,Stayed a few nights,"Nice little vacation, we went to the winery's (passport Nebraska) - they were a little drive to get to but not bad. Their house was a great way to end the evening great views. And their beef and farm fresh eggs were great :)"
2023-08-01,5.0,Stayed with kids,The property was beautiful! We hope to make it a yearly stay. I wish we could have stayed longer. Very family friendly. Our kids had a blast!
2023-08-01,5.0,Stayed a few nights,"The location, view, river, and cabin were beautiful!"
2023-08-01,5.0,Group trip,"From the beginning to end the whole trip was fantastic. John was very responsive and helpful and had an amazing place to stay. The ribeyes that were purchased from him were some of the best steaks we tried and the provided grill was excellent. We had no complaints. We did not venture to the river, but the environment was great and exploring the fields was beautiful. Highly recommend."
2023-08-01,5.0,Stayed with kids,"The River cabin was absolutely amazing! Our hosts were the best, very accommodating and great with communication! The property was beautiful. The perfect place to explore and swim! We will definitely be back."
2023-07-01,5.0,Group trip,"Amazing cabin with wonderful western Nebraska views. Hosts were very responsive and helpful. Super private with river access and plenty to do. Great for a weekend getaway or extended stay, would definitely stay here again."
2023-07-01,5.0,Group trip,The views were incredible and John was very accommodating!
2023-07-01,5.0,Stayed one night,"Great host, great steaks, peaceful location"
2023-07-01,5.0,Stayed with kids,"It was a great place to stay for my family! They loved the tree swings, zip lines and hay bales to climb. This was my kids favorite place on our trip west. The porch was peaceful, views were amazing and the night sky was incredible. The beds were comfortable and the house stayed nice and cool in the 95degree heat!"
2023-07-01,5.0,Stayed with kids,"We stopped after a long day of driving with 4 older kids (ages 11-16) and were immediately able to relax and stretch out. John gave clear instructions and the property was beautiful. Kids ran right to the river and zip line. The big round hay bale to climb up and swing from was a hit all around. Absolutely beautiful and so peaceful. The accommodations were in perfect shape, clean and spacious. We were very comfortable. Would stop again!!"
2023-07-01,5.0,Stayed with kids,"The house was lovely and just as described. The river was a short walk from the house, and there was a swing and zipline for the kids to enjoy. It was absolutely gorgeous and so peaceful."
2023-07-01,5.0,Stayed with kids,The home was clean and beautiful. The host are friendly and very helpful. Peaceful area and a great place to be with family. Our family cemeterywas down the road and the kids lived fishing by the river. Great place!
2023-06-01,5.0,Stayed a few nights,"John and Mandy were amazing hosts! The whole process and everything was very smooth, pleasant, exactly what was listed! The area was so beautiful and breath taking…. The view were amazing! The location was a very good location…. John helped us keep updated on the weather and storms, he helped guide us on the best possible route and roads to take….. John was very responsive thru the whole process and also the whole weekend…. He and Mandy made sure to message us and tell us to have a good visit, to relax and enjoy our time and visit, and also to check and see if we needed anything and that they would help us gather stuff for fire pit and help bring us stuff to start a fire…..I would definitely recommend and highly recommend to friends, family who want to enjoy a quiet, peaceful and secluded getaway or vacation….I hands down would have to say that we were and are blessed with the best hosts ever! It will be definitely hard to find better people then these two…. There’s a whole lot to say!"
2023-06-01,5.0,Stayed a few nights,"We had a great stay at the River Cabin! It's a beautiful home, with all of the amenities one could want. The surrounding countryside is very peaceful and picturesque. The South Loup River is just a few steps away and was great to kayak. The location is fairly remote, requiring some gravel road travel, but that's part of the charm. We expect a return visit!"
2023-06-01,5.0,Stayed one night,Great place to stay very beautiful views and very spacious! John the host was very responsive with communication and gave great instructions on how to get into the house! Would definitely recommend for a quiet clean place to stay!
2023-06-01,5.0,Stayed with kids,"Such a beautiful location and home. Very newly constructed, adorable decor, and super clean. It’s a bit off the beaten path as we were just passing through, but the space was perfect for a big group. Comfortable beds, thoughtful lighting by the beds and easy access to outlets. Great kitchen supplies.
As a superhost myself, I thought John and Mandy were stellar hosts that were always quick to respond. They were helpful and you could tell they took pride in their role as hosts!"
2023-06-01,5.0,Stayed with kids,"John’s home was perfect for our multigenerational family! It was clean, comfortable, spacious, and had everything you could need. John was a wonderful host - super responsive, and very accommodating. And the setting was absolutely gorgeous. I would highly recommend staying here and hope I can return soon!"
2023-06-01,5.0,Stayed with kids,"We had a nice short stay while passing through NE. The house was clean and organized. Make sure you bring the groceries and coffee you'll need for your stay because its a good drive to the closest town for supplies.
Thanks John!"
2023-06-01,5.0,Stayed a few nights,John's place was a little farther away from Kearney than what I usually stay when working there but I absolutely loved the property! Deer greeted me every morning when I pulled into the drive and the surrounding countryside was some of the most picturesque I've ever encountered. Loved it. 👍
2023-05-01,5.0,Stayed with kids,"This is the perfect place if you want to get away from everyone and everything! Views are spectacular and John and Mandy were great! Responded right away and answered all questions! The cabin was immaculate!! Pictures were exact and it was great for just 2 of us but has room for the entire family! Would recommend this place to everyone!!
10 Star Rating!!!"
2023-05-01,5.0,Group trip,Beautiful place that was perfect for our stay!
2023-05-01,5.0,Stayed a few nights,We had a great stay. John and his wife are great hosts. We loved the accommodations and seclusion of the cabin. We are already planning our next weekend get away. Definitely a hidden gem!
2023-05-01,5.0,Stayed a few nights,The place is the best. We had a great time. Lots of privacy. Wonderful place to stay. We could live there.
2023-04-01,5.0,Stayed a few nights,"John and his wife were amazing hosts. I am a Airbnb super host myself, and I have much to learn from John. He communicated very clearly and efficiently. The place was extremely clean. The beds were comfortable. The environment was peaceful, and I just couldn’t say anything better about the accommodations. As a matter of fact, he even gives you the ability to buy his farm, fresh steaks and eggs, which are probably the best you’ll ever have. Thank you guys for your tremendous hospitality. I wish I could give you 10 stars out of five."
2024-06-01,5.0,Stayed one night,Just stayed one night but it was very cozy and comfortable! Great communication as well as very peaceful location! I would stay here again and recommend it to anyone looking for a place in Kearney Nebraska!
2024-06-01,5.0,Stayed a few nights,"This place was great, Garland was more than helpful. I would recommend this place to any travelers."
2024-06-01,5.0,Stayed about a week,Great AIrbnb! Thank you for such a beautiful home for our stay!
2024-04-01,5.0,Stayed one night,"Nice and warm hosting, house is clean and spacious"
2024-03-01,5.0,Stayed a few nights,It was a wonderful stay! They were very responsive to messages and checked in on us. Checkin was super easy. Nice quiet place to unwind after a long day of classes! We will stay again!
2024-02-01,5.0,Stayed a few nights,"great stay, would stay here again when its available"
2023-11-01,5.0,Group trip,This was our 2nd stay. Highly recommend!! So comfortable and cozy. Beds are amazing and so comfortable.
2023-11-01,5.0,Group trip,"This was a wonderful option for multiple family traveling together, rather than multiple hotel rooms, on long trip. Very clean, easy access, and private for parking trucks/trailers with trip gear (didn't have to unload everything to keep it safe).
Hosts were great and communicated well!!"
2023-08-01,5.0,Stayed with kids,It was an amazing stay. The responses to our questions were very very quick. Most definitely will book with them again!
2023-08-01,5.0,Stayed one night,Garland and Lorna were excellent hosts We came in for a late arrival and they guided us to where we needed to be Beautiful and peaceful setting Clean and really neat Would recommend this place to anyone staying in the area Super friendly hosts 😊😊♥️
2023-08-01,5.0,Group trip,Me and my family loved it
2023-08-01,5.0,Group trip,A very clean and comfortable stay in Kearney. Could not have asked for a better experience
2023-07-01,5.0,Stayed one night,Great clean place. We enjoyed our visit to Kearney and your place was very nice!
2023-07-01,5.0,Group trip,"We loved staying in this home. There are three bedrooms which easily accommodated our families who were traveling together. The house was very clean and homey. We especially enjoyed the kitchen. It was well stocked with all the essential cooking supplies, so we were able to make a nice dinner and breakfast. Also, the setting was lovely. The farm is in a rural area, but close to interstate access. Finally, Lorna and Garland were great hosts."
2023-07-01,5.0,Group trip,We had a wonderful stay. It was just in the country and very peaceful. Everything was just as described and very clean.
2023-07-01,5.0,Group trip,"We thoroughly enjoyed our stay and the lodging was just as depicted in the description. It is a very private and peaceful home with a wonderful atmosphere. Garland and Lorna are very friendly, accommodating and I really enjoyed visiting with them. They made us feel welcome and right at home. We will definitely stay there again! Thanks.
Best,
Doug"
2023-07-01,5.0,Stayed with kids,Garland and Lorna’s place was so clean and comfortable. It was very spacious with plenty of room for my seven member family. They were super helpful in making sure we got there without any GPS confusion. Wonderful hosts and would definitely recommend without hesitation.
2023-07-01,5.0,Stayed with kids,"cute place, great beds, quick to respond"
2023-07-01,5.0,Stayed with kids,This is a must place to stay at! Super friendly and great people.
2023-06-01,5.0,Stayed with kids,Loved it. Great location for a family with kids. Very quiet. Only Apple Maps showed the correct location for some reason. Hosts warned us of that before hand.
2023-06-01,5.0,Stayed with kids,"Awesome place, clean and well maintained. Living room is cluttered but still very workable and a place to gather. Description didn't say it was on gravel road, but we live on a gravel road, but others did not but it was so worth the price, so clean and great accommodations so overall 5 stars."
2023-06-01,5.0,Stayed one night,"Even though the living room furniture looked like it came from the 80s LOL, it was clean and comfortable. A bit like staying at Grandma's--complete with piano--, except Grandpa put in a great TV. The house was spacious. Beds were very high quality--which is really where you want the luxury to be. Little touches like usb ports and wireless chargers. Beautiful surroundings. Will definitely stay again if we find ourselves in Kearney. Highly recommended! Thanks!"
2023-06-01,5.0,Stayed a few nights,"Great price, really nice accommodation will stay there in the future. Can not say enough about our hosting couple fantastic down to earth people."
2023-05-01,5.0,Stayed one night,A nice way to stay in Kearney- Just outside city limits! Super quiet and enough space for our family. The kids thought it was pretty cool staying in a “shouse”.
2024-06-01,5.0,Group trip,"Great place for a group, with plenty of beds and lots of outdoor space. Interior worked well for us, though it could be tough to find seating for everyone to be together if the group is large. Excellent hosts who responded quickly and thoroughly when we needed it."
2024-06-01,5.0,Stayed a few nights,Love it. Stayed multiple times and always been great!
2024-06-01,5.0,Stayed with kids,"The house was perfect for our family group and allowed for a wonderful celebration for my daughter's college graduation. The host was responsive, accommodating and friendly!! The space is a beautiful, peaceful setting and the home has plenty of space for gathering while allowing privacy as well!! Thank you so much, Tyler, for all you did to make our stay wonderful!!"
2024-06-01,5.0,Group trip,"Enjoyed our stay. Very comfortable house in a beautiful, peaceful country setting."
2024-06-01,5.0,Stayed a few nights,"Stayed here multiple times. Great location, very clean and accommodating and a wonderful host. Will be back!"
2024-06-01,5.0,Group trip,"Amazing communicators. The house was very clean, exactly as advertised, and in a gorgeous setting. We will gladly return again."
2024-05-01,5.0,Stayed a few nights,The stay was PERFECT!! We will definitely book with him again!
2024-04-01,5.0,Stayed a few nights,"Wonderful spot to stay. Clean, spacious and comfortable. Will continue to return!"
2024-04-01,5.0,Group trip,"Very welcoming and homey atmosphere. We were so very pleased with the accommodations and beautiful landscaping. Beds were comfortable and decor was fabulous.
All parties we met were very welcoming and personable. We had a very small item that needed attention and was taken care of immediately. We are definitely planning a return visit next year and cannot wait to return.
Thank you for everything!!"
2024-04-01,5.0,Stayed a few nights,Amazing place and wonderful host. Will be back!
2024-04-01,5.0,Stayed a few nights,"Tyler made you feel right at home, never had to feel like I would never get a response. Hospitality was definitely on a top level."
2024-03-01,5.0,Group trip,Great place with everything you will need.
2024-02-01,5.0,Stayed with kids,"Super great hosts, easy to communicate with. No issues what so ever! 10/10 would recommend and book again!"
2024-02-01,5.0,Stayed with kids,The place worked great for our family. Was great to be just out of town for the peace and quiet but close to what we were doing in town.
2024-02-01,5.0,Group trip,"The house was perfect for our group. It was easy to find, good location, and very comfortable!"
2024-02-01,5.0,Stayed with kids,This was our second time staying at Tyler’s place and as before this is a great home in a beautiful area! Plenty of space and clean as always!
2024-01-01,5.0,Stayed with kids,Tyler’s home is beautiful and extremely spacious! We felt right at home and loved our stay! He is absolutely an amazingly responsive host and very caring and proactive!
2023-12-01,4.0,Stayed with kids,"Beautiful home, owner was amazing."
2023-12-01,5.0,Stayed with kids,Tyler was responsive with any needs and super helpful with local recommendations! Great place to stay!
2023-12-01,5.0,Group trip,This placed worked great for our family stay. I like things very clean to really relax when I am away from home. This place was VERY clean and well organized. We had dinner and breakfast at the home and the kitchen and dining areas worked great for us. There were two areas to watch TV which was nice to be able to watch different things. This house is in a very nice neighborhood and in a peaceful country setting with lots of space. I can see how this place is perfect for business or large groups with its set up and number of bedrooms. The beds were very comfortable. The hosts were very responsive and helpful. I would highly recommend this place and will stay again if we stay in Kearney. Thank you for the great hospitality! Kandi
2023-12-01,5.0,Stayed with kids,.
2023-12-01,5.0,Stayed a few nights,"this is our 4th or 5th stay, and we continue to use Tyler's propeties because of how well they are setup for larger groups. Always takes good care of our crew."
2023-11-01,5.0,Stayed with kids,"Our family gathered for thanksgiving and had a great time. The rack in the entry was a great place for everyone to put their coat, shoes and other belongings as they entered. The upstairs gathering space seemed small for the number of people who stayed there but we made it work. Everything was very clean and the host was very accommodating. There was lots of parking and it was warm enough the first night that we were able to enjoy the fire pit. We brought our camper and would have liked to have a 30 amp plug in so we could use electric heaters instead of propane. We plan to use this VRBO again next year."
2023-11-01,5.0,Stayed with kids,"Our stay at Tylers Airbnb was awesome!!
We especially loved the large family Media room with sectional couch & games available to play, special family bonding time! 💞
The kitchen was fully stocked,
the beds, pillows & blankets so soft & cozy!!! 🧶
Everything was super clean! ✨"
2023-11-01,5.0,Stayed with kids,This house was perfect for our family of grown children + grandchildren. Plenty of beds and baths and plenty of space to gather. Handy and efficient kitchen. Beautiful setting with outdoor seating. Great decor! Highly recommend.
