date,rating,note,review_text
2023-05-01,5.0,Stayed one night,"Our family stayed here on our way to Colorado, it was our first time staying in a tiny home. We thought it was very roomy for four, not to mention clean and nicely decorated! We would stay here again, and would highly recommend this place too!"
2023-05-01,5.0,Stayed one night,"Great, unique experience in a tiny home! Place was very clean, comfortable, and had everything we needed. We were originally worried about some bug issues around this time of year but had none there and they had a bug zapper that helped. Would recommend!"
2023-05-01,5.0,Stayed a few nights,Very quiet and unique opportunity!
2023-05-01,5.0,Stayed a few nights,"Loved my stay here, it was super cozy and private while still being close to many places!"
2023-05-01,5.0,Stayed one night,"Very comfortable, clean, and well-appointed... near the freeway but very quiet inside with windows shut.
I inadvertently left an item, and the hosts are going to mail it back to me, for which I am very grateful. I hope to return someday!"
2023-05-01,4.0,Stayed one night,Very cute tiny house. Was clean and fun to stay in. My large boyfriend fit well in it so tall people don’t be afraid. It was a lovely stay and a great price. Only down sides are no functioning fire alarms and next to a busy highway. Would come back again!
2023-05-01,5.0,Stayed one night,Darling tiny house!
2023-05-01,5.0,Stayed one night,Perfect stop on our way traveling through. Rachel was thorough and helpful. Recommend
2023-05-01,5.0,Stayed one night,Place was just what it looked like in the photos. Very cute. Nicely decorated and well laid out for a tiny home.
2023-05-01,5.0,Stayed with kids,"cute place! very kid friendly. it was about 30 degrees the night we stayed and we were very warm and cozy!
a little hard to find via G**gle and A**le maps, but host called me right away and explained how to get there."
2023-05-01,5.0,Stayed with kids,our first Tiny house living experience was great. This place is convenient and bunk bed worked well for our 2 yrs old. Surrounding is peaceful and what exactly you expect in the middle of fields in Nebraska.. loved our stay!
2023-04-01,5.0,Stayed one night,Awesome tiny home! We’d stay again.
2023-04-01,5.0,Stayed one night,adorable tiny house tucked away in a private location. felt right at home
2023-04-01,5.0,Stayed one night,"I wanted to stay!!!
I had only booked for the one night as I was traveling long distance but it was super adorable and the property was very private. I even had a small fire to enjoy. The Tiny House was designed perfectly and had all I wanted in a stay. Cute town as well which was only 5 mins away."
2023-04-01,5.0,Stayed one night,"Rachel's tiny house was very cute, comfortable, and had everything needed for a night's accommodations. Loved the deck."
2023-04-01,5.0,Stayed one night,Great for a quick stop driving across the country.
2023-04-01,5.0,Stayed one night,Had a fantastic stay! Such a cute space :)
2023-04-01,5.0,Stayed a few nights,"This was my first time staying at a Tiny House so I wasn't sure what to expect.
I found that it had everything I needed for a comfortable stay.
The soft water was an added pleasure!
The only con was getting up the loft bedroom. That first step was a doozy going up and down for me. Thankfully, there was a very sturdy handrail there grab on to!"
2023-04-01,5.0,Stayed one night,"There’s a bit of a dirt road to the house, and it’s close to the Freeway… but the Tiny House is well built/insulated, and I couldn’t hear any traffic when I was inside. I’ve stayed in numerous Tiny Houses, and this one is especially nice in terms of design and layout. Has many amenities for a Tiny House. This is one of the rare designs with a staircase built in, so no ladder, but you will need to step up carefully and then crawl the last few feet to the bed, so keep this in mind. so for anyone wanting to try the Tiny House experience, this one is not to be missed. Very fun. Very comfy."
2023-04-01,5.0,Stayed one night,"This adorable tiny home was well appointed and very comfortable! Lots of nice touches with things we could use and very thoughtful books and DVDs and even some games. The triple bunk beds for little kiddos was adorable. it's a nice space back there and we used it to store all our bags and as a dressing room. The kitchen was very clean & easy to use. The bathroom was surprisingly roomy and the shower was great. Towels and linens were very high quality. My husband and I stayed on the converted couch which was nice and firm. We slept really well. My sister slept in the upstairs loft which was very cool and comfortable for her, just needed to be careful walking back down. We had everything we needed and the location was great for going out to see the crane migration (April). The host was super nice and we were very pleased."
2023-04-01,5.0,Stayed one night,Super fun place to stay. Bed upstairs was so comfortable.
2023-04-01,5.0,Stayed one night,Cute place. Would be a great place to stay a few days. But it wasn't in the plans.
2023-04-01,5.0,Stayed a few nights,"This tiny home was PERFECT for a little getaway! It is furnished beautifully, super clean, and in a perfect remote location! Would definitely stay again!"
2023-04-01,5.0,Stayed one night,The communication with the host was so explicit and helpful. The tiny house is adorable. I wouldn’t recommend going there with tall are large people.
2023-04-01,5.0,Stayed with kids,"It’s always a pleasure to stay here, we look forward to it every year 🥰"
2023-03-01,4.0,Stayed a few nights,I loved my stay at the tiny nest house. I loved the out of the way location. I had everything I needed and more for a relaxing stay. Thank you!
2023-03-01,5.0,Stayed a few nights,We loved the Rachel's tiny house. Close to Kearney yet far enough out of town to give you a country feel. We would stay there again!
2023-03-01,5.0,Stayed one night,"House was clean and comfortable - clever storage to allow so many amenities. We made dinner and breakfast and appreciated having some ""extras"" in the fridge and pantry (butter, spices).
We chose this location to be close to Sandhill Cranes on the Platte River and it was FANTASTIC!! -- convenient to local Audubon Sanctuary and to bike trail -- we walked to a pedestrian bridge over the river. Enjoyed watching thousands of cranes fly over the house over in the evening.
Would definitely return!"
2023-03-01,5.0,Stayed one night,"Great little place to stay! Close to walking / biking trail, good spot to venture out for crane viewing!"
2023-03-01,5.0,Stayed a few nights,Great host. Enjoyed our stay at Tiny Nest.
2023-03-01,5.0,Stayed a few nights,The Tiny Nest was perfect for our stay in Kearney to see the sandhill cranes! Only 15 minutes from the Rowe Sanctuary and close to the town of Kearney it really was a great spot. The sandhill cranes flew over every day ! What an experience! Thank you Rachel for sharing your Tiny nest. Would love to come back again !
2023-03-01,5.0,Stayed one night,Comfy tiny house with great amenities. Host was helpful and proactive with instructions.
2023-03-01,5.0,Stayed one night,"Very cozy tiny house that was bigger than expected! I've stayed in a tiny house before and this was a very comfortable size with great amenities. Fast wifi, firewood provided for the firepit, comfy bed, and French press for coffee (my favorite). I was in town just for one night for the Sandhill Cranes and this was a perfect getaway off the beaten path. Cranes were flying directly overhead like a personal show. Magical experience!"
2023-03-01,5.0,Stayed one night,We really enjoyed staying at Rachel's Tiny House near the Platte River! It was very close to great places to watch the Sandhills Crane migration and had gorgeous views of the sunrise.
2023-03-01,5.0,Stayed a few nights,"Perfect location, hiking trail very nearby, Cranes in the fields a block away. Very private, quiet, clean, it had everything we could possibly want. There was even a fire pit but the weather did not allow us to use it. Staying there really added to our trip."
2023-03-01,5.0,Stayed a few nights,Such a neat little place! Clean and cozy :)
2023-03-01,5.0,Stayed one night,"Loved staying in this very well-appointed tiny house! Perfect location for a springtime trip to enjoy the sandhill crane migration nearby. Would love to return once it's warmer so we can enjoy the ample outdoor space (patio, grill, firepit, hammock, beautiful big shade trees) provided as well. The host has thought of lots of lovely touches in the kitchen and bathroom. Ample books, games, and even some art supplies. Highly recommended."
2023-02-01,5.0,Stayed one night,What a peaceful and private escape. Unexpected abundance if nature. We were simply trying escape for a a day or two. Sandhill Cranes and all the natural surrounding the area!!! We will be back for fishing and more sightseeing!
2023-02-01,5.0,Stayed one night,"It was off the beaten path very nice though, wanted to see what the hype of a tiny house was about, and now I get it n think it’s very cool. Thank you I will sagest to others needing place to stay at Kearney."
2023-02-01,5.0,Stayed one night,"Great place to stay and great host. The tiny house was clean and comfortable to stretch out and relax in. 100% would stay again.
Also, I accidentally left something and they got it sent to me right away. Couldn’t recommend a better host and so very thankful for the help!"
2023-02-01,5.0,Stayed a few nights,Very romantic place near good option for food.
2023-02-01,5.0,Stayed one night,Such a great stay for us to get out of town for the night! Excited to come back when it’s warmer out here :)
2023-02-01,5.0,Stayed a few nights,"Perfect place for us to stay while working in kearney, close enough to town but far enough away to be nice and peaceful."
2023-01-01,5.0,Stayed a few nights,"Such a lovely little getaway. I would have preferred less noise from the nearby roads, but you can't really avoid that unless you plant more trees. The tiny home could use a bit of repair or updates on them lights as a few area burnt out here and there. The overall experience was comfortable and cozy though!!! Would definitely consider going back."
2023-01-01,5.0,Stayed a few nights,"We were able to get the house first in the daylight, however I think it would have been difficult to find in the dark the first time. The space is as described! It had lots of comforts in such a little space. Its well decorated and taken care of. It was a fun experience staying in a tiny house."
2023-01-01,5.0,Stayed one night,Thank you for letting me and my friends stay at such a short notice. Lovely place.
2023-01-01,5.0,Stayed one night,I thought it was a very clean and peaceful little place. I wish I could’ve stayed longer. Hopefully I’ll get to stop in again I would definitely recommend.
2023-01-01,4.0,Stayed with kids,Great place to stay! We were looking for a fun place to stay and celebrate the New Year’!
2022-12-01,5.0,Stayed one night,Rachel was an incredible host! Very responsive and incredibly accommodating. Loved it!
2022-12-01,5.0,Stayed one night,My girlfriend and I have stayed here twice! it's a very nice place and we will be back when needing a quick getaway!!
2022-12-01,5.0,Stayed with kids,"Great, private and peaceful place to relax on our way to Colorado. Inside feels much bigger than it looks and provides games gave us some fun activities to do."
2022-12-01,5.0,Stayed one night,"My partner and I really loved staying at the tiny home while traveling through Nebraska. The bed situation was so perfect and cozy. My only complaint was the couch. There were so many stains that we didn't even want to sit on it. Other than that, our stay was great."
2022-12-01,5.0,Stayed one night,Very clean! Super cute aesthetic which is a plus for me! Out of town which is another plus! I love the quiet areas. Very cozy! My son loved the bunk bed as well!
2022-11-01,5.0,Stayed a few nights,We've stayed here before and loved it so much that we came back again! I wish I could pack this place up and take it home with me! Rachel is lovely as always! We definitely recommend this stay for a reset away from the business of life!
2022-11-01,5.0,Stayed one night,Really super cute place!! Just like the pictures and so clean. We enjoyed staying in this tiny home and it had everything you need for the small space!! Rachel communicated everything perfectly! Thanks so much and we will stay again on our way across the country!
2022-11-01,5.0,Stayed one night,great place to stay very clean and organized
2022-11-01,3.0,Stayed with kids,"It was a pretty good stay, it took awhile for the house to warm up when we got there and in the morning. The stairs to the loft were a little harder to maneuver than we thought they would be. The shower was nice and warm and the couch was comfortable too!"
2022-10-01,5.0,Stayed one night,"Rachel’s home was the perfect spot for my one night in Kearney. The directions she provided made it super easy to check in and the layout made her home feel much bigger for it being a tiny home. Rachel was also a great communicator and was even kind enough to stop by and provide a spare key so I could get inside after I accidentally locked myself out. If In Kearney again, I will certainly stay here again."
2022-10-01,5.0,Stayed a few nights,I have stayed here several times when I am in town for conferences. I love the location (that it is on the outskirts of town) and especially the firepit! I look forward to staying here again next year.
2022-10-01,5.0,Stayed one night,We came for a one night getaway and loved it! it’s very nice and updated and has everything you could need and we enjoyed sitting on the hammock. the living room is comfortable and cozy! we’ll be back
2022-10-01,5.0,Stayed a few nights,The tiny house is cozy and has all the amenities in a comfortable space situated in a peaceful spot. We will definitely book again!
2022-10-01,5.0,Stayed a few nights,A great place for rest and relaxation and to experience tiny house living. The tiny nest is a quiet peaceful spot. For those that want more it is close to activities and restaurants. I appreciated the close proximity to a fine walking trail. The fall colors were beautiful and the walk enjoyable. The tiny nest is overall stocked well with needed supplies for a pleasant stay. The outside deck and the area for a bonfire are a great way to relax and enjoy nature. A little treasure with hosts that aim to make your stay a great one. Plan to enjoy the Tiny Nest again in the future.
2022-10-01,5.0,Stayed a few nights,The Tiny Nest was the perfect place to stay for a weekend getaway. The house was so cute!
2022-10-01,4.0,Stayed with kids,"This was our second stay and is a great stopover on the way to CO - convenient and right off the interstate. Our second stay did not include the 3rd bunk mattress shown in the picture, therefore confirm with the host if this is a need. Our kids love the Tiny Nest!"
2022-10-01,4.0,Stayed one night,A very cute place. Rachel is a great host. very private and quiet location. we enjoyed our stay.
2022-10-01,5.0,Stayed a few nights,This tiny house was cute! I was in town for work orientation and worked well for me. I liked that it was outside the city. You can hear the interstate traffic but wasn't overwhelming and it was disclosed in the description. Washer and dryer was a plus. Rachel was very nice and always responded to messages quickly.
2022-10-01,5.0,Stayed with kids,"Super cute, very clean and great location for what we needed to be close to!"
2022-10-01,5.0,Stayed one night,"Very accurate to pictures, had a lovely stay!"
2022-09-01,5.0,Stayed one night,"This was a lovely tiny home and we loved our stay here. It had sufficient room for us (and extra peeps too if we had any). It was fully equipped with a fully stocked kitchen, and there were books, videos and games for entertainment. Overall, it was a great place to stay. We'd come back here if we were coming through Kearney again."
2022-09-01,4.0,Stayed a few nights,"Very peaceful. Extremely quiet. There were a few safety issues that could be improved, such as adding a chain lock, fire extinguisher, labels for light switches, and treads on the loft stairs/safety handles for left-handers descending. The lock-box ought to be replaced. The road was also blocked by farm equipment during work hours and, with only one access point, cars just have to wait until the combines and wagons move in order to proceed south on Sweetwater during work hours. The grounds are nice for walking around, and the setting is very nice for just enjoying time on the deck."
2022-09-01,5.0,Stayed one night,"Clean, comfy, private and unique! The perfect place to stay on our cross country journey. The host is very friendly and responsive."
2022-09-01,5.0,Stayed with kids,Loved this place! Super cute and better than a motel..
2022-09-01,5.0,Stayed one night,"Rachel was a great host, communicated thoroughly with details. tiny nest is adorable with everything you need. a nice bonus is the bike trail just down the road. close to a town with plenty of eating & shopping. thanks, Rachel!"
2022-09-01,5.0,Stayed a few nights,the tiny house was adorable and perfect for my business trip. quiet and cozy. loved my stay.
2022-09-01,4.0,Stayed one night,"Rachel's tiny house was comfy, cozy, and sparkling clean. We enjoyed a nice walk on the nearby trail and a quiet evening on the deck before crawling into the sleeping loft."
2022-09-01,5.0,Stayed one night,"Such a sweet little place! The decor is clean, cohesive, and comfortable. Great communication with Rachel throughout, and we especially appreciated her recommendations for nearby places to eat (we loved the Thai restaurant) and hikes as well. We would love to come back and stay longer. Peaceful, comfortable, and everything we needed. Thank you!"
2022-09-01,5.0,Stayed one night,Great little place to stay! Very comfortable and clean.
2024-06-01,5.0,Group trip,"Adam's place was a comfortable, clean, and well-furnished home base for us during the UNK graduation events. The house is nicely situated in the city... close to campus and to amenities and restaurants. The neighborhood is remarkably quiet, and the fire pit area in the backyard is a relaxing place to gather and enjoy some down time.
We recommend Adam's place to anyone seeking a house experience in Kearney for a few nights. We enjoyed our stay."
2024-06-01,5.0,Stayed over a week,Nice place near the hospital!
2024-03-01,4.0,Stayed a few nights,It was a comfortable stay. This would be great for a large group. Quiet neighborhood. Adam was very communicative and responded quickly when we had an issue come up. We would stay here again!
2024-03-01,5.0,Group trip,really clean place. loves staying here
2024-03-01,5.0,Stayed a few nights,We had enough space for our family while in town for a wedding. The beds were comfortable. The kitchen had what I needed.
2024-03-01,5.0,Stayed a few nights,Adorable cottage with everything we needed. Spotless bathroom and kitchen and entire home. Nice quiet neighborhood and very close to the bricks which has great restaurants and bars. Adam’s guide was very helpful and spot on. We were a last minute booking and our hosts were very accommodating. We especially enjoyed the backyard with comfortable seating. Will definitely stay here again.
2023-11-01,5.0,Stayed a few nights,Definitely would use again.
2023-10-01,3.0,Stayed a few nights,"Place was cozy.
Adam didn’t get back to us on a few things. Response wasn’t in a timely matter.
Dishwasher didn’t work, Xbox didn’t work, fuse ball table was broken, which are amenities we were to be able to use. Sheets and linens in the dryer still, there were stains on the basement bedding. Bathtub was a little claustrophobic for us!"
2023-10-01,5.0,Stayed a few nights,"This would be a great place for a young family to stay. We were a group with two couples and a single. All of us are middle aged to seniors. Claw foot tub was difficult for the seniors to get in and out of for showers, I hadn't thought about that when I booked. It is a cute house and has a great outdoor space."
2023-10-01,5.0,Stayed one night,"Adam was very accommodating to our needs, even at the last minute. The house was exactly as described, very comfortable and welcoming. Fire pit a huge bonus! Definitely recommend and we will revisit when we return to Kearney."
2023-10-01,5.0,Stayed a few nights,"We were staying for work. This home was set up if we wanted to socialize or wanted some down time, you could get both. Very spacious. The yard and fire pit was great! Also, appreciated the coupons. The only suggestion I would have is to have more ice trays. Otherwise I wouldn’t change a thing!"
2023-10-01,5.0,Stayed a few nights,Great spot to stay in close to downtown Kearney. Clean and comfortable spot with a nice outside area as well!
2023-09-01,5.0,Group trip,It was great and a fun trip
2023-09-01,5.0,Stayed about a week,Nice house. Central location. Great host!
2023-09-01,5.0,Stayed with kids,Great Host!! We will def stay again if we are in the area!
2023-08-01,5.0,Stayed with kids,Very clean and charming! Was perfect for our family reunion with games and two tvs to access! Adam was very communicative and responsive. Would highly recommend!
2023-08-01,5.0,Stayed a few nights,Great place to stay when visiting family in Kearney!
2023-07-01,5.0,Stayed with kids,"This place was super cute and charming. We loved sitting around the fire pit watching the lightning bugs. The decor was adorable and the claw foot tub with rain shower was very nice. A few things were not perfect, but overall we had a nice stay!"
2023-07-01,5.0,Stayed with kids,Nice
2023-06-01,3.0,Stayed a few nights,"house was nice and cold at check in,
but at midnight each night the heat came on to 75 degrees and could not be changed"
2023-06-01,5.0,Stayed with kids,nice house
2023-06-01,4.0,Stayed a few nights,Nice place
2023-06-01,5.0,Stayed with kids,Adam was very kind and responsive. He allowed us to check out later than expected. Beautiful cozy house with plenty to do for the whole family.
2023-05-01,5.0,Stayed a few nights,This was one of the best places we have stayed
2023-05-01,4.0,Group trip,"First of all, thank you, Adam, for letting us stay in this cute little house! The space is well organized and clean, the beds were comfortable and the fire pit is awesome! Adam was very responsive and brought over needed items in a very timely manner. This is a very family friendly house. We also appreciated having such a nice big yard to play yard games. I would definitely stay here again! Thanks, Adam!"
2023-05-01,5.0,Stayed a few nights,"We really liked the home. We felt very comfortable. Adam got back to me right away when I had questions. We visited Pioneer Village in the neighboring town of Minden so the location of the home was perfect with easy Freeway access. Kearney offers many great restaurants! Also we visited the Archway Museum on I-80, it too was awesome! Great place to vacation."
2023-04-01,5.0,Group trip,"Comfortable sweet little house. Adam and Stephanie were very responsive. We had an issue with a chair, not a big deal to us, just wanted to make them aware. They responded quickly and were very apologetic. Appreciate the response. Great value and very quiet neighborhood. We really enjoyed our stay. Will try to book again if in the area."
2023-03-01,5.0,Stayed with kids,"We enjoyed our short stay at the house. With two small kids, it was much better than a hotel room. The house was clean and well put together with nice amenities. Would highly recommend."
2023-03-01,5.0,Stayed a few nights,Lovely older home which was very comfortable. It was sparkling clean and appointed very nicely. The beds were comfortable. Quiet neighborhood and was easy to find. I would highly recommend this property.
2023-03-01,5.0,Stayed a few nights,"Great place , great communication. Lacking some closet spaces and living room seating ..but overall great place to stay"
2023-03-01,5.0,Stayed with kids,"Such a cute house with fun activities in the basement for the kids. The space was so comfortable - we felt right at home. There are 5 in our family, and the layout worked out nicely. Only complaint was the limited silverware and towels (not enough for each person in our group)."
2023-02-01,5.0,Stayed over a week,This is a great home. I spent mayn’t weeks here and it was perfect!
2022-12-01,5.0,Group trip,Adam was a lovely host and very responsive!! He was super friendly and they had a lovely space extremely cozy for our group. As well as a well equipped kitchen!!
2022-11-01,5.0,Stayed a few nights,They were great at communication and had a cute space!!!
2022-11-01,5.0,Stayed with kids,Was the perfect place for our family for a long weekend!
2022-10-01,5.0,Stayed with kids,Super clean and relaxing atmosphere. Easy access to anywhere you want to go in this charming town. Adam was super responsive and friendly! Five stars
2022-10-01,4.0,Stayed a few nights,"A quaint, small, and comfortable home. Great location. Nice linens. Lacking a basic kitchen gear, but still a great place for a family. We enjoyed our stay!"
2022-10-01,5.0,Stayed with kids,"This is a clean, comfortable, convenient place to stay near to everything in Kearney. It is ideal for a small family, but only one bathroom might make it difficult for a very large group."
2022-09-01,5.0,Stayed about a week,House was clean and great location. Adam was friendly and willing to work with us anyway he could. Five stars all around.
2022-09-01,5.0,Stayed with kids,We loved this place! Will definitely use again if we are in the area
2022-07-01,5.0,Group trip,"Beautiful home, great location and lots of room! We had a blast this last weekend! Adam was very attentive and responded in a timely fashion!"
