date,rating,note,review_text
2022-02-01,5.0,Stayed with kids,They are so accommodating and so kind. It’s very quiet and clean! Chuck and Mary are very pleasant and Insightful. They had recommendations on some things to go and experience and appreciated learning the history of the home! I will be definitely be visiting there again.
2022-02-01,5.0,Stayed with kids,"If you have the opportunity to stay with Chuck and Mary at the Heritage House don’t pass it up! Staying in this cool old house is like stepping into a bit of Kearny history. And Chuck and Mary’s warmth makes you feel like you are part of their family. Except unlike family they honor your privacy!!! They truly go out of their way to make you feel at home. The beds are super comfortable, the shower is perfect, and the heated toilet seat with bidet is a real treat! Their outdoor garden area is beautiful and great for chilling, with both a cool pergola and hot tub! This will be the AirBNB experience you will compare all others to ever after!"
2022-01-01,5.0,Stayed one night,"Wonderful home that is only eclipsed by the exceptional people who care for the historic piece of Nebraska charm. It had everything we could possibly want, need, and so much more than I thought to imagine.
I wish we could have stayed longer; Chuck & Mary welcomed us at almost 9:45pm with spunk and energy despite the late hour, showed us around, and had cute touches all over the home to give our family a perfect stay. I won’t spoil any of their surprises, but if you’re lucky enough to book a night or two, you will be the hero of your group for finding this local gem.
Chuck has managed to maintain and restore all of the historic integrity, while adding a bunch of contemporary technologies that hang in the background but make the stay more comfortable. 1888 “thank you’s” and we hope to be back again some day!!"
2022-01-01,5.0,Stayed one night,Chuck and Mary where wonderful. Their place was wonderful and they were so welcoming to us. I would highly recommend you consider staying at their house if you are in Kearney.
2021-12-01,5.0,Stayed one night,"Third time I have stayed with Chuck and Mary, and all times have been a charm :) The location is great, and these hosts are splendid people. I wish a Happy Holidays to Chuck and Mary!"
2021-11-01,5.0,Stayed with kids,"Chuck and Mary have a beautiful home and share it with their guest. We spent a week in their upstairs. There were three large rooms decorated with love. The large entryway was equipped with coffee maker, microwave and filled mini-fridge. We enjoyed our stay and a return trip is on our to do list."
2021-11-01,5.0,Stayed one night,"Chuck & Mary take Superhost status to new heights through their attention to detail, generosity and creative personalized touches for guests. We were a bit road weary when we arrived so really appreciated their restaurant recommendations for dinner, a hot tub soak and access to their laundry machines. Their space is immaculate, lovingly decorated, and felt private. We enjoyed chatting with Chuck about his family's history and deep roots in Kearney. We also appreciated the home made goodies Chuck sent us off with as we hit the road again. We hope to return during the crane migration and stay with Chuck & Mary again."
2021-11-01,5.0,Stayed one night,A perfect place to just get away for a day or if you can longer. Every picture shown is better when you see it for yourself. Chuck and Mary are the perfect hosts.
2021-11-01,5.0,Stayed one night,"Wow, what an amazing place. This is without a doubt the nicest Airbnb I’ve ever stayed at. The attention to detail, personalized treats and beyond beautiful home were just some of the luxuries available. We didn’t want to leave!!! Chuck and Mary are the most amazing hosts who bring hospitality to a new level."
2021-11-01,5.0,Stayed one night,We really enjoyed our stay here. They have thought of everything and were very kind hosts. Above and beyond
2021-10-01,5.0,Stayed one night,"Chuck and Mary’s place was incredibly comfortable for our group of 4. We used the 3 bedrooms and also the little common area to visit in. The bathroom is well equipped. Everything was very clean. There is so much history on the walls and shelves - you can explore it all. Chuck and Mary were very gracious in our communications and personally welcomed us with such cute and kind notes. We were very thankful to be able to stay there and loved it all.
Guests should note that the rooms are up a super cute and narrow staircase. Wasn’t a problem at all - but one suitcase at a time works best 😊"
2021-10-01,5.0,Group trip,"Stayed here again on our way back through Kearney, and we enjoyed it just as much the second time through! :-)"
2021-10-01,5.0,Stayed one night,All expectations were exceeded! Chuck and Mary were so friendly and we were met with a surprise! The house is unbelievable dating to the 1880’s. We will certainly stay there again!
2021-10-01,5.0,Group trip,"I have stayed with no small number of wonderful Airbnb hosts around the world, yet Chuck and Mary stand out memorably as one of the most hospitable hosts I have ever had the fortune to stay with. They were kind and communicative, and have an extraordinary attention to detail in their lodgings. I recommend them without hesitation."
2021-10-01,5.0,Stayed one night,We can't say enough about this lovely retreat. Chuck and Mary are so kind. They pay attention to every detail from homemade quickbread to flowers in every room. We enjoyed each room too: plenty of pillows and comfortable beds. The toilet itself is an experience (you'll see why). We relaxed in the hot-tub and used the sitting room to wake up slowly with coffee in the morning (October was too chilly for sitting in the pergola). Chuck and Mary even gave us a list of interesting places to look for on our way back west and a car bouquet upon leaving. Book this place immediately!
2021-10-01,5.0,Stayed a few nights,"Heritage House in Kearney, NE is a gem not to be missed! Your hosts and the accommodations are exceptional. Thank you for a relaxing and enjoyable stay!"
2021-10-01,5.0,Stayed a few nights,A very nice place with very nice people that make you feel comfortable and right at home.
2021-10-01,5.0,Stayed with kids,"This place is Airbnb at its best! Wonderful hosts, all the best touches and a playground across the street for our toddler. Definitely recommend, and we plan to stay here again in the future!"
2021-10-01,5.0,Group trip,Chuck and Mary know how to surprise and delight. This was hands down our best AirBnB stay from booking our stay to departing. We felt like we were staying with family and truly couldn’t have felt more comfortable. Highly recommended and hope to stay again soon.
2021-10-01,5.0,Stayed one night,"The single best airbnb experience ever. They do details better than anyone else. Thoughtful, caring, and fun. Book with Chuck and Mary.. you wont regret it."
2021-10-01,5.0,Stayed one night,"My stay this week was the best Airbnb experience I have ever had. The space was beautiful, clean, and stocked with extras of everything you could need. Chuck and Mary were fantastic hosts. I will certainly be back!"
2021-09-01,5.0,Stayed one night,"My second time here and I was so happy to be back!! Chuck and Mary continue to go above and beyond for their guests, and I'm so grateful to have met them in my travels!! Would recommend to everyone! Thanks again to my favorites!"
2021-09-01,5.0,Stayed one night,"This was our 1st Airbnb, Chuck and Mary thought of everything, so warm and accomodating. We feel sorry for our next BnB, can't imagine any coming close, the bar is too high"
2021-09-01,5.0,Stayed one night,Nice location in town close to restaurants and bars. We have stayed here twice on our way thru town. The space you stay in is the whole upstairs which has 3 bedrooms. All 3 bedrooms have interesting items to look at. Very well kept historic house with a great sitting area outside and a hot tub. Well stocked fridge and some homemade bread to enjoy with your coffee in the morning.
2021-09-01,5.0,Stayed one night,"Chuck and Mary are awesome. They were very accommodating and personable. Our suite was cozy, clean and comfortable. Also, we enjoyed the special touches and delectable treat immensely. They are truly deserving of the title, super hosts."
2021-09-01,5.0,Stayed a few nights,"The Heritage House is a true gem, right in the center of Nebraska. My sisters and I have stayed here numerous times, and it has by far the best accommodations and the most fabulous hosts one can imagine."
2021-09-01,5.0,Stayed a few nights,"Awesome airbnb! I highly recommend this property.
Chuck and Mary are great hosts; friendly, welcoming, and have put a lot of effort into making a guest's stay pleasant. It's a historic old home, but doesn't feel like the typical old home, didn't have the creaks and things typical old homes have. Was sound and quiet.
They personally welcomed us even though we arrived late and showed us where to park (plenty of parking) and took us on a tour of the home. Also wished us a good morning each morning and made sure we had everything we needed.
The set up is awesome, three bedrooms that are separate from their living area, and also separated pretty good from the other guest rooms. Chuck and Mary had welcome signs and gifts for us; there's a coffee bar, a mini fridge, a tv, and nice sitting area. Beds are very comfortable. Nice patio area with covered pergola. Internet was just fine.
The bathroom is clean and fully stocked with linens and essentials. Honestly, I've typically been more of a hotel traveler because I like the conveniences of coffee, fully stocked bathrooms, etc that can be hit and miss at airbnbs. All those luxuries are taken care of at Chuck and Mary's.
One of my travel companions is a frequent airbnb user and commented this is the best airbnb he's seen. If we're every back in the Kearney area we'll be staying at Chuck and Mary's and I recommend you do to."
2021-09-01,5.0,Stayed one night,"We have stayed in many Airbnbs and Chuck and Mary's place is exceptional in many respects, starting with the welcoming and responsive hosts, for whom hosting is a passion. They have lovingly restored this historic home with great attention to detail and the comfort of their guests. Chuck and Mary offered an abundance of amenities, including freshly baked banana bread, and we will long remember our stay. We look forward to staying here again."
2021-09-01,5.0,Stayed one night,Absolutely phenomenal people with a gorgeous home! By far my best Airbnb stay! Everything was perfect!
2021-08-01,5.0,Stayed with kids,"Chuck and Mary welcomed us while traveling home for the funeral of a family member. This was the first time I had stayed in an Airbnb, and they absolutely set the bar high for any future experiences. It was a lot of fun to just walk around the space and see all of the pictures and historical items. It was kind of like visiting our own little Kearney museum. I was welcomed next to the house by Chuck, who pointed me in the direction of the garage where I parked my car for the evening. Chuck and Mary were very kind and welcoming, and they have thought of every detail. We were traveling with a kiddo and were pleased to find juice boxes and snacks, homemade banana bread, as well as toys and a variety of children’s books to keep him occupied. We definitely felt like welcome guests in their home and will look forward to booking again."
2021-08-01,5.0,Stayed one night,"Chuck and Mary went above and beyond to make sure I had a great stay. I loved the location, the comfortable room, the garden and all of the homey touches. Amazing experience—wish I could’ve stayed longer!"
2021-08-01,5.0,Stayed one night,"Chuck and Mary are truly super hosts. They have clearly put a lot of thought and effort into making sure their guests have an outstanding experience. From banana bread to beverages, they have thought of everything. We especially appreciated their restaurant recommendation. Plus they are warm and caring people."
2021-08-01,5.0,Stayed one night,"I chose to stay here because I was driving from Denver to Omaha and just wanted to stop ""somewhere"" in between. So I simply choose the Airbnb that looked best, and boy was I right! Chuck and Mary have a gift & a passion for making guests feel at home and then some. If you're anywhere in the vicinity, do yourself a favor and book a night or 10."
2021-08-01,5.0,Stayed a few nights,"If you are looking for the ultimate comfort ""stay"", just book this airbnb with Chuck and Mary. We have stayed with them each of the past three summers, and we will return again and again. The house is filled with history and charm, the location is convenient, and the hosts are the friendliest, kindest people you will meet on your trip. ""Over the top"" attention to details and the needs of guests .... and great stories when you have time to visit with them.
You will be glad you booked with Chuck and Mary."
2021-08-01,5.0,Stayed with kids,"Chuck and Mary and their beautiful Heritage House were the perfect stay in every way! Chuck communicated with us before our trip to make sure that he could have everything we needed, and when we were delayed and didn't arrive until 10pm, Chuck and Mary both greeted us with warmth and generosity. They helped us with our luggage and showed us around their guest suite full of character and thoughtful touches at every turn. They even had lovely beverages waiting for us. The beds and rooms were very comfortable, and we woke to delicious smells from the kitchen where Chuck was making a second loaf of banana bread with no nuts after he learned about an allergy in our family. This couple truly has a gift of hospitality and we felt welcomed like family on our visit back to Greg's hometown of Kearney."
2021-08-01,5.0,Stayed one night,"This is a GREAT place: clean, comfortable, plenty of room, great decor, nice touches, and great hosts!!! We're so glad we found Chuck and Mary's place. We will definitely go back."
2021-08-01,5.0,Stayed one night,Chuck and Mary's hospitality and generosity are outstanding. We thoroughly enjoyed our stay there. Everything far surpassed our wildest expectations. Their house in Kearney is a historical gem.
2021-08-01,5.0,Stayed a few nights,I couldn’t recommend staying at Heritage House more! My partner and I have basically been living in Airbnbs for the past year as we travel the country and this was our favorite stay by far! Chuck and Mary are so kind and the most hospitable hosts we’ve ever had. We planned on staying only one night but extended another night since the place was so lovely. They have thought of every touch from chocolates on the pillow to fresh homemade banana bread for breakfast. We look forward to returning to Kearney again someday and staying at Heritage House again!
2021-08-01,5.0,Stayed with kids,"Chuck and Mary were absolute fabulous hosts! This was our first experience at an Airbnb and it was great! Sweet personalized touches from our names on cards, flowers and home-made banana bread! Chuck even let us park in his garage! Hot tub was excellent too! Great experience highly recommend!"
2021-08-01,5.0,Stayed with kids,"Chuck and Mary were the most welcoming hosts we have ever had on air bnb. They make you feel like part if their family. Their home is wonderful, and they put a bunch of personal touches to it that make you feel like guests of honor. The space was perfect for my wife and I to stay with our two young children for a night while we exited towns of Kearney and Minden.
I highly recommend their place."
2021-08-01,5.0,Group trip,Here you'll find a beautiful home with exceptionally beautiful outside spaces. The hosts are wonderful and go the extra mile to make sure you have a great experience.
2021-07-01,5.0,Stayed one night,"Kind, warm hospitality, beautiful yard and home and above and beyond with personal touches. Very comfortable overnight stay and only 5 minutes from Kearney Regional Hospital. Easy access to food and shopping."
2021-07-01,5.0,Stayed one night,"Best Air BnB we have stayed in. A truly wonderful experience. Not just super hosts, Superior Hosts!"
2021-07-01,5.0,Stayed one night,"I needed a place to spend the night on a cross-country road trip and I am so glad I found Chuck and Mary's home. They were so wonderful and accommodating. In addition to Chuck's homemade banana bread, the suite was stocked with coffee options and snacks to hit the road with in the morning. There is a lovely bike trail and park nearby. Finally, the fancy toilet seat was an unexpected but awesome amenity! Can't thank you all enough for making me feel like a part of your beautiful family."
2021-07-01,5.0,Stayed a few nights,"Heritage House Airbnb is a treasure not to be missed on your journey to Kearney or through Nebraska. The accommodations are comfortable, clean, and quiet. Chuck and Mary have a gift for hospitality that will make you feel welcome, at home, and refreshed with your stay. I enjoyed reading about the history of this special home, and even more, I enjoyed spending time on their beautiful pergola hearing stories, and seeing how they make a difference in their community. I believe you too will be refreshed by your stay at Heritage House and touched by the many special touches Chuck and Mary share to make your time in Kearney such a special experience!"
2021-07-01,5.0,Stayed one night,"Chuck and Mary have truly the best Airbnb we've experienced. This is magnified by a unique gift of hospitality. They have made their upstairs suite into a lovely mix of modern and historic features and beautiful woodwork. Our visit happened to be on a sad occasion for our family and Chuck and Mary allowed us to invite additional family members to sit with us outside in their lovely, comfortable pergola and garden where we ate and talked for quite awhile. It was truly like an oasis. How blessed we were by them and their thoughtful gestures throughout our stay."
2021-07-01,5.0,Stayed a few nights,"You are sure to fall in love with the Heritage House. Everything about this home is simply magical: the warm and cozy accommodations, the private gardens, the romantic pergola, and the many special touches provided by the hosts, who will make you feel like family. My sisters and I have had the pleasure of staying here on many occasions, and we always look forward to our next trip to Kearney and the opportunity to lodge at what we consider to be Kearney's hidden jewel."
2021-07-01,5.0,Stayed one night,Chuck and Mary went above and beyond to make us feel welcome. The place was very clean and comfortable with plenty of amenities and personal touches. Highly recommend!
2021-07-01,5.0,Stayed one night,This place is one of the best accommodations you’ll experience. So much detail to making your stay perfect.
2021-07-01,5.0,Stayed one night,"Chuck and Mary went above and beyond to give us the best possible experience. They were so kind, helpful, and ready to make our stay as comfortable as possible. Their attention to detail really made us feel right at home!"
2021-06-01,5.0,Stayed one night,"This is a great place to stay if swinging through the Kearney area! It is stylish, clean, and quiet. Furthermore the hosts go out of their way to give you a great experience. This is my second visit and I will be back again!"
2021-06-01,5.0,Stayed with kids,"Chuck and Mary are incredible! The upstairs apartment where we stayed was beautiful, well furnished, and very comfortable. We have never stayed anywhere with so many thoughtful personal touches. I won't spoil any of them, but they were beautiful and thoughtful and made us feel valued and special. It felt more like visiting family than staying in a strange home. That said, privacy was plentiful. They were warm and friendly while managing to provide the privacy that travelers need. Not an easy balance to achieve I would imagine, but they made it seem effortless. I recommend them 100%. 12 out of 10 stars!"
2021-06-01,5.0,Stayed with kids,This is a great place to stay & Chuck & Mary are the best hosts. They go above & beyond to make your stay the best.
2021-06-01,5.0,Stayed with kids,"Best hospitality we have experienced using Airbnb. Chuck and Mary are excellent hosts and provided our family a fun, unique experience during our brief stop in Kearney. We will absolutely stay again our next trip out west."
2021-06-01,5.0,Stayed a few nights,"What to expect at Chuck and Mary's place? Home! They are truly lovely, kind and enjoyable people. They have really thought of everything to make your stay so awesome, it's like all the comforts of home... only better! I hope we get the chance to stay at your place again sometime, and we'll readily recommend it to our family and friends! This is a perfect example of what an airbnb stay is all about! Hats off!"
2021-06-01,5.0,Stayed one night,"If you’re traveling anywhere near Kearney, planning your route so you can spend an evening with Chuck and Mary would be well worth your while. Their lovingly restored historic home, exquisite attention to detail and exceedingly generous hospitality made our visit one we will never forget. A true highlight on our long road trip across the country."
2021-06-01,5.0,Stayed one night,"Chuck and Mary are excellent hosts who did their best to make sure my stay was as relaxing and stress free as possible. Their guest suite is lovely with some of the most comfortable beds and amenities you can find in AirBnB's. If I ever find myself going to Kearney again, I will check for Chuck and Mary's suite first."
2021-06-01,5.0,Stayed one night,"Chuck and Mary’s place was 5-star all the way around. Convenient location to the interstate, but in a cozy neighborhood. The home itself is comfortable and historic. Beds were comfortable and the rooms were very clean. Chuck and Mary were super friendly and made sure we had everything we needed. Lots of nice touches made us feel very welcome. We would stay here again in a heartbeat!"
2021-06-01,5.0,Stayed a few nights,Such amazing hosts! Very friendly and accommodating. Warm banana bread upon arrival and personalized messages. We loved the hot tub! They also had a small fridge we could use to store our cold snacks. Hope you stay again!
2021-06-01,5.0,Stayed one night,"This is a top notch place to stay in Kearney. Clean, comfortable, historic and the hospitality cannot be beat. I highly recommend it!"
2021-05-01,5.0,Stayed one night,"From the beautiful outdoor garden and outstanding indoor decor to the exemplary hospitality and cozy warmth, we were mesmerized by the magical evening we spent here and wish we had spent more. One of our best ever airbnb stays."
2021-05-01,5.0,Stayed one night,"Great hospitality, good location, and clean rooms in a home filled with a lot of history. Chuck and Mary were very helpful and responsive hosts."
2021-05-01,5.0,Stayed a few nights,"Lovely, attentive hosts who make sure your stay is exactly what you’re hoping for!"
2024-06-01,5.0,Stayed a few nights,Rachel’s tiny house was adorable! We loved it! Thank you!
2024-06-01,5.0,Stayed a few nights,"Small and cozy space perfect for a little getaway! Rachel was responsive and an overall great host. Their dog, Primrose, came over to visit a few times during our stay, very sweet dog. Would stay here again!"
2024-06-01,5.0,Stayed with kids,Great place to stay!
2024-06-01,5.0,Stayed one night,"Rachel was warm and responsive to my request on behalf of my daughter. Our daughter had had a scary experience at a chain hotel (being followed and verbally accosted in the parking lot), so it was a relief to have a safe, quiet, and beautiful place to stay. Rachel's tiny home is ""totally adorable,"" our daughter raved. ""It's so nice to be safe and not to have to unpack the whole car!""
Thank you, Rachel. We will stay again on our next cross-country trip."
2024-05-01,5.0,Stayed a few nights,"Beautiful little tiny house with everything needed to relax away from the city. but not too far, we were able to order food and have delivered. My husband and I enjoyed our stay."
2024-04-01,5.0,Stayed with kids,What an absolutely gem! This place was everything my daughter and I wanted for a quick trip out of town. Brava to Rachel on an excellent place!!!
2024-04-01,5.0,Stayed one night,thanks
2024-04-01,5.0,Stayed a few nights,"Wow, hands down the best Airbnb I have ever stayed at. I loved this tiny home. It was perfect!! I’ve wanted to live in one and staying here just confirmed how much I’d enjoy it. Great use of space, excellent decor and amenities. You’ll have everything you’ll need plus the added bonus of a serene environment complete with fire pit and hot tub! We got a surprise visit from the neighbours dog Primrose, the most loving and well behaved pup! The host was super helpful and quick to respond. If I’m ever in Kearney Nebraska again, I hope this place is available. Thanks Rachel for an incredible stay!"
2024-04-01,5.0,Stayed a few nights,"Staying in this tiny home was great! The place was so cute inside and out and matched the description and photos perfectly. It was easy to find and get checked in, and was clean and smelled nice. I would definitely recommend this to others and would be happy to stay again."
2024-04-01,5.0,Stayed a few nights,Great place to stay
2024-04-01,5.0,Stayed one night,"A tiny house, as advertised! It was fun to see how it had been designed and had a lot of charming detail, like the sliding barn door."
2024-03-01,5.0,Stayed a few nights,The Tiny Nest met or exceeded our expectations. If we get to Kearney again we will certainly consider staying at The Tiny Nest again.
2024-03-01,5.0,Stayed a few nights,We enjoyed the tiny home experience. We had everything we needed.
