date,rating,note,review_text
2024-06-01,5,Stayed a few nights,"Beautiful scenery, the host Ruby so friendly and made our stay comfortable"
2024-06-01,5,Stayed one night,"We cannot say enough great things about this cozy little gem in the country! Ruby was instantly welcoming in her online responses and gave us privacy during our time at her place. So many simple, but thoughtful extras to welcome us... fresh apples on the kitchen table, snacks & water in the kitchenette, and bath necessities (soap, shampoo & conditioner, a first aid kit too!). The clip-clop of the Amish neighbors traveling up and down the road was especially sweet! We only stayed one night this time, so we didn't get to spend much time in the beautiful outdoor spaces she's created, but we'll definitely be back! Thank you, Ruby! :)"
2024-06-01,5,Stayed a few nights,The Olde Wash House was absolutely beautiful and we will be recommending it to friends and family. We hope to come back some day. Ruby is a fantastic host. We loved everything about our stay there.
2024-06-01,5,Stayed a few nights,"This is an amazing place to stay. Very clean and comfortable. Check in was easy. The Wash House is in the middle of Amish farm country, very beautiful. Loved seeing the covered bridges, horse and buggies, rolling hill sides. Very close to Sight & Sound, dining, shopping and exploring. We will definitely be back."
2024-06-01,5,Stayed a few nights,"We spent 2 nights here while in the area, and couldn't have been more pleased. The Washhouse is beautiful inside and out, and very comfortable. We were made to feel very welcome.
We would love to stay again if in the area.
Thank you Ruby!"
2024-06-01,5,Stayed one night,"Very peaceful and quiet setting. The bed was comfortable and it had extras like coffee pods, snacks, and shampoo. I’d highly recommend this Airbnb and will stay again when I’m in the area."
2024-06-01,5,Stayed a few nights,"We had the best time staying at The Olde Wash House! It was the perfect little getaway for me and my husband. The house was cozy with a comfortable bed — we slept great! It’s located in a great spot where you can easily get to wonderful restaurants, stores, etc. Bravo greeted us a few times and was so friendly. Ruby was very responsive and such a wonderful host. We will certainly be back!"
2024-06-01,5,Stayed a few nights,Ruby’s place was a beautiful & peaceful place to stay. The space was beautifully decorated and clean! It was close to many activities… there is a bike trail about 1 mile away. I would stay here again!
2024-06-01,5,Stayed one night,"We enjoyed our stay! The wash house was immaculate, peaceful, and comfortable."
2024-06-01,5,Stayed a few nights,"Ruby's washhouse was beautiful, relaxing, and perfect for a couple's getaway. Bravo (they're dog) was friendly and a nice addition to the patio and evening campfire. Ruby was a great, responsive host and we'll definitely stay again when we want to visit Lancaster, PA."
2024-05-01,5,Stayed a few nights,"Wonderful casual, country place. Lock box & clear directions make check in easy. Welcoming snacks & drinks always appreciated. Super clean. This is out in the country, but presumably you're here because, like me, that's what you want. :). I hope to be back!"
2024-04-01,5,Stayed one night,"Ruby and her husband were very friendly, the guesthouse was spotless and comfortable. We had a great stay."
2024-04-01,5,Stayed one night,"My boyfriend and I booked Ruby’s place to get out of NJ for a night. We had the best time ever. This spot is definitely a hidden gem and we will be back. We travel a lot and we have had some bad pillows, showers, and beds, but not here. Honestly I slept better here than at home and so did my boyfriend. SO comfortable. SO clean. Such friendly, welcoming and inviting hosts. Ruby, John and Bravo (their sweet pup who loves to run around and be happy) have the best spot with the best location. Five plus stars if you are hesitant on booking read my review and book it because you will have the best, relaxing time."
2024-04-01,5,Stayed one night,Ruby’s place is lovely and has a good and comforting smell! You are see horses outside of the window and nice view of the lawn.
2024-04-01,5,Stayed one night,"Ruby's place is a hidden gem. Very private and clean. The check in instructions were clear. She thought of everything we needed, including snacks and coffee. We will definitely be back."
2024-04-01,5,Stayed one night,"Amazing nice place, would recommend to anyone 💓"
2024-04-01,5,Stayed one night,Excellence.
2024-04-01,5,Stayed one night,"Lovely, charming place to stay! Would not hesitate to return!"
2024-04-01,5,Stayed one night,We Loved staying here! It was just what we needed for a shirt get away. Close to Sight and Sound (15 minutes) which is what we came for. Accommodations were perfect! Ruby is a great host!
2024-04-01,5,Stayed one night,We loved our stay here! It was perfect for a short getaway. It was on a beautiful property. Would definitely make another visit!
2024-04-01,5,Stayed one night,"This was our 2nd stay at the Wash House, Ruby is a very cheerful host. Her place is very comfortable and nice, we would recommend her place highly!!! Thank you"
2024-04-01,5,Stayed a few nights,"Ruby was so responsive and attentive. While my stay was cut short due to health issues, Ruby made the needed adjustments. Very nice stay!!"
2024-04-01,5,Stayed one night,Ruby has a beautiful and relaxing place. She was very friendly and met us as we drove up. We highly recommend this place for a single or couple.
2024-04-01,5,Stayed one night,"Ruby made us feel welcome and she was very friendly and responsive if we needed anything. She even offered to build us a fire by the gazebo! All the accommodations had everything we needed to make our stay enjoyable! If you like a peaceful country atmosphere, this is the place!"
2024-04-01,5,Stayed a few nights,"Quiet, wonderful. Perfect place between East Earl and Lancaster. Clean, comfy and welcoming.
Would recommend 10/10. Would stay here again and again. Ruby is fantastic. Great host!"
2024-04-01,5,Stayed one night,Thank you for a wonderful stay! I will be back in the future!
2024-04-01,5,Stayed one night,Great stay! We would love to come back!
2024-03-01,5,Stayed one night,"We really enjoyed our stay. The place is cosy and well-maintained, and the surroundings are beautiful. Loved all the thoughtful touches for Easter! Would definitely recommend to other guests."
2024-03-01,5,Stayed one night,We met Ruby who was warm and friendly. Her sweet cottage is only 20 min from Lancaster and located in beautiful and serene countryside. The Wash House has the charm of the old on the outside but renovated and modernized inside. l loved the outdoor seating and the water feature plus a cute bird feeder just outside our window so we could sit still and watch. The bed was very comfortable. We hope to come back.
2024-03-01,5,Stayed with kids,"My young daughter and I stayed here for a night away from the city. It was clean, comfortable and perfect for us. I highly recommend it!"
2024-03-01,5,Stayed a few nights,Nice stay
2024-03-01,5,Stayed a few nights,"This charming little house was exactly as described and we loved it! Ruby was an excellent, kind host who clearly adds nice details to the very clean, comfortable home (and the cute little outdoor sitting areas). We would stay here again in the future and recommend the rental for couples or individuals looking to have a nice countryside cottage in the beautiful Lancaster area."
2024-03-01,5,Stayed one night,Beautifully done and wonderful hospitality. Ruby has created a wonderful save in the guesthouse. Really enjoyed it.
2024-03-01,5,Stayed one night,We were in town to see Daniel at the Sight & Sound Theater. This was close and a great place. Such a cute area and well decorated. Perfect to relax before a long drive home. We won’t be disappointed!
2024-03-01,5,Stayed one night,this place was adorable and great for the price! the space was well thought-out and had everything we needed for our stay. ruby was friendly as well!
2024-03-01,5,Stayed a few nights,"Ruby’s place was the perfect place to get away and relax! It was peaceful and what we needed! It was close enough to restaurants and activities, but far enough away to enjoy the quiet. Ruby and her husband were so friendly! Thank you for a great stay!"
2024-03-01,5,Stayed one night,"This is a perfect place for a day or a vacation. Ruby and John are lovely, and beyond helpful. The little space was a wonderful place for two people, and their willingness to share the yard, the firepit, and their kindness will make you want to return.
It is one of the most enjoyable stays I have had anywhere, and I will be back. Thank you to you both for a wonderful evening. We stopped a way to break up a long drive and we found a wonderful place.
Michael"
2024-03-01,5,Stayed one night,"One of my favorite Airbnbs, first one I’ve returned to for a second time. Wonderful place, clean, cozy, has everything you need, and very peaceful. They are very thoughtful hosts. Can’t say enough good things."
2024-03-01,5,Stayed a few nights,Staying at the Wash house was so relaxing and peaceful. I enjoyed my entire weekend. I definitely plan on staying there again soon.
2024-03-01,5,Stayed a few nights,"It's a small, quaint place that's was perfect for my wife and I to stay while attending the Bible Quiz finals at BlackRock Retreat. it's was very clean and neatly decorated. Would stay again."
2024-03-01,5,Stayed one night,The Olde Wash House is a great find and great place to stay. Great hosts!
2024-03-01,5,Stayed a few nights,"Ruby's place was beautiful. Very well decorated and clean. The bed was comfortable. We loved the small touches of snacks, water, K cup, and fresh fruit. Everything we needed was there. Would come again!!!"
2024-02-01,5,Stayed one night,The Ole Wash House was so cute and cozy! Ruby decorated for Valentines too! Quite quaint! The shower was nice and all the amenities were great! She has little snacks and even offers fresh fruit! Loved that as we were headed out on a hike! Bed was cozy! Would love to return!
2024-02-01,5,Stayed one night,Great little one room lodge! We had a relaxing evening with nothing to disturb us!
2024-02-01,5,Stayed one night,"Ruby’s home was lovely! We had a wonderful stay. Everything was so clean, smelled amazing inside, and the bed is SUPER comfortable. Highly recommend staying here!"
2024-02-01,5,Stayed one night,Ruby’s place was not only beautifully decorated but was incredibly warm and cozy! We enjoyed our visit so much we are already planning to return for a longer stay. We highly recommend you give it a try! Thank you Ruby for your hospitality and a fabulous visit!
2024-02-01,5,Stayed a few nights,"Had an amazing stay at The Olde Wash House!! Super clean, cozy and welcoming. It was awesome to be surrounded by farms and hear the buggies go by at night. Staying here gave us the opportunity to experience more than just Downtown Lancaster. My boyfriend and I definitely plan on another stay at Ruby’s place!"
2024-02-01,5,Stayed one night,Great hidden gem in Lancaster.
2024-02-01,5,Stayed one night,Our stay at the Old Wash House was wonderful! It was a one-night stay and wish is could've been longer. It is a perfect spot in relation to Lancaster and perfect size for two!
2024-01-01,5,Stayed a few nights,"Ruby was a great host!
The place was clean and she was a great and clear communicator. I’d recommend to book this if you want a peaceful retreat."
2024-01-01,5,Stayed with kids,
2024-01-01,5,Stayed one night,A beautiful and peaceful stay at the wash house was the perfect little getaway we needed. Ruby was very kind in her messaging and her husband was very nice as well! A nice cozy stay!
2024-01-01,5,Stayed one night,"Even though our stay was short we had a really relaxing time and the place was really cute and cozy, felt just like home. They were really flexible with our check in time and got us in short notice which we really appreciated! Overall it was a great experience and we will definitely be back. Definitely recommend."
2024-01-01,5,Stayed a few nights,"Ruby is an excellent host! She is a friendly, caring person. Her cottage was very cozy, peaceful and clean. We want to stay there again sometime!"
2024-01-01,5,Stayed a few nights,"Ruby's place is cozy and a true retreat. She added some sweet touches everywhere, including the gazebo."
2024-01-01,5,Stayed one night,Just what I was looking for
2024-01-01,5,Stayed one night,A great place! Beautiful scenery and welcoming host. Definitely will re-book next time we are in the area!
2024-01-01,5,Stayed a few nights,Had a great stay at the Olde Wash House! A quaint retreat with beautiful surroundings. Very cozy and even more spacious than expected! Ruby was quick to respond when we had questions and was a gracious host. We plan to return in the summer!
2024-01-01,5,Stayed one night,"This charming, cozy, beautifully decorated, spotless, one room cottage in Amish farm country was exactly what we needed. So much better than a hotel room!"
2024-01-01,5,Stayed one night,"We had a spectacular experience! From the minute we walked in , the home felt super cozy and comfortable. Everything was arranged neatly and very tidy. Ruby and John were absolutely amazing. From their recommendations and prompt responses made us feel very welcomed. We enjoyed the camp fire, the gazebo and the amazing atmosphere. It was definitely worth it and we are so appreciative of Ruby and John for having such amazing space and allowing us to share our experiences together. Super peaceful stay and we enjoyed our holidays here! Thank you so much!"
2023-12-01,5,Stayed a few nights,"Ruby and her husband offered such a warm, welcoming stay filled with pure hospitality! I wish we had stayed another day! The atmosphere, cozy vibe, and the adorable decor made us feel right at home! Ruby made this experience so wonderful and we will most certainly be back! Everything such as food, shopping, and sight seeing were so close by and the scenery was breath taking! Thank you kindly for this amazing and memorable experience!"
2023-12-01,5,Stayed a few nights,"This place is great! So cozy and perfect for two people, and not a far drive from fun things to do. Highly recommend."
2023-12-01,5,Stayed a few nights,Ruby was a wonderfully thoughtful host! Everything was perfect! Ruby’s attention to detail and the needs of her guests made our stay most comfortable and our short vacation very special. Thanks so much!
2023-12-01,5,Stayed a few nights,"Beautiful area ! Horses right outside property in the mornings. List of restaurants by the sink in the kitchen area. Beautiful bedding, very warm. Bathroom was very clean and modern. 25 minutes to main Lancaster. Very quiet, nice neighbors and cute layout. I loved that the host came out and introduced herself when we arrived it was very welcoming. Will book again."
2023-12-01,5,Stayed one night,This is probably my fourth visit here--I wouldn't stay anywhere in Lancaster area!
2023-12-01,5,Stayed one night,"Clean, comfortable, quiet... everything I'd expect from a commercial hotel, plus a few snacks and tasteful Christmas decorations. Ruby's communication was clear, helpful, and timely. The only negative was a bit of cold draft through the rustic door and windows with the December wind, but the heating unit was able to keep up. Would recommend, especially in warmer months when the draft wouldn't matter and the outside patio and fire pit would be more attractive."
2023-12-01,5,Stayed a few nights,"I absolutely loved my stay at Ruby’s place! It was a wonderful weekend, hugely due to how cute, cozy, and quaint the property is. I visited in December so the place was decorated with its own Christmas tree and Christmasy bedding - a lovely touch!This place is the perfect size for two people and the space is so well arranged that it feels bigger than it probably is in terms of square feet. The surrounding spaces within the property are great too! There’s a private deck on the backside of the Olde Wash House, fire pit area, and gazebo.
Ruby was a joy and went above and beyond to make my friend and I feel welcome. This is the best Airbnb experience I’ve ever had and highly recommend staying here!"
2023-12-01,5,Stayed a few nights,"We loved this little place so much we have already booked our stay for next December and added an extra night. We felt right at home and were welcomed shortly after we arrived. Enjoyed meeting part of Ruby’s family, were given a lot of recommendations while there of places to go and eat etc. . Ruby is an amazing host and we are looking forward to next year. Being in the country rather than in town gave us the opportunity to see a lot of Lancaster."
2023-12-01,5,Stayed a few nights,"Loved staying at Ruby’s, there was lots to do and we felt right at home. Ruby’s husband was very kind and started a fire for us and we really enjoyed playing with their adorable dog, Bravo. The community was very welcoming and the landscape as well as the home was beautiful. Would definitely recommend and are planning on coming back soon."
2023-11-01,5,Stayed a few nights,Ruby’s place was wonderful. It had everything I needed. She even had it all decorated for Christmas. I would definitely recommend this adorable space.
2023-11-01,5,Stayed a few nights,Loved the Wash House. Ruby was extremely responsive and went out of her way to solve one problem that arose. Watching all the horse and buggies right outside was really interesting. It is great to see how the old ways can get along so well with the new. Will definitely consider staying here again.
2023-11-01,5,Stayed a few nights,Perfect for what we needed it for
2023-11-01,5,Stayed one night,"This was a wonderful find. Ruby's place was stylish, peaceful, comfortable, and clean. There was not one thing more that we could have asked for. Ruby was very responsive and helpful. Highly recommend her place."
2023-11-01,5,Stayed one night,"loved staying here! Highly recommend and would definitely book again if we come back to the area! peaceful surroundings and enjoyed seeing the kids walking to school, Ruby’s place was so clean and we felt right at home!"
2023-11-01,5,Stayed one night,Very nice people! Lovely location. Friendly dog. We had a nice time. It was great to see the pony out the window in the morning and the buggies going by at night.
2023-11-01,5,Stayed one night,"Ruby has a great place; a little gem in the country. The house was immaculate, and the snacks and water were a welcome surprise. Beautiful countryside. Ruby was very responsive to questions, and her dog Bravo, is such a handsome, gentle boy. So glad we found this place, and we will definitely stay here again."
2023-11-01,5,Stayed one night,This place is absolutely adorable!!! We only wish we could have stayed longer!!! Such a quaint space and location! We will definitely try to come again (and stay longer)!
2023-11-01,5,Stayed a few nights,"Loved it, great views, great host. Beautiful and cozy, felt right at home. Awesome gazebo and fire pit. Really nice dog named ""Bravo"" which is a very lovable big baby. Not to far from town and things to do. Highly recommend."
2023-10-01,5,Stayed one night,"Wow! My only regret was that we didn't stay longer! Rubys place was absolutely wonderful and perfect. A perfect mixture of feeling pampered and feeling like you were ""home"". Everything sparkling clean, every amenity was thought of, loved the snacks left- so welcome. So comfortable- everything- the bed, the seating, the lighting, the room temp controls, the bathroom, kitchen, etc. The setting was so beautiful and the property was really nice- everything so well maintained! We definately will be back- hopefuly for a longer stay next time!"
2023-10-01,5,Stayed one night,"This is a little haven. We are so glad we found this place that had a nice, cozy space with such beautiful landscaping and a cute koi pond. I saw a frog next to the koi pond, which was a major highlight for me. There are also two lovely outdoor seating areas to enjoy the fresh air. Ruby and her husband were very hospitable and it was a great stay."
2023-10-01,5,Stayed one night,Had a great stay on our wedding night. Would highly recommend!
2023-10-01,5,Stayed one night,"Fabulous place to stay with ALL the extras you could ever want.
We appreciate Ruby and her hubby for making us feel right at home. We would definitely stay again."
2023-10-01,5,Stayed a few nights,Beautiful location and very friendly host!
2023-10-01,5,Stayed a few nights,Great cozy/comfortable space! Loved the details and outdoor surroundings.
2023-10-01,5,Stayed one night,It was the most perfect stay and in beautiful surroundings! Ruby was very kind and the place was clean!
2023-10-01,5,Stayed one night,Wonderful place to stay. Beautiful area.
2023-10-01,5,Stayed one night,Great place for a girl’s weekend! Had all the ammenities we needed and was tucked away and scenic but still close enough to have tons to do in downtown Lancaster!
2023-10-01,5,Stayed a few nights,Simply amazing and wonderful host
2023-10-01,5,Stayed one night,"Rudy’s stay is a wonderful, relaxing stay with beautiful views! Just the perfect getaway with relaxing touches and peace! So many beautiful outdoor places to sit! You won’t be disappointed!"
2023-10-01,5,Stayed a few nights,Ruby is an exceptiinal host. She greated us at check in and even helped us with luggage. I was determined to make this trip after having torn meniscus surgery. She knew of this and made sure there was an ottomon in the room for me to put my feet up. She was very friendly and hospitable giving recommendatiins for two weary travelers our first night. The olde wash home is charming clean and surrounded by beautiful amish farm land. And to the very end I realized I left something behind. And Ruby shipped it out to me the next day. Ruby is by far an airbnb superhost. You must book this cute little cottage in your next travels to Lancaster.
2023-10-01,5,Stayed one night,wonderful location. beautiful surroundings and quiet.
2023-10-01,4,Stayed one night,Such a pretty setting. Such charm and very comfortable. True to listening. Thank you for the fruit. will be back if I'm in the area.
2023-10-01,5,Stayed one night,"Ruby’s place was just what I needed. Although I was staying for a wedding nearby, it was also the perfect place for me to get away and be alone from the busy city. The wash house is super clean and cozy and provides everything you need. I would totally go back."
2023-10-01,5,Stayed with kids,Enjoyed a restful stay in Amish country. host was friendly and helpful-- she made sure to let know they didn't have any amenities for my baby so I could bring the necessary items. The house surrounding farmland are beautiful! Will definitely consider returning in the future when we come to visit family.
2023-10-01,5,Stayed a few nights,"Ruby went above and beyond for my husband and I on our wedding night, making it such a memorable night. A beautiful, quiet, peaceful abode. Perfect for our wedding weekend, 10/10 recommend!"
2023-09-01,5,Stayed a few nights,The Olde Walsh house was such a comfy and cozy stay. I loved hearing the horse & buggies outside. The location is great. Ruby was great. 10/10 would stay again!
2023-09-01,5,Stayed a few nights,"We had a wonderful stay at rubys guest house. Everything was clean, perfect arranged. This is one of a kind. We are from Germany and if we are coming back one day, we’d love to stay at ruby’s again. All the best for you and your family."
2023-09-01,5,Stayed a few nights,The Olde Wash House was very clean. The craftsmanship was beautiful as well. Ruby and John were very friendly but also gave us our privacy. I would highly recommend this stay if you are looking in the area.
2023-09-01,5,Stayed a few nights,"The Olde Wash House is amazing! The property is beautiful. It's cozy and clean. It has the perfect amount of space for a couple. Check-in is super easy, as was the parking and the place is just as described. It has everything you need while away from home. Also, the Wi-fi worked great. The best part is being able to sit outside and watch the sunset and the horses. We were lucky enough to meet Ruby and John and they are the most gracious hosts.
I highly recommend The Olde Wash House. You will love every moment there. We'll be back next year!"
2023-09-01,5,Stayed one night,Fabulous stay near my hometown! Highly recommend and we will be back again!
2023-09-01,5,Stayed with kids,"Absolutely loved this place! Super clean, quiet, adorably furnished, and beautiful surroundings. We felt so at home and didnt want to leave. Cant wait to return."
2023-09-01,5,Stayed one night,"Beautiful getaway, charming and peaceful, tasteful space. Would like to come back and spend more than just one night…"
2023-09-01,5,Stayed one night,I felt safe in this cozy space. It was spotless. The mattress was great. I’d visit again
2023-09-01,5,Stayed one night,Close to the Amish community. We enjoyed our short stay very much.
2023-09-01,5,Stayed one night,Great stay! I wish there were more Airbnbs like this—just big enough to have everything you need and small enough to be perfect for a couple traveling on a budget.
2023-09-01,5,Stayed one night,This location was incredible! Exactly as advertised! The view was stunning. The home was so well decorated and accommodated. The host added soo many thoughtful details. I will definitely be back!
2023-09-01,5,Stayed one night,"Super clean place, tastefully decorated inside and out. A quaint, quiet, peaceful place to relax. Highly recommend!"
2023-09-01,5,Stayed one night,Ruby’s cottage was nice and cozy. It was so peaceful there. Just sorry it rained and we could not enjoy the fire pit. We would go back again!!! The bed was so comfortable and made for great nights sleep.
