date,rating,note,review_text
2024-06-01,5,Stayed with kids,"Great apartment, new and very clean ."
2024-06-01,5,Stayed over a week,Great place to stay...Highly recommended...very clean...
2024-04-01,5,Stayed a few nights,"Isaac's place was great, easy access to shops and food. The place was spotless, the rooms were spacious and the beds were so comfortable. We would definately stay here again."
2024-03-01,5,Stayed with kids,"Great place, many restaurants within a 2-3 min drive. Mall is only 8 minutes away. It’s perfect."
2024-03-01,5,Stayed about a week,Great place to stay in a gated community.
2024-03-01,5,Stayed one night,The place was really nice and was very quiet. Recommend 100% and would stay there again.
2024-02-01,5,Stayed a few nights,Perfect place as always. My go to for Laredo trips
2024-02-01,5,Stayed about a week,This spot is always on point for my stays in Laredo
2024-01-01,5,Stayed one night,"Isaac is always the best host.
Quick to reply and helps with whatever u need.
Apartment is always clean and ready to go"
2023-12-01,5,Stayed with kids,"The place was clean, nice, and comfortable. The only con is the space has too much air freshener use which is not ideal for people with migraines or sensitive to scents."
2023-11-01,5,Stayed one night,"The accommodation is very nice, comfortable and easy to find. The host was friendly and attentive, the only downside is that the elevator is not working yet and it was a bit difficult for us to turn on the hot water heater."
2024-06-01,5,Stayed one night,My Guys raved about what an amazing stay. Thanks so much we will definitely book again.
2024-06-01,5,Stayed one night,"Beautiful home with plenty of space! Full kitchen - everything one could need for cooking at home or dining with take-out. Nice patio in back for relaxing, too!"
2024-06-01,5,Stayed with kids,"First of all Michelle is great! She took care of us beyond the expected. Very kind woman on the phone.
On the other hand, we stayed there before and thats why we chose the property again. Very clean, great couch and the patio is amazing. Love the pergola and the bbq grill. Thanks for everything!"
2024-06-01,5,Stayed with kids,"Everything was as shown in the photos , convenient location , Michelle is very attentive , I would return to this accommodation"
2024-06-01,5,Stayed one night,"The place was beautiful, very clean, and cozy! Michelle was very responsive and friendly. She provided clear instructions and local recommendations which made the trip so easy for us!"
2024-06-01,5,Group trip,Had a great stay! Host Michelle was fantastic!
2024-06-01,5,Stayed a few nights,Amazing home. Highly recommend
2024-06-01,5,Stayed one night,Thanks for the stay
2024-04-01,5,Stayed a few nights,"We absolutely loved Michelle’s place. When we first arrived we were concerned with all the vehicles all along the street, but it was an extremely quiet area. She had everything we could have needed, everything was spotless, and the beds were comfortable. We were here for baseball games and we’d definitely stay if we ever return to Laredo!"
2024-04-01,5,Group trip,"Excellent guest.
Highly recommended"
2024-04-01,5,Stayed a few nights,"The house was impeccable. Beautifully decorated, clean and very comfortable. Michelle was responsive and helpful. Prompt, courteous, helpful and very professional. Will definitely book again."
2024-04-01,5,Stayed a few nights,House was clean and in a great location. Would definitely recommend to others.
2024-04-01,5,Stayed with kids,Loved everything and location! Michelle was a great host and made it known she was available if we needed anything. Definitely looking forward to staying here again.😀
2024-04-01,5,Stayed a few nights,Very helpful!
2024-03-01,5,Group trip,Very clean and modern. Owner is very quick to respond!
2024-03-01,5,Stayed a few nights,The location was perfect. The house was exactly what was proposed. Outside could have been cleaned up a bit. But overall it was great and would highly recommend .
2024-03-01,5,Stayed over a week,Great place with an awesome host
2024-03-01,5,Stayed one night,Excellent service
2024-02-01,5,Stayed a few nights,Great place!
2024-02-01,5,Stayed with kids,Michelle was very responsive and helpful. Booking her house made more sense than booking 2 hotel rooms for our stay and the photos were exactly what we found when we opened the front door. Check in and out was very easy and the house was an easy distance to everywhere we needed to go (which was all around Laredo for a baseball tournament). I would definately book again if we ever came back to Laredo.
2024-02-01,4,Stayed a few nights,"This place is in a great location very close to Target and several restaurants. There was plenty of space, and it was a mostly quiet neighborhood."
2024-02-01,5,Stayed with kids,"Great place, just what we were looking for, nice location and neighborhood."
2024-02-01,5,Stayed a few nights,"The house was exactly how it looks in the pictures. It was clean and comfortable. The back yard was a nice place to sit and relax at the end of the day.
One suggestion would be to have a few more towels available but other than that I would definitely stay here again."
2024-02-01,5,Stayed with kids,"Michelle was very nice, the
Location is excellent and the house is very comfortable."
2024-01-01,5,Stayed a few nights,Excellent home! Very clean and a quiet neighborhood!! Definitely booking again-
2024-01-01,5,Stayed a few nights,"The place is amazing.
Just as described in the pictures and Michelle was a great communicative host"
2024-01-01,5,Stayed one night,Gooddd
2024-01-01,5,Group trip,Fully recommended
2024-01-01,5,Stayed one night,Enjoyed the stay! It was a last minute late booking and Michelle was very accommodating and very responsive. The home was exactly like the pictures. Patio was beautiful! Will definitely stay again!
2024-01-01,5,Group trip,Michelle communicated amazing. The location was great and the house was pretty big.
2024-01-01,5,Stayed with kids,"2nd time staying here! Such a great place to relax, me and the family felt right at home."
2024-01-01,5,Stayed with kids,"This house was perfect for our family of 5. Everything is so nice and impecable. We loved the decoration, just like the description, Aesthetic; the kitchen perfect and complete. The beds and pillows are very comfortable.
It is very close to the shops and restaurants and just a few minutes from the airport.
Would definitely recommend it and when we go back, we will stay there again."
2024-01-01,5,Group trip,We love the place and the host was amazing
2023-12-01,4,Stayed a few nights,"The house is very clean and nicely decorated. The house has many wallflower plug-ins. So, while the smell is nice, it is also overwhelming. The neighborhood is quiet during the day. but quite noisy at night and in the early morning. A lot of neighbors, who seem to have lost their mufflers, enjoyed revving their engines during these hours. There is also a nearby train, but we only heard it few times. Not a complaint, but just informational, all bedrooms are upstairs. Overall, the place is really good and the host was great - I would stay again, but will bring earplugs."
2023-12-01,5,Group trip,Beautiful place and location and location too!
2023-12-01,5,Group trip,A beautiful house! Surprised by how delicious the beds were! Clean house with all that I could occupy! The only thing is that I was happy to join a king size bed still rested very well!
2023-12-01,5,Stayed with kids,"It is a very cozy little house, very well decorated, and clean, just like what it says in the description, the price was made good for us to stay 5 people, in the showers at times cold water came out, but everything else was impeccable, comfortable spaces above all the back terrace, until it has a barbecue, the kitchen has everything you need to cook, the place is in a central area, one block from the main avenue, where there are many shops and restaurants, thank you very much to the host for always being on the lookout 🤗💜"
2023-12-01,4,Stayed with kids,"Super fast to respond, worked with us on check in time which we appreciated so much! Lots of great restaurants nearby. The place was beautiful and cozy. Just what we needed before leaving for the last part of our long trip."
2023-12-01,5,Stayed a few nights,"This place was amazing! I loved the color and style of the place and the outdoor space in the back is absolutely lovely and so comfortable, I wish you'd post pictures of the back! there are TV's in every room and with them all being smart TV's there is plenty to watch. the kitchen is awesome and I loved the couch. the lighting is warm and inviting with plenty of options. thank you so much for letting us stay! I'd love to stay here again some day!"
2023-12-01,5,Stayed one night,"Amazing place. It’s my 4th time renting the place, and never disappoints. Highly recommended"
2023-12-01,5,Group trip,Beautiful and spotless. Super easy check in. Highly recommend.
2023-12-01,5,Stayed with kids,Great property. Very spacious and squeaky clean. The TVs are very good size too and in every bedroom.
2023-12-01,5,Stayed a few nights,Nice place. Would totally repeat.
2023-12-01,5,Stayed a few nights,"The condo was very nice, very clean. The neighborhood was fine but not conducive for a scenic walk"
2023-11-01,5,Stayed a few nights,Great place and location.
2023-11-01,5,Stayed a few nights,"It was a nice, clean & quiet. It had everything it said it would and looks just like the pictures. I will stay here again next time I visit Laredo. I had even forgot some things and the host was great about it and sent it to me. Great all around experience. Thanks"
2023-11-01,4,Stayed with kids,"Very spacious place, great location, very good condition!!"
2023-11-01,5,Stayed a few nights,From start to end Host was completely helpful from able to book another night last minute and over all satisfied with overall stay. I'm definitely going be back
2023-11-01,5,Stayed with kids,"Absolutely delightful stay at this charming Airbnb! From the moment we stepped in, we were welcomed by a cozy, immaculately clean space that felt like a home away from home. The attention to detail was exceptional, with thoughtfully curated decor and all the amenities we could ask for. The host's hospitality was outstanding—they went above and beyond to ensure our comfort and provided fantastic local tips that made our trip even more enjoyable. The location was fantastic, allowing us to easily explore the area while still providing a peaceful retreat at the end of the day. Without a doubt, we had a fantastic experience and would highly recommend this Airbnb to anyone looking for a memorable and comfortable stay."
2023-10-01,4,Stayed with kids,thank you for your help
2023-10-01,5,Stayed one night,Beautiful home very clean and great location.
2023-10-01,5,Stayed with kids,Everything is fine! Very nice and recommended!!!
2023-10-01,5,Stayed a few nights,This place is a great place to stay at.
2023-10-01,5,Stayed one night,"Great house and location. Beds were really comfortable, will definitely stay here next time am in town!"
2023-10-01,4,Stayed a few nights,"Recommended, all good!"
2023-10-01,5,Stayed with kids,"The house matched its description, very beautiful home clean and updated. The stay was comfortable and homey"
2023-09-01,5,Stayed with kids,This is an awesome place....near everything and with the peace to enjoy with the family....
2023-09-01,5,Group trip,"It is a very nice house, very nicely decorated, comfortable and impeccable beds, excellent location. You Michelle for your attention."
2023-09-01,5,Stayed a few nights,"We looked for some hotels in the area and didn’t find quite what we needed, then we found Michelle’s AirBnb and it was the perfect spot for our stay in Laredo."
2023-09-01,5,Stayed with kids,Amazing Home!! So clean. Very homey and welcoming. Everything you need is there. Great place!
2023-09-01,5,Stayed one night,"excellent accommodation, very clean and beautiful, without hesitation I would return"
2023-09-01,5,Stayed with kids,My family and I enjoyed our stay there. The place was clean and had everything needed.
2023-08-01,5,Stayed with kids,"This property was absolutely stunning. The attention to detail in the decor and amenities provided truly exceeded my expectations. Every corner of the space was immaculately clean, and it was clear that Michelle takes pride in maintaining a high standard of cleanliness and comfort for their guests."
2023-08-01,5,Stayed a few nights,"What a beautiful monochromatic and modern restful space. The bathrooms were so high-end looking and the shower revitalized me. A true townhouse that creates a private world in the middle of town. Big city tastes throughout. Thank you for using your talents to create this beautiful space and making it available to all of us. I thought the bed was so comfy I gleefully overslept. We opted to bring back takeout meals just to be able to spend more time in this home. About 15 mins away from Quinto Sol, an excellent vegan/vegetarian restaurant."
2023-08-01,5,Stayed one night,Listing is as described. We were greeted by the tropical storm once we arrived in Laredo. I reached out to Stephanie about possibly checking in earlier she accommodated us with one hour early check in it helped considering we needed somewhere safe to find shelter. Thank you for providing great customer service the home was beautiful we felt comfortable and safe.
2023-08-01,5,Stayed a few nights,Was very clean and comfortable.. Would definitely book again in the future .. Attention to detail on point 100
2023-08-01,5,Stayed with kids,Nice and well kept. Pleasant stay for my family.
2023-08-01,5,Stayed a few nights,It’s a beautiful spacious home for a weekend getaway! And the central location is a big plus. Thank you! I enjoyed my stay in Laredo 🥰
2023-08-01,5,Group trip,"Excellent location, organization and cleanliness, the house is very nice."
2023-08-01,5,Stayed a few nights,The place perfectly met our needs. We were bummed that we didn't get to enjoy the patio because it was just too darn hot! Next time! We would book this location again.
2023-07-01,5,Stayed a few nights,"Great stay with a home close to the city's business areas. The house is very functional and comfortable.
We'll rent the one again later. Thanks for the hospitality."
2023-07-01,5,Stayed a few nights,"awesome places, clean and perfect, Michelle is an angel, thanks a lot"
2023-07-01,5,Stayed over a week,"I have stayed at Michelle's place MANY times now. Every stay has been nothing short of great. She and her husband have always been very accommodating, friendly, and responsive. The house is in great condition and we had everything we needed. The outdoor patio was a huge plus. I have stayed at Michelle's Airbnb for both short and extended stays and definitely recommend it to those looking for a safe, clean, cozy place to stay in Laredo."
2023-04-01,5,Stayed a few nights,"Michelle was a great host! My sister, partner, and I all felt safe and comfortable staying there. The space was beautiful, clean, and in a great location. The pictures don’t do it justice!"
2023-04-01,5,Stayed a few nights,"Michelle’s home was so beautiful, so modern and very,very well kept. My family and I loved every bit of the home. I’d most definitely choose this place over any other in town."
2023-04-01,5,Stayed a few nights,This was my second time staying at Michelle’s place. It’s beautiful and very clean and comfortable. The patio are is a really great place to unwind!
2023-04-01,5,Stayed with kids,Great place to stay
2023-04-01,5,Stayed a few nights,"Very nice and clean place, we will definitely be returning here."
2023-04-01,5,Stayed with kids,"We really enjoyed our stay it was beautiful! The location was perfect distance from the families we visited. The place was very clean and organized. Michelle was really nice and responded very quickly with any questions I had. Would love to come stay over again soon.
Thank you
Alma"
2023-04-01,5,Stayed one night,"Excellent place to stay, all impeccable"
2023-04-01,5,Stayed with kids,"Super cute and comfortable
As described
We loved the place
We would definitely stay there again"
2023-04-01,5,Stayed with kids,"Michelle and the place were great. Very clean and very convenient, one of the best places we’ve stayed in Laredo."
2023-04-01,5,Stayed with kids,Wonderful place to stay! Close to many restaurants and stores. I would definitely stay at Michelle’s place again.
2023-04-01,4,Group trip,"Beautiful place to stay! Would recommend.
More towels are needed. There were 3 bath towels for 6 people. Would have been nice to at least suggest we bring extras ourselves."
2023-03-01,5,Stayed a few nights,Michelle’s place was beautiful and extremely clean. She was very responsive and accommodating. The home is much more spacious than it appears and there’s a great little patio in the backyard. I would definitely stay here again in the future.
2023-03-01,5,Stayed with kids,"This was our 2nd time staying and we will definitely stay again! It’s a beautiful home that was clean and comfortable. I liked the new addition of shampoo, conditioner and body wash in the bathrooms. I had forgotten to pack mine so it was a special surprise!!"
2023-03-01,5,Stayed one night,We were there on our wedding day to fix ourselves and Michelle went above and beyond our expectations and I leave details that made our day very special apart from having a very kind host. It's a beautiful place ❤️
2023-03-01,5,Group trip,"Excellent place, very good location, very quiet, highly recommended.
Above all, very clean."
2023-03-01,5,Stayed a few nights,"Great place! Thanks for letting us stay there.
We look forward to our next visit to town."
2023-03-01,5,Stayed with kids,"My family and I were passing through Laredo as we traveled to Mexico and Michelle's place was the best place we could have stayed at! It was just as described, squeaky clean and we felt safe. She went the extra mile to help us keep an eye on our truck in the driveway bc we had a pickup truck with some things in the bed of the truck outside. She didn't have to do that but we appreciated it so much!"
2023-03-01,5,Stayed a few nights,Michelle was quick to respond when we were in a pinch and all hotels in the area were booked. Thank you for your kindness and hospitality.
2023-03-01,5,Stayed a few nights,Amazing place. Strongly recommended
2023-03-01,5,Stayed with kids,Loved it!
2023-03-01,5,Stayed one night,Look forward to working with her again. The house was great. Exactly what I needed
2023-03-01,5,Stayed one night,Beautiful home with plenty of space. Family enjoyed there stay and we appreciate Michelles fast and quick response. We will definitely be coming back and we will recommend all of our friends to stay here.
2023-03-01,5,Stayed with kids,Enjoyed our stay very clean and nicely decorated townhome with comfortable mattress/couch and very spacious. Will be staying again next time we’re in town. Thank you
2023-02-01,5,Stayed a few nights,"We found Michelle's condo to be a wonderful fit. The location is great. It's close to Target, HEB, etc, but was still quiet and tucked away. Parking is easy. Instructions to get inside were clear. The home is extremely well decorated with contemporary designs. The A/C worked like a charm. The water temperature and pressure were perfect. I loved the outdoor space with twinkle lights. I work remotely so I took advantage of a desk that was set up in one of the bedrooms. The wifi was excellent. We hope to be back."
2023-02-01,5,Stayed with kids,Best Airbnb in Laredo! The house was exactly like the pictures! It was a beautiful and comfortable home. We’re already booked to stay again next month!
2023-02-01,5,Stayed a few nights,"My husband, in laws and myself loved our stay at Michelle’s place! It was so clean and spacious. Most importantly, Michelle is very responsive and accommodating - not to mention thoughtful! Upon telling her that we were visiting Laredo for my baby shower, she left us the sweetest gift for our baby on the way. It’s little touches that make your stay at AirBnBs special!
I would recommend this place to everyone!"
2023-02-01,5,Stayed with kids,"It was a great, updated condo with a great location."
2023-02-01,5,Stayed a few nights,"Host was very kind and responsive. beautiful place, 10/10 would recommend"
2023-02-01,5,Stayed with kids,"Beautiful house very comfortable and well located, enchanted with the decor and comfort"
2023-02-01,5,Stayed with kids,great place to stay
2023-01-01,5,Group trip,This was a great place to stay at. Host was very clear on instructions and was very responsive. Very beautiful place. Would highly recommend for others to stay. Our stay was great!
2023-01-01,5,Stayed a few nights,"Had to put this location as my favorite for when I visit Laredo. Beautiful home, very spacious, and great location. Will recommend and try to return."
2024-06-01,5,Stayed with kids,"a very cozy place, clean and perfect to rest, I recommend it😀"
2024-06-01,5,Stayed a few nights,"It is a quite spacious house, with easy access & a very nice view, it was clean & had what was necessary.
I will return soon❤️"
2024-06-01,5,Stayed one night,"Great home, great neighborhood, great price. Will definitely be back"
2024-06-01,5,Group trip,Place was really nice and super clean! Big and spacious house I recommend !! Mark is also very quick to response! Definitely will stay again when we go back to Laredo !!
2024-06-01,5,Stayed one night,The place was great and Mark was very helpful!
2024-06-01,5,Stayed with kids,The place was great! Spacious and clean. Had everything we could need. Great host!
2024-06-01,5,Stayed with kids,! excellent
2024-06-01,5,Stayed with kids,We were very happy since the first intial point of contact. Mark was very responsive and answered any question right away .His place was spotless and very modern with many amenities in his beautiful 3 bedroom space. Also very organized and clean. Would come back if we ever have the opportunity to come back. Would recommend if you are ever in the Laredo area. Thanks!
2024-06-01,5,Stayed a few nights,Mark was very communicative and responsive. Great host will definitely stay here again.
2024-06-01,5,Stayed with a pet,"We loved our second stay, and the new futon was a lovely addition.
We were able to cook on the last night there, but I wished I had packed some ziplock bags to take my leftovers; the salsa I made was delicious.
Thank you, Maria! We shall return, possibly in June!"
2024-06-01,5,Stayed a few nights,I really enjoyed the guesthouse. It was a very nice place to stay during my visit. The place was cool to walk in from a very hot day. Maria made it very easy with her good instructions.
2024-06-01,5,Stayed with a pet,"Thank you Maria, I really loved your spot. Very convenient location with everything that you may need.
I’ll be back! 🙌🏼"
2024-02-01,5,Stayed with a pet,Plenty of space to park in the driveway. Very nice private patio area. The place was also nice and clean. Check in instructions where very clear. Host was responsive and proactive.
2024-02-01,5,Stayed with a pet,"I love this casita.
So private and cozy and María keeps it pristinely clean !
I especially appreciate the parking space inside the driveway."
2024-02-01,5,Stayed one night,"Visited for a wedding and it was the perfect place to stay at for the night. Maria is very responsive, flexible, and the place is exactly as described in the listing."
2024-01-01,5,Stayed with a pet,We arrived very late due to issue at border crossing. Maria was very helpful and let us keep a number of boxes under a covered area until the following morning. Awesome host!
2024-01-01,5,Stayed with a pet,Stayed here for work in the area. The only drawback was a lack of laundry and we were there for 2 weeks. There are laundromats available nearby if you have the free time to be able to use them.
2024-01-01,5,Stayed a few nights,"Cozy place, central to Laredo and minutes away to airport."
2023-12-01,5,Stayed with a pet,"Maria was an excellent host. We only stayed one night and would stay again if we needed a place in the future. The bed was comfortable and the landscaping in the yard was a nice touch. Everything was tidy and clean. There was enough room to set up our dog’s large crate. Very lovely stay, thank you."
2023-12-01,5,Stayed with a pet,"Maria was an excellent host towards myself, my pups, and my boyfriend. It was an amazing space for a stay when visiting my family! It was very cozy and we felt right at home."
2023-12-01,5,Stayed with a pet,Great place! super clean and comfy! Maria was kind and warm!
2023-12-01,5,Stayed with a pet,everithing great
2023-12-01,5,Stayed with a pet,Great spot! Exactly what we needed on our road trip. Loved the space heater and the snacks in the fridge
2023-12-01,5,Stayed a few nights,A peaceful and nice place to stay I fully recommend 👍👍
2023-12-01,5,Stayed a few nights,"Thank you for your hospitality during our stay. We truly enjoyed our time here, and your recommendations added so much to our experience. We appreciate your kindness and the comfortable space you provided. It was a pleasure being your guest. Farewell, and all the best!"
2023-11-01,4,Stayed a few nights,we had a great experience. the only thing I would say is that the couch is not very comfortable especially to sleep on. but for a child it is probably fine. my husband is disabled so he had the bed
2023-11-01,5,Stayed one night,"Clean, well-kept, close to highways, perfect place for a stay in Laredo. No windows in bedrooms so you get a true black-out, good night's sleep. Will stay again."
2023-11-01,5,Stayed with a pet,This place is great and cozy. Even our dog felt right at home. Will definitely be recommending to friends and family.
2023-11-01,5,Stayed a few nights,"Nice host , clean and comfortable house. I recommend it"
