date,rating,note,review_text
2023-06-01,5,Stayed with kids,Brooke's place was a perfect stopover for us on a family trip. Cottage is charming and fit our needs perfectly. Highly recommend this stay for anyone looking for a quiet getaway in the area.
2023-06-01,5,Stayed with kids,"Ended up being the perfect place to stay with three young children for a long weekend. The cottage had everything we needed, including a pack and play! We were able to cookout and play in the backyard all evening! The cottage was exceptionally clean and had all of the amenities described in the listing. My only constructive feedback is that I wish I had known how close the other houses were in the area. Even that didn’t detract from my experience since it was peaceful and quiet! Also, we really loved hanging out on the front porch!"
2023-06-01,5,Stayed one night,"Brooke's place was ideal for our stay. We were only there for one night, but it had everything we needed and more."
2023-06-01,5,Stayed with kids,"Such a cute place, and perfect for what we needed!"
2023-06-01,5,Stayed a few nights,Great communication from the host. Brooke provided very clear directions and instructions for check-in. The cottage was clean and well stocked with linens. Fishermen will love the location and theme of the cottage.
2023-05-01,5,Stayed a few nights,"We chose this stay as we wanted to be away from the hubbub. Driving through the farm countryside is peaceful. At this time of year the baby farm animals were out in multitudes.
At our stay, so quiet, we got to observe small birds competing for mates and nesting areas.
The stay had everything we needed. The bed comfortable and the shower water ample and hot."
2023-05-01,5,Stayed with kids,"Brooke was amazing! She responded quickly to every question I had. The house was clean and smelled great. She also provided a pack n play, which was amazing because I didn’t have to stuff ours in the car for the 12 hour ride! She even checked in to make sure we didn’t need anything extra for our stay. We enjoyed the yard and the rocking chairs with our little ones! 10/10 would stay here again."
2023-04-01,5,Stayed a few nights,Really enjoyed the cottage. Highly recommend.
2023-04-01,5,Stayed a few nights,"Peaceful place, chill owner and a very nice stay overall."
2023-04-01,4,Stayed one night,Nice quiet location. Just a few miles off Rt 322. Very clean and neat. Brooke was a great host - always a prompt reply and very helpful.
2023-04-01,5,Stayed one night,Very clean and comfortable location
2023-04-01,5,Stayed one night,The surrounding area was beautiful! Great stay!!
2023-04-01,5,Stayed with kids,this place was awesome! Brooke was great to deal with and we couldn't have asked for a better experience! thank you so much!
2023-04-01,5,Stayed one night,"We weren’t there long, but Brooke was very nice and responsive. It was very quiet and matched the listing. Would definitely stay there again if we’re in the area!"
2023-03-01,5,Stayed one night,Great place. Very clean and nice decor. It wasn’t as private as we expected from reading the other reviews as there are other houses close by but very quiet and peaceful as described. We enjoyed sitting on the porch which is fairly private and has a nice view. Bring a corkscrew if you plan on trying a bottle of local wine which we very much enjoyed after we improvised to get it open.😉
2023-03-01,5,Stayed with kids,"This was our second trip to Brooke’s place and she was more than accommodating. This trip we were traveling with our twin 11 month olds and she arrange to have a second pack and play at the house. Not only was it there, but the pack and plays were both already set up and had sheets on them which was amazing! The location is five minutes to downtown Lewistown which was perfect for us in town visiting family!"
2023-03-01,5,Stayed one night,"We enjoyed our stay after the Bruce Springsteen concert. The last 100 yards to the house were a little scary in the dark, but the driving directions were detailed and clear."
2023-03-01,5,Stayed a few nights,"This was my second stay and just like the first time, it was amazing. I drove up that mountain, and as soon as I pulled my car in, I felt like I was home again. This little cottage is incredibly important to me. as always, it was clean, comfortable, quiet, peaceful, and felt like home. All of the amenities provided allow you the ability to not even have to leave if you don't want, or need to Brooke is incredibly communicative, always responds quickly, and is incredibly kind. If you are lucky enough to stay in the cottage, on the side road, heading up to the cabin, stop if you can and take in the absolute beauty of the mountain you're driving up to. My only wish is that I had been able to stay another night. As long as I'm able, I'll be back, every March, to that little cabin, on the side of a beautiful mountain."
2023-02-01,5,Stayed a few nights,"Love the whole cabin, especially the fully prepped coffee bar 😉 (great for heavy coffee drinker, early morning in the mountain..). Very clean and warm in the Winter. Def will come again!"
2023-02-01,5,Stayed over a week,Brookes place was so clean and so nice. Beautiful surroundings and a great place to unwind. Internet was pretty great also! Highly recommend staying here.
2023-01-01,5,Stayed a few nights,"Cozy cottage in the hills. Very homey, with lots of personal touches - Brooke clearly wants guests to feel at home and taken care of.
The heat works great, so it's toasty warm in the cold weather. Wifi has strong signal, beds very comfy. Kitchen has everything you need.
Very peaceful, quiet area. Close to downtown Lewiston, which is cute and has a great little coffee shop - East End Coffee.
Brooke was very responsive to my requests for info about the area/restaurants & grocery stores, etc.
Highly recommend."
2022-12-01,5,Stayed a few nights,"We had a great stay overall. The beds were extremely cozy and warm, the house had everything we needed, and was very clean. The one thing I would mention is that upon entry, the house had a pretty strong smell of what seemed like maybe a previous smoker. We were able to open the windows and air it out a little, and it probably wouldn't bother many people, but both my friend who stayed with me and I have asthma, and are sensitive to that smell, so it's just something to consider if that bothers you. The house was spotless, warm, cozy, and had everything we needed otherwise. Brooke was very nice and helpful, and the stay was great."
2022-12-01,5,Stayed a few nights,"We enjoyed our holiday weekend getaway! The cottage was clean and cozy, bed was comfortable and Brooke was always helpful when we had questions. I highly recommend others to go here for a getaway of some kind!"
2022-11-01,5,Stayed one night,"Perfect little spot, exactly what we need it."
2022-11-01,5,Stayed one night,"Very nice cabin close to a creek. Spacious, quiet, comfortable."
2022-11-01,5,Stayed with kids,A great little spot in the countryside.
2022-11-01,5,Stayed a few nights,"The cottage was clean, comfortable and just as described. Brooke is a great host and extremely easy to work with."
2022-11-01,5,Stayed a few nights,"A perfect place to stay close to everything! If you like hanging out with the neighborhood cats, they will be more than happy to join you on the porch for morning coffee."
2022-10-01,5,Stayed a few nights,Place is fantastic!
2022-10-01,5,Stayed one night,"Brookes place is exactly as described. Located in a quaint town, it's nestled in a quite and beautiful location. Located not far from Beaver stadium (approx 40 min), this place was a perfect place to stay when visiting for a football game."
2022-10-01,5,Stayed one night,Loved it. Loved the little kitten who greeted us outside. Spotless and clean cottage.
2022-10-01,5,Stayed a few nights,It is exactly as pictured and very clean
2022-10-01,5,Stayed a few nights,"Super cute clean and comfortable cottage. Communication with Brooke was excellent. We needed to extend our stay and Brooke took care of everything. We really appreciate all the extras in the house (water, coffee, tea, species) as they were very handy.
Definitely a recommended place close to Penn State."
2022-10-01,5,Stayed one night,"As Advertised!! clean, comfortable, and quiet. I would absolutely stay again."
2022-10-01,5,Stayed one night,Super clean and comfortable stay. Good value. Thank you Brooke!
2022-10-01,5,Stayed one night,Great place. As advertised. Thank you Brooke!!
2022-09-01,5,Stayed one night,Great stay. Great host Affordable. Five stars.
2022-09-01,5,Stayed one night,The cottage is a great little space. I loved the fly fishing theme. The bed was comfortable and everything was neat and clean. Thanks for a restful night. We picked up our puppy the next morning and headed home.
2022-08-01,5,Stayed with kids,"Exactly as described, this is our third family trip to the Lewistown area and we definitely stay here again. Good value, clean and we enjoyed our 7 day stay at the cottage. We recommend Hostetler Country Market near Belleville and Woody's BBQ in Huntingdon for any travelers not familiar to the area. Looking forward to staying again on our next trip to PA. Thank you for being a great host, Brooke."
2022-08-01,5,Stayed a few nights,"Cozy cottage, a lovely stay! Tip top shape - full kitchen, clean bathroom, 2 separate bedrooms with comfortable beds, nice living room and great front porch. AC units weren't too powerful but good enough. Quiet location in middle of field with other homes around perimeter. Bridge is fine, don't worry! Quick drive to town. Host was responsive and sweet. Highly recommend!"
2022-08-01,5,Stayed with kids,"This was our second stay at what my 4 year old refers to as our “holiday house” she has no concept that is in fact not ours at all, and I think that’s because it feels comfortable and familiar for us. A great place to stay for our little family and we hope to visit the holiday house again soon haha."
2022-08-01,5,Stayed with kids,We had an wonderful experience and enjoyed the Lewistown area very much. The accommodations were excellent and the cabin had everything we needed to make our stay feel like home.
2022-08-01,5,Stayed one night,Great stay for the price!
2022-07-01,5,Stayed a few nights,"Me and my best friend loved the area of this cottage! The creek was beautiful, and we loved the drive through up to the cottage!"
2022-07-01,5,Stayed with kids,"For context, we don’t normally stay at super fancy or luxurious air bnbs but my husband said this is the nicest place we ever stayed. Our kids are already asking when we can go back. They absolutely loved the creek. It was perfect for our family and Brooke was a very attentive host. We will definitely be back!"
2022-06-01,5,Stayed about a week,"First, the cottage and amenities were great… clean and comfortable with everything we needed to make our stay quite nice!
Second, the only problem we encountered (a minor technical glitch in the TV) was corrected to our complete satisfaction within a very short time on the day of our arrival.
Third, we had a most relaxing week in a cottage that feels remote but is relatively close to so much!"
2022-06-01,5,Stayed a few nights,Working away from home and needed to find a place to stay. Perfect little cottage! Very clean and Brooke was an amazing host. Would’ve loved to stay longer.
2022-05-01,5,Stayed a few nights,"The cottage is cozy. Definitely off of the beaten path and you have to drive a one lane gravel road to get to it. The bridge wasn’t any concern as others have posted, but the inability to move out of someone’s way on most of the path can be iffy. Everything that we needed was provided as far as towels, dishes, paper towels, etc. We appreciate Brooke being responsive and it helped to make our stay a good one."
2022-05-01,5,Stayed a few nights,"Our son got married at Hungry Run Distillery, so we booked the Cottage for the weekend. It was close to the Venue, as Brooke had told us. The Cottage location was peaceful and a nice place to unwind, after such a beautiful day!"
2022-05-01,5,Stayed with kids,"I highly recommend this cottage, it is very well maintained and there is noticeable care put in to make it a nice place to stay. The bridge to get to the cottage was a little intimidating for us at first but didn’t take long to get acclimated. Comfy and clean!"
2022-05-01,5,Stayed a few nights,Beautiful area and lovely checking in and out process.
2022-05-01,5,Stayed one night,"Lovely tidy cottage, perfect for a weekend stay!"
2022-04-01,5,Stayed with kids,"Great private location! Brooke’s cabin was the perfect 4 day stay for my little family. It was cozy, had everything we needed, and we felt right at home. Brooke is a great, responsive, and very helpful host!"
2022-04-01,5,Stayed a few nights,"I stayed at Brooke's while taking a class at the State Fire Academy for four days. The place was cute, clean, and convenient. It was so nice to be able to cook some meals in preventing the need to eat out every night. The bridge wasn't as bad as some say and the area seemed very safe! I would definitely stay again."
2022-04-01,5,Stayed a few nights,"Brooke was wonderful to book with! Prompt in responding, kind, and accommodating. The cottage was very cute, very clean, and exactly what we needed for our weekend getaway!"
2022-03-01,5,Stayed with kids,A great little spot! Perfect for a quiet stay. Brooke was a great host. Thanks so much!
2022-03-01,5,Stayed one night,Great stay! Easy to get to town. Nice place with everything you need
2022-03-01,5,Stayed a few nights,"I took this weekend solo for some self care and the cottage did not disappoint. I had a really great time. It was quiet, and no distractions. the cottage is lovely and comfortable. Brooke was incredibly easy to reach for any questions or concerns. I of course picked a weekend that we got a snow storm, but she was very gracious in allowing me extra time to stay past checkout if needed. Thankfully I did not and was able to leave on time. I would absolutely come back for another solo, hideaway, weekend of quiet self care again. Which I'm hoping will be sooner rather than later. Also, the bridge can be daunting, but it is easily doable. If I can do it with some snow and ice... you can absolutely do it too. Just take it slow and you will be fine. Thank you again for a great weekend."
2022-02-01,5,Stayed one night,Great stay in a cozy cottage!
2022-02-01,5,Stayed one night,Brooke is a great hostess.
2022-02-01,5,Stayed one night,Brooke is a wonderful host. it's was a very comfortable stay
2022-01-01,5,Stayed a few nights,Cute little place tucked away. Has all of the amenities you need for a low-key getaway.
2022-01-01,5,Stayed a few nights,"We had a great weekend. The nighttime temperatures were 12 and 7 degrees and the cottage stayed warm and cozy. We found a great brewery “The Shy Bear” nearby and spent an afternoon there listening to live music. Brooke is a great host, always responded very promptly. I left my jacket behind and she offered to mail it back to me."
2022-01-01,5,Stayed one night,"This was the perfect find for our trip. My family and I wanted a safe, quiet place to stay. This was the perfect spot. The cottage is comfortable and CLEAN and we loved the country, small town feel.
When we stayed it was a cold weekend. However, the house heated up perfectly! The Roku TV and WiFi were both easy to figure out and made the perfect way to unwind after a long day. Plus, the host also left some snacks when we arrived; the perfect way to welcome us.
The host is also what makes this AirBnB a great place to stay. She will be happy to answer questions and communicates quickly. She even went above and beyond. The morning of our checkout was accompanied by terrible weather (freezing rain). However, Brooke was proactive and on top of it. She reached out to us in a timely manner the morning of checkout and communicated we could shelter there until conditions approved. Part of this was just luck no reservations were made for later that day. HOWEVER, the care for the safety of their guests and the quality service to the AirBnB is what shown through.
We recommend and would definitely stay again!"
2022-01-01,4,Stayed one night,A cute fishing cabin! Clean and as described!
2022-01-01,5,Stayed a few nights,Great quiet and cozy NYE weekend with my little family. The cottage was very clean and had everything we needed. Nice-and peaceful location. It was mostly raining and Ioved the sound of the rain on the tin porch ❣️
2021-12-01,5,Stayed a few nights,"this is a great place to stay if your trying to have peace and quiet it is extremely private the bridge to drive over it is very old and scary so proceed with caution and try not to travel after 5pm as the area gets pitch black the town is very quiet and deserted. the 2 movie theatres and most stores look like they are out of business so make sure you stock up on food, there is a supermarket called giants which has food and items for great prices! there is a forest 30 minutes that was a nice place"
2021-12-01,5,Stayed with kids,"had an amazing stay. quick responses from host, very cozy, personal and Brooke is awesome"
2021-12-01,5,Stayed a few nights,Was an amazing stay and Brooke provided great communication.
2021-12-01,3,Stayed a few nights,"A nice and cozy place, easy communication, and good isolation. Only issue was the internet was quite slow and we had to purchase our own router for the internet to work to our needs."
2021-12-01,5,Stayed one night,very clean and hospitable
2021-11-01,5,Stayed a few nights,"Great cozy cottage getaway. Was perfect for staying over to attend a Penn State football game. Had the ability to cook food at the house, but got some takeout from town."
2021-11-01,5,Stayed a few nights,Such a clean and cozy place. Easy drive to State College which is why we stayed in that area. Beautiful part of our state! Brooke was very easy to reach and very accommodating. Thank you!
2021-11-01,5,Stayed one night,"Had a great time! Loved the decor and board games! Owner was very responsive and neighbors seem very friendly. Great view too! Careful on the bridge coming in, though..."
2021-11-01,5,Stayed a few nights,Great space. Would definitely stay again. Extremely clean.
2021-10-01,5,Stayed one night,"This was the perfect find for our trip out into Western PA. The cottage is quite simple but very comfortable, and exactly what we were looking for in a place to stay. At the time of our booking, it was also the only full home rental we could find in the area - most other options we came across were single rooms or going to a full blown hotel (both not really for us!).
A few things that really helped enhance our stay: great heating/cooling in the house that is easy to control, nice board game selection, the Roku TV was easy to use, and the host also left some local treats and waters for us - a sweet little addition.
We will definitely be revisiting in the future if we have to travel to this area again."
2021-10-01,5,Stayed one night,Brooke was wonderful to deal with. She was very communicative and highly responsive to every single message and question that I sent to her. Check in was simple and Brooke was flexible with me on arrival time.
2021-10-01,5,Stayed a few nights,"We really enjoyed our stay at Brooke's cottage! It was better than expected. We appreciate how clean and nice the space was. The narrow bridge on the way to this rural location made us ""smile"" and added to the experience. Thank you so much for making our stay a unique and great weekend."
2024-06-01,5,Stayed a few nights,Very nice place to stay and great atmosphere. I highly recommend.
2024-06-01,5,Stayed with kids,"We enjoyed a peaceful, clean stay with great communication and many thoughtful details, including sweet treats and well-stocked toiletries. Would highly recommend to anyone staying in the area!"
2024-06-01,5,Stayed a few nights,Very peaceful and clean place. Beautiful scenery and had everything we needed. Lisa was very responsive to questions. Thanks for the yummy treats and the s’more supplies. Enjoyed time with our family and very relaxed.
2024-04-01,5,Stayed with kids,"The home was very beautiful. We all enjoyed our stay very comfortably! Lisa allowed us to use anything in the house we needed and even offered up using the fire pit to make make s’mores. Who doesn’t love S’mores?! Also the the welcome sign was very sweet. Coming from Lancaster, she had a platter of whoopie pies for us. I thought it made for a nice personal touch to welcoming us into her home!"
2024-01-01,5,Group trip,"We loved staying at the Old Park Estate. It has a welcoming atmosphere as soon as you open the front door. It is a beautiful home with a lot of space. The game room was one of our favorites. The bedrooms are larger and the beds are very comfortable. The kitchen is fully stocked. The house is in the country but minutes from shopping and restaurants.
When we had any questions, Lisa quickly responded.
Overall it was one of our favorite places to do a weekend stay."
2023-11-01,4,Group trip,"The house is spacious, welcoming, and Lisa is an excellent, responsive host."
2023-11-01,5,Group trip,"Everything was great, thank you so much we appreciate it"
2023-10-01,5,Stayed a few nights,"We had a wonderful weekend at Lisa’s place. We were close enough to PSU campus to enjoy a hockey and football game. Also brought our bikes along to hit the Rothrock trails. Lisa was welcoming and very responsive. She thought of a lot of details to make your stay stress free. Bathroom supplies you may have forgotten, a well stocked coffee bar and a very cute game room for downtime or a rainy day. Beds were comfortable for a good nights sleep. We will definitely stay here again. Thanks for a great stay Lisa"
2023-10-01,5,Stayed a few nights,"We were in town for a wedding, and this cozy residence made for a perfect place for our family to spend time together, while celebrating a wonderful occasion! The home and property were so quiet and peaceful. It made for a great time to rest in between so many activities. Highly recommend!"
2023-10-01,5,Stayed a few nights,"Stayed at the Old Park Farmhouse for our niece’s wedding at Belle Mountain estate. The house was wonderful, close to the wedding and quickly became the gathering spot for much of the family. A GREAT place to gather with lots of space. Lisa was very responsive and the house was set up with many nice touches like a coffee bar with excellent locally ground coffee."
2023-09-01,5,Stayed a few nights,Very nice place with great communication from Lisa.
2023-09-01,5,Stayed a few nights,"Great place for a family, easy drive to PSU for games. Lisa was a great host with great communication throughout."
2023-08-01,5,Stayed one night,Lisa was super helpful and very quick to respond. House was clean and very well stocked. Her place was perfect for our group to stay while we attended a wedding at Bell Mountain estates. A+
2023-07-01,5,Group trip,5 stars!
2023-07-01,5,Stayed a few nights,"What an absolutely fantastic home this was. I went with two of my friends to get away for the weekend and play board games, and there was so much space! The property is beautiful and well taken care of and is very peaceful and quiet. Looking forward to booking again in the future!"
2023-06-01,5,Stayed with kids,Felt right at home. Lisa was very responsive and helpful
2023-06-01,5,Stayed a few nights,Great location. Only 1 mile from the wedding venue.
2023-06-01,5,Group trip,"We had 6 adults stay two nights, for my daughter's wedding, just down the road. We were greeted with homemade blueberry dessert, sodas, water. We had a little issue with chilly first night and heat didn't work. We did find a space heater that helped. She dropped off a 2nd space heater for the second night. Phone signals were hit or miss (no WIFI). A really beautiful facility and is very homey and spacious."
2023-05-01,5,Stayed a few nights,"Great place with plenty of room. Nice peaceful setting with a huge yard. Great place for entertaining and family get togethers. The house was and old farm house, very unique and clean. Plenty of games and information for the area for food and exploration. Would definitely stay again. The host Lisa was very responsive and accommodated my whole families needs."
2023-05-01,5,Group trip,"Amazing host
Amazing property
🥰"
2022-11-01,5,Group trip,"This property is a gem! Very large space with plenty of sleeping areas as well as huge common areas. Our favorite was the large selection of board games to play with friends. It is convenient to groceries, restaurants and the highway. Highly recommend!"
2022-10-01,5,Stayed with kids,My family of 5 enjoyed this well kept house. It was spotless at checkin and the host provided all we needed including homemade treats. I highly recommend this property.
2022-10-01,5,Group trip,Fantastic place to stay with great hosts who provide excellent communication!
2024-05-01,5,Stayed one night,"Perfect stay for our son's PSU graduation. Quiet street, great accomodations, even though all we were really there for was to sleep. Bed was heavenly & entire home was pristine. Would 10/10 recommend, and we'd even like to stay again and explore more of Lewistown."
2024-05-01,5,Stayed one night,We had a fabulous stay at John’s place. The house is very charming and squeaky clean. It felt like home. I highly recommend!
2024-04-01,5,Stayed one night,The house was perfect. It's an older house that is clearly well loved and maintained both inside and outside. Instructions on how to use everything were very clear and local recommendations were really helpful.
