date,rating,note,review_text
2024-06-01,5,Stayed a few nights,"Wonderful place , very convenient to relatives house.very quiet place,and wonderful host."
2024-03-01,5,Stayed one night,great value
2024-03-01,5,Stayed one night,This place was awesome. This will be our go to spot in Marion from now on
2024-01-01,5,Stayed a few nights,Lasana is an amazing host! She was very attentive with my stay. The home felt like home. She showed a lot of attention to detail for her guest to help them navigate through the home by providing small post-it notes on the wall. I would be happy to stay with her again.
2024-01-01,5,Stayed a few nights,Wonderful place to stay .very close to my sons house
2024-06-01,5,Stayed with kids,We enjoyed our stay. The home was clean and in a great location for us to visit friends nearby. The neighborhood was peaceful. Host was friendly and responsive.
2024-06-01,5,Stayed a few nights,This is a 5 star ✨ for me. Sharon is a great host.
2024-06-01,5,Stayed with kids,"Listing was as described and matched the photos. Host was responsive with any questions I had. The garage is a nice feature so you don’t have to leave your vehicle outside in an unknown area, although the neighborhood seemed very safe and friendly. The backyard is a nice space to hang out and relax with family/friends and is private with the fenced in yard. Would definitely recommend this property to anyone and if I’m in the area again would definitely stay here again."
2024-06-01,5,Group trip,"This was one of the best Airbnbs we've ever stayed at! The home was clean and updated, the beds were comfortable, and it was a short drive to everything we needed. The host was responsive and SO kind! We would 100% stay here again."
2024-06-01,5,Stayed over a week,Had a really nice stay for a couple weeks while on business. The neighborhood was extremely quiet. Very convenient to any of your needs around town. Wouldn’t hesitate to stay again!
2024-06-01,5,Stayed a few nights,Great house! Sat in the backyard and heard 15 different type of birds. Comfy furniture. Children games a big + when 7 yr old granddaughter came for visit. We will definitely be back.
2024-06-01,5,Stayed with kids,A wonderful opportunity to experience FLW’s design. Grateful to Matthew for opening up his home to us. A very memorable experience for my family and I.
2024-06-01,5,Stayed with kids,"What a cool and unique place, with an awesome host to boot! Getting to stay in an authentic Frank Lloyd Wright home is a rare opportunity. The home itself still has most of what look like the original fixtures, and is true to the architect's vision. Matthew was always super welcoming and responsive. An added bonus for kids: there is a really great park right around the corner with an awesome playground. We hope to be back soon!"
2024-05-01,5,Stayed with a pet,"We found this Gem available for our last minute travel plans, that also allowed our four legged family members.
We are Frank Lloyd Wright fans and this masterpiece was everything we could have imagined and more.
We were blown away by the house and the amazing park down the street. Just perfect for a little getaway and immersed in a gorgeous piece of history."
2024-04-01,5,Stayed with kids,"I enjoyed spending a weekend at Woodside with my family and friends. The adults, including two architects, got to learn about the house while the kids explored the grounds. We were to go out to eat, but the kitchen was so well equipped we cooked instead."
2024-04-01,4,Group trip,"Such a treat to experience this home! Each view is something to pause and take in.
Know that the house has quirks and you have to be flexible to look past them. Best to travel with close friends / family."
2024-03-01,5,Stayed a few nights,"We had an amazing stay at Woodside!!! If you're passionate about interior design or architecture, staying in a Frank Lloyd Wright house is an unparalleled experience. It wasn't just a place to stay; it was a chance to live within a work of art. This particular Airbnb was exceptional, offering a well-preserved example of Wright's genius. For any design enthusiast, it's an opportunity not to be missed."
2024-02-01,4,Stayed with a pet,We had a great extended family get- together. We enjoyed the history and architecture of the home. It was incredible!
2024-02-01,5,Stayed with a pet,A real treat to stay in a Frank Lloyd Wright house. Unique architecture. Updated kitchen with high-end appliances. Nice grounds. Has some of the FLW quicks - easy to live with given the rare treat of staying in a great place. Hosts were very responsive and all was great.
2024-02-01,5,Stayed a few nights,A beautiful house and quiet area. Perfect for a weekend getaway or a small dinner party. The whole stay was a great experience and we will definitely be going back to Woodside.
2024-01-01,5,Stayed a few nights,This house is an absolute gem! We can’t wait to come back!
2024-01-01,5,Group trip,"all the delight of an architectural gen, plus the comfort of a well stocked kitchen, lots of linens, lots of bathrooms and hot water. such a peaceful stay!"
2024-01-01,5,Stayed one night,"The Frank Lloyd Wright home was so well maintained , we loved our night staying here ! Our bed and linens were very comfortable!
Matthew was very prompt and kind in communicating with us, it was a perfect weekend getaway ! The house is exactly like the photos ! Thank you Matthew!"
2024-01-01,5,Stayed a few nights,"it was a privilege having the opportunity to stay in this amazing space. it made the special occasion we were celebrating all the more memorable. believe all the positive comments you read in these reviews, take the negative comments with a grain of salt. can't overstate how gracious it is of Matthew to share this historic treasure with the rest of us. thanks again Matthew, hope to visit again sometime!"
2023-12-01,5,Stayed with a pet,I cannot express how beautiful and seamless this experience was. An incredible slice or architectural history and such an enjoyable stay.
2023-12-01,5,Stayed with a pet,The pictures really don’t do the Frank Lloyd Wright House justice! It is beautiful and Matthew made our family Christmas special.
2023-12-01,5,Group trip,"We had the most magical stay at Woodside. Words can’t describe the warmth and comfort that emanate from each room. But if you know anything about this house I’m guessing you know that already! So here are the other details of our stay- the place was spotless, the kitchen had everything you could ever need, and the beds were super comfortable. The owner, Matthew, is hands down the most responsive and helpful Airbnb host I’ve ever encountered. It’s clear that he’s doing everything possible to maintain it exactly FLlW would see fit. Don’t pass up the opportunity to immerse yourself in this work of art!"
2023-11-01,5,Stayed with a pet,"What a unique experience to stay and feel what it’s like to live in a Frank Lloyd Wright House. The house is unexpected and peaceful. The heated flooring so cozy. We really enjoyed our stay at Woodside.
The bed arrangement is slightly different than in the pictures. On one wing there is a large master room with a king bed, and adjacent bathroom. A single twin bed in a room with seperate bathroom, as well. On the other wing is a bedroom with a single bed & a bedroom with a full sized bed. Both those have an en-suite with shared shower. Next to that those two rooms is a sitting room with fireplace and balcony. There is also a powder room off the main hallway. The main living room is amazing with the high ceilings large fireplace, big windows and tipi inspired architectural details. A true treasure and treat to stay in!"
2023-10-01,5,Group trip,"Amazing house, comfortable beds, very well-equipped kitchen. We had a great time."
2023-10-01,5,Stayed a few nights,Thank you. We have had a great time there with golden Fall times
2023-10-01,5,Stayed one night,Really cool!
2023-10-01,5,Stayed with kids,It’s hard to put into words staying at Woodside. You feel like you’re transported back in time to a beautiful piece of history. I’m so grateful for the short time I was able to stay and can’t wait to go back!
2023-09-01,5,Stayed one night,"The place is beautiful. We really enjoyed our time here and felt really at home. It’s a 70 year old historic home so it comes with some wear and tear, but it’s part of the experience. This was our honeymoon and we look forward to coming back to visit soon. Matthew was extremely responsive and he helped us find the booklets on the history of the home. If you are a Frank Lloyd Wright fan, I highly recommend taking a look through it."
2023-09-01,3,Stayed with a pet,"Loved getting to enjoy first hand the architecture and seeing how the lighting changed the vibes. Seating and beds were comfortable. The kitchen was phenomenal. Loved cooking meals there. The house sound system was nice.
A few things we didn’t enjoy so much- the back door was open on arrival. Everything was fine except it was hot. It took time to cool down and the main air unit became noisy and annoying.
The house is dated and needs some repairs. The electrical system appears to be original to the house. Many of the switches did not work or were touchy. There were areas where tiles were missing on the floors and in the bathrooms. There were no shower curtains and the jacuzzi tub was not functional.
The main bedroom was musty and hot. A window unit cooled it down but the result was cool musty air.

The outdoor deck should be replaced. It bounced when walked on and the steps were falling apart.
While we enjoyed the experience overall I don’t feel it was worth the $$$."
2023-08-01,4,Stayed one night,"It was a thrill to stay in a Frank Lloyd Wright home. We very much enjoyed our stay. We’ll equipped kitchen. Wonderful outdoor terrace. Clean, neat house. Spacious. Huge living room. Beautiful artwork. Kid’s wing. Wonderful grounds. As those of you that understand the complexities and oddities of a old Frank Lloyd Wright house, this one, too, is a work in progress and upkeep. The owner is obviously working to maintain the property. But don’t expect everything to be in pristine condition. The owner is great to work with; very responsive and understanding. I hope to stay there again!"
2023-08-01,5,Stayed one night,"The Davis House is a rare ascending space in Wright's oeuvre, a Usonian house that seems to combine the characteristics of the Guggenheim Museum. Rare blue print drawings can also be seen. The owner is very helpful and friendly. It was a very impressive stay. Thank you very much."
2023-08-01,5,Stayed with a pet,"What a wonderfully preserved Frank Lloyd Wright home and in great condition. A must-do for any Frank Lloyd Wright fan. Plus it's in a very quiet area, perfect for a weekend getaway. Loved it!"
2023-07-01,5,Stayed a few nights,"Beautiful and unique home, Matthew is a great host!"
2023-07-01,5,Stayed a few nights,Amazing!
2023-06-01,5,Group trip,"I grew up in this town and always wondered what the house looked like on the inside. Then I married a BSU architecture grad and big fan of FLW. So fast-forward many years when we had to travel back to Marion for a family wedding - it seemed like the best place for our family to stay while in town. It was also for a special treat for my husband.
It was everything we expected and had such a cool factor. It’s unique and quirky and exactly what an original FLW house should be. It was an amazing experience to stay in this home.
Matthew was responsive and a great host. The house is fully stocked and the kitchen has everything you need…and then some!
What a gem."
2023-05-01,5,Stayed a few nights,We feel privileged to have been allowed to stay at this landmark. We enjoyed exploring the fascinating story behind it. It is very beautiful. The owner was responsive and helpful.
2023-05-01,5,Stayed one night,Had a great time and am looking forward to staying again.
2023-05-01,5,Group trip,We had a great stay and it was exactly what we expected. Matthew was a great host and if we had any questions he was always available to talk to. The kitchen was wonderful. We enjoyed learning about the history of the house. We hope to be making reservations to stay there again soon.
2023-04-01,5,Stayed with kids,"Five Stars all around for this house and the host! Staying in a Frank Lloyd Wright house is a fantastic experience! Each different time of the day/night showed light and shadows that were so intentional and picturesque. Our daughter is a huge architecture fan; this was a fun way to create lifelong memories with her! Matthew was an incredibly generous host with his time and he shared stories about the house and previous owners. He had a fire ready for us to start in the fireplace, which was magical! We were planning to go out to eat, but the grocery store was only a mile away, so we made steaks and had all the trimmings. Super easy! Thank you for everything, Matthew! We highly recommend this getaway and look forward to returning!"
2023-03-01,5,Stayed a few nights,"A very rare opportunity to stay in a Frank Lloyd Wright architected home - we loved it! We came for a weekend to stay for my friend's 60th birthday. She is a huge FLW fan, and we surprised her with this trip. We were blown away by the architectural integrity, the documentation that was provided telling about the home and the history, and the high end appliances in the kitchen. Matthew answered all of our questions promptly, and was a joy to work with on this stay. The home has tons of room, and was more than what we four needed. We loved being able to stay in this home which is on the registry of historic places as well! The caretaker had a fire built and ready for us to light in the iron stove, and we took advantage of that. If you are looking for a peaceful escape and a place to cozy in for a few days, you couldn't go wrong here."
2023-01-01,5,Group trip,Great stay in a unique home. Nearby Matter Park has a great disc golf course. The full kitchen was great.
2023-01-01,5,Group trip,I was looking for a unique and memorable place to take the family to celebrate New Years Eve. This place exceeded all of my expectations and left us with such wonderful memories. How often do you get to spend a night in a museum? The Host was super responsive and you can tell loved to be able to share his piece of history. A great experience I highly recommend.
2022-12-01,5,Stayed with a pet,We had a great stay in this FLW house. Enjoyed the wonderful kitchen and the expansive great room with fireplace (wood stove). Matt was a very responsive host and made check-in super easy. This was a wonderful post-Christmas relaxing retreat for our family.
2022-11-01,5,Group trip,"In the theme of Thanksgiving: We were grateful for the following:
1) Matthew sharing his incredible Frank Lloyd Wright home with us.
2) The well stocked kitchen to prepare our lovely Thanksgiving meal.
3) The opportunity to be with each other in front of a roaring fire.
4) The extremely relaxing weekend because the home is located in a very quiet neighborhood.
5) The mild weather, so that we were able to take advantage of the backyard and look at the brilliant night sky.
Our experience was magical. We will be back!!!!😊😊😊"
2022-10-01,5,Stayed with a pet,Very nice experience for FLW admirers.
2022-09-01,3,Stayed with kids,Timeless architecture. Good location. Easy check-in. Responsive host. No hot baths.
2022-09-01,5,Group trip,Amazing historic home
2022-09-01,5,Stayed a few nights,"We're grateful for the chance to stay at Woodside and to explore Marion. Such a treat to stay over at a Frank Lloyd Wright home and read its history and explore the design. Wonderful location and great, easygoing host. Highly recommend!"
2022-09-01,5,Stayed a few nights,We had a wonderful stay at Woodside. The spaces are extraordinary and the kitchen is fit for a chef! Thanks for sharing your Usonian treasure with us!
2022-08-01,5,Stayed a few nights,"Walk in and see the true hand of the master. One room, thousands of angles, it’s amazing. How many Frank Lloyd Wright houses can you stay in for two days?…a handful and less every year. Don’t wait. Thank you Matthew"
2022-08-01,5,Stayed a few nights,Not many opportunities to stay in a Frank Lloyd Wright house and there couldn’t be a better host. Matt was super helpful and check in was flawless. Our group really enjoyed it. We opt for Air BnBs for work trips so we can relax more and this was just the ticket. We will be back next year for the same event.
2022-07-01,5,Stayed with a pet,"This is a must stay, especially for architecture fans. Frank Lloyd Wright home from 1955. The design is amazing. Huge ceilings, long hallways with tons of windows allow for a great breeze throughout the home. With 3 fireplaces, this would be great and cozy in the winter.
If you have many friends, definitely a group area, with all private rooms, enough bathrooms to go around, and a well stocked kitchen for any and all cooking needs.
The neighborhood is quiet and peaceful, and at night it's quite easy to see all the stars you don't see in a city.
A large deck and yard provide enough space to hangout with friends without crowding, and have a fire or two on chilly nights.
Everything was clean,tidy, and welcoming for our stay. It was great to see that there were some updates to the home, but most of it is kept original to FLW design.
The host communicated quickly to answer any questions we had, and check-in was easy and painless, letting us get right to enjoying this beautiful home."
2022-07-01,5,Group trip,Precious experience. You have to stay at this house to fully appreciate it. Matthew was quick to respond to all of our needs. Very gracious host.
2022-07-01,4,Stayed a few nights,"It's a legit Frank Lloyd Wright house! It's beautiful and has a lot of history. The outdoor area was great, and the indoor+outdoor sound system was fun.
The accommodations were more rustic than we expected. It felt more like glamping than a luxury home. Only one room had working air conditioning, and the house was generally pretty old. For example, we didn't open some of the doors because of visible bugs and cobwebs on the outside. The furnishing are in need of an update - such as shower fixtures . For the price, we expected better amenities than a motley assortment of old soap bottles on the floor of the shower.
The kitchen was great, and we cooked a lot. We had some issue with plumbing, though, and the fridge has a noisy pump that causes an unpleasant reverberation throughout the kitchen.
The listing said that there was a stationary bike, but it was in a separate building that was locked and inaccessible."
2022-06-01,5,Stayed a few nights,"Cannot describe how special this place is! A true gem. The special attention given to light within the home is unreal. How the sunlight hits each room at particular times of the day gives such insight into how thoughtful this piece of architecture truly is. Thank you, Frank Lloyd Wright and thank you, Matthew!"
2022-06-01,4,Stayed with a pet,Great spot for architect buffs. There are original blueprints you can look at and a 20 page document written by the original owner about his relationship with FLW and the building process. Very cool spot. An ideal destination in the fall or winter.. we went while there was a heat wave and the AC struggled to work.
2022-06-01,5,Group trip,"The house is amazing and beautiful. It is a historic home and is purposely staged and maintained in a way that is authentic to the times of its design. There are books, photos, and documents about the history and designer which are fascinating. There are some quirks to this home because of its uniqueness, but it did not detract from our stay. It was an amazing place for us!"
2022-06-01,5,Stayed one night,"Matthew was really helpful and communicative. The house itself was simply amazing and it was an opportunity of a lifetime to spend a whole day exploring every part of the house, from original features to later upgrades. Oh, and all the other reviews are right - the kitchen has all you could ever ask for!"
2022-06-01,5,Stayed one night,"Highly recommended for FLW fans. And very grateful that Matthew shares it with everyone. Check-in was simple, communication was excellent, and the house exceeded our expectations. Matthew went above and beyond."
2022-05-01,4,Stayed with a pet,"This is a classic Frank Lloyd Wright home, and it should be experienced. Mattew has great communications, and the home was great for the 6 of us to enjoy."
2022-05-01,5,Stayed with a pet,"Woodside was such a fantastic place to stay. If you like FLW and have ever wanted to stay in one of his properties, this is a fantastic opportunity to do so. The neighborhood is quiet and serene. The house has a fantastic kitchen and fireplaces to get stuck in and enjoy yourself!"
2022-04-01,4,Stayed a few nights,A very unique home in a residential neighborhood with otherwise conventionally designed homes on generous treed lots. Nearby park has very nice public garden with fanciful sculptures and fountains.
2022-02-01,5,Stayed with a pet,One of a kind experience. Great house with lots of privacy when you want it with fantastic shared spaces when everyone is together.
2021-10-01,5,Stayed a few nights,Beautiful home and thoughtful touches to give people an opportunity to enjoy a FLW home.
2021-07-01,4,Group trip,What can you say about the thrill of staying in a home designed by Frank Lloyd Wright? There was a unique feature around every turn! Matthew’s furnishings compliment the space so well. This is an old home that needs to be treated with respect.
2021-06-01,5,Stayed with kids,This home was amazing. The spaces are so unique. We wish we got to spend more time in the home as it was a quick in and out trip. But definitely encourage anyone who is a fan of unique stays to book this home!
2021-04-01,5,Group trip,"Great opportunity to stay in a FLW creation. The owner added décor adds to the overall experience. The kitchen has everything needed to prepare a gourmet meal. We wanted for nothing in this gorgeous home. I live close and will definitely rent again, and will suggest it to everyone.
I brought my own plates, pots, bakeware and flatware because I did not know what to expect. There was plenty of the owners items to have left mine at home. There are stemless wineglasses available that pairs well with the huge wine cooler including room for your favorite bottles. Linens and towels are nice quality and plentiful.
The price tag might look high, but the experience was worth every penny. This is not just a place to rest your head; it is a place to enjoy."
2020-11-01,5,Group trip,"What an amazingly unique home! Staying in this original Wright home is something all of us will remember. The available articles and history of the home were great to read and gave a good perspective. There is plenty of space to spread out and/or entertain. The two distinct ""wings"" make it very accommodating for a multiple family gathering. We'll definitely consider coming back."
2020-08-01,4,Group trip,"Our group of 6 had a great weekend in Marion at the incredible Frank Lloyd Wright home. It was really neat to walk around the house when we first arrived and check out the creative and historical architecture and all of the nooks and crannies built into the place. The kitchen was off the charts and we never wanted for any plate, pot, cup, pan or utensil. The setting is spacious and great for conversation, games, and eating. It will be worth the trip and worth going back."
2024-04-01,5,Group trip,We brought the whole family out to Katie’s place for my daughter’s IWU graduation. It was a comfortable home base for all the graduation events. It was so nice to relax together in the living room and around the dining table for meals. My senior parents really appreciated the recliners as my mom has back problems. They were a welcome and appreciated surprise. The fenced backyard is large and quiet. We loved watching the squirrels. Plenty of parking space in the wide driveway and the code lock made it easy for the 6 of us to come and go without worrying about sharing a key.
2024-04-01,5,Group trip,Katie's home was very nice and very well kept. The description was accurate and fit exactly what we needed. Overall a great spot!
2024-03-01,5,Stayed a few nights,"My husband and I traveled to IN for a family wedding. The house was cozy, peaceful, and quiet. Close to stores and food as well. The house was clean. My only concerns would be the roof is now black, not blue like the picture(we passed it), and I would have loved if there were some throw blankets and access to a washer/dryer. However, the listing did say there as a laundromat close by but I missed that part. Overall, great stay. Thank you from NC!"
2024-02-01,5,Stayed with kids,Katie was an amazing host. Even became a hero through my stay when I unexpectedly locked myself out. She was attentive and friendly. The house was comfy and warm. Would definitely recommend.
2023-11-01,5,Stayed a few nights,"Katie's place was clean, comfortable, and cozy for our stay. It matched the description and had everything we needed."
2023-11-01,5,Stayed a few nights,"Katie’s place was so clean, well organized and she was always attentive and helpful! We tried to book it for our next trip and it had already been booked! Highly recommend!"
2023-09-01,5,Group trip,"Katie’s place was a beautiful, peaceful place with great decor. it made us feel right at home. Access to restaurants and shopping if that’s what you like to do or sit around fire pit andcrelax.
we had a great time and planning on booking for next year
thank you katie for the wonderful accommodations"
