date,rating,note,review_text
2024-06-01,3,Stayed a few nights,"Overall I would describe my stay as “okay”. The main factors that did not make my stay “great” were the screams of the hosts kids early in the AM (9am both morning of the stay), the chicken sounds also in the AM (as early as 6am), and the bed could be improved (low to the ground and slopes toward the middle).
Everything is as described in the listing and the stay is in a desirable location but would probably look for a different Airbnb on my next visit."
2024-06-01,5,Stayed a few nights,Very nice and quiet place just love it !!
2024-06-01,5,Stayed one night,A host that is very flexible and responsive. Terrific location and very comfortable stay!
2024-06-01,5,Stayed one night,Eva’s place was so lovely and felt like a cozy home away from home! Everything was pristinely clean and the decor was carefully selected for a welcoming environment. The location is right off the plaza and everything is within walking distance. Please come and enjoy this amazing getaway!!:) thanks again Eva for your generosity and hospitality!
2024-06-01,5,Stayed a few nights,"We had a great time here, it was in a perfect location took about 9 mins to get to wherever we were going. Everything was so clean and the bed was super comfortable. Perfect little spot for two people. Would stay again if we went back!"
2024-06-01,5,Stayed one night,Very close to cool shops and restaurants. Nice quiet neighborhood. Eva was very responsive to our needs.
2024-06-01,4,Stayed a few nights,It was cute! Location was great. I think it was fair for the price.
2024-06-01,5,Stayed one night,"Lovely place, just as described. Hostess was great to work with, very accomodating."
2024-05-01,5,Stayed one night,Perfect place for a quick solo trip. Thanks guys!
2024-04-01,5,Stayed a few nights,The cottage is very cozy and clean. Great location with restaurants within walking distance and a short drive to downtown. Quick response time from the host! I enjoyed my stay and would book this place again.
2024-04-01,5,Stayed one night,Loved this tiny little space & the area. Me and my husband had a great stay & would definitely return in the future!
2024-04-01,5,Stayed one night,"Very cute, clean, and convenient!"
2024-04-01,5,Stayed a few nights,A Lovely little spot just minutes away from the Plaza Arts district. Close to museums and all that good stuff in OKC. I highly recommend it!
2024-04-01,4,Stayed about a week,"Cute. Great location. Host was very nice and responsive to our concerns. The bed was comfy. It was cool to be able to see the neighbors’ chickens. They weren’t noisy at all. I’d say the listing was accurate, and we had a great time running around OKC. I’m happy we were so close to the Plaza area. It was our favorite by far."
2024-03-01,5,Stayed one night,"We really enjoyed our stay at Eva’s Airbnb- it was clean, cozy and private and had everything one would need. I only wish we could have stayed another night! Definitely recommended."
2024-03-01,5,Stayed about a week,"One of my favorite places I've stayed. This was exactly what I wanted - a cozy, clean and cute little place for my week in OKC. Right down the street from the Plaza and I didn't want to leave. Worth every penny and hope to stay here again."
2024-03-01,5,Stayed one night,"Eva's place was great - a very easy walk down to the Plaza for fun eats and drinks, and a perfectly cozy little getaway!"
2024-03-01,5,Stayed a few nights,Perfect for what we needed. It was nice having places to walk and eat. Felt private. Ubers around the city were pretty cheap. If I came back to OKC I would consider this listing!
2024-03-01,5,Stayed one night,"Great Hostess,"
2024-03-01,5,Stayed one night,Cozy cottage in a nice neighborhood.
2024-03-01,3,Stayed one night,"We didn’t have an issue finding the address or getting to the backyard, but if you had very large or heavy suitcases it could be difficult as there was no paved path and you had to walk around the hosts vehicles in the driveway. The place was cute and nicely decorated. Only tap water available, I wished there was a water filter pitcher in the fridge. There was no ice available. Everything looked and felt clean - however I had troubles falling asleep because the linens smelled so bad. It was like they were using a moldy washing machine. The towels were the same. They looked clean but just had a lingering musty and unpleasant odor. The worst part was the guinea fowl! I knew they had chickens…. But these other birds were SO LOUD and INCESSANT at all hours. Also, kids playing right outside made our adult *alone* time feel…awkward. The screen over the front door of the place was quite sheer and I didn’t feel like we had privacy in that room. The price was very reasonable, though."
2024-03-01,5,Stayed one night,The house was perfect for a one night stay. The location was super close to the concert venue we attended (Beer City Music Hall). Overall a good experience. Thank you for the hospitality.
2024-03-01,5,Stayed a few nights,"Absolutely loved staying at Eva’s! Perfect distance to walk to the Plaza, and exactly what we needed for the weekend. Hope to visit again!"
2024-03-01,5,Stayed a few nights,I really loved this place. It was small but it was cute. I would definitely come here again!
2024-01-01,5,Stayed a few nights,"very comfortable, and clean! We enjoyed our stay and would definitely book again!"
2024-01-01,5,Stayed a few nights,"This was such a cozy cottage in an ideal location so close to the Plaza District. Eva, the host, was helpful and friendly, I would love to stay here again!"
2024-01-01,4,Stayed a few nights,"Cute spot, def get the Scandi IKEA vibe here. Loved that the next door neighbor behind the unit had a chicken coup. Didn’t feel like you were in Oklahoma City 😃"
2023-12-01,5,Stayed one night,Nice private area! Very cozy
2023-12-01,5,Stayed one night,We had a very cozy stay and felt right at home. We hope to stay here again!
2023-12-01,5,Stayed a few nights,"Very nice quiet area, but there was a lot of things to do within driving/ walking distance. Eva was very clear with her directions so check in was a breeze."
2023-12-01,5,Stayed one night,Great stay
2023-12-01,5,Stayed one night,It's always a pleasure to stay and so close to town! Love staying here.
2023-12-01,5,Stayed one night,"It was me and my partner’s one year anniversary and we wanted a cozy getaway, this was perfect!"
2023-12-01,5,Stayed one night,Very nice and exactly as described. Easy entry and access. Beautiful part of town.
2023-12-01,5,Stayed one night,"Eva is so kind and welcoming, and the space was great! It was exactly like the description. The neighborhood is beautiful, quiet, and close to everything."
2023-12-01,5,Stayed one night,"This was a great place, great location and great hosts!"
2023-12-01,5,Stayed one night,Everything was great!
2023-12-01,3,Stayed one night,"Nice location- quiet and near restaurants. However, the hostess ignored multiple messages about our need for bath towels (never responded even though the messages were read). We were unable to take showers because of this and were in the middle of a road trip. The bed was also uncomfortable and caved in towards the middle. Additionally, the air/heating unit rumbled the room so I would recommend turning it off to sleep."
2023-11-01,5,Stayed a few nights,"Cozy, Felt like home! Eva was great! Perfect for our weekend in OKC!"
2023-11-01,5,Stayed one night,Great price! Cozy and cute accommodations. All was clean and nice.
2023-11-01,5,Stayed a few nights,"Eva's place is a short walk from the Plaza District, and a very cozy and comfortable stay. Highly recommend!"
2023-11-01,5,Stayed one night,What a great little hideaway! Definitely the breather I needed during my stay in Oklahoma! When I come back I will be sure to book again. Super cute neighborhood too!
2023-11-01,5,Stayed a few nights,"Eva's place was beautiful, cozy, and very thoughtful. Perfect natural light and efficient layout for a small space. Amenities were just what we needed. Super walkable to the Plaza district, and a ton of cute houses throughout the neighborhood!"
2023-11-01,5,Stayed a few nights,"We had a great stay at Eva’s place. It was clean, she gave very clear instructions, and provided helpful information. Would definitely stay again!"
2023-11-01,5,Stayed a few nights,This airbnb was a great stay for me. I was inbetween workstations and needed a place to stay for 2 nights and it right during Halloween. So the neighborhood was flooded with kiddos but it was nice.
2023-10-01,5,Stayed about a week,"Eva's place was a fantastic little private place tucked away in a nice neighborhood but not far from pretty much anything you would need. A grouping of restaurants was half a mile away and, like most things in OKC, anything else was just 15 minutes away. The place was clean and had everything I needed for the stay and Eva was super friendly and responsive. Great recommendations too. Highly recommended, would definitely stay here again!"
2023-10-01,4,Stayed one night,"Location is walking distance from the plaza district with plenty of things to do and places to eat.
The listing looks just like the photos and had everything we could need for a quick weekend stay."
2023-10-01,4,Stayed a few nights,"Good place to stay while visiting family in OKC. We didn’t have a car so walking to the Plaza is a huge bonus - shops, bars, restaurants. The space is the perfect size for two. It’s nothing glamorous, but just fine for us!"
2023-10-01,5,Stayed one night,Great stay!! We enjoyed our stay!
2023-10-01,5,Stayed one night,"Really enjoyed staying at Eva's place. It was a great, cozy space with everything we needed while traveling. Would definitely stay again if we're in the area."
2023-10-01,5,Stayed a few nights,Our stay was so nice and peaceful! The bed is to absolutely die for! Everything was as described and I would definitely stay again.
2023-09-01,5,Stayed about a week,Was the perfect host her and her husband gave me some good recommendations and was very friendly. Made my stay very pleasant.
2023-09-01,4,Stayed a few nights,Nice place. Great location. Useful amenities and items provided. Would stay again.
2023-09-01,4,Stayed one night,It was a good location and the bed was comfortable. It was a little hard to get belongings into the unit as the entry to the unit was the main tenants driveway so had to squeeze by cars.
2023-09-01,4,Stayed one night,"Older, but fixed up.
Clean"
2023-09-01,5,Stayed one night,I was only there for one night for a concert but Eva's place was quiet and clean and one of the few who has matcha in their home. I'm not a coffee drinker myself and when I saw there was matcha and even a kettle for me to make some I was over the moon with joy!! 10 out of 10 would stay here a again!
2023-09-01,5,Stayed one night,Beautiful place to stay!! Eva’s place had everything you could need! It was so cool to do many cool restaurants and shops. Perfect place to stay!
2023-09-01,5,Stayed with kids,Super cute place to stay. The neighborhood is awesome. Definitely recommend!
2023-09-01,4,Stayed one night,"My mother and I had a nice stay. It was quiet and private. The bed was comfortable and the place was clean. Thanks, Eva!"
2023-08-01,5,Stayed one night,"Really great place, very comfortable bed."
2023-08-01,5,Stayed one night,Wonderful spot! Walking distance to the plaza district - check out Mexican Radio for dinner! Would definitely stay again
2023-07-01,5,Stayed one night,"Enjoyed our one night stay at Eva's house. Nice neighborhood in close proximity to a variety of restaurants and shops. It was too hot for us to walk around and explore, but we would definitely return to the area at a cooler time of year and do just that. We were traveling home after a long camping trip and had a lot of gear in our car but felt secure leaving it parked on the street. Appreciated that Eva already had the air conditioning on so that the space was cool when we arrived. Appreciated the awesome coffee setup even more."
2023-07-01,5,Stayed one night,Great place to stay for a weekend trip!
2023-07-01,5,Stayed one night,We stayed at the plaza cottage for one night. It was perfect for a night getaway to celebrate my girlfriends birthday. We decided to stay in but there was so much to do around us. Very clean and would stay again.
2023-07-01,5,Stayed over a week,The space was just what was needed and great for the price.
2023-06-01,5,Stayed one night,Cute spot! The bed was very comfortable!
2023-06-01,5,Stayed one night,"In town to catch a concert and had the most charming stay at Eva’s place. Very cute, clean and quiet!"
2023-06-01,5,Stayed a few nights,"My husband and I had a great anniversary weekend at the cottage. We love exploring the Plaza District so the proximity was awesome. We went to a concert at Beer City Music Hall and it was a short drive just like the various local breweries. Eva and her family are so sweet and accommodating. We would recommend this place to any couple looking for a fun, romantic, weekend."
2023-06-01,5,Stayed a few nights,Great stay...everything as stated!
2023-06-01,5,Stayed one night,We absolutely loved this place in OKC! We were there just one night on a road trip and it had everything we needed. The space is perfect for a short or long stay and the neighborhood has such great restaurants and shops. Highly recommend!
2023-06-01,5,Stayed one night,"I was passing through and only stayed for one night but the cottage was so cozy and welcoming, I wish I was there longer. It is very walkable to restaurants and bars and in a quiet neighborhood where I felt very safe. 10/10 would absolutely recommend!"
2023-06-01,5,Stayed one night,"I had a lovely stay at the cottage--the bed was very comfortable, and the bathroom and kitchen were very well-stocked! It was a little bit of a challenge to locate at night time, but I managed."
2023-06-01,5,Stayed one night,"We had a nice overnight stay at Eva’s cottage while we were in OKC. It is in a quiet neighborhood, set back behind the main house. It is a short walking distance from restaurants at Midtown. It has all the amenities you need for a short stay. Thank you!"
2023-06-01,5,Stayed one night,Our stay in Eva’s cottage was great! We felt like home! Everything was like in the description. The neighborhood was really beatiful and safe. Eva and his husband have been really kind and give us useful suggestions! We would like to come back to OKC!
2023-06-01,5,Stayed one night,"Very cute, just like the pics. Only stayed for one night but it was exactly what I needed! Thanks Eva!!"
2023-06-01,5,Stayed a few nights,Our stay at Eva's was fantastic. The place was super cute and clean. I would definitely stay at it again. The neighborhood was peaceful and I felt very safe. As we walked down the walkway to the private stay the hosts were on the front porch hanging out and we were able to chat and get to know each other some. Super welcoming and friendly!!
2023-05-01,5,Stayed one night,Eva's place was so cute and lovely. We were passing through Oklahoma City and I highly recommend staying here!
2023-05-01,5,Stayed a few nights,"We really enjoyed this space! It was easy to get around to everything we needed in OKC and we enjoyed being close to some fun local restaurants and shops. Everything was neat, clean, and comfortable, and we appreciated thoughtful touches, like good coffee, oatmeal, and toiletries. The bed is a bit low, which didn’t bother us, but I wouldn’t recommend for everyone. There’s also a step up from the kitchenette to the bedroom, which, again, wasn’t an issue for us, but is something others may want to be aware of. Overall, we would definitely recommend and will try to book again next time we’re in OKC!"
2023-05-01,5,Stayed one night,"it was in a nice location, clean, and safe. Eva was helpful and communicative. I appreciated having matcha and milk in the fridge! it was a nice convenience"
2023-05-01,5,Stayed a few nights,This was a great location. We walked to restaurants and a short distance from many great neighborhoods. It was soo quiet. Very private and comfortable. We would definitely stay here again
2023-05-01,5,Stayed one night,Loved this spot! It was perfect for my wife and I. Really close to lots of things in OKC.
2023-05-01,4,Stayed one night,"The place is nice but very hard to find the location at night, I arrived at 9:30pm and hopefully one neighbor helped me to locate the house."
2023-05-01,5,Stayed one night,We enjoyed staying here. It was a quick walk to a strip of local restaurants and close to our other destinations in the city. Easy check in and clean.
2023-05-01,5,Stayed one night,Lovely spot! We had a show at The Tower Theatre and it was the perfect stay. Would definitely stay again.
2023-05-01,5,Stayed a few nights,It was perfect for my couple day say in OKC! I loved how close it was to the Plaza District restaurants and it was even close enough for us to scooter to downtown! The mattress was so comfortable that before I left I took a picture of tag on it because I want one in my house!
2023-05-01,5,Stayed one night,Eva's place was a wonderful choice for our night in OKC! She was so easy to communicate with. Highly recommend!
2023-05-01,5,Stayed a few nights,"I’d have to stay that this was one of the best experiences we’ve ever had with a host, and such a wonderful overall experience with our stay that I cannot recommend Eva’s place more.
She sent a message at the time of booking-weeks in advance, asking if we had questions and I asked for all of her recommendations.
She asked my interests and tailored a guide specifically to me. I made a brief mention about liking Matcha tea, and that was that.
Fast forward, we arrive with a breeze of a check in, took a look around and everything fit the space so well. You can tell Eva has attention to detail and despite the space being small, it was exactly what we needed.
She had a coffee corner where something caught my eye, a matcha setup to make my own, that I had forgotten I had told her about weeks prior. Turns out she got me everything to make it because she dug deeper and found out the place she mentioned stopped serving matcha and she didn’t want me to miss out.
The cherry on top of our trip"
2023-04-01,5,Stayed a few nights,"We enjoyed our stay very much. Eva was a terrific host and great communicator, and we would certainly stay here again."
2023-04-01,5,Stayed one night,"Sure, we could come again. Nice stay."
2023-04-01,5,Stayed one night,"It was a very cute and well decorated AirBNB! There were good amenities and everything you would need for a quick getaway. It probably wouldn't be big enough for more than 2 people. The space was a little small and a bit noisy with it being a converted shed behind a home, but aside from that it was quiet at night and very cozy. It was also close to a good area of OKC in a nice neighborhood. Thanks for the great stay and hospitality."
2023-04-01,5,Stayed one night,Lovely little cottage :)
2023-04-01,5,Stayed one night,this place had everything we needed for our quick stay! the bed was very comfortable and the place was very clean. we definitely recommend.
2023-04-01,5,Stayed one night,Quaint and charming guest cottage walking distance to neighborhood food and drink! Comfortable and peaceful space with friendly and accommodating hosts.
2023-04-01,5,Stayed a few nights,"Eva’s place was a nice and secluded getaway in OKC! It was just a 10 minute commute downtown, and had a beautiful quaint kitchenette and bedroom! She also provided me with a variety of different recommendations for food and coffee shops, as well as places open late for a bite to eat since I was getting in very late. I was able to explore OKC and find just what I needed when I was in town!"
2023-04-01,4,Stayed a few nights,"Responsive host. Is behind their house and in between some yards with kids in the houses playing outside. So not super private, but lovely place."
2023-04-01,4,Stayed one night,"We booked this place at 3 pm the same day we arrived— very last minute. We were thankful to find a place available that felt safe and was convenient. It was clean and tidy. The bed was plenty comfortable, which was a plus. The street is tight but in a quiet neighborhood. We would definitely stay here again."
2023-04-01,5,Stayed one night,"Great Cottage! Very private and clean.
She also left some dairy free milk and oat meal which was amazing. I highly recommend this cozy place for someone who is coming to Oklahoma. Thank you Eva!"
2023-04-01,5,Stayed one night,Eva’s place was perfect. We explored Bricktown and the canal on our cross country road trip and it was the perfect place to sleep and shower. The neighborhood was safe with very unique houses. Highly recommended!
2023-04-01,4,Stayed a few nights,"Cozy is the perfect description! Eva's place is a cute, stand-alone cottage in the back of their driveway. Clean with very comfortable bed, it is perfect for 1 or 2 people to stay when in Oklahoma City. It's extremely close to the Plaza strip via 3-5 minute walk. Great local restaurants and bars. Perfect free on-street parking and easy driving or Uber/Lyft access to other parts of the city for exploring. Cottage included anything you may need for your stay as it relates to toiletries (bonus for including some items that other places don't provide!) and in-kitchen essentials. Was pleasantly surprised to have option to create own french press coffee in the morning. Recommend for your next stay in OKC :)"
2023-03-01,5,Stayed one night,It was great! The check in was simple and the place was well stocked. Would def return when in OKC!
2023-03-01,3,Stayed one night,"I wouldn't go out of my way to find it again. It is suitable for one or maybe two ppl for a few nights.
Bed is comfy.
Neighborhood seemed safe. There was a sheriff's SUV parked across the street overnight, guess he lives nearby.
The unit does not feel private or quiet. You are obviously staying in someone's mother-in-law cottage just a few feet away.
Shower is *tiny*.
One small car will park in the middle of the driveway and make it weird to walk back and forth.
Milk in the fridge was unopened but weeks expired, glad I didn't drink it 🤢"
2023-03-01,5,Stayed a few nights,my stay was very comfortable in this cozy cottage. it had everything I needed and was quiet and private. The decor was simple and elegant and the cottage was clean and tidy. I will definitely stay here again when the need arises.
2023-03-01,5,Stayed one night,"Wonderful family!! I asked about healthy places to eat and because it was a Sunday, Eva was concerned about my finding a good place due to limited places opened on Sunday. She invited me to dinner. The meal was healthy. delicious , and simple. She cooked a chicken from their stock and veggies and we had wonderful ,stimulating conversation with 3 beautiful children present.
Thank you Eva, Truman, Viliam, Winter, and Smillen( forgive spelling mistakes) for opening your home to me. Many blessings to you."
2023-03-01,5,Stayed one night,Awesome host and an awesome cottage! Thanks Eva!
2023-03-01,5,Stayed one night,Eva’s house was super cute and clean! It’s the perfect size for a couples weekend. It’s also located near a bunch of different restaurants and things to do.
2023-03-01,5,Stayed a few nights,We enjoyed our stay here! Location was easy to access and in walking distance to the Plaza district. The bed was very comfortable! Perfect cottage for a little getaway trip.
2023-03-01,5,Stayed a few nights,"parking can be a little confusing as there is not much room on the street to park without fear of your vehicle being hit. Otherwise, it is a great place to stay, it was a great and very homy place."
2023-03-01,5,Stayed a few nights,Nice cozy little place with hot water and good heat! Just right for our needs!
2023-03-01,5,Stayed one night,"Eva has a great place! It's easy to find and has plenty of street parking. Clean, cute, and comfortable. It's also easy walking distance to the Plaza district which is a massive bonus!"
2023-03-01,5,Stayed one night,"Fantastic, cozy cottage with easy access to great food and entertainment. Quiet and beautiful neighborhood and still very secluded"
2023-03-01,5,Stayed a few nights,As described. Has everything you need for your stay. Small ish drive way that is sometimes hard to get through without having to step in the grass/under small tree branches. Worth the price!
2023-03-01,5,Stayed one night,The Airbnb was so cute! We really enjoyed our stay.
2023-02-01,5,Stayed one night,"The place was clean, quiet, and so close to everything.m in the city. We will definitely stay again!"
2023-02-01,5,Stayed one night,"An adorable and well-appointed cottage! Would definitely stay again. Great area, LOTS of shops but also private and peaceful. Extremely comfortable bed and lots more amenities than some larger places I've stayed, quite impressive! I was nervous about the shower (as a fat) but it was great w/ everything you could need on a trip!"
2023-02-01,5,Stayed a few nights,"Eva’s place is exactly as described. It offers a bit more than a standard hotel room and gives you an idea of what it’s like to live like a local, tucked into a quaint neighborhood away from the bustle of downtown. We did take advantage of the ease of street parking, leaving our car by the cottage and walked a couple of miles to check out local sites, restaurants and breweries. As others have mentioned the shower is a bit tight, but the remaining bedroom and kitchen space makes up for it."
2023-02-01,5,Stayed one night,"My husband and I stayed here for a night while in OKC, and it was great! The shower is small, though, so just keep that in mind! But still a very nice place!"
