date,rating,note,review_text
2022-09-01,5,Stayed one night,This was such a great little find. I really enjoyed staying here. The studio apartment in the back of Eric’s house is really nice. You have all the space to yourself separate from the house. This is by far the best stay l I’ve experienced.
2022-09-01,5,Stayed one night,"I stopped by for a night at Erik and Blake's listening.. They have done a remarkable renovation at their place.. really modern and has the ful package even a washer (comes handy when you've been on the road for a while).. great host.
Highly recommended."
2022-09-01,5,Stayed a few nights,I travel to OKC often for work & this place has been my favorite by far!! So homey & cozy. I thoroughly enjoyed resting after work here. Will definitely be returning!
2022-08-01,5,Stayed one night,Eric & Blake went above and beyond for us. They even let us park our jeep in their personal driveway since we had so much of our personal belongings for our road trip. Their spot was so cute & extremely well maintained. They’re great hosts!
2022-08-01,5,Stayed one night,"Super cute & comfy. Great location, close to Paseo District & Midtown!"
2022-08-01,5,Stayed one night,"Beautiful place, communicative hosts, great location!"
2022-08-01,5,Stayed one night,"A fantastic spot! Beautiful interior, both sleek and comforting at the same time—Eric and Blake are amazing hosts!! Would reccomend!"
2022-08-01,5,Stayed one night,Great hosts and great little place to stay! Love it!
2022-08-01,5,Stayed a few nights,"wonderful environment and close enough to walk to some places, and even when we had to drive it was normally 10 minutes or less!"
2022-08-01,5,Stayed a few nights,Great place! I will stay here every time I visit the city!
2022-08-01,5,Stayed one night,Wonderful little space. Had everything you could need. Hosts were very easy to communicate with and check in/out was simple. Would highly recommend!
2022-08-01,5,Stayed one night,"This is our new go-to airbnb for Oklahoma City! Eric and Blake’s place was beautiful, clean, with thoughtful touches. We loved the location of the airbnb, and it was just the right size for two. We will be back!"
2022-08-01,5,Stayed a few nights,Great place. Very clean. Very safe. Great price too. Would definitely stay there again.
2022-08-01,5,Stayed one night,Such a cozy and comforting place! Exceeded our expectations and will definitely stay again and recommend to others traveling to the area!
2022-08-01,5,Stayed a few nights,"Hands down the best Airbnb I’ve stayed in, especially for the price! And Eric and Blake were awesome hosts!"
2022-07-01,5,Stayed a few nights,Great communication. Lovely little spot. Definitely will be back.
2024-06-01,5,Stayed a few nights,"If you’re coming to OKC stay here! The place was beautiful and the neighborhood had so much to do!! 110% would recommend this place. Stephanie was extremely proactive…with a possible bad storm moving in, she provided me all the details and information I needed to safe!"
2024-06-01,5,Stayed one night,This place was perfect! It had everything we needed! Beautiful little place!! The host Stephanie was the best host!!
2024-06-01,5,Stayed one night,"What a GEM! So beautiful and peaceful. Just what we needed on our way to visit our son. Loved walking through the amazing community and riding the nearby Ferris wheel, which we recommend riding in the evening. Had a relaxing evening watching a movie before getting some needed rest.
Stephanie was so communicative and provided many local recommendations."
2024-06-01,5,Stayed one night,"This guesthouse is immaculate and beautiful in an excellent neighborhood and within walking distance of restaurant, coffee shop, and brewery. One of the best quality AirBnB's that I have stayed in."
2024-06-01,5,Stayed a few nights,"The space was perfect for a weekend getaway. Everything was clean and comfortable. The location was perfect, close to everything but still quiet and peaceful. The apartment itself was gorgeous! We will definitely stay here again if we are back in town."
2024-06-01,5,Stayed with kids,We loved staying at The Scissortail! The house was VERY clean and comfortable! We will definitely try to stay here again. We were able to go to the Ferris wheel and walk around the park and that was a unique experience. Stephanie was proactive and answered questions before we even had them!
2024-06-01,5,Stayed a few nights,"Stephanie gave me the best experience I have ever had when booking and staying at an AirBNB! It was such a great place to stay, and we very much enjoyed our stay here! The space was very clean and was exactly as described in the listing! The instructions to get there and to enter was very clear, which made check-in super easy! She was also super friendly and very responsive. Would definitely book to stay here again when we're in town for another OKC Thunder game!"
2024-06-01,5,Stayed one night,Place is absolutely beautiful! It looked even better in person than the photos! Host is extremely friendly and went above and beyond to make sure the stay went great. She Called us to make sure everything with the check in went well and to wish us a good time. The view of the city from the window was amazing! Would def stay again if ever in the area.
2024-06-01,5,Stayed one night,"This was a perfect place to stay for a short business trip, but also would be a great place to spend more time, which I hope to in the future. The loft is inviting with elegant decor. The location in a new walkable neighborhood with places to eat and drink and shop is excellent."
2024-06-01,5,Stayed one night,Great host and location. Very well kept and extremely clean. Easy to access highways and centrally located.
2024-06-01,5,Stayed one night,"This place is a must-stay! It was spotless and modern with a beautiful kitchen. Super cute area, Wheeler District and the drive into the city area was like 10 minutes. Stephanie was super communicative and very helpful - we loved the recommendations of food and nightlife around. Thanks for being such a great stopover on our road trip - even if it was just for a night!"
2024-04-01,5,Stayed a few nights,"We stayed here for the Oklahoma Memorial marathon, and this place was the perfect spot for us! Great location and amazing people!! Love their hospitality! Definitely coming back in the future 😊"
2024-04-01,5,Stayed a few nights,Wonderful place to stay at for a much needed weekend getaway.
2024-04-01,5,Stayed a few nights,"Wonderful location, close to downtown attractions, amazing hosts, super clean, many thoughtful touches, would recommend to anyone"
2024-04-01,5,Stayed a few nights,"We enjoyed the location, and its proximity to downtown activities is fantastic. The unit is exactly as described and more. You couldn’t find a more helpful and responsive hostess. Don’t hesitate to book this if it is available during the time you need it! My husband and I will return."
2024-04-01,5,Stayed a few nights,Terrific host and wonderful guesthouse in a friendly & walkable neighborhood. Could not have asked for more!
2024-04-01,5,Stayed one night,Stephanie was wonderful! The space was absolutely stunning. Clean and peaceful aesthetic and idyllic location. Wish we could have stayed longer and would love to come back!
2024-04-01,5,Stayed a few nights,"very clean and relaxing space. The neighborhood is nice, quiet and has great amenities within walking distance. close to Bricktown and is just overall a good distance to reach central/ and downtown OKC. The Host is very accommodating and eager to make your stay a good one. would book again!"
2024-04-01,5,Stayed one night,"This Airbnb was a top favorite for us. The place is so cute, and the area was wonderful! It was the perfect stay for us coming in for a concert."
2024-04-01,5,Stayed a few nights,"The space was exactly as pictured and absolutely beautiful. Lots and lots of thought and attention to detail! The space is in a newly developing area and there are still places to eat and have coffee, etc…also, very close to highway entrances to get to other areas."
2024-04-01,5,Stayed one night,Great location and beautiful home!
2024-04-01,5,Stayed a few nights,Stephanie was an amazing host & everything about her place was just perfect!
2024-04-01,5,Stayed a few nights,I enjoyed my visit and being Stephanie’s guest. Home was just as described in a nice and peaceful neighborhood. I visited several museums which were very close in proximity and I tried out Scrambl’d which was good and nearby too. I’ll definitely book again when near OKC!
2024-03-01,5,Stayed one night,"An amazing place!! Great attention to detail, the place is gorgeous and we felt right at home."
2024-03-01,5,Stayed one night,"Absolutely loved, great location, easy in and out. Wonderful little cozy space. Super clean and detailed decorated. Would definitely recommend to anyone. We will be back!! One of the best place we have stayed!!"
2024-03-01,5,Stayed a few nights,"Fabulous new development in OKC. The space was modern, aesthetic, cozy and resourceful. A great spot for my visit to Oklahoma."
2024-03-01,5,Stayed a few nights,We really enjoyed our stay at Stephanie’s place!! Very clean and easy to find and peaceful surroundings! Would definitely stay here again!!
2024-03-01,5,Stayed one night,Great place to stay at! Stephanie was a wonderful host and checked on us. Be sure to book this place! You will be glad you did.
2024-03-01,5,Stayed one night,Definitely the best host & place we have stayed at. Everything was so clean & very nice decorated. Will definitely stay here again if we come back to the area!
2024-03-01,5,Stayed one night,"The cutest little place to stay, it was perfect for me and my husband on our one night get away. It was the perfect space for us, so clean and had everything we needed!!"
2024-03-01,5,Stayed a few nights,"Wonderful place to stay! If you are coming to OKC and have not visited the Wheeler District, this is a must stay. Clean, comfortable, and great host! Can’t wait to come back."
2024-03-01,5,Stayed one night,"Beautiful home in a great location! The space was so artfully designed and decorated. Host was very kind and responsive. Close to downtown, would recommend!"
2024-03-01,5,Stayed a few nights,We loved staying at Stephanie’s bnb! We felt right at home and enjoyed our weekend very much!
2024-03-01,5,Stayed a few nights,"Per usual, an amazing stay! I love staying here and get so excited when it’s available during my work weeks! Great amenities, awesome location, safe neighborhood, and Stephanie’s wonderful communication. Until next time!"
2024-03-01,5,Stayed one night,"Had a great stay, so clean plus nice and Stephanie was a great communicator"
2024-03-01,5,Stayed one night,Beautiful place
2024-03-01,5,Stayed a few nights,Beautiful place in a fun area. Stephanie was responsive and so helpful - definitely want to stay again.
2024-02-01,5,Stayed one night,We loved our stay and look forward to staying here again in the future! Stephanie has thought of everything to make this place feel like home!
2024-02-01,5,Stayed one night,"Amazing location, thoughtful and friendly host, will definitely be back!"
2024-02-01,5,Stayed one night,Such a cute place! Close to downtown and other things to do. Host was very friendly and made us feel right at home. Would definitely stay here again
2024-02-01,5,Stayed one night,"Adorably curated spot, full of color, open concept and cozy! This bnb was super clean, organized and had everything we needed. Stays super cool inside which we loved and nice comfy bed. Then neighborhood is beautiful and unique, like a little community with a great taco place and brewery to walk to and get drinks. Host was always friendly, kind and communicative! Highly recommended this spot and the area."
2024-02-01,5,Stayed a few nights,Very clean peaceful place to stay!!!
2024-02-01,5,Stayed one night,"All I have to say is if you are in Ok City, do not pass up Stephanie’s place. It is absolutely stunning inside (and outside of course). It has everything you need and more. It was nice to see decaf with the coffee pods. That was a first. She always had cups of oatmeal for breakfast. Stephanie is is very fast at her replies. We were taking our time site seeing RT 66 so we got in around 9:30, but I messaged her an told her we were there. Next time we go through there, we are going to stay longer. It was the first time during our 2 week trip that I actually slept all night. I wish I could give more than 5 ⭐️"
2024-02-01,5,Stayed a few nights,loved our stay here! super quiet and clean neighborhood!
2024-02-01,5,Stayed one night,Extremely nice guesthouse close to an amazing brewery
2024-02-01,5,Stayed a few nights,"This place is so adorable! Huge spacious bathroom with natural light was a huge perk. Had a nicely appointed kitchen that ALMOST made me want to cook on vacation.
The neighborhood is cute and quiet and also like 10 minutes from basically everything I wanted to do."
2024-02-01,5,Stayed with kids,"We couldn't have chosen a better place to stay at in OKC! This guest house is small, but super nice and just all around perfect for a couple or small family like ours(1 child). We loved how clean and welcoming the place felt as soon as we stepped up into the unit. Not only is the guest house super nice, but the Wheeler District, in which it lies, is really beautiful also. The best part though is its location! It's super close to all and any downtown activities, restaurants, or sights you may want to visit. Most stuff in downtown, including bricktown, is about a 10-15min drive up the road. Super convenient in every way.
We truly did enjoy our stay, even though it was just for two nights. Stephanie and Chris are amazing hosts. Great communication and they make you feel welcome and right at home. Don't pass this AirBnB up. Highly Recommend a stay here!"
2024-02-01,5,Stayed one night,It’s was fantastic!
2024-02-01,5,Stayed one night,"Highly recommend staying here!!! We really enjoyed our time in this neighborhood and at the Airbnb! The Airbnb smelled amazing, was really clean, and the bed & couch were so comfy! Stephanie, Chris and their kids are friendly and welcoming! The neighborhood is very new but feels very welcoming! Also Taco Nation has the best tacos ever!! All in all, great stay- and we hope to back some day!!"
2024-02-01,5,Stayed one night,"Stephanie's place was such a delight to stay in. The area was both clean and looked just like the images. Stephanie was a communicative host. She was very responsive, even late at night/early in the morning. I recommend staying here if you are wanting a relaxing stay."
2024-01-01,5,Stayed one night,"Absolutely beautiful Airbnb! Extremely clean and smelled soooo fresh. We felt very comfortable, and the hostess was so kind and hospitable! She provided more than what was even needed, and was very attentive. It was the perfect place for us to stay 🤍"
2024-01-01,5,Stayed a few nights,"If you were going to be in Oklahoma City for any reason, I highly suggest booking this Airbnb. It’s located in a peaceful, enchanting neighborhood with a brewery, coffee shop, taco restaurant, and several parks within walking distance. The space itself is beautifully decorated, clean, and comfortable. They have added very thoughtful touches, such as a fully stocked coffee/tea drawer, a locals guidebook to Oklahoma City, and a cute, easy to identify entrance marker. Felt like a home away from home! The host is very accommodating, communicates well, and is super responsive.
Stephanie and her husband created such a fantastic space. I can’t wait to visit again. Thank you so much !!"
2024-01-01,5,Stayed one night,"Loved Scissortail! Very comfortable couch with the TV set up to watch multiple streaming services. Well-appointed kitchen with everything easy to find. I was able to park right by the entrance and could see my vehicle from the living room.
If you stay in Wheeler you must check out the businesses nearby. More coming each week, The Big Friendly is a great brewery. A huge bonus of staying at the property is the proximity of the businesses.
Stephanie was very quick with communication and answering my questions through the app! Super friendly, she could not have been a better host. Everything was easy to use, they've got one of the better welcome books I've seen. Scissortail is a great spot, I'm definitely coming back!"
2024-01-01,5,Stayed one night,"This was a beautiful, cute cottage neighborhood, and this rental was the perfect stay for our one night in OKC. We had everything we needed, and communication was impeccable. We had a blast, and you will too!"
2024-01-01,5,Stayed a few nights,Repeat customer because this place is so great! 10/10 every time! Will be back!
2024-01-01,5,Stayed one night,"Don’t have a single negative thing to say about this place. Great host and great price. The location is beautiful and easy to feel right at home. Even with the temperature falling down to 5, couldn’t think of a better place to cozy up. Will definitely be back here when I come back to OKC."
2024-01-01,5,Stayed one night,"Great location, beautiful design, and everything has been thought of! The coffee/tea drawer is epic and all AirBnB hosts need to take notes!!! 10/10 will recommend to ALL of my out of town guests and colleagues!"
2024-01-01,5,Stayed a few nights,"I have stayed in many Air Bnb’s, but I have never been as impressed as I was with Stephanie and Chris’ place! Not only did they have clear instructions, but I was checked on multiple times throughout my stay. The apartment was immaculate and so aesthetically pleasing. Will definitely be back!"
2024-01-01,5,Stayed a few nights,"We had the best visit at The Scissortail OKC! Stephanie is an INCREDIBLE host. The space is absolutely gorgeous, peaceful, & clean! The space is fully stocked with anything & everything you will need. So thoughtful & intentional to provide guests with the best experience & stay. The checkin/checkout instructions were clear and to the point. Stephanie also was very responsive, interactive and friendly! She gave us great local recommendations and offered to be any help that she could be. We will definitely be back to stay anytime we are in the area!"
2024-01-01,5,Stayed a few nights,"This place deserves more than 5 stars! I thoroughly enjoyed my stay! Stephanie was the best and most responsive host ever and made me feel right at home. The home is full of top notch amenities, cozy touches, and is located in a great area. Can’t wait to stay again!"
2024-01-01,5,Stayed one night,"HIGHLY RECOMMEND
Stephanie was my favorite host to ever have on Airbnb. She was incredibly involved and helpful. My favorite stays are always on the property someone is currently living in because there are around for any help or needs. Stephanie’s home was BEAUTIFUL and had every travel necessity you could think of (EVEN SHOWER CAPS!) I will most definitely be staying here again in the future."
2023-12-01,5,Stayed one night,Absolutely did not expect how amazing this place was. The community was beautiful and peaceful and the views were amazing! The host was top tier and I will plan our trips to availability on this airbnb. I could not have been more satisfied and the host went above and beyond to make us feel welcome! Thank you so much for your hospitality!
2023-12-01,5,Stayed one night,Homey vibe and peaceful community. Highly recommend
2024-06-01,5,Stayed one night,"Very accommodating and responsive, would return anytime I'm in OKC!"
2024-06-01,5,Stayed one night,Responsive host and a unique spot in a convenient location. Enjoyed the stay
2024-06-01,5,Stayed one night,Everything was great!
2024-06-01,5,Stayed a few nights,"We had an absolutely wonderful stay at this Airbnb! The place was exactly as described, offering all the comforts of home. The deck was a standout feature, providing a perfect spot for morning coffee and evening relaxation. The location was fantastic, with great restaurants and cozy coffee shops just a short walk away. There was plenty of space for two couples and the hosts have done a great job with decorating.
I highly recommend this place for anyone looking for a comfortable and convenient stay. Will definitely book again!"
2024-06-01,5,Stayed one night,"While our expectations were not completely met with respect to the value for the condition of the home, our host was accommodating in meeting our expectations with customer service to help offset our disappointment.
We certainly appreciate the gesture of breakfast offering or 15% off of our next stay!
We most likely will not stay again for $230/night for the amount of issues in cleanliness and disrepair that took down the value of the advertisement.
We were also on alert with DB monitors in the home, the overall comfort level of the home, dirty walls and baseboards, loose flooring, broken bed frame, and the very strong odor of Marijuana for the majority of our stay."
2024-06-01,5,Stayed one night,Great stay! Great place!
2024-06-01,5,Stayed one night,"Very cute condo, lots of light and openness. Cool floor plan, easy street parking, would return 👍🏻"
2024-06-01,5,Stayed one night,Super friendly hosts. Great unit with great views of downtown OKC.
2024-06-01,5,Stayed with a pet,We had a great time!!!
2024-06-01,5,Stayed one night,Couldn’t ask for better!
2024-06-01,5,Stayed one night,Thanks everything Was Great I’ll definitely be Back if in town!
2024-06-01,5,Stayed one night,awesome spot.
2024-05-01,5,Stayed a few nights,"This place was great for my quick work trip. Views of OKC skyline were incredible and the place was put together very well. Cody was great and always quick to respond/ help with anything. When I come back to OKC again, I’ll be staying here again!"
2024-04-01,5,Stayed a few nights,Cody responded quickly. Location is great. Fun weekend! Thank you!
2024-04-01,5,Stayed a few nights,"We picked Skyline Views because the roof top deck and the windows were so inviting but the location turned out to be even better. We walked to several coffee shops, restaurants, bars, and a great book store. It was the perfect hub for our first trip to OKC. Everything was spot on and easy. Couldn’t ask for more."
2024-04-01,5,Stayed one night,Everything was perfect great place. Great location would definitely stay again.
2024-04-01,5,Stayed with a pet,This is an awesome property! The host are very responsive and you will feel welcomed as soon as you arrive.
2024-04-01,5,Stayed one night,Had an amazing time great view of downtown
2024-04-01,5,Stayed one night,Very clean and nice place to stay! I definitely recommend
2024-04-01,5,Stayed one night,Cody place was amazing. Nice view. Clean and comfy. Will be back.
2024-04-01,5,Stayed one night,The best place ever.
2024-04-01,5,Stayed one night,Cody was great to work with! The place was very nice and as described!
2024-04-01,5,Stayed one night,was a extremely nice place for me and my girlfriend and brother and his wife very comfy hosts were very friendly and responsive
2024-04-01,5,Stayed a few nights,"Cody’s place was exactly as advertised and
more. t
There’s great little bars and restaurants right down the street. Just a great little place"
2024-04-01,5,Stayed one night,It was so beautiful. Words cannot explain how much fun me and my friends had. Everything was clean and very comfortable. The host was so responsive and always willing to help with no hesitation. Which we didn’t need really any help because they had everything laid out with beautiful instructions. Definitely will be visiting that home again!!
2024-04-01,5,Stayed one night,Place was amazing.
2024-04-01,5,Stayed one night,Our stay was short and sweet but the house was everything as listed and more! Parking was easy and checking in and out was a breeze! We will definitely be staying here again!
2024-03-01,5,Stayed one night,I only rented one night so cleaning fee was little high but it was nice
2024-03-01,4,Stayed a few nights,It was a beautiful and unique condo! The location was close to downtown and within a short drive from Bricktown.
2024-03-01,5,Stayed one night,"Had a great time! Such a nice condo, we had a great experience. Would recommend! Will return!"
2024-03-01,5,Stayed with kids,"I hadn't known much about OKC prior to coming but wow did this place leave a great impression. The location itself was gorgeous with a beautiful view of the skyline. Not only was the home great but I learned alot about the city and will definitely be going back, hopefully to this specific place."
2024-03-01,5,Stayed a few nights,Amazing location and super cute spot!! I felt right at home. We loved the balconies and space.
2024-03-01,5,Stayed one night,"Modern, clean, easy to locate, and great hosts! And perhaps best of all - a rooftop patio with great views of downtown."
2024-03-01,5,Stayed one night,super cool place to stay!
2024-03-01,5,Stayed one night,Easy to find and the space was super clean. Comfortable bedding and linens. Accommodating hosts for last minute booking. Couldn’t have been a better place! Thanks so much!
2024-03-01,5,Stayed one night,Nice place. Great view from the patio
2024-03-01,5,Stayed with a pet,Cody was the perfect host! Easy going and extremely responsive
2024-03-01,5,Stayed one night,Another Amazing stay in Midtown at this great location. Close to everything.
2024-03-01,5,Stayed a few nights,This was a great place to stay! Lots of places to go within walking distance. The beds had some of the softest sheets I’ve ever felt!
