date,rating,note,review_text
2024-06-01,5.0,Stayed one night,Great stay. clean location.
2024-06-01,5.0,Stayed one night,"Branden’s home was perfect for a quick night stay traveling through. We booked it last minute. We were able to pull our vehicle into the large garage which was nice, since we arrived after dark. Decor is nice and modern. Beds were comfortable. Home was super clean, which is most important to me! Thanks for a great stay!"
2024-06-01,5.0,Group trip,Great location and great stay during our time back for graduation!
2024-06-01,5.0,Stayed a few nights,Great visit to Peoria for graduation and great stay. Neighbors (behind) were so so friendly! Garage space was helpful. Beds were comfy and space was perfect for family of 4. Backyard was a bonus!
2024-04-01,5.0,Stayed a few nights,Branden and his team are super responsive and the home was very clean and comfortable!
2024-04-01,5.0,Stayed a few nights,Great location! Very easy to find. Very clean.
2024-04-01,5.0,Group trip,"Super property - convenient to Bradley, downtown and the hospital complex. Would absolutely stay again."
2024-04-01,5.0,Group trip,"Great place to stay. Convenient, clean and tidy. Would highly recommend"
2024-04-01,5.0,Group trip,"Absolutely beautiful home!
Would love to stay here again."
2024-04-01,5.0,Stayed a few nights,Charming home. Very comfortable and has all the amenities we needed for our stay. Would definitely stay here again when in Peoria.
2024-04-01,5.0,Stayed a few nights,This home was recently renovated and absolutely lovely. And it has a fantastic yard for my collies to romp around.
2024-03-01,5.0,Group trip,"This house is so clean, spacious and comfortable. Would definitely come back again!"
2024-03-01,5.0,Stayed a few nights,This is a super cute place that is very spacious. The layout is really nice because there are a bunch of different sections to the home with different vibes. So you can chill in any one of the spaces and it feels like a different house! Would definitely recommend to others.
2024-03-01,5.0,Stayed a few nights,Fantastic home. Eclectic and Ecenentric.
2024-03-01,5.0,Stayed with kids,"Branden's house was just as described and perfect for our long weekend in Peoria! It was clean, newly renovated, spacious, and well-appointed. We were very pleased with the amenities and the location was very convenient to Bradley University which was our destination every day. It's also just across the street from the hospital complex and a short drive to downtown Peoria so it's a great location for the area. The garage and dedicated parking were also appreciated.
Branden was quick with response to questions and provided a great amount of proactive details. We'd choose it again!"
2024-03-01,5.0,Stayed with kids,I loved it very clean very beautiful house was a great host overall
2024-03-01,5.0,Stayed over a week,"I never got to meet Brandon but then it wasn´t necessary. The house was in perfect condition when we arrived and we never had any problems in the over 2 weeks that we were there. On the few occasions that I had a question about something, he answered immediately. Very responsive. I highly recommend this place. I do have one complaint however. We live in Costa Rica and the temperature was 13 degrees when we arrived. But I guess that´s outside Brandon´s control. The house was warm though. :-)"
2024-02-01,5.0,Stayed a few nights,The place was extremely clean and nice! Branden was a fantastic host and made things very easy. House was so well stocked and great location. Thank you again!
2024-02-01,5.0,Stayed one night,Beautiful home great host!
2024-02-01,5.0,Group trip,Fantastic house. Modern with vintage touches. Comfortable and cozy. Great space for 6 people. Garage for parking. Super close to downtown Peoria. Will definitely stay again when needed.
2024-01-01,5.0,Stayed one night,"Was an extremely beautiful home. Very clean, everything was easy to figure out & the instructions were very clear!"
2024-01-01,5.0,Stayed a few nights,Extremely clean and comfortable space with a wonderful layout. The host was communicatcble and easy to contact.
2024-01-01,5.0,Stayed with kids,We absolutely loved our stay. The house was better than the pictures. Our power went out and Branden was there within 15 minutes to hook up the generator to make sure we had heat. He went above and beyond and stayed 3+ hours (outside) until the power came back on. We extended an extra night and just felt comfortable and at home. Would definitely stay again.
2024-01-01,5.0,Stayed a few nights,"Another great stay one of Brandon’s properties. Overall everything was clean, safe and comfortable. Amazing host, responsive and always proactive. When planning a trip here I always check his homes first. You won’t be disappointed staying at any of his properties."
2024-01-01,5.0,Stayed a few nights,This is just the cutest home in a convenient location! Everything is modern and clean yet super cozy - even the linens smelled amazing! Highly recommend if you’re looking for a comfortable location which is easy to find and close to everything downtown!
2024-01-01,5.0,Stayed one night,Really nice home! a+
2024-01-01,5.0,Group trip,"LOVED the space!!! Super cute, clean, cozy, and such a great stay! Would definitely come back again sometime soon next time me and my friends need a little getaway! Very nice and responsive host. 10/10 in all areas! 👍🏼"
2023-12-01,5.0,Stayed one night,be me
2023-12-01,5.0,Stayed a few nights,"We were very happy with our stay. The house was very clean and beautifully decorated. There really was no amenity lacking. We had everything that we could need. The house was plenty spacious for our family, and we would definitely stay here again."
2023-12-01,5.0,Stayed a few nights,Very homey spot. Don’t hesitate to rent.
2023-12-01,5.0,Stayed one night,"Very accurate and extremely comfortable!
Would definitely stay here again when in the area!"
2023-12-01,5.0,Stayed a few nights,Beautiful and clean place. we really enjoyed our stay.
2023-12-01,5.0,Stayed a few nights,Very clean and well kept home. Felt very comfortable during the entire stay. Host made sure everything was clean and prepared before we arrived.
2023-12-01,5.0,Stayed one night,clean and comfortable house would recommend
2023-12-01,5.0,Stayed a few nights,"We loved everything about the house! Super clean, great floor plan and it had everything we needed. We will definitely be back!"
2023-11-01,5.0,Stayed a few nights,Great stay!
2023-11-01,5.0,Stayed one night,"Stayed here with close girlfriends on a quick get away to Peoria. Clean, safe and comfortable spot to stay. Highly recommend."
2023-11-01,5.0,Group trip,Beautiful place for an overnight stop in the area!
2023-11-01,5.0,Stayed a few nights,"Branden was responsive and kind, and a great host to communicate with. The place is 5 stars all around. Convenient to local events and restaurants, easy to get to, well-apportioned and quite spacious, and felt extraordinarily comfortable and livable. My guests and I were very happy we stayed here during our visit."
2023-11-01,5.0,Stayed with kids,Great place to stay just outside of downtown. Exactly as the pictures show. Would not hesitate to book again if we are in the area.
2023-11-01,5.0,Group trip,"My family and I enjoyed our stay at this home. It was very pretty, clean, and good layout. We came in to watch a comedy show and it took us a short Uber to get there which was convenient. The host was responsive when we had a couple of questions and very friendly."
2023-11-01,5.0,Stayed one night,Branden’s place was just lovely. Everything was even more charming than described. Felt nice and clean. I would absolutely book it again.
2023-10-01,5.0,Stayed a few nights,This place is cute! The design and decor are really nice. And I cannot stress enough how clean this place was! It had everything we needed. It’s an older neighborhood with beautiful mature trees! We loved it! Would definitely stay again when we come back to Peoria!
2023-10-01,5.0,Stayed a few nights,Was so happy so see that the pictures matched the actual residence. Very clean and well kept. Will book again.
2023-09-01,5.0,Stayed a few nights,Extremely beautiful airbnb with tons of room and privacy in the back yard. Highly recommend!!
2023-09-01,5.0,Stayed one night,I just wish we had more than one day stay. This place was spotless. Homey and comfortable. Conveniently located. And I loved the outdoor patio. It’s a 5.
2023-09-01,5.0,Stayed a few nights,"This home was perfect for our stay. Convenient location. As with any neighborhood, there is a mixture of diversity, but we had no problems and it was very peaceful. We appreciated the outdoor lighting being on a timer for convenience and safety. The house looks exactly like the picture. It's quite obvious the owner took great care in the decor and updates in this home. The spacious deck was an added bonus as well as the use of the garage. TV's in every bedroom and a large screen in the family room. Check in was extremely easy and there wasn't a huge checklist of rules, very straight forward and easy. Highly recommend this house for a very nice, clean, fuss free stay."
2023-09-01,5.0,Stayed a few nights,Everything was great with the stay for the week for work. Would definitely rent again if I’m in town. Very clean and organized house.
2023-08-01,5.0,Stayed with kids,"Great, cozy and clean"
2023-08-01,5.0,Stayed a few nights,We’ve been staying in Peoria for several weeks now for work at several different places. This is the 2nd time we’ve stayed at one of Branden’s houses and both houses we’ve stayed at were the 2 nicest homes we’ve been at! Very nice and clean and well taken care of. Would recommend anyone to stay at one of their homes!
2023-08-01,5.0,Stayed one night,Branden was very responsive to any questions or concerns I had. Very friendly and his home exceeded our expectations. Will definitely book this airbnb in the future.
2023-08-01,5.0,Group trip,"Our stay at Branden's place was perfect. The house is beautiful, spacious, very clean. It was even better than what we expected. Branden was also very quick to respond to inquiries. Location is very close to Peoria's downtown with plenty to do near there. I'd highly recommend this house."
2023-07-01,5.0,Stayed with kids,Branden’s home was absolutely stunning. The decor felt right at home! My family and I enjoyed our stay here
2023-07-01,5.0,Stayed a few nights,This house is nice and clean. The neighborhood might not be the safest and parking was a bit weird with the alley but we enjoyed our stay.
2023-07-01,5.0,Stayed a few nights,"Very thoughtful and modern renovation of the house. We especially enjoyed the sky lights which provided nice natural light throughout the dining and living areas. The kitchen and bathrooms were very clean and had everything we needed or wanted. The beds were comfortable and the bedrooms had plenty of closet and storage space.
The response from the host was immediate and extremely helpful with a variety of recommendations for the area. Every restaurant suggestion was VERY good!
Overall a great weekend!"
2023-07-01,5.0,Stayed a few nights,thankful for the opportunity to stay at Braden's place. I had a wonderful stay. I would gladly stay again.
2023-07-01,5.0,Stayed one night,Felt like home. Wonderful natural lighting and amazing back patio. Will stay there again in the future if I'm back in the area.
2023-07-01,5.0,Stayed with kids,"We had an excellent two night stay. House was impeccably clean, communication was top notch, and we would definitely stay here again. Had two young children with us and we loved that everything was one level and one bedroom was on the opposite side of the house from the other two. Great outdoor space too!"
2023-07-01,5.0,Stayed with kids,Beautiful place that was a great in-town getaway for my family. It was like staying in a magazine photo spread.
2023-07-01,5.0,Stayed with kids,Great stay!
2023-07-01,5.0,Stayed a few nights,"I left my complicated daily life and got along well in a quiet place.
Thank you."
2023-07-01,5.0,Stayed about a week,"Super comfortable, easy to access location."
2023-06-01,5.0,Stayed a few nights,"We loved the layout and decor!
We enjoyed coffee on the back patio each morning!"
2023-06-01,5.0,Stayed a few nights,Great house! Super cute.
2023-06-01,5.0,Stayed with kids,"Clean & well equipped, great space for a family."
2023-06-01,5.0,Stayed with kids,"My recent stay at Branden’s place was absolutely great! From the moment I arrived until the day I left, Branden went above and beyond to ensure that my experience was nothing short of perfect. From the moment I made the booking until the day I checked out, he was responsive, friendly, and accommodating. The home was inviting and the warm atmosphere instantly made us feel at home. This place truly exceeded my expectations in terms of comfort, coziness, and cleanliness. I highly recommend this property to anyone looking for a place to stay in Peoria. We will definitely be returning in the future!
Thank you!"
2023-05-01,5.0,Stayed a few nights,Branden was a great host! Very responsive and kind. The house was so comfortable and clean. Very close to downtown Peoria and easy to access. Check in and out was super smooth. If we return to Peoria we will definitely stay in one of Brandens properties!
2023-05-01,4.0,Stayed a few nights,Great location for class quiet
2023-05-01,5.0,Stayed a few nights,minutes from everything very comfortable felt like i was home
2023-05-01,5.0,Stayed a few nights,"Perfect place for graduation weekend, nice & cosy to stay and get together, easy to reach by car. Thank you Fires & co!"
2023-05-01,5.0,Stayed a few nights,The home was beautiful and the location was very handy for our circumstance. The host was very accommodating and helped to make my daughter’s wedding day memorable. I am forever grateful!
2023-05-01,5.0,Stayed a few nights,"I've used Airbnb a few times and this place was by far the best spot I've stayed at. The house was beautiful, the host was responsive, and the instructions were very clear so that there was no confusion. I stayed from Friday to Monday and had no issues with anything. I'm very happy to have stayed here and if I ever come back this will be the first spot I check for availability."
2023-04-01,5.0,Stayed one night,Beautiful home friendly host!
2023-04-01,5.0,Stayed one night,Branden was a great host. The house had everything we needed for a one night stay.
2023-04-01,5.0,Stayed one night,great stay!
2023-04-01,5.0,Stayed a few nights,Brandon was very responsive to our needs. The washing machine went out prior to our arrival and he was quick to let us know and fix the issue quickly. Beautiful home and very comfy.
2023-04-01,5.0,Stayed with kids,"The host was so amazing and helpful. The house was clean, stocked with the essentials and had very easy check-in details. Definitely one of the best Airbnb’s in Peoria."
2023-04-01,5.0,Stayed one night,This was a great stay! Highly recommend!
2023-04-01,5.0,Stayed one night,Overall great stay! We had no problems! Would recommend!
2023-03-01,5.0,Group trip,Located about a mile from the civic center. Easy to find and a great place to stay if you are doing anything downtown. Would recommend to anyone!
2023-03-01,5.0,Stayed one night,The house is nicely decorated and has everything you need for a short stay. It was a short drive from downtown.
2023-03-01,5.0,Stayed one night,"Beautiful home! Branden was very responsive, also. Would highly recommend!"
2023-03-01,5.0,Stayed a few nights,"Best BnB I’ve stayed in, easily!"
2023-03-01,5.0,Stayed a few nights,"The home is bright and spacious, and worked perfectly for our stay."
2023-03-01,5.0,Stayed with kids,"Beautiful house, close to downtown. Very clean and comfortable stay. I especially liked being able to park in the attached garage for added comfort."
2023-02-01,5.0,Stayed one night,"We were so happy to find this place! It was so cute , clean, and cozy. It was the perfect location for us only 2 min. away from the Civic Center where we were attending a concert. We would not hesitate to book this house again!"
2023-02-01,5.0,Group trip,Adorable find in Peoria! Location is close to downtown and the house is cleaned immaculately. We had everything we needed and more when staying here.
2023-01-01,5.0,Stayed a few nights,Branden’s place was immaculately clean. The beds were extremely comfortable and I absolutely want to stay here next time we are in town! The pictures do not do it justice! The added bonus of having a garage was nice. The sitting rooms were both beautiful and we used the kitchen amenities. Everything was top notch and I would recommend to ALL my friends to stay here as well!
2022-12-01,5.0,Stayed one night,"Very convenient location, outstanding renovation for a comfortable short stay. We were visiting for the Historical Society home tour & several homes were close by. Lots of parking options, either on street or driveway/garage. Interior was very tastefully decorated, and more room than we had expected. While it was too cold to enjoy, the back deck would be perfect in warmer weather. Overall experience was perfect!"
2022-12-01,5.0,Group trip,"Thank you for letting us use the place, it was beautiful & perfect in what we were looking for 👍🏼"
2022-12-01,5.0,Stayed a few nights,"Amazing place for the price. I was working at OSF hospital down the street, and this place was awesome. Quiet and clean. super close to work."
2022-11-01,5.0,Stayed with kids,Great place to stay. Super clean and cute. Felt right at home. We knew going in that the neighborhood wasn’t the “best” area and that really was the only downside.
2022-11-01,5.0,Stayed with kids,This house was absolutely lovely! Modern styles with one of the coolest sitting rooms I’ve ever seen. Amenities were above and beyond my expectations and host was very responsive for the couple questions we had. This worked out really well for my family and I would definitely stay here again!
2022-11-01,5.0,Group trip,"Stayed for a girls night away! Cozy, very clean, and perfect hangout! The kitchen table and living space were great for conversation. Beds were very comfortable. Great location! Would stay again!!"
2022-11-01,5.0,Stayed one night,Great place to stay when visiting Peoria
2022-11-01,5.0,Stayed one night,"This house is a must if you are staying in Peoria! Immaculate details in each room, making it feel cozy as well as welcoming. We enjoyed making dinner in the kitchen and eating outside on the back porch. The heater in the master bath is an amazing touch as well. Definitely recommend!"
2022-11-01,5.0,Stayed one night,"Very nice and lovely home to drop by for a stay! Nice and quite neighborhood, off street parking!"
2022-11-01,5.0,Group trip,Gorgeous house with plenty of space. It was nice that we were able to park in the garage and everything was so clean! Definitely recommend!!
2022-11-01,5.0,Stayed one night,Very clean lovely home!! Easy access and the host was wonderful!!
2022-10-01,5.0,Stayed a few nights,Nice and clean house. Suits well for group of 3-5 people. Easy access by car to reach Peoria environment.
2022-10-01,5.0,Group trip,Excellent place to spend a weekend in Peoria. Close to everything. Super clean and well equipped with everything we needed.
2022-10-01,5.0,Stayed one night,This property is exactly as pictured. It is a lovely home and we really enjoyed our stay there. Quiet neighborhood and close to what we were looking to do. Highly recommend!
2022-10-01,5.0,Group trip,This was absolutely AMAZING! So beautiful inside and out. Owners were amazing and very communicative! I will definitely be staying here again!!
2022-10-01,5.0,Stayed with kids,"This was one of the best Airbnb we stayed in. This place is amazing! The location is great, everything seemed to be 5 minutes away!"
2022-10-01,5.0,Stayed one night,Very cute place and very clean..
2022-10-01,5.0,Stayed with kids,"We are so happy we picked this air bnb in Peoria! It was a fantastic experience. Clean and beautifully decorated to boot! Loved the location, very convenient and centrally located to get to all the places we needed to visit in the Peoria area. Great communication with the host as well. Beds were comfortable and the fenced in side yard with patio was a fun spot to let my two year old roam around. Also loved the gas fire place, very cozy. It was such a home away from home it was hard to leave. Will definitely book again."
2022-09-01,5.0,Stayed a few nights,"Stayed her multiple times, great place, to stay if your in the area."
2022-09-01,5.0,Group trip,it was perfect
2022-09-01,5.0,Stayed one night,"Beautiful, clean, spacious, comfortable. Like home!"
2022-09-01,5.0,Stayed one night,We had everything we needed. The place is beautifully decorated and clean.
2022-09-01,5.0,Stayed one night,Great place! Great location and the hosts were very responsive. Highly recommend staying here.
2022-09-01,5.0,Stayed a few nights,"5 stars all around. Branden's place was by far the best experience I've had renting temporary housing in Peoria. It was very clean, spacious, and well designed on the inside. The backyard was relaxing and I spent a good amount of time outside as well. loved staying here."
2022-09-01,5.0,Group trip,"We had no issues whatsoever, and really enjoyed our stay!"
2022-09-01,5.0,Group trip,BEAUTIFUL HOME!! Branden kept in touch with us until we checked in. We had everything we needed. location might not be the best but the house makes up for everything
2022-09-01,5.0,Stayed one night,Brandens place was in the perfect place for a wedding we had to attend. We comfortable had two couples there. The house is beautifully decorated and was everything as advertised. Branden sent clear check in and check out recommendations.
2022-08-01,5.0,Stayed a few nights,"Branden's home near downtown Peoria was perfect for our annual girls' weekend. The home is located near several dining and shopping options. Accessing the home was quick and easy and instructions left by the owner were straightforward and helpful. The updated kitchen and bathrooms were beautiful, as well as the decor and artwork throughout the home. I especially appreciated the labels on all the light switches. Everything felt clean and new. The large smartTV was ideal for watching movies. Netflix and basic cable channels were available and we were also able to access our own personal streaming accounts. We would definitely stay here again and wouldn’t hesitate to recommend this rental to others."
2022-08-01,5.0,Stayed a few nights,"Our stat at Branden's place was fantastic. The home was decorated beautifully and very comfortable! The bathroom and bedrooms were spacious. We were in town for a Jeep Crawl do having a garage to park in and store the the Jeep panels was an added bonus. The kitchen had top of the line appliances, coffee maker and a wonderful water filtration system. We will definitely stay again next time we're in town!!
Easy clean up, easy check in. Soooo quiet!! Great for a family, a work trip or a romantic weekend away! Close to Obed and Isaac's and many other fun activities!"
2022-08-01,5.0,Stayed a few nights,"Very nice people, Excellent Communication. Super nice place, always clean. Place Honestly feels like home, Would Definitely recommend."
2022-08-01,5.0,Stayed a few nights,"Place was Excellent, Had everything you possibly need. Close to downtown Peoria, Restaurants etc... Would definitely recommend."
2022-08-01,5.0,Stayed a few nights,Had a great time- love the skylights in the Airbnb! Such a great place to catch up with friends!
2022-08-01,5.0,Stayed with kids,"The house was amazing, my granddaughter said it looked like a mansion.lol!"
2022-08-01,5.0,Stayed with kids,Beautiful home and easy to book with them. Very nice and welcoming.
2022-07-01,5.0,Group trip,"We were in Peoria for a wedding. This place had plenty of room for our family. The house is close to the riverfront. The place is awesome, we felt right at home. The decor is amazing. The skylights provide a ton of natural light. The bathrooms are clean and loaded with plenty of towels. Branden is a great host. One extra bonus is there is a garage which had room for our car. This place is amazing."
2022-07-01,5.0,Stayed a few nights,This home is beautiful and beyond comfortable. Branden was more than accommodating. I can’t wait to stay again.
2022-07-01,5.0,Stayed a few nights,"This was an amazing stay!
Branden was awesome at communicating and made sure my trip went as seamless as possible!"
2022-07-01,5.0,Stayed one night,"Lovely, clean, and stylish home that has everything you’d need. Owner quickly replies to messages and is very helpful! Highly recommend this place and will be remembering it for future stays in Peoria."
2022-07-01,5.0,Stayed a few nights,"Great host, nice home. Recommend!"
2022-07-01,5.0,Stayed with kids,"Beautiful and comfortable interior. Fantastic kitchen, great backyard. We were in town for a disc golf tournament and the house was conveniently located for getting to many different parts of the area."
2022-07-01,5.0,Stayed one night,Beautiful clean home!
2022-07-01,5.0,Stayed with kids,"Beautiful well decorated home, super clean and fully furnished"
2022-07-01,5.0,Stayed one night,Such a great place to stay. Well decorated and appointed. You can’t go wrong with Brandon’s place.
2022-06-01,5.0,Stayed a few nights,"The house was spottles, the setup was perfect, and the beds were pretty cozy."
