date,rating,note,review_text
2022-08-01,5.0,Stayed one night,"Jill is a good host. Excellent communication, clean place, close to everything."
2022-08-01,5.0,Group trip,This was the cutest air bnb! Jill keeps it very clean! There was plenty of room for everyone to spread out. I love how close it is to anything you want to do in peoria. Would absolutely stay here again!
2022-08-01,5.0,Stayed with kids,The house is beautiful and set up very well. The snacks and drinks Jillian provided were an added bonus. This is a place we would consider again if passing through Peoria!
2022-08-01,5.0,Stayed one night,comfortable
2022-08-01,5.0,Stayed with kids,"An awesome place to stay! Great location, value, etc. loved the available snacks and was a so clean and welcoming place!"
2022-08-01,5.0,Stayed about a week,It’s a nice little house not too far from shopping centers including a mall. The hiway was just a few miles down the road. Our stay was perfect and the house met all our needs. I would definitely consider this place again.
2022-08-01,5.0,Stayed with kids,Very clean and really well stocked!
2022-07-01,5.0,Stayed with kids,The house was clean and filled with everything we needed for our weekend stay. Highly recommend booking this!
2022-07-01,5.0,Stayed one night,"We stopped for a brief overnight stay here on a cross country trip. This is a lovely, clean, well-appointed home! The beds are comfortable and there were extras like coffee, tea and snacks provided. There were even ice packs to take with you. The setting was in a quiet neighborhood. I would highly recommend a stay at this property."
2022-07-01,5.0,Stayed with kids,Well cared for home that worked well for our large family (7). Very neat and tidy.
2022-07-01,5.0,Stayed a few nights,We had a wonderful stay!
2022-07-01,5.0,Stayed with kids,This was the perfect place for our family’s trip to Peoria! It was so nice having a pack-n-play on sight so we didn’t have to lug ours around. The house was immaculately clean and well stocked with everything we needed.
2022-07-01,5.0,Stayed a few nights,"My husband and son stayed at Jillian’s during Junior Disc Golf World Championships. It was the absolutely perfect place for them to unwind after long days on the course. Everything went extremely smoothly - reservation, check in, stay, and check out. Highly recommend Jillian’s place!"
2022-07-01,5.0,Stayed a few nights,"This house was great. Very well stocked, clean, and comfortable in a central location. Highly recommend."
2022-07-01,5.0,Stayed with kids,"Clean, comfortable, well maintained, lots of extras that make your stay feel like your at home! We will definitely stay again if we are in the area!"
2022-06-01,5.0,Stayed a few nights,Jillian's place was very clean and well stocked. The kitchen had enough plates and utensils for a small group. There are a lot of pots and pans to cook your own food. It was a nice touch to have some juices left in the fridge. The neighborhood is nice and quiet.
2022-06-01,5.0,Stayed a few nights,"This is our (family of 5) second time staying here for our son’s yearly baseball tournament and will stay again next year! (10 min from Louisville Slugger Sports Complex)
Jillian is a great host and very easy to communicate with and accommodating."
2022-06-01,5.0,Stayed one night,"This spot was really, really nice. Nice quiet, shady space outside, parking on the driveway, restaurants within walking distance, all the personal touches were amazing. Super clean , felt like I was at home here. Highly recommend!!"
2022-06-01,5.0,Stayed with kids,Great place! Peaceful neighborhood. Loved the extra snacks and drinks. Great place.
2022-06-01,5.0,Stayed with kids,"Very nice house in town, but very private. Absolutely great deal"
2022-06-01,5.0,Stayed with kids,"We had a great stay at Jillian's place! It's cute, clean and in a good location. We didn't have any issues but were confident that if we did, Jillian was always quick to respond to any questions. We look forward to coming back in the future."
2022-06-01,5.0,Group trip,Great place to stay. Jill was super friendly and helpful. Great communication
2022-06-01,5.0,Stayed a few nights,House was extremely clean and the extra amenities made it extremely homey feeling. Definitely worth the stay
2022-06-01,5.0,Stayed a few nights,"Awesomely cute and comfortable house! Neighborhood is amazingly quiet and SO convenient. Loved sitting in the shady back yard. The snacks and drink “extras” provided were very handy, helping us stay put which allowed more time for visiting with family.
Jillian communicated the house details, rules, and check in information clearly and in a timely manner. Everything was so perfect we didn’t need any additional information. Definitely hope to stay at Jillian’s place on our next trip!"
2022-06-01,5.0,Stayed a few nights,Nice comfy place to stay. A good home base with easy access to hospitals.
2022-05-01,5.0,Stayed a few nights,"The house was exactly as pictured, the perfect size for three or four people. Really clean. Definitely would stay again."
2022-05-01,5.0,Stayed a few nights,Owner was very responsive and was a great communicator
2022-05-01,5.0,Stayed one night,"The perfect respite after a long day on the road! Thank you!
Jillian’s place is EXCEPTIONALLY convenient to just about anything you’d like to eat and to any store you might need. Great location nestled in an adorable little neighborhood. Perfect!"
2022-05-01,5.0,Group trip,"A very clean and comfortable stay! It was perfect for our weekend trip to Peoria. The three bedrooms gave each of us our own comfortable, private area, yet the home was cozy enough to enjoy each other’s company as well. Great communication, and close to everything."
2022-05-01,5.0,Stayed a few nights,"Lovely, sweet home in quiet neighborhood. Easy, short trip to the University where we needed to pick up our son. And lots of food and amenities nearby. Great stay!"
2022-05-01,5.0,Stayed a few nights,"What a WOUNDERFUL and cute home! Our team enjoyed the week long stay so much that they wanted to stay the following week as they continued thier work in Illinois. The host responded fast to our messages, along with assisting us getting another stay for a week. The company has saved this BnB for future use! Truly appreciate staying in this house ❤️"
2022-05-01,5.0,Group trip,We had a great stay. This place was clean and up to expectations.
2022-05-01,5.0,Stayed with kids,"The house is adorable. The kitchen is well stocked for all cooking needs. The only downside was the floors are a bit squeaky, which made for some dicey situations with two little ones sleeping, but overall it was a great stay."
2022-04-01,5.0,Stayed one night,This adorable home is beautifully decorated and. It sits in a quiet neighborhood and is close to everything. The owners have provided everything you might need. Communication/check in was very easy. Would definitely stay here again.
2022-04-01,5.0,Stayed with kids,"This house was so very nice. Quiet neighborhood and plenty of parking. We stayed here for our daughter’s wedding weekend and it provided us a far better experience than a hotel would’ve. It was updated, clean and so comfortable. Communication with Jill was easy and she responded quickly. I would definitely stay here again."
2022-04-01,5.0,Stayed a few nights,"I've stayed at this place several times, and have never had any problems. It's easy to check in, communication is great, house is just as described, and I love my ""home away from home""!"
2022-04-01,5.0,Group trip,Jillian was a wonderful host and this location was great for our weekend stay in Peoria. Quick communication and had just about everything you could need in the home that would make for a good stay. Highly recommend!
2022-04-01,5.0,Group trip,This house offers all of the comforts of home just outside of downtown. It’s quiet and cozy and we’d stay again when in town.
2022-04-01,5.0,Stayed one night,Just what me and my teenage kids needed!
2022-04-01,4.0,Stayed with kids,Cute house! Very clean and nice neighborhood. My kids loved the snacks that were available.
2022-04-01,5.0,Stayed a few nights,House was perfect for us. very convenient to the Civic Center.
2022-03-01,5.0,Stayed a few nights,"I've stayed here twice now when coming to town for work. It's a great location, clean, quiet, and has everything you need! I highly recommend booking this place!"
2022-03-01,5.0,Stayed one night,"Jillian's place was very clean, beautiful and had so many extra thoughtful touches! Would definitely stay here again."
2022-03-01,5.0,Stayed one night,super clean. very comfortable and nice touches
2022-03-01,5.0,Stayed with kids,"Would definitely recommend it. Cozy, with a lot of nice personal touches. Host was great."
2022-03-01,5.0,Stayed with kids,The place was amazing and was more than expected. Highly recommended.
2022-03-01,5.0,Stayed a few nights,I have never felt more at home than I did at Jillian’s. She literally thought of everything. Even feminine products! Seriously … who is that thoughtful! If you are ever in need of a comfortable place to stay in the area this is the one! I’d give 10 stars if I could.
2022-03-01,5.0,Stayed with kids,Beautiful house! Games for the whole family. Very clean and comfortable! Everything you need while away from home.
2022-03-01,5.0,Stayed with kids,Super cute and cozy! Very clean. Great location. Highly recommend.
2022-03-01,5.0,Stayed with kids,Gracious host!!! Lovely home in nice quiet area. Communication was a plus!!! House well equipped for our needs!! Very comfortable!!! Kid friendly!!! We will definitely book again if in Peoria!!! All 🌟 across the board!!
2022-02-01,5.0,Stayed with kids,We loved our stay! Quite neighborhood that’s close to shopping and downtown. I would highly recommend and will be staying again if we need to make a trip back.
2022-02-01,5.0,Stayed one night,"If you are looking a great space that has wonderful bedroom space, a great kitchen for meals, and a lovely lounging area with beautiful decor for the price of an incredibly cheap motel, look no further! This place is just barely out of Peoria, but only a 10 minute drive from some incredible dining places! Would 10/10 come back here!"
2022-02-01,5.0,Stayed one night,"We had a wonderful stay at this charming place. Nice quiet neighborhood, very comfortably furnished with everything you need and more. Super clean, spacious and close to everything. We would highly recommend this to others and plan to return in the future."
2022-02-01,5.0,Stayed a few nights,This is a really cute little house that was perfect for my needs! Check in and communication were super easy. The place has everything you'll need and then some! I appreciated the cleanliness and quietness. This was a great home away from home while I was in town for work. I recommend this place highly!
2022-02-01,5.0,Stayed one night,"Very nice house, a good size for 3-4 people to stay in. Nice area as well, no too far from things to do in town."
2022-01-01,5.0,Stayed one night,"Very clean, accommodating, and plenty of space for a relaxing stay. Host was friendly and easy to contact. Would love to stay again if ever in the area!"
2022-01-01,5.0,Stayed a few nights,"The house was exactly as advertised, clean, comfy and close to where we needed to be. Jill was responsive and if we were returning to Peoria we would look to stay again!"
2022-01-01,5.0,Stayed with kids,Jill is an amazing host
2022-01-01,5.0,Stayed a few nights,What a beautiful and well equipped home! It has everything you’d need. I travel to Peoria often to see family and this tops my list as the best place to stay.
2022-01-01,5.0,Stayed a few nights,"Everything was just as stated. Very clean, cozy home. Appreciated the front porch light being turned on when we arrived after it was dark. The available snacks, ice packs and foam coolers was a nice offering."
2022-01-01,5.0,Stayed a few nights,"This house was impeccably clean, and exactly as described. It’s about 10min away from OSF hospital. The neighborhood was quaint, quiet and we felt very safe. We stayed during winter when there had been snow and ice. The owners made sure the driveway and walkway were clear which was a big relief to us. The bathroom was stocked with shampoo, conditioner and body wash. The kitchen was stocked with plenty of a nice variety of food items - oatmeal, coffee, popcorn, fruit cups, and juice, among others. We had a wonderful 2-night stay, highly recommend for any couple/family needing a safe, clean, quiet place that gives you more room and flexibility than a hotel."
2022-01-01,5.0,Stayed a few nights,"Communication was always prompt and the accommodation were first rate. Fantastic value. The juice and snacks well appreciated. Jill is a first rate, gracious host"
2022-01-01,5.0,Group trip,"Awesome house! Super clean, lots of towels, bedding and accommodations for will we were there. Quiet neighborhood, close to everything, and cozy. Big open basement for kiddos to play. Jill was responsive and very accommodating."
2021-12-01,5.0,Stayed with kids,"This was a great place to stop overnight on a longer road trip. Our three boys really enjoyed the complimentary juice, snacks, and oatmeal!"
2021-12-01,5.0,Stayed a few nights,This is an awesome place to stay! It is impeccably clean with everything you need for your stay. We have stayed here several times and have never been disappointed. The house is located in a quiet neighborhood and there is easy access to shopping and restaurants in different areas of Peoria. Jill is a very accommodating host with excellent and timely communication. We will be back!
2021-12-01,5.0,Stayed with kids,Nice and clean! Close to everything. Owners respond promptly every time
2021-12-01,5.0,Stayed a few nights,very cute house! had a good stay 🙂
2021-11-01,5.0,Stayed a few nights,Everything was nice and clean. The home was very beautiful and comfortable I loved staying here I didn’t want to leave .
2021-11-01,5.0,Stayed with kids,Host was great. Very responsive to any questions or needs we had. Property was nicely renovated and as described. Worked great for our family of 4.
2021-11-01,5.0,Stayed a few nights,"Beautiful home, great location and excellent communication. Number one pick to stay again."
2021-11-01,5.0,Stayed with kids,The house was very clean and extremely well stocked. We didn’t need to contact Jill for anything. We would definitely stay again.
2021-11-01,5.0,Stayed a few nights,"Great place. Quiet and very clean and comfortable. Host provides so many things to make guests feel at home. Even provides drinks and snacks. My sister said she was done renting hotel rooms, this was the best way to travel and stay."
2021-11-01,5.0,Stayed a few nights,"Very cozy home in a good neighborhood, great contact between myself and the home owner, would totally stay again"
2021-10-01,3.0,Stayed a few nights,"Pros:
Good Location
Snacks and some beverages available
Cute decor
Mostly well equipped
Cons:
Dishwasher left a film on the dishes to the extent that they didn’t look clean… We ended up hand washing them.
The host received a alarm that there was water in the basement and asked me to go downstairs 3 separate times check it out, clean up the water, and take a picture of the thermometer. Subsequently, we didn’t have hot water for showers the last 24 hours.
No sponge or dish cloth for washing dishes"
2021-10-01,5.0,Stayed a few nights,"A super-thoughtful superhost with a very home-y house! Walking into this space feels like coming home with art on the walls and comfortable bedding available (including a variety of pillows). The food amenities were more than expected and very adequate. Jill left helpful and generous notes, including the house rules, in public rooms (kitchen/living room) to ensure a smooth stay from arrival and departure! Would gladly stay here again!"
2021-10-01,5.0,Stayed with kids,Jill's place was the perfect stay for our family driving through on a road trip. The house is so clean and cozy and set up great for kids! Thank you Jill for great stay!
2021-10-01,5.0,Stayed a few nights,Driveway is a hill. Window wells have shrubs around them. Otherwise very nice and cozy.
2021-10-01,5.0,Stayed one night,We were glad for GPS to locate the house - it was easy then. It was a quiet and private neighborhood which we appreciated
2021-10-01,5.0,Stayed a few nights,"The house was very clean and perfectly located to everything we needed to do, if necessary we would definitely book again!"
2021-10-01,5.0,Stayed one night,"This place is immaculate! Extremely clean, well organized and nicely decorated made for a very relaxing stay. Extra touches such as snacks and things for kids make this an extremely attractive place for families with kids. I cannot say enough about how much we enjoyed this location and would highly encourage others to try it out!"
2021-10-01,5.0,Stayed a few nights,Highly recommend! We will be booking again when we come back!!
2021-09-01,5.0,Stayed a few nights,extra clean
2024-06-01,5.0,Stayed about a week,"Everything was as pictured. The house is decorated very well, and the beds were very comfortable. You won't find a better view. We will definitely be staying here on our next visit."
2024-06-01,5.0,Stayed a few nights,"We had the best stay here! The hosts were accommodating and really thought of everything. The house is beautiful, my bridal party and I could not get over how amazing the house was. Would definitely stay at one of their properties again!"
2024-06-01,5.0,Stayed a few nights,"I can't say enough good things about my first experience at Blackbird on the Drive, and of Jim & Rebecca.
They were helpful in booking, responded quickly to questions, and were super friendly!
Being from the area, I was already familiar with the location; however, I was pleasantly surprised at how peaceful, quiet, and serene the home was. It felt like a 5 star resort rather than a home in the heart of a thriving city!
I was blown away by the cleanliness, furnishings, and extras inside the home!
The robes made me feel like a celebrity, the stocked bar with fridge & recipes were a hit, and the beds were incredible. BEST SLEEP EVER!
This was a work/play stay and I will be recommending it and returning!"
2024-04-01,5.0,Stayed with kids,"This home was beautiful and so comfortable! The view was fantastic. There were extra amenities that were a pleasant surprise!
Jim and Rebecca were perfect host. They were very friendly and very accommodating.
We hope to return in the future and definitely highly recommend this location!"
2024-04-01,5.0,Stayed one night,"Our stay at blackbird was beautiful, luxurious and so restful. Would definitely stay again in the future."
2024-03-01,5.0,Stayed a few nights,Our stay was simply AMAZING! The house is over the top beautiful! We were so blessed to be able to stay at the house as I know Jim and Rebecca's homes are usually booked up. I highly recommend this house! Thank you for a wonderful stay!
2024-03-01,5.0,Stayed a few nights,This is by far my favorite place I’ve stayed in the Peoria area. Great views and a very nice home to boot. Would love to stay again.
2024-02-01,5.0,Stayed a few nights,This was my first time staying at this airbnb but I’ve stayed at most of their others! They never disappoint and it was STUNNING!
2024-01-01,5.0,Stayed a few nights,"Very beautifully decorated, hosts went above and beyond with making you feel at home. They thought if everything from cocktail ingredients. Charcuterie board, breakfast breads and shower/bathing products. Overall it was a perfect place to stay.
."
2024-01-01,5.0,Stayed one night,"Beautiful home, everyone should spend an evening here! Very relaxing and chill! Host did not miss anything, many small touches that enhance your stay!"
2023-12-01,5.0,Stayed a few nights,"I had an amazing birthday weekend at Blackbird on the Drive. The space and views are absolutely beautiful, and of all the many home shares and vacation homes I have stayed at, this one easily offered the most amenities and hospitality items--including a well-stocked bar and entertaining fridge. I had a minor issue getting into the home when we first arrived, but my call for assistance was answered right away and it was figured out almost immediately. I had a few local friends over to celebrate my birthday and they were all raving about the space and talked about how comfortable they felt while there. This is my second stay at a Jim and Rebecca property, and it definitely won't be my last."
2023-12-01,5.0,Stayed with kids,"Jim and Rebecca’s Blackbird on The Drive is the absolute best AirBnB I’ve ever stayed at. The home is stunning, the views were beautiful at night with the city lights, the bar was fully stocked, they left Christmas cookies and a charcuterie board for us. I used the space for boudoir photography and my clients were shocked with the beauty and how comfortable they were in the home! While I wasn’t photographing clients my toddler and husband and I lounged; there were 3 living rooms to choose from so it was easy to get cozy. I already have clients asking when I’ll return and originally I planned on using other spaces to add variety, but this home has variety enough and Rebecca & Jim were just fantastic! Thanks again!!!"
2023-12-01,5.0,Stayed about a week,"Jim and Rebecca’s Blackbird house was an incredible stay for us, probably the best Airbnb experience we have ever had. Very clean and extremely welcoming."
2023-11-01,5.0,Stayed a few nights,"Even before booking, when I had a question, the response was so fast and warm & friendly. The home was beautiful, the photos do not lie. We had some bridal photos done while we were there and there were multiple places throughout the house to choose from to make fabulous backgrounds. Cannot rate these hosts highly enough."
2023-11-01,5.0,Stayed a few nights,Absolutely stunning home! Exceeded our expectations- so well decorated and felt right at home. The pictures don't do it justice!
2023-10-01,5.0,Stayed a few nights,"Rebeca and Jim are excellent hosts, the house is spectacular, everything is beautiful and impeccable inside the house, we will definitely return soon, we were very comfortable."
2023-10-01,5.0,Stayed a few nights,This home is STUNNING. Even more beautiful in real life. I booked this home for my bridesmaids and I to stay at/get ready at and it was perfect - absolutely no shortage of mirrors and outlets. Hosts were extremely welcoming and generous. Would definitely stay again just for a fun weekend retreat!
2023-10-01,5.0,Stayed a few nights,We booked this for the weekend of my wedding and my bridesmaids and I got ready here. It was the most perfect spot and we were able to get some beautiful pictures!!!
2023-10-01,5.0,Stayed a few nights,Jim and Rebecca’s place is great. The view is beautiful and peaceful. We would definitely stay there again.
2023-10-01,5.0,Stayed with kids,"Jim and Rebecca are excellent host. We were met with comfort and a homey feeling. The home is absolutely stunning! Only complaint is that we wish we would’ve booked more nights! Will definitely be back soon… this is our second stay of their five “Beatles,” named properties! We plan to stay in the other three asap. Highly recommended!"
2023-10-01,5.0,Stayed a few nights,Amazing! No other word can describe it.
2023-10-01,5.0,Stayed one night,What a lovely home!!! We felt so comfortable and safe. The home was decorated beautifully and the views were great. My husband enjoyed a drink of the bourbon and we ladies shared a bottle of wine that was provided. We used the well stocked kitchen to make our breakfast before hitting the road again. We highly recommend this property and wish we could have stayed longer.
2023-09-01,5.0,Stayed one night,Absolutely gorgeous! They were super accommodating and responsive. Would absolutely recommend!
2023-09-01,5.0,Stayed with kids,"We had a wonderful time at Jim and Rebecca's place. It was a treat to stay in such a beautiful and spacious home! There were various rooms and outdoor spaces to relax and everything was beautifully decorated. Jim and Rebecca were attentive hosts, and even went out of their way to return something that we had left behind by accident. Would highly recommend their home to anyone!"
2023-09-01,5.0,Stayed over a week,The hosts where amazing and the house was beautiful!
2023-08-01,5.0,Stayed a few nights,"This is an amazing place to stay! We live in the area but we felt like we were at an all together special location away from home. You can't help but relax and enjoy this lovely, comfortable home. We highly recommend it!"
2023-08-01,5.0,Stayed a few nights,"This house is incredible, every detail was attended to. We had treats, a stocked bar, amazing views, cozy robes and so much more!
The design and aesthetic is stunning.
Bravo Blackbird!!
Well done Jim and Rebecca."
