date,rating,note,review_text
2023-10-01,5.0,Stayed a few nights,"This apartment was amazing! We came down to stay for a few days to meet up with some good friends who live close by and we would absolutely come back to stay here again. The apartment was beautiful and super clean and cozy. The location was perfect, close to bars and restaurants. Aref was awesome and very communicative! He made sure all of our questions were answered. Overall, we highly recommend this AirBnb for its cleanliness, comfort, great location, and attentive host. It made our trip truly memorable!"
2023-10-01,5.0,Stayed a few nights,Great spot! Walking distance to Atwells St. with tons of great restaurants (as well as liquor store and Walgreen’s). Space was clean and comfortable and Aref was clear with instructions. Would stay again!
2023-10-01,5.0,Stayed a few nights,Perfect place to stay in providence conveniently located directly across from a nice cafe. Thanks so much for hosting!
2023-10-01,5.0,Stayed with kids,"This place was exactly as pictured which isn’t always the case as I’m sure most of you know. My brother got married this past weekend and Aref’s place was a perfect spot to stay. It was quiet at night and a totally safe space for me and my family to stay for the weekend. I was really impressed how what appeared to be such an old building was transformed into such a beautiful, modern and comfortable space.
Thanks Aref! And if we make another trip to Providence, we know who to call!"
2023-10-01,5.0,Stayed with kids,We loved the place. Stylish in every way🤩. Spacious and extremely comfy. We’ll come back when again in the area. Thanks Alef for your detailed information prior and after our stay. Everything worked perfectly and made our stay a splendid.
2023-10-01,5.0,Group trip,Perfect for our family visit for wedding downtown. Modern decor in large older apartment blding. One park spot and then relied on street parking which in early October was not an issue.
2023-10-01,5.0,Stayed with kids,"This was a beautiful stay, the apartment was just as described and we had a restful sleep in the comfortable beds.Great spot."
2023-10-01,5.0,Group trip,"Absolutely stunning! We loved staying there, everything was clean and lots of soft blankets! We had such an amazing time and loved taking pictures of the space"
2023-09-01,5.0,Stayed with kids,"We stayed here for a wedding. It was a great location, near lots of restaurants. It was the perfect spot that was close to the downtown area and only 10 minutes to the venue."
2023-09-01,4.0,Stayed one night,We had a great stay at this beautiful apartment. 100% recommend!!
2023-09-01,5.0,Stayed a few nights,"We loved staying here! Came for a girls weekend and this was a great location, close to lots of great food and bars and a quick Uber to downtown. The apartment looks just as it is listed and was spotless! Would definitely stay here again!"
2023-09-01,5.0,Stayed one night,Great stay! Thank you!
2023-09-01,5.0,Group trip,"Had a great stay at this place while visiting providence for a night. A clean, comfortable place to stay that’s close to great food and coffee. Can’t go wrong here."
2023-09-01,5.0,Stayed a few nights,"Loved the apartment: beautifully furnished, great location on Federal Hill, fun neighborhood, and totally guest-friendly check-out procedures. Aref’s communications were thorough and well-timed and he responded in a matter of minutes to the couple of questions I had. Would absolutely book with Aref again."
2023-09-01,5.0,Stayed with kids,Great stay!! The apartment is beautiful and the loft is so so fun! Awesome neighborhood convenient to everything
2023-09-01,5.0,Stayed one night,"Perfect! If I could give more than 5 stars I would. Picked up my daughter at a local college because her dorm room was 90 degrees on the 9th floor during a heatwave. She brought 3 of her friends to stay over and get relief from their stifling dorms. They were in heaven in Aref's air-conditioned unit. It is so well appointed, sparkling clean and comfortable, way beyond expectations. Very convenient off street parking spot. I really enjoyed walking on the street and felt very safe, local architecture was stunning. Excellent Pizzeria was about a 2 minute walk, liquor store about 5 minute walk. Such a great place to hangout, hope to stay again as my daughter has 4 more years in Providence."
2023-09-01,5.0,Stayed a few nights,Great location and easy access to everything in Providence! Very comfortable bed and the apartment is beautifully designed!
2023-09-01,5.0,Stayed one night,Good dude
2023-09-01,5.0,Stayed with kids,"Aref’s place is located across from a great coffee shop and is walking distance from plenty of great restaurants and DePasquale Square. The place itself was very neat and tidy, and loved all the wood details! I would recommend this place to any of my friends visiting Providence."
2023-08-01,5.0,Stayed one night,We had an great stay in Aref's INCREDIBLY beautiful space. It was quick direct access from the major highway as we drove from Maine. Quick Uber into downtown for drinks and food. The space was absolutely stunning and comfortable. Thank you for taking such great care of us!
2023-08-01,5.0,Stayed one night,"My family of four LOVED Aref's gorgeous apartment and wished we had booked a longer stay immediately. It was incredibly well appointed - a feast for the eyes with all of the stylish furnishings and beautiful details, including a bounty of fresh flowers on the table. The building itself is landmark worthy. And there was a parking spot for our rental car, too. The location is also wonderful - close to Brown, terrific restaurants, river walk, downtown, Capitol. Providence itself was lovely and a great food town. Come hungry and get a good workout so you can eat more! If you are vegan, Plant City is a dream of 4 major vegan restaurants, plus cafes, patios, also elegantly designed. Thank you, Aref, for your hospitality! Hope to be back soon♥️🙏♥️"
2023-08-01,5.0,Stayed one night,Absolutely stunning place! Great location!
2023-08-01,5.0,Stayed one night,"Aref is a wonderful, responsive host. The home is beautiful and well decorated and quite comfortable. The beds are great. Shower is modern and up-to-date. This is our second time staying here and we would definitely stay here again. It’s close to the college campus that our daughter is attending."
2023-08-01,5.0,Group trip,"Beautiful place within walking distance of tons of shops and places to eat. Everything was very clean, exactly as Aref described, and easy to access. Aref was responsive and helpful and provided tons of information prior to check in which made for a smooth arrival."
2023-08-01,5.0,Stayed one night,"The pictures of this apartment in Providence do not do it justice. It was absolutely gorgeous inside, we were able to walk to a gorgeous restaurant in 5 minutes and had almost no issues at all. The only hiccup was the parking situation but like most cities we were able to easily park on the street right next to the house. Would 100% recommend Aref and this air bnb."
2023-08-01,5.0,Stayed with kids,"Overall, a great experience, I would recommend. I will review and consider his other properties as well when in that area."
2023-08-01,5.0,Stayed one night,We stayed one night at Arefs apartment with our two boys. It was perfect for our needs. The boys loved the loft/bedroom combination! The apartment was spotless and beautiful designed. Super comfortable beds and pillows were a plus! Would definitely stay again. Aref was wonderful at connecting and providing clear information on check in and out . Great host and great apartment!
2023-08-01,5.0,Stayed a few nights,"This is a beautully restored apt in a lovely historic house in fabulous Federal Hill. The apt is meticulously and artistically designed and furnished. I note that there is a closet in the 2d bdrm, but none in the master, so we used the 2d bdrm closet for our clothing. We love the diversity as well as the strong Italian element in this wonderful area of Providence. Being able to walk to the fab restaurants and little shops in Atwells is a plus."
2023-08-01,5.0,Stayed with kids,"Consensus among our group: this was one of the nicest Air B and B experiences we've had! The apartment was well-appointed and absolutely spotless. Communication from Aref was also friendly, timely, and thorough.
Thanks for a great stay!"
2023-08-01,4.0,Stayed one night,"Attractive 2BR apartment, well appointed in high-end modern style. I appreciated the morning coffee and clear communications."
2023-08-01,5.0,Stayed with kids,"This 2 bedroom apartment was located in an historic building and included every amenity from wifi, smart tv, towels to a full kitchen (ice maker, stove microwave, dishwasher, toaster, dishes, and a stocked coffee maker). Parking was right behind the apartment and could be accessed from a back door which made unloading your vehicle about 10 steps away. Coffee shop was right across the street and had great coffee and sandwiches. There is a pizza place next store called hotline pizza, which only takes orders online at set up time slots (I highly recommend). Julians is a block away with a great breakfast and lunch special. Also, about 3 blocks behind the building is Atwells Ave. with about 20 different restaurants. In sum, great location, apartment, host and experience.
Thank you Aref"
2023-07-01,5.0,Group trip,"Place is clean and location is awesome. Short walk to breakfast joints, coffee shops, & spa. Easy access to fun downtown area with short Uber rides never going over 20$. Had a great girls trip!"
2023-07-01,5.0,Stayed one night,Fantastic place that has been tastefully designed and very well maintained
2023-07-01,5.0,Stayed a few nights,"We had a lovely stay at Aref’s place! It was a very neat apartment in a nice and cozy part of town. Also the kitchen was superb. We got groceries at Urban greens co-op market (tip!!).
Aref was really helpful throughout our stay. We went to a conference at the providence conference centre which was also quite close-by (20 min walk)."
2023-07-01,5.0,Stayed with kids,Aref was very quick to respond and was helpful . We loved his place it was beautiful and very clean. Would definitely return .
2023-07-01,5.0,Stayed one night,"Wonderful stay, perfectly located and clean!"
2023-07-01,5.0,Stayed with kids,"This beautiful apartment looks just like the pictures. The neighborhood is great, and the apartment has everything you need for an amazing stay."
2023-07-01,5.0,Stayed about a week,"Thé apartment was just as pictured! I’d say that the 2nd bedroom w loft might even be better than the master bedroom!!! My 15 yr old son liked the loft! A few missing items in kitchen for week-long stay but Aref was happy to take suggestions and was able to accommodate right away. Can’t beat location! Minutes walk away from convention centre (we walked it a few times daily!) and great restaurants- and surrounded by fantastic coffee shops & bakeries. Shopping mall attached to convention centre. Only problem was finding full fledged grocery store! Finally found « stop-&-shop ». Would recommend nice outdoor setup w BBQ, Adirondack chairs & closed fire pit. Would love to go back on a future trip!"
2023-07-01,5.0,Group trip,We spent a night at Aref’s place as we had tickets to a show at Gillette Stadium. It was the perfect location for a one night stay! We explored the area prior to going to the show… lots of restaurants in the area! Beautiful spot.
2023-07-01,5.0,Stayed a few nights,Our stay was absolutely amazing! The place is beautiful and accommodated myself and two other friends with no problem! I would definitely stay here again if I come back to Providence and would definitely recommend!
2023-06-01,5.0,Group trip,We had a swell time at this divine location. The apartment was decorated so adorably and area was just splendid. Our only complaint is that the apartment was lacking a microwave. Highly recommend.
2023-06-01,5.0,Stayed one night,"Aref was incredibly helpful with the self check-in process. Instructions were precise and easy to follow. Excellent space, clean and comfortable."
2023-06-01,5.0,Stayed one night,Lovely place that is well decorated and a good location. Our part of 4 were quite comfortable and appreciated the cleanliness. Aref was responsive and took care of an oversight. Highly recommended place!
2023-06-01,5.0,Group trip,"This place is absolutely gorgeous! Located in a great neighborhood. I really enjoyed my stay here, it was very cool and modern, yet cozy at the same time. I had an issue with the door lock and Aref responded to it right away. His instructions were all very clear and he communicated well."
2023-06-01,5.0,Stayed one night,"Beautiful, well appointed apartment in a fun neighborhood on a quiet corner. Lot's of great restaurants within walking distance! All of the logistics of our stay were smooth and straightforward. Aref was an excellent communicator, we were very well taken care of here. Thanks for everything Aref!"
2023-06-01,5.0,Stayed with kids,"Aref's place is very well put together with the furnishings and interior design. Very comfortable and clean, an excellent place to stay near Federal Hill. Highly recommend staying here!"
2023-06-01,5.0,Group trip,Location is super convenient and near everything! Night life is fun and dining is also a great experience. Inside is beautiful and refreshing! My guests and I felt so comfortable and to me comfort is very important. The long mirror in the living room area was super cool and convenient as well. Bunk bed loft area was also very comfy as my guest described it as “sleeping on clouds”. Thank you so much Aref for providing us with this amazing experience in RI; def a great way to celebrate my 35th bday.
2023-06-01,5.0,Group trip,Beautiful and modern place. Pictures matched perfectly. Nice amenities. Felt very comfortable. Was extremely close to everything I needed. Aref was responsive. Great experience overall
2023-06-01,5.0,Stayed a few nights,"The place was as described and in a perfect location to all things in Federal Hill. We would definitely stay there again! A plus in Federal Hill is that it comes with a parking space and it is a noon check out which is later than most places. It is newly remodeled and everything was pristine! Easy check in and check out. He send messages at appropriate times about what we needed.For example, on check out day, he sent the procedure which was perfect timing and his procedure is very simple! We will return!"
2023-06-01,5.0,Stayed one night,Really nice renovation in a beautiful old building.
2023-05-01,5.0,Stayed a few nights,This apt looks exactly like the photos! Beautiful and pristine. Very comfortable beds (memory foam) and great layout in the living room/kitchen area. Lots of sunlight and great location. Aref was very helpful and responsive. Recommend!
2023-05-01,5.0,Group trip,Couldn’t have stayed at a better location in Providence. The place was perfect and very immaculate. Would stay here again if we came back to Rhode Island!
2023-05-01,5.0,Group trip,"This place was a beautiful, gothic chic dream. Super clean, airy and quiet. The only downside was there were only 3 towels with 5 of us and we couldn’t find any extras. Otherwise I would absolutely stay here again!"
2023-05-01,5.0,Stayed one night,Enjoyed our stay! 3 girlfriends and I fit comfortably and enjoyed the area.
2023-05-01,5.0,Stayed a few nights,"This unit is beautiful, comfortable and well decorated. The beds and bedding are great. The lighting is fabulous. Modern appliances, kitchen, bathroom shower and AC and heating system. Ample seating in living room and kitchen area. Location great. Neighborhood has a good vibe with cafes and a short drive to Brown University campus. Parking spot big enough for a large SUV. Close by to some of the best restaurants in the Federal Hill section. Host Aref responsive and put allot of effort into the Unit. Definitely would stay here again."
2023-05-01,5.0,Stayed a few nights,Great location. Clean. Pretty historic building.
2023-05-01,5.0,Group trip,Very charming townhouse! We had a great time!
2023-05-01,5.0,Stayed a few nights,Had always we had a amazing stay! This is now 3rd time we stayed with Aref every unit is too notch with high end finish’s. We will be back!!!
2023-04-01,5.0,Group trip,"Aref's place is absolutely beautiful! We were all blown away as soon when we walked into Aref's apartment, i can not recommend this airbnb enough! The apartment itself was perfect, beautifully decorated, squeaky clean, clutter free and had all the amentities we needed, we also loved that we had parking reserved for us and how close we were to so many restaurants and the mall. I can't wait to return and stay at any of Aref's beautiful apartments; they all look amazing."
2023-04-01,5.0,Stayed one night,"Amazing place!!! Gorgeous and welcoming inside, comfy beds, cozy living room area, modern clean kitchen and very creative use of the space. Easy check in, Aref’s instructions were exact and we didn’t need to communicate with him for anything, but he was spot on about the breakfast cafe across the street and great selection of authentic Italian cuisine about a 10 minute walk away. Would stay again for sure !"
2023-04-01,5.0,Stayed one night,Great location and the design of this space is unmatched!
2023-04-01,5.0,Group trip,Beautiful apartment in a great location!
2023-04-01,5.0,Group trip,Absolutely loved it!
2023-04-01,5.0,Group trip,"Wonderful spot for a girls weekend, comfortable, great location."
2023-04-01,5.0,Stayed one night,"A really relaxing place, felt right at home and would have happily stayed longer. Thank you 🙏"
2023-04-01,5.0,Stayed a few nights,"Wonderful location and space was beautiful, squeaky clean, and convenient to everything. We will be back!"
2023-04-01,5.0,Stayed a few nights,This place was beautiful in every way. Gorgeously decorated and very clean. Perfect setup for our family of 4. The host has thought of every detail. We loved the location and found a great place to walk to dinner. The next morning we walked right across the street for coffee.
2023-04-01,5.0,Stayed one night,"Our stay at was fantastic! Host was extremely communicative which made finding the location and accessing the apartment extremely easy. We were genuinely impressed with the quality and care that was put into the unit’s decoration, ambiance and upkeep. Many of us were “taking notes” on how to best replicate an upscale style in our own apartments. Ideal location on Broadway made getting around the city to various spots quick and easy. An overwhelmingly positive experience that has me wanting to return to Providence in the near future and when I do, I will be looking to stay here! 5 stars."
2023-03-01,5.0,Stayed a few nights,Amazing
2023-03-01,5.0,Group trip,The apartment was cozy and beautifully decorated. All the beds were comfortable. Our group had plenty of space to relax and spend time together in the kitchen/living area. I was especially impressed with the location. Everything we needed from a great dinner to convenience store to coffee was only steps away. I was very happy with my stay!
2023-03-01,5.0,Stayed with kids,The apartment was very nicely furnished and cozy. Looking for to staying again.
2023-03-01,5.0,Group trip,"We had such a wonderful stay at Aref's apartment. This apartment is centrally located near all attractions Providence has to offer. The apartment itself is so beautiful, spacious and well decorated. I can tell Aref put a lot of work and creativity in the interior design of the apartment. I will definitely be staying here again during my next visit to Providence."
2023-03-01,5.0,Group trip,"An amazing property—close to downtown, easy to find and park, plus beautifully decorated. Comfy beds, lots of towels, and space heaters for the colder months. We were a group of 5 and had plenty of room. Overall great experience and we will definitely book here again when in town! (Oh, and Aref got back to me very quickly when I texted him with a question)."
2023-03-01,5.0,Group trip,"Great home, great location, great communication! The apartment was super comfortable and looked just like the pictures. It was very clean. Definitely great value & will stay there again!"
2023-02-01,5.0,Group trip,"I booked Aref's place for my sister's birthday weekend, this past weekend. The instructions I received from Aref were timely, very clear; making finding the space, checking and checking out seamless. I never once had to contact him for help with anything. The space was perfect for us 5 girls to hang out, sleep and get ready in. We especially loved the elevated design of the space which made us feel like we were in such a luxe space (which was a bonus to a fun weekend). The location was perfect as well. It was literal walking distance to Atwell's street, which is the heart of Federal Hill and where we spent most of our time. It was great to be able to enjoy our night out and walk back safely to our rental, and continue to enjoy the space after hours. I definetly would book again the next time I'm in Providence!"
2023-02-01,4.0,Stayed with kids,Very nice place with comfortable accommodations in a great location. We were very comfortable during our stay.
2023-02-01,5.0,Stayed with kids,"This place was beautiful! Right near Federal Hill everything was pretty close. We are a family of five, including two toddlers, and the place was plenty big for all of us. Aref was super helpful upon check-in with very fast response time. We would book a place from Aref anytime, hopefully this one again!"
2023-02-01,5.0,Group trip,This was a lovely apartment and we had a great time there! Definitely would recommend it to others
2023-02-01,5.0,Group trip,This is a gorgeous space perfect for a weekend getaway. It was clean and was in such a great location. Aref was communicative and friendly!
2023-02-01,5.0,Stayed a few nights,"Comfortable, clean and perfect location. Aref was responsive when I had an issue with parking and provided a quick solution. The beds and linens were top notch. Will stay here again!"
2023-02-01,5.0,Stayed a few nights,This is a beautiful place and a great neighborhood
2023-01-01,5.0,Group trip,"This is my 2nd time staying at one of Aref’s spaces in this beautiful vintage gothic home. All of his rentals are decorated beautifully, clean and artsy. I look forward to staying in one of your spaces again when I visit Providence. Thanks so much!"
2023-01-01,5.0,Stayed with kids,"We had a great stay. The apartment was as advertised, very well taken care of, and Aref is an excellent host."
2023-01-01,5.0,Stayed one night,Very clean and comfy cozy!
2023-01-01,5.0,Stayed one night,"The place is exactly as the pictures show! Clean and very neat, bathroom was clean and well stocked with plenty of towels but it was a very small space. Great stay, the only thing that was a little off putting is that an hour before we were suppose to check out someone came to the door and we heard them put the code in and the lock turn. No one came in but we were already packed up and about to leave so we did just that."
2023-01-01,5.0,Stayed one night,The place was an absolute pleasure at walk in. It was clean and organized. The beds were so comfy and we felt right at home.
2023-01-01,5.0,Stayed one night,It’s a really cute apartment to stay! Furniture and decorations are perfect. Big rooms. And the kitchen is also very nice for cooking
2023-01-01,5.0,Stayed one night,"Perfect place for a little getaway! Right in downtown, so much to do."
2023-01-01,5.0,Stayed with kids,This place is awesome! Can’t wait to stay here again!
2023-01-01,5.0,Group trip,Absolutely stunning location and Aref was super helpful and actively responsive!!! Definitely recommend for any occasion!!!
2023-01-01,5.0,Stayed one night,Unfortunately the power went out in the neighborhood and Aref was communicative on the situation and offered a full refund. He was very kind and helpful and I would happily book again with him. The apartment is beautiful and comfortable.
2022-12-01,5.0,Stayed with kids,Took my family last minute. Very nice place kids loved it. Close to Mall and walking distance to Fed Hill.
2022-12-01,5.0,Stayed with kids,"We enjoyed a mid-week stay at this lovely space on the west side of Providence. It was the perfect getaway, cozy enough for inside time while near enough to good food, sites, and parks. Aref was pleasant and responsive. We would enjoy visiting again!"
2022-12-01,5.0,Stayed a few nights,Great!
2022-12-01,5.0,Stayed one night,Good stay
2022-12-01,5.0,Group trip,The airbnb was beautifully renovated. Only stayed for 1 night so it was just what we needed. Extra lofted bed was a great use of space. Aref sent pre-arrival emails which made our stay easy. The only feedback I would have is instructions on how to use the thermostat as it was quite warm in the home when we arrived. Thank you for a great stay!
2022-12-01,5.0,Stayed one night,"Host is super friendly! When there was a minor problem, he stopped by immediately to fix the issue! House is really pretty, cozy, and overall amazing!"
2022-12-01,5.0,Group trip,Area’s place was great for a quick one night visit to Providence. It was close to downtown and an easy 25 minute walk to the train station. The building was quiet and the apartment was beautifully decorated. We’d stay here again if in the area.
