date,rating,note,review_text
2024-06-01,5.0,Stayed a few nights,"Stayed at the apartment for two days while helping my daughter who is in college move out of her dorm. The location is perfect. Many restaurants within walking distance. Off street parking was ideal. And the overall layout of the apartment was wonderful. The second story loft was very cute. And when I return in the fall, I will definitely be staying there once again.
Photos are accurate and the apartment was spotless.
The perfect place to stay."
2024-06-01,5.0,Stayed one night,Great location and a great apartment. Plenty of space and everything went smoothly the whole time. Would recommend!
2024-06-01,5.0,Stayed one night,"Beautiful place, great communication, thank you!"
2024-04-01,5.0,Stayed a few nights,It’s the best air bnb in Providence!
2024-04-01,5.0,Stayed one night,We stayed a night at Jennifer's Loft. My teens and I enjoyed the quiet neighborhood. Jennifer was responsive and gave clear communication. The place was exactly as it was described. We enjoyed our stay.
2024-04-01,5.0,Stayed one night,"Easy walk to campus, off street parking. Clean and wuiet"
2024-04-01,5.0,Stayed one night,"Cute, clean apartment in a quiet area. Excellent instructions and communications with Jennifer."
2024-04-01,5.0,Stayed one night,"We enjoyed our stay at Jennifer’s place immensely! The apartment is so cute and very comfortable! We only stayed 1 night, but will definitely return and stay here again!"
2024-04-01,5.0,Stayed with kids,"Would stay again! Super convenient to Brown, very clean and comfortable."
2024-04-01,5.0,Stayed a few nights,"Jennifer's Loft was perfect for our needs. (We had 3 people, but 4 would have been comfortable, too.) The loft was exactly as described. While we had a car, we literally walked everywhere. On top of being a great location, Jennifer's place was clean, cute, and comfortable. We didn't cook while we stayed, but we easily could have. If our daughter commits to Brown, then Jennifer's Loft may become our new home-away-from-home for the next 4 years. :) Thanks for a great stay!"
2024-04-01,5.0,Stayed a few nights,Had a great time. The host was super responsive and helpful.
2024-04-01,5.0,Stayed one night,The location was absolutely perfect for my conference at Brown and enjoying local awesome restaurants and shops too!
2024-04-01,5.0,Stayed a few nights,"Great location to campus. Also walkable to Red Stripe, CVS and Starbucks. Would stay again!"
2024-03-01,5.0,Stayed with kids,"Apartment was great - my daughter loved the loft! Walkable, comfortable, easy in & out. Jennifer was helpful & responsive. Would definitely stay again!"
2024-03-01,5.0,Stayed one night,Clean and beautiful space. Great location. Had to check in early and Jennifer was really accommodating and responded quickly. Would definitely stay here again.
2024-03-01,5.0,Stayed one night,The space was very clean and located in a great spot for our visit . Everything matched the description great and we would stay there again if we were in the area.
2024-03-01,5.0,Stayed one night,"Jennifer’s apartment was the perfect place to stay during my conference at the convention center. It was spacious, clean, and had everything I needed. Most importantly, the mattress was comfortable!"
2024-03-01,5.0,Stayed with kids,"Peaceful, clean, beautiful view. We’d choose this place again in a heartbeat. Thank you, Jennifer!"
2024-03-01,5.0,Stayed a few nights,Great Location! We enjoyed our stay.
2024-03-01,5.0,Stayed one night,Easy access and very very responsive - would stay again. Depending on destination walking can be very hilly but Uber was easy (lots of Lyft scooters and bikes available right outside too). Everything is close by.
2024-03-01,5.0,Stayed a few nights,"Good location, good space, felt very safe. Jennifer was very responsive.
Some street noise (as to be expected by a college campus on the weekend). It is noted well in the description, but if you are planning on using both beds, definitely keep in mind the low and peaked ceiling in the lofted bedroom."
2024-03-01,4.0,Stayed a few nights,Great location! Very close to Brown and RISD and walking distance to restaurants and shops.
2024-03-01,5.0,Stayed a few nights,Our stay was AMAZING! Jennifer was a superb host. Her home is absolutely stunning/ with a very warm atmosphere. Any questions we had Jennifer was quick to respond. I highly recommend Jennifer when choosing a place to stay in the providence area.
2024-03-01,5.0,Stayed a few nights,"Jennifer’s place was fantastic—easy to reach, clean, spacious. Had a great time!"
2024-03-01,5.0,Stayed one night,"The loft apartment was spacious, immaculately clean and had what we needed in the kitchen to make this stay easy and enjoyable. Walkable to a couple cute areas with restaurants and shops. Safe area, quiet except it’s near Brown campus and on a Saturday night ear plugs will help with an uninterrupted night’s sleep in the loft bedroom as there was sporadic some noise on the street. No issues at all with noise in the bedroom! Jennifer was proactive with communication, highly responsive and made things easy. Highly recommend!"
2024-03-01,5.0,Stayed a few nights,"Jennifer’s place was wonderful, close and walkable to so many things! The space was beautiful and comfortable for what we needed!"
2024-02-01,5.0,Stayed one night,"Jennifer's place was perfect for a weekend stay in Providence! Easy parking, close to lots of great restaurants, and a super cute apartment. We would definitely stay here again!"
2024-02-01,5.0,Stayed one night,Great place to stay for the weekend!
2024-02-01,5.0,Stayed one night,"Great location, very walkable to Thayer St, right at edge of Brown U campus, nice residential neighborhood! Apartment is just as advertised, perfect for a short stay."
2024-02-01,5.0,Stayed one night,"Recently stayed overnight at the Loft and it was amazing. My wife and a second couple enjoyed our stay as if felt like home. The Loft is well designed and welcoming. Nothing regarding this Loft apartment was disappointing. It is located within walking distance from a very active and lovely restaurant/shopping district; which im sure during warm weather it's the place to be! We would definitely love to stay here again during the warmer seasons and enjoy more of what the area has to offer.
AMAZING STAY 🙏 ☆☆☆☆☆"
2024-02-01,5.0,Stayed one night,"This is a total gem. You're a short walk away from so many of the things you'll want to explore in Providence. The living room and kitchen area are expansive. The bedroom is spacious, and the loft is a separate bedroom. Jennifer is a fantastic host. She was always quick to respond and helped me get my water bottle back after I left it in the apartment. I can't wait to return!"
2024-02-01,4.0,Stayed one night,Was really such a beautiful space & to not be so far out was great I would recommend & stay again for sure.
2024-02-01,5.0,Stayed one night,Jennifer was a great host and I loved staying at the apartment. It was incredibly clean and convenient. Closed to everywhere but private and super quiet at the same time. She was very helpful with instructions for check-in/check-out and I appreciate how smooth she made my trip as it was work-related and time was very tight. Highly recommended. Thank you Jennifer.
2024-02-01,5.0,Stayed one night,"This the second of Jennifer’s properties at which we have stayed, and this one is also unique and beautiful. It is clean, quiet, nicely decorated, and comfortable.
When we return to Providence, we hope one of Jennifer’s properties will be available."
2024-02-01,5.0,Stayed one night,Great place to stay. Close to brown university. Pretty safe and peaceful place
2024-01-01,5.0,Stayed a few nights,You literally can't asked ask for a better place to stay in Providence 😊
2024-01-01,5.0,Stayed a few nights,Jennifer’s place is absolutely stunning! I will definitely return next time in town.
2024-01-01,5.0,Stayed a few nights,This small loft in college hill is really great for a couple!
2024-01-01,5.0,Stayed about a week,"Great location walking distance to restaurants, the Pizzatola, and the Nelson Fitness Center. The place is clean, the beds are comfortable, and the kitchen had everything we needed. I’d stay there again!"
2024-01-01,5.0,Stayed about a week,Good value for location and size.
2024-01-01,5.0,Stayed one night,"Respect the rules and you’ll have no problems here, had a great stay."
2023-12-01,5.0,Stayed one night,"Jennifer's place was exactly what we were looking for. it was a perfect place to catch some rest while visiting providence. Jennifer was very communicative in her expectations and to offer help as her guests. if you are looking at this place vs another, I would say pick this one."
2023-12-01,5.0,Stayed a few nights,Beautiful unique loft apartment! Absolutely spotlessly clean. Cozy & comfortable. Great location! Host could not have been more helpful! Highly recommend - we would definitely stay again!
2023-12-01,5.0,Stayed a few nights,Beautiful place
2023-12-01,5.0,Stayed with kids,"We had a perfect stay at Jennifer’s apartment. The location was excellent! Walking distance to the schools, museums, shops and historic sights. The accommodation was spotless and felt warm and inviting, its a real gem and we will definitely be staying there again on our next visit to Providence! Thank you Jennifer for being a super host!!"
2023-12-01,5.0,Stayed a few nights,Perfect location for visit to Brown University!
2023-12-01,5.0,Stayed a few nights,Was very delightful to stay with
2023-12-01,5.0,Stayed a few nights,Great location and clean apartment
2023-12-01,5.0,Stayed one night,Perfect location and she even had a parking spot for my car. The host communicated well before I needed any information such that I had zero problems or questions at any point. Would come back.
2023-11-01,5.0,Stayed one night,"What a great and unique home, in an excellent location -- walkable to so many great places: all of Brown U., RISD, and quality restaurants and shops. We loved staying here!"
2023-11-01,5.0,Stayed a few nights,"The loft was a great space, spotless, and very comfortable."
2023-11-01,5.0,Stayed one night,"Very charming place-pictures are very accurate and the place is spotless. Great location near Brown and downtown Providence. Easy check in and super responsive host. Upon arrival there were water bottles and snacks to make you feel at home. Kitchen was stocked with coffee too. No list of things to do upon departure, which is the way it should be."
2023-11-01,5.0,Stayed a few nights,"Couldn't ask for a better location- close to Thayer but not too close, great places to visit in every direction. And parking!"
2023-11-01,5.0,Stayed a few nights,"Within 10 minutes walking distance of many of Providence’s great spots (even less to Brown) The apartment easily works for four adults Clean, easy, check-in, communicative host."
2023-11-01,5.0,Stayed a few nights,"The location is ideal, and Jennifer was responsive. Great stay, definitely recommend."
2023-11-01,5.0,Stayed a few nights,"Clean, comfy and spacious. Jennifer was communicative and accommodating. Recommend staying here!"
2023-11-01,5.0,Stayed a few nights,"Perfect location, clean and quiet. Definitely recommend."
2023-11-01,5.0,Stayed one night,"Great place. Nice location, especially for Brown. Excellent instructions and communication."
2023-11-01,5.0,Stayed one night,Love the location and great design of this place. Super cool!
2023-11-01,5.0,Stayed one night,Hard to imagine a better place for a visit to Brown. And the loft space is very cool!
2023-10-01,5.0,Stayed one night,"This apartment is perfect! We only stayed one night and I wish we could have stayed longer. The apartment looks just like the photos. It is pristinely clean and beautiful. Both beds were comfortable, the kitchen was fully equipped with everything you'd need and we felt right at home. The neighborhood it is in is also really beautiful, peaceful, and walkable to Brown University and lots of restaurants. Jennifer was responsive and and helpful - and even kindly let us check out an hour later. Don't hesitate to book this place. I am definitely going to bookmark it as a future place to stay again! Thank you, Jennifer!"
2023-10-01,5.0,Stayed one night,Beautiful place! Totally recommend.
2023-10-01,5.0,Stayed about a week,"We very much enjoyed this stay at Jennifer’s. A fine, pretty apartment a short walk from Brown University and close to Wayland Square. Jennifer is an excellent host."
2023-10-01,5.0,Stayed one night,The apartment was perfect for a quick visit to Brown. Everything was in walking distance and having designated parking was very convenient. The two separate sleeping areas was also nice. Highly recommend!
2023-10-01,5.0,Stayed a few nights,Our stay with Jennifer was excellent! The loft was beautiful and Jennifer was very responsive and helpful.
2023-10-01,5.0,Stayed a few nights,Cute place! We loved the quiet location that’s completely walkable to areas of Brown and downtown Providence. Fabulous for a weekend stay with a roomy feel . Very comfortable beds.
2023-09-01,5.0,Stayed one night,everything as described! So close to Brown!
2023-09-01,5.0,Stayed one night,"Jennifer's place is beautiful and spacious! Unfortunately, I was just there for one night so didn't get to take advantage of the place and the area as much as I would have liked. Will be coming back for sure!"
2023-09-01,5.0,Stayed one night,Great place nice and clean loved the area!!!
2023-09-01,5.0,Stayed with kids,We made a last minute spontaneous trip to check out providence. We were very excited with the area. Can't wait t go back.
2023-09-01,5.0,Stayed a few nights,"We stayed at this place with my brother and sister in law to see my 2 children currently at the university. The location is perfect, right next to the university and near Thayer street where many restaurants are located. The place is charming and clean. Jennifer did an amazing job with her communication. We are very lucky to have booked this place."
2023-09-01,5.0,Stayed one night,"Nice, quiet neighborhood and cozy place."
2023-09-01,5.0,Stayed a few nights,We immediately felt at home and would have liked to have stayed longer!!!
2023-09-01,5.0,Stayed with kids,"Second time staying in one of ""Jennifer's Places"" before. As before, everything was great. The basics: it is close to campus, parking is safe and easy, clean and well-appointed. The unique: this place in particular feels...fun. Our family loved it."
2023-09-01,5.0,Stayed one night,thank you!
2023-09-01,5.0,Stayed one night,Apartment was clean and cozy. We had everything we needed. Jeniffer is great host and I highly recommend her accommodation.
2023-09-01,5.0,Stayed one night,"Had a great stay and Jennifer's place. Communication was clear, prompt and helpful."
2023-09-01,5.0,Stayed one night,"Loved our stay in Providence! Jennifer’s place is clean, comfortable beds, and an awesome location."
2023-09-01,5.0,Stayed a few nights,"Very clean, convenient off-street parking, practically on Brown campus."
2023-09-01,5.0,Stayed one night,Fabulous location for visiting Brown. Cozy attic area with plenty of room and nice views of the athletic fields. We enjoyed our stay and would definitely book again when visiting the area.
2023-09-01,5.0,Stayed with kids,Fantastic place in College Hill. Peaceful location that was easy to walk to from the train station.
2023-08-01,5.0,Stayed one night,One of the best airbnbs in Providence. Amazing hospitality and cleanliness. The loft area was our favorite!
2023-08-01,5.0,Stayed a few nights,"We had a lovely stay in Jennifer's adorable apartment. The space was beautiful, very well-appointed with everything we needed, and just as pictured. The sleeping loft was so cozy and cute - my daughter loved having her own little nest away from it all. Great location for walking to Brown and the surrounding area, which was the purpose of our trip. Would definitely stay here again."
2023-08-01,5.0,Stayed a few nights,Went to Providence to celebrate my birthday and wanted to stay for a couple of nights. Jennifer’s place was the perfect spot to come back to to relax and wind down at the end of the day. It was very clean and comfortable.
2023-08-01,5.0,Stayed one night,Lovely stay in Jennifer’s place. Very convenient location and parking and super easy check in and check out. Cute apartment close to everything.
2023-08-01,5.0,Stayed with kids,Fantastic apartment. Beautiful location. Host was super helpful and communication was seamless. We hope to come back soon. Thank you!
2023-08-01,5.0,Stayed over a week,This apartment worked really well for my spouse and me for a 3-week stay while attending a conference in Providence. It is very comfortable and the location is good. The host was responsive and helpful.
2023-08-01,5.0,Stayed a few nights,We had a good time
2023-08-01,5.0,Stayed a few nights,"Jennifer’s place was a perfect base for our parents to explore Providence and exactly as described. It was a very welcoming, light and bright apartment in a great location. Check in was stress free and very easy, and Jennifer was always on hand to answer any questions. We would not hesitate to stay again!"
2023-07-01,5.0,Stayed one night,Jennifer was a great host! Very responsive when I had a question about check-in. The place was exactly as described and was nice and tidy. I’d happily stay here again!
2023-07-01,5.0,Stayed with kids,"It was a very nice stay, very peaceful and quiet area, walkable distance to Brown University. We had problem with the shower during the stay, Jennifer is very responsive to fix the problem for us. I would stay at Jennifer’s place again for my next visit to Brown."
2023-07-01,5.0,Stayed one night,"Amazing stay in a great location right
near the Brown University campus. Jennifer was clear with the check-in and out instructions and everything went seamlessly. The pictures don’t do this beautiful apartment justice."
2023-07-01,5.0,Stayed one night,"Great space, fantastic location, responsive host! Will definitely stay again!"
2023-07-01,4.0,Stayed one night,Good location and large house
2023-07-01,5.0,Stayed one night,"Awesome space, very unique. Very clean. Great experience."
2023-07-01,5.0,Stayed a few nights,Jennifer's place in College Hill is perfect for exploring Providence and Rhode Island. The apartment is wonderfully located in the heart of the Brown University campus and is an easy walk to restaurants and to transport. We had a great stay and were sad to leave!
2023-06-01,5.0,Stayed one night,Amazing stay if you want to be close to everything in providence!
2023-06-01,5.0,Stayed one night,Very much enjoyed our stay. Comfortable and convenient to University and surrounding amenities.
2023-06-01,5.0,Stayed a few nights,We were bringing our daughter to RISD for a summer program. The place was perfect. Very comfortable. It was very close to both Brown and RISD. I would definitely stay again.
2023-06-01,5.0,Stayed with kids,"Jennifer’s place provided the perfect stopover in providence. Clean and nicely decorated, it was both quiet and close enough to walking destinations that it felt in the center of it all. Wonderful place that I would love to stay in again when I’m back in Providence."
2023-06-01,5.0,Stayed one night,"Jennifer's place was a great home base for a weekend trip to Providence. Check-in was easy, Jennifer was really responsive, and the space was exactly as advertised."
2023-06-01,5.0,Stayed one night,"The place was clean and cute. If it wasn’t pouring the whole time, it would’ve been great for riding a bike or scooter to get around."
2023-06-01,5.0,Stayed with kids,"This apartment was just like it was in the photos - modern, cool, clean - I thought it was going to be too good to be true, but this spot was perfect! Jennifer was very helpful and responsive and our visit went seemlessly"
2023-06-01,5.0,Stayed a few nights,"Highly recommend this apartment. Excellent location; can walk to everything you need - bookstore, restaurants, coffee shops and more. Loads of space inside to relax and be comfortable. Would love to stay here again."
2023-06-01,5.0,Stayed a few nights,"The location of this apartment was perfect. It was within walking distance to great restaurants and Brown University’s beautiful campus. Each morning we walked to Amy’s, which was a delicious breakfast spot, as we sat outside. The apartment was clean, with a lot of natural light. The neighborhood was safe, and the check in process was flawless. We would definitely stay here again."
2023-06-01,5.0,Stayed a few nights,"Wish I found this place days before cuz is my dream home. Loved it all! Beds were amazing, especially the upper floor one. WIsh I could live there."
2023-05-01,5.0,Stayed a few nights,Great spot
2023-05-01,5.0,Stayed one night,"Wonderful stay! Great area, very clean modern apartment. Jennifer was very helpful with everything and I even accommodated an early check in. Highly recommend !"
2023-05-01,5.0,Stayed one night,Great space! Was perfect for 3 of us and very clean and modern. Jennifer was extremely responsive. Would rent again!
2023-05-01,5.0,Stayed a few nights,"We loved our stay at The Loft.
Jennifer is an amazing host~welcoming, friendly and very easy to reach and communicate with regarding questions that came up. Jennifer's space is super clean, cozy and easy to settle into. The beds are comfortable and the space quiet~great for getting a good night's sleep after walking all around the city.
The sunlight that comes through the living room window in the morning is beautiful! The space is really cool~old building with gorgeous architectural features.
Updated bathroom, kitchen along with modern cooling and heating system for the space.
Jennifer had great restaurants and activities to recommend.
The Loft is walking distance to everything we wanted to see, explore and visit.
Awesome location!
We loved it!
We recommend Jennifer's place and will definitely book again for our next trip to Providence."
2023-05-01,5.0,Stayed one night,This was a really cute apartment! I really enjoyed staying there with my friends. The bathroom and kitchen were clean. And the living room had really good vibes:)
2023-05-01,5.0,Stayed a few nights,"Great place! Great communication. Totally clean, comfortable bed. Great location. Good parking. Just a heads up: the loft has a skylight so it gets light very early. And the AC units are very good - note they are in the rooms other than the upper loft. Overall a great stay!"
2023-05-01,5.0,Stayed one night,"Staying at Jennifer's loft was a very nice experience. She communicated well and was quick to respond to our questions. The entire place was very clean and smelled of bleach upon entry.
Although the description noted the ceiling was short, the Loft area was smaller than expected as the camera angles don't show well that you can't stand up in the space. Great for kids, maybe, but not the best for adults.
The location is beautiful and very easy to walk around or grab an uber to another area. We were happy to have off-street parking for the night, too.
All in all, it served our purposes well, and we enjoyed our stay."
2023-05-01,5.0,Stayed a few nights,"Absolutely fantastic stay at Jennifer’s place. Very well located, we were always within walking distance of one of her excellent recommendations."
2023-05-01,5.0,Stayed a few nights,"Very cute apartment and neighborhood! It was bigger then it looked in the pictures, I would definitely recommend!"
2023-04-01,4.0,Stayed a few nights,Great location with walkable restaurants and coffee shops. The internet was intermittently slow.
2023-04-01,5.0,Stayed one night,great place! very nice set up. I walked in and walked around saying oh wow look at this wow how cool is this haha would definitely stay here again
2023-04-01,5.0,Stayed a few nights,Location is perfect especially if visiting Brown university. Parking spot was great. Cute apartment. Would stay again!
2023-04-01,5.0,Stayed one night,Nice place very clean
2023-04-01,5.0,Stayed a few nights,Great place and host.
2023-04-01,5.0,Stayed one night,"An excellent stay at a great location in downtown Providence, near Thayer Street! Walkable and with clear directions.
The two-level format of the area was nice, with an open loft and an easy staircase. The whole place was fresh and clear, and parking was straightforward and convenient. Overall a great experience, and I plan on booking this apartment again the next time we plan to go to Providence!"
2023-04-01,5.0,Stayed one night,"Jennifer’s loft was the perfect place for us to stay while visiting family in Providence. Clean, bright and as described. We had everything we needed during our stay. Jennifer was very responsive when I had a question. I would absolutely come back again. I couldn’t recommend this space more!"
2023-04-01,5.0,Stayed a few nights,"Loved staying here! Such a beautiful apartment; the pictures really don’t do the place justice. Stayed here for my son to attend accepted students day at Brown University, and the apartment was very walkable to Brown and all the action on Thayer St. The apartment has cool views of the tennis and ball fields across the street. There was also a perfect little desk overlooking a scenic street, where I was able to work, and the WiFi was great so I could host a 2-hour Zoom meeting with a cool view of that spiral staircase behind me). Note: there are several stairs to the apartment (which I appreciated for the forced exercise lol), but it’s not for those with mobility problems. Can’t wait to stay here again over the next 4 years!"
2023-04-01,5.0,Stayed a few nights,"We had a great stay! The place was spacious and centrally located. We were within blocks from Brown University and several restaurants, coffee shops and stores."
