date,rating,note,review_text
2023-03-01,5.0,Stayed with kids,House was very nice! Super clean and updated! We only stayed for one night so we didn't get to fully enjoy the house but everything we did use was great!
2023-03-01,4.0,Stayed one night,"Nice place, comfortable beds"
2023-03-01,5.0,Stayed with kids,"Great place, very clean and had everything we needed"
2023-03-01,5.0,Stayed one night,"soo cute! great little house. very clean, super convenient. could have stayed for days!!!"
2023-03-01,5.0,Stayed with kids,Lovely home... And it felt so cozy thank you!! We will return!!!
2023-03-01,5.0,Stayed one night,Easy to find and felt very comfortable staying there. Looking forward to booking again next time we are in Rolla
2023-03-01,5.0,Stayed one night,The house is so new and clean. We can find amenities we needed. Time is fast we didn’t like to leave.
2023-02-01,5.0,Stayed one night,"2nd time staying at one of Shane’s properties. Both good experiences. Very responsive and accommodating host. Clean places. Well appointed, tastefully decorated, and reasonably stocked with necessary items. We would definitely stay at one of this host’s properties again."
2023-02-01,5.0,Stayed one night,2nd time staying at Shanes and it was an easy check in clean house no problem great stay!!!
2023-02-01,4.0,Stayed with kids,Slept very well on the beds which isn’t typical for me. I was very happy!
2023-02-01,5.0,Stayed with kids,Shane went above and beyond to make our stay perfect. I wish I could give more than 5 stars. Thanks again!
2023-02-01,5.0,Stayed a few nights,"We stayed here for my little brother’s army graduation. We wanted something close and big enough to fit the family. This spot was perfect for all of us. We slept like babies, were able to cook, and relax all cozy. It is a 40 minute drive from base but was well worth it."
2023-02-01,5.0,Group trip,Good stay again. Thanks.
2023-02-01,5.0,Stayed a few nights,The house was wonderful! Booked at the last minute and exactly what we needed.
2023-01-01,5.0,Group trip,Nice place to stay
2023-01-01,5.0,Stayed with kids,"Shane's home was beautiful, we loved the fully loaded kitchen. There was also a welcome basket with popcorn and other goodies. The waters in the fridge were a pleasant surprise. It felt like home. We highly recommend this home."
2023-01-01,4.0,Stayed a few nights,place was clean
2023-01-01,5.0,Stayed one night,I loved the place
2023-01-01,5.0,Stayed with kids,Loved it
2023-01-01,5.0,Stayed one night,"Pulled in after dark and had to leave before sunup, so we didn't get to enjoy much but beds and shower but we were happy with those. My mattress was very comfortable. Would stay again, thanks."
2023-01-01,5.0,Group trip,Always a pleasure to stay with Shane.
2023-01-01,5.0,Stayed a few nights,"My husband, sister, brother in law & myself stayed here for 5 days and the space was perfect for us. Very roomy and clean! The kitchen is great to cook in, couch comfortable and the washer / dryer was an awesome thing to have! WELL worth the price! Very close to down town, lots to see and do! South central creamery, scruffs grill & Route 66 were our favorite things we saw. Definitely would book with Shane again if we’re ever back in the area. He was also very quick and responsive to all our questions."
2022-12-01,5.0,Stayed a few nights,"A wonderful place to stay- cozy, comfortable and felt like home. Shane was a great communicator and extremely responsive. Easy in and out, right by the Missouri S & T and felt like we were able to get to places within 5-7 minutes."
2022-12-01,4.0,Group trip,"This little house is very cute and cozy. Great accomodations. comfortable, well equipped kitchen, lots of space. accomodated our family well for our trip to Rolla for our son's graduation from S&T. The kitchen even had some unexpected items that people might need: flour, sugar, lots of spices/s&p, olive oil, paper plates, etc. Lots of pans, dishes, bowls, etc. for cooking a great meal. Comfortable beds and LOTS of blankets for cozying up!"
2022-12-01,5.0,Group trip,"The house was really nice. At first when we drove up, the other homes made the house look bad. However, the home is super clean and well kept up once we walked in the house. I would stay here again. Thanks for hosting my family!"
2022-12-01,5.0,Stayed with kids,very responsive and peaceful clean comfortable beds.. reallt enjoyes our stay..
2022-12-01,5.0,Stayed with kids,Very nice and cozy home! Everything was good. Great location if visiting your Soldier in Fort Leonard Wood. Shane portrayed great hospitality! 10/10 .. would definitely stay here again!
2022-12-01,5.0,Stayed one night,Clean and welcoming. Shane made it supper easy.
2022-11-01,5.0,Stayed with kids,Great home
2022-11-01,5.0,Stayed one night,Enjoyed our stay here! Was very comfortable. Everything so clean! Really appreciate the quick response from host and their willingness to accommodate.
2022-11-01,5.0,Stayed one night,Great place to stay
2022-11-01,5.0,Stayed a few nights,Perfect!
2022-11-01,4.0,Stayed one night,Shane is a great host .. communication was very responsive…the house inside was everything the picture shows and more.. it was very comfortable and all the linens were fresh and the beds were comfortable. The location from first glance was not very cozy but did not have any problem from the neighborhood. Very nice house
2022-11-01,5.0,Group trip,"This is a very cozy home, good location if you are visiting Fort Leonard. Shane was very quick with responding to any questions we had. Most of the essential things were already there so little shopping was needed. Never wanted to leave this airbnb! Thanks Shane☺️"
2022-11-01,5.0,Stayed one night,Great deal! They were very accommodating and let us get in early.
2022-11-01,5.0,Group trip,"This was a wonderful refuge! Clean, comfortable, peaceful and lovely/tasteful decor! The kitchen/dining area is excellent! The shower felt fantastic! Also, having three spacious, clean bedrooms with equivalent sized beds was perfect for our group of five. My two daughters stayed in the center bedroom and really enjoyed having carpeting to sit on to do some stretching and much appreciated visiting on their own. My youngest daughter especially loved the calm and sweet cat who was content to stay on the porch."
2022-11-01,4.0,Stayed with kids,Nice!! Beautiful home would stay again
2022-10-01,5.0,Group trip,This is a lovely 3 bedroom home that is just as described. It had all the amenities we needed for a family weekend. It is beautifully renovated with decorative touches that make it feel homey.
2022-10-01,5.0,Stayed a few nights,"Great place for a quick trip to pick up my solider. Close to everything, food, stores and most importantly Fort Leonard Wood. Clean house with accurate description."
2022-10-01,5.0,Stayed one night,Great spot for a quick stay or an extended stay with lots of nice amenities.
2022-10-01,5.0,Stayed with kids,Highly recommend. Loved the up to date style
2022-10-01,5.0,Group trip,The place was great! Just what we needed! Walking distance to where we needed to be. Well stocked & super clean with comfy furniture. Would stay there again!
2022-10-01,5.0,Stayed a few nights,We really enjoyed our stay! This place was extremely clean and comfortable and the pictures were accurate. Shane was very responsive to our messages. We would stay here again!
2022-10-01,5.0,Stayed a few nights,"Stayed for one weekend for a wedding and had no issues! Was a bit confused about parking when we got there, but Shane responded immediately and let us know to park in the street. Would definitely stay here again!"
2022-10-01,5.0,Stayed a few nights,"This is such the perfect cutest home! We stayed to visit my daughter out of basic training we were able to bring her home let her take a hot shower and relax … shower 10/10 amazing a good amount of space and comfy beds !
Also had the best dinner in town at NaCl+water ( that’s the name) such incredible food … ps the black cat is friendly we named him Felix"
2022-10-01,5.0,Stayed one night,Thank you so very much for all the special touches. we appreciated the water bottles and coffee! Your home was very comfortable and decorated very nice. It was very clean and welcoming. Thank you
2022-10-01,5.0,Stayed a few nights,Shane was quick to respond to all my messages. The place was very nicely decorated and very comfortable. I felt good/safe about the Sheriff's Department being right across the street. I would definitely stay there again.
2022-10-01,5.0,Stayed one night,Nice big rooms with nicer finishes. Exceptionally clean and organized. Shane was helpful and responsive. We plan to stay at another one of Shane’s places next time we are in town. 👍
2022-10-01,5.0,Group trip,"Everything was spotless and I loved the decor
Would stay again."
2022-09-01,5.0,Group trip,Everything was amazing we couldn'thave asked for anything to be any better. We will definitely stay again if in the area!
2022-09-01,5.0,Stayed a few nights,"The house was perfect for our weekend in Rolla visiting our son. It was in the perfect location, super clean, and well kept."
2022-09-01,5.0,Group trip,Shane’s house was perfect for our stay. We had a family member at fort Leonard Wood!
2022-09-01,5.0,Stayed one night,"A lot of AirBnB's seem to have lost their homey charm in recent years, but Shane goes the extra mile to make his property stand out. This home has spacious bedrooms, a nice deck/yard, a great location within walking distance from many restaurants, its very clean / well stocked with amenities and thoughtful comforts to make you feel at home. What a well-run place! I will definitely be staying here any time I have an extended stay in Rolla."
2022-09-01,5.0,Stayed a few nights,"With easy access to downtown and plenty of space, this will be an easy repeat choice for the next time I need to visit Rolla."
2022-09-01,5.0,Group trip,Loved the house. Very clean & even being close to town very quiet.
2022-09-01,5.0,Stayed with kids,"Stayed here while in town for my son's BCT graduation, close to base. Lots of food options close by. Shane was super responsive when we had some stove trouble and came and fixed it right up. Thanks for a worry free visit!"
2022-09-01,5.0,Stayed with kids,Great clean place on the inside. If your needing a place to stay after fugitive beach it’s perfect
2022-09-01,4.0,Stayed with kids,Great location if you’re visiting fugitive beach. Owner was very responsive and fast texting back.
2022-08-01,5.0,Stayed with kids,We enjoyed our stay tremendously and will be reserving this air bnb on our trip next summer to fugitive beach. It was an overall amazing experience.
2022-08-01,5.0,Group trip,perfect little spot get away while visited our son at Leonard Wood
2022-08-01,5.0,Group trip,"Had a great stay! Clean place in a quiet neighborhood, Shane was excellent!"
2022-08-01,5.0,Group trip,"Great find! We traveled from Milwaukee, WI for family day and basic training at Fort Leonard Wood. This was a great little hide-a-way to rest our weary bodies. Will look into renting again if we are ever by this way!"
2022-08-01,5.0,Stayed a few nights,"It was the perfect Airbnb for us. The location and the accommodation were exactly as shown in the photos. The home was clean, cute, and organized. We really enjoyed our time there and will look forward to coming back for our multiple visits to our son at the local college."
2022-08-01,5.0,Stayed a few nights,The location is great. Easy to find. 10 minutes to Fugitive Beach and perfectly centered to anything you might need. The how house is Clean and cozy. Perfect space for my husband and I and our 3 boys.
2022-08-01,5.0,Group trip,Such a beautiful home! Quiet neighborhood! Host was very helpful and reply fast! I would highly recommend this place!
2022-08-01,5.0,Stayed a few nights,Perfect house for us and good price!
2022-08-01,4.0,Stayed with kids,Great house for a quick weekend trip
2022-08-01,5.0,Stayed a few nights,"Cozy house with everything needed for our mini getaway! Will definitely plan a stay next summer! Thank you, Shane!"
2022-07-01,5.0,Stayed with kids,Such a great place. Spacious and clean.
2022-07-01,5.0,Stayed with kids,The owner was so nice and the house was absolutely beautiful.
2022-07-01,5.0,Stayed with kids,Awesome host and very clean/cute house!
2022-07-01,4.0,Stayed one night,"Clean home at the end of the street in a working class neighborhood, across from a parking lot for sheriff department vehicles and down the block from the courthouse and jail. Inside was renovated nicely. Great kitchen. Only one bathroom, but water pressure in shower was heavenly. Bed was comfortable and blackout curtains were appreciated."
2022-07-01,5.0,Stayed with kids,"clean, near stores, and had everything I needed"
2022-07-01,5.0,Group trip,"We were a mother/daughter group of 6 and this house was perfect for us. Very convenient for getting to Fugitive Beach and close enough to walk to the downtown area for dinner or ice cream. The kitchen is very spacious and had everything we needed. We took 6 back to back showers and the last person still had warm water, impressive! So do not let the 1 bathroom scare you."
2022-07-01,5.0,Stayed a few nights,"very good stay , nice location close to everything and very clean"
2022-07-01,5.0,Stayed with kids,Great location. Close to bars/restaurants and grocery
2022-07-01,5.0,Stayed a few nights,"Great value, smooth process, and the house was immaculately clean!"
2022-07-01,5.0,Stayed one night,"Great spot, very convenient to the interstate. Clean, spacious, and comfortable."
2022-07-01,5.0,Stayed with kids,very nice house with everything you need. I really recommend it.
2022-07-01,4.0,Stayed one night,"We enjoyed our stay, will stay again sometime. Very nice and clean. More lighting would be nice."
2022-07-01,5.0,Stayed with kids,"Clean, convenient and exactly as described. The location was perfect for us as an overnight stopover on the road to Texas. I loved that the host allowed for last minute and one night bookings. Traveling with several small children, finding an AirBNB with multiple bedrooms is so much better than cramming into a hotel!
The house was close to the interstate, in a quiet area where we felt safe and was perfectly maintained. We had everything we needed for a quick overnight and the price couldn’t be beat."
2022-06-01,5.0,Stayed with kids,Great place for our quick stop over in Rolla. Plenty of room for our family of seven.
2022-06-01,5.0,Stayed one night,"The place was comfortable, clean and so modern!"
2022-06-01,5.0,Stayed with kids,Cute place super spacious and we felt safe
2022-06-01,5.0,Stayed one night,"Every detail provided made our stay so smooth and relaxing. Bedrooms were clean with plenty of blankets and pillows. I wish we'd had a chance to use the kitchen, it was huge and beautiful. The house is in a peaceful location that felt super private and convenient. Thanks for everything! We would definitely stay here again."
2022-06-01,5.0,Stayed one night,The house is just as described. Very clean and lots of room. Just minutes from S&T and lots of restaurants and shopping.
2022-06-01,4.0,Stayed one night,"We booked last minute on our way through town. It was a quick and easy process to check-in. My daughter enjoyed the wildlife from the deck out back. We slept well with one exception. The a/c thermostat was programmed (I didn’t realize) and changed over sometime during the night or early morning to an 81 degree setting. Consequently, we were a bit warm as we slept so be sure to check that if you’re booking during the summer."
2022-06-01,5.0,Stayed with kids,We rented this home for my son’s Army graduation. Excellent and fast communication. The home was clean and organized. Located close to restaurant’s. I would recommend staying here.
2022-06-01,5.0,Stayed one night,Cute place!
2022-06-01,5.0,Stayed with kids,"Beautiful and clean home. This was our first time using AirBnb and he made the process easy and the expectations high.
Thanks!"
2022-06-01,5.0,Stayed with kids,Great place to stay with everything you need!
2022-06-01,5.0,Stayed with kids,"This was a great place to stay, clean and spacious!"
2022-06-01,5.0,Group trip,Great and convenient place to stay!
2024-06-01,5.0,Stayed one night,We always book this place when it’s available and we’re visiting our daughter at S and T. Clean and Cozy.
2024-05-01,5.0,Stayed one night,"Great place to stay in Rolla. Everything was clean, had some nice surprises with their coffee selection. Highly recommend this place. Thank you for the great communication!"
2024-04-01,5.0,Stayed one night,Excellent
2024-04-01,5.0,Stayed one night,Thanks for letting us stay. We Felt really at home and the place was immaculate. Thanks Shane.
2024-04-01,5.0,Stayed a few nights,"Went to Missouri for a military graduation, definitely felt like home! Shane was an awesome host and was very responsive and kind. I would definitely stay here again, it was peaceful, super clean, and spacious! Loved the backyard!"
2024-04-01,4.0,Stayed one night,Third time staying at one of Shane’s houses. Never an issue. Great alternative to hotels if you want a little more living space.
2024-04-01,5.0,Stayed with kids,Shane was very responsive. The property was as described with a spacious backyard and peaceful location.
2024-04-01,5.0,Stayed with kids,Shane was easy to communicate with and flexible. The location and property was peaceful with an sizeable backyard.
2024-04-01,5.0,Stayed a few nights,This place was located in a beautiful neighborhood with quiet neighbors. We had everything we needed in the house. The house was cozy and exactly what we were looking for this trip!
2024-04-01,5.0,Stayed one night,"Very clean which is super important to me. There were bottles of water in the fridge waiting for us, several different flavors of coffee pods with cream and sugar available, even a couple bags of microwave popcorn. Very nice surprise! Pretty National Park decor, comfortable furniture and beds. Plenty of thick nice towels and hot water. Would definitely stay again!"
2024-04-01,5.0,Stayed a few nights,Nice place to stay
2024-04-01,5.0,Stayed with kids,Shane was very responsive and the place was great! Would definitely stay again!
2024-03-01,5.0,Stayed with kids,"It was very cozy , and nice comfortable stay for my family and I as we attended our daughters Army AIT Graduation. I enjoyed the kitchen had coffee pods and condiments, bottle waters in refrigerator, extra blankets and towels . We home was very comfortable and enough space for us.We loved the home decor and theme .Quiet Neighborhood and Neighbors.Shane was very responsive from start to the end and we are very pleased. Thank you 😊 We would definitely stay again !!"
2024-03-01,5.0,Stayed one night,"Clean, cozy and comfortable. Highly recommend Shane’s property!"
2024-03-01,5.0,Stayed a few nights,Lovely place and well priced.
2024-03-01,5.0,Stayed a few nights,Great neighborhood. Friendly neighbors and dogs. We will be back.
2024-03-01,5.0,Stayed one night,"This was a quick trip for us, and Shane’s place was a perfect spot to land at the end of a day of driving and start our busy day in Rolla. Very fresh and cozy. No complaints!"
2024-03-01,5.0,Stayed one night,"Quiet neighborhood, spacious home. Large kitchen. Host accommodating for early check-in. Very pleasant experience!!!"
2024-03-01,5.0,Stayed one night,Great place to stay for the weekend watching our son play baseball!
2024-02-01,4.0,Stayed a few nights,Always easy to rent with Shane!
2024-02-01,5.0,Stayed one night,We loved our peaceful stay here after a long day of travel. The kitchen is well stocked and we were able to cook our meal there. The home is decorated with a National Park/mountain theme along with comfortable furniture to provide a relaxing space. We enjoyed out stay here and will definitely be back again.
2024-02-01,5.0,Stayed a few nights,Very comfortable and spacious. The kitchen had everything we needed and we appreciated the waters and the Keurig. Very clean
2024-02-01,4.0,Stayed one night,Overall very satisfied
2024-02-01,5.0,Stayed a few nights,This was a great stay had plenty of room for the kids fenced in back yard most definitely will be the go to if I’m near the area again! Don’t look no further:)
2024-01-01,5.0,Stayed a few nights,"Very nice house, quiet neighborhood, exactly as he described."
2024-01-01,5.0,Stayed a few nights,Great place to stay for a weekend get a way ...
2024-01-01,5.0,Stayed a few nights,Very nice stay. Just as described. The bedrooms were actually bigger in my opinion than the pictures show. Very comfortable for my short stay.
2024-01-01,5.0,Stayed a few nights,Shane was a great host. We enjoyed our stay.
2024-01-01,5.0,Stayed one night,"Was perfect for after a stressed day of driving in a snow storm. He responded very quickly. We really appreciated the coffee and hot chocolate, ice for our drinks and car drink cups. Seemed like we could have cooked and had great meals …next time. Nice and cozy. He was available for help with WiFi. We loved have the deck of cards. Watching the squirrels made us feel at home."
2024-01-01,5.0,Stayed a few nights,this a great to stay! we to book emergently and the was very responsive.
2023-12-01,5.0,Stayed one night,"Shane's place was quiet and peaceful, perfect for a quick stopover on my road trip. He responded quickly and his place was one of the best-stocked Airbnb's I have stayed at! I recommend this place."
2023-12-01,5.0,Stayed one night,Good place to stay with family
2023-12-01,5.0,Stayed a few nights,"Very clean and roomy, nice open area in the kitchen and living room. Comfortable furniture. Would definitely recommend this place."
2023-12-01,5.0,Stayed with kids,"Everything was great. We had everything we needed, Shane was very responsive and let us check in early."
2023-12-01,5.0,Stayed a few nights,"I have stayed at this location over 5/6 times in the past 2 years. It is such a nice place, nice surroundings and quite. Shane has always been great. Highly recommend!"
2023-12-01,5.0,Stayed one night,Wonderful place to stay. We came to town to visit with family and this place was close by.
2023-12-01,5.0,Stayed with kids,This was our first time staying at an Airbnb. We loved the place and the host was great! It was definitely worth the price. Way better than staying at any hotel. Everything we needed was there.
2023-11-01,4.0,Stayed one night,"Basic, clean home. For our purposes (simple overnight stay), traveling thru town for a place to sleep, it was great. Close location to the highway. Nice, dark and quiet location."
2023-11-01,5.0,Stayed a few nights,We had a great time. Peaceful location for a getaway weekend.
2023-11-01,5.0,Stayed with kids,"This place was perfect for a quick night's rest. It was squeaky clean and had everything we needed to crash. I can't remember if it stated in the description that it was a duplex but that always makes me a little stressed because I don't want to disturb others. We got in very late and I just made sure my kids were quiet. I don't think it would have changed my mind and u am glad I chose this place. We would definitely stay again. Also, the national parks decore is great."
2023-11-01,5.0,Stayed a few nights,"We had a great stay at Shane’s place! We were particularly impressed with the well-stocked kitchen (cooking supplies, spices, etc.) and it was very clean overall. Also decorated nicely. Would stay here again!"
2023-11-01,5.0,Stayed with kids,Shane’s place worked great for our family visit. The kitchen was well stocked
2023-11-01,5.0,Stayed a few nights,Enjoyed our stay. Place was as advertised and very clean. Would definitely stay again.
2023-11-01,5.0,Stayed over a week,A nice place to stay
2023-10-01,5.0,Stayed a few nights,Shane is a great host. This is the third home of his that I've stayed in.
2023-10-01,5.0,Stayed one night,"Very convenient, accommodating, and peaceful!"
2023-10-01,5.0,Stayed a few nights,Great little house in quiet neighborhood. Perfect for visiting family.
2023-10-01,5.0,Stayed with kids,"Great place, great communication"
2023-10-01,5.0,Stayed one night,Very clean and wonderful place for our overnight stay. Everything we needed was available. The place was really surrounded by trees and I enjoyed the yard and deck. It was quiet. A real winner in Rolla!
2023-10-01,5.0,Stayed a few nights,I loved it
2023-10-01,5.0,Stayed about a week,We stayed in Rolla for a friend's wedding and used Shane's appartment as our homebase for a little over a week. The appartment offered everything we needed for our stay and offered the perfect place to relax in the evenings. Check-in and check-out were super uncomplicated. Thanks a lot for having us.
2023-09-01,5.0,Stayed a few nights,Was a great place to stay at. Close to the downtown area of Rolla. I would gladly stay here again.
2023-09-01,5.0,Stayed a few nights,Very clean and beautifully decorated house in a peaceful neighborhood. Had everything we needed for the stay. Host was very responsive and helpful. Would definitely stay again.
2023-09-01,5.0,Stayed a few nights,Great place! Peaceful & comfy. Felt right at home.
2023-09-01,5.0,Stayed one night,"Shane was a great host - quick to respond and very helpful! The place matched the description, was clean and felt safe. Would stay again if in the area. :)"
2023-09-01,5.0,Stayed one night,Great place big yard and nice deck with a grill out back
2023-09-01,5.0,Stayed one night,Excellent stay! Would definitely come back again.
2023-09-01,5.0,Stayed one night,"Convenient stay in Rolla off I-44. Easy to access, comfortable amenities, and smooth check in and check out. Would recommend!"
2023-08-01,5.0,Stayed one night,10/10
2023-08-01,5.0,Stayed a few nights,"Very clean, attractive space, close to the freeway as promised!"
