date,rating,note,review_text
2022-01-01,5,Stayed with kids,"This has been my personal favorite rental for our family of 5 (5 yr old, 3 yr old, & 7 month old)! The house is well stocked with basics and beyond. I'm a clean freak and I'm usually uncomfortable even in the nicest hotels but this house was high on my standards of clean. We were all very comfortable and the family trip was that much better because of having what we needed already there. My brothers live in the area and they were impressed with how well the house was stocked and said it's a nice, quiet neighborhood, which you notice right away. I'm familiar with the area as well since I've always come to visit them but now we have this option to stay in our own house since we've added to our family. Stores are close by, we went kayaking just minutes away, we visited Skydive Sebastian to watch skydivers landing with the kids... other than that the kids enjoyed the pool just about everyday. The beds are very comfortable. I really can't say enough positive things! We just hope it's available for us next year! Thank you Andrea 😊"
2022-01-01,5,Stayed with kids,"What a place, we will definitely come back."
2022-01-01,5,Stayed with kids,"Our family absolutely loved this place. The listing was accurate and pictures matched! The lay out was perfect for us, all one floor and kids could hang out in the TV room, and it was easy to keep an eye on them while we were the kitchen . Plenty of extra towels, fun pool toys, and extra things (blow dryer) on hand. Andrea was extremely responsive, proactively communicated and cared about all details. Will stay here again!"
2021-12-01,5,Stayed with kids,"Amazing house! Clean, great beds, nice kitchen, has all supplies we needed, fabulous pool, safe neighborhood, close to our favorite beach in Wabasso, close to Sebastian Inlet where you can see dolphins and manatees. Had a great holiday seeing family with my family and we always love Paradise Ice Cream close by. Can’t wait to stay at this house again! Andrea was an amazing host and always got back to me if we needed anything, which honestly we didn’t because this house has it all!!"
2021-11-01,5,Stayed with kids,"The home was beautiful, clean and comfortable. The pool was warm and inviting. We thoroughly enjoyed our stay. We would recommend it and look forward to staying again!"
2021-11-01,5,Stayed a few nights,Perfect stay!!!
2021-11-01,5,Stayed with kids,This home was perfect for a family staycation! The house is lovely well equipped and the heated pool was the cherry on top! We felt at home and enjoyed every minute of it. Bedding is very comfortable. We highly recommend to anyone who wants to have a good relaxing and quality time with family near the ocean.
2021-11-01,5,Stayed with kids,Excellent location and beautiful clean home. I will be back.
2021-10-01,5,Stayed a few nights,"Great host, great place. The whole booking and stay process was easy and smooth. Recommend to anyone staying in the area!"
2021-10-01,5,Stayed with kids,The best house ever seen. Super organized and clean. Beautiful and cozy home. We passed the best vacations days. We recommend this place as the best. Thanks to Andrea for offer us the best experience.
2021-10-01,5,Stayed a few nights,"Communication: EXCELLENT
Cleanliness: EXCELLENT
Location: EXCELLENT
Accommodations: EXCELLENT
Andrea & her home are just EXCELLENT!!
CAN’T WAIT TO VISIT AGAIN!!"
2021-10-01,5,Stayed a few nights,Everything was clean and as described. It is a beautiful house and a quiet neighborhood which we loved.
2021-10-01,5,Stayed with kids,"We really enjoyed our stay at this property with the pool area, open floor plan and accommodations. This is a very well kept home, and it fit our family of five perfectly. Andrea and her husband could not have been more kind and welcoming with many thoughtful touches which we appreciated after a long delayed trip. The master bath is spa like. It is a well appointed home in a great location. I can’t say enough about the patio /pool area, the comfortable set up and large kitchen."
2021-10-01,2,Stayed a few nights,"My family and I booked this property because it had stellar reviews. The house is absolutely beautiful to the naked eye, however the house had roaches. When we first arrived before we brought our belongings in, my aunt and I decided to spray and wipe down the house (just COVID preventative measures) and while we were doing this, we found a dead roach in the refrigerator. Shortly after that, a baby roach was crawling on the kitchen island. I sent a message to Andrea about this and she was quick to respond and apologized for this encounter.
She called me the next morning and I told her what happened. She replied saying it was most likely a water bug and that they never had an issues with roaches before. I assured her that it was a roach and she asked if I see another one, if I can catch it and hold onto it for when the Orkin rep come to the house. I thought this request was very unusual and inappropriate for her to ask me as her guest so I told her I will not catch the roach but try to take a picture.
The next day the Orkin rep came and treated/sprayed the property. Andrea’s husband also came to the house. My aunt expressed to Andrea’s husband that she was concerned about the possibility of bringing roaches back home. The day of our departure, as we were packing up, my aunt found a roach in her cooler. The same thing we feared, presented itself. I immediately sent another message to Andrea regarding this. Although quick to respond, her response seemed a bit dismissive: Andrea apologized once again and told me to read her stellar reviews because this has never been an issue. I completely understand that may not have been an issue in the past but many people are in and out of the property since it’s an AirBnB and being dismissive did not help the situation. Again, the house is beautiful to the naked eye and Andrea is quick to respond to inquiries, however I think it’s important for other people to know our experience. Please also note, we found roaches also in some of the kitchen drawers, near the garbage, and near the entrance."
2021-09-01,5,Stayed a few nights,Andrea's place was great. Super convenient location and quiet neighborhood.
2021-09-01,5,Stayed a few nights,Super clean and well equipped. Beds are super comfortable and pool was so refreshing. The kitchen was well stocked and the decor is adorable. We will definitely stay again. Highly recommend.
2021-09-01,5,Stayed a few nights,"I was so pleased when we arrived at the house. It was better then I expected. The house was furnished perfect, immaculate and every thing we needed and more was supplied. I would recommend this home to anyone looking to stay in sebatian."
2021-08-01,5,Stayed with kids,"Andrea is an excellent host! Great location for a quiet, low-key getaway."
2021-08-01,5,Stayed with kids,A must stay if you are in the area! The house is lovely and full of everything you need! Beds are comfy and sheets are soft. House has a really nice layout that is great for families. Full of everything you would need. Host was very responsive to all communication. Will definitely stay again if we go to Sebastian!
2021-08-01,5,Stayed a few nights,My family and i enjoyed our stay ! The pool was awesome and loved how the pool water was sea-salt. the overall house is beautiful ! We had an amazing time ! We definitely enjoyed the large kitchen to make meals and we all loved how the house was located not to far from the beaches ! This was an awesome stay after doing Disney this was awesome place to relax and enjoy family time! Andrea definitely was an awesome host and definitely communicated us quickly and easy ! We felt right at home
2021-08-01,5,Stayed a few nights,"Andreas place is absolutely pristine and beautifully decorated. Equipped with everything you need to have an awesome stay in the beautiful River town of Sebastian. The pool area is private and super clean. I didn’t get a chance to grill although there was a Beautiful grill on site. The beds and pillows were super comfortable.
I would definitely stay in this beautiful peaceful home again!"
2021-08-01,5,Stayed a few nights,"This Airbnb was perfect. Easy check in, responsive host. Quiet neighborhood that is close to everything. The pool is nice to relax in. I can't say enough about our experience here. We will definitely look to stay again."
2021-08-01,5,Group trip,"Beautiful home, easy to find and Andrea is an excellent communicator. House had everything we needed. Great Weekend."
2021-08-01,5,Stayed with kids,"My family and I were extremely surprised at all of the extra touches she had in her home. We were greeted with a bottle of wine and an abundance of towels. Our favorite part being from Colorado was how big the fans were in the home and the ability to control the temp ourselves because we are not use to the Florida heat. I also loved all the other little extras that were in the house such as (knives, pots, baking and grilling utensils etc...) The kitchen is a great size and the master bathroom is lovely and clean with lots of extras as well."
2021-08-01,5,Stayed with kids,We had such a wonderful experience! The house was in exceptionally clean condition and beautiful. Surpassed my expectation! Andrea was a great host and made sure we had everything we needed to feel at home. I would highly recommend staying here and plan to stay again in the future!
2021-07-01,5,Group trip,House was perfect had everything we needed and more
2021-07-01,5,Stayed a few nights,"This home is amazing! No picture can describe how beautiful this house actually is. It has everything you need legit everything, beautiful location, wonderful quality. It was so peaceful to stay there I highly recommend Andrea’s home you will be more than happy to stay there!"
2021-07-01,5,Stayed with kids,These pictures do not do justice!!! The house is so much prettier! Andrea added so much detail to the house. Everything you need is here! Which I was surprised because at other houses we had to buy bbq Utensils or hand soap!!! We were there a week and she checked in to see if all was good! Beautiful house to get!!!
2021-07-01,5,Stayed a few nights,"Truly an amazing house and experience all the way around! Andrea deserves the title of “super host”! If possible, I would have rated 10 ⭐️!!"
2021-07-01,5,Stayed with kids,"This place is very beautiful, well appointed and everything you need is available. You won't be disappointed. Host is great communicator and will resolve any issues immediately. Enjoy your stay in this immaculate state of the art home."
2021-07-01,5,Stayed with kids,Thank you for a fantastic stay in florida. We had an awesome time and a memorable trip. We are already talking about returning soon.
2021-07-01,5,Group trip,As stated earlier had a blast would book again kids had a blast and us adults relax and enjoy. beautiful home everything you need is there..
2021-07-01,5,Stayed with kids,"INCREDIBLE! AMAZING! There are no words….. you will NEVER find another house like this or another host like Andrea! This vacation was perfect because of the absolutely beautiful, clean, spacious home that Andrea provided! Every single thing you could ever need is already in this house! Not to mention, the house is decorated incredibly! The pool area is perfect! As beautiful as the pictures on the listing are, they DO NOT DO THIS HOUSE JUSTICE! My family and I never wanted to leave! Andrea will respond do you promptly with and questions or concerns you have, and is so gracious! Thank you, Andrea! We will be back!!!!! ❤️❤️"
2021-06-01,5,Group trip,"This house is everything you are seeing and more. Beach is an easy drive to the house and the house comes stocked with towels, cleaning detergent and soap and shampoo! Great place."
2021-06-01,5,Stayed with kids,Super clean! All basic supplies were provided. Excellent communication with the host any time we had any questions. 10ish minutes to food and shopping. Would stay again!
2021-06-01,5,Group trip,Place was amazing just like the add. Def will stay there again. 10-10
2021-06-01,5,Stayed with kids,"The house have everything you need ! So clean and comfortable! Very close to the beach , supermarket, restaurants! I have a wonderful time whit my family!"
2021-06-01,5,Stayed with kids,"Nice area, great home"
2021-06-01,5,Stayed a few nights,"We had a great stay here! Everything was as expected. The pool was wonderful and the house was very nice. Very quiet neighborhood and the pool area is very private! All in all, this was a great first Airbnb experience for me!"
2021-05-01,5,Stayed with kids,"My family and I stayed here for the memorial day weekend and we had such a great time. House was spacious, clean and had great amenities. We highly recommend this stay."
2021-05-01,5,Stayed with kids,"I had never booked an air bnb but this was definitely a great 1st for a newbie and someone who was very skeptical. Me and my family loved our stay from beginning to end. The place was clean , cozy and just as pictured. We will definitely return. I left behind a bag with some very important items in it and she messaged me not long after I left and infirm me. She then mailed my items , beyond pleased"
2021-05-01,5,Stayed a few nights,Nice clean home. Great quiet location.
2021-05-01,5,Group trip,"Beautiful place😍 very clean and the decoration was amazing. The host was very responsive. So much space. Highly recommended, we loved it."
2021-05-01,5,Stayed a few nights,Such a lovely home! The house had everything we needed for a perfect vacation. The best Airbnb I’ve ever stayed in!
2021-05-01,5,Stayed a few nights,Beautiful place! Nice location. Responsive host. Highly recommended! We will be back.
2021-05-01,5,Stayed a few nights,Such an amazing home!
2021-05-01,5,Stayed with kids,"This house was way above expectations. When we walked in we were very pleasantly surprised how clean and nicely decorated the house was. The amenities were fantastic from the pool, to the grill, to the big open kitchen and comfortable beds, everything was beyond perfect. The host was in communication with us the entire time. While we have stayed at other Airbnb’s this was by far our best experience. We already booked again! Can’t wait for our next adventure. I highly suggest you check this place out for yourself. You will be happy you did! With the free bottle of wine the host provided, it will just top off your experience!"
2021-05-01,5,Stayed a few nights,"Andrea’s place is perfect! Very private, clean, and comfortable! A
The perfect place for a restful and relaxing vacation!"
2021-05-01,5,Group trip,"You can expect a well maintained house with all you need, great responses to your needs and perfect location"
2021-04-01,5,Stayed about a week,Ideal stay for this area.
2021-04-01,5,Stayed with kids,I was reluctant at first bc it was a brand new listing with no reviews yet BUT This house is exactly as advertised and even more when you get there —so much space. Gorgeous master bedroom space and bathroom that’s on the other side of the house for “alone time” ;). The pool is deep enough and she even provided a variety of floaties that my 3 year old was able to use and safely enjoy the pool. It’s a very welcoming space and that bottle of wine waiting on the counter was a great touch :D
2024-06-01,5,Group trip,"Cary was an amazing host, friendly, and had plenty of places to refer us to. He keeps his place in impeccable condition, decor was spot on. also, the little things that he had in the home put it above and beyond.. will definitely stay there again..."
2024-05-01,5,Stayed a few nights,Great location
2024-04-01,5,Stayed a few nights,"Cary and Susan have created a great getaway. The location directly across from the river and within easy reach of restaurants and shopping was picturesque and convenient.
We were in town to visit family and this proved ideal. Cary and Susan were nearby and friendly but not at all imposing. We would happily stay again when visiting Sebastian."
2024-03-01,5,Stayed about a week,"This place is spectacular. Perfect location to walk to restaurants and entertainment. The views from the private dock and windows were spectacular. The beds were very comfortable and the kitchen is well appointed. Everyone we met was very friendly!
Cary is an amazing host and was very helpful in recommending restaurants and things to do in the area. We highly recommend this home and we’re looking forward to our next stay."
2024-02-01,5,Stayed with a pet,"Lovely house. Well appointed and clean and super comfy. Nice, helpful hosts with good tips for food and fun! Awesome walkability. Thanks for a great 2 months!"
2023-12-01,5,Stayed a few nights,"Visiting from the UK - this was a lovely airbnb which we would highly recommend. Super comfortable, well appointed, very clean and an absolute pleasure to stay in."
2023-12-01,5,Group trip,Beautiful home! Perfect location! Loved the awesome views out front and from the dock! Host was awesome! Quick walk to restaurants and entertainment spots! Loved everything about it!
2023-11-01,5,Group trip,"Beautiful views, watched dolphins from the porch."
2023-09-01,5,Stayed a few nights,"Thank you for the amazing stay in your lovely home, Cary! The airbnb was absolutely beautiful and Cary was an awesome host. We had a small issue that I didn't realize until somewhat late on a Friday night. I texted Cary around 9 pm and there was a handyman at the house 20 minutes later and the problem was fixed! He was incredibly responsive and helpful. Look no further for your stay!"
2023-07-01,5,Group trip,"After reading this home's reviews, I had high hopes for our stay. This beautiful home exceeded all of those! This place is really spectacular. It is very comfortable and beautifully decorated. The dock is great for fishing, and we saw two dolphins swimming under it on our first evening there. The beds are very comfortable. There are several restaurants within walking distance. Everyone we encountered was very friendly! The area by the river is great for walking in the morning or evening, with great sunrise and sunset views. Highly recommend this home. The host has done an outstanding job of providing everything to make this a comfortable stay."
2023-06-01,5,Stayed a few nights,"This is the loveliest B&B. It looked like we were the first people who ever stayed there it was so immaculately clean. Caught some fish off the dock, and enjoyed sitting down by the little beach area. Lots of great restaurants close by. Try the pizza from Earl’s Hideaway. Not intimidating at all."
2023-05-01,5,Group trip,The perfect house to stay in! It was close to walk to lots of restaurants and the little beach out front was perfect to sit and enjoy the sunshine.
2023-05-01,5,Stayed a few nights,Beautiful place with an awesome host!
2023-04-01,5,Stayed a few nights,"I can't say enough positive things about our experience....in short, the home is beautifully decorated, clean and comfortable. If given the opportunity, we would absolutely stay again."
2023-04-01,5,Stayed with kids,"A+++ You could not find a nicer, more stylish Airbnb or a more scenic, walkable riverfront location within many miles! We hope to return and would not consider another 3 bedroom, 2 bath accommodation that has absolutely everything you could want, including a great price. Many thanks."
2023-04-01,5,Stayed with kids,We had a great stay in Sebastian. Our son loved the little beach and the playground down the road. The home was cozy and just what we were looking for in a quick weekend away. It was also easy to cook our own meals as the kitchen is well equipped!
2023-03-01,5,Stayed a few nights,"First, we absolutely loved the ""river house"" because it quickly became our ""river home."" Cary and Susan were absolutely wonderful, communicative, and welcoming. We were in town visiting family with family and this home was perfect to sit on the beautiful Sebastian River, and play games and laugh in this beautiful space with our loved ones. Cary and Susan have created an elegant and tranquil home with everything anyone could possibly need. It was so nice to be conveniently close enough to walk to parks, restaurants, and it was especially amazing to have sunsets and sunrises on our front lawn/beach. Thank you Cary and Susan! We hope to be back sooner than later!!!!!"
2023-03-01,5,Stayed with a pet,This is the nicest AirBNB we have ever experienced! The view is amazing!! The beds are comfortable and the linens are very high quality. We were so lucky to find this place. The host greeted us personally and offered recommendations and answered messages promptly. Thank you so much!
2023-03-01,5,Group trip,Great stay! Cary was a great host.
2023-02-01,5,Stayed a few nights,Cary was a great host. The rental was very clean and comfortable. The view of the water was very relaxing. I had a wonderful time. It was worth every penny! Thanks.
2023-02-01,5,Stayed with a pet,Our time in Sebastian was fantastic! The place was so nice and the location was great. The view out our front door was gorgeous and very convenient to walk to several restaurants. Would highly recommend.
2023-02-01,5,Stayed with kids,"We were so pleased with our stay at the river house. The house was wonderful, and the location was out of this world."
2023-01-01,5,Stayed over a week,"We really enjoyed our stay. Cary was a superb host. He was friendly without being intrusive. We loved talking with him and sharing our adventures of the day. The house set up was perfect for us, on the ground floor. Beds very comfortable and bathrooms good size with all the needed amenities. Very well kept and very clean! Liked that it was easy to walk around, along the river, and to many restaurants and drinking establishments. Looking forward to a return visit. Thank you for providing a great place to stay!"
2022-12-01,5,Stayed a few nights,Gorgeous! Thanks so much for a great stay. Hope to be back!
2022-12-01,5,Stayed with kids,We took our annual family Christmas trip and Carey's Airbnb was amazing ! Beautiful view of the Indian river and the Airbnb was absolutely gorgeous! We had spacious bedrooms and bathrooms ! The kitchen had everything for us to cook large meals equipped with everything we needed . We spent a lot of time on the dock with a fire pit . We walked in the morning on the river walk right in front of the house . Had a wonderful stay this long weekend thanks for sharing your home with us !
2022-11-01,5,Stayed with kids,"This home was so beautiful inside and out. The bedrooms were very large. The living area was smaller but seemed fine as you had the benefit of a big table where other guests could sit. I was very impressed with the quality of all the items stocked in the house especially in the kitchen. They also had extra things that are not common in Airbnb’s shampoo, soap, detergent , trash bags, spices as well as cleaning supplies to tidy up on your stay. It was refreshing to see a place so clean and well taken care of. The dock was so pretty and peaceful. The location was nice and you could walk to many places.
The hosts were very nice, helpful and flexible. I would highly recommend this beautiful home if you are visiting Sebastian."
2022-11-01,5,Stayed a few nights,"Beautiful space, wonderful hosts, and unbeatable location. Highly recommend."
2022-11-01,5,Stayed with kids,"Pictures don’t do justice to this one — spotless home, well cared for, in a very convenient location. Cary and his wife ran into my mother and mother-in-law during our stay and could not have been nicer or more accommodating. Private dock with amazing views and an easy pace of life. If we are ever back in town we’d be so glad to book with Cary!"
2022-10-01,5,Stayed with kids,"Cary’s place was our best AirBnB stay to date. It was spotless, sophisticated and welcoming - we had everything we needed and more - just what we needed for a family trip to visit friends and family. Luxury touches (wonderful beds, linens, towels, TVs, nice cookware) were so appreciated by us - two tired parents of young kids! The hosts were easily available while respectful of our privacy. The location simply can’t be beat. We will be back for our next trip to Sebastian!"
2022-09-01,5,Stayed a few nights,Great location with amazing views. Host was super accommodating and friendly. looking forward to staying here again
2022-08-01,5,Stayed with kids,"This house is beautiful, the owners are nice and the location is great! Definitely recommend!"
2022-08-01,5,Stayed with a pet,"On a scale of 1-10, our stay was an 11. This house has everything: incredible waterfront location, very clean and well furnished, and very nice/attentive owners that were always available if needed.
I've stayed in a lot of BnB's and this one really stands out. First, the location is impeccable - very close to many waterfront restaurants and local attractions plus it has a direct view of the river. There is an easily accessible private dock to enjoy the water and watch the sunrise. I was very impressed with the quality of the linens and bed comfort. The house is stocked with all of the essentials for cooking, a dishwasher, AC that kept the house comfortably cool, full washer/dryer, fast Wi-Fi, and GREAT TV's with a wide selection of channels. I was on a family vacation and we felt like we were at home. Cary was incredibly helpful and attentive. I cannot recommend this property enough. I will absolutely be coming back!"
2024-06-01,5,Stayed one night,I was impressed by how large of a space we had. It was very clean and comfortable. I had a quiet peaceful sleep. I walked the neighborhood and it was fun to see the different trees and flowers. I liked the fish decor and painted wall.
