date,rating,note,review_text
2024-06-01,5,Stayed a few nights,"We did have a minor issue with the keypad when trying to get in when we arrived, but we finally was able to get in contact with one of the owners and she was able to reset the code for us. We were provided with a binder that had lots of information in it, which was very helpful.
The home is very homey and makes you feel right at home. The home was extremely clean and there was a lot of supplies in the home. I would definitely stay here again if I came to this area.
I would also suggest maybe putting televisions in the other bedrooms just a suggestion Just in case other guest kids or just want to be alone in the room to watch TV or movies."
2024-06-01,5,Stayed with kids,The home was a spacious and peaceful respite between outings; I hope we can book here again on our next visit!
2024-06-01,5,Group trip,"With the exception of the busy road and train close by there is absolutely nothing this property and/or host could have done better! Such a thoughtful and comfortable space-5 stars is not enough-Thank you
✨🌟✨🌟✨🌟✨🌟✨🌟✨🌟✨🌟✨"
2024-05-01,5,Group trip,Awesome house and very impressed with the host ! Fit all our needs for the wedding weekend ! Will def recommend
2024-04-01,5,Stayed with kids,"House like home
immaculate condition !
Home away from home at Sebastian, Fl! Our House stay by Lindsay and Erin was a lovely experience, the house was so spacious, super clean, and equipped with everything we needed. Convenient location and seamless check-in made it a perfect choice for a comfortable getaway. Complete warm hospitality in a private setting.
Our stay in private rooms by exceeded expectations. The hosts’ attention to detail and personalized service made us feel like we welcomed guests into their homes. The communication was perfect, everything went just smooth. We will be back with our bote, didn’t bring it this time because it was too windy to go out."
2024-04-01,5,Stayed a few nights,"The house is very cozy and comfortable. The game room was our hangout!
Lyndsay was excellent."
2024-06-01,5,Stayed with kids,"John’s Hidden Gem was just like the listing and a bit more actually. Comfortable clean place. Some board games, small iron and ironing board. Coffee for the morning. Plus a small fridge with something inside waiting for us that I wish all hosts would have… a Brita pitcher filled with cold water. It was so refreshing when we arrived and then I filled it up again before bed and we had cold water in the night and morning. It’s the little things. John thinks of those. Plus a Roku TV to watch your favorite streaming service. Neighborhood is very quiet and peaceful. John was a polite, professional, responsive host. Great stay."
2024-06-01,5,Stayed a few nights,Perfect for a quite get away.
2024-06-01,5,Stayed one night,Very happy with this stay! Very quiet and peaceful!
2024-06-01,5,Stayed a few nights,This little gem of a place was exactly what we needed for our weekend trip to Sebastian! Cute small one bedroom suite with lots of ocean-themed decor.
2024-06-01,5,Stayed with kids,"We had a wonderful stay at this beautiful guest suite! Everything was clean, the area was peaceful and quiet and the suite itself had everything we needed for a nice weekend away! We have family in the area and will definitely be back."
2024-06-01,5,Stayed one night,This is a charming place. King size bed is comfortable. Great for two people. Close to restaurants and the beach. I have stayed here before and will book again when I come to visit nearby family.
2024-06-01,5,Stayed one night,John was a great host. His place is very clean and had everything we needed. He allowed an early check in which was great. Bed was very comfortable. Would definitely come back!
2024-05-01,5,Stayed one night,"Perfect, really. Quiet, private place with everything you might want."
2024-05-01,5,Stayed one night,I appreciated John’s simple and concise instructions. We only stayed one night (about 12 hours) but it was a very clean efficient studio for a couple’s overnight needs! Would recommend.
2024-04-01,5,Stayed a few nights,"We enjoyed our stay, had questions that were answered immediately, we booked to stay while we visit for my daughters wedding and when we asked to check in a bit early so we can get our things in there before we rush to her wedding they allowed it. So thankful"
2024-04-01,5,Stayed a few nights,"John's place was a perfect match for the description. Very comfortable bedding, useful tourist directions, very smooth and fast communication. Perfect"
2024-04-01,5,Stayed one night,"John's place is stylish, super clean, very well equipped and in a convenient location close to everything. John is an awesome and proactive host. I would definitely book his place again."
2024-04-01,5,Stayed a few nights,"Great little place in a safe, nice neighborhood close to our friends and the quaint Sebastian area."
2024-04-01,4,Stayed one night,John was an excellent host. Made us feel really comfortable!
2024-04-01,5,Stayed one night,"We got accommodations on the same day, John responded quickly. An excellent accommodation, as shown in the pictures, even more beautiful. It has board games, coffee and water for your well-being.❤️ super clean place, I hope to stay here next time!"
2024-03-01,5,Stayed one night,"It is a cute, small place great for a couple. Nice to have car park right at entrance door. Not far to beach, restaurants or in our case, family."
2024-03-01,5,Stayed one night,"John was an excellent host, very responsive and helpful!
the place was perfect for my stay, would book again if i’m in town!"
2024-03-01,5,Stayed a few nights,"Cute little space with a very comfortable bed! Easy entry abs check out, close to a lot of good locations."
2024-03-01,5,Stayed a few nights,"John's place was perfect for our stay in Sebastian. The Hidden Gem was clean, cozy, comfortable, and quiet. John was very responsive and accommodating. We would stay there again when we're in the area."
2024-03-01,4,Stayed a few nights,Great pace and stay
2024-03-01,5,Stayed a few nights,We felt very comfortable. The furnishings are very tasteful and new. You are accommodated in a separate part of the house with its own entrance. It's a very safe and high quality area and neighborhood. We would come back at any time.
2024-03-01,5,Stayed a few nights,"Very enjoyable experience. First time booking an Airbnb and John was wonderful to work with. Very peaceful and clean. Definitely will be back when we visit Sebastian next year.
Thank you John!"
2024-03-01,5,Stayed about a week,John was super quick in responding to any messages sent to him. Place was clean and as described with no surprises. Never saw or heard any noises coming from the main part of the home and wouldn’t have thought anyone was even living there if not for a car parked in the driveway that wasn’t always there. Would recommend and probably will return if available next year. Thank you John!
2024-02-01,5,Stayed a few nights,"I enjoyed my stay, John was unobstrusive, yet responded in a timely manner everytime I messaged him."
2024-02-01,5,Stayed a few nights,John‘s AirBnB was wonderful. All super clean and well taken care of. Felt very comfortable right from the beginning. Quiet and safe location plus very easy to get to. Only 15 minutes away from the Vero Beach fairgrounds where we attended the Blues Festival. Lots of other great places close by. Would definitely recommend this place. Thanks again for the breakfast recommendation. Country Ham N Egg was spot on.
2024-02-01,4,Stayed a few nights,I was in too much of a rush when selecting this location
2024-02-01,5,Stayed a few nights,"This Airbnb was perfect! Clean, cozy and with a responsive host who helped us with beach suggestions, etc.
Highly recommend! Thanks John."
2024-02-01,5,Stayed a few nights,"John’s description of the suite was spot on, it definitely is a hidden gem. The neighborhood is very peaceful the suite has plenty of space. John was very friendly and communicative. We definitely appreciated the check-in folder with local recommendations, many good spots/restaurants around. Would stay here again in the future!"
2024-02-01,5,Stayed one night,Great place! Great host!
2024-02-01,5,Stayed one night,"Thank you, John for being a wonderful host! I’m sure we will see you again. 😃"
2024-02-01,5,Stayed a few nights,"Clean, convenient, and as advertised."
2024-02-01,5,Stayed one night,The listing is just as advertised and it is nice to have a place where you aren’t charged an enormous cleaning fee then be told to clean up. The room is spacious giving a bigger hotel suite type of vibe. Very quiet place and comfortable accommodations.
2024-02-01,5,Stayed one night,"John was a great host. 🌟 We came in around 9 pm and were able to privately enter with ease. His space was private, immaculate and exactly as described. The bed was comfy, shower pressure perfect and the cool water in fridge was a nice touch after a warm Florida day. Thank you, John! We will be back!"
2024-02-01,5,Stayed one night,"John's studio is just what I needed for a one-night stay. I would actually love to come back and stay longer. It is just right for one or possibly two people who don't need a huge space to be comfortable. nice neighborhood, and very convenient to shops, restaurants, and the beaches."
2024-02-01,5,Stayed one night,Place was as described. Great communication. Space was private with own bathroom. The neighborhood was quiet and I felt safe in the area and in this space. Will be back when in the area.
2024-02-01,5,Stayed with kids,John has a beautiful guesthouse which my son and I feel right at home. Awesome stay.
2024-02-01,5,Stayed with kids,The best experience staying in a place. Everything is sparkling and excellent communication. Additional host was super understandable and willing He helped us with everything we needed. I would stay as many times as needed.
2024-01-01,5,Stayed a few nights,I would recommend staying here and saving a lot of money staying at a hotel. Its close proximity to downtown Sebastion makes it a perfect place to spend a few nights.
2024-01-01,5,Stayed over a week,"Nice neighborhood convenient to shopping/restaurants.
Space was clean and well appointed. John was very helpful."
2024-01-01,5,Stayed one night,The place was wonderful. We had everything we needed for a comfortable stay. John was very responsive and pleasant.
2024-01-01,5,Stayed one night,We stayed one night and it was exactly what we needed. Peaceful neighborhood and clean room!
2024-01-01,5,Stayed a few nights,Extremely clean and quiet. Highly recommend.
2024-01-01,5,Stayed one night,"This is a great little spot in Sebastian, especially if like me, you’re looking for a comfortable place for the night (or two) when your campsite gets rained out! Super easy check in, very clean, comfy bed, big dedicated parking spot, and located in a very quiet lovely neighborhood. John the host even offered to help out when I had a migraine from the thunder storm. Thank you again!"
2024-01-01,5,Stayed a few nights,Very clean & comfortable!
2024-01-01,5,Stayed one night,"This was one of the cleanest room I've ever seen!
thank you for our short but nice stay!"
2024-01-01,5,Stayed one night,Thanks again for the stay at your beautiful place and for being so accommodating & responsive!
2024-01-01,5,Stayed a few nights,"Great place, looking forward to staying again in the future!"
2023-12-01,4,Stayed a few nights,Nice clean and simple place to stay. Water didn’t get very hot.
2023-12-01,5,Stayed one night,"Our stay at John’s was great! It was close to where we needed to be, super clean, and easy access. Would definitely recommend and will be returning!!"
2023-12-01,5,Stayed one night,"Absolutely perfect for sleeping, I could not move off that bed. I was just that that comfortable. self check in was very easy and simple and place was not hard to find we definitely recommend this to everyone and two beds for this price is very convenient."
2023-12-01,5,Stayed a few nights,"Our stay here was great! Quiet and peaceful, and very close to the activities we had planned for our time in Florida. Highly recommend!"
2023-12-01,5,Stayed a few nights,"John was very responsive, friendly and helpful! The Airbnb is well located in a calm living neighborhood in Sebastian and the place was super lovely – clean and nice interior design. It was very well prepared for our stay with coffee pods, mugs, wine glasses, towels and a variety of board games. There’s a coffee machine, microwave, small fridge, TV (with Netflix app), AC-unit and fans. The bed is big and comfortable, and there is great water pressure in the shower. I would highly recommend this Airbnb!"
2023-11-01,5,Stayed a few nights,"It was a very great experience and he always responded and made sure we was comfortable, would book again ."
2023-11-01,5,Stayed a few nights,"I was pleasantly surprised at how clean the unit was. Everything was exactly as pictured on the Airbnb app. John was easy to communicate with. I would definitely recommend John's place. If needed, in the future, I will most certainly be back to rent again."
2023-11-01,5,Stayed one night,"If there were 10 stars I would definitely give them 10 stars!
The place is lovely, with the kind of details travelers like us appreciate so much.
John had all the amenities listed and we were greatly grateful for the filtered fresh water in the mini fridge, nice good coffee, the games and gadgets in the closet, the space in general was great, clean and neat. Great communication with John! Super responsive and gave us local recomendations.
Definitely a great place to stay!"
2023-11-01,5,Stayed one night,"The house was very clean. it was a peaceful neighborhood, perfect for a vacation!!"
2023-11-01,5,Stayed a few nights,"Lovely home! It is a well thought out space and very clean. The street is quiet and peaceful. Location was perfect, very easy to get any place you need to go! John was a wonderful host and available if we needed anything!"
2023-10-01,5,Stayed a few nights,Thank you for the accommodations! This is a cute little studio apartment that was perfect. Close proximity to the beach and restaurants nearby.
2023-10-01,5,Stayed one night,"This place was perfect for us. It’s adorable, clean and close to where we needed to be. It’s a great deal and we will definitely stay here again when we are in town. Highly recommended 🤩"
2023-10-01,5,Stayed one night,Very cozy and just what we needed
2023-10-01,5,Stayed a few nights,John was great and the place was great!
2023-10-01,5,Stayed a few nights,"This was seriously a hidden gem! John was quick to reply to any questions I had. We booked this last minute and extended our stay, both of which John handled! I will definitely reach out to John again the next time I visit! And I’ll recommend it to all my friends and family."
2023-10-01,5,Stayed one night,Very nice and clean studio. We enjoyed very much.
2023-10-01,5,Stayed a few nights,Nice neighborhood and very clean.
2023-10-01,5,Stayed one night,"Dedicated parking spot 10 feet from private entrance, can’t beat that. Clean, roomy and great location for about anything in Sebastian. I’d definitely choose again."
2023-10-01,5,Stayed one night,Just what we needed 😊
2023-09-01,5,Stayed one night,"Such a great spot! John’s space was so cute, very clean and the bed was super comfortable. Close drive to restaurants downtown and easy to get to. John was was a great host and very accommodating. I will definitely be booking again with him soon. :)"
2023-09-01,5,Stayed a few nights,"Loved this place so much!
The photos were very helpful in getting there and it was the easiest Airbnb we’ve stayed in so far.
Such a small and peaceful stay, amazing price too! There was a little itinerary on stuff to do which we loved and used and they had board games which we also enjoyed a lot.
Very beautiful area and 100% would recommend and would go again!!"
2023-09-01,5,Stayed a few nights,"Johns place was perfect for my stay. Very clean, quite,and so much more reasonably priced then any hotel in the area. this will be my go to location when visiting my family in vero beach."
2023-09-01,5,Stayed a few nights,Exactly as described.
2023-09-01,5,Stayed one night,"Thank you , very nice place"
2023-08-01,5,Stayed a few nights,Thank you!
2023-08-01,5,Stayed one night,John’s place was perfect for my husband and I for one night while visiting family. Was easy to find and the photos were helpful with where to park/which door was ours. This is attached to another unit but has its own private entrance and we never heard the person next door. House was clean and had nice amenities. Does not have central A/C but the window unit and fan kept the place perfectly cool. Would recommend.
2023-08-01,5,Stayed a few nights,"Great place to stay while in Sebastian! Nice and quiet neighborhood, easy parking, good air conditioning!"
2023-08-01,5,Stayed with kids,"Great stay, clean house"
2023-08-01,5,Stayed one night,"Perfect quiet overnight in Sebastian, property was exactly as described. Plenty of space, clean and quiet."
2023-08-01,5,Stayed a few nights,"Simple, clean, and cute home. Instructions to check in and out are very easy and the area feels safe and peaceful. I recommend this place to anyone looking to stay in the area. 10/10!"
2023-08-01,5,Stayed one night,John was responsive and the suite is great. If you are looking for a nice place near all of the fun things that Sebastian has to offer then you have found the perfect place to stay!
2023-08-01,5,Stayed with kids,John's place was very clean and had a very home feel. I'll definitely recommend anybody to rent from him!
2023-07-01,5,Stayed a few nights,"John was a great host. Very quick to communicate and provided everything we needed to check in. He even offered local things to do and places to eat. The place was clean and looked like the photos. Here are a few pros and cons:
Pros:
• Comfy bed
• Clean and looked like photos
• Great water pressure in shower
• Close to restaurants & river
• Quiet neighborhood
• John was quick to communicate and available if we needed him
• Binder in room gives rules and things to do & places to eat - helpful!
Cons:
• No ceiling fan - had to use window A/C with floor fan by bed to keep cool during the night
• Only had Men’s 3-in-1 shampoo/conditioner/body wash so ladies bring your own.
Great stay! Thanks John!"
2023-07-01,5,Stayed one night,"super nice place, like the host, kind and helpful. easy check in thanks to the independent entrance. very quiet place, we spent a very beautiful night there."
2023-07-01,5,Stayed a few nights,Nice clean place very peaceful would definitely stay here again
2023-07-01,5,Stayed a few nights,"John, always has his place looking great. Good value, safe neighborhood, clean unit. This was my second visit there…looking forward to more."
2023-07-01,5,Stayed one night,Beautiful studio. Very clean and comfortable.
2023-07-01,5,Stayed a few nights,Thank you for letting us stay in your beautiful place. It was very clean and quiet. Very nice place to stay we will definitely be back.
2023-07-01,5,Stayed one night,We had a very nice time! It’s close to everything and has all you need. It was clean and safe. The bed is very comfy!
2023-07-01,5,Stayed one night,awesome
2023-06-01,5,Stayed about a week,"it was a amazing place with a beautiful home feel to it, the host was awesome and was there for any questions or concerns. the restaurants that were recommended were perfect! I'd definitely stay again! highly recommend if you want a nice getaway!!"
2023-06-01,5,Stayed one night,"Nice, clean, quiet place to stay."
2023-06-01,5,Stayed one night,Hidden Gem was exact what we needed. our host John was wonderful. We would definitely consider it again in the future
2023-06-01,5,Stayed a few nights,"Love coming here, it’s the perfect little space for a quick visit. John a great host, very responsive. The space was clean and quiet like always. Will definitely be back again! 10/10"
2023-06-01,5,Stayed a few nights,This was the perfect getaway for a weekend stay! Sebastian is a cute little town and perfect for unwinding. The Airbnb is close to beaches and was very clean & cozy
2023-06-01,5,Stayed one night,John was very friendly and responded quickly. The place was exactly as described and perfect for what we needed. The self check-in was very convenient since we got in late from a wedding. Would definitely recommend staying here!
2023-06-01,5,Stayed one night,"This is a beautiful guest quarters to stay in. Very clean, comfortable, affordable, easy to check in and John is responsive to all communication. Couldn't ask for a better spot to stay as we were traveling through Sebastian!"
2023-05-01,5,Stayed a few nights,Great stay! Nice neighborhood! Would stay again!
2023-05-01,5,Stayed one night,"I stayed for one night and the place was perfect. It's very neat. There is no stove but we didn't need it. The bed was comfy, temperature was good, easy parking, great instructions complete with recommendations of things to do and places to eat, and the shower pressure was good too! :)"
2023-05-01,5,Stayed a few nights,"Location and description were perfect. Everything was immaculate, and the bed was super comfortable. John was very responsive when we didn't know how to operate the key lock. He also suggested a great place for breakfast and coffee (in his welcome book). We, like one other guest, found the air conditioning a bit funky, but the fan helped. John's place is a great value."
2023-05-01,5,Stayed one night,"Great stay! Host is very nice and communicative. Check in was very easy, clean, comfy bed. Good shower pressure. Only thing to note is the AC is not the best, the air wasn’t distributed super well but there was a fan that you can use so it worked out. Everything else was great!! Super good value!"
2023-05-01,5,Stayed one night,Beautiful stay! Very peaceful and safe neighborhood. Perfect!
2023-05-01,5,Stayed one night,Perfect place for a quick work trip! It was cozy and a great location.
2023-05-01,5,Stayed a few nights,2nd time staying here .. just as great as the first stay. Did not disappoint!
2023-05-01,5,Stayed one night,It was great to spend our last night in Florida in a peaceful place. We were very content with not going anywhere after a fun time exploring all week.
2023-05-01,5,Stayed a few nights,"John is a great host. He provided clear instructions for a flexible and easy check in. The place was very nice and peaceful, and matched the description perfectly. There were even local food recommendations provided, which was a plus. I would definitely stay again in the future!"
2023-04-01,5,Stayed a few nights,The space was very clean and tidy. The surrounding area is quiet and relaxing. Restaurants are close to the property. The air conditioner is too noisy to let it run at night.
2023-04-01,5,Stayed one night,"John's place looks just like the photos, with beachy touches everywhere. Great value, quiet and peaceful. I would totally stay again. Oh! Plus netflix included lol"
2023-04-01,5,Stayed one night,"Cozy, Clean and Courteous with Fresh Towels."
2023-04-01,4,Stayed one night,"Cute little place, I loved that we could play games or go out. It was super clean and comfy to be in."
2023-04-01,5,Stayed one night,"John’s place was the perfect location! Close enough to the beach to get there, but avoid traffic. The space was comfortable and very clean! Great water pressure in the shower too!"
2023-04-01,5,Stayed a few nights,"I had a great stay. It was located in a great area, restaurants and stores very close. Very quiet neighborhood good for relaxing. Enjoyed meeting John he was very friendly. Highly recommended. Everything looked just like the pictures!"
2023-04-01,5,Stayed a few nights,Cute and clean little place not far from the beach and other shops/food. Would stay here again!
2023-04-01,5,Stayed a few nights,"Extremely beautiful and convenient place in a very quiet area. Checking in was easy, the private parking is very convenient, and the space itself is lovely - spacious, large bed, nice bedroom and living room. Would highly recommend!"
2023-04-01,5,Stayed a few nights,Perfect location for my needs and fulfilled tge description I read online. Than you.
2023-04-01,5,Stayed a few nights,"Good value, great interactions with John, clean unit, quiet and safe neighborhood. I look forward to staying there again. 5 stars all the way!"
2023-04-01,5,Stayed one night,"Was indeed a gem. Perfect
For me. Would stay again"
2023-04-01,5,Stayed one night,excellent place to stay! Highly recommend!
2023-04-01,5,Stayed a few nights,.
2023-04-01,5,Stayed one night,Thank you
2023-04-01,5,Stayed a few nights,We had a great trip. John place was exactly what we needed and comfortable
2023-03-01,5,Stayed one night,John was a great host he introduced him self no more than 10 mins after we arrived to make sure we were satisfy with the place. He responded quickly to emails and made our stay homie.
2023-03-01,5,Stayed a few nights,"Very accommodating, thanks John!! Clean, the most comfortable bed and a great neighborhood."
2023-03-01,5,Stayed a few nights,"Everything is perfect! Clean, quiet your host is very helpful! 100% recommended!"
2023-03-01,5,Stayed a few nights,comfortable quiet and clean
