date,rating,note,review_text
2021-08-01,5,Group trip,"Character, cleanliness, and comfort! This four bedroom house felt like home. Super comfortable night’s sleep. All in good working order, everything we needed in the kitchen, even snacks. A comfy living room for hanging out, smaller game or TV room upstairs, a nice touch. Within walking distance to restaurants and interesting local sites."
2021-08-01,5,Group trip,Great house and a great location. We certainly enjoyed our stay. Hosts were very nice and helpful.
2021-07-01,5,Group trip,This is a lovely older home with lots of character. It was absolutely immaculate. The bathrooms have been updated but maintain original features. We were able to easily walk downtown.
2021-06-01,4,Group trip,"The pictures don’t do this house justice. It is lovely, clean, well kept and comfortable. We rented it for a friends weekend getaway and were surprised at how spacious the house is. We had plenty of room to spread out. The shower was great and the floor plan is perfect for a group of friends or family. Looking for a reason to go back to St Joe to stay here again."
2021-06-01,5,Stayed with kids,"This house is beautiful and has so many architectural details and unique antique furniture! The house had plenty of room for our group of 8. I really enjoyed the selection of teas provided in the kitchen as well as the coffee pot and coffee! The kids had the best time with several games of hide and seek! My kids also loved the puzzles and books found in one of the sitting rooms. The beds were comfy, the table was big and capable of seating all of us at the same time, and the washer and dryer were greatly appreciated! The street noise was a bit loud, but nothing out of the ordinary for downtown cities. We had a wonderful time and really enjoyed our stay!"
2021-06-01,4,Stayed one night,"Floors were a little creaky, but expected with a older home."
2021-05-01,5,Stayed a few nights,This is a really cool place. HUGE. Four bedrooms (2nd floor) and plenty of living space on the first floor. Great parking right in front (handicapped parking is ONLY on Sunday).
2021-05-01,5,Stayed a few nights,This home is so beautiful and the host is wonderful. You will love your stay here!
2021-04-01,5,Group trip,We enjoyed our girl's trip! Plenty of room to spread out! Everyone loved the home. So much history! Will rent again!!
2021-04-01,5,Stayed with kids,They are awesome place to stay house is big and Donna is very professional I recommend this stay
2021-04-01,5,Stayed a few nights,The hosts were great !!!! Definitely a very nice Airbnb
2021-03-01,5,Group trip,It is an amazing place to stay everything was clean ..it was nice and quiet .
2021-03-01,5,Stayed one night,The house is so interesting. Historic details all over and the rooms were very comfy! The location was fantastic for walking.
2021-03-01,5,Stayed with kids,We enjoyed our mini vacation so much because we stayed at Zion’s place. The house was very warm and inviting. It was centrally located and had all the amenities you could ask for. The kitchen was very well equipped. The rooms were spacious and accommodated our family perfectly. It felt like home. We recommend the Zion place whenever your travels take you to St. Joseph MO.
2021-01-01,5,Stayed a few nights,Perfect place to stay for a group weekend getaway.
2021-01-01,5,Stayed a few nights,The Company that I work for Places us in Airbnb’s instead of Hotels. I travel all over the Midwest and have stayed in a lot Airbnb’s. Zions place is one of the nicest Airbnb’s I have stayed in. There is every amenity you could ask for. The Airbnb was spotless. The Host was very communicative !!!!!!! Definitely a five star host.
2021-01-01,5,Stayed a few nights,The host was very nice. The Airbnb was very nice. I would definitely stay here again !!!!!
2020-12-01,5,Group trip,"Great house in a great location! This house is warm and welcoming. There is plenty of space not only for sleeping, but there is comfortable space to enjoy hanging out together. The kitchen has all you need to make your meals and there are many special touched throughout the house that made our stay great!"
2020-12-01,5,Stayed with kids,House is beautiful. Very quiet . Off street parking. 2nd time staying here. Will stay here everytime we are in town if it is available.
2020-11-01,5,Stayed with kids,This house is nostalgic and a perfect place to gather your family. The large walk-in pantry was spacious and well stocked with a variety of dishes. Our granddaughters loved opening the various doors to see where this or that might lead. They especially loved tossing bath towels down the laundry shoot. The wooden floors were well maintained and lovely. Would come here again without hesitation.
2020-10-01,5,Group trip,Great place! Very safe and clean. Easy check in and location. Answered questions right away. Chocolate was a nice surprise 😍
2020-10-01,5,Group trip,Beautiful home with a quiet location near beautiful downtown! Very clean and has many amenities! Will definitely return if I'm in the area!!
2020-09-01,4,Stayed with kids,Wonderfully accommodating for our needs! We would definitely stay there again!
2020-09-01,5,Stayed with kids,"This is such a beautiful home! You can easily see the effort that they go to in order to keep the heritage of the place alive! Perfectly clean, even the basement where the laundry is :) Love this place so much!"
2020-09-01,5,Group trip,Very clean spot to stay
2020-08-01,5,Group trip,Wonderful old home. So it does creak. But gorgeous non the less. Spacious places for everyone to be in.
2020-08-01,5,Stayed one night,Everything was nice and the host were so sweet.
2020-08-01,5,Stayed one night,"Great house right in downtown! Clean and comfortable, you feel right at home and the hosts made everything simple and easy. Very responsive, and we loved our stay!"
2020-07-01,5,Stayed one night,Great place to stay.
2020-06-01,5,Stayed with kids,"Stay here!!! We’ve stayed in a lot of AirBnbs, and this one floats to the top of the list as a favorite. Our accommodations had fallen through in Kansas City, so we had to find something quick! These are the little adventures that make traveling such so memorable. This historic home is 100 years old, but refurbished beautifully down to the last detail. The glass doorknobs, the oak floors. Just gorgeous! It’s also a huge space for families to spread out. We have 4 kids and didn’t even use one of the bedrooms! Donna was so sweet to let us in and show us the closest pizza place, Geneo’s, which was delicious and within a 5 minute walk.
I had no idea there was so much history in this town, but I wish we had a day or 2 to explore the museums and the city. It looks so great! Little gems like this are what make AirBnbs so awesome!"
2020-06-01,5,Stayed with kids,Nice and quiet while we were there. Plenty of space. Very nice accommodations for our group of 8.
2020-05-01,5,Stayed one night,Very clean and spacious. Communication was excellent and we had zero problems.
2020-04-01,5,Stayed a few nights,Wonderful home!
2020-03-01,5,Group trip,"This is a cute old home that used to be for the pastor at the neighboring church. It's conveniently located near many restaurants and cafes, and yet is quiet and removed from traffic. It was perfect for us!"
2019-12-01,4,Group trip,Lovely old home with great character.
2019-12-01,5,Stayed with kids,Great location. Walking distance to 2 coffee shops and a dozen small businesses. House was clean and hosts had timely communication. Wifi worked well.
2019-11-01,5,Group trip,"Quaint well decorated clean home!! We had group of 5 ladies the home accomidated us quite well, as well as reports of comfortable beds!!"
2019-11-01,5,Stayed a few nights,Nice clean and historic place. Nice to not really have any nabors aswell
2019-11-01,5,Group trip,"Quick responsiveness on behalf of the host allowed our family to all be together during a last minute trip to St. Joseph. The home was spotless and had all the essentials we could need, and more. If we ever travel to St. Joseph again, we would certainly rebook this house."
2019-11-01,4,Stayed one night,Perfect spot for a small group getaway.
2019-10-01,5,Stayed with kids,Great place to stay. Great host. Loved the layout of this old house and even with one full bathroom 10 of us managed to get ready in time. Grandkids loved having their own room to play and the puzzles in it. I will book it again the next time I'm in town.
2019-09-01,5,Group trip,"Donna met us at the house to give us a key and a thorough tour of the house. This is a great space to accommodate a large group. Our family had plenty of room to spread out. The rooms were good size and the beds were comfortable. Although there was only one full bath, we were able to make it work. Even with all daughters getting ready to attend a wedding! There were plenty of towels, washcloths, and toiletries. The main floor living space was large and comfortable. Plenty of seating in the living room and dining room. The kitchen is well stocked with cooking essentials, and the coffee is provided!! There is a half bath on the main floor as well. Although the house is located in the older part of town, we felt safe walking to nearby amenities. There is a great little market just a few blocks away. We would recommend this place to others and and would likely stay here again, if we are back in the area. It would be a great place to host a family reunion or celebrate a holiday. Thank you Donna for thinking of the little things!"
2019-09-01,5,Stayed a few nights,Nice place!!!
2019-09-01,5,Stayed one night,Great space for a group! Will stay here again if passing through St. Joseph!
2019-09-01,5,Group trip,"I enjoyed the stay at the AirB&B with the amazing hostess Donna for helping me with the changed of my reservation dates and greeting me at the location, eventhough, when I was running a little behind schedule. I will visit here again. Thank you! Tanya"
2019-07-01,5,Stayed with kids,Beautiful historic home with great character! Donna and Betty were great hosts. Donna met us at the house to show us around and helped us find the nearest grocery. Our kids loved the playroom upstairs. The house was very clean and comfortable.
2023-11-01,5,Stayed a few nights,Such a unique place to stay! Great location.
2023-10-01,5,Stayed a few nights,"Really next to a Hugh park. A bit hard to locate in the beginning but once found, very secluded . No TV, but had Wi Fi. Bring own food. Walmart close by. Side by side refrigerator. Gas stove, did not use. Used microwave to heat water for tea, 2-3x/ day. Stayed 4 nights, 3 days. Visited many museums, saw mighty Missouri River. Highways made it easy to navigate the City .
Great place to visit, lots of 1900 history there. Get a St. Joseph,MO brochure with a map of City, at a Missouri rest area.
Had a electric heater and gas fireplace. Once sun went down, turned on electric heater shaped like a radiator. Kept us warm like 71 degrees.
Thanks Caroline, for a great visit. Lowell & Chery Jones"
2023-10-01,5,Stayed a few nights,Very comfortable and homey in historic carriage house apartment
2023-10-01,5,Stayed a few nights,Great place!!
2023-09-01,5,Stayed one night,"I enjoy staying in historical properties. This carriage house was charming and unique. I enjoyed walking around the property imagining what it might have been like a hundred years ago which is a favorite time period for me. It was very peaceful and relaxing.
I heated water for a hot drink, and enjoyed her lovely teapot and beautiful gas stove. Had we stayed longer and made meals for ourselves, we would have had everything we needed.
I appreciated the historical book about St. Joseph. It was very interesting to learn about the historic district, architecture, and fun facts about the city.
Photography is a favorite hobby, and I loved all the photo ops surrounding the carriage house.
I'm grateful this property was available. Thank you Caroline for sharing your home and being very gracious."
2023-09-01,5,Stayed over a week,I loved having the kitchen in the Airbnb. Saved me tons on cash on meals. Good place if you need calm surroundings and a place to relax on a work trip.
2023-09-01,5,Stayed one night,"This was a great stop on our road trip! Super clean, cozy, and Caroline was responsive and clear in directions. Definitely would stay again!"
2023-08-01,3,Stayed a few nights,"Stayed for 2 nights. Location is great next to Krug Park and trails nearby. Did hear quite a lot of honking from cars going through the tunnel leading into the park, but wasn’t too bad. I stayed when it was very hot and the window a/c had a hard time keeping the place cool, especially the bedroom. The place was very clean except for minor cob webs. Kitchen was great and supplies for cooking were provided. Bed was okay; could use updated pillows and comforter. Smelled a little musty inside. Stairs leading up to the carriage could use some lighting and maybe a porch light as it was very dark and sometimes difficult to make my way up the stairs. Overall it’s a good value for the price and host was very kind and clearly communicated."
2023-08-01,5,Stayed one night,"The pictures on the website matched the place itself, and everything was clean and comfortable! Also a very cool, historic place and town. Caroline put together a neat little book that gave the history of St. Joseph, and places to go. A very enjoyable stay, would definitely recommend!"
2023-08-01,5,Stayed one night,nice place....would stay here again
2023-08-01,5,Stayed one night,Great evening. Caroline was helpful in locating the carriage house. Follow the written directions as they are spot on! We saw a deer in the yard when we returned from dinner. Beautiful park-like setting.
2023-08-01,4,Stayed one night,"This is a lovely place to stay. Very secluded and peaceful. Right next to Krug Park, and near all the sights of St. Joe's. Caroline was a great host."
2023-08-01,4,Stayed one night,Loved the historic dwelling and peaceful location. Very clean and cozy
2023-07-01,4,Stayed a few nights,This was our second time staying and we enjoyed it. Caroline brought fresh towels halfway through our stay which was nice. Description is accurate and recommend for few night stay in St Joe.
2023-07-01,5,Stayed a few nights,I had a great stay at the Carriage House. Lovely setting and beautiful accommodations. I would definitely return.
2023-07-01,5,Stayed one night,Super cool experience!!! Very secluded and clean. If you are looking for a quiet spot that is great for many occasions this will fit that need.
2023-06-01,5,Stayed one night,"Caroline's Carriage House Henry Krug Estate property even more beautiful than the photos. We loved the historical grounds, furnishings, and literature. The bed was extremely comfortable. We also enjoyed that was near Krug Park. The only regret we had was that we couldn't spend more time at the Carriage House and St. Joseph."
2023-06-01,5,Stayed a few nights,"Mrs Caroline was very kind. She let us have our peace and quite but made it clear that she was there for all our needs.
We travel a lot and we stay in a lot of Airbnb’s but we try to at nice and beautiful places at a reasonable price and this was definitely one of those places and if I’m ever in St Joseph’s again I would definitely stay there again!!"
2023-05-01,5,Stayed a few nights,"I enjoyed my stay at Caroline's place. It was exactly what I needed for my weekend. I have family in the area, so I will look to stay here again on upcoming trips! Better than a hotel stay."
2023-05-01,5,Stayed a few nights,"We enjoyed our stay at the carriage house. It was clean, cozy, and peaceful. We loved information about the history of Krug Park."
2023-05-01,5,Stayed a few nights,"Had a wonderful stay. Very clean, quiet, and private."
2023-04-01,5,Stayed one night,"Wonderful place, thank you for sharing your space."
2023-04-01,5,Stayed a few nights,"Great Spot, quiet"
2023-04-01,5,Stayed a few nights,"I really enjoyed my stay at the Carriage house. I was there for a couple of days and unfortunatley was pretty busy while i was there so i did not get to enjoy the grounds much. But the grounds are beautiful and rustic. They extend very far back into the woods and are right next to the historic Krugg park. The place was nice and clean. It is really old so dont expect top tier luxury and a new asthetic. But it is very put together and cozy.
One thing to note which is not a big deal is that the park next door has an ampitheater. During my first night, I was pretty sure some teens were trying to have a rave there. It was noticeable but the house is old and blocks out sound pretty well so it didnt really interupt my sleep but be aware that it is there."
2023-03-01,5,Stayed a few nights,"This was a great weekend stay in a historic and peaceful setting. I met Caroline upon arrival and she was so friendly and her instructions were very easy to follow. Having grown up visiting Krug Park, I really enjoyed the location and opportunity to learn more about its history. Would certainly recommend!"
2023-03-01,5,Stayed a few nights,Really enjoyed being there.
2023-03-01,5,Stayed a few nights,Very private response feel welcomed
2023-03-01,4,Stayed one night,Great location and place. Very neat old building with monuments.
2023-01-01,5,Stayed one night,Cozy place. The host was very informative and pleasant. Recommended for anyone that needs a place in St Joe!
2023-01-01,5,Stayed one night,Caroline’s place made our family’s trip to St. Joe’s so wonderful! It was effortless to check in and she already had the gas fireplace going to warm the place up. Everything was very clean and stocked for our stay; having the extra portable heater in the January cold was so helpful too! Caroline is an excellent communicator and every response was kind and prompt. We would definitely love to stay here again the next time we come to town…thank you so much Caroline for taking such good care of us!
2023-01-01,5,Stayed a few nights,"The carriage house was a great weekend stay. The space is cozy and private, and the gas fireplace kept us toasty all night. A great experience overall."
2023-01-01,5,Stayed a few nights,Wonderful place to stay for our conference.
2023-01-01,5,Stayed a few nights,"This charming Victorian guest house was the perfect getaway for my husband and I! Caroline provided us with chocolate and coffee as a welcome. She also communicated with us very well about the home, check in, and check out. The home was very clean and kept. I would 10/10 recommend staying here!"
2022-12-01,5,Stayed a few nights,"This was our second stay here and it was just as we remembered. Great location, snug, and comfortable, and unique in a good way. The Christmas light show down below the hill was a wonderful bonus, as was the bottle of local chocolate milk. Thank you!"
2022-12-01,5,Stayed one night,"Cozy, little getaway! Very comfortable bed! Would definitely stay again!"
2022-11-01,5,Stayed one night,"This was a perfect day trip up from Kansas city with my mom. Check in was contact-less and easy, and communication was great. Caroline's place is beautiful, unique, and comfortable. It's situated on a hill with beautiful views from every window. We awoke to a beautiful sunrise. My mom and I had a great time exploring the grounds of the home, and the nearby park. It dipped below freezing at night and the fireplace kept the place warm and cozy. We can't wait to come back in the springtime when things are blooming in the park!"
2022-11-01,5,Stayed one night,"Super cute historical spot. I only got to stay one night, but I would have liked to stay more and explore the surrounding grounds."
2022-11-01,5,Stayed one night,Very relaxing and easy check-in & check-out. Great place to stay!
2022-11-01,5,Stayed about a week,Everything was perfect! Exactly as described! Above and beyond. Very comfortable.
2022-11-01,4,Stayed a few nights,Historic and charming carriage house. Beautiful estate with lovely grounds. Responsive and congenial host.
2022-10-01,5,Stayed a few nights,"The carriage house had one of the best beds I have slept on in an AirBNB. The grounds were gorgeous, the place well-appointed, and it was so comfortable and quiet. I would definitely stay again."
2022-10-01,5,Stayed a few nights,Nice bit of history in a peaceful setting thanks Caroline
2022-10-01,5,Stayed a few nights,Very Pleasant and Peaceful. Cozy
2022-10-01,5,Stayed one night,"My friend & I just gushed about this quaint & cozy stay.. clean & tastefully decorated and enjoyed the history! Well done & thank you for sharing, Caroline!"
2022-10-01,5,Stayed one night,Nice place to stay to explore St Joseph. Went for a morning walk in the adjacent park. Ate pizza at the host recommended pizza place. Toured the Pony Express museum.
2022-09-01,5,Stayed one night,"Caroline was extremely accommodating and willing to work with me on last-minute, unexpected changes! It was a pleasure staying at the carriage house and would definitely do it again/recommend the experience to others!"
2022-09-01,5,Stayed one night,"Nice quiet place to stay. Full fridge and stove, which was helpful because we arrived late and needed to fix something to eat. Just note this is an 1800 carriage house, so yes it is older, but clean and quaint. There are steps up to the apartment. Great communication with host!"
2022-09-01,5,Stayed a few nights,Wonderful location and very accommodating hosts. They went out of their way to make sure we had what we needed.
2022-08-01,5,Stayed a few nights,"This carriage house is lovely, and the host really great. It's quiet and private in a lovely setting. It was so nice to have a kitchen and a comfortable bed. Thank you!"
2022-08-01,5,Stayed one night,"Really enjoyed the tucked away remote feeling and the chance to get some fresh air in the garden while able to access conveniences within a couple of miles. Leaving a list of suggested places to eat, get coffee was perfect for us and was very helpful. The host had excellent response time with any correspondence."
2022-08-01,5,Stayed a few nights,Great place with a great host. Always available and very nice person
2022-08-01,5,Stayed one night,What a great location for a weekend stay. Secluded and beautiful. We will definitely stay here again if possible!!
2022-08-01,5,Stayed a few nights,"This is a great place, nice and private guesthouse with great AC! I would recommend, way better then a hotel"
2022-07-01,5,Stayed one night,"A very unique place to stay with wonderful host built in the late 1800s surrounded by beautiful gardens. We loved staying there. Fully modern bathroom, full size fridge and stove, small dinning room table, and comfortable couch and bed. Plenty of room for a comfortable extended stay. Be aware there is no TV as well as stairs to climb to get the guest house and there is no central heat and air. Staying in the middle of July ment the window air conditioner unit was a bit loud trying to keep up with the heat. I'm greatfull it was there and considered it a small price to pay for the comfortable and interesting experience."
2022-07-01,5,Stayed a few nights,"Amazing house, such a beautiful place to stay while in town. Everything was as advertised, such great hosts. a++++"
2022-07-01,5,Stayed one night,Very quiet and surrounded by large mature trees on the property.
2022-07-01,5,Stayed with kids,Stunningly beautiful location with a fascinating history. Getting up early and walking the grounds if this amazing estate was one of the highlights of our entire trip. The carriage house itself is lovely and very clean. It was just the escape we needed! Can’t recommend out enough!
2022-07-01,5,Stayed one night,"Caroline’s space is clean, well stocked, and secluded. It had everything we needed for our stay. The property is beautiful as well - you don’t really feel like you’re in St. Joe."
2022-07-01,5,Stayed one night,"Caroline's instructions were precise and on point.
The historic carriage house is a unique home. Antique, beautiful, and well-maintained architecture.
The atmosphere is calm and relaxing.
The house is entirely private from the main house. I enjoyed the total privacy.
The drive from the main street to the house is delightful; makes the house feel secluded and a hidden gem in the middle of St Joseph.
Comfortable bed and clean bathroom."
2022-06-01,5,Stayed a few nights,Amazing scenery and ambiance to the property. really enjoyed my stay plan to stay again !
2022-06-01,3,Stayed one night,"We appreciated Caroline's allowing us to check in early, so we had plenty of time to see the Pony Express Museum -- which was outstanding. The cottage is clean and beautifully located, and the description is accurate.
Our one major concern stemmed from a sensitivity to odors that other tenants might not share. The cottage -- because of age and having been closed during the unseasonably hot weather that we experienced -- had a musty smell (like many older houses) that we couldn't shake. The window air conditioning unit helped, and we left the door and windows open until the bugs discovered us."
2022-06-01,5,Stayed a few nights,"Such a unique place! I enjoyed my experience and will definitely be staying again.
Very clean, organized, simple check in, great communication. Secluded and secure."
2022-06-01,5,Stayed a few nights,"This is a gorgeous Air BNB on beautiful grounds. Caroline is a wonderful host who helped us so much when we had some problems, she was very responsive to us. I hope to return someday, and I highly recommend the Carriage House Airbnb."
2022-05-01,5,Stayed one night,"Caroline was a perfect host. The setting was amazing. Made you want to stay for weeks.
This is a special historical place that has everything you need for a comfortable stay."
2022-05-01,5,Stayed a few nights,"The Carriage House was very nice, and I really enjoyed my stay. Would definitely stay here again!"
