date,rating,note,review_text
2024-06-01,5,Stayed one night,Very cute place! A hidden gem for sure
2024-06-01,5,Stayed a few nights,"Absolutely beautiful estate and grounds! Extremely peaceful, safe and quiet! Lovely family host!"
2024-06-01,5,Stayed one night,My second stay here. It is charming and I love it.
2024-05-01,5,Stayed a few nights,"This place was perfect. Easy to find and get into and very private and peaceful. Caroline was a fantastic host
This would not be a good place to drive a truck and trailer into. A regular truck or other vehicle is fine but a trailer would be very difficult to turn around in!"
2024-04-01,5,Stayed a few nights,"I came for a writing retreat. I needed a quiet place to write and work. This is the ideal location. The scenery is beautiful. The place gets wonderful lighting during the day. It was clean and the bed was very comfortable. It is a historic home, so if you don't appreciate the charm and traits of such, this will not be the place for you. Unfortunately I had to cut my trip short, but if I get the chance, I definitely plan to return."
2024-04-01,5,Stayed a few nights,"Caroline was a great host. She even brought a TV up for us to watch during our stay. The carriage house is clean and feels very private even though you’re right behind the main house. The property is awesome and has lots to look at. Not far from the downtown area, about 10 minutes. I would highly recommend this spot if you like unique stays with a lot of history."
2024-04-01,5,Stayed with kids,No complaints & we had a great weekend.
2024-04-01,5,Stayed one night,Caroline was a great hostess and very understanding. Would stay here again!!
2024-04-01,5,Stayed a few nights,Great place to stay in St. Joseph...such a peaceful and cozy getaway. Highly recommend!
2024-03-01,5,Stayed a few nights,Cute spot close to downtown. It felt a little bit like the Cotswolds. Enjoyed our stay.
2024-03-01,5,Stayed a few nights,"The place to stay in St joe! This is a beautiful apartment which apparently was the old carriage House on the property. It was quiet, peaceful and just lovely!"
2024-03-01,5,Stayed one night,"Caroline’s place is a wonderful place to lodge. We enjoyed the comfortable accommodations; the fireplace was particularly cozy on this chilly Saturday. The reading material was appreciated (historical information about the Carriage House and other interesting architecture around St Joseph), even the inside of the bathroom door provides interesting reading.
We took advantage of the sunny afternoon and walked around the grounds. Early spring flowers were in bloom all over the grounds.
All in all, a great place to stay."
2024-02-01,5,Stayed a few nights,Nice little private place on beautiful grounds. Waking up to hear all the different birds was one of my favorite parts of Caroline is extremely nice and an over the top host who made sure my stay was pleasant. Thank you!
2024-02-01,5,Stayed a few nights,It was just what I was looking for
2024-02-01,5,Stayed one night,This was such a beautiful magical little gem! Caroline was so thoughtful and responsive! I love this quaint little cottage!
2024-01-01,5,Stayed a few nights,"Great carriage house. There was no TV and so they put one in for my stay! The weather was bad so they met
E when I arrived late. Even helped me get inside. So friendly and a beautiful place. Highly recommend!"
2024-01-01,5,Stayed a few nights,"Quiet with pleasant ambiance in the winter. The gas fireplace used for heat offered flickering light in the bedroom. Perfect to disconnect, simple decor. Worth staying at instead of a hotel: less expensive, less noisy, more privacy, complete kitchen for light meals."
2024-01-01,5,Stayed one night,"Amazing place to stay. Very peaceful, private and beautiful. We wish we could've stayed longer!"
2023-12-01,5,Stayed a few nights,"Amazing place, very neat and tidy when I was there, beautiful surroundings and Caroline was extremely nice during our stay, would 100% come back again."
2023-12-01,5,Stayed one night,"Charming property rich in history and character. Rental was comfortable, spacious, quiet, safe and secure. Temperature was easy to adjust and control with actual flames from the gas fireplace which added ambience. Linens and towels were all fresh and spotless. Great place when you need to relax and unwind."
2023-12-01,5,Stayed one night,"Lovely experience. Everything exactly as described. Clean, comfortable, cozy."
2023-11-01,5,Stayed one night,"This is my 2nd time staying in Carolyn's beautiful carriage house with my mom around Thanksgiving and it remains one of my favorite airbnb stays. The home is s cozy and relaxing that we instantly felt comfortable there. The grounds and nearby park system are magical. check in was easy, communication excellent. I hope to return again next year!"
2023-11-01,4,Stayed a few nights,"Such a lovely and quaint setting! We really enjoyed the quietness, gas fireplace, great park to walk in nearby."
2023-11-01,5,Stayed a few nights,"We had a great time staying at this location. The grounds were beautiful, awesome trails and quiet area. Caroline was responsive and a great communicator. Would stay again!"
2024-06-01,5,Group trip,this house is much better than I expected. It's a great mansion. Highly recommended
2024-06-01,5,Group trip,We had a wonderful stay at the Painted Lady. The house was full of character and so comfortable for everyone in our family! We couldn't have asked for anything more.
2024-06-01,5,Stayed a few nights,Beautiful property
2024-05-01,5,Group trip,We had a wonderful weekend staying at this property! It was perfect for our family and our needs. Absolutely beautiful home!
2024-04-01,5,Stayed a few nights,"The house and it's host we're amazing! I'm glad to have chosen this place to stay, and she was always communicating with me about what to expect when I got to the house, as well as a few recommendations for food places. The host and co-host are extremely nice and friendly."
2024-03-01,5,Group trip,"This is our second stay in 6mo. We love staying here. Beautiful home inside and out. Everything you need. Comfy beds and lots of them! Lovely kitchen to make your own meals.
We would love to stay here again in the future."
2024-03-01,5,Stayed with kids,Everything was fantastic and Kristen is the best host.
2024-03-01,5,Stayed a few nights,It was such a pretty place and we enjoyed having the entire house to oursleves
2024-03-01,5,Group trip,"Kristen did a fantastic job as a host! She was very responsive to any questions or requests during our stay. She was proactive about letting me know about a boil order due to a water main break in the town. the house is huge, clean, and very cozy, and we were able to feel right at home there! I will definitely work with Kristen again if the opportunity presents itself!"
2024-01-01,5,Group trip,"If you’re looking for a weekend getaway in a beautiful historic home, this is your location! Beautiful decorations, lots of amenities, perfect for our girls weekend!! Lots of corners to go have private conversations or even time to be alone and read a book if you wanted. Plus Kristen was a pleasure to deal with! Very accommodating and friendly! Definitely recommend and will be back!!"
2024-01-01,5,Group trip,Kristen has an absolutely beautiful home! The original wood and pocket doors along with the decor set this house way beyond the others. Her rates are great deal compared to others in my opinion. She was fast to respond if we needed anything and super friendly. She offered everything we could possibly need inside the home which was great. The house has a great location too. We tried some of the local restaurants and were very impressed. Also just down the road from a super cool Axe throwing and lazer tag place. We highly recommend renting from Kristen if you're coming to the area. We will be renting from her again for sure!
2024-01-01,5,Group trip,Cool place to stay
2024-01-01,5,Stayed with kids,"Beautiful, historic home that’s full of character and with plenty of room! Worked great for our family."
2023-12-01,5,Stayed with kids,Great Airbnb. Beautiful home with tons of character!
2023-12-01,5,Group trip,The Painted Lady is a beautiful home with lots of room and everything we needed. We'll be back to stay again!
2023-11-01,5,Stayed a few nights,Great accomodations. Kristen was a great host who went out of her way to make our stay as comfortable as possible. My family had a great time. A++
2023-11-01,5,Group trip,beautiful old home with period furniture. baths were nice and there is lots of room. beds were comfortable and kitchen well appointed.
2023-11-01,5,Stayed a few nights,Kristen was very kind and helpful from the start. The house blew us away. It was absolutely stunning! We will be staying here again.
2023-10-01,5,Stayed a few nights,This place is STUNNING! I can’t wait to come back!!
2023-10-01,5,Stayed with kids,"Kristen's house was beautiful! We had a very pleasant stay in her gorgeous, historical home. There was plenty of room for our family and we loved staying in this St. Joseph gem!"
2023-10-01,5,Stayed with kids,"Lovely and very large home, filled with beautiful antiques. The house was really incredible,and Kristen was a friendly responsive host, trying to make sure we were comfortable. It was a good location for our needs, as well."
2023-10-01,5,Stayed a few nights,Beautiful place. Wish we had stayed longer to enjoy it. Loved all the character of this 130 year old home. The host was extremely prompt and easy to work with.
2023-09-01,5,Stayed with kids,"We really enjoyed the charm of the Painted Lady with its interior furnishings matching its rich history in St. Joseph. Also the house was so clean, beds were very comfortable, and the large kitchen was great for our extended family. One of our favorite places at the house was the large porch were we spend numerous evenings visiting with family and enjoying the wonderful fall weather. Kristen anticipated our needs and had instructions on how to operate everything from ceiling fans to washer and dryer. We really appreciate the opportunity to stay at this house. Kristen has done a wonderful job making it attractive and comfortable for visitors."
2023-09-01,5,Group trip,"Our 2 night stay went great. We had 6 adults with only 1 couple so we used all bedrooms. Very clean and comfortable. The history and decor of the house is a bonus! We enjoyed the gas range and eat in kitchen for meals and game night. The porch has a swing and some chairs with shades-great place for morning coffee. Also a beautiful flower garden and a drive way for off street parking. Friendly helpful notes around house were very nice. And great communications before check in, during stay and after checking out. Plenty of room for all! Every room has a little detail to it that makes you smile. We will definitely be back as we stay in St Joe quite often!!!!!"
2023-09-01,5,Group trip,She went above and beyond for our accommodation. Place was great and well equipped.
2023-08-01,5,Stayed with kids,Beautiful well-kept house. The owners took extra effort to make it feel like a home. They also had very interesting information on the houses 100+ year old history. My kids and I enjoyed learning its history.
2024-06-01,5,Stayed a few nights,We really enjoyed our stay here. It was quiet and we enjoyed relaxing on the deck at night. We had a party of 21 people and there were enough cabins to accommodate. Thanks again
2024-06-01,5,Stayed a few nights,A wonderful getaway! One of the best airbnbs I've been in for the price. Reminded me of the smell of a cabin in the forest. Hot tub was great and we enjoyed the games they had. Really big kitchen.
2024-06-01,5,Stayed with kids,We enjoyed our stay at this unique cabin!
2024-06-01,5,Stayed one night,highly recommend awesome cabins beautiful view quite clean spacious cabins amazing stay comfortable beds
2024-06-01,5,Stayed one night,"This is my third time staying with Anthony. It is champagne accommodations on a beer budget! It's a beautiful spot. Quite, peaceful lil get away that is always clean fully stocked and communication is a 10. if it's your first time it's possible I would recommend arriving during the daylight just because it's easier to navigate it's pretty dark out there being that it's away from the city. that being said Anthony does give amazing instruction on how to get your check in accomplished"
2024-06-01,5,Stayed with kids,We enjoyed our stay at this quaint cabin right on the river - peaceful and quiet and had everything we needed. Very comfortable and the host was responsive and helpful!
2024-06-01,4,Stayed a few nights,"The only thing I didn’t like about this cabin was that your neighbors are literally on top of you! If you try to take a bath the construction workers next door are right out your window smoking & talking from the living room you can see into the living room of the condo below from the skylights which would creep me out if I were below and then walking back and forth from your door to the parking lot you may encounter the guy in the red truck who has a bit of an attitude, or the ppl smoking on their front porch in the dark so as long as your not looking for private this spot is amazing!
The cabin is done in wood and I love that the bathrooms are small but very nice with a beignet and wonderful tubs! The ac is a little strange but it works ok and they have fans everywhere so with the both it’s ok.
We were unable to find the kitchen lights so that was a bit of an issue and the Wi-Fi was horrible bring you own Wi-Fi box if you plan on watching anything."
2024-04-01,5,Stayed one night,"It was so worth it, very beautiful place .😍"
2024-04-01,5,Stayed with a pet,Peaceful upstairs cabin with plenty of space for our family of four! Loved the big tub and our view of the Missouri.
2024-04-01,5,Group trip,Had a great stay at the Boho Loft. Very peaceful area with a view of the river. Would stay here again.
2024-04-01,5,Stayed a few nights,We loved our stay! It was easy to find and the views are amazing! Close to the casino (which my husband loved). The neighborhood was quiet and we slept great! The space was clean and beautiful! St Joe is our favorite vacation spot and we will definitely be staying here when we come back!
2024-04-01,4,Stayed with a pet,Great spot on the Missouri River to see beautiful sunsets. Comfortable king size bed. Enjoyed the peaceful evenings and close to town also
2024-04-01,5,Stayed a few nights,"we loved this place... everything was just as it was pictured... river view was beautiful, house was comfortable and clean... definitely plan on returning"
2024-03-01,5,Stayed one night,Came for a relaxing night and was not disappointed. Views of the river were amazing and boho loft was perfect. Will definitely stay again!
2024-03-01,5,Group trip,I absolutely adore this place
2024-03-01,5,Stayed one night,It's a very nice and peaceful place to stay at. I would definitely stay here again!
2024-03-01,5,Stayed with a pet,Great place to get away for the weekend.
2024-03-01,5,Stayed a few nights,"Awesome place! Great communication, great amenities"
2024-03-01,5,Stayed with a pet,We stopped for 1 night on our way to Lake of the Ozarks and it was just what we were looking for. Much nicer than staying in a hotel room. I was transporting a boat and felt safe leaving it parked out front. We travel with our dog so appreciated it being pet friendly. Would definitely stay here again if traveling through the area.
2024-03-01,5,Stayed with a pet,"Very beautiful place! Cozy, comfortable, and a beautiful view! Anthony was very responsive and friendly. Would definitely go back!"
2024-03-01,5,Stayed one night,"Stunning views of the Missouri River from this very nice cabin directly on the waterfront. The Bo Ho loft is absolutely adorable, very private and cozy. We are looking forward to visiting again in the summer"
2024-03-01,5,Stayed with kids,Really peaceful place everyone was really nice there too. I highly recommend it.
2024-03-01,5,Stayed one night,Cute place. Nicely furnished. Would definitely stay here again
2024-02-01,5,Stayed one night,Great place
2024-02-01,5,Stayed a few nights,We had such an amazing time here!!! Super relaxing and peaceful! Can’t wait to go back!
2024-02-01,5,Stayed one night,Anthony's place was a just as described. He's super he's to work with and well worth the price.
2024-02-01,5,Stayed one night,Such a unique and beautiful cabin!! The beds and couch were very comfortable! So spacious and nice throughout!
2024-02-01,5,Stayed a few nights,Will definitely be back. It was very relaxing and loved the layout. Very cool place!
2024-02-01,5,Stayed a few nights,We came for a quick getaway from KC and this place did not disappoint. Great location right on the river and close to downtown St. Joe. The house feels very cozy with plenty of room to spread out. I would definitely stay again.
2024-02-01,5,Stayed one night,"Loved the boho room and jacuzzi tub! Wonderful place, very happy with the stay :)"
2024-02-01,5,Stayed with a pet,My family and I had a great trip! The place was stunning and it was perfect for our needs!
2024-01-01,5,Stayed with kids,"The unit we stayed in was very interesting.
I got turned around in it a few times lol.
I felt like every time I started looking around I found a new room! The view of the Missouri River while taking a bath was so cool!!!
I would say the water could be hotter or a larger hot water tank.
I would come again, really fun with the cabin feel. I would recommend it."
2024-01-01,5,Stayed a few nights,Great place! Easy check in and out.
2024-01-01,5,Stayed with a pet,"Because of a family funeral, we stayed in a couple of Anthony's places. They were both wonderful, and we would definitely recommend these to anyone coming to Saint Joe. I left a little more detailed review on the other cabin, but I definitely would stay here again! And actually, plan on it! Highly recommend it!"
2024-01-01,5,Stayed one night,He was quick with responses and friendly
2024-01-01,5,Stayed one night,Anthony’s place was fantastic. Nice secluded space with a beautiful view of the river. The jacuzzi tub was great and the bed was extremely comfortable. Will definitely stay in the future!
2024-01-01,5,Stayed with kids,"We had a great experience at this residence . We really appreciate the quick response on the last minute booing request. Everything about the location and house was great. My kids were very excited to be there and wanted to stay “forever” :)
We cannot wait to visit again with my in laws . My parents also loved the pictures we sent and would love to visit there as well . Thanks for the great experience."
2024-01-01,5,Stayed one night,Absolutely phenomenal couldn't ask for anything better
2024-01-01,5,Stayed a few nights,"Amazingly beautiful place to stay, wish we could’ve stayed longer"
2024-01-01,4,Stayed with a pet,Amazing views!!! Very rustic and beautiful place. I will be looking forward to revisiting this beautiful property.
2023-12-01,5,Stayed a few nights,Was extremely happy with the experience all the way around very helpful and friendly house was clean and in a great location if u don’t want to be down town
2024-06-01,5,Stayed a few nights,The place was awesome for what we needed. It was very clean and homey feeling
2024-06-01,5,Stayed one night,We stopped in St. Jospeh on the way to Montana and booked this duplex last minute the day off. It is in a great location and is well stocked. Everything was exactly as described. The communication was excellent and timely. Much better than staying in a hotel! We had a great stay! Book it!❤️
2024-06-01,5,Stayed a few nights,Jessica is a wonderful hostess. She was always responsive when I messaged her. We would definitely stay at her place again!
2024-06-01,5,Stayed a few nights,"we loved our stay. prompt responses and easy in and out. Everything was spotless and clean. Very thankful for the snacks, coffee, and bottled water."
2024-06-01,5,Stayed a few nights,Jessica's place is clean and very comfortable with great amenities. Neighborhood was peaceful but still close to the major roads so it was easy and quick to get around. We had a wonderful stay and would certainly stay there again if visiting St. Joseph.
2024-04-01,5,Stayed a few nights,Good
2024-04-01,5,Stayed one night,Thank you for the short turn around
2024-04-01,5,Stayed one night,Very nice place
2024-04-01,5,Stayed a few nights,"very nice, clean home. rooms were spacious and one of them had a balcony perfect for a morning coffee"
2024-04-01,5,Stayed a few nights,Very nice place to stay!
2024-04-01,5,Stayed with kids,Jessica was an extremely gracious host!! We enjoyed our stay and everything was as described. Highly recommend!!
2024-04-01,5,Stayed with kids,"Will definitely be staying again when visiting St. Joseph! Peaceful, feels like home perfect for a small family!"
2024-03-01,5,Stayed a few nights,Jessica was a great hostess. She responded quickly right after reservations. communicated with me about the code and what was expected.
2024-03-01,5,Stayed a few nights,There's nothing like going somewhere and it's feeling home like. The house was spacious. Everything was clean and nice. absolutely loved it!
2024-03-01,5,Stayed one night,Nice place and easy to find. Had everything we needed to make it a comfortable stay..
2024-03-01,5,Stayed a few nights,"Had a family gathering for St Patrick’s, needed a few extra beds, perfect spot!"
2024-03-01,5,Stayed a few nights,Great place
2024-03-01,5,Stayed with kids,"We needed a place to stay for an overnight softball tournament and this place was perfect. Close to the university and met all
Our needs."
2024-03-01,5,Stayed with kids,"Great, super clean place that met all my expectations. Host was very responsive and bonus, not much cleaning expected!"
2024-02-01,5,Stayed about a week,Nice house.
2024-02-01,5,Stayed a few nights,Jessica was wonderful to have the home ready even though we booked very last minute! The home was perfect and super close to the Griffon Sports Complex which was exactly what we needed! Super clean and super nice having a garage to park the car! Will stay again if we ever return to the area. Thanks so much!!
2024-02-01,5,Stayed a few nights,Jessica was very responsive. We enjoyed our stay.
2024-01-01,5,Stayed one night,Jessica was a great host! She contacted me with info well before check in time and was happy to recommend local food spots. The home was easy to find and very clean and comfortable.
2024-01-01,5,Stayed one night,"Great place, we were only in town for the night as my son was visiting Benedictine College. Very comfy beds, and very spacious. Would stay there again."
2024-01-01,5,Stayed about a week,"Another fantastic stay! Thank you for hosting, Jessica!"
2024-01-01,5,Stayed with kids,"We enjoyed our stay. The house was very clean and spacious. Amenities like coffee, tea, snacks and toiletries were appreciated. The location is great!"
2023-12-01,5,Stayed with kids,"Going to see family for holidays is always a headache but Jessica made it easy. Very responsive , clean house and communicated well with us. Would love to come back when we go back up there"
2023-12-01,5,Stayed one night,Spotless home. Very cozy. Would highly recommend.
2023-12-01,5,Stayed a few nights,"Very beautiful, super clean, beautifully decorated house with two bedrooms upstairs and living area downstairs. We lacked absolutely nothing! Will definitely consider this if we return to this area for a visit."
2023-12-01,5,Stayed with kids,"We traveled with our 6 month old daughter and needed a good space for her. Jessica had the home ready to go several hours before check in, which was so nice as we were able to get our daughter out of her car seat and let her stretch and roll around. The carpet was super clean, and I was able to lay her on the floor without worrying about it being dirty. Everything was spotless-probably the cleanest Airbnb we’ve stayed in. Having laundry on site with the baby was very convenient and we used the washer a couple times with dirty clothes. Would definitely stay here again."
2023-11-01,5,Stayed one night,"Exactly what we were looking for, which was a comfy cozy place for a small family get together. Everything was clean and nice. We are already planning 1 or 2 additional stays next month!"
2023-11-01,5,Stayed over a week,Extremely clean and tidy with everything you could need for an extended stay. Quiet neighbourhood with lots of amenities close by.
2023-10-01,5,Stayed a few nights,"Jessica is fantastic! She was very flexible with my, her home is sparkling cleaning and she is extremely kind. Would definitely stay again!"
2023-10-01,5,Stayed a few nights,Jessica was always responsive. The house was cleaned and smelled good. The instructions she gave us were clear and it was easy to get into the house. Everything described was just as it were. The kitchen was stocked with everything we needed. The bathroom was sanitized before we got there. I would stay there again if I had to come back to St. Joseph. Thanks Jessica for hosting us!
2023-10-01,5,Stayed a few nights,"Very well thought out, super clean and convenient. Jessica definitely does it right!"
2023-10-01,5,Stayed a few nights,Jessica was great with communication and her place was clean and well kept. I will definitely do business with her again. Thx for adding to a fantastic weekend!
2023-10-01,5,Stayed a few nights,Z
2023-10-01,5,Stayed a few nights,"I needed a place to stay while I attended my friend's wedding. This was a great place to come home to! Super clean and comfy beds, plus lots of fresh towels. It was a great stay."
