date,rating,note,review_text
2024-06-01,5,Stayed a few nights,"Really enjoyed the stay. The place was better than the pictures. We felt right at home and the surroundings were beautiful. The place was quiet, private and peaceful. Definitely recommend it for a peaceful getaway from city life or just wanting to change scenery to something different."
2024-06-01,5,Group trip,Sue’s home was very comfortable and relaxing. The entire home was clean and neatly organized and very well maintained. I would highly recommend!
2024-04-01,5,Stayed a few nights,"We have stayed here a number of times now and, as always, the house was clean and comfortable and just what we needed. The enclosed back porch is especially appreciated."
2024-03-01,5,Stayed a few nights,We loved the home and delightful decor. The carrot cake muffins were to die for. We would definitely stay here again.
2023-10-01,5,Stayed one night,"Sue is a great host. Always responsive and has treats waiting for us upon arrival. The cottage is immaculate and in a beautiful, relaxing country surrounding."
2023-10-01,5,Stayed a few nights,"We have stayed here several times and it is always clean, well organized, and comfortable. From time to time we have stayed at other places in the area and none of them has been as good as the ""Mud Valley House."""
2023-10-01,5,Stayed one night,Perfect country cottage!! Wonderful host who always has the most delicious treats waiting on arrival. Have stayed here many times and will continue to stay here when in the area!!
2023-09-01,5,Group trip,"Great place to stay after a day of floating the river! Clean, easy to find, and very cozy. Would stay here again next time. Thank you!"
2023-09-01,5,Group trip,We stayed here after floating the river. This was our second stay at Sue’s and we hope to be back next year. She is a wonderful host and we especially enjoyed the screened in porch!
2023-09-01,5,Stayed a few nights,"Honestly, my favorite place I have stayed so far.
When we arrived there were cookies and a hand written welcome note.
The best shower!!! Perfect temperature gauge and pressure.
We left an item and Sue offered to mail it back to us. Wonderful host!!!
The cottage is a great stay."
2023-09-01,5,Stayed one night,"Adorable country cottage. Very peaceful, private setting for a relaxing get away. Host is super! Responsive to every need and always leaves the most wonderful treats!!"
2023-08-01,5,Group trip,"Loved this cottage! It was very cozy, clean, and had all the amenities as described and more. We were greeted with some yummy cookies in the kitchen which was so sweet and made the arrival so welcoming. The sunroom was just beautiful and relaxing to hang out in the morning sipping coffee. We would absolutely stay here again. Thank you so much!!"
2023-08-01,5,Stayed a few nights,this home was so peaceful. we absolutely loved it. Sue was great! She did a few little extra things that just topped it all off. Just wish we would have had more time.
2023-08-01,5,Stayed a few nights,"Wonderful place to stay. Everything was very clean. Simple and easy check out. Quiet and quaint, as described. Host was friendly and quick to respond. Would definitely stay again!"
2023-08-01,5,Stayed one night,Very nice place. Love the screened back porch.
2023-08-01,5,Stayed a few nights,"Just finished our third year returning to Sue’s place! Her house is always clean, so comfortable and quiet! Sue is quick to respond to any of our questions and so glad to help us navigate the town! We can’t wait to stay again! Would highly recommend!!"
2023-07-01,5,Group trip,Great place! most likely will be back !!
2023-07-01,5,Stayed a few nights,Have stayed there before and always enjoyed. Would recon recommend to anyone. Definitely 5 stars
2023-07-01,5,Group trip,We had such a wonderful weekend! It’s a great place to get away and relax. We loved the friendly cat and back patio.
2023-07-01,5,Stayed one night,"The AirBNB was absolutely perfect. Quiet and quaint, the home was absolutely spotless clean and prepared for us, the property is stunning, the back screened in porch was the epitome of relaxation. Sue was so kind and welcoming. We had very easy entry instructions and clean up instructions. It was a pleasant stay and very close to a lot of restaurants and the river."
2023-06-01,5,Stayed with kids,"Nice, clean, comfortable, good options in house with kitchen and blankets and towels and games, quiet area"
2023-06-01,5,Stayed a few nights,Sue was amazing & helpful! The house was absolutely beautiful! it was far enough out to be peaceful and quiet but like 10 min drive into town for some good food/things to do!
2023-06-01,5,Stayed with kids,"This was our 2nd AirBnB. What a beautiful home, classic beauty. Wonderful touches. Very welcoming, and cozy. We even had delicious homemade cookies left for our arrival. Plenty of blankets and pillows. Secure touch panel not facing peering eyes to gain entry. Great outdoor enclosed patio in the back to sit and relax, w/ binoculars and a bird book. Set back off the road for peace and quite, country feel. Book of other guests comments, we left ours as well. Felt safe. Main drag shopping nearby. This is definitely a must stay if we're in the area again."
2023-06-01,5,Stayed a few nights,"I love staying at this house. Host is amazing, and it’s a great house."
2023-06-01,5,Group trip,"My friends and I stayed here over the weekend to celebrate my birthday. The house was so nice and clean and just perfect for our weekend getaway. If there was anything we needed, you open a cabinet and it was there for you. We were so impressed with our stay! Thank you so much Sue for allowing us to rent your place. We will definitely be doing it again:)"
2023-06-01,5,Stayed one night,"I can’t rave enough about this house. It’s such a nice home, it’s clean, and the hosts are the best I’ve ever had to deal with."
2023-05-01,5,Group trip,"Staying at Sues place was absolutely amazing! She was very helpful and responsive when I needed something. She also baked cookies to welcome us and they were the best cookies ever! We all had an amazing experience and anytime we come to tahlequah we want to stay here! There was a leak in the plumbing and she immediately came over to fix it and helped us out a bunch! 10/10 recommend staying here. The pictures do not do it justice in person, it is such a cute little house and perfect for our stay."
2023-05-01,5,Stayed a few nights,"Such an amazing place to stay. The hosts are amazing, and the home is very comfortable. Very quiet area, and I get plenty of rest while I'm staying there. I highly recommend this house for anyone looking for a great place to stay."
2023-05-01,5,Stayed a few nights,Love staying at this house and would highly recommend.
2023-05-01,5,Stayed a few nights,"The host was amazing!!! Very responsive, home as advertised, and enjoyed my stay. I would definitely recommend anyone looking for a nice house to stay on during their stay. 10/10 for sure!!!"
2023-05-01,4,Stayed over a week,"Very quite and pastoral property. It’s not a new home but seems to be we’ll maintained and updated.
No dogs or other pests. No noise."
2023-04-01,5,Stayed a few nights,"Sue's house was great! Everything was just as stated and if we had a question she responded quickly. We will definitely be back.
Thanks Sue"
2023-04-01,5,Stayed a few nights,"As usual, things went very smoothly. We had no problems. The place is comfortable and very clean. It is quiet and peaceful with a reasonable level of access to town."
2023-03-01,5,Stayed with kids,A great place to stay very clean and looks even better in person!! Would definitely stay again!!
2023-03-01,5,Stayed with kids,"Wonderful home and hosts! Nice quiet, comfortable place to get away."
2023-01-01,5,Stayed a few nights,"Clean, comfortable, in the country close to town, & Sue is a great host."
2022-11-01,5,Stayed a few nights,Wonderful cottage and a great host!!
2022-10-01,5,Stayed one night,Absolutely beautiful cottage in a wonderful location. Sue is an exceptional host and makes the stay a special experience with cookies or some treat waiting for you at check in!! We have stayed here several times and always love the experience!!
2022-10-01,5,Stayed a few nights,Sue’s place is wonderful. It felt like home. The Cottage was super clean and comfortable. The location is excellent. Everything we needed was available. We couldn’t be happier.
2022-09-01,5,Stayed one night,Perfect place to relax and enjoy watching NSU Riverhawks games!! Sue is a great host and we enjoy the extras she provides like cookies and muffins!! A perfect weekend get away to enjoy NSU home games!!
2022-09-01,5,Stayed a few nights,We were very pleased with the accommodations and host. The kitchen was particularly well appointed compared to most!
2022-09-01,5,Stayed one night,Super adorable home in a secluded setting. Sue is a great host and added a special touch by having a delicious plate of cookies waiting for us on arrival. Will definitely be back!
2022-09-01,5,Stayed with kids,"She’s place was great. Awesome location, very clean, and really good value. Highly recommend. We will be back!"
2022-08-01,5,Group trip,"Ver clean, nice place! Beautiful home and nice host."
2022-08-01,5,Stayed a few nights,"This cottage is the perfect place to stay for our annual float trip! It’s very clean, roomy, and perfect for a quiet getaway! Sue is very easy to work with as well! Our second time staying here and highly recommend!"
2022-08-01,5,Group trip,The house was very nice. We had a great time and will be coming back next time we’re in the area. I highly recommend playing giant uno on the screened in back porch
2022-08-01,5,Stayed one night,Lovely place. The screened porch was a pleasant surprise and perfect to enjoy a rainy morning
2022-08-01,5,Group trip,"Quiet, clean, and cute place to stay!"
2022-08-01,5,Group trip,"I can’t say enough great things about our stay. Most AirBnbs just feel like a place to stay. This felt like a home. We enjoyed listening to records while playing games in the living room. The cottage is a wonderful place!! Sue was helpful with any questions we had, and even left us homemade cookies to welcome us on our arrival. We will definitely stay here again next year, when we come back."
2022-08-01,5,Stayed one night,The best experience I’ve had with an air bnb. The house is everything you would expect and more. Sue is also an awesome host.
2022-07-01,5,Stayed a few nights,Super cute place and nice location.
2022-07-01,5,Stayed one night,Really enjoyed our stay! Very cozy!
2022-07-01,5,Group trip,This was an amazing place to stay! Will definitely be back .
2022-07-01,5,Group trip,The place was so cute and perfect for what we needed. Sue is a great host!
2022-07-01,5,Stayed a few nights,"Sue’s little house in the country is a great spot. Clean, comfortable, and Sue communicates quickly and even left us home made cookies. I’d highly recommend."
2022-07-01,5,Group trip,"The house is clean, spacious, and comfortable! We loved the privacy of not being able to see any neighbors or hear any highway noise, it was incredibly peaceful!"
2022-07-01,5,Stayed with kids,"This home was absolutely wonderful! So clean, quiet and the fluffiest towels! Kids ride their bikes on the circle drive without us needing to worry about any traffic and owners even let them play on their swing set! The home-made treats waiting when we arrived were an extra special touch. We loved this home!"
2022-06-01,5,Group trip,"We loved our stay! Such a delightful, home-y environment. Sue was such a generous host."
2022-06-01,5,Stayed a few nights,Absolutely wonderful! We had an amazing weekend! Sue is the best!
2022-06-01,5,Stayed with kids,"The pictures don’t do it justice! So cozy and comfortable. Lots of little, thoughtful touches! So happy with our weekend stay!"
2022-06-01,5,Group trip,"Beautiful home, well past our expectations."
2022-05-01,5,Stayed a few nights,"The Cottage is a delightful place. We enjoyed our long-weekend stay, and The Cottage's charm made that happen. The quiet country setting led to many hours on the screened-in porch and led to great nights' sleep. The Cottage is well equipped, nicely appointed, and super clean. We enjoyed our stay, and we'll reserve The Cottage again for future trips to Tahlequah. Thank you, Sue and Steve!"
2022-03-01,5,Group trip,Really nice place… wouldn’t hesitate to stay again…
2022-03-01,5,Group trip,Loved this place. Excellent location. Only one small issue and it was addressed immediately. Would definitely stay again.
2021-12-01,5,Stayed with kids,"Another great stay for us at Sue’s guest house. Always clean, cozy and quiet!"
2021-12-01,5,Stayed with kids,"Clean, cozy, quiet house!
Will hope to return for a visit soon!"
2021-11-01,5,Stayed one night,"Sue’s house was perfect for us. Clean, comfortable. Country feel but very close to town. We would definitely stay here again if we need a place in the Tahkequah area again."
2021-11-01,5,Stayed with kids,"We have had an amazing extended stay at Sue's cottage, the amennities were endless! The house was spacious, comfortable, and very well stocked. There were so many fun toys and books for our toddler to play with which was a huge unexpected perk. The nearby town has some really nice parks with beautiful streams. You are situated about an hours drive from several awesome tourist attractions (state parks, a drive through safari park, The Gathering Place in Tulsa). Lastly, the hosts were so kind, attentive, and accommodating. We would definitely stay again!"
2021-09-01,5,Stayed about a week,"Beautiful warm cozy country cottage close to town, restaurants and shopping. The host was fabulous. Very accommodating. Everything was perfect. Is my go-to place when I’m in the area."
2021-09-01,5,Group trip,"The pictures don’t do this place justice. It was immaculately clean and well-appointed. Location was convenient. The screened in porch was our favorite spot. We enjoyed the extra touches like records, games and cookies. Highly recommend! Hope to stay here again after our next float trip!"
2021-09-01,5,Stayed a few nights,"This house was the perfect place for our weekend getaway. It was very clean, quiet and spacious! Sue was fabulous to work with and very quick to respond. We will definitely be back!"
2021-08-01,5,Stayed one night,Very welcoming and convenient! She definitely goes out of her way!
2021-08-01,5,Group trip,This house is great. The screened in porch is great for relaxing at the end of the day. The home is cozy and clean and in a perfect location. Will be back!
2021-08-01,5,Group trip,"The cottage is in the perfect place - best of both worlds - just outside the city in the country. Sue is a great host. The cottage was very clean, comfortable, & nicely decorated. The screened in back porch is wonderful - couldn’t count all of the hummingbirds we saw! Each time we’ve stayed here Sue has had a special treat waiting for us, this time it was soft, delicious chocolate chip cookies!"
2021-08-01,4,Stayed with kids,Great stay
2021-08-01,5,Group trip,"Great location, great hosts, great house! Definitely recommend!"
2021-07-01,5,Stayed a few nights,Sue’s place was perfect in every way. We had a girls trip to Tahlequah and enjoyed every minute. We hope to stay here again!
2021-07-01,5,Group trip,"This was perfect! The house had everything we needed and was in the perfect location. We had a blast! Thank you, Sue!"
2021-07-01,5,Stayed a few nights,The house and amenities were amazing! We thoroughly enjoyed our stay and the seclusion this home offers. Sue is a welcoming homeowner with exceptional communication. We definitely recommend staying in this lovely home!
2021-07-01,5,Group trip,"Expect peace and quiet, easy access and beautiful surroundings."
2021-06-01,5,Stayed with kids,The house was very clean and roomy. We had everything we needed and more. The location was perfect. Out of town a bit but close enough to grocery stores. Sue was very welcoming and accommodating. She also made delicious scones.
2021-06-01,5,Stayed a few nights,We loved this place! We enjoyed our time it was just what we needed!
2021-06-01,5,Stayed with kids,Such a cute & cozy little cottage. We had everything we needed and more. We will be staying here anytime we visit the river.
2021-06-01,5,Stayed one night,"We enjoyed this lovely home very much. We called it “the pleasant place”. We experienced a bit of nostalgia with the vinyl record offerings and enjoyed our time out on the screened in patio. The hummingbirds were nearby during our coffee the next morning on the patio. We were particularly thrilled to find half-and-half in the refrigerator for our coffee – and we loved the scones that the hosts had provided!! The master bedroom bed was comfortable, the master bath shower was enormous and all of our needs were satisfied. We recommend this lovely home in a rural setting."
2021-05-01,5,Stayed with kids,Awesome place to stay. So clean and comfy! We especially enjoyed the covered back patio ! Would highly recommend !
2021-05-01,5,Group trip,We had a great time at Sue's place. The communication was super easy and quick and the place looks exactly like it does on the pictures. Check in was super easy. The cottage was easy to find. Very clean. Little details through-out that made our stay so much more enjoyable. Sue was very accommodating and very quick to respond with any questions. The whole place made us feel at ease. We had a wonderful time and will stay again!
2021-05-01,5,Group trip,We enjoyed our stay so much! We will definitely be staying here again I. The future!
2021-05-01,5,Stayed with kids,The cutest house with lots of privacy
2021-05-01,5,Group trip,"Great place. Super quiet very comfortable. Sparkling clean and tidy. Just far enough away from town but minutes from whatever we needed.
Highly recommend."
2021-04-01,5,Stayed a few nights,Sue’s home is so comfortable and inviting. She’s thought of so many little details to make your stay enjoyable. We had the most amazing girl’s weekend. Thank you!
2021-04-01,5,Group trip,"The house is fantastic! Everything is updated and very nice. It had everything we needed and more. The location is very serene... beautiful sunsets, quiet, wildlife... couldn’t have asked for more."
2021-04-01,5,Stayed a few nights,"The Cottage was perfect and Sue was wonderful! Finding a place to stay that feels like home is just what this cottage is, home away from home!"
2021-03-01,5,Stayed a few nights,We have now stayed at this place twice. It is very comfortable. It is quiet but with easy access into Tahlequah or out to other areas.
2021-02-01,5,Stayed one night,"Excellent rent! Close to town, but in the country. Clean, quiet, and homey. We loved it!"
2021-02-01,5,Stayed a few nights,"What a wonderful place to stay!! Clean, spacious yet cozy, great location, quiet and private, super comfortable beds, yummy treats....perfect for our little trip. Thanks again!!"
2020-12-01,5,Stayed a few nights,"My wife and I grew up in farmhouses and while this house is situated across a cattle guard crossing (another one of our favorite memories) the amenities were far above our expectations! We lacked for nothing already present upon arrival and fully believe had we a need, Sue would have quickly responded to meet it. The paved road and driveway with a large pull in garage was amazing as well. Sitting off the road we experienced no traffic noise and enjoyed the peace and quiet. We will be booking again when back in the area."
2020-12-01,5,Stayed a few nights,Great house. Plenty of room. Nice updated bathrooms. Quiet location that is still close to town. Comfortable furniture and bedding. Back porch would be great during warm months. Very nice kitchen and dining area
2020-11-01,5,Stayed with kids,"Cute, clean & spacious little house in the country."
2020-11-01,5,Group trip,Sue's cottage is perfect for a weekend getaway if you enjoy being in the country. Sue is very quick to respond also.
2020-11-01,5,Stayed about a week,Incredibly clean and full of all the amenities you need. Beautiful setting and extremely hospitable and helpful. Will be staying here again!!
2020-10-01,5,Stayed one night,Great rental. We used it for an on-camera interview. Sue worked with us to ensure everything was ready for our arrival.
2020-10-01,5,Stayed a few nights,Very clean house. Host was very responsive and helpful with any questions or concerns.
2020-10-01,5,Stayed a few nights,"Great place, great location. Sue is amazing and home is sparkling. Must stay for anyone visiting the area."
2020-09-01,5,Stayed a few nights,"Sue's place is awesome -- so quiet, in a pretty and peaceful setting; spacious interior, lovely little kitchen. We especially loved the porches, small quiet front porch and larger, screened in back porch -- that included regular visits from the horses who are the nearest neighbors. Two very comfortable bedrooms but plenty of room for other guests if yours is a family event. Overall, one of our best airbnb experiences!"
2020-09-01,5,Group trip,This place is great! Definitely one to remember!
2020-09-01,5,Group trip,This is the cutest place and is perfect for a small group!
2020-09-01,5,Stayed with kids,Sue’s place by far exceeded all of my expectations. The property is so quiet and beautiful and the cottage has all of the personal touches of home. We wished it was our actual home! Our 1 year old pushed her walker up and down the long driveway and I was able to get a long run in on some nearby dirt roads. We were close to all of the family we wanted to spend time with and were able to explore downtown easily as well. I wish we’d have been in town longer to enjoy the cottage even more. The beds and sheets were so soft and we had everything we needed in the kitchen as well. One of the best Airbnb’s I’ve ever stayed in and we can’t wait to come back and stay longer.
2020-09-01,5,Group trip,Such a beautiful home! Sue was very nice and quick to respond to all questions I had. Everything was exactly as listed.
2020-08-01,5,Stayed a few nights,"This house is absolutely amazing. She thought of everything and really made us feel at home. The location of the property is right out of town but felt hours away. It was so quiet and relaxing. Some of the best sleep I have had.
We sat on the front porch and drank coffee every morning.
I would recommend this house.
I can’t wait to come back!"
2020-08-01,5,Stayed a few nights,This cottage is adorable! The owners thought of everything you could need! Very clean. I want to go back!
2020-08-01,5,Group trip,Very cute space and homey!
2020-08-01,5,Stayed with kids,"This little home was a wonderful surprise, Sue's thoughtful touches, the scenery, and the house itself was like going home to see my Mom! We loved the fresh baked banana muffins, the screened in porch, comfy couches, and TV's in living room, and bedroom. My grandson loved, loved, loved the screened in porch, he insisted we have each meal out there. Sitting on the porch we had soft comfy chairs, listened the soft sounds of rain, and melodic sound of the soothing wind chimes, we Soo enjoyed Sue's warm, quaint, quite little house. It was by far the best bnb we have ever stayed at! The beautiful little family of Cardinals were also a most blessed and prefect scene to watch while sitting in cozy screened porch. Loved everything about this warm little home and look forward to going back soon."
2020-08-01,5,Group trip,This was a great little house in the country. It was exactly what we expected and more. Sue was a great host and will definitely check to see if this is available the next time we come down.
2020-08-01,5,Stayed a few nights,This house was so cute and clean! Made us feel comfortable and right at home 🏡
2020-07-01,5,Group trip,The house has everything you need to relax and feel at home. And the location is great as well.
2020-07-01,5,Stayed one night,"This is a great deal for them money, very clean, beds wonderful, very spacious house. Nice screened in porch, and the bonus is you can use the garage if you need it. Host is very responsive to any questions. I will come back here again."
2020-07-01,5,Stayed a few nights,Sue’s cottage was absolutely wonderful. It had a great location. It was very private and had tons of room. We are looking forward to our next trip up there.
2020-07-01,5,Group trip,Beautiful home off the beaten path Clean and comfortable. I would definitely stay there again.
2020-07-01,5,Stayed one night,Great place..
2020-07-01,5,Group trip,100% recommend this Airbnb. Sue is a great host and it sits at a great location and is accessible to many attractions around town.
2020-07-01,5,Group trip,Our stay was perfect! The location was great. This was the perfect quiet place to stay!
2020-07-01,5,Stayed a few nights,The house is absolutely wonderful. Great place to stay.
2020-06-01,5,Stayed a few nights,Sue’s place was cozy and welcoming. It’s tucked away in the country and offers a lot of space for guests.
2020-06-01,5,Stayed one night,Awesome place to stay!!
2020-06-01,5,Group trip,Super Cute place. Clean and cozy! Patio was super cute. For sure will stay here again!!
2020-06-01,5,Stayed about a week,Great place and location!
2020-06-01,5,Stayed one night,"Amazing place to stay! Fast WiFi, tons of room, and lots of amenities! Beautiful home in the countryside but not far from town."
2020-06-01,5,Group trip,Sue was absolutely wonderful! And her Cottage was perfect and beautiful and had so many great extras! We will definitely stay again!
2020-06-01,5,Group trip,This place is definitely a hidden gem! Even though it was just an overnight trip the home was very cozy and the treats left were the perfect touch! Definitely will want to make another trip to stay longer next time.
