date,rating,note,review_text
2023-09-01,5,Stayed one night,They were very responsive. There was an error at checkin & once we brought it to their attention they took care of it immediately.
2023-09-01,5,Stayed a few nights,"Nice rooms, quiet and comfortable. Wonderful common areas and deck to enjoy the view! Delicious breakfast! Will definitely stay again!"
2023-08-01,5,Stayed a few nights,Great accommodations! The breakfast was a great way to start the day. The regular business of the winery did not disturb us at all.
2023-07-01,5,Stayed a few nights,Great stay and the staff was very welcoming! Will stay here next time I travel to Vermilion!
2023-06-01,5,Stayed one night,We had a wonderful stay at Valiant. We enjoyed time on the deck drinking wine and playing cards. It was very quiet at night and the breakfast was delicious. We would definitely chose to stay here again.
2023-04-01,5,Stayed a few nights,"We had a great stay in Vermillion! Our hosts at Valiant were super kind and flexible, even though we had a last-minute change to our booking. Tasting their wines and spirits was another fun experience.. you have to try their Bourbon:)"
2023-04-01,5,Stayed with kids,"Very friendly staff and kind,Highly recommend for a stay :)"
2023-03-01,5,Stayed one night,"Our second stay here. It’s clean and peaceful, welcoming and hospitable. The breakfast is a nice addition. Thank you."
2023-02-01,5,Stayed a few nights,"Super! It was chance that we stayed here in winter but what a magical time of year. Everything is spot on, great place to stay and the staff, wine and breakfast is superb Cant go wrong"
2022-12-01,5,Stayed one night,We always enjoy staying at Valiant! My only issue is getting up two flights of ice covered metal stairs to get in. But it was Christmas so I didn’t expect people to be around to help.
2022-11-01,5,Stayed one night,"It's great to stay where you get treated like a long lost friend and spoiled from start to finish. Super friendly staff, great breakfast and location! We can't wait to find back!"
2022-10-01,5,Stayed a few nights,"We had a very comfortable stay. The space was very clean and the whole staff was amazing, especially Adrienne! She was very welcoming."
2022-09-01,5,Stayed one night,"The hosts were very welcoming, and the balcony was beautiful!"
2022-08-01,4,Stayed a few nights,Comfy beds and nice location!
2022-08-01,5,Stayed one night,"Nice place, very clean and great breakfast"
2022-08-01,5,Stayed one night,Beautiful location and a nice big room! We were warmly welcomed with a glass of wine and some ideas about how to spend our evening downtown. Breakfast was yummy and right on time! It was a great girls night out....we will be back!
2022-07-01,5,Stayed one night,Beautiful peaceful setting. Love the deck with the overlook.
2022-06-01,5,Stayed a few nights,Was great! Loved the outside space. Beautiful views. 
2022-06-01,5,Stayed one night,Great place to stay. Its located in a nice quiet area off the beaten path with a great view.
2022-06-01,5,Stayed one night,"A beautiful setting. Our favorite spot was the balcony playing games, enjoying the wildlife, and sunset. We also had a delicious breakfast!!! We would stay again 🙂"
2022-05-01,5,Stayed one night,"A nice, quiet and safe place to spend the night."
2022-02-01,5,Stayed a few nights,fantastic place for our weekend getaway!
2021-12-01,5,Stayed one night,"Nice room, good breakfast, and complimentary wine tasting"
2021-09-01,4,Stayed about a week,"Valiant was a fantastic place to stay in Vermilion. Good location with pretty views. Very friendly staff, very clean rooms and great value."
2021-08-01,4,Stayed one night,Convenient location for visiting both Vermillion and Yankton.
2021-06-01,3,Stayed a few nights,"Rooms are clean, beds are comfortable but the decor is very outdated. The good was fine but not what we have experienced at other bed and breakfast."
2021-06-01,5,Stayed a few nights,Valiant is great! Both hosts were so nice and sweet!
2021-06-01,5,Stayed a few nights,This is an amazing place to stay! Comfortable! Peaceful! Beautiful! Clean! Great breakfast! Kind and helpful folks own and operate this wonderful bed and breakfast! I highly recommend it and will definitely return when in Vermillion!
2021-05-01,5,Stayed a few nights,"Thanks to Sherry and Adrienne for making our stay enjoyable while we visited family in Vermillion for the first time since the pandemic. We really liked our Bloody Mary Sunday at the Winery. We had never heard of it before, and it was very tasty. We did the wine tasting on the second floor deck with a great view. Breakfasts were hearty and wonderfully prepared! We were in the Buffalo room, which was clean and comfortable. Definitely would stay again, if we are back in town."
2021-05-01,5,Stayed with kids,It was a great stay. love it!!! highly recommend!
2021-04-01,5,Stayed a few nights,The best accommodations and a special place to visit. Adrienne was warm and welcoming and provided excellent service at check in and dining. Rooms are roomy. Will definitely stay again.
2020-12-01,5,Stayed a few nights,Quiet and cozy. Lots of character. Close to downtown Vermillion with lots of great eateries.
2020-10-01,5,Stayed a few nights,"This is a very comfortable hotel like room. Our after hours check in was convenient, no contact, and fast.
The homemade breakfast was made fresh at the time we requested and was mouth wateringly delicious.
We had an excellent stay and would definitely return.
We enjoyed the wine tastings as well."
2020-10-01,3,Stayed one night,"Great location and sparkling clean rooms. Tasting room is very cool, but only open Thursday through Sunday."
2020-10-01,5,Stayed one night,Great B&B with wine tasting included. A real treat in the fall is sitting out on the back porch in the golden leaf canopy tasting the vineyard's offerings.
2020-09-01,5,Stayed a few nights,Valiant is a friendly place to stay. Adrian was very pleasant and was able to help you with anything you needed. The room as lovely and very clean! The shared kitchen and balcony was an added convenience. Breakfast in the morning as delicious and relaxing. We would definitely go back if we are in the area again.
2020-08-01,5,Stayed a few nights,"Comfortable, feels private, breakfast is good & good host"
2020-08-01,5,Stayed one night,Beautiful views. Quiet space. Nice clean room with great amenities. Friendly staff and love the wine/whiskey tasting!
2020-08-01,5,Stayed one night,"We had a quiet stay at the B&B.. Though we arrived after 5pm, there were two glasses of wine waiting for us since the tasting hours were over. We really enjoyed sitting out on the deck later in the evening, it was a perfect night for it! Our host provided info on local running trails and the breakfast was great! Plenty of tables were available to ensure social distancing was possible. Everything was clean. My only critique was that the shower could have had a better head or pressure, or something - it was fine, but not great for washing my thick hair."
2019-11-01,5,Stayed a few nights,Amazing view and even better breakfast!
2019-10-01,4,Stayed a few nights,Our first time using AirBNB and was pleasantly surprised with the experience. Valiant's was the quietest place I have ever stayed. Breakfast each morning was delicious and ready when we came downstairs. I would definitely stay here again when in Vermillion.
2019-07-01,4,Stayed one night,"Nice place, convenient locations for us. Breakfast was good."
2019-02-01,4,Stayed one night,"An adorable place with a cute atmosphere, kind people, great wine, and delicious breakfast!"
2018-09-01,4,Stayed a few nights,Good value - a very nice place at a reasonable price. Fine view of the bluffs. Room was spacious and nicely decorated. The wine tasting is a nice touch as well. Plus warm cookies at bedtime !
2018-09-01,5,Stayed one night,This was a great find for my wife and I. Wonderful staff and accommodations. Such a nice option when you visit a college town.
2024-06-01,5,Stayed a few nights,"My husband and I had the pleasure of staying at Darren’s place Memorial Day weekend. It was just what the Dr ordered. We spent three days listening to nature and watching the river run by. He has a beautiful spot and Darren is very responsive, doing everything he can to be sure guests are comfortable."
2024-06-01,5,Stayed with kids,"We had the MOST wonderful time at The River @ Newcastle and we’re so pleased to have met Darren. He has an exceptionally beautiful spot, was so responsive and accommodating, and his place was so well appointed. He was such a pleasure to speak with and we had the best time camping, fishing, looking at the stars, and spending time with family. Could NOT have been any better. Will 100% stay again. Thank you, Darren!"
2024-05-01,4,Stayed with kids,"Beautiful view of the river and bridge from the nice deck. Camper was ok and adequate for what we needed. Driveway is steep, so 4x4 vehicle is almost a necessity, especially after a rain. Darren is a great host!"
2023-10-01,5,Stayed a few nights,Beautiful setting right on the river. Clean RV. Lots to do around the area but also very peaceful to just hang out at the RV. Wish we had brought our fishing poles!
2023-10-01,5,Group trip,This was such a fun stay with beautiful views!! Darren was so helpful and informative and made sure we had everything we needed for the weekend. Definitely recommend!
2023-09-01,5,Stayed about a week,"From the momentof booking, Darren was attentive and took action for any of my concerns. He went out of his way to make me feel comfortable. The property was so beautiful with the river view and pristine 5th wheel and it was obvious at how much work he had been trying to improve it. I would call him a SUPER Super Host. His property manager was on top of a plumbing issue and it was taken care of within the hour they were notified. I couldn't have asked for a nicer, peaceful place to stay for 10 days."
2023-09-01,4,Stayed a few nights,Beautiful area! Darren was very responsive and answered all of my questions. Very friendly host.
2023-08-01,5,Stayed a few nights,"UNBELIEVABLE!! The lodging, the views and the hospitality were absolutely unrivalled😊. Our family can't thank Darren enough for making our weekend getaway perfect!"
2023-08-01,5,Stayed a few nights,What a beautiful place on the river. Darren made sure we knew where everything was and had what we needed. The outdoor kitchen with the best view was the highlight!
2023-08-01,5,Stayed one night,Darren was an exceptional host and his place was exactly as described. The private dock and views were incredible. We cannot wait to return for our next visit!
2023-08-01,5,Stayed a few nights,"We couldn't have found a better place for our vacation than the River at Newcastle! It had everything we were looking for and more: total privacy, spectacular river views, clean and comfortable accommodations, and a huge deck complete with outdoor kitchen. Best of all was Darren - he is the ultimate host, without exception! He is so welcoming, helpful, and cheerful and made us feel right at home. Thank you, Darren for the River and Newcastle. It's beyond five stars - we will be back!"
2023-07-01,5,Stayed one night,Very clean sorroundings and has everything you will need.Host is very friendly!
2023-07-01,5,Stayed with kids,We had an absolute blast here! The camper was very comfortable for our family of 4 and the view of the river was breathtaking. Darren was an extremely gracious host. We’ll definitely be back! 🖤💙🖤
2023-07-01,5,Stayed a few nights,"This was incredible weekend for all of us! I speak for everyone, we absolutely loved this camp on the river!
Highly recommend this place to anyone that enjoys a secluded place with water right next to it. I don’t have anything bad to say about this place.
Darren was an amazing host, he got back to me within minutes with any questions I had, and was just an amazing host overall. I can’t say enough good things about this place. Definitely will be coming back."
2023-07-01,5,Stayed a few nights,The view was awesome! Peaceful! Darren was a great host. Made sure everything was taken care of.
2023-07-01,5,Stayed with kids,"Our stay at The River was nothing short of amazing. The 5th wheel was very clean & comfortable. The deck was massive and was situated just right to have an unobstructed view of the river - we were even able to set up Darren’s tent & air mattress for our kids to have an outdoor camping experience. Not to mention, the Blackstone grill was a huge perk! The dock was also a huge plus - our kids enjoyed some time with their fishing poles out there and had a blast. Darren provided a wonderful & quiet little getaway, and his communication was unmatched."
2023-06-01,5,Stayed with kids,"Peaceful retreat, quiet and safe. The place is in a beautiful location with a great view of the Missouri River. My family loves the location, and my kids had a great time fishing on the dock.
Darren was extremely helpful throughout our stay. We can't wait to come back."
2023-06-01,5,Stayed one night,"Peaceful retreat, clean , quiet and safe. Exceeded description. Globetrotter recharging my batteries…beautiful location and place for that. Plenty of places, activities and food within a reasonable drive. Really enjoyed hearing the birds and watching the fish jump while on the dock.
Paddle boarding, kayaking at a small lake without any power watercraft at Lake Yankton was a blast. Picked up South Dakota’s best pizza and enjoyed it immensely on the new deck.
Huge selection of trails…hiking, biking and walking."
2023-06-01,5,Stayed a few nights,"Darren was extremely helpful throughout our time booking all the way through check-out, it was the perfect weekend getaway to disconnect and recharge in a beautiful location! Can’t wait to comeback!"
2024-06-01,5,Stayed one night,"This was a lovely oasis ~ unexpected, and above and beyond, from the furnishings (cozy, well decorated, special touches), to the home cooked breakfast delivered to our door. Even the books were well curated (I did not even know Alice Walker wrote a book about raising chickens until I saw it in your collection). Many thanks!"
2024-06-01,5,Stayed with a pet,"If you could mix time travel with hospitality, you may be nearby. Add in genuine warmth and a connection to the land and a sprinkle of cooking your grandma used to make, and you are now at kate's. Thanks for the lasting inspiration."
2024-05-01,5,Stayed one night,"Kate’s Cottage is truly a hidden gem. We always love our time there! It’s so beautiful, quaint & peaceful. Gale is such a wonderful host. Each of her little touches is done with so much thought & love. Her breakfasts are delicious too. Can’t wait to stay again!"
2024-05-01,5,Stayed with a pet,Gale was so warm and friendly and the Cottage couldn't have been more adorable.
2024-04-01,5,Stayed with kids,"This is our third visit with Gale. We have previously stayed at her place, during Christmas and New Year’s. And she had decorated them to create the winter wonderland at that time!
This time, we went in spring, with our little son. And it was a perfect weekend get away.
The place is as always very clean, neat, comfortable, cozy. She even had board books out for our baby!! Even though it was raining, and she had prior engagements, she came specially to show the goats to us. And her breakfast is always was delicious.
She’s an amazing host. Very responsive.
You don’t need to think twice before booking this place!"
2024-04-01,4,Stayed one night,"Nice country cottage in a quiet peaceful setting. Gale served a made from scratch breakfast that was delicious. Enjoyed seeing goats, chickens and Flo the black lab on the property, but watch out for Batcat, the not so friendly black cat."
2024-04-01,5,Stayed with a pet,"Staying at kate’s cottage never disappoints, it’s beautiful, cozy and so so peaceful, Gale is absolutely amazing and the breakfast is so delicious. Being surrounded by nature and the calmness of the farm is the best way to spend a gateway. As always we loved to come back."
2024-03-01,5,Stayed with a pet,Gale is a phenomenal host and the cottage is absolutely perfect! We love our unplugged time at the cottage!!
2024-03-01,5,Stayed one night,"Gale's place is beautiful, quiet and peaceful - that much is obvious. But she didn't have to provide a delicious homeade breakfast, seasonally decorate, provide high quality linens, towels and a robe, light a candle and turn the lights low upon my arrival, provide snacks and cream/honey to go with my tea or any of the other little touches...yet, she did. This place was like going home to my Mama's- and I'm blessed with the BEST one. ♡ Thank you, Gale."
2024-03-01,5,Stayed one night,"We thoroughly enjoyed our stay at the cottage. It was a cozy getaway before our long haul home. Gale was a lovely host, and her breakfast was delicious!"
2024-03-01,5,Stayed with kids,Such a sweet cottage and Gale couldn’t have been more helpful and accommodating! Our 9-month old loved the animals. Gale recommend Kava Rose for dinner and we loved it. Just a lovely stay overall. Thank you Gale!
2024-03-01,5,Stayed one night,this was an amazing beautiful cabin. I truly wish I could have stayed for much longer. truly set a new standard for airbnbs!
2024-03-01,5,Stayed with a pet,"We loved our stay at Kate’s Cottage. It was homey and comfortable and Gale is an excellent host. She was very responsive and friendly, and the breakfast she prepared for us was amazing! I would highly recommend staying here."
2024-02-01,5,Stayed with a pet,"Gale’s is never a disappointment. 2nd time here and we were blown away by the comfort of the bed. And of course the breakfast and the details she has put in make this a home away from home.
We will keep returning when traveling in this part of the world. 10 stars"
2024-02-01,5,Stayed with a pet,"If I could give this place 100 stars I would! Gale could not be better a host! The cottage is immaculate and feels like home the second you pull in the driveway. Upon arrival we were greeted by the chickens, kitty and even the goats came out to say hello. All the little extras far surpassed any expectations I’ve ever had of an airbnb host!
The included breakfast was delicious topped with a cherry on top of a handwritten note by the host and baked goodies!
We will be back!"
2024-02-01,5,Stayed a few nights,"Kate's Cottage came recommended to us when our original stay changed. We were able to make a last minute reservation with Gale when we saw the cottage was open for our time in the area. We have stayed at lots of airbnb's and VRBO'S in the U.S. and one in Paris. This stay was by far our FAVORITE and it is because of Gale's ability to go above and beyond with every little detail. The cottage and property are delightful and so comfortable feeling. The beds are amazing and the surroundings so quiet. Gale adds the extra touches such as homemade breakfast, bread, chocolate chip cookies, coffee, cocoa to tie everything together in a beautiful bow. We cannot wait to book our next stay at Kate's Cottage!! Thank you again for everything!"
2024-02-01,5,Stayed one night,We had a great time at this spot! Secluded and quiet and a perfect place to rest for the night. Gale is a great communicator and makes a great breakfast!
2024-02-01,5,Stayed one night,"A great place for a quiet, unplugged stay! We worked on vision and goals for the next year and it was the perfect stay! Breakfast - delicious as always and Gale is such a great host!!!"
2024-01-01,5,Stayed a few nights,"If I could give Katie’s Cottage 10 stars I would. Such a cute place; all the details in decorating. Clean, cozy; and breakfast both mornings pushed it over the top! Exactly as pictured and described."
2024-01-01,5,Stayed with a pet,Gale was the most amazing host ever. The cottage was perfect for us while we waited for our apartment to be ready. The breakfast each day was phenomenal and I wish we could live there permanently! I can’t wait to go back to Kate’s cottage.
2024-01-01,5,Stayed with a pet,I had a great stay. Adorable spot to rest for the night.
2023-12-01,5,Stayed a few nights,We loved our stay at Kate’s Cottage. It was a cozy weekend trip to rest up and enjoy time with family!
2023-12-01,5,Stayed with a pet,"We love Kate's Cottage and will continue to go back. It's such a peaceful oasis. Gale is the absolute BEST HOSTESS!! Thank you for all of the accommodations and amazing food, amenities, and care."
2023-12-01,5,Stayed with a pet,"I am from St. Louis and lived in North Dakota, so Gale‘s spot was a good halfway point. We’ve been coming here for over half a decade and it is honestly something we look forward to every time we make the drive. Not only is her place ridiculously inexpensive for what you get, she is an awesome person, great hostess But genuinely a good human being. The first time we went there it was like a home away from home. She remembers my kids names and is the most sincere person you will ever meet. I cannot recommend this place enough. It has been nothing but great memories, good vibes, And a feeling of your home away from home. This place is a national treasure."
2023-12-01,5,Stayed one night,"I figured it would be difficult for Gale and her cottage to exceed expectations based on her reviews, considering we knew it was going to be amazing. But Gale did it. Gale obviously loves to host her guests and makes the experience unique and unforgettable. My family loved our stay and will be back. Thanks Gale!"
2023-11-01,5,Stayed with a pet,Such a cute little cottage. Gale goes above and beyond for her guests
2023-11-01,5,Stayed with a pet,"There are not enough words to describe this wonderful little slice of heaven. The cottage itself was beautiful and full of surprises. I had everything I needed and more. The breakfast Gale made was beyond amazing and the little touches were just so adorable. I felt so spoiled. Especially since I booked late and Gale still asked if I wanted some cookies when she came to feed the goats!!! The cookies were warm and freshly baked and just a nice little hug before bed!
Meeting Gale and Flo were my highlights. Gale is such a nice upbeat wonderful person and you can tell they put a lot of work into this Beauty! And flo was so loving and sweet! What a good watchdog! This was my favorite place I’ve ever stayed through air bnb!!!"
2023-11-01,5,Stayed one night,"Ever been somewhere and it was BETTER than the pictures and description? That is Gale’s Place! So relaxing and peaceful and just beautiful! Gale is such amazing woman and her attention to detail to making you feel at home is felt from the moment you reach out to inquire. The homemade breakfast was just delicious and such a wonderful treat. The beauty that surrounds the cottage is breathtaking (makes a wonderful sunrise coffee walk)! Extremely personalized stay and incredibly cozy. Finn makes a great surprise in the morning and comes to say hello. We were passing through and were incredibly lucky to have found this gorgeous gem. Do yourself a favor and go ahead and book, you’ll thank me later and forever want to come back. Thank you Gale for everything, it was just perfect and we felt so loved staying at your cottage on the farm ❤️"
2023-11-01,5,Stayed with a pet,"This is one of the cutest cottages ever. You have to see it!
I could have stayed here and never left. This truly feels like a home away from home. It is so well maintained and decorated. You can tell that there is a very caring and loving couple behind the scenes of this place. And someone with an eye for home decor.
The breakfast delivery in the morning is a bonus and such a sweet start to the day. We spent a night in the early winter here and it was beautiful but we can imagine this place being even more magical in the summer.
We highly recommend this place to everyone who travels by here!"
2023-11-01,5,Stayed a few nights,"If you like great breakfast’s and hospitality, cute little cabin in the country side of South Dakota then this is a wonderful place to be!"
2023-10-01,5,Stayed with kids,"We have now been to Kate's Cottage several times, and love everything about it. Thanks, Gale, for such a wonderful place to stay!"
2023-10-01,5,Stayed a few nights,Great little get away in the country. Breakfast was a big hit!
2023-10-01,5,Stayed one night,The cottage was cozy and Gale’s hosting skills surpassed any other place we have stayed. Highly recommend it for a quiet stay.
2023-10-01,5,Stayed a few nights,"Kate’s Cottage is the reason you stay with an air bnb rather than a hotel. A unique and homey space, surrounded by beautiful farm country, with unmatched hospitality from the host. If you are visiting Sioux Falls, Kate’s cottage is worth the short drive. One of our favorite stays ever."
2023-09-01,5,Stayed one night,Kate's cottage is very beautiful! The cottage is exquisitely decorated for fall and the breakfast and snacks are delicious. Gale is extremely welcoming! Highly recommend.
2023-09-01,5,Stayed one night,The offering is beyond the best! We so loved the little farm cottage and it’s authentic charm. The location is amazingly beautiful. Both of us wished we could stay longer.
2023-09-01,5,Stayed one night,"Kate's Cottage is simply delightful! Book now and thank me later :) Gale has created an adorable, comfortable, safe, and cozy spot perfect for your trip through SD. Breakfast was delectable, Flo was welcoming
..but it all works because of Gale, the consummate host."
2023-09-01,5,Stayed one night,The little cottage was clean and nice. The bed was sooo comfortable! The location is very peaceful and quiet. Gale prepared a delicious breakfast for us in the morning! We would definitely recommend a stay here if in the area!
