date,rating,note,review_text
2022-08-01,5,Stayed one night,"Super super super cute. Very accommodating and welcoming and the perfect little spot to stop on our way to school! Not sure if I missed this in the description when booking the place, but there are not any showers. Not really a problem, but just wish that I knew beforehand:) Would definitely recommend again!"
2022-08-01,5,Stayed one night,loved it! the chicken coop (& the entire property) is so homey and cute. would recommend to anyone!
2022-08-01,5,Stayed one night,"The coop was wonderful! Our hosts were incredibly accommodating, and their hospitality is amazing! Thanks for a wonderful stay!"
2022-08-01,4,Stayed one night,Fun stay option. Instructions and maps were straight forward and very helpful.
2022-08-01,5,Stayed one night,The chicken coop was the perfect place for two old friends to meet in the middle. We enjoys sitting in the gazebo and watching the sun set and swinging in the corn crib while we told stories and caught up on each other's families. The only thing that would have made it better is if we could have stayed longer!
2022-08-01,5,Stayed one night,So cute! This is a great place to barbecue and enjoy the sunset. The beds were springy but comfortable and we had a lovely night. No shower for now!
2022-08-01,5,Stayed with kids,"Kelley’s coop was magical and very cozy. My kids and I stopped for the night on our way home from the black hills,SD. We all enjoyed the scenery and my kids though the coop was pretty neat. We would definitely stay here again."
2022-07-01,5,Stayed one night,Exactly what we were looking for and the host was ready to get us when we arrived and available for any questions. Beautiful grounds and the coop was exactly what we were looking for on our road trip. A+
2022-07-01,4,Stayed one night,Cute place and grounds!
2022-07-01,3,Stayed one night,"The Chicken Coop was an enjoyable basic accommodation. (They refer to it as “glamping” in the welcome book) There is no shower at the time of writing this, but there are plans to add one, so check before you book! The kitchenette only has a microwave, so plan accordingly. Overall charming and quirky on a beautiful property."
2022-07-01,5,Stayed one night,"We really enjoyed your beautiful property and I wish I could have a whole weekend to spend relaxing and just reading a book! Our only concern was a lack of shower/bathing option as that was not mentioned in the description, but thankfully wasn't a big deal for us for just one night! Who knows, maybe we will see you next year if my husband enjoys his week and the starting point is close to you again! Thank you, again!"
2022-07-01,4,Stayed one night,"Staying in a renovated chicken coop was pretty cool! Kelley has an amazing property with a lot of places to explore. The only downside was that there was no showers available. The listing says it has running water, but that’s only for a sink. If you want to shower, you’re going to have to drive up to the nearest truck stop."
2022-07-01,5,Stayed with kids,Nice little place to stay if you enjoy nature and getting away from the city but not be too far when you do want to go to town!
2022-07-01,5,Stayed one night,"First of all, this property was GORGEOUS. There was so much to explore and see, from the gazebo to the balcony of the reception hall to the corn crib swings and on! The twinkle lights strung throughout the grounds added a magical (and useful!) element to the stay.
To all people that will book in the future (which you definitely should)- remember that you will be staying in a refurbished chicken coop. There will be some spiders/flies/other random bugs in various nooks and crannies of the place. Do not come expecting your stay to be comparable to one at The Ritz. Embrace the eccentric and absolutely adorable stay for what it is. Outside, under the stars, in the fields, beneath the trees.
Kelley was a dream of a host. She was quick to respond and very informative. She provided cereal, milk, orange juice, and a gallon of water in the kitchen, as well as plastic cutlery, paper towels, garbage bags, etc. She also had chocolates and little snack pastries in the coop for us upon arrival.
I cannot stress how beautiful and expansive the grounds of this property are. I would highly recommend the chicken coop to anyone and everyone."
2022-07-01,4,Stayed with a pet,We thoroughly enjoyed our stay at the Chicken Coop! A true glamping experience with lots of fun things to explore around the property. The fact that it is pet-friendly was a big plus. Would recommend!
2022-07-01,5,Stayed one night,"The Chicken Coop was a great addition for our large group. It is a unusual space, but quaint and comfortable. The beds are wonderful. No running water or bathrooms unless you go to another building on the property (as advertised)."
2022-07-01,5,Stayed one night,Absolutely enchanting.
2022-07-01,5,Stayed with kids,We stayed here and appreciated the whole ranch. I didn't mind not having wifi because I still had good signal. All the things I didn't think I needed was accessible and the washer and dryer made my life so much easier being on the road. Our group loved it here and we plan to be back in one years time! Wopida Tanka!! -Watob Omani
2022-07-01,5,Stayed one night,very cute and fun place to stay
2022-07-01,5,Stayed with a pet,"Had a great stay in the coop! No running water/shower was complicated but the host was very kind and flexible and helped us out. We brought our lab puppy with us and he loved it there! Very dog friendly and lots of places to just hang out and relax. If you have dogs, beware of ticks! Coop was cute and eclectic, we loved it! The milk and cereal were a treat in the mornings, AC was nice and cold."
2022-06-01,5,Stayed one night,Blue Tin Ranch and the Chicken Coop were perfect! The Chicken Coop was comfortable and cozy - and Kelley was a great host. We loved the property! Thank you for making our stay so enjoyable.
2022-06-01,5,Stayed one night,This was a unique stay for the both of us. We liked the way it was set up. Clean and neat. If you don’t want the same old thing this is the place to stay.
2022-06-01,5,Stayed one night,I had a lovely stay with my dog. The property is beautiful. Kelley was a wonderful host. I definitely would come back.
2022-06-01,5,Stayed with kids,"Noreen is so incredibly kind and accommodating. We arrived pretty late into the evening on our check-in day, and she took the time to show us around, helping us feel safe and comfortable on the ranch. We stayed in the chicken coop, which was cozy and inviting after a long drive. The sinks and toilets are a short walk across their driveway (as stated on the listing), but this was a non-issue for us since the weather was very warm while we stayed and their light sensors turned on whenever we needed to head that direction at night. Although this was essentially glamping, there are plenty of outlets for lighting and charging phones/electronics if needed. We watched movies, relaxed, and were able to make cereal for breakfast (provided by Noreen). We even asked for extra fans to stay cooler at night. There is a window AC unit that helped a ton, but we're just not used to the humidity we experienced! Noreen took care of that and any other request we reached out for. My kids absolutely loved the ranch, chicken coop, and yard games... calling it their favorite part of our trip! The ranch location is just a short drive to Vermillion if you happen to be headed to USD like we were. Also, if you're lucky to stay on the property, you might get to say hello to Noreen's sweet pets Freckles and Moo. Thank you again for the memories, we hope to return soon!"
2022-06-01,5,Stayed one night,"Such a beautiful location and stay!! If I ever pass through the area again, will for sure stay here."
2022-06-01,5,Stayed one night,Kelley was super friendly and the chicken coop and exterior spaces were all really cute! Such a great find and highly recommend! Made the perfect pit stop along our road trip to CO from MN!
2022-06-01,5,Stayed one night,"We had such an amazing time! It was clean, cute and cozy! Would definitely recommend to anyone looking for a fun little getaway!"
2022-06-01,5,Stayed one night,Unique spot and very cute.
2022-05-01,5,Stayed with kids,"we really appreciate the hospitality, made us feel like home. We were a little bummed out because showers were not available upon check in and bathrooms were located outside in a separate building. Otherwise beautiful experience. The kids loved the unique experience and adventure we were able to have on her beautiful property."
2022-05-01,5,Stayed with a pet,"Loved my stay here. The hosts were very friendly and easy to communicate with, greeted me on arrival and let me know where everything was. The coop was as pictured and a lovely place to stay. The bathroom facilities are spacious and plenty. I did not miss having running water in the coop. The provided amenities were a nice touch, too. Note that the second bed in the coop is an air mattress on a frame. The first bed was very comfortable and easy to sleep on, medium firmness.
The property has some lovely shared spaces and would be great to hang out in. The hosts were also welcoming to my dog, which I very much appreciated!"
2022-05-01,4,Stayed one night,"Kelly's Farm is a fantastic and serene place. It is right off the road so easy to access.
The farm itself is very big and therefore lot of open places to explore. Kelly has decorated a section of the farm very well, sitting in that Gazebo with shade over you and the birds chirping around you is very peaceful.
We stayed in the Chicken Coop, and it is literally that, a remodeled coop.
Therefore, the cleanliness takes a hit inside the room. The blankets/throws have lot of dust in it, the bed/mattress too is not in the greatest condition.
Also, given that the restroom is a short walk away from the coop, for me to say this is good value the per night price needs to further drop a little bit to say $35-$40.
But in the mornings one will realize how beautiful the place is, we loved the place apart from a few minor issues mentioned above."
2022-05-01,5,Stayed with a pet,"Great stay! Very peaceful, lots of unique outdoor spaces."
2022-05-01,4,Stayed one night,Nice quiet getaway! Well restored older building with tin siding and however no running water in the chicken Koop. But restrooms are available nearby. Unique experience!!
2022-05-01,4,Stayed with a pet,I enjoyed my stay. Lots of birds and away from the city noises.
2021-11-01,5,Stayed one night,"Blue Tin Ranch was fantastic! There are so many extra touches in the lodgings; cute decorations, clean and very spacious. Lots of fun farm games and things to see and do. I plan to stay longer next time and to bring my family! Hostesses were super nice!"
2021-11-01,4,Stayed one night,Beautiful property and a sweet place to stay!
2021-11-01,5,Stayed a few nights,"Wonderful place with lots to see! You can definitely tell they have put a ton of heart and effort into making this a fun and enjoyable place to stay, any questions we had were answered so fast! We will definitely be back!"
2021-10-01,5,Stayed one night,"It was a fun experience staying in the chicken coop - they had the heater going before I came so it wasn't too cold and they provided extra blankets. There were a lot of nice little touches included and the entire grounds (Blue Tin Ranch) was beautiful and relaxing. The host was super accommodating and I would definitely stay here again. It is a chicken coop, so go into to it with the right level of expectation and you will enjoy your stay. Definitely take the time to explore the place."
2021-10-01,3,Stayed one night,There is no running water. The space is not insulated and has only a small space heater. The farm is beautiful and well maintained. I booked in Oct. It was too cold to pay $90 a night.
2021-10-01,5,Stayed one night,Beautifully and artfully decorated on a secluded and relaxing lot. Lovely place. Could be the perfect retreat.
2021-10-01,5,Stayed one night,"Awesome stay!! Clean, safe, and adorable."
2021-10-01,5,Stayed a few nights,"Kelley has a wonderful gift for hospitality. I felt so comfortable and peaceful in the renovated chicken coop/glamping hut, I didn’t want to leave!"
2021-10-01,5,Stayed one night,"LOVED IT. I was only able to stay one night because that’s all that was available, there’s a reason they’re always booked. Such a beautiful property. Would love to return"
2021-10-01,5,Stayed one night,Beautiful place !! Friendly hosts and at home vibes 😊 enjoyed the gazebo and other activities they had going on! Would stay there again for sure
2021-10-01,5,Stayed with kids,Such a great experience! Communication was excellent and they were so inviting! Beautiful views of the sunset and lots to do! Highly recommend!
2021-09-01,5,Stayed one night,"Recommend! Loved staying here, it’s beautiful and family makes you feel like you’re home! Very safe and organized."
2021-09-01,5,Stayed one night,the house is very accommodating of my last minute reservation
2024-04-01,5,Stayed one night,"We enjoyed our stay at Valiant. The room was very clean, quiet, comfortable, and spacious. The view was great. It was easy to come and go without feeling like we were inconveniencing anyone. Friendly host. Overall a very welcoming experience!"
2024-04-01,5,Stayed one night,"This BnB was wonderful!! The hosts were wonderful, the venue was wonderful, it was all just WONDERFUL!!
In the evening there were cookies left in the kitchen for us and they were wonderful!
I very much enjoyed the complimentary wine and spirits tasting. I brought home the rhubarb wine. The Lion’s Paw ale did not last when it got home. My boyfriend thoroughly enjoyed it so next time you see me, it will be with my boo not my son. I look forward to experiencing one of the other themed rooms!
P.S. Breakfast the next morning was WONDERFUL! The bacon was perfect and I loved the seasoning on the potatoes!"
2024-01-01,5,Stayed one night,"This place was great! Beautiful room and quiet stay. Cold winter night, otherwise we would have enjoyed the scenery from the back deck."
2023-05-01,5,Stayed one night,"Beautiful room, wonderful wine and the staff is amazing. Took the time to sit and talk with us and made recommendations. The breakfast was amazing. We would definitely come again. Thank you!"
2022-12-01,5,Stayed a few nights,"A delightful winery, has a variety of wines to try as well as whiskey and rum. The room was clean as was the tasting/ dining area. It was quiet and peaceful and was an enjoyable stay. will visit again."
2022-09-01,5,Stayed a few nights,Beautiful place to stay. The breakfast is wonderful. Can’t wait to come back.
2022-08-01,5,Stayed one night,One of our favorite places to stay. Sitting on the back deck watching the full moon come up in the east as a thunderstorm rolled across the plains in the west was the best.
2022-08-01,5,Stayed one night,"This is a real bed and breakfast - charming, quality furnishings and accessories, peaceful, excellent bed and delicious breakfast. Pleasant balcony patio. Excellent service."
2022-07-01,5,Stayed one night,"The University room is spacious and comfortable. The view from the third floor balcony, not far from the room, is gorgeous. We enjoyed the complimentary wine tasting and delicious breakfast."
2022-04-01,5,Stayed one night,"As a USD grad and lover of all things Vermillion, it's hard to beat the morning views on the patio overlooking the Vermillion and Missouri rivers. Great hospitality, food, and rooms."
2022-04-01,4,Stayed one night,"The place is clean and the breakfast is wonderful. The host is so kind.
The walls seem to be thin and we could hear a lot of others conversations in the hallway and wondered if other people could hear us. The bathroom did not have any conditioner so bring that if you need it."
2022-02-01,4,Stayed a few nights,"Friendly staff, nice view toward river, good wines, and a comfortable stay! The breakfasts were great and even got to chat with a local artist and the owner! Win-win! 👍🏼"
2022-01-01,5,Stayed a few nights,We stayed here to celebrate New Years and had a wonderful time. Very clean. Excellent communication with hosts. The wine tasting was great and there were many fun items in the gift shop as well. Breakfast was delicious - felt like we were staying at a lodge! Highly recommend this wonderful winter retreat.
2021-10-01,4,Stayed a few nights,"Everything about our stay the weekend of Oct. 22-24 was excellent. Friendly staff, great breakfast, clean room, etc. The only drawback was the low water pressure for the shower, but otherwise we'd definitely stay there again...and next time try to experience more of the vineyard and the wine tastings. Thanks for a wonderful weekend!"
2021-10-01,5,Stayed one night,"This was a wonderful overnight stay. We were made to feel so welcome. Beautiful view, comfortable room, very relaxing. Fun wine flight and delicious breakfast Great experience"
2021-08-01,5,Stayed one night,Great host and wonderful views!
2021-08-01,5,Stayed a few nights,Very Nice.
2021-08-01,5,Stayed a few nights,Comfortable room with everything you need. Beautiful setting makes for great balcony hangs in the evening. The food is great and the hospitality is second to none. The vineyard is close to the Missouri River and we got out for some light hikes around the area each day. Lots of great lunch and dinner choices in town and close to shopping in Sioux City.
2021-08-01,5,Stayed a few nights,"This place deserves all the accolades. We missed the wine and whiskey tasting days on the days we were there, but were invited to arrange a private tasting! The staff are amazing: we were cooked wonderful breakfasts; everything was clean and well organized; and the staff who worked there were really helpful and friendly. The shared kitchen has all you need to heat up and serve, but not really cook.
And oh, the deck! Get there early enough to enjoy sitting on the deck with a pair of binoculars. American goldfinches everywhere."
2021-07-01,4,Stayed a few nights,nice and cozy place
2021-07-01,4,Stayed one night,Wine-tasting on the scenic balcony is an awesome experience!
2021-06-01,4,Stayed a few nights,Great value
2021-06-01,5,Stayed one night,Wonderful place! Great room and the winery was also wonderful. The winery is worth a trip alone. We will definitely be back soon!
2021-06-01,5,Stayed a few nights,Great place. They even modified our meals to Keto. Best place in Vermillion.
2021-05-01,5,Stayed a few nights,Such a great experience! I don't believe the pictures even do the place justice. I went to just have a little get away and it exceeded my expectations!
2021-04-01,5,Stayed a few nights,"Great place, breakfast was awesome!"
2021-04-01,5,Stayed one night,This was a perfect choice for our visit to USD. The views from the balcony are amazing. The breakfast is fantastic. Room was spacious and clean.
2020-12-01,5,Stayed a few nights,"The Vineyards worked out perfectly for a stay to visit my Dad, who lives in SD now. The breakfast was fabulous, room very clean, and a beautiful area. There was a blizzard during one day of our stay and Sherry even offered personal accommodations to help us out. Will book again!"
2020-12-01,5,Stayed one night,Lovely getaway near Sioux City. It was easy to check in. Great hospitality with free wine tasting and amazing cookies waiting in our room. Breakfast by the fireplace in the morning was so nice. We felt well taken care of and at a bargain price. Thank you for refreshing us!
2020-11-01,5,Stayed about a week,"It’s an awesome inn. Our beds were very comfortable, but bring your pillows. The suite is roomy, with a nice en suite bathroom and everything is spotlessly clean. Best for last, breakfast is varied and wonderful!!"
2020-09-01,4,Stayed one night,Good location and spacious room.
2020-09-01,5,Stayed a few nights,"A spacious, clean, comfortable room. Quiet, too. And a complimentary wine tasting. Recommended."
2020-09-01,5,Stayed a few nights,Vermillion is a fun place to visit and the Valiant a great place to stay.
2020-09-01,4,Stayed one night,"Cozy getaway with a great view! Communication with the host was excellent, very responsive. Breakfast is included and is amazing 😃."
2020-09-01,5,Stayed one night,Great breakfast!! Great scenery!! Very quiet and peaceful! We enjoyed our stay. Will come again!!!
2020-08-01,5,Stayed one night,"Very friendly staff, fun wine tasting. So pretty"
2020-08-01,5,Stayed one night,"We stayed only one night and I wish we could have stayed for a week. It was the best nights rest I’ve had in a very long time! Everything was perfect, and the hostess created a dairy free breakfast just to accommodate my daughter. So grateful!"
2020-08-01,5,Stayed about a week,"clean, great hospitality, accommodating, friendly, beautiful views,"
2020-07-01,4,Stayed one night,"Valiant was an amazing host! The space was very clean, the staff helpful and friendly, the wine is amazing, and the breakfast was perfect! I would love to stay again if in the area."
2020-07-01,5,Stayed one night,"Loved the location, the accomodations were very comfortable; decor like you would expect in a winery but all the fixtures looked brand-new; breakfast was superb - one of the best I've ever had. The tasting room was closed but I still was able to buy a few bottles. Outstanding"
2020-07-01,5,Stayed one night,A very pleasant and safe place to stay. Would prioritize a stay here in the future.
2020-07-01,5,Stayed one night,Great place to stay! Breakfast was excellent and the location was beautiful and convenient!
2020-07-01,5,Stayed one night,"Sherry and Adriane helped me immensely as a person who has never been to South Dakota. I stayed during July 4th weekend when most restaurants were closed, and Sherry and Adriane went out of their way to help me get some food in Vermillion. Their hospitality was outstanding and the food was excellent for breakfast. I was pleasantly surprised by the beauty of the location and the historical significance of the vineyard and neighboring landmarks. Some of those landmarks were even part of the Lewis and Clark trail. Highly recommended, and if I am ever in Vermillion I wouldnt hesitate to stay again."
2020-03-01,5,Stayed one night,Great place for a quiet weekend away!
2020-03-01,5,Stayed one night,We enjoyed our stay here. Accommodating staff and comfy beds! Very charming place to stay and the wine we sampled was very good.
2024-06-01,5,Stayed with kids,"Cute older house, perfect for what we needed"
2024-05-01,5,Stayed a few nights,This was an absolute great find!! It was blocks from walking anywhere in Vermillion. Would stay here again
2024-04-01,5,Stayed about a week,"Fun, quirky home! After long hours of working on a project for the University, it was nice to come back to this little haven. My assistant and I are vintage nerds, so this place was perfect! Amberly was prompt in replying to our questions and checked in with us to make sure we had what we needed."
2024-04-01,5,Stayed one night,Lovely stay.
2024-04-01,5,Stayed with kids,Charming house in a well kept neighborhood.
2024-04-01,4,Stayed with kids,"Daniel was very nice, and his home was comfortable and cozy we will definitely book again."
2024-04-01,5,Stayed over a week,"Great to stay there, very nice place!"
2024-03-01,5,Stayed about a week,Great stay! Definitely make sure to stay here if you are in the area!
2024-01-01,5,Stayed a few nights,The place was so cute and it ended up to be right in the neighborhood where we needed to be!
2023-12-01,4,Stayed a few nights,Charming house in a charming neighborhood! We enjoyed our stay here and would recommend this place!
2023-12-01,5,Stayed a few nights,"Lovely folks, great space would 💯 stay again. lock was a bit of a hassle, would recommend updating, but host was super responsive and helpful."
2023-11-01,4,Group trip,Great place!
2023-11-01,5,Stayed over a week,Quick communication and nice older house close to where we needed to be.
2023-10-01,5,Group trip,"It was a very nice property! Very clean, comfortable beds, fully stocked, and we loved it! The host was amazing and accommodating. It was beautiful and everything was perfect. We'd definitely stay again."
2023-10-01,5,Stayed a few nights,"It could not have been more perfect. Beautiful home ..so peaceful and filled with good energy.
It had everything we needed. We would love to have to stay again when we come back."
2023-10-01,5,Group trip,Our stay was great for the weekend. It was very convenient for walking places. We would stay there again.
2023-10-01,5,Stayed about a week,"I absolutely loved my stay here! The house was prefect…so cozy and comfortable; the hosts were great, too! I can’t wait to stay again on my next trip to Vermillion."
2023-09-01,5,Stayed a few nights,"fabulous. had everything needed, especially in lichen and for families"
2023-09-01,5,Stayed a few nights,"Cozy, quaint and eclectic architectural home. Thoughtful consideration of amenities… French press and lovely selection of teas was so thoughtful, and such a fun collection of books… and a piano!! :)
Location is perfect!! We parked and walked to everything the entirety of our stay. So close to great coffee, eats, local businesses and USD.
Check-in was seamless and instructions for everything were complete and easy to follow!!
Made our business trip, such an unanticipated treat!!!
Will not hesitate to book again with Daniel, when we are in the area!!"
2023-09-01,5,Stayed a few nights,Very cool place and loved the butterflies in the backyard very relaxing
2023-09-01,4,Stayed with kids,Quirky place to stay. Location was great for USD.
2023-09-01,5,Stayed a few nights,Great location and easy to get to places in town. Thanks for the stay.
