date,rating,note,review_text
2024-06-01,5.0,Stayed with kids,Very spacious and comfortable couch!! Very comfortable!!!
2024-06-01,5.0,Stayed about a week,"Lovely loft in the heart of Luverne. Very walkable to restaurants, parks, and museums. Our hosts were very nice and met us with the key and showed us around."
2024-06-01,5.0,Stayed a few nights,Great stay for our group of 4. Very spacious and clean. Good launching point to nearby brewery or state park.
2024-06-01,5.0,Stayed one night,Nice quiet place downtown with plenty of space.
2024-06-01,5.0,Stayed with kids,We came for hiking around the area- was nice and central for where we were going. Clean and spacious home.
2024-04-01,5.0,Stayed a few nights,"the space is LARGE! clean, and artsy,"
2024-04-01,5.0,Stayed a few nights,"our plane got in at 930pm and we still needed our car rental and the a 30 minute drive to our airbnb.
so we got there at 1030 at night. They were were very nice about the late hour, and showed is around. They even called around to see if there was anywhere to eat since it was so late."
2024-04-01,5.0,Stayed one night,We loved our stay! The space was so spacious. Our teen boys loved the huge couch & eclectic art. It felt like we were in our own gallery. We definitely wish we could have stayed longer.
2024-03-01,5.0,Stayed a few nights,Great space with amazing artwork. Excellent location near restaurants s a nd brewery - would definitely stay again!
2023-12-01,5.0,Group trip,"Rented the unit for our family. Very clean, large and well stocked. Decor is fabulous. Lots of room. Nicole was very pleasant to work with. Great rental."
2023-12-01,5.0,Stayed with kids,This was a great space!
2023-11-01,5.0,Group trip,Wonderful space! We will be back!
2023-11-01,5.0,Stayed one night,Will stay here again! Have family in town and a great place to stay while visiting.
2023-10-01,5.0,Stayed a few nights,"What a great place to stay! And amazing hosts to go with it! The apartment location was convenient, and within walking distance of everything we wanted, including Take 16 Brewery! This was such a fun and contemporary space! And so spacious too! Our group will be back!"
2023-10-01,5.0,Stayed a few nights,"I loved having Nicole as a host! She was very accommodating. I always love staying here, my girlfriends and I had a wonderful time. We are hoping to make her bnb our annual get together spot so we can be near our families but have 'me time', too!"
2023-10-01,5.0,Stayed one night,"This place is a gem! Great location. Nice spot if driving through MN. The hosts were very responsive and accommodating. Met at arrival (we arrived around 10pm). The place is huge, clean, and was much more than what was expected in the description (as a great thing). The beds were very comfortable and the bedding was quality. Definitely one of the nicer AirBNBs i’ve been to and the price was very reasonable! Would stay here again if going through!"
2023-08-01,5.0,Stayed one night,"This is a wonderful place! The price is so good and you can enjoy the whole room with friends. Although we arrived late, Kevin was still friendly to welcome us and introduce all facilities. If I visit this town again, I definitely will live here again."
2023-08-01,5.0,Stayed one night,"The loft is huge and welcoming. We appreciated the opportunity to stretch out! Having four beds in two rooms gave us all the opportunity to get a good night's sleep. There are indoor stairs to reach the loft, as described, but they were manageable for us. No issues with parking in the alley in the back. Decent pizza directly across the street, groceries a block away, and an excellent morning coffee shop walkable two doors away."
2023-08-01,4.0,Stayed with kids,"This unique apartment is centrally located. Nicole was an excellent host with easy to access instructions. The apartment was well laid out and has a chill, relaxing vibe."
2023-08-01,5.0,Group trip,"Such a great location right on Main Street! Very spacious and really cool place, would highly recommend!"
2023-07-01,5.0,Stayed with kids,The place was a great find and was very spacious! We'll look to stay here again!
2023-07-01,5.0,Stayed one night,"There were 4 of us, plenty of room and fit our needs perfectly, would definitely recommend and would book again. We were in the area for the races at Husets, easy access and close."
2023-07-01,5.0,Stayed a few nights,"Really cool space! Bottom outside door dies not lock, but not uncommon for a small town. Our host's dog became lonely while they were out Sunday morning. We had a bit of dog music for a while.🙂"
2023-07-01,5.0,Stayed a few nights,Four of us stayed here and we all loved it! Clean and very spacious! We loved the decor - lots of fun art! Great location on Main street so within walking distance of a lot of things. We ate at a great restaurant just down the block and in the other direction on the same block there is a coffee shop. Great spot to jump off to surrounding attractions. Would highly recommend!
2023-07-01,5.0,Stayed with kids,The place was very beautiful and stylish. Located downtown and within walking distance of all the best restaurants and shops. Host was very friendly and responsive. This is definitely a great pick to stay if you are in town to see the local sights or even crash after a long drive.
2023-06-01,5.0,Stayed a few nights,"This spacious two-bedroom puts the space in spacious. Airy and filled with light, it has a wonderful ambiance. Big living room with a huge sectional on which a dozen people could sit comfortably. We did not spend much time in the kitchen, but it's well-appointed and clean. The two bedrooms are large - and, yes, spacious - with the most (and best organized) closet space I have ever seen in an Airbnb. The beds and pillows are very comfy; the bed linens are new and top-rate.
It's easy to see two couples or a family with kids enjoying Nicole's place.
The decor is artistic, creative, tasteful and interesting. I sincerely believe that you will never find an Airbnb with as many books and such a wide variety of books. You could study for a degree in art history - if you had enough time.
Good location - right on Main Street in the quaint downtown of Luverne. Off-street parking in the back.
Only caveat... Lots of stairs to climb."
2023-06-01,5.0,Stayed with kids,Our stay was great. Place was as advertised and the hosts where very helpful and responsive. Will stay again if in the area.
2023-06-01,5.0,Group trip,"Great place to stay if you are visiting Luverne! This art inspired loft was perfect for 5 hockey girls going to the rink everyday! They loved coming back to the welcoming accommodations to relax at the end of a hard day!! Being right on Main Street, we walked to coffee and the theatre is across the street! So fun exploring Luverne’s quiet, quaint town. The hosts are so fast to respond and live near by, so meeting us when we arrived was so convenient and having a tour of the place with the host was a nice touch!! Highly recommend this loft apartment!"
2023-06-01,5.0,Stayed with kids,"Very clean, spacious, and quiet. We enjoyed the artistic space and the hospitality of the hosts."
2023-06-01,5.0,Stayed one night,"Amazing, clean, quiet and comfortable spot. They were incredibly accommodating. Definitely recommend."
2023-06-01,5.0,Stayed one night,"Such a lovely space, open concept design in the living room/kitchen that’s very relaxing with a great space to play a game of chess or read a book from the shelf. The bedrooms are great for a group of four adults, very comfortable. The hosts are lovely, very personable and full of great recommendations for the area! Highly recommend!"
2023-06-01,5.0,Stayed one night,Great place to stay! Highly recommend!
2023-06-01,5.0,Stayed one night,"Though we only stayed for one night, the place was clean and really cool. The check-in was a bit different than I was used to, but they were very responsive and it went smoothly. The location worked great for us and I would for sure recomend staying here."
2023-06-01,5.0,Stayed with kids,"We couldnt have asked for a better place to stay on our way out to South Dakota. Our kids loved it so much that they were disappointed that we only stayed one night. The decor was artistic and beautiful. Looked better than the pictures! We would highly recommend this place to anyone- family friendly, bigger space than we expected and it was cleaner than clean! We give it 6 stars!"
2023-06-01,5.0,Stayed one night,"Loved this space! Great spot, and very spacious. Super hosts, and right downtown. We will be back."
2023-05-01,5.0,Stayed with kids,We had a one night stay and it worked perfectly for us. Convenient location and spacious.
2023-05-01,5.0,Group trip,"This a huge, modern space, you'll love staying here. By the time we arrived, one of the beds was updated to a queen size, so my wife and I were able to enjoy that while our teenage kids use the full size beds. Great value for the size of the apartment. It was nice to play the provided guitars in the evenings as well."
2023-04-01,5.0,Stayed over a week,Loved staying here. Luverne is a beautiful town and I really feel like I had the perfect spot to enjoy it from. The hosts are wonderful and gracious.
2020-08-01,5.0,Stayed with kids,This is a gem of a place to stay! Close to everything and great decor. We will definitely book again if in the area.
2020-08-01,5.0,Stayed with kids,We can’t rate our experience high enough. It was such a great place in the middle of a cute little town. Great location - right between a coffee shop and yummy restaurant. Apartment was so nice and comfortable. We would totally stay there again.
2020-08-01,5.0,Stayed with kids,Nicole’s place was incredibly spacious with lots of unique artwork and books. We enjoyed our stay and would recommend it!
2020-08-01,5.0,Stayed with kids,"Nicole’s place was a very sweet stay, they responded timely to all our communications, were welcoming and so helpful. A great place to rest and recharge in our long journey. The kids loved it. Comfortable and super clean, very beautiful and full of sweet details. I recommend this place if you are visiting. Centrally located, great food around, the cafe in the corner was great too for breakfast. Very beautiful, my family loved it! I hope we can come back with more time."
2020-07-01,5.0,Stayed with kids,"Clean, welcoming space! Wonderful artistic touches - loved the color coordinated books! we were only able to stay one night but wish we had had more time!"
2020-07-01,5.0,Stayed one night,"Great location- one block from cute coffee shop and from an excellent restaurant, 4 blocks from brewery. Spacious and comfortable. Great stop in Lucerne to break up our drive home from Black Hills, SD."
2020-07-01,5.0,Stayed with kids,Such an adorable place. Very clean
2020-07-01,5.0,Stayed a few nights,"The space was exactly what we needed - a large living area and kitchen, and spacious bedrooms. We really enjoyed the art work and books in the space too!"
2020-07-01,5.0,Group trip,"This place was wonderful. Right in the heart of downtown, near restaurants, very clean, and fabulous air conditioning! Check in was a breeze. Would definitely stay again."
2020-07-01,5.0,Stayed with kids,"High ceilings and plenty of beds! The place was stylish and spacious, perfect for our family traveling through. Worth it."
2020-07-01,5.0,Stayed one night,"Nicole’s place is amazingly beautiful. Giant windows, high ceilings and beautiful design elements. I highly recommend it!"
2020-07-01,5.0,Stayed one night,"Stylish loft, hidden gem in a small town. Fantastic hosts!"
2020-06-01,5.0,Stayed with kids,"Kevin and Nicole went above and beyond any expectations that I may have had going into the apartment. The pictures really don't do the space justice as it is MUCH bigger than it looks in the pictures. We are a family of 8 and we had plenty of space for all of us. Only having one bathroom could be challenging for us, but we made it work. We had one minor issue and Nicole took care of that right away. They were quick to respond to any need or question. I look forward to staying there. The art work is beautiful, the book shelves are stocked with so many choices, and our hosts were amazing! If I could give them six stars I would. You won't be disappointed if you stay in the apartment!"
2020-06-01,5.0,Stayed one night,"My favorite AirBNB stay. The apartment is beautifully decorated, furniture and beds very comfortable. Location was great to walk around a quaint town, enjoy dinner and a beer at the local brewery. We were just passing thru, but was a perfect restful stop. Highly recommend."
2020-06-01,5.0,Stayed one night,"This place is superb, and beautiful!"
2020-06-01,5.0,Stayed one night,Great place. Brought back memories of the small town i grew up in
2020-06-01,5.0,Stayed a few nights,Very fun place to stay!
2020-05-01,5.0,Stayed a few nights,Small town hospitality and perfect place for touring the area. Very friendly and helpful hosts.
2020-05-01,5.0,Stayed with kids,Host made sure the apartment was freshly cleaned prior to our arrival. The apartment is a beautiful space and larger than I was expecting.
2020-03-01,5.0,Group trip,Beautiful modern apartment space! Loved the art pieces and decor.
2020-01-01,5.0,Stayed one night,Spacious and lovely. You will not be disappointed.
2019-11-01,5.0,Stayed with kids,"We've stayed at Nicole's place a few times and it doesn't disappoint. It's quiet, comfortable, and spacious. There are art books and artwork throughout the apartment. And there's a few guitars on the wall for the musically inclined. We really enjoy being able to stay there when we visit Luverne."
2019-11-01,5.0,Stayed one night,"We LOVED staying in Nicole's loft! I hosted a 'mom's night in' and invited a dozen friends over for a get together. Everyone was so impressed with the space! We will absolutely be staying here again. The space is cool and contemporary, yet incredibly inviting. Thanks again!!"
2019-10-01,5.0,Stayed a few nights,Beautiful apartment with an ideal proximity to shopping and restaurants. Far surpassed our expectations.
2019-09-01,5.0,Group trip,"Hosts were very communicative, flexible, and have a wonderfully unique place that you simply must visit to experience! Many, many thanks!"
2019-09-01,5.0,Stayed one night,Facility is exactly as pictured! Host were very accommodating with our ever changing arrival times.
2019-09-01,5.0,Stayed one night,Loved the decor. Comfy beds. Neat as a pin. Nicole was quick to meet us. Great place to stay
2019-08-01,5.0,Group trip,Very clean and comfortable.
2019-08-01,5.0,Stayed with kids,"We loved this place. It's larger than the pictures appear, which was much appreciated for my family of 8. Trendy and ecclectic styling with small touches such as mints and tips on local attractions."
2019-07-01,5.0,Stayed with kids,"Luvene is a small town close to Sioux Fall and right by Freeway-90: the house is literally 3min from the free way, making it a convenient place to stop for the night. This unit is on the second floor of an old brick house in the downtown. There is parking place at the back of the building. Despite of aged appearance of the building from outside, inside it was very neatly kept. This 2 bd/1 ba unit is tastefully decorated and full of character. The host family took great care of the place, and responded promptly to our questions. My family enjoyed our one night stay there. One comment though: because of the age of the house, ""old house smell“ could be an issue in some poorly vented corner, such as the storage closet for linen and cleaning item. Most of my family did not seem to notice, but I may have a more sensitive nose and sensed the lingering smell."
2019-07-01,5.0,Stayed with kids,"This place was great! Lots of space, comfy, private with lots of great places within walking distance that we could go to if we wanted to venture out. We would definitely stay there again!"
2019-07-01,5.0,Stayed with kids,The pictures don’t really show how nice this apartment is. Everything is a couple notches above what you would expect from the listing! Great communication with Nicole. I totally recommend this place!
2019-07-01,5.0,Group trip,everything was great!
2019-07-01,5.0,Stayed with kids,Great place for a family gathering!
2019-07-01,5.0,Stayed a few nights,"Nice place to stay, roomy +clean apartment. Nicole is friendly and helpful. Definitely recommend it."
2019-07-01,5.0,Stayed one night,Good people who care to provide a relaxed environment.
2019-06-01,4.0,Group trip,"Great location and lots of space that my family enjoyed! Unique apartment with unique artwork. Our host suggested Pipestone National Monument and my family loved climbing all over the rocks there and the history. There is a yummy restaurant right next door that was perfect after a couple long hot days enjoying the outdoors. Could have been cleaner, but from the other comments, I think this is normally not the case."
2019-06-01,5.0,Stayed with kids,"We stayed two nights here. Nicole accommodates your needs, just need to ask with her. She responds super fast. Check in was super easy. The place is sparkling clean. Pictures show exact rooms. Two bedroom are separated by the bathroom. Normal noises in one room does not affect the other bedroom. We had kids sleep in the bed room while we were in the living space that has a door as well. No one lives during the night below this level (there are shops/businesses.)
Location is a cool Main Street. City park is pretty big/amazing for little kids and we did some grilling there. State park is very close from here.
Each one of us were pleased with this stay. Did i forget to say the loft is spacious? And yes, you can park 3 SUVs or cars in the back parking area. If yours are the trucks, two will fit without any issues. We parked three SUVs there. We will certainly stay again if we happen to pass through this area in future."
2019-06-01,5.0,Stayed a few nights,Amazing Place
2019-06-01,5.0,Stayed with kids,"Family of 6 stayed for an overnight here. Nicole has a great, clean and spacious loft with a neat artistic atmosphere. It was a relaxing and comfortable stay. Cool main street location. Everything was super easy."
2019-06-01,5.0,Stayed a few nights,This was our second time staying at Nicole and Cody's apartment and we loved it just as much as the first. It's the perfect place to stay while enjoying all of the great things in Luverne - could not recommend it more highly!
2019-05-01,5.0,Stayed with kids,Very nice place. Big and very clean.
2019-05-01,5.0,Group trip,Great place! Fun space and great location! My friends and I loved it
2019-04-01,5.0,Group trip,"I used this apartment for my friend's bachelorette party, and it was fantastic! Everyone was commenting on how much they loved the space. Also, Nicole and her family were so hospitable and helpful from giving tips to taking a couple pictures of our group. It was perfect!"
2019-04-01,5.0,Stayed one night,Comfy and stylish place. Great stay!
2019-04-01,5.0,Stayed a few nights,"Nicole was an awesome hostess. The apt is super clean, stylish and comfortable. I will absolutely stay here on my return trips to Luverne."
2019-02-01,5.0,Stayed with kids,Awesome place to stay!
2019-01-01,5.0,Group trip,Great space with comfortable sleeping arraignments. The loft has a wow factor when you first walk in! Wonderful place to stay for a short or long period.
2018-11-01,5.0,Stayed a few nights,"This is a very nice space in downtown Luverne. Nicole is very responsive, the space was just as advertised, and totally met our needs for our short stay."
2018-11-01,5.0,Stayed one night,"Great hospitality! Nicole is very friendly and attentive. She was quick with her responses and catered to our needs. Nicole went above and beyond. The apartment is very spacious. Love the vibe of the living room. Good location in the heart of downtown, within walking distance of lots of great destinations. Would recommend this apartment and host."
2018-11-01,5.0,Stayed one night,👍
2018-09-01,5.0,Stayed one night,"Great space, great location, lovely small town charm. Thoroughly enjoyed every aspect of our stay. Awesome hosts!"
2018-08-01,5.0,Group trip,It was nice place for family trip.
2018-08-01,5.0,Stayed with kids,Great communication! Beautiful spacious apartment. Cute decor. Definitely recommend!
2018-08-01,5.0,Stayed one night,Great accommodation! We loved staying there for the night!
2018-08-01,5.0,Stayed with kids,"Luverne, MN is a gem. I could easily take a vacation in this town. It is like Maybury from the Andy Griffith show where everyone is kind and considerate. The apartment we stayed in Unit D was tastefully decorated though we did cover one picture that my son deemed scary. 12ft ceilings and high quality everything made it so much nicer than any hotel stay. As long as you can take stairs U recommend it. A working 100 year old theater is across the street and coffee shops and a grocery store made this feel like home. I highly recommend."
2018-08-01,5.0,Stayed a few nights,Awesome place with great hosts. Will definitely return.
2018-08-01,5.0,Stayed a few nights,"What a great space! Only two of us stayed here but there is ample room for two couples or even two small families. The high ceilings along with a sort of minimalist decor really make the space feel grand. There are books and DVDs available to entertain you, if needed. The location is wonderful, right on the main street. Next door is Sterling's Café and Grille which was perfect with their sidewalk seating for enjoying the beautiful evenings with a glass of wine (or local beer), the food was good as well. Nicole and family were very kind and friendly, and easily accessible. I would certainly recommend this spot."
2018-08-01,5.0,Group trip,Nicole was fabulous! Great communication. She was flexible and worked with us checking in a little later than planned. Very Nice place!
2018-08-01,5.0,Stayed a few nights,This is a spectacular apartment in the heart of Luverne on Main Street! We loved staying here while in town for a family celebration - it was perfect in every way. Can't recommend Nicole's apartment highly enough and we'll definitely be back again!
2018-08-01,4.0,Stayed over a week,"Loved the location! Walking distance to everything downtown and the park. I especially enjoyed the nice kitchen ware for cooking, nice pots and pans, knives etc. The loft was stylish, and Netflix and a number of good DVD’s was available. Would definitely stay at again!!"
2018-07-01,5.0,Stayed one night,Great place to stay! It’s clean and a very neat apartment to stay in. Definitely recommend it
2018-07-01,5.0,Stayed one night,"Very spacious and comfy space, wonderful kind hosts! Would absolutely stay here again :)"
2018-07-01,5.0,Stayed one night,"Comfortable, clean, very nice place. Groceries a block away. Friendly town and people."
2018-07-01,5.0,Group trip,"Very nice, clean and spacious! Nicole was very kind and offered suggestions to us for places to eat, etc. The amenities were perfect for our party of 7! Love the open kitchen, dining and living room! We will definitely stay again if we ever go through there again!"
2024-06-01,5.0,Stayed a few nights,"Dear Debby
Thank you so much for letting us stay at your beautiful cottage. We really enjoyed the time at your place.
Thank you
Radmila"
2024-05-01,5.0,Stayed a few nights,"This place is a gem of a retreat. If you’re looking for a ton of bustle and noise everywhere, don’t book here. The lake is so serene and peaceful. It has a walkable path and beautiful views. Just a note: the wifi is not always the sharpest and there is no dedicated desk space- so leave your work at home, unplug and really enjoy Gods creation. Other note- there is no actual stove, but does include a two burner plug in and toaster type oven- so don’t plan on cooking any major meals here- plenty of fridge space and prep space though, so think easy to make meals. The host was so responsive, the instructions were crystal clear and the rest was deep. Thank you for a restorative place to grieve my good friend Pastor Marie. Also, the personal note and my favorite snack was the cherry on top!!"
2024-04-01,5.0,Stayed with kids,We had a great stay at the Cozy Cottage. The area is beautiful and quiet. Everyone slept great in the comfortable beds.
2024-02-01,5.0,Stayed a few nights,Great place to stay!
2023-11-01,5.0,Stayed a few nights,We had another wonderful stay at the cozy cottage! The hosts are very responsive and accommodating. We will be back!
2023-11-01,5.0,Stayed a few nights,"What a wonderful spot!!
We loved Cozy Cottage. It was immediately welcoming, with snuggly beds and a rustic cottage atmosphere! Just perfect for our anniversary trip. We stayed in Windom for a day drive to Mankato, and hope we can come back with our littles during the summer to more fully experience the surrounding area and Fish Lake."
2023-11-01,5.0,Stayed a few nights,One of the best places I’ve stayed. Very welcoming and very good communication. Hope we get to go back soon
2023-10-01,5.0,Stayed a few nights,"Very nice and cozy place, I didn’t like that the windows were all open without blinds felt like was being watched at times. Overall though very satisfied."
2023-10-01,5.0,Stayed a few nights,This was our second year in a row staying at Debby's place. This year was just as good as last and already looking forward to our trip next year!
2023-10-01,5.0,Stayed with kids,"We had a wonderful stay at this cozy cottage. It is a very stylish cottage with appropriate decor. We enjoyed the outdoors, walking to the nearby Fish Lake, the park, small hike to the vineyard etc. It is also a great place for night sky watching with clear skies with very little light pollution."
